1002008004,玩具|益智玩具|悠悠球,奥迪双钻/AULDEY 火力少年王4舞动火力 悠悠球专用配件套装（绳+手套+润滑油A+KK轴承+侧轴套件A）,玩具乐器>健身玩具>户外玩具>奥迪双钻/AULDEY 火力少年王4舞动...,京东商城,奇奇玩具1002008004,玩具|益智玩具|悠悠球,AULDEY 奥迪双钻 火力少年王3 悠悠球 溜溜球 天马神弓V 675011 紫色 严青用球,玩具 > 游戏 > 悠悠球,亚马逊(卓越网),Auldey 奥迪1002008004,玩具|益智玩具|悠悠球,AODA 奥达 风暴YOYO 溜溜球 2011新款 琉璃之翼悠悠球 710032 绿色,玩具 > 游戏 > 悠悠球,亚马逊(卓越网),AODA 奥达1002008004,玩具|益智玩具|悠悠球,AULDEY 奥迪双钻 正版 悠悠球 金属环溜溜球 火力少年王4 陀螺暴旋金属环悠悠球 宇际天秤 675703超给力直降100元,玩具 > 动漫玩具及周边 > 角色模型,亚马逊(卓越网),Auldey 奥迪1002008004,玩具|益智玩具|悠悠球,AULDEY 奥迪双钻 火力少年王4之舞动活力 悠悠球 溜溜球 润滑油C 675913 附带奥迪双钻悠悠球 八股比一混丝绳 （颜色随机）,玩具 > 游戏 > 悠悠球,亚马逊(卓越网),Auldey 奥迪1002008004,玩具|益智玩具|悠悠球,奥达玩具 五星风暴 悠悠球 溜溜球 YOYO-急速旋斧 710015 黑色,玩具 > 游戏 > 悠悠球,亚马逊(卓越网),AODA 奥达1002008004,玩具|益智玩具|悠悠球,正版奥迪双钻 火力少年王4 达人进阶金属环球 蝶形悠悠球/yoyo,当当网 > 玩具 > 游戏动漫 > 动漫电玩周边,当当网,奥迪双钻1002008004,玩具|益智玩具|悠悠球,大贸商(DMS) 塑料练习 悠悠球 溜溜球 YOYO 初级者-AP07741,玩具乐器>健身玩具>户外玩具>大贸商(DMS) 塑料练习 悠悠球 溜溜...,京东商城,大贸商玩具专营店1002008004,玩具|益智玩具|悠悠球,奥迪双钻 火力少年王4悠悠球 鬼异 季莫用球 675607,玩具乐器>健身玩具>户外玩具>奥迪双钻>奥迪双钻 火力少年王4悠悠球 鬼异 季莫...,京东商城,奇奇玩具1002008004,玩具|益智玩具|悠悠球,奥迪双钻（Auldey）火力少年王3悠悠球-天马神弓 卡通玩具 动漫玩具 675009,玩具乐器>动漫玩具>卡通周边>奥迪双钻（AULDEY）>奥迪双钻（Auldey）火力少年王3悠悠...,京东商城,维沃玩具1002008004,玩具|益智玩具|悠悠球,DMS大贸商 TJ 高精度合金 高级悠悠球 溜溜球 YOYO-AP07795,玩具乐器>动漫玩具>卡通周边>DMS大贸商 TJ 高精度合金 高级悠悠...,京东商城,大贸商玩具专营店1002008004,玩具|益智玩具|悠悠球,奥迪双钻 AULDEY 《火力少年王4之舞动火力》悠悠球 罗阳用球 675809奥迪舞动火力少年王4 大地,玩具 > 益智,亚马逊(卓越网),AULDEY 奥迪1002008004,玩具|益智玩具|悠悠球,爵士兔 2012新款 高精度铝合金带轴 悠悠球 YOYO 溜溜球 HS1001-A/B专注儿童创意文化20年,所有分类 > 母婴用品、玩具 > 玩具音像图书 > 运动户外 > 体育玩具 > 爵士兔,1号店,1002008004,玩具|益智玩具|悠悠球,大贸商特价 DUOMAN带侧轴 悠悠球 溜溜球 yoyo 5款AF00006,玩具 > 运动户外玩具 > 球类玩具 > 商品详情,当当网,大贸商1002008004,玩具|益智玩具|悠悠球,奥迪双钻-火力少年王4 达人进阶塑料悠悠球 星际火狐,玩具乐器>健身玩具>户外玩具>奥迪双钻（AULDEY）>奥迪双钻-火力少年王4 达人进阶塑料悠悠...,京东商城,童果童品专营店1002008004,玩具|益智玩具|悠悠球,永骏 MYTH神话YOYO球 航空铝合金悠悠球 溜溜球 蓝色 YJ8802,玩具 > 游戏 > 悠悠球,亚马逊(卓越网),永骏YJ1002008004,玩具|益智玩具|悠悠球,MAGICYOYO T8 魔术悠悠【魅影】2012升级版 专业合金悠悠球 粉金色拼装版,玩具 > 游戏 > 悠悠球,亚马逊(卓越网),MAGICYOYO1002008004,玩具|益智玩具|悠悠球,AULDEY 奥迪双钻 火力少年王3 速霸 675206,玩具 > 游戏 > 悠悠球,亚马逊(卓越网),Auldey 奥迪1002008004,玩具|益智玩具|悠悠球,AULDEY 奥迪双钻 火力少年王3 雪鳞锋-简化（超市版）675229C,玩具 > 游戏 > 悠悠球,亚马逊(卓越网),Auldey 奥迪1002008004,玩具|益智玩具|悠悠球,AULDEY 奥迪双钻 火力少年王4 幻影天王 675804,玩具 > 游戏 > 悠悠球,亚马逊(卓越网),Auldey 奥迪1002008004,玩具|益智玩具|悠悠球,AULDEY 奥迪双钻 火力少年王4 寒冰 675818,玩具 > 游戏 > 悠悠球,亚马逊(卓越网),Auldey 奥迪1002008004,玩具|益智玩具|悠悠球,乐智由我 溜溜球 成人儿童益智力玩具yoyo球,玩具乐器>益智玩具>早教启智>乐智由我>乐智由我 溜溜球 成人儿童益智力玩具yo...,京东商城,乐智由我旗舰店1002008004,玩具|益智玩具|悠悠球,永骏 悠悠球 yoyo球航空铝合金 儿童 玩具10珠KK轴承蝶型溜溜球 YJ8800金黄,玩具乐器>创意减压>创意玩具>Hape>永骏 悠悠球 yoyo球航空铝合金 儿童...,京东商城,美乐欣旗舰店1002008004,玩具|益智玩具|悠悠球,永骏 悠悠球 专业比赛yoyo球 儿童益智玩具3-6岁YJ8705 YJ8705蓝色,玩具乐器>创意减压>创意玩具>Hape>永骏 悠悠球 专业比赛yoyo球 儿童益...,京东商城,小淘气旗舰店1002008004,玩具|益智玩具|悠悠球,爵士兔玩具YOYO溜溜球HS3001 HS3001-G/F粉红色,玩具乐器>创意减压>创意玩具>爵士兔玩具YOYO溜溜球HS3001 H...,京东商城,爵士兔旗舰店1002008004,玩具|益智玩具|悠悠球,AULDEY 奥迪双钻 火力少年王3 悠悠球 溜溜球 雪鳞锋 675229（初级YOYO球）,玩具 > 游戏 > 悠悠球,亚马逊(卓越网),Auldey 奥迪1002008004,玩具|益智玩具|悠悠球,奥迪双钻火力少年王3悠悠球/溜溜球 速霸 675206绿,玩具乐器>动漫玩具>卡通周边>奥迪双钻火力少年王3悠悠球/溜溜球 速霸...,京东商城,诺诺玩具1002008004,玩具|益智玩具|悠悠球,Auldey 奥迪 火力少年王3 风火轮 675217,玩具/类别/游戏/悠悠球,亚马逊(卓越网),Auldey 奥迪1002008004,玩具|益智玩具|悠悠球,Auldey 奥迪 火力少年王3 光子精灵 悠悠球 675105,玩具/类别/游戏/悠悠球,亚马逊(卓越网),Auldey 奥迪1002008004,玩具|益智玩具|悠悠球,Auldey 奥迪 火力少年王4 速霸S 675805,玩具/类别/游戏/悠悠球,亚马逊(卓越网),Auldey 奥迪1002008004,玩具|益智玩具|悠悠球,奥迪双钻（Auldey）火力少年王3 悠悠球YOYO/溜溜球 天马神弓 675011A,玩具乐器>健身玩具>户外玩具>奥迪双钻（AULDEY）>奥迪双钻（Auldey）火力少年王3 悠...,京东商城,维沃玩具1002008004,玩具|益智玩具|悠悠球,永骏 悠悠球 YOYO球 溜溜球 YJ8702 儿童益智玩具 金色,玩具乐器>健身玩具>户外玩具>永骏>永骏 悠悠球 YOYO球 溜溜球 YJ8...,京东商城,1002008004,玩具|益智玩具|悠悠球,奥迪双钻 火力少年王4系列 悠悠球/yoyo球 专业竞技金属球 KK轴承 发烧级 专业 溜溜球,玩具乐器>健身玩具>户外玩具>奥迪双钻（AULDEY）>奥迪双钻 火力少年王4系列 悠悠球/yo...,京东商城,童果童品专营店1002008004,玩具|益智玩具|悠悠球,经典快霸悠悠球 花式快打 专业比赛 儿童益智玩具3-6岁 YJ8706蓝色,玩具乐器>创意减压>创意玩具>经典快霸悠悠球 花式快打 专业比赛 儿童...,京东商城,美乐欣旗舰店1002008004,玩具|益智玩具|悠悠球,正版星辉溜溜球 悠悠球火力奇兵25705 （无包装）,玩具乐器>适用年龄>6-14岁>星辉（Rastar）>正版星辉溜溜球 悠悠球火力奇兵25705...,京东商城,众客商城1002008004,玩具|益智玩具|悠悠球,奥迪双钻正版 发光悠悠球 溜溜球 火力少年王3 光刃战士 675220,玩具乐器>动漫玩具>卡通周边>奥迪双钻正版 发光悠悠球 溜溜球 火力少...,京东商城,爱你宝贝玩具专营店1002008004,玩具|益智玩具|悠悠球,奥迪双钻火力少年王3 发光悠悠球/溜溜球 光刃战士 675220,玩具乐器>动漫玩具>卡通周边>奥迪双钻火力少年王3 发光悠悠球/溜溜球...,京东商城,乐之源玩具专营店1002008004,玩具|益智玩具|悠悠球,奥迪双钻 火力少年王3 金属溜溜球悠悠球 星际火狐675603火狐,玩具乐器>健身玩具>户外玩具>奥迪双钻（AULDEY）>奥迪双钻 火力少年王3 金属溜溜球悠悠球...,京东商城,爱你宝贝玩具专营店1002008004,玩具|益智玩具|悠悠球,奥迪双钻火力少年王悠悠球配件 高精度KK轴承 悠悠线悠游挂小包挂 普通KK轴承,玩具乐器>动漫玩具>卡通周边>奥迪双钻（AULDEY）>奥迪双钻火力少年王悠悠球配件 高精度KK...,京东商城,乐之源玩具专营店1002008004,玩具|益智玩具|悠悠球,奥迪双钻（Auldey）火力少年王3 悠悠球YOYO/溜溜球 天马神弓 675011A 蓝色,玩具乐器>健身玩具>户外玩具>奥迪双钻（AULDEY）>奥迪双钻（Auldey）火力少年王3 悠...,京东商城,维沃玩具1002008004,玩具|益智玩具|悠悠球,奥迪双钻 火力少年王 舞动火力 悠悠球/溜溜球 光明使者S 675605,玩具 > 运动户外玩具 > 球类玩具 > 商品详情,当当网,奥迪双钻1002008004,玩具|益智玩具|悠悠球,奥迪双钻 火力少年王 舞动火力 悠悠球/溜溜球 幻影天王 675804,玩具 > 运动户外玩具 > 沙滩玩具 > 商品详情,当当网,奥迪双钻1002008004,玩具|益智玩具|悠悠球,奥迪双钻 火力少年王 舞动火力 悠悠球/溜溜球 遁天骑兵 675811,玩具 > 运动户外玩具 > 球类玩具 > 商品详情,当当网,奥迪双钻1002008004,玩具|益智玩具|悠悠球,DMS大贸商 高精度带侧轴高强度塑料-电光冷雾 悠悠球 溜溜球 yoyo-AF00005,首页>母婴>玩具>户外玩具>绳类/球类>DMS大贸商高精度带侧轴高强度塑料...,苏宁,大贸商1002008004,玩具|益智玩具|悠悠球,YJ 永骏 航空铝合金悠悠球 专业比赛yoyo球 儿童益智玩具3-6岁,所有分类>母婴用品、玩具>玩具>益智玩具>YJ>YJ 永骏 航空铝...,1号店,YJ1002008004,玩具|益智玩具|悠悠球,DMS大贸商 中级 高精度合金 悠悠球 溜溜球 yoyo-AP07793,首页>母婴>玩具>户外玩具>绳类/球类>DMS大贸商中级高精度合金悠悠...,苏宁,大贸商1002008004,玩具|益智玩具|悠悠球,奥迪双钻 火力少年王悠悠球系列 yoyo溜溜球 魔剑675610 球+线+油,玩具乐器>动漫玩具>卡通周边>奥迪双钻（AULDEY）>奥迪双钻 火力少年王悠悠球系列 yoyo...,京东商城,乐之源玩具专营店1002008004,玩具|益智玩具|悠悠球,正版yoyo 奥迪双钻 悠悠球 溜溜球 火力少年王3 火狐675003 悠悠球+油+线,玩具乐器>动漫玩具>卡通周边>奥迪双钻（AULDEY）>正版yoyo 奥迪双钻 悠悠球 溜溜球 ...,京东商城,爱你宝贝玩具专营店1002008004,玩具|益智玩具|悠悠球,专柜正品 奥迪双钻 火力少年王专业竞技金属悠悠球溜溜球 光明使者675006,玩具乐器>动漫玩具>卡通周边>奥迪双钻（AULDEY）>专柜正品 奥迪双钻 火力少年王专业竞技金...,京东商城,小屁孩母婴专营店1002008004,玩具|益智玩具|悠悠球,Magic Yoyo 魔术 YOYO N9 浮云专业合金悠悠球 溜溜球 yoyo球 高强度铝合金 适合1A 3A 5A玩法 紫色,玩具 > 游戏 > 悠悠球,亚马逊(卓越网),Magicyoyo 魔术 YOYO1002008004,玩具|益智玩具|悠悠球,LUCKYTED正版奥迪双钻悠悠球 超级光子精灵s溜溜球超冰魄寒冰儿童玩具 火狐 绿色,玩具乐器>适用年龄>3-6岁>luckyted>LUCKYTED正版奥迪双钻悠悠球 超级...,京东商城,luckyted玩具城1002008004,玩具|益智玩具|悠悠球,LUCKYTED儿童玩具火力少年铝合金包塑溜溜球 悠悠球滚珠轴承 金底蓝有原装礼盒包装,玩具乐器>适用年龄>6-14岁>luckyted>LUCKYTED儿童玩具火力少年铝合金包...,京东商城,luckyted玩具城1002008004,玩具|益智玩具|悠悠球,luckyted 正版奥迪双钻 火力少年王4 金属悠悠球/溜溜球 黑煞675612 5正版悠悠球,玩具乐器>动漫玩具>卡通周边>luckyted>luckyted 正版奥迪双钻 火力少年...,京东商城,luckyted玩具城1002008004,玩具|益智玩具|悠悠球,奥迪双钻（AULDEY）火力少年王悠悠球主打塑料球基础系列溜溜球 赤焰蝎王675808,玩具乐器>动漫玩具>卡通周边> 奥迪双钻（AULDEY）>奥迪双钻（AULDEY）火力少年王悠悠球...,京东商城,维沃玩具1002008004,玩具|益智玩具|悠悠球,LUCKYTED 正品正版奥迪双钻黑红寒冰金红蓝银飞火流星悠悠球溜溜球冰魄 寒冰银白 寒冰球,玩具乐器>适用年龄>6-14岁> luckyted>LUCKYTED 正品正版奥迪双钻黑红寒...,京东商城,luckyted玩具城1002008004,玩具|益智玩具|悠悠球,奥迪双钻悠悠球配件 润滑油 手套 KK轴承 悠悠绳 悠悠挂 胶圈,玩具 > 运动户外玩具 > 球类玩具 > 奥迪双钻悠悠球配件 润滑油 手套 KK轴承 悠悠绳 悠悠挂 胶圈,当当网,奥迪双钻1002008004,玩具|益智玩具|悠悠球,奥迪双钻AULDEY 动漫卡通周边火力少年王5传奇再现新款悠悠球溜溜球676317 离合器塑胶赤焰战虎676317,玩具乐器>动漫玩具>电影周边> 奥迪双钻（AULDEY）>奥迪双钻AULDEY 动漫卡通周边火力少...,京东商城,金色童年玩具专营店1002008004,玩具|益智玩具|悠悠球,奥迪双钻 悠悠球玩具赤焰战虎S 玉鳞蛇 溜溜球火力少年王5yoyo球 闪电风神-675814,玩具乐器>动漫玩具>卡通周边> 奥迪双钻（AULDEY）>奥迪双钻 悠悠球玩具赤焰战虎S 玉鳞蛇 ...,京东商城,auldey/奥迪双钻专卖店1002008004,玩具|益智玩具|悠悠球,奥迪双钻 火力少年王5 悠悠球溜溜球儿童玩具yoyo球新品入门级别676317/318 入门 赤焰战虎676317,玩具乐器>动漫玩具>卡通周边> 奥迪双钻（AULDEY）>奥迪双钻 火力少年王5 悠悠球溜溜球儿童...,京东商城,美乐欣旗舰店1002008004,玩具|益智玩具|悠悠球,奥迪双钻正版悠悠球火力少年王5yoyo球玄铁磐龙入门NO.676318,首页>母婴>玩具>户外玩具>绳类/球类>奥迪双钻正版悠悠球火力少年王5yoy...,苏宁,奥迪双钻(AULDEY)1002008004,玩具|益智玩具|悠悠球,奥迪双钻正版悠悠球火力少年王5yoyo球赤焰战虎初级NO.676319,首页>母婴>玩具>户外玩具>绳类/球类>奥迪双钻正版悠悠球火力少年王5yoy...,苏宁,奥迪双钻(AULDEY)1002008004,玩具|益智玩具|悠悠球,奥迪双钻AULDEY 动漫卡通周边火力少年王5传奇再现新款悠悠球溜溜球赤焰战虎676319,玩具 > 模型/动漫 > 卡通动漫周边 > 奥迪双钻AULDEY 动漫卡通周边火力少年王5传奇再现新款悠悠球溜溜...,当当网,奥迪双钻AULDEY