1002008002,玩具|益智玩具|健身架,伟易达小海龟健身椅106303,玩具乐器>益智玩具>健身架>伟易达小海龟健身椅106303,京东商城,惠童1002008002,玩具|益智玩具|健身架,皇室Toyroyal婴儿健身架运动架TR964,首页>母婴>玩具>婴幼玩具>学爬学步/健身架>皇室Toyroyal婴儿健身架运动架...,苏宁,皇室1002008002,玩具|益智玩具|健身架,Fisher Price 费雪 欢乐成长之声光健身器 W9898,当当网 > 玩具 > 婴儿玩具 > 肢体训练,当当网,Fisher Price 费雪1002008002,玩具|益智玩具|健身架,FisherPrice 费雪 缤纷脚踏健身器C1454,所有分类>母婴用品、玩具>玩具>宝宝玩具>健身架>Fisher Price/费雪>FisherPric...,1号店,Fisher Price/费雪1002008002,玩具|益智玩具|健身架,五星 多功能乐曲健身架 16080064,所有分类 > 母婴用品、玩具 > 宝宝玩具 > 健身玩具 > 五星,1号店,1002008002,玩具|益智玩具|健身架,智乐美天鹅绒月亮小子多功能婴儿健身架婴儿游戏垫XYB12,玩具乐器>健身玩具>爬行垫/毯>智乐美>智乐美游戏垫,京东商城,智乐美1002008002,玩具|益智玩具|健身架,JOLAMI 智乐美 月亮小子多功能婴儿健身架婴儿游戏垫,玩具 > 婴幼,亚马逊(卓越网),JOLAMI 智乐美1002008002,玩具|益智玩具|健身架,JOLAMI 智乐美 马戏团多功能婴儿健身架婴儿游戏垫,玩具 > 婴幼,亚马逊(卓越网),JOLAMI 智乐美1002008002,玩具|益智玩具|健身架,JOLAMI 智乐美 小脚丫多功能婴儿健身架婴儿游戏垫,玩具 > 婴幼,亚马逊(卓越网),JOLAMI 智乐美1002008002,玩具|益智玩具|健身架,童畅 宝宝智力健身架 婴儿音乐体操健身架,所有分类 > 母婴用品、玩具 > 童车/床/汽座 > 健身游戏 > 童畅,1号店,1002008002,玩具|益智玩具|健身架,智乐美小脚丫多功能婴儿健身架婴儿游戏毯XYB3,玩具乐器>健身玩具>爬行垫/毯>智乐美>智乐美游戏毯,京东商城,智乐美1002008002,玩具|益智玩具|健身架,Fisher Price 费雪 可爱动物健身器N8850(0岁以上),红孩子玩具早教健身/学步爬行垫/游戏毯费雪Fisher Price 费雪 可爱动物,红孩子,费雪1002008002,玩具|益智玩具|健身架,Auby/澳贝 幼儿音乐健身架 环保 婴儿健身器 初生宝宝玩具463302,所有分类>母婴用品、玩具>玩具>宝宝玩具>健身架>Auby/澳贝>Auby/澳贝 幼儿...,1号店,Auby/澳贝1002008002,玩具|益智玩具|健身架,汇乐696多功能跳跳椅 健身架//健身器 宝宝玩具//婴儿礼物 蓝色,玩具乐器>益智玩具>早教启智>汇乐>汇乐696多功能跳跳椅 健身架//健身器...,京东商城,尼斯露丹1002008002,玩具|益智玩具|健身架,骅威 美美乐园 多功能游戏垫 爬行垫 健身架 3057,玩具乐器>益智玩具>早教启智>骅威 美美乐园 多功能游戏垫 爬行垫 健...,京东商城,骅威玩具旗舰店1002008002,玩具|益智玩具|健身架,五星 婴幼玩具 乐器健身架 健身器 婴儿多功能音乐琴键健身器 可拆卸电子琴 37721,玩具 > 婴幼,亚马逊(卓越网),贝乐星1002008002,玩具|益智玩具|健身架,费雪动物互动健身器新年送礼礼品礼物W9840,红孩子>玩具早教>健身/学步>学爬学步/健身架>费雪,红孩子,费雪1002008002,玩具|益智玩具|健身架,Mamalove 妈妈爱 婴儿宝宝多功能人体工学摇椅 秋千LA29 (薰衣草),母婴用品 > 家具 > 摇椅、秋千椅 ,亚马逊(卓越网),Mamalove 妈妈爱1002008002,玩具|益智玩具|健身架,Fisher- Price 费雪 美国美泰 玩具 声光益智学习 缤纷脚踏健身器C1454,玩具 > 婴幼,亚马逊(卓越网),Fisher- Price 费雪1002008002,玩具|益智玩具|健身架,澳贝正品 婴儿宝宝多功能趣味椅 儿童音乐健身架玩具463312,玩具乐器>益智玩具>早教启智>澳贝（AUBY）>澳贝正品 婴儿宝宝多功能趣味椅 儿童音乐...,京东商城,1002008002,玩具|益智玩具|健身架,Hape 婴儿健身架 低龄宝宝活动健身器 益智玩具 早教启智 德国品牌,玩具乐器>益智玩具>早教启智>Hape>Hape 婴儿健身架 低龄宝宝活动健身器...,京东商城,童童星1002008002,玩具|益智玩具|健身架,【年货玩具礼盒】倍贝乐宝宝跳跳健身架 弹跳椅 跳跳乐 婴幼儿玩具 送礼佳品,玩具乐器>益智玩具>健身架>倍贝乐（BELLBEL）>【年货玩具礼盒】倍贝乐宝宝跳跳健身架 ...,京东商城,倍贝乐旗舰店1002008002,玩具|益智玩具|健身架,费雪牌 Fisher Price 品牌玩具 可爱动物多功能轻便摇椅W2811,所有分类>母婴用品、玩具>玩具>宝宝玩具>摇椅/秋千>费雪牌>费雪牌 Fisher...,1号店,费雪牌1002008002,玩具|益智玩具|健身架,年终热卖 Fisher Price 费雪玩具 欢乐成长之脚踏钢琴健身器健身架W2621,玩具乐器>益智玩具>健身架>费雪（Fisher Price）>年终热卖 Fisher Price 费雪...,京东商城,布雷奥玩具旗舰店1002008002,玩具|益智玩具|健身架,智乐美 益智玩具 高档超绒多彩音乐蝴蝶多功能婴儿健身架游戏垫XY2B1,玩具乐器>益智玩具>健身架>智乐美>智美乐游戏垫,京东商城,智乐美1002008002,玩具|益智玩具|健身架,美贝乐 宝宝婴儿健身架 多功能婴儿 早教玩具 0070,玩具乐器>益智玩具>健身架>美贝乐 宝宝婴儿健身架 多功能婴儿 早教...,京东商城,金色童年玩具专营店1002008002,玩具|益智玩具|健身架,Auby奥贝/澳贝玩具 专柜正品 婴儿爬行锻炼 健身器 活动健身架463301,玩具乐器>益智玩具>早教启智>澳贝（AUBY）>Auby奥贝/澳贝玩具 专柜正品 婴儿爬...,京东商城,酷趣玩具1002008002,玩具|益智玩具|健身架,费雪W2621脚踏钢琴健身器,玩具乐器>益智玩具>健身架>费雪（Fisher Price）>费雪W2621脚踏钢琴健身器,京东商城,博乐图智玩具旗舰店1002008002,玩具|益智玩具|健身架,费雪 欢乐成长之脚踏钢琴健身器 W2621,玩具乐器>益智玩具>健身架>费雪>费雪 欢乐成长之脚踏钢琴健身器 W262...,京东商城,宝之轩旗舰店1002008002,玩具|益智玩具|健身架,【亲子日】Fisher Price 费雪 欢乐成长之脚踏钢琴健身器W2621,玩具乐器>益智玩具>健身架>费雪（Fisher Price）>【亲子日】Fisher Price 费雪...,京东商城,baby1781002008002,玩具|益智玩具|健身架,迪希婕DCJ 蝴蝶仙子摇马 送凉垫 儿童音乐实木摇椅摇摇马木马 益智健身玩具 宝宝节日礼物,玩具乐器>健身玩具>户外玩具>阿布熊（sunny bear）>迪希婕DCJ 蝴蝶仙子摇马 送凉垫 儿童...,京东商城,紫云旗舰店1002008002,玩具|益智玩具|健身架,费雪 明星产品 宝宝便携式小餐椅 宝宝小餐 宝宝儿童吃饭桌P0109,玩具乐器>益智玩具>健身架>费雪>费雪 明星产品 宝宝便携式小餐椅 宝宝小...,京东商城,佳贝玩具1002008002,玩具|益智玩具|健身架,Evebel/爱伊贝丽 宝宝跳跳婴儿健身器支架式 健身架 婴儿玩具 宝宝礼品 感统训练,所有分类>母婴用品、玩具>玩具>宝宝玩具>健身架>Evebel/爱伊贝丽>Evebel/爱伊贝...,1号店,Evebel/爱伊贝丽1002008002,玩具|益智玩具|健身架,贝乐星 五星 婴儿 健身架 儿童多功能健身 启智欢乐健身架 婴幼儿 宝宝玩具 37722,所有分类>母婴用品、玩具>玩具>宝宝玩具>健身架>贝乐星>贝乐星 五星 婴儿 ...,1号店,贝乐星1002008002,玩具|益智玩具|健身架,开心玛特 三色摇马 儿童塑料 加厚塑料幼儿园木马摇马 儿童益智游乐 锻炼健身,所有分类>母婴用品、玩具>玩具>宝宝玩具>摇椅/秋千>开心玛特>开心玛特 三色摇马 ...,1号店,开心玛特1002008002,玩具|益智玩具|健身架,澳贝 音乐健身架 婴儿健身器 婴儿玩具0-1岁 益智玩具,玩具乐器>益智玩具>早教启智>澳贝（AUBY）>澳贝 音乐健身架 婴儿健身器 婴儿玩具0...,京东商城,韬世母婴专营店1002008002,玩具|益智玩具|健身架,【米氏孕婴】费雪二合一虫虫健身器,玩具乐器>益智玩具>健身架>费雪（Fisher Price）>【米氏孕婴】费雪二合一虫虫健身器,京东商城,米氏孕婴官方旗舰店1002008002,玩具|益智玩具|健身架,英纷 海洋多功能婴儿健身垫带健身器音乐爬行垫儿童益智玩具0-1岁,玩具 > 婴幼,亚马逊(卓越网),英纷1002008002,玩具|益智玩具|健身架,龙祥 婴儿玩具音乐儿童健身架 宝宝玩具健身器0-1岁8605 AJH88,所有分类>母婴用品、玩具>玩具>宝宝玩具>健身架>龙祥>龙祥 婴儿玩具音乐儿...,1号店,龙祥1002008002,玩具|益智玩具|健身架,彩虹 多功能健身架 音乐儿童健身架玩具婴儿玩具0-1-3岁健身器,所有分类>母婴用品、玩具>玩具>宝宝玩具>健身架>彩虹>彩虹 多功能健身架 ...,1号店,彩虹1002008002,玩具|益智玩具|健身架,Auby/澳贝 奥贝 婴儿宝宝多功能趣味椅 新餐椅 音乐健身架玩具 儿童高档二合一 463312,所有分类>母婴用品、玩具>玩具>宝宝玩具>健身架>Auby/澳贝>Auby/澳贝 奥贝...,1号店,Auby/澳贝1002008002,玩具|益智玩具|健身架,Blue Box蓝盒 婴儿健身学步 3合1运动趣味架 儿童礼物,玩具乐器>益智玩具>健身架>蓝盒（Blue Box）>Blue Box蓝盒 婴儿健身学步 3合...,京东商城,宝宝玩具城1002008002,玩具|益智玩具|健身架,费雪健身架送礼物礼盒佳品 缤纷脚踏声光健身器C1454 婴儿健身架 儿童玩具,玩具乐器>益智玩具>早教启智>费雪（Fisher Price）>费雪健身架送礼物礼盒佳品 缤纷脚踏声光健...,京东商城,联联专营店1002008002,玩具|益智玩具|健身架,五星玩具 婴儿健身架 虫虫健身架37720 优质环保材料,玩具 > 婴幼,亚马逊(卓越网),五星玩具1002008002,玩具|益智玩具|健身架,泰燕 吊篮儿童秋千婴幼儿座椅 宝宝婴儿益智玩具荡秋千 生日礼物 红色 43cm-17cm,玩具乐器>健身玩具>户外玩具>泰燕 吊篮儿童秋千婴幼儿座椅 宝宝婴儿益...,京东商城,泰燕秋千旗舰店1002008002,玩具|益智玩具|健身架,皇冠球桌新款特价带电气悬冰球桌室内健身器桌面冰球台锻炼反应力 218,玩具乐器>健身玩具>户外玩具>皇冠（CROWN）>皇冠球桌新款特价带电气悬冰球桌室内健身器...,京东商城,同梦缘玩具专营店1002008002,玩具|益智玩具|健身架,澳乐 婴儿益智儿童帐篷玩具早教宝宝游戏屋海洋波波球圆点球池,玩具乐器>健身玩具>户外玩具>澳乐（AOLE-HW）>澳乐 婴儿益智儿童帐篷玩具早教宝宝游戏屋...,京东商城,美娃母婴专营店1002008002,玩具|益智玩具|健身架,英纷0831健身器多功能健身睡觉爬行垫宝宝婴幼儿童早教益智玩具,玩具乐器>益智玩具>健身架>英纷>英纷0831健身器多功能健身睡觉爬行垫宝...,京东商城,名车荟萃1002008002,玩具|益智玩具|健身架,澳贝（AUBY）澳贝 奥贝多功能趣味椅 餐椅和健身架二合一 463312,玩具乐器>健身玩具>爬行垫/毯>澳贝（AUBY）>澳贝（AUBY）澳贝 奥贝多功能趣味椅 ...,京东商城,童乐汇母婴1002008002,玩具|益智玩具|健身架,Blue Box蓝盒 婴幼儿启蒙玩具动物乐器组合 多功能大象琴台033782,玩具 > 婴儿玩具 > 早教产品 > 商品详情,当当网,蓝盒1002008002,玩具|益智玩具|健身架,圣诞礼物 包邮 【费雪牌 Fisher Price】美太 费雪欢乐成长之脚踏钢琴健身器 W2621,玩具 > 婴儿玩具 > 乐韵培养 > 商品详情,当当网,Fisher Price 费雪1002008002,玩具|益智玩具|健身架,美贝乐 宝宝婴儿健身架 多功能婴儿 早教玩具 0070,玩具 > 婴儿玩具 > 肢体训练 > 商品详情,当当网,彩虹1002008002,玩具|益智玩具|健身架,MAMMA布玩 健身架-快乐的小动物,玩具 > 婴儿玩具 > 早教产品 > 商品详情,当当网,MAMMA 妈妈布书1002008002,玩具|益智玩具|健身架,智乐美（Jolami）多功能婴儿健身架婴儿游戏垫 XYB14（咕嘎丫丫）,玩具 > 婴儿玩具 > 儿童地垫 > 商品详情,当当网,智乐美Jolami1002008002,玩具|益智玩具|健身架,倍贝乐 婴幼儿多功能健身器【跳跳+吊环】 体能感统训练必备 超高性价比,所有分类>母婴用品、玩具>玩具>宝宝玩具>健身架>倍贝乐>倍贝乐 婴幼儿多功能...,1号店,倍贝乐1002008002,玩具|益智玩具|健身架,FisherPrice/费雪 欢乐成长之声光健身器W9898,所有分类>母婴用品、玩具>玩具>宝宝玩具>健身架>Fisher Price/费雪>FisherPric...,1号店,Fisher Price/费雪1002008002,玩具|益智玩具|健身架,英纷玩具健身架海洋婴儿宝宝爬行垫毯0-1岁幼儿益智多功能0830,玩具乐器>益智玩具>健身架>奥乐宝>英纷玩具健身架海洋婴儿宝宝爬行垫毯0-1...,京东商城,云峰源玩具专营店1002008002,玩具|益智玩具|健身架,Yobee/优贝比 多功能健身架8605,所有分类>母婴用品、玩具>玩具>宝宝玩具>健身架>Yobee/优贝比>Yobee/优贝比 ...,1号店,Yobee/优贝比1002008002,玩具|益智玩具|健身架,AUBY/奥贝/澳贝 音乐健身架*1 463302,玩具乐器>益智玩具>健身架>澳贝（AUBY）>AUBY/奥贝/澳贝 音乐健身架*1 4...,京东商城,天爱母婴专营店1002008002,玩具|益智玩具|健身架,哈喜屋早教益智婴幼儿健身架 宝宝健身器 婴儿玩具宝宝玩具1-3岁 小菊,玩具乐器>益智玩具>早教启智>哈喜屋>哈喜屋早教益智婴幼儿健身架 宝宝健身器 ...,京东商城,乐美母婴生活馆1002008002,玩具|益智玩具|健身架,淘雨堂敲击果虫 婴幼儿健身玩具锻炼手眼脑 超好玩 益智0-1岁,首页>母婴>玩具>婴幼玩具>益智玩具>淘雨堂敲击果虫婴幼儿健身玩具锻炼手...,苏宁,1002008002,玩具|益智玩具|健身架,五星玩具 多功能火车健身架 儿童益智玩具 婴幼儿音乐灯光玩具37722 蓝色,首页> 母婴> 母婴用品> 宝宝玩具> 益智玩具> 五星玩具 多功能火车健身架 儿童益智玩具 婴幼儿音乐灯光玩具37722,凡客诚品,五星玩具1002008002,玩具|益智玩具|健身架,专柜正品 美泰正版费雪 婴幼儿玩具 缤纷动物豪华健身器 Y6588,玩具乐器>益智玩具>健身架>费雪（Fisher Price）>专柜正品 美泰正版费雪 婴幼儿玩具 缤纷...,京东商城,扬州铭溢1002008002,玩具|益智玩具|健身架,英纷玩具0816婴儿音乐健身架 海洋健身架 益智音乐健身玩具健身器,玩具 > 婴儿玩具 > 肢体训练 > 商品详情,当当网,英纷1002008002,玩具|益智玩具|健身架,智乐美 益智玩具 海洋世界多功能婴儿健身架游戏垫XY329,玩具乐器>益智玩具>健身架>智乐美>智美乐游戏垫,京东商城,智乐美1002008002,玩具|益智玩具|健身架,AUBY 奥贝 澳贝/奥贝AUBY 动感驾驶室模拟驾驶婴幼儿儿童益智早教玩具463428,玩具 > 游戏 > 益智思维游戏,亚马逊(卓越网),AUBY 奥贝1002008002,玩具|益智玩具|健身架,南国婴宝838-7音乐健身架宝宝健身器婴儿玩具0-1岁满月礼品,玩具 > 婴儿玩具 > 肢体训练 > 商品详情,当当网,南国婴宝1002008002,玩具|益智玩具|健身架,优贝比 健身架儿童益智玩具 锻炼健身器必备用品 奥海3318健身架,玩具乐器>益智玩具>健身架>贝恩施>优贝比 健身架儿童益智玩具 锻炼健身器...,京东商城,金万豪玩具专营店1002008002,玩具|益智玩具|健身架,仙邦宝贝婴儿宝宝玩具音乐健身器游戏架3001-1B,玩具乐器>益智玩具>健身架>仙邦宝贝（Simbable Kidz）>仙邦宝贝婴儿宝宝玩具音乐健身器游戏架30...,京东商城,仙霸母婴旗舰店1002008002,玩具|益智玩具|健身架,火车健身架婴幼儿音乐健身器早教益智 讲故事 唱童谣 动物伴奏曲送小火车 AJ-37722,玩具乐器>益智玩具>健身架>皇冠>火车健身架婴幼儿音乐健身器早教益智 讲故...,京东商城,益智园玩具专营店1002008002,玩具|益智玩具|健身架,LUCKYTED多功能婴儿健身架音乐架儿童健身架 婴儿玩具0-1岁宝宝音乐健身架 最热销带音乐款送三节电池,玩具乐器>适用年龄>1-3岁> luckyted>LUCKYTED多功能婴儿健身架音乐架儿...,京东商城,luckyted玩具城1002008002,玩具|益智玩具|健身架,LUCKYTED 正品澳贝健身架463302奥贝婴儿带音乐玩具0-1岁儿童宝宝健身器 送宝宝爬行垫 电池 加长带,玩具乐器>益智玩具>健身架> luckyted>LUCKYTED 正品澳贝健身架4633...,京东商城,luckyted玩具城1002008002,玩具|益智玩具|健身架,【玩具正品惠】AUBY澳贝 益智玩具 电子多功能学习桌 463439,玩具乐器>益智玩具>健身架> 费雪（Fisher Price）>【玩具正品惠】AUBY澳贝 益智玩具 电...,京东商城,星高玩具专营店1002008002,玩具|益智玩具|健身架,哈喜屋 早教益智婴幼儿健身架 宝宝健身器 婴儿玩具宝宝玩具1-3岁 太空人,,亚马逊(卓越网),哈喜屋1002008002,玩具|益智玩具|健身架,宝宝健身架 婴儿玩具儿童早教音乐 站立健身器安全玩具0-1岁宝宝,首页>母婴>玩具>婴幼玩具>学爬学步/健身架>宝宝健身架婴儿玩具儿童早教音乐站...,苏宁,勾勾手1002008002,玩具|益智玩具|健身架,包邮 奥贝 澳贝玩具正品 多功能趣味椅463312 婴幼儿餐椅健身架,玩具 > 益智玩具 > 科教玩具 > 包邮 奥贝 澳贝玩具正品 多功能趣味椅463312 婴幼儿餐椅健身架,当当网,Auby/澳贝1002008002,玩具|益智玩具|健身架,特价 宝宝餐大人饭一起做·宝宝健康断奶餐+益智营养餐 家庭辅食书籍 婴儿食谱辅食书籍,图书>健身与保健>婴幼儿保健>特价宝宝餐大人饭一起做·宝宝健康断奶餐...,京东商城,1002008002,玩具|益智玩具|健身架,Fisher Price 费雪 游戏毯欢乐成长之脚踏钢琴健身器W2621,母婴用品 玩具>婴幼儿玩具>费雪婴幼儿玩具>Fisher Price 费雪 游戏毯欢乐成长之脚踏钢琴健身器W2621,国美电器网上商城,费雪婴幼儿玩具1002008002,玩具|益智玩具|健身架,仙邦宝贝 多功能音乐健身架 宝宝站立健身器 儿童早教婴儿玩具 3001-A,首页>母婴>玩具>婴幼玩具>学爬学步/健身架>仙邦宝贝多功能音乐健身架宝宝站立...,苏宁,仙邦宝贝(SimbableKize)1002008002,玩具|益智玩具|健身架,费雪缤纷动物豪华健身器Y6588 宝宝婴儿玩具健身架,费雪缤纷动物豪华健身器Y6588 宝宝婴儿玩具健身架,当当网,费雪1002008002,玩具|益智玩具|健身架,宝宝健身架带音乐 儿童健身器摇铃健身架 新生婴儿益智玩具0-1岁,首页>母婴>玩具>婴幼玩具>学爬学步/健身架>宝宝健身架带音乐儿童健身器摇铃健身...,苏宁,onaic1002008002,玩具|益智玩具|健身架,包邮正品费雪脚踏钢琴健身器多功能音乐玩具踢踏学习健身架W2621,玩具乐器>益智玩具>早教启智> 费雪（Fisher Price）>包邮正品费雪脚踏钢琴健身器多功能音乐玩具...,京东商城,童开乐玩具专营店1002008002,玩具|益智玩具|健身架,五星 婴儿宝宝火车健身架 婴儿玩具 音乐灯光 0-1岁宝宝健身器 37722,玩具乐器>益智玩具>健身架> 五星>五星 婴儿宝宝火车健身架 婴儿玩具 音乐...,京东商城,沃尔基玩具，母婴专营店1002008002,玩具|益智玩具|健身架,比爱 动物乐园敲敲乐 敲击果虫婴儿玩具 打地鼠游戏 亲子互动玩具 创意闯关打地鼠,首页>母婴>玩具>婴幼玩具>益智玩具>比爱动物乐园敲敲乐敲击果虫婴儿玩...,苏宁,比爱1002008002,玩具|益智玩具|健身架,费雪牌 新品Fisher Price 费雪 蹦跳学步欢乐园CCF37宝宝健身架 婴儿玩具,所有分类>母婴用品、玩具>玩具>幼儿感官认知玩具>幼儿爬行/学步/健身>健身架>费雪牌,1号店,健身架1002008002,玩具|益智玩具|健身架,费雪牌 缤纷动物豪华健身器Y6588 宝宝婴儿玩具健身架,所有分类>母婴用品、玩具>玩具>幼儿感官认知玩具>幼儿爬行/学步/健身>健身架>费雪牌,1号店,健身架