1004006004,汽车摩托|内饰精品|颈枕、头枕,【京东自营】GiGi 天然乳胶 休闲颈枕 U型枕护颈枕午睡枕旅行枕靠枕保健颈椎枕 NE-003-N（琥珀）,汽车用品>汽车装饰>头枕腰靠>GiGi>吉吉天然乳胶NE-003-N（琥珀）,京东商城,GiGi1004006004,汽车摩托|内饰精品|颈枕、头枕,【京东自营】RZM 全皮革记忆棉汽车用头枕护颈枕颈椎车靠枕 无味安全(尊享系列)高原棕黄 对装,汽车用品>汽车装饰>头枕腰靠>RZM>RZM全皮革记忆棉汽车用头枕护颈枕颈椎车靠枕,京东商城,RZM1004006004,汽车摩托|内饰精品|颈枕、头枕,GREAT LIFE GLT-025 记忆棉U型护颈枕 U型记忆棉午睡枕 （厂家直发）,汽车用品>汽车装饰>头枕腰靠>GREAT LIFE>GREAT LIFEGLT-025,京东商城,GREAT LIFE1004006004,汽车摩托|内饰精品|颈枕、头枕,爱车屋（ICAROOM） I-366KK-2 荷塘月色高档车用头枕护颈枕 车用 家用 汽车抱枕两用 四件套装（厂家直发）,汽车用品>内饰精品>抱枕/腰靠>爱车屋（ICAROOM）>爱车屋I-366KK-2,京东商城,爱车屋（ICAROOM）1004006004,汽车摩托|内饰精品|颈枕、头枕,卡韵 汽车头枕颈枕对装 舒适透气 车用头枕 汽车枕头 车用护颈枕 骨头枕 橘色,其它>卡韵 汽车头枕颈枕对装 舒适透气 车用头...,京东商城,卡韵汽车用品1004006004,汽车摩托|内饰精品|颈枕、头枕,富晨 苏格兰纹颈枕 汽车头枕 黑色 一对,其它>富晨 苏格兰纹颈枕 汽车头枕 黑色 一对,京东商城,宝御记车品专营店1004006004,汽车摩托|内饰精品|颈枕、头枕,宝御记 真皮 头层牛皮 汽车头枕护颈枕 黑色 一对,其它>宝御记 真皮 头层牛皮 汽车头枕护颈枕 ...,京东商城,宝御记车品专营店1004006004,汽车摩托|内饰精品|颈枕、头枕,阿布熊 车枕 多功能护颈U型枕 午睡枕 卡通颈枕 猪猪,汽车用品>汽车装饰>头枕腰靠>阿布熊>阿布熊 车枕 多功能护颈U型枕 午睡枕 ...,京东商城,阿布熊汽车用品专营店1004006004,汽车摩托|内饰精品|颈枕、头枕,普士德 汽车内饰 钻石绒小熊系列 环保舒适头枕,汽车用品 > 汽车内饰 > 头枕,亚马逊(卓越网),普士德1004006004,汽车摩托|内饰精品|颈枕、头枕,优唐家汽车颈枕时尚撞色纯棉麻YTJ831 红色-单只颈枕,汽车用品>汽车装饰>头枕腰靠>优唐家>优唐家汽车颈枕时尚撞色纯棉麻YTJ831...,京东商城,美斯优唐汽车用品专营店1004006004,汽车摩托|内饰精品|颈枕、头枕,鑫闵 汽车毛绒颈枕 可爱 头枕 车用护颈枕 汽车头枕 熊猫头枕 单只哦 对装叉眼眯眼,汽车用品 > 汽车内饰 > 头枕,亚马逊(卓越网),鑫闵1004006004,汽车摩托|内饰精品|颈枕、头枕,Anjuny 安程 XP0604 汽车扭扭健康颈枕 坐枕汽车颈枕 车用头枕护颈枕四季通用(深蓝),汽车用品 > 汽车内饰 > 头枕,亚马逊(卓越网),Anjuny 安程1004006004,汽车摩托|内饰精品|颈枕、头枕,新族 U型颈靠午睡宝 (粉色),汽车用品 > 汽车内饰 > 头枕,亚马逊(卓越网),新族1004006004,汽车摩托|内饰精品|颈枕、头枕,Climbke 登峰客户外旅行U型枕护颈枕 动车睡眠神器飞机高铁火车飞行枕(青蛙),汽车用品 > 汽车内饰 > 头枕,亚马逊(卓越网),登峰客1004006004,汽车摩托|内饰精品|颈枕、头枕,品泰 打孔皮革汽车头枕 护颈枕 车用头枕 汽车枕头 特价颈枕 橘色   ,汽车用品>汽车内饰>汽车头枕>品泰 打孔皮革汽车头枕 护颈枕 车用头枕 汽车枕头 特价颈枕 橘色   ,为为网,品泰1004006004,汽车摩托|内饰精品|颈枕、头枕,ABIGALE 汽车头枕 汽车颈枕 汽车靠枕 冰丝头枕 手工编织（一对装） 米黄色,汽车用品 > 汽车内饰 > 头枕,亚马逊(卓越网),ABIGALE 艾比盖尔1004006004,汽车摩托|内饰精品|颈枕、头枕,TYPER 汽车用品网布护颈垫 TR-1001 (灰),汽车用品 > 汽车内饰 > 头枕,亚马逊(卓越网),Typer 泰普尔1004006004,汽车摩托|内饰精品|颈枕、头枕,酷玛传奇 汽车靠枕，抱枕 原创等待的猫咪素色天然乳胶车用头枕 汽车护颈枕 怀旧复古车枕 (现代简约),汽车用品 > 汽车内饰,亚马逊(卓越网),酷玛传奇1004006004,汽车摩托|内饰精品|颈枕、头枕,欧美佳竹炭太空记忆棉骨头枕 汽车保健枕 车用头枕护颈枕,汽车用品 > 车饰精品 > 车内饰品 > 商品详情,当当网,欧美佳1004006004,汽车摩托|内饰精品|颈枕、头枕,麻王 汽车透气竹炭记忆棉 慢回弹 亚麻养生 U型枕 灰色,首页>汽车用品>内饰精品>头枕/颈枕>麻王汽车透气竹炭记忆棉慢回弹亚...,苏宁,麻王1004006004,汽车摩托|内饰精品|颈枕、头枕,铁臂阿童木（Astroboy） 汽车办公室 护腰腰靠+骨头枕慢回弹记忆棉套装 灰色,汽车用品>汽车装饰>头枕腰靠>铁臂阿童木（Astro Boy）>铁臂阿童木汽车办公室,京东商城,铁臂阿童木（Astro Boy）1004006004,汽车摩托|内饰精品|颈枕、头枕,悠嘻猴四季通用PU皮护颈骨头枕(米色),汽车用品>头枕/颈枕/抱枕>悠嘻猴>悠嘻猴四季通用PU皮护颈骨头枕(米色),国美电器网上商城,悠嘻猴1004006004,汽车摩托|内饰精品|颈枕、头枕,悠嘻猴四季通用仿亚麻汽车抱枕(银灰色),汽车用品>头枕/颈枕/抱枕>悠嘻猴>悠嘻猴四季通用仿亚麻汽车抱枕(银灰色),国美电器网上商城,悠嘻猴1004006004,汽车摩托|内饰精品|颈枕、头枕,铁臂阿童木BZDP-01G,汽车用品>头枕/颈枕/抱枕>铁臂阿童木>铁臂阿童木BZDP-01G,国美电器网上商城,铁臂阿童木1004006004,汽车摩托|内饰精品|颈枕、头枕,爱驾KLAJYK-108记忆棉腰靠（咖啡色）,汽车用品>头枕/颈枕/抱枕>爱驾>爱驾KLAJYK-108记忆棉腰靠（咖啡色）,国美电器网上商城,爱驾1004006004,汽车摩托|内饰精品|颈枕、头枕,酷玛传奇 汽车内饰用品韩国VIP DAD镶钻皇冠头枕/四季通用泡泡舒适/护颈枕,所有分类>大小家电、厨电、汽车>汽车生活>汽车内饰>抱枕靠枕>酷玛传奇>酷玛传奇 汽车内饰用...,1号店,酷玛传奇1004006004,汽车摩托|内饰精品|颈枕、头枕,麻王 颈枕yy-010（对装）磁疗手编,首页>汽车用品>内饰精品>头枕/颈枕>麻王颈枕yy-010（对装）磁疗手...,苏宁,麻王1004006004,汽车摩托|内饰精品|颈枕、头枕,沿途I61 头枕 决明子 太阳花 米色,首页>汽车用品>内饰精品>头枕/颈枕>沿途I61头枕决明子太阳花米...,苏宁,沿途1004006004,汽车摩托|内饰精品|颈枕、头枕,依然(ERILL)正品记忆棉高级商务用汽车头枕护颈枕ZK-2801 优雅米,首页>汽车用品>内饰精品>头枕/颈枕>依然(ERILL)正品记忆棉高级商务...,苏宁,ERILL/依然1004006004,汽车摩托|内饰精品|颈枕、头枕,依然(ERILL)正品记忆棉高级商务用汽车头枕护颈枕ZK-2802 米色,首页>汽车用品>内饰精品>头枕/颈枕>依然(ERILL)正品记忆棉高级商务...,苏宁,ERILL/依然1004006004,汽车摩托|内饰精品|颈枕、头枕,腰宝宝 汽车头枕 护颈颈枕 汽车头靠靠枕 真皮太空记忆棉 车用颈枕,所有分类>大小家电、厨电、汽车>汽车生活>汽车内饰>抱枕靠枕>腰宝宝>腰宝宝 汽车头枕 护...,1号店,腰宝宝1004006004,汽车摩托|内饰精品|颈枕、头枕,XINAN 新款 四季通用 茶叶汽车头枕 护颈枕 汽车用品,所有分类>大小家电、厨电、汽车>汽车生活>座垫脚垫>多功能垫>XINAN>XINAN 新款 四...,1号店,XINAN1004006004,汽车摩托|内饰精品|颈枕、头枕,GIGI新款太空记忆棉行车汽车用头枕 头靠 卡通印花简约头枕 枕靠(杏色),汽车用品>头枕/颈枕/抱枕>GiGi>GIGI新款太空记忆棉行车汽车用头枕 头靠 卡通印花简约头枕 枕靠(杏色),国美电器网上商城,邦诺车品专营店1004006004,汽车摩托|内饰精品|颈枕、头枕,WRC汽车用家用多功能空调被抱枕被腰枕靠垫耐磨 柔软棉芯(咖格空调被),汽车用品>头枕/颈枕/抱枕>WRC>WRC汽车用家用多功能空调被抱枕被腰枕靠垫耐磨 柔软棉芯(咖格空调被),国美电器网上商城,WRC旗舰店1004006004,汽车摩托|内饰精品|颈枕、头枕,拉米斯汽车座椅头靠 头枕颈枕车用 车内靠枕 腰靠护颈枕 腰枕(腰靠棕红色),汽车用品>头枕/颈枕/抱枕>拉米斯>拉米斯汽车座椅头靠 头枕颈枕车用 车内靠枕 腰靠护颈枕 腰枕(腰靠棕红色),国美电器网上商城,邦诺车品专营店1004006004,汽车摩托|内饰精品|颈枕、头枕,拉米斯汽车座椅头靠 头枕颈枕车用 车内靠枕 腰靠护颈枕 腰枕(头枕腰靠棕黄),汽车用品>头枕/颈枕/抱枕>拉米斯>拉米斯汽车座椅头靠 头枕颈枕车用 车内靠枕 腰靠护颈枕 腰枕(头枕腰靠棕黄),国美电器网上商城,邦诺车品专营店1004006004,汽车摩托|内饰精品|颈枕、头枕,正品吉吉GiGi太空记忆棉护椎汽车腰靠行车腰枕背靠腰靠G-1109(杏色),汽车用品>车主用品>GiGi>正品吉吉GiGi太空记忆棉护椎汽车腰靠行车腰枕背靠腰靠G-1109(杏色),国美电器网上商城,欧联车品专营店1004006004,汽车摩托|内饰精品|颈枕、头枕,出胜 汽车专用内饰精品 车内装饰用品豹纹 头枕 颈枕(黑白色),汽车用品>头枕/颈枕/抱枕>出胜>出胜 汽车专用内饰精品 车内装饰用品豹纹 头枕 颈枕(黑白色),国美电器网上商城,豫海车品专营店1004006004,汽车摩托|内饰精品|颈枕、头枕,爱车屋ICAROOM 米汤D 汽车腰枕/腰靠/腰垫 T-009D,汽车用品>头枕/颈枕/抱枕>爱车屋>爱车屋ICAROOM 米汤D 汽车腰枕/腰靠/腰垫 T-009D,国美电器网上商城,爱车屋1004006004,汽车摩托|内饰精品|颈枕、头枕,爱车屋ICAROOM 米汤D 汽车用骨头枕/护颈枕 T-002D,汽车用品>头枕/颈枕/抱枕>爱车屋>爱车屋ICAROOM 米汤D 汽车用骨头枕/护颈枕 T-002D,国美电器网上商城,爱车屋1004006004,汽车摩托|内饰精品|颈枕、头枕,【品牌特卖】歌诗达 金砖华丽系列精品汽车颈枕头枕 车用颈枕头枕(C系列棱角颈枕),汽车用品>头枕/颈枕/抱枕>歌诗达>【品牌特卖】歌诗达 金砖华丽系列精品汽车颈枕头枕 车用颈枕头枕(C系列棱角颈枕),国美电器网上商城,豪盾汽车用品专营店1004006004,汽车摩托|内饰精品|颈枕、头枕,【品牌特卖】歌诗达 时尚系列精品汽车颈枕头枕 车用颈枕头枕(蓝米J4),汽车用品>头枕/颈枕/抱枕>歌诗达>【品牌特卖】歌诗达 时尚系列精品汽车颈枕头枕 车用颈枕头枕(蓝米J4),国美电器网上商城,豪盾汽车用品专营店1004006004,汽车摩托|内饰精品|颈枕、头枕,【品牌特卖】歌诗达 时尚系列精品汽车颈枕头枕 车用颈枕头枕(橙米J3),汽车用品>头枕/颈枕/抱枕>歌诗达>【品牌特卖】歌诗达 时尚系列精品汽车颈枕头枕 车用颈枕头枕(橙米J3),国美电器网上商城,豪盾汽车用品专营店1004006004,汽车摩托|内饰精品|颈枕、头枕,【品牌特卖】歌诗达 时尚系列精品汽车抱枕腰枕 车用抱枕腰枕(黄红E2),汽车用品>头枕/颈枕/抱枕>歌诗达>【品牌特卖】歌诗达 时尚系列精品汽车抱枕腰枕 车用抱枕腰枕(黄红E2),国美电器网上商城,豪盾汽车用品专营店1004006004,汽车摩托|内饰精品|颈枕、头枕,【品牌特卖】歌诗达 时尚系列精品汽车抱枕被 车用抱被 空调被(蓝米E4),汽车用品>头枕/颈枕/抱枕>歌诗达>【品牌特卖】歌诗达 时尚系列精品汽车抱枕被 车用抱被 空调被(蓝米E4),国美电器网上商城,豪盾汽车用品专营店1004006004,汽车摩托|内饰精品|颈枕、头枕,GREAT LIFE 车用记忆棉舒适腰靠,汽车用品>头枕/颈枕/抱枕>格雷特>GREAT LIFE 车用记忆棉舒适腰靠,国美电器网上商城,格雷特1004006004,汽车摩托|内饰精品|颈枕、头枕,沿途H76 头枕 超纤皮水波纹 对装(灰色),汽车用品>头枕/颈枕/抱枕>沿途>沿途H76 头枕 超纤皮水波纹 对装(灰色),国美电器网上商城,沿途车品专营店1004006004,汽车摩托|内饰精品|颈枕、头枕,时尚汽用品 四季通用 护颈枕 汽车头枕 豹纹款(棕色心),汽车用品>头枕/颈枕/抱枕>酷玛传奇>时尚汽用品 四季通用 护颈枕 汽车头枕 豹纹款(棕色心),国美电器网上商城,酷玛传奇官方旗舰店1004006004,汽车摩托|内饰精品|颈枕、头枕,时尚汽车用品 汽车小碎花竹炭包头枕米色均码(棕色),汽车用品>头枕/颈枕/抱枕>酷玛传奇>时尚汽车用品 汽车小碎花竹炭包头枕米色均码(棕色),国美电器网上商城,酷玛传奇官方旗舰店1004006004,汽车摩托|内饰精品|颈枕、头枕,汽车头枕骨头护颈枕车用短绒卡通可爱靠枕拍下请备注颜色(浪漫红),汽车用品>头枕/颈枕/抱枕>酷玛传奇>汽车头枕骨头护颈枕车用短绒卡通可爱靠枕拍下请备注颜色(浪漫红),国美电器网上商城,酷玛传奇官方旗舰店1004006004,汽车摩托|内饰精品|颈枕、头枕,汽车头枕冰丝护颈靠枕车用一对骨头枕内饰(红白),汽车用品>头枕/颈枕/抱枕>酷玛传奇>汽车头枕冰丝护颈靠枕车用一对骨头枕内饰(红白),国美电器网上商城,酷玛传奇官方旗舰店1004006004,汽车摩托|内饰精品|颈枕、头枕,车之颜 休闲系列方形靠垫被/抱枕被/晾被(灰色),汽车用品>头枕/颈枕/抱枕>车之颜>车之颜 休闲系列方形靠垫被/抱枕被/晾被(灰色),国美电器网上商城,腾信汽车用品专营店1004006004,汽车摩托|内饰精品|颈枕、头枕,WRC汽车用 头颈枕骨头枕腰靠枕抱枕组合套装 办公家用奢华碳纤纹(两头枕黑红),汽车用品>头枕/颈枕/抱枕>WRC>WRC汽车用 头颈枕骨头枕腰靠枕抱枕组合套装 办公家用奢华碳纤纹(两头枕黑红),国美电器网上商城,WRC旗舰店1004006004,汽车摩托|内饰精品|颈枕、头枕,WRC汽车用 头颈枕骨头枕腰靠枕抱枕组合套装 办公家用奢华碳纤纹(四只装黑色),汽车用品>头枕/颈枕/抱枕>WRC>WRC汽车用 头颈枕骨头枕腰靠枕抱枕组合套装 办公家用奢华碳纤纹(四只装黑色),国美电器网上商城,WRC旗舰店1004006004,汽车摩托|内饰精品|颈枕、头枕,GiGi竹炭记忆棉头枕杏色灰色黑色 慢回弹 车用头枕 车用颈枕(灰色),汽车用品>头枕/颈枕/抱枕>GiGi>GiGi竹炭记忆棉头枕杏色灰色黑色 慢回弹 车用头枕 车用颈枕(灰色),国美电器网上商城,邦诺车品专营店1004006004,汽车摩托|内饰精品|颈枕、头枕,爱车屋ICAROOM 米汤D 汽车抱枕/车用抱枕(3号抱枕),汽车用品>头枕/颈枕/抱枕>爱车屋>爱车屋ICAROOM 米汤D 汽车抱枕/车用抱枕(3号抱枕),国美电器网上商城,4S网络专营店1004006004,汽车摩托|内饰精品|颈枕、头枕,爱车屋ICAROOM 米汤D 汽车用骨头枕,汽车用品>头枕/颈枕/抱枕>爱车屋>爱车屋ICAROOM 米汤D 汽车用骨头枕,国美电器网上商城,爱车屋1004006004,汽车摩托|内饰精品|颈枕、头枕,车之颜 原姿商务车系列车用颈枕/头枕/骨头枕(单个装) CM201,汽车用品>头枕/颈枕/抱枕>车之颜>车之颜 原姿商务车系列车用颈枕/头枕/骨头枕(单个装) CM201,国美电器网上商城,车之颜1004006004,汽车摩托|内饰精品|颈枕、头枕,飞石（FLYING STONE) 车用座椅头枕2件套KD-022,汽车用品>头枕/颈枕/抱枕>飞石>飞石（FLYING STONE) 车用座椅头枕2件套KD-022,国美电器网上商城,飞石汽车用品专营店1004006004,汽车摩托|内饰精品|颈枕、头枕,卡饰社 舒适竹炭抱枕/腰靠 时尚灰色 (单个) CS-27577,汽车用品>头枕/颈枕/抱枕>卡饰社>卡饰社 舒适竹炭抱枕/腰靠 时尚灰色 (单个) CS-27577,国美电器网上商城,东莞港威车品专营店1004006004,汽车摩托|内饰精品|颈枕、头枕,卡饰社 舒适竹炭头枕 时尚米色 (对装) CS-27572,汽车用品>头枕/颈枕/抱枕>卡饰社>卡饰社 舒适竹炭头枕 时尚米色 (对装) CS-27572,国美电器网上商城,东莞港威车品专营店1004006004,汽车摩托|内饰精品|颈枕、头枕,马车夫COACHMAN 汽车头枕 慢回弹记忆棉护颈枕 骨头枕（单只）,汽车用品>头枕/颈枕/抱枕>马车夫>马车夫COACHMAN 汽车头枕 慢回弹记忆棉护颈枕 骨头枕（单只）,国美电器网上商城,马车夫官方旗舰店1004006004,汽车摩托|内饰精品|颈枕、头枕,正品GiGi竹炭至尊太空记忆棉车用头枕 慢回弹汽车护颈枕 靠垫(黑色),汽车用品>头枕/颈枕/抱枕>GiGi>正品GiGi竹炭至尊太空记忆棉车用头枕 慢回弹汽车护颈枕 靠垫(黑色),国美电器网上商城,邦诺车品专营店1004006004,汽车摩托|内饰精品|颈枕、头枕,汽车头枕手编冰丝颈枕对装夏季车用脖枕(棕色 ),汽车用品>头枕/颈枕/抱枕>酷玛传奇>汽车头枕手编冰丝颈枕对装夏季车用脖枕(棕色 ),国美电器网上商城,酷玛传奇官方旗舰店1004006004,汽车摩托|内饰精品|颈枕、头枕,泰澄 汽车枕头颈枕 车用枕头护颈枕 骨头枕 四季通用保健枕头(桔色),汽车用品>头枕/颈枕/抱枕>泰澄>泰澄 汽车枕头颈枕 车用枕头护颈枕 骨头枕 四季通用保健枕头(桔色),国美电器网上商城,泰澄车品旗舰店1004006004,汽车摩托|内饰精品|颈枕、头枕,DK 汽车头枕 纯棉 靠枕颈枕 记忆棉 车用护颈枕  高端车饰 包邮(米色),汽车用品>头枕/颈枕/抱枕>D-K>DK 汽车头枕 纯棉 靠枕颈枕 记忆棉 车用护颈枕  高端车饰 包邮(米色),国美电器网上商城,在舟车品专营店1004006004,汽车摩托|内饰精品|颈枕、头枕,CARMATE快美特康芙特CSZ291汽车振动按摩颈枕-米黄色 汽车用品晶臣代理,首页>精品装饰>头枕/抱枕/腰靠>CARMATE 快美特 快美特康芙特CSZ291,易迅网, Carmate/快美特1004006004,汽车摩托|内饰精品|颈枕、头枕,WellHouse 天鹅绒 汽车枕/午睡枕/子母护颈枕/充气枕头/U型枕/旅行枕(粉色WH122),汽车用品>头枕/颈枕/抱枕>WellHouse>WellHouse 天鹅绒 汽车枕/午睡枕/子母护颈枕/充气枕头/U型枕/旅行枕(粉色WH122),国美电器网上商城,腾信汽车用品专营店1004006004,汽车摩托|内饰精品|颈枕、头枕,五福金牛 好运牛头枕 骨头枕 车用颈枕 汽车头枕一对,所有分类>大小家电、厨电、汽车>汽车生活>汽车内饰>抱枕靠枕>五福金牛>五福金牛 好运牛头枕...,1号店,五福金牛