1004004011,汽车摩托|汽车美容|车掸,红兔子 二只装 家居除尘刷 超细纤维伸缩尘掸 除尘清扫尘掸 加密长毛雪尼尔除尘掸 挂式不锈钢清洁刷 咖啡色J2103-1,首页>家居/家装建材/厨具>清洁用品>清洁工具>红兔子二只装家居除尘刷超细纤维...,苏宁,红兔子1004004011,汽车摩托|汽车美容|车掸,红兔子 雪尼尔尘掸 超细纤维可弯曲擦车掸子 车用静电尘掸子 新款鸡毛掸子 双面蓝色 N2109-2,首页>家居/家装建材/厨具>清洁用品>清洁工具>红兔子雪尼尔尘掸超细纤维可弯曲擦...,苏宁,红兔子1004004011,汽车摩托|汽车美容|车掸,红兔子 三只装 家居除尘刷 超细纤维伸缩尘掸 除尘清扫尘掸 加密长毛雪尼尔除尘掸 挂式不锈钢清洁刷 浅蓝色J2203-1,首页>家居/家装建材/厨具>清洁用品>清洁工具>红兔子三只装家居除尘刷超细纤维...,苏宁,红兔子1004004011,汽车摩托|汽车美容|车掸,普润 五只装雪尼尔 超细纤维伸缩尘掸 除尘清扫尘掸 加密长毛 车用 鸡毛掸子清洁掸 可伸缩 蓝色,家居家装>清洁用品>清洁工具> 普润（PU RUN）>普润 五只装雪尼尔 超细纤维伸缩尘掸 除...,京东商城,天瑞家居专营店1004004011,汽车摩托|汽车美容|车掸,普润 雪尼尔尘掸 超细纤维可弯曲擦车掸子 新款鸡毛掸子 双面 蓝色 产品编号：N2109-2,首页>家居/家装建材/厨具>清洁用品>清洁工具>普润雪尼尔尘掸超细纤维可弯曲擦车...,苏宁,普润1004004011,汽车摩托|汽车美容|车掸,车盟海饰 汽车蜡拖 车蜡掸超细纤维纳米车掸子 蜡刷车掸擦车拖把车刷 洗车工具汽车用品 男款黑色一把,汽车用品>美容清洗>洗车配件> 车盟海饰>车盟海饰 汽车蜡拖 车蜡掸超细纤维纳米车...,京东商城,车盟海饰汽车用品专营店1004004011,汽车摩托|汽车美容|车掸,卡饰社 超细纤维 可伸缩 掸子扫 蓝色,首页 > 港威汽车用品专场 > 卡饰社 超细纤维 可伸缩 掸子扫 蓝色,唯品会,无1004004011,汽车摩托|汽车美容|车掸,普润 雪尼尔尘掸 超细纤维可弯曲擦车掸子 新款鸡毛掸子 双面 粉色可伸缩汽车用刷长柄除尘扫可弯曲家用鸡毛掸子清洁掸     N2109-3,家居日用 > 清洁护理 > 其它 > 普润 雪尼尔尘掸 超细纤维可弯曲擦车掸子 新款鸡毛掸子 双面 粉...,当当网,普润1004004011,汽车摩托|汽车美容|车掸,普润 雪尼尔 超细纤维伸缩尘掸 除尘清扫尘掸 加密长毛 咖啡色J2103-1,家居日用 > 清洁护理 > 清洁工具 > 普润 雪尼尔 超细纤维伸缩尘掸 除尘清扫尘掸 加密长毛 咖啡色J21...,当当网,普润1004004011,汽车摩托|汽车美容|车掸,普润 雪尼尔 超细纤维伸缩尘掸 除尘清扫尘掸 加密长毛 玫红色 J2107,家居日用 > 清洁护理 > 清洁工具 > 普润 雪尼尔 超细纤维伸缩尘掸 除尘清扫尘掸 加密长毛 玫红色 J2...,当当网,普润1004004011,汽车摩托|汽车美容|车掸,普润 雪尼尔 超细纤维伸缩尘掸 除尘清扫尘掸 加密长毛 亮绿色 J2303,家居日用 > 清洁护理 > 清洁工具 > 普润 雪尼尔 超细纤维伸缩尘掸 除尘清扫尘掸 加密长毛 亮绿色 J2...,当当网,普润1004004011,汽车摩托|汽车美容|车掸,家家爽 全能型除尘平板拖清洗方便可换布易拆易洗地板拖把,,亚马逊(卓越网),家家爽1004004011,汽车摩托|汽车美容|车掸,普润 雪尼尔 超细纤维伸缩尘掸 除尘清扫尘掸 加密长毛 亮绿色J2303 超细纤维伸缩尘掸 除尘清扫尘掸,家居日用 > 清洁护理 > 清洁工具 > 普润 雪尼尔 超细纤维伸缩尘掸 除尘清扫尘掸 加密长毛 亮绿色J23...,当当网,尚品1004004011,汽车摩托|汽车美容|车掸,卡饰社（CarSetCity）CS-28014-1 超细纤维子母掸子扫 免伤车漆掸子扫 蓝色,首页 >美容清洁 >其他清洗工具 >卡饰社（CarSetCity） >CS-28014-1,易迅网,1004004011,汽车摩托|汽车美容|车掸,车之吻 福字系列桃形塑胶软面除尘蜡掸 灰色棉纱线/蓝色手柄,首页 >美容清洁 >其他清洗工具 >车之吻 >福字系列桃形塑胶软面除尘蜡掸,易迅网,1004004011,汽车摩托|汽车美容|车掸,悦卡 YC-CD02 纯棉线汽车车掸可伸缩手柄蜡拖汽车清洁养护除尘除静电蜡掸（咖啡色）,首页 >美容清洁 >其他清洗工具 >悦卡 >YC-CD02,易迅网,1004004011,汽车摩托|汽车美容|车掸,港威 卡饰社 超细纤维 可伸缩 360度 掸子扫,首页 > 港威汽车用品专场 > 卡饰社 超细纤维 可伸缩 360度 掸子扫,唯品会,无1004004011,汽车摩托|汽车美容|车掸,冰星掸子三合一 可伸缩雪呢绒掸子 蜡刷 送迷你蜡刷 掸子蜡,当当网 > 汽车用品 > 养护用品 > 蜡扫/掸子/海绵,当当网,冰星1004004011,汽车摩托|汽车美容|车掸,洁诺绅缩小扫把 蜡掸 汽车掸子 擦车掸子洁诺绅缩小扫把 蜡掸,当当网 > 汽车用品 > 养护用品 > 蜡扫/掸子/海绵,当当网,1004004011,汽车摩托|汽车美容|车掸,鑫苹果 明洁 汽车 养护 清洁 掸子 灰色,汽车用品>汽车美容>车掸>鑫苹果>鑫苹果掸子,京东商城,鑫苹果1004004011,汽车摩托|汽车美容|车掸,洁诺鲨鱼王子 蜡掸 汽车掸子 擦车掸子 送掸子蜡 蓝洁诺掸子,当当网 > 汽车用品 > 养护用品 > 蜡扫/掸子/海绵,当当网,1004004011,汽车摩托|汽车美容|车掸,泰澄/纳米纤维伸缩式除尘洗车掸子 汽车蜡拖 车用擦车拖把/蜡刷泰澄/纳米纤维伸缩式汽车蜡拖/蜡刷,当当网 > 汽车用品 > 养护用品 > 蜡扫/掸子/海绵,当当网,泰澄1004004011,汽车摩托|汽车美容|车掸,车之吻 纯棉黑线掸子（纯棉黑线，高效除尘） (北京地区已开通线下安装及保养服务！仅限亚马逊自营商品，详见商品描述),汽车用品 > 汽车保养 > 洗车工具 > 尘掸,亚马逊(卓越网),车之吻1004004011,汽车摩托|汽车美容|车掸,蜡拖豪华除尘拖/车尘掸汽车掸子高级子母掸子带保护罩,当当网 > 汽车用品 > 养护用品 > 蜡扫/掸子/海绵,当当网,阳光1004004011,汽车摩托|汽车美容|车掸,新禾 雪尼尔多用蜡拖汽车掸子把除尘刷,汽车用品 > 保养\\清洁 > 维护\\清洁 > 洗车工具 > 刷子 ,亚马逊(卓越网),新禾1004004011,汽车摩托|汽车美容|车掸,汽车掸子纳米超细纤维可伸缩可水洗不掉毛不划车漆,当当网 > 汽车用品 > 养护用品 > 蜡扫/掸子/海绵,当当网,1004004011,汽车摩托|汽车美容|车掸,冰星正品 汽车用品 蜡托 拖把 蜡拖 车掸子多种用途 E-08 热卖,当当网 > 汽车用品 > 养护用品 > 蜡扫/掸子/海绵,当当网,冰星1004004011,汽车摩托|汽车美容|车掸,卡饰社超细纤维可伸缩,汽车用品>掸子>卡饰社>卡饰社超细纤维可伸缩,国美电器网上商城,卡饰社1004004011,汽车摩托|汽车美容|车掸,冰星 汽车掸子 正品 汽车拖把蜡拖除尘掸子清洁刷车用 A-8,汽车用品 > 汽车美容 > 蜡扫/掸子 > 商品详情,当当网,冰星1004004011,汽车摩托|汽车美容|车掸,【货到付款】中德 超纤维汽车蜡掸 除尘掸车用清洁刷 车拖,汽车用品>汽车美容>车掸>【货到付款】中德 超纤维汽车蜡掸 除尘掸...,京东商城,中德旗舰店1004004011,汽车摩托|汽车美容|车掸,劲牛王BULLSONE 高级掸子,汽车美容/清洁/养护>美容清洁工具,为为网,劲牛王1004004011,汽车摩托|汽车美容|车掸,popoku 泡泡酷 PDX雪呢绒 圆形汽车除尘掸子 (北京地区已开通线下安装及保养服务！仅限亚马逊自营商品，详见商品描述),汽车用品 > 汽车保养 > 洗车工具 > 尘掸,亚马逊(卓越网),泡泡酷1004004011,汽车摩托|汽车美容|车掸,思卡丽 超细纤维可伸缩汽车除尘掸 洗车蜡拖把 180度灰线,汽车用品>汽车美容>车掸>思卡丽 超细纤维可伸缩汽车除尘掸 洗车蜡...,京东商城,思卡丽京东旗舰店1004004011,汽车摩托|汽车美容|车掸,车当家 纳米汽车除尘掸 车用蜡拖,生活电器、汽车生活>汽车生活>美容清洗>清洁工具,1号店,车当家1004004011,汽车摩托|汽车美容|车掸,泰澄 汽车擦车刷子 可伸缩除尘蜡拖 车用蜡刷 汽车掸子车刷 洗车工具,汽车用品 > 洗车/美容工具 > 泰澄,国美电器网上商城,1004004011,汽车摩托|汽车美容|车掸,卡饰社 超细纤维除尘掸子扫 蓝色 CS-28013-1,汽车用品 > 掸子/擦车巾 > 卡饰社,国美电器网上商城,1004004011,汽车摩托|汽车美容|车掸,咕咕 汽车弹子 蜡拖 除尘扫 不锈钢把可伸缩式 (白色),汽车用品 > 掸子/擦车巾 > 咕咕,国美电器网上商城,1004004011,汽车摩托|汽车美容|车掸,Dian bin 点缤 汽车蜡扫 蜡拖 铝合金可伸缩扁形蜡扫 洗车拖把 蜡刷 车弹子,汽车用品 > 汽车保养 > 洗车工具 > 尘掸,亚马逊(卓越网),Dian bin 点缤1004004011,汽车摩托|汽车美容|车掸,披甲熊 汽车蜡拖 车用超细纤维伸缩除尘掸 洗车擦车蜡掸,汽车用品>掸子>披甲熊>披甲熊 汽车蜡拖 车用超细纤维伸缩除尘掸 洗车擦车蜡掸,国美电器网上商城,邦诺车品专营店1004004011,汽车摩托|汽车美容|车掸,Dian bin 点缤 星光 汽车蜡拖 擦车拖把 汽车刷车掸子 清洁除尘掸 洗车蜡刷拖把,汽车用品 > 汽车保养 > 洗车工具 > 尘掸,亚马逊(卓越网),Dian bin 点缤1004004011,汽车摩托|汽车美容|车掸,冰星 汽车除尘掸子超纤维掸子去静电车掸除尘刷蜡拖蜡刷蜡扫合金杆H11,汽车用品 > 汽车保养 > 洗车工具 > 尘掸 ,亚马逊(卓越网),冰星1004004011,汽车摩托|汽车美容|车掸,SURKR超细纤维雪尼尔 清洁除尘掸 洗车掸子 免伤车漆 家用扫灰 紫色,家居家装>生活日用>浴室用品>SURKR >SURKR超细纤维雪尼尔 清洁除尘掸 ...,京东商城,天使爱韩国生活馆1004004011,汽车摩托|汽车美容|车掸,车之吻 铝合金杆旋转伸缩杆擦车蜡刷/环保塑胶软面纯棉灰线(高效除尘、不掉毛絮、超柔棉纱线、掸线含清洁上光保护蜡剂、去污、清洁、上光一次完成) (北京地区已开通线下安装及保养服务！仅限亚马逊自营商品，详见商品描述),汽车用品 > 汽车保养 > 洗车工具 > 尘掸,亚马逊(卓越网),车之吻1004004011,汽车摩托|汽车美容|车掸,冰星 汽车伸缩式超细纤维除尘蜡拖掸子 E系列 E18,冰星>冰星 汽车伸缩式超细纤维除尘蜡拖掸子 E...,京东商城,环球汽车用品专营店1004004011,汽车摩托|汽车美容|车掸,冰星 汽车伸缩式超细纤维除尘蜡拖掸子 E系列 E08,冰星>冰星 汽车伸缩式超细纤维除尘蜡拖掸子 E...,京东商城,环球汽车用品专营店1004004011,汽车摩托|汽车美容|车掸,鑫苹果 旋风超洁 可伸缩清洁掸子,汽车用品>汽车美容>车掸>鑫苹果>鑫苹果旋风超洁,京东商城,鑫苹果1004004011,汽车摩托|汽车美容|车掸,日本LEC激落清洁掸子 超细纤维刷子 360度家务除尘刷 可拆卸刷头S-385,家居家装>清洁用品>清洁工具>LEC>日本LEC激落清洁掸子 超细纤维刷子 3...,京东商城,加惠家居1004004011,汽车摩托|汽车美容|车掸,【免运费】勤晨 汽车蜡拖 车蜡掸超细纤维纳米车掸子 蜡刷车掸擦车拖把车刷 洗车工 情侣款/黑色一把橙色一把,汽车用品>汽车美容>车掸>勤晨>【免运费】勤晨 汽车蜡拖 车蜡掸超细纤维...,京东商城,勤晨专营店1004004011,汽车摩托|汽车美容|车掸,Koocar 雪尼尔珊瑚虫汽车蜡拖清洁除尘掸子可弯曲可叠 蜡掸 橙色,汽车用品 > 汽车保养 > 洗车工具 > 尘掸,亚马逊(卓越网),Koocar1004004011,汽车摩托|汽车美容|车掸,雅高 平板拖把 超细纤维平板可伸缩除尘拖把 夹固平拖 201不锈钢拖把 枚红色 平板拖把 TM13053100010 (玫红色),购买由网豆商城提供的雅高拖把合格购物商品超过 ￥ 100.00 元，另外购买蓝泡泡马桶清洁剂 将减免￥ 20.00 元。 点此查看如何获得促销优惠 (促销说明) 当您购买 1 或由网豆商城提供的更多指定商品时，您将免运费获得此商品 点此查看如何获得促销优惠 (促销说明),亚马逊(卓越网),Ya Gao 雅高1004004011,汽车摩托|汽车美容|车掸,幸福家雪尼尔珊瑚虫可弯曲折叠家用除尘掸子 颜色随机发送,家居家装>清洁用品>清洁工具>幸福家雪尼尔珊瑚虫可弯曲折叠家用除尘掸子...,京东商城,幸福家1004004011,汽车摩托|汽车美容|车掸,奇丽屋创意清洁工具灰藏掸 家用静电除尘掸 汽车用掸子 QLW-025,家居家装>清洁用品>清洁工具>奇丽屋>奇丽屋创意清洁工具灰藏掸 家用静电除尘掸...,京东商城,目磊家居专营店1004004011,汽车摩托|汽车美容|车掸,【免运费】车之魂汽车掸子擦车拖把蜡刷蜡拖 纯棉浸蜡车刷子除尘掸子,汽车用品>汽车美容>洗车配件>车之魂>【免运费】车之魂汽车掸子擦车拖把蜡刷蜡拖...,京东商城,车之魂专营店1004004011,汽车摩托|汽车美容|车掸,卡饰社 超细纤维除尘掸子扫 蓝色 CS-28013-1,首页>汽车用品>清洁美容>美容清洁工具>卡饰社超细纤维除尘掸子扫蓝色C...,苏宁,卡饰社1004004011,汽车摩托|汽车美容|车掸,木丁西 高级方形超细纤维不锈刚把柄带伸缩式蜡拖把 汽车除尘刷 洗车用掸清洁刷 蜡掸,汽车用品 > 汽车保养 > 洗车工具 > 尘掸,亚马逊(卓越网),木丁西1004004011,汽车摩托|汽车美容|车掸,魔洗MOXI擦车洗车除尘掸子蜡扫 白色,魔洗（MOXI）>魔洗MOXI擦车洗车除尘掸子蜡扫 白色,京东商城,惠购在线1004004011,汽车摩托|汽车美容|车掸,春季热卖 奥瑞驰 纳米绵汽车蜡拖 伸缩蜡拖 汽车除尘车掸 擦车拖把洗车刷汽车清洁用品 两色 蓝色子母蜡拖,汽车用品>美容清洗>洗车配件>其它>春季热卖 奥瑞驰 纳米绵汽车蜡拖 伸缩蜡...,京东商城,牧耐汽车用品专营店1004004011,汽车摩托|汽车美容|车掸,旺旺萱 超细纤维可伸缩手柄汽车掸子 车用除尘蜡拖 洗车拖把,汽车用品>美容清洗>洗车配件>其它>旺旺萱 超细纤维可伸缩手柄汽车掸子 车...,京东商城,运喜车品专营店1004004011,汽车摩托|汽车美容|车掸,E路驰 360度伸缩除尘掸 车掸蜡拖 防静电圆筒蜡刷 超细纤维不掉毛 (白线),汽车用品 > 汽车保养 > 洗车工具 > 尘掸,亚马逊(卓越网),E路驰1004004011,汽车摩托|汽车美容|车掸,超细纤维汽车蜡刷/除尘蜡拖/洗车刷|腊把|伸缩式腊把,汽车用品 > 汽车美容 > 蜡扫/掸子 > 商品详情,当当网,酷玛传奇1004004011,汽车摩托|汽车美容|车掸,研美车配 雪尼尔 除尘刷 MLJ-7095 多色,所有分类>大小家电、厨电、汽车>汽车生活>美容清洗>清洁工具>研美车配>研美车配 雪尼尔 除...,1号店,研美车配1004004011,汽车摩托|汽车美容|车掸,耐实达 伸缩汽车蜡把 汽车掸子 除尘掸 车用擦车蜡拖把 蜡刷 黑色扁蜡拖,汽车用品>美容清洗>洗车配件>其它>耐实达 伸缩汽车蜡把 汽车掸子 除尘掸 ...,京东商城,耐实达京东专卖店1004004011,汽车摩托|汽车美容|车掸,scx 可伸缩蜡拖 双面用洗车刷 雪绒擦车拖把 可拆卸汽车除尘掸子,汽车用品 > 汽车保养 > 洗车工具 > 车刷,亚马逊(卓越网),SCX1004004011,汽车摩托|汽车美容|车掸,SURKR 韩国原装进口 高档除尘器 家用除尘掸 毛掸子,家居 > 家居清洁 > 除球器,亚马逊(卓越网),SURKR1004004011,汽车摩托|汽车美容|车掸,驰航 汽车刷蜡 洗车刷除尘车掸 可伸缩 掸子汽车清洁用品 (单个刷),汽车用品 > GPS导航、配件 > DVD导航仪,亚马逊(卓越网),iCar 以轩1004004011,汽车摩托|汽车美容|车掸,【免运费】车之魂 汽车蜡拖 掸子蜡拖 超纤细绒车用拖把洗车拖把,车之魂>【免运费】车之魂 汽车蜡拖 掸子蜡拖 超...,京东商城,车之魂专营店1004004011,汽车摩托|汽车美容|车掸,【货到付款】利拓 可伸缩超细纤维车用除尘掸 蜡拖 汽车清洁 XH-5100-TB 360度圆头蜡拖灰色,汽车用品>美容清洗>洗车配件>利拓>【货到付款】利拓 可伸缩超细纤维车用除尘...,京东商城,利拓旗舰店1004004011,汽车摩托|汽车美容|车掸,擦车拖把 刷车掸子洗车刷汽车拖把 除尘掸汽车刷子,家居家装>清洁用品>清洁工具>擦车拖把 刷车掸子洗车刷汽车拖把 除尘掸...,京东商城,H&3旗舰店1004004011,汽车摩托|汽车美容|车掸,冰星 超柔雪绒汽车蜡刷E18超纤静电除尘掸 汽车蜡拖车掸,汽车用品>汽车美容>车掸>冰星>冰星 超柔雪绒汽车蜡刷E18超纤静电除尘...,京东商城,邦诺车品专营店1004004011,汽车摩托|汽车美容|车掸,楼龙 扁形纳米棉 伸缩式蜡拖 家用车用用除尘拖 拖把车 掸子QC-30 红色,家居家装>清洁用品>清洁工具>楼龙(Loulong)>楼龙 扁形纳米棉 伸缩式蜡拖 家用车用用...,京东商城,楼龙旗舰店1004004011,汽车摩托|汽车美容|车掸,仁璟 雪尼尔除尘掸 除尘刷 掸子 双面可弯曲 一个 颜色随机,家居日用 > 清洁护理 > 清洁工具 > 商品详情,当当网,仁璟1004004011,汽车摩托|汽车美容|车掸,卡雨汽车除尘拖 汽车拖把车掸蜡刷  小型,汽车用品 > 汽车美容 > 蜡扫/掸子 > 商品详情,当当网,卡雨1004004011,汽车摩托|汽车美容|车掸,酷玛传奇 插把掸子折叠蜡掸子油掸子蜡刷汽车车用车刷子掸子 (插把掸子),汽车用品 > 汽车内饰,亚马逊(卓越网),酷玛传奇1004004011,汽车摩托|汽车美容|车掸,豫香 YUXIANG 汽车刷 蜡拖 擦车拖把 车用清洁除尘掸子 洗车刷 汽车用品,所有分类>大小家电、厨电、汽车>汽车生活>美容清洗>清洁工具>豫香 YUXIANG>豫香 YUXIANG...,1号店,豫香 YUXIANG1004004011,汽车摩托|汽车美容|车掸,宝家洁 3D立体超细纤维尘掸 除尘掸 小掸子 带手柄 可悬挂 家用,首页>家居/家装建材/厨具>清洁用品>清洁工具>宝家洁3D立体超细纤维尘掸除尘掸...,苏宁,宝家洁1004004011,汽车摩托|汽车美容|车掸,淘乐士日式雪尼尔车用除尘掸 多用除尘刷子清洁掸子 无划痕可拆洗 2个装,首页>家居/家装建材/厨具>清洁用品>清洁工具>淘乐士日式雪尼尔车用除尘掸多用除尘...,苏宁,淘乐士1004004011,汽车摩托|汽车美容|车掸,卡饰社超细纤维360度可伸缩,汽车用品>掸子>卡饰社>卡饰社超细纤维360度可伸缩,国美电器网上商城,卡饰社1004004011,汽车摩托|汽车美容|车掸,迪加伦 汽车蜡把 除尘蜡刷 拖把掸子 车用蜡拖,汽车用品>掸子>迪加伦>迪加伦 汽车蜡把 除尘蜡刷 拖把掸子 车用蜡拖,国美电器网上商城,迪加伦旗舰店1004004011,汽车摩托|汽车美容|车掸,卡饰社 超细纤维 可伸缩 掸子扫 灰色 CS-28011-2,汽车用品>掸子>卡饰社>卡饰社 超细纤维 可伸缩 掸子扫 灰色 CS-28011-2,国美电器网上商城,东莞港威车品专营店1004004011,汽车摩托|汽车美容|车掸,UNIC优易可 汽车除尘掸子 可伸缩式汽车拖把 洗车工具 蜡拖 汽车尘掸,所有分类>厨卫清洁、纸、清洁剂>清洁用具>除尘工具>除尘掸/掸头>UNIC优易可>UNIC优易可 汽车...,1号店,UNIC优易可1004004011,汽车摩托|汽车美容|车掸,XIANGLIALI 享丽莱 超柔软细纤维 雪尼尔车居多用蜡拖 掸子 汽车刷子 刷子 掸子 蜡拖 蜡刷 超柔软车用蜡把 (颜色随机),,亚马逊(卓越网),XIANGLIALI 享丽莱1004004011,汽车摩托|汽车美容|车掸,Carzkool 车志酷 伸缩汽车蜡拖 蜡把 汽车掸子 除尘掸 汽车拖把 汽车刷车掸（母子掸、一大一小）,汽车用品 > 汽车保养 > 洗车工具 > 尘掸,亚马逊(卓越网),Carzkool 车志酷1004004011,汽车摩托|汽车美容|车掸,佳百丽 汽车蜡拖 汽车刷 汽车刷 擦车拖把 汽车掸子洗车刷子车用清洁用品-子母蜡拖+佳百丽防雾毛1条巾,首页>汽车用品>清洁美容>美容清洁工具>佳百丽汽车蜡拖汽车刷汽车刷擦...,苏宁,佳百丽1004004011,汽车摩托|汽车美容|车掸,Carsetcity 卡饰社 超细纤维 可伸缩 掸子扫 CS-28011-3 紫色,所有分类>大小家电、厨电、汽车>汽车生活>美容清洗>清洁工具>Carsetcity/卡饰社>Carsetcity...,1号店,Carsetcity/卡饰社1004004011,汽车摩托|汽车美容|车掸,京东良品 除尘掸子 桌面清洁笤帚 雪尼尔去尘掸子 带专用收纳盒 日本进口清洁工具,所有分类>厨卫清洁、纸、清洁剂>清洁用具>除尘工具>除尘掸/掸头>京东良品>京东良品 除尘掸子 ...,1号店,京东良品1004004011,汽车摩托|汽车美容|车掸,两只装雪尼尔除尘掸子可伸缩汽车长柄除尘扫鸡毛掸子家用清洁掸 实用性家用车用双面可弯曲超细纤维细毛 黄色 二只装,家居日用 > 清洁护理 > 清洁工具 > 商品详情,当当网,普润1004004011,汽车摩托|汽车美容|车掸,日本山崎 巧手ＭＯＰ(多色入) 清洁灰尘掸子 家用除尘掸子 伸缩柄另售 白色,家居家装>清洁用品>清洁工具>日本山崎 巧手ＭＯＰ(多色入) 清洁灰尘...,京东商城,乐至百百款1004004011,汽车摩托|汽车美容|车掸,车爱人 汽车伸缩扁蜡把 纳米线除尘蜡拖 洗车掸子 清洁蜡刷 可拆卸折叠 灰色,汽车用品>汽车美容>车掸>车爱人（CHE AI REN）>车爱人 汽车伸缩扁蜡把 纳米线除尘蜡拖 ...,京东商城,车魅影车品专营店1004004011,汽车摩托|汽车美容|车掸,金星布盒靓丽掸子汽车适用,汽车用品>汽车美容>车掸>其它>金星布盒靓丽掸子汽车适用,京东商城,太原唐久大卖场1004004011,汽车摩托|汽车美容|车掸,普润 两只装雪尼尔除尘掸子可伸缩汽车长柄除尘扫鸡毛掸子家用清洁掸 双面可弯曲超细纤维细毛 二只装 黄色,家居日用 > 清洁护理 > 清洁工具 > 商品详情,当当网,普润1004004011,汽车摩托|汽车美容|车掸,车仕盾汽车掸子除尘蜡刷汽车用品清洁刷擦车油拖把蜡拖 米色线-旋转式,车仕盾汽车掸子除尘蜡刷汽车用品清洁刷擦车...,京东商城,车仕盾专营店1004004011,汽车摩托|汽车美容|车掸,石家垫 超纤维车用纳米伸缩除尘刷 汽车蜡拖 圆形 灰色,汽车用品>美容清洗>洗车配件>石家垫>石家垫 超纤维车用纳米伸缩除尘刷 汽车蜡...,京东商城,石家车品专营店1004004011,汽车摩托|汽车美容|车掸,车仆（cheif）雪尼尔蜡扫掸子 可拆卸易清洗超细纤维 除尘掸子洗车掸子免伤车漆 蓝色,汽车用品>美容清洗>洗车配件>车仆（Chief）>车仆（cheif）雪尼尔蜡扫掸子 可拆卸...,京东商城,车仆旗舰店1004004011,汽车摩托|汽车美容|车掸,佳百丽 汽车蜡拖 汽车刷 擦车拖把 汽车掸子洗车刷子车用清洁用品,汽车用品 > 汽车美容 > 蜡扫/掸子 > 商品详情,当当网,佳百丽1004004011,汽车摩托|汽车美容|车掸,格林卡 雪尼尔汽车除尘扫 车用掸子 紫色,汽车用品>美容清洗>洗车配件>格林卡（Greencars）>格林卡 雪尼尔汽车除尘扫 车用掸子 紫色,京东商城,茵达车品专营店1004004011,汽车摩托|汽车美容|车掸,家家爽 超细纤维可伸缩弯曲汽车家用静电除尘掸JH-9781,家居日用 > 清洁护理 > 清洁工具 > 商品详情,当当网,家家爽1004004011,汽车摩托|汽车美容|车掸,虎贝尔 汽车用蜡拖刷 除尘掸子 子母掸 H801 子母掸,汽车用品>美容清洗>洗车配件>虎贝尔（HBR）>虎贝尔 汽车用蜡拖刷 除尘掸子 子母掸 ...,京东商城,虎贝尔闪购旗舰店1004004011,汽车摩托|汽车美容|车掸,OMN 欧曼尼 小车刷 车用掸子 蜡拖 蜡刷 汽车清洁用品 除尘 洗车用品 白色,,亚马逊(卓越网),OMN 欧曼尼1004004011,汽车摩托|汽车美容|车掸,奴卡森 汽车除尘掸子汽车清洁用品擦车蜡刷伸缩式洗车拖把 紫色,汽车用品>美容清洗>洗车配件>奴卡森（NUKASEN）>奴卡森 汽车除尘掸子汽车清洁用品擦车蜡刷...,京东商城,奴卡森官方旗舰店1004004011,汽车摩托|汽车美容|车掸,恒亮 正品双面纳米掸子 汽车除尘刷 K-18,汽车用品 > 汽车保养 > 洗车工具 > 尘掸 汽车用品 > 汽车保养 > 洗车工具 > 车刷,亚马逊(卓越网),恒亮1004004011,汽车摩托|汽车美容|车掸,E路驰 360°高级除尘掸-白线 B-04,所有分类>大小家电、厨电、汽车>汽车生活>美容清洗>清洁工具>E路驰>E路驰 360°高级...,1号店,E路驰1004004011,汽车摩托|汽车美容|车掸,普润 两只装雪尼尔除尘掸子可伸缩汽车长柄除尘扫鸡毛掸子家用清洁掸 双面可弯曲超细纤维细 颜色随机 二只装H1201,家居日用 > 清洁护理 > 清洁工具 > 商品详情,当当网,普润1004004011,汽车摩托|汽车美容|车掸,MEVEIN 米帆 加厚加密可伸缩蜡拖/除尘掸洗车掸子 刷擦车拖把清洁汽车用品 (天蓝色) 灰色,汽车用品>美容清洗>洗车配件> 米帆（MEVEIN）>MEVEIN 米帆 加厚加密可伸缩蜡拖/...,京东商城,米帆车品专营店1004004011,汽车摩托|汽车美容|车掸,伴君 汽车掸子蜡拖套装洗车拖把汽车蜡刷伸缩蜡把车用除尘掸子小号 灰色,汽车用品>美容清洗>洗车配件> 伴君>伴君 汽车掸子蜡拖套装洗车拖把汽车蜡刷伸...,京东商城,伴君车品专营店