1004003016,汽车摩托|改装配件|车身装饰,【包邮】天盾 牌照框 车牌架 车牌框 牌照架 牌照 车牌架新交规 铝镁合金 牌照框 新交规 铝合金黄色,汽车用品>改装配件>车身装饰>天盾（Targe）>【包邮】天盾 牌照框 车牌架 车牌框 牌...,京东商城,佳合车品专营店1004003016,汽车摩托|改装配件|车身装饰,宾马 荣威350汽车专车专用车窗饰条 亮条 不锈钢 全车窗14件套,汽车用品>改装配件>车身装饰>宾马 >宾马 荣威350汽车专车专用车窗饰条 亮...,京东商城,天州车品专营店1004003016,汽车摩托|改装配件|车身装饰,华饰车品 T2汽车专车专用塑胶挡泥板 改装挡泥皮 大众,汽车用品>汽车装饰>车身装饰件>华饰>华饰车品 T2汽车专车专用塑胶挡泥板 改...,京东商城,华奇饰车品专营店1004003016,汽车摩托|改装配件|车身装饰,华饰车品 T2汽车专车专用塑胶挡泥板 改装挡泥皮 江淮同悦RS,汽车用品>汽车装饰>车身装饰件>华饰>华饰车品 T2汽车专车专用塑胶挡泥板 改...,京东商城,华奇饰车品专营店1004003016,汽车摩托|改装配件|车身装饰,华饰车品 T2汽车专车专用塑胶挡泥板 改装挡泥皮 长城哈弗H6,汽车用品>汽车装饰>车身装饰件>华饰>华饰车品 T2汽车专车专用塑胶挡泥板 改...,京东商城,华奇饰车品专营店1004003016,汽车摩托|改装配件|车身装饰,华饰 车窗饰条 全车窗 下窗饰条 车窗亮条 专车专用 中柱8件套 别克凯越,华饰 车窗饰条 全车窗 下窗饰条...,京东商城,华奇饰车品专营店1004003016,汽车摩托|改装配件|车身装饰,华饰 别克昂科拉后护板 后备厢踏板 后门踏板,汽车用品>汽车装饰>车身装饰件>华饰>华饰 别克昂科拉后护板 后备厢踏板 后门...,京东商城,华奇饰车品专营店1004003016,汽车摩托|改装配件|车身装饰,宾马 长安福特12款新福克斯汽车专车专用车窗饰条 亮条 不锈钢 车窗中柱6件套,宾马 长安福特12款新福克斯汽车专车专用...,京东商城,天州车品专营店1004003016,汽车摩托|改装配件|车身装饰,晶贵 JG0103 新交规 通用型 新国标镁合金炫彩车牌架 红色,汽车用品>汽车装饰>车身装饰件>晶贵>晶贵JG0103,京东商城,晶贵1004003016,汽车摩托|改装配件|车身装饰,奥美斯(Aomis) 日产专车专用晴雨挡 无限款亚克力雨挡 四片装 黑色 日产颐达,汽车用品>汽车装饰>车身装饰件>华饰>奥美斯(Aomis) 日产专车专用晴雨挡...,京东商城,华奇饰车品专营店1004003016,汽车摩托|改装配件|车身装饰,华饰 长城哈弗H6改装路虎中网 哈弗H6中网 H6中网框 中网饰条 上中网黑色+前后字标绿标后饰条,汽车用品>汽车装饰>车身装饰件>华饰>华饰 长城哈弗H6改装路虎中网 哈弗H6...,京东商城,华奇饰车品专营店1004003016,汽车摩托|改装配件|车身装饰,奥美斯(Aomis)丰田专车专用晴雨挡 无限款亚克力雨挡 四片装 黑色 丰田花冠,汽车用品>汽车装饰>车身装饰件>华饰>奥美斯(Aomis)丰田专车专用晴雨挡 ...,京东商城,华奇饰车品专营店1004003016,汽车摩托|改装配件|车身装饰,华饰车品 T2汽车专车专用塑胶挡泥板 改装挡泥皮 大众高尔夫,汽车用品>汽车装饰>车身装饰件>华饰>华饰车品 T2汽车专车专用塑胶挡泥板 改...,京东商城,华奇饰车品专营店1004003016,汽车摩托|改装配件|车身装饰,疯狂爱车 东风悦达起亚赛拉图欧风专用挡泥板 东风悦达起亚赛拉图欧风专用挡泥皮 黑色 4S店汽车装饰改装专用 正品汽车挡泥板 (厂家直接发货)+随机赠送小礼品（打蜡海绵、擦车巾、停车牌等） DIY自己的爱车 让它不再受伤！包邮喔，拍下立减运费！,汽车用品 > 汽车外饰 > 挡泥板,亚马逊(卓越网),疯狂爱车-美霸1004003016,汽车摩托|改装配件|车身装饰,睿博 K3全窗条 K3车窗改装专用汽车亮条包边贴全车窗装饰条,汽车用品 > 汽车外饰 > 装饰线 ,亚马逊(卓越网),睿博1004003016,汽车摩托|改装配件|车身装饰,睿博 荣威550全窗条 荣威550车窗改装专用汽车亮条包边贴全车窗装饰条,汽车用品 > 汽车外饰 > 装饰线 ,亚马逊(卓越网),睿博1004003016,汽车摩托|改装配件|车身装饰,睿博 智跑全窗条 智跑车窗改装专用汽车亮条包边贴全车窗装饰条,汽车用品 > 汽车外饰 > 遮阳棚 ,亚马逊(卓越网),睿博1004003016,汽车摩托|改装配件|车身装饰,睿博 风云2二厢全窗条 风云2车窗改装专用汽车亮条包边贴全车窗装饰条,汽车用品 > 汽车外饰 > 遮阳棚 ,亚马逊(卓越网),睿博1004003016,汽车摩托|改装配件|车身装饰,沿途优质镁合金车牌架 不生锈汽车牌照框 车牌框可拆 一对装 银色,其它>沿途优质镁合金车牌架 不生锈汽车牌照框 ...,京东商城,沿途车品旗舰店1004003016,汽车摩托|改装配件|车身装饰,宾马 帝豪EC715-RV两厢汽车专用车窗饰条 亮条 不锈钢 车窗中柱6件套,宾马 >宾马 帝豪EC715-RV两厢汽车专用车...,京东商城,天州车品专营店1004003016,汽车摩托|改装配件|车身装饰,宾马 丰田2012+汉兰达汽车专用车窗饰条 亮条 不锈钢 全车窗8件套,宾马 >宾马 丰田2012+汉兰达汽车专用车窗饰...,京东商城,天州车品专营店1004003016,汽车摩托|改装配件|车身装饰,奥美斯(Aomis) 日产专车专用晴雨挡 无限款亚克力雨挡 四片装 日产天籁,汽车用品>汽车装饰>车身装饰件>华饰>奥美斯(Aomis) 日产专车专用晴雨挡...,京东商城,华奇饰车品专营店1004003016,汽车摩托|改装配件|车身装饰,奥美斯(Aomis) 吉利专车专用晴雨挡 无限款亚克力雨挡 四片装 吉利远景,汽车用品>汽车装饰>车身装饰件>华饰>奥美斯(Aomis) 吉利专车专用晴雨挡...,京东商城,华奇饰车品专营店1004003016,汽车摩托|改装配件|车身装饰,奥美斯(Aomis) 吉利专车专用晴雨挡 无限款亚克力雨挡 四片装 吉利英伦金刚,汽车用品>汽车装饰>车身装饰件>华饰>奥美斯(Aomis) 吉利专车专用晴雨挡...,京东商城,华奇饰车品专营店1004003016,汽车摩托|改装配件|车身装饰,奥美斯(Aomis) 铃木专车专用晴雨挡 无限款亚克力雨挡 四片装 长安铃木羚羊,汽车用品>汽车装饰>车身装饰件>华饰>奥美斯(Aomis) 铃木专车专用晴雨挡...,京东商城,华奇饰车品专营店1004003016,汽车摩托|改装配件|车身装饰,奥美斯(Aomis) 铃木专车专用晴雨挡 无限款亚克力雨挡 四片装 长安铃木雨燕,汽车用品>汽车装饰>车身装饰件>华饰>奥美斯(Aomis) 铃木专车专用晴雨挡...,京东商城,华奇饰车品专营店1004003016,汽车摩托|改装配件|车身装饰,宾马 现代IX35专车专用车窗饰条 不锈钢 全车窗10件套,汽车用品>改装配件>车身装饰>宾马 现代IX35专车专用车窗饰条 不锈...,京东商城,天州车品专营店1004003016,汽车摩托|改装配件|车身装饰,【免运费】车之魂 车牌架 新交规航空铝合金牌照架 汽车牌照框车牌框 大红色,汽车用品>改装配件>车身装饰>车之魂>【免运费】车之魂 车牌架 新交规航空铝合...,京东商城,车之魂专营店1004003016,汽车摩托|改装配件|车身装饰,疯狂爱车 长安欧诺专用挡泥板 长安欧诺专用挡泥皮 黑色 4S店汽车装饰改装专用 正品汽车挡泥板 (厂家直接发货)+随机赠送小礼品（打蜡海绵、擦车巾、停车牌等） DIY自己的爱车 让它不再受伤！包邮喔，拍下立减运费！,汽车用品 > 汽车外饰 > 挡泥板,亚马逊(卓越网),疯狂爱车-美霸1004003016,汽车摩托|改装配件|车身装饰,疯狂爱车-美霸 长安悦翔V3专用挡泥板 长安悦翔V3专用挡泥皮 黑色 4S店汽车装饰改装专用 正品汽车挡泥板 (厂家直接发货)+随机赠送小礼品（打蜡海绵、擦车巾、停车牌等） DIY自己的爱车 让它不再受伤！,汽车用品 > 汽车外饰 > 挡泥板,亚马逊(卓越网),疯狂爱车-美霸1004003016,汽车摩托|改装配件|车身装饰,疯狂爱车-美霸 江淮同悦专用挡泥板 江淮同悦专用挡泥皮 黑色 4S店汽车装饰改装专用 正品汽车挡泥板 (厂家直接发货)+随机赠送小礼品（打蜡海绵、擦车巾、停车牌等） DIY自己的爱车 让它不再受伤！,汽车用品/类别/汽车外饰/挡泥板,亚马逊(卓越网),疯狂爱车-美霸1004003016,汽车摩托|改装配件|车身装饰,疯狂爱车 江淮同悦三厢专用挡泥板 江淮同悦三厢专用挡泥皮 黑色 4S店汽车装饰改装专用 正品汽车挡泥板 (厂家直接发货)+随机赠送小礼品（打蜡海绵、擦车巾、停车牌等） DIY自己的爱车 让它不再受伤！包邮喔，拍下立减运费！,汽车用品 > 汽车外饰 > 挡泥板,亚马逊(卓越网),疯狂爱车-美霸1004003016,汽车摩托|改装配件|车身装饰,疯狂爱车 一汽奔腾B70专用挡泥板 一汽奔腾B70专用挡泥皮 黑色 4S店汽车装饰改装专用 正品汽车挡泥板 (厂家直接发货)+随机赠送小礼品（打蜡海绵、擦车巾、停车牌等） DIY自己的爱车 让它不再受伤！包邮喔，拍下立减运费！,汽车用品 > 汽车外饰 > 挡泥板,亚马逊(卓越网),疯狂爱车-美霸1004003016,汽车摩托|改装配件|车身装饰,疯狂爱车-美霸 本田思铭专用挡泥板 本田思铭专用挡泥皮 黑色 4S店汽车装饰改装专用 正品汽车挡泥板 (厂家直接发货)+随机赠送小礼品（打蜡海绵、擦车巾、停车牌等） DIY自己的爱车 让它不再受伤！,汽车用品 > 汽车外饰 > 挡泥板,亚马逊(卓越网),疯狂爱车-美霸1004003016,汽车摩托|改装配件|车身装饰,英非特 新交规七彩车牌架 太空铝航空铝合金彩色牌照框 银色,汽车用品 > 改装配件 > 改装 > 商品详情,当当网,驿行者1004003016,汽车摩托|改装配件|车身装饰,英非特 新交规七彩车牌架 太空铝航空铝合金彩色牌照框 枫叶红,汽车用品 > 改装配件 > 改装 > 商品详情,当当网,驿行者1004003016,汽车摩托|改装配件|车身装饰,奥美斯(Aomis) 铃木专车专用晴雨挡 无限款亚克力雨挡 四片装 不带亮条 昌河铃木利亚纳两厢,汽车用品>汽车装饰>车身装饰件>华饰>奥美斯(Aomis) 铃木专车专用晴雨挡...,京东商城,华奇饰车品专营店1004003016,汽车摩托|改装配件|车身装饰,奥美斯(Aomis) 铃木专车专用晴雨挡 无限款亚克力雨挡 四片装 带亮条 昌河铃木利亚纳三厢,汽车用品>汽车装饰>车身装饰件>华饰>奥美斯(Aomis) 铃木专车专用晴雨挡...,京东商城,华奇饰车品专营店1004003016,汽车摩托|改装配件|车身装饰,奥美斯(Aomis) 海马专车专用晴雨挡 无限款亚克力雨挡 四片装 带亮条 海马骑士,汽车用品>汽车装饰>车身装饰件>华饰>奥美斯(Aomis) 海马专车专用晴雨挡...,京东商城,华奇饰车品专营店1004003016,汽车摩托|改装配件|车身装饰,奥美斯(Aomis) 起亚专车专用晴雨挡 无限款亚克力雨挡 四片装 带亮条 起亚赛拉图,汽车用品>汽车装饰>车身装饰件>华饰>奥美斯(Aomis) 起亚专车专用晴雨挡...,京东商城,华奇饰车品专营店1004003016,汽车摩托|改装配件|车身装饰,奥美斯(Aomis) 标致专车专用晴雨挡 无限款亚克力雨挡 四片装 不带亮条款 标致207两厢,汽车用品>汽车装饰>车身装饰件>华饰>奥美斯(Aomis) 标致专车专用晴雨挡...,京东商城,华奇饰车品专营店1004003016,汽车摩托|改装配件|车身装饰,奥美斯(Aomis) 比亚迪专车专用晴雨挡 无限款亚克力雨眉 四片装 不带亮条 比亚迪F3R,汽车用品>汽车装饰>车身装饰件>华饰>奥美斯(Aomis) 比亚迪专车专用晴雨...,京东商城,华奇饰车品专营店1004003016,汽车摩托|改装配件|车身装饰,奥美斯(Aomis) 日产专车专用晴雨挡 无限款亚克力雨挡 四片装 带亮条 启辰D50,汽车用品>汽车装饰>车身装饰件>华饰>奥美斯(Aomis) 日产专车专用晴雨挡...,京东商城,华奇饰车品专营店1004003016,汽车摩托|改装配件|车身装饰,奥美斯(Aomis) 专车专用晴雨挡 无限款亚克力雨挡 四片装 带亮条 别克昂科拉,汽车用品>汽车装饰>车身装饰件>华饰>奥美斯(Aomis) 专车专用晴雨挡 无...,京东商城,华奇饰车品专营店1004003016,汽车摩托|改装配件|车身装饰,奥美斯(Aomis)丰田专车专用晴雨挡 无限款亚克力雨挡 四片装 带亮条 丰田逸致,汽车用品>汽车装饰>车身装饰件>华饰>奥美斯(Aomis)丰田专车专用晴雨挡 ...,京东商城,华奇饰车品专营店1004003016,汽车摩托|改装配件|车身装饰,奥美斯(Aomis) 长安专车专用晴雨挡 无限款亚克力雨挡 四片装 不带亮条 长安CS35,汽车用品>汽车装饰>车身装饰件>华饰>奥美斯(Aomis) 长安专车专用晴雨挡...,京东商城,华奇饰车品专营店1004003016,汽车摩托|改装配件|车身装饰,英非特 YEFFETE 锌合金高档带钻车牌架 国标新交规 汽车牌照框 车用装饰车牌架,所有分类>大小家电、厨电、汽车>汽车生活>汽车外饰保护>车牌架>英非特 YEFFETE>英非特 YEFFET...,1号店,英非特 YEFFETE1004003016,汽车摩托|改装配件|车身装饰,Merdia/美蒂亚 车牌架 新交规 牌照框 车牌框 0.7厚不锈钢 汽车牌照架框（送固封螺丝一套）,所有分类>大小家电、厨电、汽车>汽车生活>汽车外饰保护>车牌架>Merdia/美蒂亚>Merdia/美蒂亚...,1号店,Merdia/美蒂亚1004003016,汽车摩托|改装配件|车身装饰,COOL&BRIGHT 酷博特 Rolls-Royce地毯标-适合劳斯莱斯Rolls-Royce汽车系列-改装铝合金车标 装饰标-银色-一套（2件）-35x110x3mm,汽车用品 > 汽车内饰 ,亚马逊(卓越网),COOL&BRIGHT 酷博特1004003016,汽车摩托|改装配件|车身装饰,scx 车牌架 铝合金车牌框 防盗汽车牌照框 固封螺丝防腐蚀 蓝色,汽车用品 > 汽车外饰 > 车牌框架,亚马逊(卓越网),SCX1004003016,汽车摩托|改装配件|车身装饰,COOL&BRIGHT 酷博特 BMW地毯标-适合宝马BMW汽车系列-改装铝合金车标 装饰标-银色-一套（2件）-35x110x3mm,汽车用品 > 汽车内饰 > 脚垫 ,亚马逊(卓越网),COOL&BRIGHT 酷博特1004003016,汽车摩托|改装配件|车身装饰,立飒 2013新交规车牌架 镁合金车牌框 牌照框牌照架 赠避震垫 L18,所有分类>大小家电、厨电、汽车>汽车生活>汽车外饰保护>车牌架>立飒>立飒 2013新交规...,1号店,立飒1004003016,汽车摩托|改装配件|车身装饰,3M 汽车专用双面胶带 进口双面胶带 超强泡棉胶带0.6CM 1CM 2CM 3个尺寸 0.6CM,汽车用品>汽车装饰>车身装饰件>3M>3M 汽车专用双面胶带 进口双面胶带 超...,京东商城,车泓车品1004003016,汽车摩托|改装配件|车身装饰,华饰 专车专用 车窗装饰条 不锈钢亮条 下窗饰条 四片装T1 大众宝来,汽车用品>汽车装饰>车身装饰件>华饰>华饰 专车专用 车窗装饰条 不锈钢...,京东商城,华奇饰车品专营店1004003016,汽车摩托|改装配件|车身装饰,华饰 专车专用 车窗装饰条 不锈钢亮条 下窗饰条 四片装T1 雪铁龙世嘉,汽车用品>汽车装饰>车身装饰件>华饰>华饰 专车专用 车窗装饰条 不锈钢...,京东商城,华奇饰车品专营店1004003016,汽车摩托|改装配件|车身装饰,华饰 专车专用 车窗装饰条 不锈钢亮条 下窗饰条 四片装T1 奔腾B50,汽车用品>汽车装饰>车身装饰件>华饰>华饰 专车专用 车窗装饰条 不锈钢...,京东商城,华奇饰车品专营店1004003016,汽车摩托|改装配件|车身装饰,华饰 专车专用 车窗装饰条 不锈钢亮条 下窗饰条 四片装T1 雪佛兰乐驰,汽车用品>汽车装饰>车身装饰件>华饰>华饰 专车专用 车窗装饰条 不锈钢...,京东商城,华奇饰车品专营店1004003016,汽车摩托|改装配件|车身装饰,华饰 T1 专车专用汽车注塑晴雨挡 注塑亮条晴雨挡雨眉 斯柯达明锐,汽车用品>汽车装饰>车身装饰件>华饰>华饰 T1 专车专用汽车注塑晴雨挡 注...,京东商城,华奇饰车品专营店1004003016,汽车摩托|改装配件|车身装饰,华饰 T1 专车专用汽车注塑晴雨挡 注塑亮条晴雨挡雨眉 别克君威,汽车用品>汽车装饰>车身装饰件>华饰>华饰 T1 专车专用汽车注塑晴雨挡 注...,京东商城,华奇饰车品专营店1004003016,汽车摩托|改装配件|车身装饰,华饰 T1 专车专用汽车注塑晴雨挡 注塑亮条晴雨挡雨眉 长安奔奔MINI,汽车用品>汽车装饰>车身装饰件>华饰>华饰 T1 专车专用汽车注塑晴雨挡 注...,京东商城,华奇饰车品专营店1004003016,汽车摩托|改装配件|车身装饰,华饰 T2 专车专用汽车注塑晴雨挡 注塑亮条晴雨挡雨眉 长城M4,汽车用品>汽车装饰>车身装饰件>华饰>华饰 T2 专车专用汽车注塑晴雨挡 注...,京东商城,华奇饰车品专营店1004003016,汽车摩托|改装配件|车身装饰,华饰 T2 专车专用汽车注塑晴雨挡 注塑亮条晴雨挡雨眉 奇瑞X1,汽车用品>汽车装饰>车身装饰件>华饰>华饰 T2 专车专用汽车注塑晴雨挡 注...,京东商城,华奇饰车品专营店1004003016,汽车摩托|改装配件|车身装饰,3M 双面胶 汽车家居通用 强力无痕泡沫胶带 宽0.8厘米 长33米(2卷装),汽车用品>改装配件>车身装饰>3M>3M 双面胶 汽车家居通用 强力无痕泡沫...,京东商城,翊惠车品专营店1004003016,汽车摩托|改装配件|车身装饰,华饰 陆风X5前后保险防撞护杠,汽车用品>汽车装饰>车身装饰件>华饰>华饰 陆风X5前后保险防撞护杠,京东商城,华奇饰车品专营店1004003016,汽车摩托|改装配件|车身装饰,华饰 13款福特翼虎鲨鱼鳍天线 带收音同色烤漆 珍珠白,汽车用品>汽车装饰>车身装饰件>华饰>华饰 13款福特翼虎鲨鱼鳍天线 带收音同...,京东商城,华奇饰车品专营店1004003016,汽车摩托|改装配件|车身装饰,华饰 09-12款丰田汉兰达外侧脚踏板-经典款,汽车用品>汽车装饰>车身装饰件>华饰>华饰 09-12款丰田汉兰达外侧脚踏板-...,京东商城,华奇饰车品专营店1004003016,汽车摩托|改装配件|车身装饰,华饰 09丰田汉兰达前后保险杠-御用款,汽车用品>汽车装饰>车身装饰件>华饰>华饰 09丰田汉兰达前后保险杠-御用款,京东商城,华奇饰车品专营店1004003016,汽车摩托|改装配件|车身装饰,华饰 T2 专车专用汽车注塑晴雨挡 注塑亮条晴雨挡雨眉 东风风神H30,汽车用品>汽车装饰>车身装饰件>华饰>华饰 T2 专车专用汽车注塑晴雨挡 注...,京东商城,华奇饰车品专营店1004003016,汽车摩托|改装配件|车身装饰,华饰 T1 汽车专车专车轮眉 车轮装饰条 福特新福克斯,汽车用品>汽车装饰>车身装饰件>华饰>华饰 T1 汽车专车专车轮眉 车轮装饰条...,京东商城,华奇饰车品专营店1004003016,汽车摩托|改装配件|车身装饰,华饰 T1 汽车专车专车轮眉 车轮装饰条 马自达M3,汽车用品>汽车装饰>车身装饰件>华饰>华饰 T1 汽车专车专车轮眉 车轮装饰条...,京东商城,华奇饰车品专营店1004003016,汽车摩托|改装配件|车身装饰,华饰 T1 汽车专车专车轮眉 车轮装饰条 雪佛兰爱唯欧,汽车用品>汽车装饰>车身装饰件>华饰>华饰 T1 汽车专车专车轮眉 车轮装饰条...,京东商城,华奇饰车品专营店1004003016,汽车摩托|改装配件|车身装饰,华饰 大众途观拉手 途观外拉手 途观车门外拉手 ABS电镀 改装配件 拉手,汽车用品>汽车装饰>车身装饰件>华饰>华饰 大众途观拉手 途观外拉手 途观车门...,京东商城,华奇饰车品专营店1004003016,汽车摩托|改装配件|车身装饰,华饰 12款RAV4前后杠 RAV4前后保险杠 注塑材质 RAV4前后护杠,汽车用品>汽车装饰>车身装饰件>华饰>华饰 12款RAV4前后杠 RAV4前后...,京东商城,华奇饰车品专营店1004003016,汽车摩托|改装配件|车身装饰,金利美 汽车轮胎气门嘴帽 装饰帽 装饰气门嘴 不锈钢 多图款式 4个装 银色 本田,其它>金利美 汽车轮胎气门嘴帽 装饰帽 装饰气...,京东商城,Sportline车品专营店1004003016,汽车摩托|改装配件|车身装饰,金利美 汽车轮胎气门嘴帽 装饰帽 装饰气门嘴 不锈钢 多图款式 4个装 银色 丰田,其它>金利美 汽车轮胎气门嘴帽 装饰帽 装饰气...,京东商城,Sportline车品专营店1004003016,汽车摩托|改装配件|车身装饰,金利美 保时捷新款卡宴尾喉 改装升级turbo四出尾喉 铝合金+不锈钢材质 一对装 短款 银色,其他>金利美 保时捷新款卡宴尾喉 改装升级tu...,京东商城,Sportline车品专营店1004003016,汽车摩托|改装配件|车身装饰,程稳 新交规 汽车牌照框 双轨道镁合金车牌架 牌照托 车牌框 防盗螺丝 金黄,汽车用品>汽车装饰>车身装饰件>程稳>程稳 新交规 汽车牌照框 双轨道镁合金车...,京东商城,程稳汽车用品专营店1004003016,汽车摩托|改装配件|车身装饰,华饰 2013福特翼虎车身彩贴 拉花 A款,汽车用品>汽车装饰>车身装饰件>华饰>华饰 2013福特翼虎车身彩贴 拉花 A...,京东商城,华奇饰车品专营店1004003016,汽车摩托|改装配件|车身装饰,威利 行李架 丰田RAV4 原厂款铝合金压铸银色行李架 2009-2012年 10941104【厂家直发】,汽车用品>汽车装饰>车身装饰件>威利（WELLY）>威利行李架,京东商城,威利（WELLY）1004003016,汽车摩托|改装配件|车身装饰,TYPER TR-180 新交规汽车车牌架(大红色) 抗磨损不变形不生锈,汽车用品>汽车装饰>车身装饰件>太普儿（TYPE-R）>TYPERTR-180,京东商城,太普儿（TYPE-R）1004003016,汽车摩托|改装配件|车身装饰,华饰车品 索菲尔系列 T2汽车专车专用扶手箱 中央扶手储物盒 改装免打孔扶手 黑色 昌河铃木利亚纳两厢,汽车用品>汽车装饰>车身装饰件>华饰>华饰车品 索菲尔系列 T2汽车专车...,京东商城,华奇饰车品专营店1004003016,汽车摩托|改装配件|车身装饰,华饰车品 索菲尔系列 T2汽车专车专用扶手箱 中央扶手储物盒 改装免打孔扶手箱 米色 启辰D50,汽车用品>汽车装饰>车身装饰件>华饰>华饰车品 索菲尔系列 T2汽车专车...,京东商城,华奇饰车品专营店1004003016,汽车摩托|改装配件|车身装饰,华饰车品 索菲尔系列 T2汽车专车专用扶手箱 中央扶手储物盒 改装免打孔扶手箱 米色 雪佛兰科鲁兹,汽车用品>汽车装饰>车身装饰件>华饰>华饰车品 索菲尔系列 T2汽车专车...,京东商城,华奇饰车品专营店1004003016,汽车摩托|改装配件|车身装饰,华饰车品 索菲尔系列 T2汽车专车专用扶手箱 中央扶手储物盒 改装免打孔扶手箱 黑色 起亚秀尔,汽车用品>汽车装饰>车身装饰件>华饰>华饰车品 索菲尔系列 T2汽车专车...,京东商城,华奇饰车品专营店1004003016,汽车摩托|改装配件|车身装饰,2013款道奇酷威车窗饰条 车窗亮条 新款酷威下窗饰条改装装饰条 酷威上下中前全套+中柱22件,汽车用品>改装配件>车身装饰>其他>2013款道奇酷威车窗饰条 车窗亮条 新...,京东商城,泰溥专卖店1004003016,汽车摩托|改装配件|车身装饰,华饰 T1拉手外拉手门把手 汽车外门碗保护 门碗+拉手 起亚K3,汽车用品>汽车装饰>车身装饰件>华饰>华饰 T1拉手外拉手门把手 汽车外门碗保...,京东商城,华奇饰车品专营店1004003016,汽车摩托|改装配件|车身装饰,华饰 T1拉手外拉手门把手 汽车外门碗保护 门碗+拉手 长安悦翔,汽车用品>汽车装饰>车身装饰件>华饰>华饰 T1拉手外拉手门把手 汽车外门碗保...,京东商城,华奇饰车品专营店1004003016,汽车摩托|改装配件|车身装饰,华饰 T2拉手外拉手门把手 汽车改装专用外门碗保护装饰贴 门碗+拉手 别克英朗XT,汽车用品>汽车装饰>车身装饰件>华饰>华饰 T2拉手外拉手门把手 汽车改装专用...,京东商城,华奇饰车品专营店1004003016,汽车摩托|改装配件|车身装饰,华饰 T2拉手外拉手门把手 汽车改装专用外门碗保护装饰贴 拉手 标致307三厢,汽车用品>汽车装饰>车身装饰件>华饰>华饰 T2拉手外拉手门把手 汽车改装专用...,京东商城,华奇饰车品专营店1004003016,汽车摩托|改装配件|车身装饰,酷玛传奇 中华V5骏捷三厢FRV|FSV|尊驰中华H230汽车晴雨挡车窗雨眉 尊驰,汽车用品>改装配件>其他配件>其它>酷玛传奇 中华V5骏捷三厢FRV|FSV...,京东商城,酷玛传奇官方旗舰店1004003016,汽车摩托|改装配件|车身装饰,欧泰 赫迪五代真皮扶手箱 手扶箱 储物箱 黑色 丰田雅力士,汽车用品>汽车装饰>车身装饰件>华饰>欧泰 赫迪五代真皮扶手箱 手扶箱 储物...,京东商城,华奇饰车品专营店1004003016,汽车摩托|改装配件|车身装饰,斯沃德 T3专用扶手箱 免打孔专用中央手扶箱 改装专用 灰色 大众帕萨特领驭,汽车用品>汽车装饰>车身装饰件>华饰>斯沃德 T3专用扶手箱 免打孔专用中央...,京东商城,华奇饰车品专营店