1004001003,汽车摩托|电子电器|嵌入式导航,富威二代 速腾双嵌入式导航升级包 送三年CMMB资费 送硬盘专用车载GPS导航仪,当当网 > 汽车用品 > 导航/行车记录仪 > GPS导航,当当网,富威1004001003,汽车摩托|电子电器|嵌入式导航,纽曼GPS导航仪Q500黑色(4G),首页>汽车用品>电子/电器>嵌入式导航>纽曼GPS导航仪Q500黑色(4G),苏宁,1004001003,汽车摩托|电子电器|嵌入式导航,纽曼GPS导航仪S590(4G),首页>汽车用品>电子/电器>嵌入式导航>纽曼GPS导航仪S590(4G),苏宁,1004001003,汽车摩托|电子电器|嵌入式导航,ABT爱伯特 现代新悦动车系 DVD导航仪一体机 倒车影像全配置,汽车用品>电子电器>嵌入式导航>ABT爱伯特 现代新悦动车系 DVD导...,京东商城,DIGIMAX汽车改装精品屋1004001003,汽车摩托|电子电器|嵌入式导航,泰洋星双核Ⅱ代 日产老款骐达/启辰d50专用车载DVD导航一体机,汽车用品>电子电器>嵌入式导航>泰洋星双核Ⅱ代 日产老款骐达/启辰d50...,京东商城,泰洋星汽车用品店1004001003,汽车摩托|电子电器|嵌入式导航,悦畅 现代悦动 DVD导航仪一体机 GPS嵌入式DVD导航 导航仪倒车后视 凯立德地图 车载蓝牙电话,汽车用品>电子电器>嵌入式导航>悦畅 现代悦动 DVD导航仪一体机 GP...,京东商城,悦畅汽车用品旗舰店1004001003,汽车摩托|电子电器|嵌入式导航,泰洋星8寸大屏 大众速腾/迈腾/途观/途安专用车载DVD导航一体机,汽车用品>电子电器>嵌入式导航>泰洋星8寸大屏 大众速腾/迈腾/途观/途...,京东商城,泰洋星汽车用品店1004001003,汽车摩托|电子电器|嵌入式导航,泰洋星双核Ⅱ代 大众老款POLO波罗/高尔夫专用车载DVD导航一体机,汽车用品>电子电器>嵌入式导航>泰洋星双核Ⅱ代 大众老款POLO波罗/高...,京东商城,泰洋星汽车用品店1004001003,汽车摩托|电子电器|嵌入式导航,悦畅 东南V5 DVD导航仪一体机 GPS嵌入式DVD导航 导航仪倒车后视 凯立德地图 车载蓝牙电话,汽车用品>电子电器>嵌入式导航>悦畅 东南V5 DVD导航仪一体机 GP...,京东商城,悦畅汽车用品旗舰店1004001003,汽车摩托|电子电器|嵌入式导航,悦畅 大众朗逸 DVD导航仪一体机 GPS嵌入式DVD导航 导航仪倒车后视 凯立德地图 车载蓝牙电话,汽车用品>电子电器>嵌入式导航>悦畅 大众朗逸 DVD导航仪一体机 GP...,京东商城,悦畅汽车用品旗舰店1004001003,汽车摩托|电子电器|嵌入式导航,悦畅 13款现代胜达 DVD导航仪一体机 GPS嵌入式DVD导航 导航仪倒车后视 凯立德地图 车载蓝牙电话,汽车用品>电子电器>嵌入式导航>悦畅 13款现代胜达 DVD导航仪一体机...,京东商城,悦畅汽车用品旗舰店1004001003,汽车摩托|电子电器|嵌入式导航,泰洋星双核 8寸大屏 长丰骑兵奇兵/黑金刚专用车载DVD导航,汽车用品>电子电器>嵌入式导航>泰洋星双核 8寸大屏 长丰骑兵奇兵/黑金...,京东商城,泰洋星汽车用品店1004001003,汽车摩托|电子电器|嵌入式导航,路特仕（ROTISS） 6856/8056 DVD导航一体机 新景程/乐风/乐驰专用 3D实景6.2寸高清数字屏（厂家直发）,汽车用品>电子电器>嵌入式导航>路特仕（ROTISS）>路特仕6856/8056,京东商城,路特仕（ROTISS）1004001003,汽车摩托|电子电器|嵌入式导航,路特仕（ROTISS） 68159A/80159A DVD导航一体机 长城C50专用 3D实景地图固定测速提醒8寸高清屏（厂家直发）,汽车用品>电子电器>嵌入式导航>路特仕（ROTISS）>路特仕68159A/80159A,京东商城,路特仕（ROTISS）1004001003,汽车摩托|电子电器|嵌入式导航,卡仕达原装专用iPod线材,汽车用品>电子电器>嵌入式导航>卡仕达>卡仕达原装专用iPod线材,京东商城,智予恒汽车用品专营店1004001003,汽车摩托|电子电器|嵌入式导航,科骏达 丰田雅力士 嵌入式导航 专车专用车载DVD导航一体机K015-E,科骏达>科骏达 丰田雅力士 嵌入式导航 专车专用...,京东商城,智予恒汽车用品专营店1004001003,汽车摩托|电子电器|嵌入式导航,德赛西威(SVAUTO) NAV712G 雪佛兰科鲁兹SE车型专用 DVD导航一体机,汽车用品>电子电器>嵌入式导航>德赛西威>德赛西威NAV712G,京东商城,德赛西威1004001003,汽车摩托|电子电器|嵌入式导航,泰洋星海马福美来2代/海福星/海南马自达323专用车载DVD导航仪一体机双核 马自达323,汽车用品>电子电器>嵌入式导航>泰洋星海马福美来2代/海福星/海南马自达...,京东商城,泰洋星汽车用品店1004001003,汽车摩托|电子电器|嵌入式导航,泰洋星 现代08至10老悦动/2011年款新悦动专用车载DVD导航一体机 8寸大屏！ 2008至2010款悦动车,汽车用品>电子电器>嵌入式导航>泰洋星 现代08至10老悦动/2011年...,京东商城,泰洋星汽车用品店1004001003,汽车摩托|电子电器|嵌入式导航,卡仕达领航系列 大众新领驭 专车专用车载DVD导航一体机CA022-T 导航+前后可视,汽车用品>电子电器>嵌入式导航>卡仕达领航系列 大众新领驭 专车专用车载...,京东商城,智予恒汽车用品专营店1004001003,汽车摩托|电子电器|嵌入式导航,泰洋星8寸大屏 大众高尔夫6新款帕萨特/斯柯达昕锐晶锐/大众CC专用车载DVD导航一体机 斯柯达晶锐,汽车用品>电子电器>嵌入式导航>泰洋星8寸大屏 大众高尔夫6新款帕萨特/...,京东商城,泰洋星汽车用品店1004001003,汽车摩托|电子电器|嵌入式导航,卡仕达领航系列 大众途观 专车专用车载DVD导航一体机CA312-T 导航+后视,汽车用品>电子电器>嵌入式导航>卡仕达领航系列 大众途观 专车专用车载D...,京东商城,智予恒汽车用品专营店1004001003,汽车摩托|电子电器|嵌入式导航,卡仕达 丰田新霸道导航 专车专用导航 e航系列DVD导航CA126-BMA,首页>汽车用品>电子/电器>嵌入式导航>卡仕达丰田新霸道导航专车专用导航...,苏宁,卡仕达1004001003,汽车摩托|电子电器|嵌入式导航,科骏达 马自达2导航 专车专用导航 DVD车载导航K009-E,首页>汽车用品>电子/电器>嵌入式导航>科骏达马自达2导航专车专用导航...,苏宁,科骏达1004001003,汽车摩托|电子电器|嵌入式导航,卡仕达领航系列 大众迈腾 嵌入式导航专车专用车载DVD导航一体机CA069-T 导航+前后可视包安装,卡仕达>卡仕达领航系列 大众迈腾 嵌入式导航专车...,京东商城,智予恒汽车用品专营店1004001003,汽车摩托|电子电器|嵌入式导航,卡仕达领航系列 大众新迈腾B7L 嵌入式导航专车专用车载DVD导航一体机CA312-T 导航+前后可视包安装,卡仕达>卡仕达领航系列 大众新迈腾B7L 嵌入式...,京东商城,智予恒汽车用品专营店1004001003,汽车摩托|电子电器|嵌入式导航,天之眼丰田卡罗拉/ RAV4 /新锐志 /花冠/汉兰达/2012新凯美瑞/导航仪DVD一体 老款凯美瑞,汽车用品>电子电器>嵌入式导航>其他>天之眼丰田卡罗拉/ RAV4 /新锐志 ...,京东商城,骏青车品专营店1004001003,汽车摩托|电子电器|嵌入式导航,泰洋星8寸大屏 2013款大众新宝来/桑塔纳/新捷达专用车载DVD导航仪一体机固定测速,汽车用品>电子电器>嵌入式导航>泰洋星8寸大屏 2013款大众新宝来/桑...,京东商城,泰洋星汽车用品店1004001003,汽车摩托|电子电器|嵌入式导航,泰洋星 08至12款别克新凯越专用车载DVD导航仪一体机 凯越导航 新凯越替换原车CD款式,汽车用品>电子电器>嵌入式导航>泰洋星 08至12款别克新凯越专用车载D...,京东商城,泰洋星汽车用品店1004001003,汽车摩托|电子电器|嵌入式导航,卡仕达E航系列 起亚秀尔SOUL 专车专用车载DVD导航一体机CA104-BM 导航+后视+内置胎压,汽车用品>电子电器>嵌入式导航>卡仕达E航系列 起亚秀尔SOUL 专车专...,京东商城,智予恒汽车用品专营店1004001003,汽车摩托|电子电器|嵌入式导航,友通 日产新轩逸/2011新骐达/2013新天籁 专用DVD导航影音一体机 (包安装） 标配+倒车摄像头,汽车用品>电子电器>嵌入式导航>友通 日产新轩逸/2011新骐达/20...,京东商城,古德巴迪科技1004001003,汽车摩托|电子电器|嵌入式导航,友通2013东风标致408/408/风神S30/小康V27V29 DVD导航影音 包安装 标配,汽车用品>电子电器>嵌入式导航>友通2013东风标致408/408/风神...,京东商城,古德巴迪科技1004001003,汽车摩托|电子电器|嵌入式导航,友通丰田汉兰达 车载GPS导航仪 专用DVD导航影音一体机 (包安装） 标配,汽车用品>电子电器>嵌入式导航>友通>友通丰田汉兰达 车载GPS导航仪 专用D...,京东商城,古德巴迪科技1004001003,汽车摩托|电子电器|嵌入式导航,友通大众迈腾 车载GPS导航仪 DVD导航影音一体机 虚拟9碟 一键云导航(包安装） 标配+倒车摄像头,汽车用品>电子电器>嵌入式导航>友通>友通大众迈腾 车载GPS导航仪 DVD导...,京东商城,古德巴迪科技1004001003,汽车摩托|电子电器|嵌入式导航,友通 本田新飞度 车载GPS导航仪 专用DVD导航影音一体机 (包安装） 标配,汽车用品>电子电器>嵌入式导航>友通>友通 本田新飞度 车载GPS导航仪 专...,京东商城,古德巴迪科技1004001003,汽车摩托|电子电器|嵌入式导航,天之眼本田凌派杰德雅阁2012款新CRV导航第九代新思域思铭/锋范 专用DVD导航仪一体机 新CRV,汽车用品>电子电器>嵌入式导航>其他>天之眼本田凌派杰德雅阁2012款新CRV...,京东商城,骏青车品专营店1004001003,汽车摩托|电子电器|嵌入式导航,天之眼 起亚 K5/K3/K2/福瑞迪/智跑/狮跑/赛拉图车载DVD导航仪一体机 秀尔,汽车用品>电子电器>嵌入式导航>其他>天之眼 起亚 K5/K3/K2/福瑞迪/...,京东商城,骏青车品专营店1004001003,汽车摩托|电子电器|嵌入式导航,天之眼 日产 NV200 新骐达 骊威 颐达 逍客 阳光 奇骏 新轩逸专用DVD导航仪一体 逍客,汽车用品>电子电器>嵌入式导航>其他>天之眼 日产 NV200 新骐达 骊威 ...,京东商城,骏青车品专营店1004001003,汽车摩托|电子电器|嵌入式导航,天之眼丰田卡罗拉/ RAV4 /新锐志 /花冠/汉兰达/2012新凯美瑞/导航仪DVD一体 汉兰达,汽车用品>电子电器>嵌入式导航>其他>天之眼丰田卡罗拉/ RAV4 /新锐志 ...,京东商城,骏青车品专营店1004001003,汽车摩托|电子电器|嵌入式导航,天之眼 现代 朗动 瑞纳 新悦动 索纳塔8八代 IX35 伊兰特新胜达 原装专用 车载DV 索纳塔8,汽车用品>电子电器>嵌入式导航>天之眼>天之眼 现代 朗动 瑞纳 新悦动 索纳塔...,京东商城,骏青车品专营店1004001003,汽车摩托|电子电器|嵌入式导航,e路航 大众宝来高尔夫途观途安朗逸迈腾速腾CC桑塔纳POLO 8寸车载dvd导航仪一体机,所有分类>大小家电、厨电、汽车>汽车生活>车载电器>嵌入式导航>e路航>e路航 大众宝来高尔...,1号店,e路航1004001003,汽车摩托|电子电器|嵌入式导航,泰洋星 本田老款飞度/思迪/CR-V/CRV导航/广本田2.3雅阁六代/老款奥德赛专用车载DVD导航一体机 本田04/06年,汽车用品>电子电器>嵌入式导航>泰洋星 本田老款飞度/思迪/CR-V/C...,京东商城,泰洋星汽车用品店1004001003,汽车摩托|电子电器|嵌入式导航,科骏达 别克凯越 专车专用车载DVD导航一体机K6003AG 导航包安装,汽车用品>电子电器>嵌入式导航>科骏达 别克凯越 专车专用车载DVD导航...,京东商城,智予恒汽车用品专营店1004001003,汽车摩托|电子电器|嵌入式导航,科骏达 长城哈佛H3 专车专用车载DVD导航一体机K110-A 导航+后视(含安装),汽车用品>电子电器>嵌入式导航>科骏达>科骏达 长城哈佛H3 专车专用车载DVD...,京东商城,智予恒汽车用品专营店1004001003,汽车摩托|电子电器|嵌入式导航,友通 五菱宏光/荣光 DVD导航影音一体机 GPS （包安装） 标配+倒车摄像头,汽车用品>电子电器>嵌入式导航>友通 五菱宏光/荣光 DVD导航影音一体...,京东商城,古德巴迪科技1004001003,汽车摩托|电子电器|嵌入式导航,友通 本田老飞度/思迪/老奥德赛/雅阁2.3/理念 DVD导航一体机（包安装） 标配,汽车用品>电子电器>嵌入式导航>友通>友通 本田老飞度/思迪/老奥德赛/雅阁2...,京东商城,古德巴迪科技1004001003,汽车摩托|电子电器|嵌入式导航,友通 长安系列 GPS DVD导航影音一体机 终身地图免费升级 包安装 悦翔 标配+倒车摄像头,汽车用品>电子电器>嵌入式导航>友通>友通 长安系列 GPS DVD导航影音一...,京东商城,古德巴迪科技1004001003,汽车摩托|电子电器|嵌入式导航,友通 YT-6000 支持东风天龙天锦大货车 DVD导航影音一体机 正版欣嘉航地图 包安装 途胜 标配,汽车用品>电子电器>嵌入式导航>友通>友通 YT-6000 支持东风天龙天锦大...,京东商城,古德巴迪科技1004001003,汽车摩托|电子电器|嵌入式导航,泰洋星丰田2008至2013年款凯美瑞专用车载DVD导航一体机凯美瑞导航 08至11款老凯美瑞,汽车用品>电子电器>嵌入式导航>泰洋星丰田2008至2013年款凯美瑞专...,京东商城,泰洋星汽车用品店1004001003,汽车摩托|电子电器|嵌入式导航,纽曼（Newsmy）高保真E系列日产新骐达专用车载DVD导航一体机 3G上网1080P高清,汽车用品>电子电器>嵌入式导航>纽曼（Newsmy）>纽曼（Newsmy）高保真E系列日产新骐...,京东商城,酷跑车品1004001003,汽车摩托|电子电器|嵌入式导航,科骏达 长安志翔 专车专用车载DVD导航GPS一体机CA133-A 导航+后视(含安装),汽车用品>电子电器>嵌入式导航>科骏达>科骏达 长安志翔 专车专用车载DVD导航...,京东商城,智予恒汽车用品专营店1004001003,汽车摩托|电子电器|嵌入式导航,科骏达 长安CD101 专车专用车载DVD导航GPS一体机K6175-V6A 导航,汽车用品>电子电器>嵌入式导航>科骏达>科骏达 长安CD101 专车专用车载DV...,京东商城,智予恒汽车用品专营店1004001003,汽车摩托|电子电器|嵌入式导航,友通 本田2012思域CRV老CRV GPS导航仪 DVD导航影音一体机（包安装） 标配+倒车摄像头,汽车用品>电子电器>嵌入式导航>友通>友通 本田2012思域CRV老CRV G...,京东商城,古德巴迪科技1004001003,汽车摩托|电子电器|嵌入式导航,科骏达 智享系列 起亚K3 K173-M 专车专用专嵌入式车载DVD导航GPS一体机 导航,汽车用品>电子电器>嵌入式导航>科骏达>科骏达 智享系列 起亚K3 K173-M...,京东商城,智予恒汽车用品专营店1004001003,汽车摩托|电子电器|嵌入式导航,东影大众2012款朗逸7寸专车专用车载DVD导航仪GPS蓝牙一体机 朗逸专车专用导航仪,首页>汽车用品>电子/电器>嵌入式导航>东影大众2012款朗逸7寸专车专用车...,苏宁,东影(D-film)1004001003,汽车摩托|电子电器|嵌入式导航,东影大众新领驭7寸专车专用车载DVD导航仪GPS蓝牙一体机 新领驭专车专用导航仪,首页>汽车用品>电子/电器>嵌入式导航>东影大众新领驭7寸专车专用车载DVD...,苏宁,东影(D-film)1004001003,汽车摩托|电子电器|嵌入式导航,东影 福特福克斯 新嘉年华 新翼搏 新翼虎 锐界专车专用车载DVD导航仪GPS一体机 2013款新福克斯,汽车用品>电子电器>嵌入式导航>东影（D-film）>东影 福特福克斯 新嘉年华 新翼搏 新翼...,京东商城,东影旗舰店1004001003,汽车摩托|电子电器|嵌入式导航,WIFI无线连接器 WIFI无线连接器,汽车用品>电子电器>嵌入式导航>耀睿（YeaWise）>WIFI无线连接器 WIFI无线连接器,京东商城,耀睿导航旗舰店1004001003,汽车摩托|电子电器|嵌入式导航,东影广汽导航仪广汽GA5专车专用车载DVD导航仪GPS蓝牙一体机 广汽GA5导航仪一体机,首页>汽车用品>电子/电器>嵌入式导航>东影广汽导航仪广汽GA5专车专用车载...,苏宁,东影(D-film)1004001003,汽车摩托|电子电器|嵌入式导航,德赛西威（SVAUTO） SV7305 别克新君威（咖啡色内饰）专用导航3D实景地图固定测速提醒（厂家直发）,汽车用品>电子电器>嵌入式导航>德赛西威>德赛西威SV7305,京东商城,德赛西威1004001003,汽车摩托|电子电器|嵌入式导航,四方游 雪佛兰新景程新赛欧乐风GPS车载DVD导航仪,所有分类>大小家电、厨电、汽车>汽车生活>车载电器>嵌入式导航>四方游>四方游 雪佛兰新景程...,1号店,四方游1004001003,汽车摩托|电子电器|嵌入式导航,欧华 日产本田丰田系列 DVD导航一体机 4G云导航 车载GPS导航 4G云导航+倒车后视 日产天籁,汽车用品>电子电器>嵌入式导航>欧华（OWA）>欧华 日产本田丰田系列 DVD导航一体机...,京东商城,欧华京东旗舰店1004001003,汽车摩托|电子电器|嵌入式导航,卡仕达 丰田锐志导航 专车专用领航系列车载DVD导航一体机CA131-T 导航+倒车轨迹+内置胎压,汽车用品>电子电器>嵌入式导航>卡仕达>卡仕达 丰田锐志导航 专车专用领航系列车...,京东商城,智予恒汽车用品专营店1004001003,汽车摩托|电子电器|嵌入式导航,卡仕达D106平台 别克老君越 专车专用车载DVD导航一体机CA3611G 导航(含安装),汽车用品>电子电器>嵌入式导航>其它>卡仕达D106平台 别克老君越 专车专用...,京东商城,智予恒汽车用品专营店1004001003,汽车摩托|电子电器|嵌入式导航,耀睿（Yeawise）现代伊兰特索纳塔八代途胜IX35专用汽车载安卓DVD导航一体 其他车型,汽车用品>电子电器>嵌入式导航>耀睿（YeaWise）>耀睿（Yeawise）现代伊兰特索纳塔八...,京东商城,耀睿导航旗舰店1004001003,汽车摩托|电子电器|嵌入式导航,科骏达 斯巴鲁森林人 专车专用车载DVD导航一体机K6047G 导航+后视,汽车用品>电子电器>嵌入式导航>其它>科骏达 斯巴鲁森林人 专车专用车载DVD...,京东商城,智予恒汽车用品专营店1004001003,汽车摩托|电子电器|嵌入式导航,科骏达 斯巴鲁森林人 专车专用车载DVD导航一体机K6047G 导航+后视(含安装),汽车用品>电子电器>嵌入式导航>其它>科骏达 斯巴鲁森林人 专车专用车载DVD...,京东商城,智予恒汽车用品专营店1004001003,汽车摩托|电子电器|嵌入式导航,车易得CHEED 大众朗逸晶锐昊锐宝来速腾迈腾途观领驭polo高尔夫车载DVD导航一体 DVD导航标配 途锐,汽车用品>电子电器>嵌入式导航>车易得（CHEED）>车易得CHEED 大众朗逸晶锐昊锐宝来速...,京东商城,1004001003,汽车摩托|电子电器|嵌入式导航,车易得CHEED 大众朗逸晶锐昊锐宝来速腾迈腾途观领驭polo高尔夫车载DVD导航一体 DVD导航+高清倒车影像 宝来,汽车用品>电子电器>嵌入式导航>车易得（CHEED）>车易得CHEED 大众朗逸晶锐昊锐宝来速...,京东商城,1004001003,汽车摩托|电子电器|嵌入式导航,车易得CHEED 大众朗逸晶锐昊锐宝来速腾迈腾途观领驭polo高尔夫车载DVD DVD导航+倒车影像+电视盒 斯柯达昊锐,汽车用品>电子电器>嵌入式导航>车易得（CHEED）>车易得CHEED 大众朗逸晶锐昊锐宝来速...,京东商城,1004001003,汽车摩托|电子电器|嵌入式导航,车易得CHEED 大众朗逸晶锐昊锐宝来速腾迈腾途观领驭polo高尔夫车载DVD导航一 DVD导航+倒车影像+电视盒 途锐,汽车用品>电子电器>嵌入式导航>车易得（CHEED）>车易得CHEED 大众朗逸晶锐昊锐宝来速...,京东商城,1004001003,汽车摩托|电子电器|嵌入式导航,【爆品闹元宵】PLC贝奥斯 起亚K2专车专用DVD影音导航一体机 导航+摄像头+外置数字电视盒子,汽车用品>电子电器>嵌入式导航>贝奥斯（PLC）>【爆品闹元宵】PLC贝奥斯 起亚K2专车...,京东商城,环球汽车用品专营店1004001003,汽车摩托|电子电器|嵌入式导航,车易得CHEED 吉利远景3D实景地图固定测速车载DVD导航一体机7触摸屏汽车GPS导 DVD导航标配,汽车用品>电子电器>嵌入式导航>车易得（CHEED）>车易得CHEED 吉利远景3D实景地图固...,京东商城,1004001003,汽车摩托|电子电器|嵌入式导航,耀睿（Yeawise）马自达专用车载安卓DVD导航一体机马自达3 5 2 8 马自达8,汽车用品>电子电器>嵌入式导航>耀睿（YeaWise）>耀睿（Yeawise）马自达专用车载安卓...,京东商城,耀睿导航旗舰店1004001003,汽车摩托|电子电器|嵌入式导航,欧华 日产本田丰田系列 DVD导航一体机 4G云导航 车载GPS导航 4G云导航 丰田卡罗拉,汽车用品>电子电器>嵌入式导航>欧华（OWA）>欧华 日产本田丰田系列 DVD导航一体机...,京东商城,欧华京东旗舰店1004001003,汽车摩托|电子电器|嵌入式导航,欧华 日产本田丰田系列 DVD导航一体机 4G云导航 车载GPS导航 4G云导航+倒车后视 丰田凯美瑞,汽车用品>电子电器>嵌入式导航>欧华（OWA）>欧华 日产本田丰田系列 DVD导航一体机...,京东商城,欧华京东旗舰店1004001003,汽车摩托|电子电器|嵌入式导航,纽曼（Newsmy)车PAD 2代现代专用车载安卓DVD导航一体机 全新胜达 车PAD 安卓双核,汽车用品>电子电器>嵌入式导航>其他>纽曼（Newsmy)车PAD 2代现代专...,京东商城,酷跑车品1004001003,汽车摩托|电子电器|嵌入式导航,纽曼（Newsmy)车PAD 2代本田九代雅阁凌派专用车载安卓双核四核DVD导航一体 2014款九代雅阁 车PAD 安卓双核,汽车用品>电子电器>嵌入式导航>纽曼（Newsmy）>纽曼（Newsmy)车PAD 2代本田九...,京东商城,1004001003,汽车摩托|电子电器|嵌入式导航,东影 东风标致301风神S30 东风A60专用DVD导航仪gps一体机 东风A60(8寸),汽车用品>电子电器>嵌入式导航>东影（D-film）>东影 东风标致301风神S30 东风A6...,京东商城,东影旗舰店1004001003,汽车摩托|电子电器|嵌入式导航,悦畅 马自达6 马自达3 CX-5 DVD导航仪一体机 车载GPS嵌入式 导航仪全国包安装 老款马自达3,汽车用品>电子电器>嵌入式导航>悦畅>悦畅 马自达6 马自达3 CX-5 DV...,京东商城,null1004001003,汽车摩托|电子电器|嵌入式导航,四方游 现代瑞纳/IX35低配/新悦动/老悦动/索纳塔八代低配GPS车载DVD导航仪一体机 导航 不安装 索纳塔八代,汽车用品>电子电器>嵌入式导航>四方游>四方游 现代瑞纳/IX35低配/新悦动/...,京东商城,四方游导航专营店1004001003,汽车摩托|电子电器|嵌入式导航,四方游 起亚K2/K3/K5/福瑞迪/狮跑/智跑/赛拉图/13款索兰 GPS/DVD导航仪 导航 不安装 起亚K3,汽车用品>电子电器>嵌入式导航>四方游>四方游 起亚K2/K3/K5/福瑞迪/狮...,京东商城,四方游导航专营店1004001003,汽车摩托|电子电器|嵌入式导航,四方游 丰田汉南达/RAV4/卡罗拉/新锐志/花冠/新威驰/凯美瑞 GPS车载DVD导航仪 导航 不安装 新锐志,汽车用品>电子电器>嵌入式导航>四方游>四方游 丰田汉南达/RAV4/卡罗拉/新...,京东商城,四方游导航专营店1004001003,汽车摩托|电子电器|嵌入式导航,四方游 大众迈腾速腾高尔夫朗逸宝来POLO帕萨特领驭途观途安 GPS车载DVD导航仪 导航 不安装 高尔夫,汽车用品>电子电器>嵌入式导航>四方游>四方游 大众迈腾速腾高尔夫朗逸宝来POL...,京东商城,四方游导航专营店1004001003,汽车摩托|电子电器|嵌入式导航,四方游 大众迈腾速腾高尔夫朗逸宝来POLO帕萨特领驭途观途安 GPS车载DVD导航仪 导航 不安装 速腾,汽车用品>电子电器>嵌入式导航>四方游>四方游 大众迈腾速腾高尔夫朗逸宝来POL...,京东商城,四方游导航专营店1004001003,汽车摩托|电子电器|嵌入式导航,四方游 比亚迪L3/比亚迪G3/比亚迪F3 GPS车载DVD导航仪一体机 导航+安装 比亚迪F3,汽车用品>电子电器>嵌入式导航>四方游>四方游 比亚迪L3/比亚迪G3/比亚迪F...,京东商城,四方游导航专营店1004001003,汽车摩托|电子电器|嵌入式导航,东影 马自达CX-5专车专用车载式DVD多媒体蓝牙电话GPS导航仪一体机 马自达CX-5,汽车用品>电子电器>嵌入式导航>东影（D-film）>东影 马自达CX-5专车专用车载式DVD...,京东商城,东影旗舰店1004001003,汽车摩托|电子电器|嵌入式导航,车易得CHEED 雪佛兰科鲁兹车载DVD导航一体机汽车GPS导航仪分体机 DVD导航标配,汽车用品>电子电器>嵌入式导航>车易得（CHEED）>车易得CHEED 雪佛兰科鲁兹车载DVD...,京东商城,1004001003,汽车摩托|电子电器|嵌入式导航,东影 海南马自达2013款M3 S7专用车载DVD导航仪GPS一体机 海马2013款S7(高配版),汽车用品>电子电器>嵌入式导航>东影（D-film）>东影 海南马自达2013款M3 S7专用...,京东商城,东影旗舰店1004001003,汽车摩托|电子电器|嵌入式导航,悦畅 经典新福克斯导航 翼搏/嘉年华蒙迪欧致胜DVD导航仪一体机 蓝牙GPS 全国包安 长安翼虎 送高清倒车影像,汽车用品>电子电器>嵌入式导航>悦畅>悦畅 经典新福克斯导航 翼搏/嘉年华蒙...,京东商城,悦畅汽车用品旗舰店