1004003016,汽车摩托|改装配件|车身装饰,潮客-奔腾B50不锈钢车窗饰条 B50车窗装饰条 B50下窗饰条/竞奔腾B50专用,当当网 > 汽车用品 > 外饰精品 > 装饰条/轮眉,当当网,潮客1004003016,汽车摩托|改装配件|车身装饰,赫迪 车窗饰条(Q6),汽车、保养、装饰 > 装潢改装 > 外饰精品,易迅网,赫迪1004003016,汽车摩托|改装配件|车身装饰,欧泰 银色加厚车衣,汽车、保养、装饰 > 装潢改装 > 汽车车衣,易迅网,1004003016,汽车摩托|改装配件|车身装饰,好美车 不锈钢防盗车牌架 (雪佛兰),汽车、保养、装饰 > 装潢改装 > 车牌照框,易迅网,好美车1004003016,汽车摩托|改装配件|车身装饰,卡通车牌架 牌照架 TYPER车牌框 Kitty牌照框/卡通不锈钢车牌框,当当网 > 汽车用品 > 外饰精品 > 车牌架,当当网,1004003016,汽车摩托|改装配件|车身装饰,三菱 车牌架车牌框汽车牌照框(银),当当网 > 汽车用品 > 外饰精品 > 车牌架,当当网,无限完美1004003016,汽车摩托|改装配件|车身装饰,赫迪 车窗饰条(骊威、俊逸),汽车、保养、装饰 > 装潢改装 > 外饰精品,易迅网,赫迪1004003016,汽车摩托|改装配件|车身装饰,Cactus 汽车车牌架 牌照架 铝合金 车牌框 可拆卸 牌照框,汽车用品 > 改装配件 > 改装,当当网,Cactus1004003016,汽车摩托|改装配件|车身装饰,潮客 长安悦翔 车窗饰条/悦翔下窗饰条/悦翔不锈钢饰条/竞,汽车用品 > 改装配件 > 改装 > 商品详情,当当网,潮客1004003016,汽车摩托|改装配件|车身装饰,TYPER牌照架TYPE-R车牌架 加厚不锈钢车牌框 牌照框 本田进口加厚纯不锈钢+车标,当当网 > 汽车用品 > 外饰精品 > 车牌架,当当网,WRC1004003016,汽车摩托|改装配件|车身装饰,晶贵纯不锈钢雪佛兰车型专用车牌架 带雪佛兰车标牌照架 雪佛兰牌照框,汽车用品 > 汽车外饰 > 车牌框架,亚马逊(卓越网),晶贵1004003016,汽车摩托|改装配件|车身装饰,欧泰车牌框 铃木专用车牌架 镜面高级不锈钢车牌架 牌照框 牌照架,当当网 > 汽车用品 > 外饰精品 > 车牌架,当当网,欧泰1004003016,汽车摩托|改装配件|车身装饰,潮客 标致307*车窗饰条/下窗装饰条 标志不锈钢/竞,汽车用品 > 改装配件 > 改装 > 商品详情,当当网,潮客1004003016,汽车摩托|改装配件|车身装饰,铃木*牌照架 铃木车牌架 磨砂不锈钢车牌框 铃木牌照框,汽车用品 > 改装配件 > 改装 > 商品详情,当当网,竞雄1004003016,汽车摩托|改装配件|车身装饰,TYPER牌照架TYPE-R车牌架 加厚不锈钢车牌框 牌照框 马自达磨砂+进口纯不锈钢+车标,当当网 > 汽车用品 > 外饰精品 > 车牌架,当当网,WRC1004003016,汽车摩托|改装配件|车身装饰,竞雄 起亚双色磨沙车牌架 不锈钢双色磨沙车牌架 牌照框 起亚系列,汽车用品 > 改装配件 > 改装 > 商品详情,当当网,竞雄1004003016,汽车摩托|改装配件|车身装饰,正版NAPOLEX史迪奇汽车牌照框螺丝罩 卡通车贴装饰扣对装LS-21,当当网 > 汽车用品 > 配件 > 其它,当当网,Disney 迪士尼1004003016,汽车摩托|改装配件|车身装饰,镁合金车牌架 牌照框 牌照架 车牌框 带车标LOGO 汽车牌照托,汽车用品 > 改装配件 > 改装 > 商品详情,当当网,粤野1004003016,汽车摩托|改装配件|车身装饰,龙七车牌架 中华 尊驰 骏捷FRV FSV 防盗不锈钢 牌照框,汽车用品 > 改装配件 > 改装 > 商品详情,当当网,龙七1004003016,汽车摩托|改装配件|车身装饰,车当家 镁合金车牌架防盗牌照框对装 墨黑色,汽车用品>改装配件>其他配件>车当家 镁合金车牌架防盗牌照框对装 墨黑...,京东商城,车当家京东旗舰店1004003016,汽车摩托|改装配件|车身装饰,晶贵纯不锈钢起亚车型专用车牌架 带起亚车标牌照架 起亚牌照框,汽车用品 > 汽车外饰 > 车牌框架,亚马逊(卓越网),晶贵1004003016,汽车摩托|改装配件|车身装饰,新国标新交规 英非特车牌防震消音垫 牌照框隔音垫减震垫 对装,汽车用品 > 改装配件 > 改装 > 商品详情,当当网,英非特1004003016,汽车摩托|改装配件|车身装饰,高匠 车管所 省市简称字螺丝 汽车牌照扣 防盗牌照镙丝 车牌架防盗螺丝 湘,汽车用品 > 汽车外饰 > 车牌框架,亚马逊(卓越网),高匠/Gaojiang1004003016,汽车摩托|改装配件|车身装饰,3M 美国胶带双面胶汽车专用双面泡棉胶带（宽1CM） 长3米,汽车用品 > 汽车外饰 > 防撞、装饰条 > 防撞条,亚马逊(卓越网),3M1004003016,汽车摩托|改装配件|车身装饰,车当家 镁合金车牌架 车牌框 牌照框 牌照架 汽车防盗牌架框 对装 (银灰),汽车用品/类别/零件\\改装\\外饰/个性化和外部装饰/牌照架,亚马逊(卓越网),车当家1004003016,汽车摩托|改装配件|车身装饰,完美 宝马X3专用汽车车牌框架 防盗可拆卸车牌架 牌照框 黑+银,汽车用品 > 汽车外饰 > 车牌框架,亚马逊(卓越网),完美1004003016,汽车摩托|改装配件|车身装饰,3M 汽车专用双面胶带 6mm * 30m进口双面胶带 超强泡棉胶带,汽车用品 > 汽车外饰 > 防撞、装饰条 > 防撞条,亚马逊(卓越网),3M1004003016,汽车摩托|改装配件|车身装饰,卡饰社(CarSetCity) CS-27524 超轻质铝合金车牌架 银色,汽车用品>改装配件>车身装饰>卡饰社（CarSetCity）>卡饰社CS-27524,京东商城,卡饰社（CarSetCity）1004003016,汽车摩托|改装配件|车身装饰,越野兵 尼桑汽车亚克力车窗晴雨挡 尼桑骐达/颐达/阳光/天籁/奇骏/玛驰/骊威 03-10款老骐达,汽车用品>改装配件>其他配件>越野兵>越野兵 尼桑汽车亚克力车窗晴雨挡 尼桑骐...,京东商城,越野兵车品专营店1004003016,汽车摩托|改装配件|车身装饰,思卡丽 铝镁合金新交规车牌架 汽车牌照框 双轨道车用牌照架车牌框 紫色,汽车用品>改装配件>车身装饰>思卡丽 铝镁合金新交规车牌架 汽车牌照框...,京东商城,思卡丽京东旗舰店1004003016,汽车摩托|改装配件|车身装饰,泰澄 2013新交规太空铝标准车牌架 汽车牌照框 通用型 新国标 铝合金炫彩车牌架 枫叶红,汽车用品>改装配件>其他配件>其它>泰澄 2013新交规太空铝标准车牌架 ...,京东商城,泰澄车品专营店1004003016,汽车摩托|改装配件|车身装饰,酷斯特 2012款新福克斯全窗饰条 车窗亮条 新福克斯车窗饰条 三厢下窗8件套分体,汽车用品>改装配件>车身装饰>酷斯特>酷斯特 2012款新福克斯全窗饰条 车窗...,京东商城,酷斯特旗舰店1004003016,汽车摩托|改装配件|车身装饰,立飒L10 奢华镁合金车牌架 汽车牌照框 车牌框 银色 445mm*145mm*3mm,汽车用品>内饰精品>功能用品>其他>立飒L10 奢华镁合金车牌架 汽车牌照框...,京东商城,立飒汽车用品专营店1004003016,汽车摩托|改装配件|车身装饰,泰澄 2013新交规太空铝标准车牌架 汽车牌照框 通用型 新国标 铝合金炫彩车牌架 湖蓝,汽车用品>改装配件>其他配件>其它>泰澄 2013新交规太空铝标准车牌架 ...,京东商城,泰澄车品专营店1004003016,汽车摩托|改装配件|车身装饰,龙七新交规车牌架车牌框钛合金材料 十年质保 钢琴黑 斯柯达,汽车用品>改装配件>车身装饰>龙七>龙七新交规车牌架车牌框钛合金材料 十年质...,京东商城,翊惠车品专营店1004003016,汽车摩托|改装配件|车身装饰,卡卡买 新交规车牌架 镁合金双轨道顶级汽车牌照框 玫红 对装,汽车用品>改装配件>车身装饰>卡卡买>卡卡买新交规车牌架,京东商城,卡卡买1004003016,汽车摩托|改装配件|车身装饰,2013新交规车牌架 汽车车牌框 牌照框 航空铝合金车牌架 黑色 455*165*6.5mm,汽车用品>内饰精品>功能用品>其他>2013新交规车牌架 汽车车牌框 牌照框...,京东商城,立飒汽车用品专营店1004003016,汽车摩托|改装配件|车身装饰,威利 2012款二厢福克斯 整窗饰条 16件 21151301,汽车用品 > 汽车外饰 > 镀铬装饰,亚马逊(卓越网),WELLY 威利1004003016,汽车摩托|改装配件|车身装饰,迈威 上汽荣威 550|350|750|W5 专用车牌架 不锈钢车牌架 银色,汽车用品/类别,亚马逊(卓越网),迈威1004003016,汽车摩托|改装配件|车身装饰,睿博 新交规汽车车牌架 可拆卸牌照框 车牌框航空铝合金不生锈 黑色,汽车用品 > 汽车外饰 > 车牌框架,亚马逊(卓越网),睿博1004003016,汽车摩托|改装配件|车身装饰,龙七牌 高档不锈钢防盗车牌架/牌照架/牌照框车牌框 三菱,汽车用品 > 汽车外饰 > 车牌框架,亚马逊(卓越网),龙七牌1004003016,汽车摩托|改装配件|车身装饰,睿博 车牌架 新交规 汽车牌照框 车牌框 个性牌照架 铝合金可拆卸 新交规（黄金色）1对,汽车用品 > 汽车外饰 > 车牌框架,亚马逊(卓越网),睿博1004003016,汽车摩托|改装配件|车身装饰,睿博 车牌架 新交规 汽车牌照框 车牌框 个性牌照架 铝合金可拆卸 新交规（蓝色）1对,汽车用品 > 汽车外饰 > 车牌框架,亚马逊(卓越网),睿博1004003016,汽车摩托|改装配件|车身装饰,睿博 奇瑞双色高级不锈钢车牌架 车牌架 车牌框,汽车用品 > 汽车外饰 > 车牌框架,亚马逊(卓越网),睿博1004003016,汽车摩托|改装配件|车身装饰,睿博 车牌架 新交规 汽车牌照框 车牌框 个性牌照架 铝合金可拆卸 新交规（玫红）1对,汽车用品 > 汽车外饰 > 车牌框架,亚马逊(卓越网),睿博1004003016,汽车摩托|改装配件|车身装饰,葫芦娃CB-CPJ-HK01   汽车车牌架/不锈钢车牌架/hello kitty车牌架,汽车用品/类别/汽车零件,亚马逊(卓越网),葫芦娃1004003016,汽车摩托|改装配件|车身装饰,卡饰社 航空铝制车牌架 银色 2片装 CS-27900,汽车用品 > 汽车外饰 > 车牌框架,亚马逊(卓越网),Carsetcity 卡饰社1004003016,汽车摩托|改装配件|车身装饰,帕飞克 新交规航空铝合金车牌架 防盗牌照架 可拆卸车牌框 牌照框 马自达CX-7 cx7 (送牌照平头螺丝2套+防震垫2片) 两片装 暗灰色,汽车用品 > 汽车外饰 > 车牌框架,亚马逊(卓越网),Cactus1004003016,汽车摩托|改装配件|车身装饰,帕飞克 新交规航空铝合金车牌架 防盗牌照架 可拆卸车牌框 牌照框 丰田 普拉多 霸道 2010 (送牌照平头螺丝2套+防震垫2片) 两片装 暗灰色,汽车用品 > 汽车外饰 > 车牌框架,亚马逊(卓越网),Cactus1004003016,汽车摩托|改装配件|车身装饰,帕飞克 新交规航空铝合金车牌架 防盗牌照架 可拆卸车牌框 牌照框 凯迪拉克 新SRX全尺寸 (送牌照平头螺丝2套+防震垫2片) 两片装 暗灰色,汽车用品 > 汽车外饰 > 车牌框架,亚马逊(卓越网),Cactus1004003016,汽车摩托|改装配件|车身装饰,帕飞克 新交规航空铝合金车牌架 防盗牌照架 可拆卸车牌框 牌照框 起亚 福瑞迪 (送牌照平头螺丝2套+防震垫2片) 两片装 暗灰色,汽车用品 > 汽车外饰 > 车牌框架,亚马逊(卓越网),Cactus1004003016,汽车摩托|改装配件|车身装饰,帕飞克 新交规航空铝合金车牌架 防盗牌照架 可拆卸车牌框 牌照框 斯巴鲁 森林人 (送牌照平头螺丝2套+防震垫2片) 两片装 银色,汽车用品 > 汽车外饰 > 车牌框架,亚马逊(卓越网),Cactus1004003016,汽车摩托|改装配件|车身装饰,帕飞克 新交规航空铝合金车牌架 防盗牌照架 可拆卸车牌框 牌照框 现代 伊兰特 2002款 (送牌照平头螺丝2套+防震垫2片) 两片装 暗灰色,汽车用品 > 汽车外饰 > 车牌框架,亚马逊(卓越网),Cactus1004003016,汽车摩托|改装配件|车身装饰,帕飞克 新交规航空铝合金车牌架 防盗牌照架 可拆卸车牌框 牌照框 奇瑞A3三厢 2010 (送牌照平头螺丝2套+防震垫2片) 两片装 暗灰色,汽车用品 > 汽车外饰 > 车牌框架,亚马逊(卓越网),Cactus1004003016,汽车摩托|改装配件|车身装饰,帕飞克 新交规航空铝合金车牌架 防盗牌照架 可拆卸车牌框 牌照框 宝马5系GT535 (送牌照平头螺丝2套+防震垫2片) 两片装 暗灰色,汽车用品 > 汽车外饰 > 车牌框架,亚马逊(卓越网),Cactus1004003016,汽车摩托|改装配件|车身装饰,帕飞克 新交规航空铝合金车牌架 防盗牌照架 可拆卸车牌框 牌照框 长城炫丽 (送牌照平头螺丝2套+防震垫2片) 两片装 暗灰色,汽车用品 > 汽车外饰 > 车牌框架,亚马逊(卓越网),Cactus1004003016,汽车摩托|改装配件|车身装饰,帕飞克 新交规航空铝合金车牌架 防盗牌照架 可拆卸车牌框 牌照框 雷克萨斯ES250 ES300 ES350 2006 (送牌照平头螺丝2套+防震垫2片) 两片装 银色,汽车用品 > 汽车外饰 > 车牌框架,亚马逊(卓越网),Cactus1004003016,汽车摩托|改装配件|车身装饰,帕飞克 新交规航空铝合金车牌架 防盗牌照架 可拆卸车牌框 牌照框 斯柯达 晶锐 (送牌照平头螺丝2套+防震垫2片) 两片装 暗灰色,汽车用品 > 汽车外饰 > 车牌框架,亚马逊(卓越网),Cactus1004003016,汽车摩托|改装配件|车身装饰,帕飞克 新交规航空铝合金车牌架 防盗牌照架 可拆卸车牌框 牌照框 丰田 凯美瑞混合动力 2009 (送牌照平头螺丝2套+防震垫2片) 两片装 银色,汽车用品 > 汽车外饰 > 车牌框架,亚马逊(卓越网),Cactus1004003016,汽车摩托|改装配件|车身装饰,帕飞克 新交规航空铝合金车牌架 防盗牌照架 可拆卸车牌框 牌照框 雷克萨斯CT200H (送牌照平头螺丝2套+防震垫2片) 两片装 银色,汽车用品 > 汽车外饰 > 车牌框架,亚马逊(卓越网),Cactus1004003016,汽车摩托|改装配件|车身装饰,帕飞克 新交规航空铝合金车牌架 防盗牌照架 可拆卸车牌框 牌照框 宝马3系加长 320 328 335 (送牌照平头螺丝2套+防震垫2片) 两片装 深蓝色,汽车用品 > 汽车外饰 > 车牌框架,亚马逊(卓越网),Cactus1004003016,汽车摩托|改装配件|车身装饰,帕飞克 新交规航空铝合金车牌架 防盗牌照架 可拆卸车牌框 牌照框 奔驰R300 R350 R500 不带扶手箱 (送牌照平头螺丝2套+防震垫2片) 两片装 深蓝色,汽车用品 > 汽车外饰 > 车牌框架,亚马逊(卓越网),Cactus1004003016,汽车摩托|改装配件|车身装饰,帕飞克 新交规航空铝合金车牌架 防盗牌照架 可拆卸车牌框 牌照框 丰田 汉兰达七座加扩展件 三片装 2012款 7座 (送牌照平头螺丝2套+防震垫2片) 两片装 暗灰色,汽车用品 > 汽车外饰 > 车牌框架,亚马逊(卓越网),Cactus1004003016,汽车摩托|改装配件|车身装饰,帕飞克 新交规航空铝合金车牌架 防盗牌照架 可拆卸车牌框 牌照框 起亚 新佳乐七座专用 2010 (送牌照平头螺丝2套+防震垫2片) 两片装 深蓝色,汽车用品 > 汽车外饰 > 车牌框架,亚马逊(卓越网),Cactus1004003016,汽车摩托|改装配件|车身装饰,帕飞克 新交规航空铝合金车牌架 防盗牌照架 可拆卸车牌框 牌照框 本田2012款CRV cr-v (送牌照平头螺丝2套+防震垫2片) 两片装 深蓝色,汽车用品 > 汽车外饰 > 车牌框架,亚马逊(卓越网),Cactus1004003016,汽车摩托|改装配件|车身装饰,帕飞克 新交规航空铝合金车牌架 防盗牌照架 可拆卸车牌框 牌照框 现代 i30 2009 (送牌照平头螺丝2套+防震垫2片) 两片装 银色,汽车用品 > 汽车外饰 > 车牌框架,亚马逊(卓越网),Cactus1004003016,汽车摩托|改装配件|车身装饰,帕飞克 新交规航空铝合金车牌架 防盗牌照架 可拆卸车牌框 牌照框 欧宝 安德拉SUV五座 (送牌照平头螺丝2套+防震垫2片) 两片装 银色,汽车用品 > 汽车外饰 > 车牌框架,亚马逊(卓越网),Cactus1004003016,汽车摩托|改装配件|车身装饰,帕飞克 新交规航空铝合金车牌架 防盗牌照架 可拆卸车牌框 牌照框 标志 标志508 2011 (送牌照平头螺丝2套+防震垫2片) 两片装 深蓝色,汽车用品 > 汽车外饰 > 车牌框架,亚马逊(卓越网),Cactus1004003016,汽车摩托|改装配件|车身装饰,帕飞克 新交规航空铝合金车牌架 防盗牌照架 可拆卸车牌框 牌照框 马自达M6 睿翼 睿翼 (送牌照平头螺丝2套+防震垫2片) 两片装 深蓝色,汽车用品 > 汽车外饰 > 车牌框架,亚马逊(卓越网),Cactus1004003016,汽车摩托|改装配件|车身装饰,帕飞克 新交规航空铝合金车牌架 防盗牌照架 可拆卸车牌框 牌照框 路虎 陆虎 发现者4 五座专用 (送牌照平头螺丝2套+防震垫2片) 两片装 浅绿色,汽车用品 > 汽车外饰 > 车牌框架,亚马逊(卓越网),Cactus1004003016,汽车摩托|改装配件|车身装饰,帕飞克 新交规航空铝合金车牌架 防盗牌照架 可拆卸车牌框 牌照框 宝马3系 2012款 加长版 国产 (送牌照平头螺丝2套+防震垫2片) 两片装 深蓝色,汽车用品 > 汽车外饰 > 车牌框架,亚马逊(卓越网),Cactus1004003016,汽车摩托|改装配件|车身装饰,帕飞克 新交规航空铝合金车牌架 防盗牌照架 可拆卸车牌框 牌照框 大众 新领驭 (送牌照平头螺丝2套+防震垫2片) 两片装 深蓝色,汽车用品 > 汽车外饰 > 车牌框架,亚马逊(卓越网),Cactus1004003016,汽车摩托|改装配件|车身装饰,帕飞克 新交规航空铝合金车牌架 防盗牌照架 可拆卸车牌框 牌照框 丰田 威驰 2008 (送牌照平头螺丝2套+防震垫2片) 两片装 银色,汽车用品 > 汽车外饰 > 车牌框架,亚马逊(卓越网),Cactus1004003016,汽车摩托|改装配件|车身装饰,帕飞克 新交规航空铝合金车牌架 防盗牌照架 可拆卸车牌框 牌照框 本田 新思域 混合动力车 (送牌照平头螺丝2套+防震垫2片) 两片装 深蓝色,汽车用品 > 汽车外饰 > 车牌框架,亚马逊(卓越网),Cactus1004003016,汽车摩托|改装配件|车身装饰,帕飞克 新交规航空铝合金车牌架 防盗牌照架 可拆卸车牌框 牌照框 起亚 霸锐 (送牌照平头螺丝2套+防震垫2片) 两片装 深蓝色,汽车用品 > 汽车外饰 > 车牌框架,亚马逊(卓越网),Cactus1004003016,汽车摩托|改装配件|车身装饰,帕飞克 新交规航空铝合金车牌架 防盗牌照架 可拆卸车牌框 牌照框 丰田 逸致 五座 2011 (送牌照平头螺丝2套+防震垫2片) 两片装 银色,汽车用品 > 汽车外饰 > 车牌框架,亚马逊(卓越网),Cactus1004003016,汽车摩托|改装配件|车身装饰,帕飞克 新交规航空铝合金车牌架 防盗牌照架 可拆卸车牌框 牌照框 别克 林荫大道 (送牌照平头螺丝2套+防震垫2片) 两片装 暗灰色,汽车用品 > 汽车外饰 > 车牌框架,亚马逊(卓越网),Cactus1004003016,汽车摩托|改装配件|车身装饰,帕飞克 新交规航空铝合金车牌架 防盗牌照架 可拆卸车牌框 牌照框 宝马迷你mini cooper 标准两门 (送牌照平头螺丝2套+防震垫2片) 两片装 暗灰色,汽车用品 > 汽车外饰 > 车牌框架,亚马逊(卓越网),Cactus1004003016,汽车摩托|改装配件|车身装饰,帕飞克 新交规航空铝合金车牌架 防盗牌照架 可拆卸车牌框 牌照框 江淮 和悦RS (送牌照平头螺丝2套+防震垫2片) 两片装 深蓝色,汽车用品 > 汽车外饰 > 车牌框架,亚马逊(卓越网),Cactus1004003016,汽车摩托|改装配件|车身装饰,帕飞克 新交规航空铝合金车牌架 防盗牌照架 可拆卸车牌框 牌照框 福特 s-max smax 七座 (送牌照平头螺丝2套+防震垫2片) 两片装 浅绿色,汽车用品 > 汽车外饰 > 车牌框架,亚马逊(卓越网),Cactus1004003016,汽车摩托|改装配件|车身装饰,帕飞克 新交规航空铝合金车牌架 防盗牌照架 可拆卸车牌框 牌照框 雪佛兰 SPARK 斯帕克 进口 (送牌照平头螺丝2套+防震垫2片) 两片装 深蓝色,汽车用品 > 汽车外饰 > 车牌框架,亚马逊(卓越网),Cactus1004003016,汽车摩托|改装配件|车身装饰,帕飞克 新交规航空铝合金车牌架 防盗牌照架 可拆卸车牌框 牌照框 丰田 RAV4 (送牌照平头螺丝2套+防震垫2片) 两片装 浅绿色,汽车用品 > 汽车外饰 > 车牌框架,亚马逊(卓越网),Cactus1004003016,汽车摩托|改装配件|车身装饰,帕飞克 新交规航空铝合金车牌架 防盗牌照架 可拆卸车牌框 牌照框 斯柯达 明锐 (送牌照平头螺丝2套+防震垫2片) 两片装 浅绿色,汽车用品 > 汽车外饰 > 车牌框架,亚马逊(卓越网),Cactus1004003016,汽车摩托|改装配件|车身装饰,帕飞克 新交规航空铝合金车牌架 防盗牌照架 可拆卸车牌框 牌照框 奥迪A5双门硬顶轿跑 (送牌照平头螺丝2套+防震垫2片) 两片装 浅绿色,汽车用品 > 汽车外饰 > 车牌框架,亚马逊(卓越网),Cactus1004003016,汽车摩托|改装配件|车身装饰,帕飞克 新交规航空铝合金车牌架 防盗牌照架 可拆卸车牌框 牌照框 丰田 雅力士 2008 (送牌照平头螺丝2套+防震垫2片) 两片装 浅绿色,汽车用品 > 汽车外饰 > 车牌框架,亚马逊(卓越网),Cactus1004003016,汽车摩托|改装配件|车身装饰,帕飞克 新交规航空铝合金车牌架 防盗牌照架 可拆卸车牌框 牌照框 奔驰C级旅行车 (送牌照平头螺丝2套+防震垫2片) 两片装 深蓝色,汽车用品 > 汽车外饰 > 车牌框架,亚马逊(卓越网),Cactus1004003016,汽车摩托|改装配件|车身装饰,帕飞克 新交规航空铝合金车牌架 防盗牌照架 可拆卸车牌框 牌照框 现代 i30 2009 (送牌照平头螺丝2套+防震垫2片) 两片装 浅绿色,汽车用品 > 汽车外饰 > 车牌框架,亚马逊(卓越网),Cactus1004003016,汽车摩托|改装配件|车身装饰,帕飞克 新交规航空铝合金车牌架 防盗牌照架 可拆卸车牌框 牌照框 丰田 锐志 2006款 (送牌照平头螺丝2套+防震垫2片) 两片装 玫红色,汽车用品 > 汽车外饰 > 车牌框架,亚马逊(卓越网),Cactus1004003016,汽车摩托|改装配件|车身装饰,帕飞克 新交规航空铝合金车牌架 防盗牌照架 可拆卸车牌框 牌照框 别克 英朗 2010 (送牌照平头螺丝2套+防震垫2片) 两片装 浅绿色,汽车用品 > 汽车外饰 > 车牌框架,亚马逊(卓越网),Cactus1004003016,汽车摩托|改装配件|车身装饰,帕飞克 新交规航空铝合金车牌架 防盗牌照架 可拆卸车牌框 牌照框 日产尼桑 轩逸 蓝鸟 2006 (送牌照平头螺丝2套+防震垫2片) 两片装 玫红色,汽车用品 > 汽车外饰 > 车牌框架,亚马逊(卓越网),Cactus1004003016,汽车摩托|改装配件|车身装饰,帕飞克 新交规航空铝合金车牌架 防盗牌照架 可拆卸车牌框 牌照框 奥迪A4L (送牌照平头螺丝2套+防震垫2片) 两片装 玫红色,汽车用品 > 汽车外饰 > 车牌框架,亚马逊(卓越网),Cactus1004003016,汽车摩托|改装配件|车身装饰,帕飞克 新交规航空铝合金车牌架 防盗牌照架 可拆卸车牌框 牌照框 捷豹 XF (送牌照平头螺丝2套+防震垫2片) 两片装 浅绿色,汽车用品 > 汽车外饰 > 车牌框架,亚马逊(卓越网),Cactus1004003016,汽车摩托|改装配件|车身装饰,帕飞克 新交规航空铝合金车牌架 防盗牌照架 可拆卸车牌框 牌照框 雪铁龙 世嘉三厢 2006款 (送牌照平头螺丝2套+防震垫2片) 两片装 浅绿色,汽车用品 > 汽车外饰 > 车牌框架,亚马逊(卓越网),Cactus1004003016,汽车摩托|改装配件|车身装饰,帕飞克 新交规航空铝合金车牌架 防盗牌照架 可拆卸车牌框 牌照框 宝马1系 118i (送牌照平头螺丝2套+防震垫2片) 两片装 玫红色,汽车用品 > 汽车外饰 > 车牌框架,亚马逊(卓越网),Cactus1004003016,汽车摩托|改装配件|车身装饰,帕飞克 新交规航空铝合金车牌架 防盗牌照架 可拆卸车牌框 牌照框 路虎 陆虎 极光 内尺寸 (送牌照平头螺丝2套+防震垫2片) 两片装 玫红色,汽车用品 > 汽车外饰 > 车牌框架,亚马逊(卓越网),Cactus1004003016,汽车摩托|改装配件|车身装饰,帕飞克 新交规航空铝合金车牌架 防盗牌照架 可拆卸车牌框 牌照框 斯柯达 明锐 (送牌照平头螺丝2套+防震垫2片) 两片装 玫红色,汽车用品 > 汽车外饰 > 车牌框架,亚马逊(卓越网),Cactus1004003016,汽车摩托|改装配件|车身装饰,帕飞克 新交规航空铝合金车牌架 防盗牌照架 可拆卸车牌框 牌照框 名爵 MG3 2010 (送牌照平头螺丝2套+防震垫2片) 两片装 玫红色,汽车用品 > 汽车外饰 > 车牌框架,亚马逊(卓越网),Cactus1004003016,汽车摩托|改装配件|车身装饰,帕飞克 新交规航空铝合金车牌架 防盗牌照架 可拆卸车牌框 牌照框 现代 ix35 (送牌照平头螺丝2套+防震垫2片) 两片装 金黄色,汽车用品 > 汽车外饰 > 车牌框架,亚马逊(卓越网),Cactus1004003016,汽车摩托|改装配件|车身装饰,帕飞克 新交规航空铝合金车牌架 防盗牌照架 可拆卸车牌框 牌照框 2011款宝马X3 (送牌照平头螺丝2套+防震垫2片) 两片装 金黄色,汽车用品 > 汽车外饰 > 车牌框架,亚马逊(卓越网),Cactus1004003016,汽车摩托|改装配件|车身装饰,帕飞克 新交规航空铝合金车牌架 防盗牌照架 可拆卸车牌框 牌照框 大众 途锐 2011款 (送牌照平头螺丝2套+防震垫2片) 两片装 玫红色,汽车用品 > 汽车外饰 > 车牌框架,亚马逊(卓越网),Cactus