1004006006,汽车摩托|内饰精品|方向盘套,索瑞尔手缝方向盘套真皮 把套四季通用荣威350 550 w5 名爵MG3 MG3 沃尔沃 黑色8002,汽车用品>内饰精品>方向盘套>索瑞尔>索瑞尔手缝方向盘套真皮 把套四季通用荣威...,京东商城,铠翼汽车用品专营店1004006006,汽车摩托|内饰精品|方向盘套,御马 四季通用高档方向盘套把套 头层牛皮SW008方向盘套 黑色,汽车用品>内饰精品>方向盘套>御马 四季通用高档方向盘套把套 头层牛皮...,京东商城,御马车品旗舰店1004006006,汽车摩托|内饰精品|方向盘套,车之吻 高档超纤皮汽车方向盘套 超手感防滑 四季通用/米黄色,汽车用品>内饰精品>方向盘套>车之吻>车之吻高档超纤皮汽车方向盘套,京东商城,车之吻1004006006,汽车摩托|内饰精品|方向盘套,车之吻 环保超纤皮汽车方向盘套 超手感波浪纹 四季通用/黑红色,汽车用品>内饰精品>方向盘套>车之吻>车之吻环保超纤皮汽车方向盘套,京东商城,车之吻1004006006,汽车摩托|内饰精品|方向盘套,浩优 长城腾翼C30/C50/V80/C20R/赛影汽车超纤皮方向盘套 四季把套 棕色,汽车用品>内饰精品>方向盘套>其他>浩优 长城腾翼C30/C50/V80/C...,京东商城,连顺车品专卖店1004006006,汽车摩托|内饰精品|方向盘套,浩优 荣威550/350/750/950/W7W5四季汽车超纤皮方向盘套 把套 米色,汽车用品>内饰精品>方向盘套>其它>浩优 荣威550/350/750/950...,京东商城,连顺车品专卖店1004006006,汽车摩托|内饰精品|方向盘套,点将台 时尚pu压纹汽车方向盘套fa26 灰色 中号(38CM),汽车用品>内饰精品>方向盘套>点将台 >点将台 时尚pu压纹汽车方向盘套fa26...,京东商城,点将台旗舰店1004006006,汽车摩托|内饰精品|方向盘套,CHACO 西皮按摩直金边方向盘把套 米色,汽车用品>内饰精品>方向盘套>CHACO 西皮按摩直金边方向盘把套 米...,京东商城,CHACO汽车用品旗舰店1004006006,汽车摩托|内饰精品|方向盘套,飞石FLYING STONE真皮方向盘套SW-10B时尚双色 中号38CM外径,汽车用品>内饰精品>方向盘套>飞石FLYING STONE真皮方向盘套...,京东商城,飞石专营店1004006006,汽车摩托|内饰精品|方向盘套,思卡华 时尚豹纹方向盘套 方向把套 四季 汽车用品支持货到付款 全豹纹,汽车用品>汽车装饰>车内饰品>其它>思卡华 时尚豹纹方向盘套 方向把套 四季...,京东商城,思卡华旗舰店1004006006,汽车摩托|内饰精品|方向盘套,KAPIN 汽车方向盘套 打孔汽车方向盘套 防滑 透气方向盘套,汽车用品 > 汽车内饰 > 方向盘套,亚马逊(卓越网),KAPIN1004006006,汽车摩托|内饰精品|方向盘套,yuchebao 御车宝 方向盘套 帝王 把套 四季款 帝王蟒 (北京地区已开通线下安装及保养服务！仅限亚马逊自营商品，详见商品描述),汽车用品 > 汽车内饰 > 方向盘套,亚马逊(卓越网),yuchebao 御车宝1004006006,汽车摩托|内饰精品|方向盘套,安帝卡把套冰丝系列编结002 手感细腻清凉吸汗透气不闷热日照升温慢 浅灰色,汽车用品 > 汽车内饰 > 方向盘套,亚马逊(卓越网),安帝卡