1004006004,汽车摩托|内饰精品|颈枕、头枕,爱思优威汽车办公室家庭适用抱枕格调抱枕 颈枕B款,汽车用品>汽车装饰>头枕腰靠>爱思优威（SUV）>爱思优威汽车办公室家庭适用抱枕格调抱枕 ...,京东商城,美斯优唐汽车用品专营店1004006004,汽车摩托|内饰精品|颈枕、头枕,(Astro Boy)铁臂阿童木 超纤绒可爱造型汽车头枕 头型护颈枕 靠枕头靠 对装 XSJ-15（黑色）,抱枕靠枕 > ,1号店,Astroboy/铁臂阿童木1004006004,汽车摩托|内饰精品|颈枕、头枕,Garfield 加菲猫 精工刺绣车用骨头枕 护颈枕 靠枕 单个装 JFTZ-03R 红色,抱枕靠枕 > ,1号店,Garfield/加菲猫1004006004,汽车摩托|内饰精品|颈枕、头枕,ICAROOM 爱车屋 I-002A太空棉系列汽车头枕/颈枕 单个,汽车用品 > 汽车内饰 > 车用腰靠 ,亚马逊(卓越网),ICAROOM 爱车屋1004006004,汽车摩托|内饰精品|颈枕、头枕,Exspider 伊仕百得 炫惑系列立体颈枕 车用头枕 PS201-PI 红黑,汽车用品 > 汽车内饰 > 头枕,亚马逊(卓越网),exspider 伊仕百得1004006004,汽车摩托|内饰精品|颈枕、头枕,华辉 纳米亮丝透气汽车头枕 慢回弹记忆棉骨头枕 颈枕 靠枕 (一对装, 优雅米),汽车用品 > 汽车内饰 > 头枕,亚马逊(卓越网),华辉1004006004,汽车摩托|内饰精品|颈枕、头枕,腰宝宝 汽车真皮头枕 颈枕 靠枕 太空记忆棉 车用新款 蝴蝶型 马鞍棕,汽车用品>内饰精品>颈枕/头枕>腰宝宝 汽车真皮头枕 颈枕 靠枕 太空...,京东商城,易车车品专营店1004006004,汽车摩托|内饰精品|颈枕、头枕,爵信（The letter）丹尼皮汽车头枕 车用护颈枕对装 绅士黑,汽车用品>内饰精品>颈枕/头枕>其他>爵信（The letter）丹尼皮汽车头...,京东商城,爵信车品专营店1004006004,汽车摩托|内饰精品|颈枕、头枕,SNOOPY史努比慢回弹记忆棉保健骨头枕 汽车头枕 颈枕 对装 经典红-超纤绒,首页> 家居生活> 汽车用品> 内饰精品> 颈枕/头枕> SNOOPY史努比慢回弹记忆棉保健骨头枕 汽车头枕 颈枕 对装,凡客诚品,SNOOPY 史努比1004006004,汽车摩托|内饰精品|颈枕、头枕,阿童木纳米亮丝透气汽车头枕 慢回弹记忆棉骨头枕 颈枕 靠枕 单个 优雅米,首页> 家居生活> 汽车用品> 内饰精品> 颈枕/头枕> 阿童木纳米亮丝透气汽车头枕 慢回弹记忆棉骨头枕 颈枕 靠枕 单个,凡客诚品,Astro Boy 铁臂阿童木1004006004,汽车摩托|内饰精品|颈枕、头枕,SNOOPY史努比精工电绣汽车用头枕 骨头枕 颈枕 单个 TZ03R单个,首页> 家居生活> 汽车用品> 内饰精品> 颈枕/头枕> SNOOPY史努比精工电绣汽车用头枕 骨头枕 颈枕 单个,凡客诚品,SNOOPY 史努比1004006004,汽车摩托|内饰精品|颈枕、头枕,百易达 红酒系列汽车颈枕 精制超纤维皮头枕(对装) 黑色红线,其它>百易达 红酒系列汽车颈枕 精制超纤维皮头...,京东商城,盛易达车品专营店1004006004,汽车摩托|内饰精品|颈枕、头枕,艺芙蓉 Y11J001D米色 汽车饰品 车用抱枕/靠枕 颈枕/头枕 腰靠/腰枕组合5件套装,首页>汽车用品>内饰精品>头枕/颈枕>艺芙蓉Y11J001D米色汽车饰...,苏宁,艺芙蓉1004006004,汽车摩托|内饰精品|颈枕、头枕,靓莱雅 高档汽车头枕 丹尼皮车用颈枕*2 新福克斯骊威骊威车饰用品 灰色,汽车用品 > 汽车内饰,亚马逊(卓越网),靓莱雅1004006004,汽车摩托|内饰精品|颈枕、头枕,淇淇 车用骨头枕护颈枕车枕头头枕 汽车用品颈枕头枕 黑色,汽车用品>内饰精品>抱枕/腰靠>淇淇>淇淇 车用骨头枕护颈枕车枕头头枕 汽车用...,京东商城,在舟车品专营店1004006004,汽车摩托|内饰精品|颈枕、头枕,MCAR 夏季冰丝汽车用头枕护颈枕 对装 金色一对,汽车用品>汽车装饰>头枕腰靠>MACR >MCAR 夏季冰丝汽车用头枕护颈枕 对装...,京东商城,励天励行车品店1004006004,汽车摩托|内饰精品|颈枕、头枕,魔焕 汽车内饰 抱枕靠枕 头枕 颈枕 超纤皮革 四件套,其它>魔焕 汽车内饰 抱枕靠枕 头枕 颈枕 超...,京东商城,魔焕旗舰店1004006004,汽车摩托|内饰精品|颈枕、头枕,香车纺 高级汽车座垫搭配颈枕/头枕 (一对装) 限量限区超级特价 英伦灰,汽车用品>汽车装饰>头枕腰靠>其它>香车纺 高级汽车座垫搭配颈枕/头枕 (一...,京东商城,新能量汽车用品专营店1004006004,汽车摩托|内饰精品|颈枕、头枕,【金秋风暴】奥特莱芙 太空竹炭记忆棉U型枕 多功能颈枕 米色,汽车用品>内饰精品>颈枕/头枕>【金秋风暴】奥特莱芙 太空竹炭记忆棉U型...,京东商城,奥特莱芙旗舰店1004006004,汽车摩托|内饰精品|颈枕、头枕,魅驹 汽车颈枕 皮革全打孔 车用头枕 汽车用品护颈枕 对装,汽车用品>汽车装饰>头枕腰靠>魅驹（MEIJU） >魅驹 汽车颈枕 皮革全打孔 车用头枕 汽...,京东商城,魅驹车品旗舰店1004006004,汽车摩托|内饰精品|颈枕、头枕,Sleepezbedz睡眠易汽车用品汽车头枕护颈枕车用头枕汽车靠枕骨头枕,家居家装>家纺>枕芯枕套>睡眠易>Sleepezbedz睡眠易汽车用品汽车...,京东商城,1004006004,汽车摩托|内饰精品|颈枕、头枕,爱思优威汽车内饰颈枕布艺骨形颈枕一对 灰色,汽车用品>内饰精品>颈枕/头枕>爱思优威（SUV）>爱思优威汽车内饰颈枕布艺骨形颈枕一对 灰...,京东商城,美斯优唐汽车用品专营店1004006004,汽车摩托|内饰精品|颈枕、头枕,腰宝宝 汽车真皮颈枕 头枕 靠枕 太空记忆棉 车用 马鞍棕-蝴蝶款,汽车用品>汽车装饰>头枕腰靠>腰宝宝>腰宝宝 汽车真皮颈枕 头枕 靠枕 太空记...,京东商城,易车车品专营店1004006004,汽车摩托|内饰精品|颈枕、头枕,摩丝娃娃 中国红（红80后经典）单只 卡通造型车用头枕,汽车用品>内饰精品>颈枕/头枕>摩丝娃娃 中国红（红80后经典）单只 卡...,京东商城,1004006004,汽车摩托|内饰精品|颈枕、头枕,美每车 汽车用品 卡通毛绒靠枕 颈枕 可爱熊猫头枕 (一个装),汽车用品 > 汽车内饰 > 头枕 ,亚马逊(卓越网),美每车1004006004,汽车摩托|内饰精品|颈枕、头枕,Crusader 科赛德 CD-927 豪华超纤皮颈枕腰靠四件套,汽车用品 > 汽车内饰 > 车用腰靠,亚马逊(卓越网),Crusader 科赛德1004006004,汽车摩托|内饰精品|颈枕、头枕,Crusader 科赛德 CD-932 豪华超纤皮颈枕腰靠四件套,汽车用品 > 汽车内饰 > 车用腰靠,亚马逊(卓越网),Crusader 科赛德1004006004,汽车摩托|内饰精品|颈枕、头枕,Crusader 科赛德 CD-933 豪华超纤皮颈枕腰靠四件套,汽车用品 > 汽车内饰 > 车用腰靠,亚马逊(卓越网),Crusader 科赛德1004006004,汽车摩托|内饰精品|颈枕、头枕,Crusader 科赛德 CD-767 豪华超纤皮颈枕腰靠四件套,汽车用品 > 汽车内饰 > 车用腰靠,亚马逊(卓越网),Crusader 科赛德1004006004,汽车摩托|内饰精品|颈枕、头枕,Crusader 科赛德 CD-1396 豪华超纤皮颈枕腰靠四件套,汽车用品 > 汽车内饰 > 车用腰靠,亚马逊(卓越网),Crusader 科赛德1004006004,汽车摩托|内饰精品|颈枕、头枕,Crusader 科赛德 CD-606 豪华超纤皮颈枕腰靠四件套,汽车用品 > 汽车内饰 > 车用腰靠,亚马逊(卓越网),Crusader 科赛德1004006004,汽车摩托|内饰精品|颈枕、头枕,Crusader 科赛德 CD-677 豪华超纤皮颈枕腰靠四件套,汽车用品 > 汽车内饰 > 车用腰靠,亚马逊(卓越网),Crusader 科赛德1004006004,汽车摩托|内饰精品|颈枕、头枕,Crusader 科赛德 CD-554 豪华超纤皮颈枕腰靠四件套,汽车用品 > 汽车内饰 > 车用腰靠,亚马逊(卓越网),Crusader 科赛德1004006004,汽车摩托|内饰精品|颈枕、头枕,Crusader 科赛德 CD-640 豪华超纤皮颈枕腰靠四件套,汽车用品 > 汽车内饰 > 车用腰靠,亚马逊(卓越网),Crusader 科赛德1004006004,汽车摩托|内饰精品|颈枕、头枕,Crusader 科赛德 CD-883 豪华超纤皮颈枕腰靠四件套,汽车用品 > 汽车内饰 > 车用腰靠,亚马逊(卓越网),Crusader 科赛德1004006004,汽车摩托|内饰精品|颈枕、头枕,Crusader 科赛德 CD-708 豪华超纤皮颈枕腰靠四件套,汽车用品 > 汽车内饰 > 车用腰靠,亚马逊(卓越网),Crusader 科赛德1004006004,汽车摩托|内饰精品|颈枕、头枕,Crusader 科赛德 CD-864 豪华超纤皮颈枕腰靠四件套,汽车用品 > 汽车内饰 > 车用腰靠,亚马逊(卓越网),Crusader 科赛德1004006004,汽车摩托|内饰精品|颈枕、头枕,Crusader 科赛德 CD-940 豪华超纤皮颈枕腰靠四件套,汽车用品 > 汽车内饰 > 车用腰靠,亚马逊(卓越网),Crusader 科赛德1004006004,汽车摩托|内饰精品|颈枕、头枕,Crusader 科赛德 CD-790 豪华超纤皮颈枕腰靠四件套,汽车用品 > 汽车内饰 > 车用腰靠,亚马逊(卓越网),Crusader 科赛德1004006004,汽车摩托|内饰精品|颈枕、头枕,Crusader 科赛德 CD-964 豪华超纤皮颈枕腰靠四件套,汽车用品 > 汽车内饰 > 车用腰靠,亚马逊(卓越网),Crusader 科赛德1004006004,汽车摩托|内饰精品|颈枕、头枕,Crusader 科赛德 CD-721 豪华超纤皮颈枕腰靠四件套,汽车用品 > 汽车内饰 > 车用腰靠,亚马逊(卓越网),Crusader 科赛德1004006004,汽车摩托|内饰精品|颈枕、头枕,Crusader 科赛德 CD-725 豪华超纤皮颈枕腰靠四件套,汽车用品 > 汽车内饰 > 车用腰靠,亚马逊(卓越网),Crusader 科赛德1004006004,汽车摩托|内饰精品|颈枕、头枕,万年骆驼 WF002G竹炭记忆枕汽车头枕护颈枕车用安全头枕骨头颈枕靠枕(土黄色),汽车用品 > 汽车内饰 > 头枕,亚马逊(卓越网),万年骆驼1004006004,汽车摩托|内饰精品|颈枕、头枕,Crusader 科赛德 CD-548 豪华超纤皮颈枕腰靠四件套,汽车用品 > 汽车内饰 > 车用腰靠,亚马逊(卓越网),Crusader 科赛德1004006004,汽车摩托|内饰精品|颈枕、头枕,Crusader 科赛德 CD-618 豪华超纤皮颈枕腰靠四件套,汽车用品 > 汽车内饰 > 车用腰靠,亚马逊(卓越网),Crusader 科赛德1004006004,汽车摩托|内饰精品|颈枕、头枕,Crusader 科赛德 CD-943 豪华超纤皮颈枕腰靠四件套,汽车用品 > 汽车内饰 > 车用腰靠,亚马逊(卓越网),Crusader 科赛德1004006004,汽车摩托|内饰精品|颈枕、头枕,Crusader 科赛德 CD-979 豪华超纤皮颈枕腰靠四件套,汽车用品 > 汽车内饰 > 车用腰靠,亚马逊(卓越网),Crusader 科赛德1004006004,汽车摩托|内饰精品|颈枕、头枕,Crusader 科赛德 CD-702 豪华超纤皮颈枕腰靠四件套,汽车用品 > 汽车内饰 > 车用腰靠,亚马逊(卓越网),Crusader 科赛德1004006004,汽车摩托|内饰精品|颈枕、头枕,Crusader 科赛德 CD-1219 豪华超纤皮颈枕腰靠四件套,汽车用品 > 汽车内饰 > 车用腰靠,亚马逊(卓越网),Crusader 科赛德1004006004,汽车摩托|内饰精品|颈枕、头枕,Crusader 科赛德 CD-1081 豪华超纤皮颈枕腰靠四件套,汽车用品 > 汽车内饰 > 车用腰靠,亚马逊(卓越网),Crusader 科赛德1004006004,汽车摩托|内饰精品|颈枕、头枕,Crusader 科赛德 CD-1124 豪华超纤皮颈枕腰靠四件套,汽车用品 > 汽车内饰 > 车用腰靠,亚马逊(卓越网),Crusader 科赛德1004006004,汽车摩托|内饰精品|颈枕、头枕,Crusader 科赛德 CD-1027 豪华超纤皮颈枕腰靠四件套,汽车用品 > 汽车内饰 > 车用腰靠,亚马逊(卓越网),Crusader 科赛德1004006004,汽车摩托|内饰精品|颈枕、头枕,Crusader 科赛德 CD-596 豪华超纤皮颈枕腰靠四件套,汽车用品 > 汽车内饰 > 车用腰靠,亚马逊(卓越网),Crusader 科赛德1004006004,汽车摩托|内饰精品|颈枕、头枕,Crusader 科赛德 CD-731 豪华超纤皮颈枕腰靠四件套,汽车用品 > 汽车内饰 > 车用腰靠,亚马逊(卓越网),Crusader 科赛德1004006004,汽车摩托|内饰精品|颈枕、头枕,Crusader 科赛德 CD-1263 豪华超纤皮颈枕腰靠四件套,汽车用品 > 汽车内饰 > 车用腰靠,亚马逊(卓越网),Crusader 科赛德1004006004,汽车摩托|内饰精品|颈枕、头枕,Crusader 科赛德 CD-1084 豪华超纤皮颈枕腰靠四件套,汽车用品 > 汽车内饰 > 车用腰靠,亚马逊(卓越网),Crusader 科赛德1004006004,汽车摩托|内饰精品|颈枕、头枕,Crusader 科赛德 CD-1155 豪华超纤皮颈枕腰靠四件套,汽车用品 > 汽车内饰 > 车用腰靠,亚马逊(卓越网),Crusader 科赛德1004006004,汽车摩托|内饰精品|颈枕、头枕,Crusader 科赛德 CD-533 豪华超纤皮颈枕腰靠四件套,汽车用品 > 汽车内饰 > 车用腰靠,亚马逊(卓越网),Crusader 科赛德1004006004,汽车摩托|内饰精品|颈枕、头枕,Crusader 科赛德 CD-1249 豪华超纤皮颈枕腰靠四件套,汽车用品 > 汽车内饰 > 车用腰靠,亚马逊(卓越网),Crusader 科赛德1004006004,汽车摩托|内饰精品|颈枕、头枕,Crusader 科赛德 CD-536 豪华超纤皮颈枕腰靠四件套,汽车用品 > 汽车内饰 > 车用腰靠,亚马逊(卓越网),Crusader 科赛德1004006004,汽车摩托|内饰精品|颈枕、头枕,Crusader 科赛德 CD-635 豪华超纤皮颈枕腰靠四件套,汽车用品 > 汽车内饰 > 车用腰靠,亚马逊(卓越网),Crusader 科赛德1004006004,汽车摩托|内饰精品|颈枕、头枕,Crusader 科赛德 CD-1170 豪华超纤皮颈枕腰靠四件套,汽车用品 > 汽车内饰 > 车用腰靠,亚马逊(卓越网),Crusader 科赛德1004006004,汽车摩托|内饰精品|颈枕、头枕,Crusader 科赛德 CD-1057 豪华超纤皮颈枕腰靠四件套,汽车用品 > 汽车内饰 > 车用腰靠,亚马逊(卓越网),Crusader 科赛德1004006004,汽车摩托|内饰精品|颈枕、头枕,浩优 汽车四季通用靠枕 头枕 护颈枕车用骨头枕头靠 对装 卡其色,汽车用品 > 汽车内饰 > 头枕,亚马逊(卓越网),浩优1004006004,汽车摩托|内饰精品|颈枕、头枕,Crusader 科赛德 CD-1348 豪华超纤皮颈枕腰靠四件套,汽车用品 > 汽车内饰 > 车用腰靠,亚马逊(卓越网),Crusader 科赛德1004006004,汽车摩托|内饰精品|颈枕、头枕,Crusader 科赛德 CD-1043 豪华超纤皮颈枕腰靠四件套,汽车用品 > 汽车内饰 > 车用腰靠,亚马逊(卓越网),Crusader 科赛德1004006004,汽车摩托|内饰精品|颈枕、头枕,Crusader 科赛德 CD-1334 豪华超纤皮颈枕腰靠四件套,汽车用品 > 汽车内饰 > 车用腰靠,亚马逊(卓越网),Crusader 科赛德1004006004,汽车摩托|内饰精品|颈枕、头枕,Crusader 科赛德 CD-698 豪华超纤皮颈枕腰靠四件套,汽车用品 > 汽车内饰 > 车用腰靠,亚马逊(卓越网),Crusader 科赛德1004006004,汽车摩托|内饰精品|颈枕、头枕,Crusader 科赛德 CD-1034 豪华超纤皮颈枕腰靠四件套,汽车用品 > 汽车内饰 > 车用腰靠,亚马逊(卓越网),Crusader 科赛德1004006004,汽车摩托|内饰精品|颈枕、头枕,Crusader 科赛德 CD-748 豪华超纤皮颈枕腰靠四件套,汽车用品 > 汽车内饰 > 车用腰靠,亚马逊(卓越网),Crusader 科赛德1004006004,汽车摩托|内饰精品|颈枕、头枕,Crusader 科赛德 CD-1111 豪华超纤皮颈枕腰靠四件套,汽车用品 > 汽车内饰 > 车用腰靠,亚马逊(卓越网),Crusader 科赛德1004006004,汽车摩托|内饰精品|颈枕、头枕,Crusader 科赛德 CD-622 豪华超纤皮颈枕腰靠四件套,汽车用品 > 汽车内饰 > 车用腰靠,亚马逊(卓越网),Crusader 科赛德1004006004,汽车摩托|内饰精品|颈枕、头枕,CarSetCity 卡饰社 车用舒适头枕腰靠 套装 红色格纹,首页 > 汽车用品 > 颈枕/腰靠 > CARSETCITY 卡饰社 > 产品编号: A0S-0M8-1C1,新蛋商城,CARSETCITY 卡饰社1004006004,汽车摩托|内饰精品|颈枕、头枕,万年骆驼 汽车抱枕空调被 车用抱枕被 多用抱枕 商务空调被灰,汽车用品 > 汽车内饰 > 头枕,亚马逊(卓越网),万年骆驼1004006004,汽车摩托|内饰精品|颈枕、头枕,GiGi 吉吉 太空记忆棉 提花面料 立体骨头枕护颈枕G-1206 (黑色),汽车用品 > 汽车内饰 > 头枕,亚马逊(卓越网),GiGi 吉吉1004006004,汽车摩托|内饰精品|颈枕、头枕,万年骆驼 汽车抱枕空调被 车用抱枕被 多用抱枕 商务抱枕米,汽车用品 > 汽车内饰 > 头枕,亚马逊(卓越网),万年骆驼1004006004,汽车摩托|内饰精品|颈枕、头枕,GiGi 吉吉 太空记忆棉 舒适护经济型头枕 G-1303 (卡其色),汽车用品 > 汽车内饰 > 头枕,亚马逊(卓越网),GiGi 吉吉1004006004,汽车摩托|内饰精品|颈枕、头枕,GiGi 吉吉 竹炭记忆棉 U型护颈枕 自驾游头枕 G-1223 (米色),汽车用品 > 汽车内饰 > 头枕,亚马逊(卓越网),GiGi 吉吉1004006004,汽车摩托|内饰精品|颈枕、头枕,GiGi 吉吉 太空记忆棉 骨头枕护颈枕靠枕 G-1063 (米色),汽车用品 > 汽车内饰 > 头枕,亚马逊(卓越网),GiGi 吉吉1004006004,汽车摩托|内饰精品|颈枕、头枕,Coola&Diffe 酷拉·蒂菲1113 汽车用品内饰 骨头枕 颈枕 一对装 可爱卡通简约商务,汽车用品 > 汽车内饰 > 头枕,亚马逊(卓越网),Coola&Diffe 酷拉·蒂菲1004006004,汽车摩托|内饰精品|颈枕、头枕,Coola&Diffe 酷拉·蒂菲1504 汽车用品内饰 骨头枕 颈枕 一对装 可爱卡通简约商务,汽车用品 > 汽车内饰 > 头枕,亚马逊(卓越网),Coola&Diffe 酷拉·蒂菲1004006004,汽车摩托|内饰精品|颈枕、头枕,原创2013热卖汽车头枕骨头枕护颈枕 车用短绒靠枕卡通可爱,汽车用品 > 汽车美容 > 擦车巾/海绵 > 商品详情,当当网,酷玛传奇1004006004,汽车摩托|内饰精品|颈枕、头枕,正品!WRC/汽车护颈枕/车用头枕/四季多功能骨头靠枕/绣标头枕,汽车用品 > 车饰精品 > 车内饰品,当当网,WRC1004006004,汽车摩托|内饰精品|颈枕、头枕,正品！吉吉 GiGi 太空记忆棉弓形头枕 车用头枕 车用颈枕 四季通用,汽车用品 > 车饰精品 > 车内饰品 > 商品详情,当当网,吉吉1004006004,汽车摩托|内饰精品|颈枕、头枕,ICAROOM 爱车屋 专 车用骨头枕头枕 颈枕对装I-100F灰头枕颈枕车用汽车颈枕,汽车用品 > 汽车内饰 > 头枕,亚马逊(卓越网),ICAROOM 爱车屋1004006004,汽车摩托|内饰精品|颈枕、头枕,ICAROOM 爱车屋 丽丽绒灰色系 车用U型枕U枕睡觉枕午睡U枕I-326U,汽车用品 > 汽车内饰 > 头枕,亚马逊(卓越网),ICAROOM 爱车屋1004006004,汽车摩托|内饰精品|颈枕、头枕,美丽绸 舒适抱枕 汽车车用抱枕 靠枕 （对装） 米色,汽车用品>汽车装饰>头枕腰靠>一剪梅>美丽绸 舒适抱枕 汽车车用抱枕 靠枕 （...,京东商城,铠翼汽车用品专营店1004006004,汽车摩托|内饰精品|颈枕、头枕,腰宝宝 宝乘 汽车头枕 护颈枕 表面100%真皮材质 汽车靠枕颈枕 车用车枕头骨头枕,所有分类>大小家电、厨电、汽车>汽车生活>汽车内饰>抱枕靠枕>腰宝宝,1号店,抱枕靠枕1004006004,汽车摩托|内饰精品|颈枕、头枕,威卡司 舒适抱枕va-m004,汽车用品>头枕/颈枕/抱枕>威卡司>威卡司 舒适抱枕va-m004,国美电器网上商城,协众车品专营店1004006004,汽车摩托|内饰精品|颈枕、头枕,咔噜噜 帐猫老师汽车护颈枕 汽车头枕 毛绒玩具,所有分类>大小家电、厨电、汽车>汽车生活>座垫脚垫>多功能垫>咔噜噜>咔噜噜 帐猫老师汽车...,1号店,咔噜噜1004006004,汽车摩托|内饰精品|颈枕、头枕,CARARTS車雅風 汽车茶香枕抱枕靠枕 汽车枕腰垫　汽车内饰　健康茶枕 护颈枕 骨头枕CA-3170,所有分类>大小家电、厨电、汽车>汽车生活>汽车内饰>抱枕靠枕>CARARTS車雅風>CARARTS車雅風...,1号店,CARARTS車雅風1004006004,汽车摩托|内饰精品|颈枕、头枕,福客思 竹炭太空记忆棉汽车用头枕颈枕护颈枕 车家两用 颈部弧形设计 单只 舒适颈枕,所有分类>大小家电、厨电、汽车>汽车生活>汽车内饰>抱枕靠枕>福客思>福客思 竹炭太空记忆...,1号店,福客思1004006004,汽车摩托|内饰精品|颈枕、头枕,Rzm日滋美 全皮革汽车 安全护颈枕 车用头枕 一对装(公爵米),生活电器、汽车生活>汽车生活>车饰精品>抱枕靠枕>Rzm日滋美,1号店,Rzm日滋美1004006004,汽车摩托|内饰精品|颈枕、头枕,文博 居家车用 骨头枕 汽车头枕靠垫 保健颈枕,家居家装>家装软饰>其他>文博>文博 居家车用 骨头枕 汽车头枕靠垫 保...,京东商城,来此购生活馆1004006004,汽车摩托|内饰精品|颈枕、头枕,scx 汽车头枕对装 车用靠枕护颈枕四季车枕头骨头枕汽车内饰用品 决明子米色一对,汽车用品 > 汽车内饰 > 车用腰靠,亚马逊(卓越网),SCX1004006004,汽车摩托|内饰精品|颈枕、头枕,纳雪莱 车用靠枕颈枕 佰仕达真皮汽车头枕护颈枕头 可爱骨头枕车饰品 米色,汽车用品 > 汽车内饰 > 头枕,亚马逊(卓越网),纳雪莱1004006004,汽车摩托|内饰精品|颈枕、头枕,ii 熊猫汽车头枕 可爱卡通护颈枕 车枕 车用腰靠垫 抱枕 汽车用品 微笑爱心脸头枕,汽车用品 > 汽车内饰 > 头枕,亚马逊(卓越网),ii1004006004,汽车摩托|内饰精品|颈枕、头枕,ii 汽车头枕 车饰用品 车用护颈枕 车居两用单只装 可爱透气夏季清凉 米黄色车居两用单支装,汽车用品 > 汽车内饰 > 车用腰靠,亚马逊(卓越网),ii1004006004,汽车摩托|内饰精品|颈枕、头枕,ii 记忆棉 汽车头枕 车用头靠枕 颈椎车枕护颈枕 汽车用品 专供三防+记忆棉/杏色,汽车用品 > 汽车内饰 > 头枕,亚马逊(卓越网),ii1004006004,汽车摩托|内饰精品|颈枕、头枕,ii 记忆棉汽车用品汽车头枕 护颈枕汽车靠枕车枕 四季车用头枕 灰色1个29/2个49,汽车用品 > 汽车内饰 > 头枕,亚马逊(卓越网),ii1004006004,汽车摩托|内饰精品|颈枕、头枕,单车岁月 汽车头枕 太空记忆棉颈枕 护颈枕头 汽车用品 车用骨头枕 sports款 单个装 ,生活电器、汽车生活>汽车生活>车饰精品>抱枕靠枕>单车岁月,1号店,单车岁月1004006004,汽车摩托|内饰精品|颈枕、头枕,FREEMAN自由人 透气 不变形 双珠地 太空记忆棉 舒适头枕 头枕 颈枕 车用,所有分类>大小家电、厨电、汽车>汽车生活>汽车内饰>其它精品>FREEMAN自由人>FREEMAN自由人...,1号店,FREEMAN自由人1004006004,汽车摩托|内饰精品|颈枕、头枕,酷玛传奇 车用头枕可爱 淇淇骨头枕情侣靠枕 汽车头枕 护颈枕 汽车颈枕对装,所有分类>大小家电、厨电、汽车>汽车生活>汽车内饰>抱枕靠枕>酷玛传奇>酷玛传奇 车用头枕可...,1号店,酷玛传奇1004006004,汽车摩托|内饰精品|颈枕、头枕,变形金刚 汽车头枕靠枕 护颈枕 正品汽车用品对枕汽车内饰 一对装 威震天一对,变形金刚（Transformers）>变形金刚 汽车头枕靠枕 护颈枕 正品汽车...,京东商城,驰众汽车用品专营店1004006004,汽车摩托|内饰精品|颈枕、头枕,品尚车居 太空棉汽车头枕 汽车颈枕 汽车护颈枕 汽车骨头枕 单个装 简爱,品尚车居>品尚车居 太空棉汽车头枕 汽车颈枕 汽车...,京东商城,广州信雅1004006004,汽车摩托|内饰精品|颈枕、头枕,卡饰社（CarSetCity）进口超纤皮 车用舒适腰靠/头枕 苏格兰风格 舒适汽车颈枕 白线格腰靠,汽车用品>内饰精品>颈枕/头枕>卡饰社>卡饰社（CarSetCity）进口超纤皮...,京东商城,耐实达京东专卖店1004006004,汽车摩托|内饰精品|颈枕、头枕,酷玛传奇天然乳胶车用头枕 汽车护颈枕 汽车头枕 单个,汽车用品>内饰精品>颈枕/头枕>其他>酷玛传奇天然乳胶车用头枕 汽车护颈枕 汽...,京东商城,酷玛传奇官方旗舰店1004006004,汽车摩托|内饰精品|颈枕、头枕,【支持货到付款】韩国WINE车用家用办公室用时尚舒适头颈枕AW-02 一对装 冰白,汽车用品>内饰精品>颈枕/头枕>WINE>【支持货到付款】韩国WINE车用家用办公...,京东商城,安道车品专营店1004006004,汽车摩托|内饰精品|颈枕、头枕,香车纺 高级汽车座垫搭配颈枕/头枕 (一对装) 限量限区超级特价 米棕色,汽车用品>汽车装饰>头枕腰靠>其它>香车纺 高级汽车座垫搭配颈枕/头枕 (一...,京东商城,新能量汽车用品专营店1004006004,汽车摩托|内饰精品|颈枕、头枕,天盾 新款时尚 汽车用品必备汽车头枕 护颈枕车饰枕头靠枕颈椎枕 TZ001 熊腰靠2,汽车用品>汽车装饰>头枕腰靠>天盾（Targe）>天盾 新款时尚 汽车用品必备汽车头枕 护...,京东商城,佳合车品专营店1004006004,汽车摩托|内饰精品|颈枕、头枕,自由人 太空记忆棉汽车至尊护颈枕骨头车枕 抱枕腰靠垫背套装汽车用品家用办公用 至尊头枕-米白色,自由人>自由人 太空记忆棉汽车至尊护颈枕骨头车枕...,京东商城,车泓车品1004006004,汽车摩托|内饰精品|颈枕、头枕,新族（SOJOY） SJ3012 按摩网靠 透气汽车腰靠 高低档按摩 清凉透气 家用办公用 绿色,汽车用品>汽车装饰>头枕腰靠>新族>新族SJ3012,京东商城,新族1004006004,汽车摩托|内饰精品|颈枕、头枕,【京东自营】GiGi 太空记忆棉行车头枕 汽车用颈枕靠枕 对装 杏色 G-1107,汽车用品>汽车装饰>头枕腰靠>GiGi>吉吉G-1107杏色（2个）,京东商城,GiGi