1004006005,汽车摩托|内饰精品|抱枕、腰靠,自由人 双珠地太空记忆棉三维腰靠 839(4443)   ,汽车用品>汽车内饰>抱枕腰靠>自由人 双珠地太空记忆棉三维腰靠 839(4443)   ,为为网,自由人1004006005,汽车摩托|内饰精品|抱枕、腰靠,GiGi/吉吉 太空记忆棉腰枕 工形腰枕 1067 (灰色),汽车用品 > 汽车内饰 > 车用腰靠,亚马逊(卓越网),GiGi 吉吉1004006005,汽车摩托|内饰精品|抱枕、腰靠,GiGi 竹炭记忆棉人体工程腰靠 G-1224 (黑色),汽车用品 > 汽车内饰 > 车用腰靠,亚马逊(卓越网),GiGi1004006005,汽车摩托|内饰精品|抱枕、腰靠,GiGi 太空记忆棉拥抱型腰靠 腰枕 靠背 G-1209 (杏色),汽车用品 > 汽车内饰 > 车用腰靠,亚马逊(卓越网),GiGi1004006005,汽车摩托|内饰精品|抱枕、腰靠,驭美达 记忆棉圆头大腰靠 车用腰靠 车用靠垫 汽车腰枕 赠品(随机),汽车用品>内饰精品>抱枕/腰靠>御指环>驭美达 记忆棉圆头大腰靠 车用腰靠 车用...,京东商城,翱途车品专营店1004006005,汽车摩托|内饰精品|抱枕、腰靠,SEBTER 帅贝特 按摩垫靠垫带揉捏 SBT-003,汽车用品 > 汽车内饰 > 车用腰靠,亚马逊(卓越网),SEBTER 帅贝特1004006005,汽车摩托|内饰精品|抱枕、腰靠,GiGi 吉吉 竹炭记忆棉至尊腰靠 G1227 (杏色),汽车用品 > 汽车内饰 > 车用腰靠,亚马逊(卓越网),GiGi 吉吉1004006005,汽车摩托|内饰精品|抱枕、腰靠,酷拉蒂菲[cooladiffe]1630 汽车太空记忆棉腰靠 慢反弹腰垫枕 简约商务灰色,汽车用品>内饰精品>抱枕/腰靠>酷拉蒂菲[cooladiffe]1630...,京东商城,恺美车品专营店1004006005,汽车摩托|内饰精品|抱枕、腰靠,ICAROOM 爱车屋 太空棉系列 记忆棉倍贴腰枕/汽车腰枕/车用腰靠I-009A,汽车用品 > 汽车内饰 > 车用腰靠,亚马逊(卓越网),ICAROOM 爱车屋1004006005,汽车摩托|内饰精品|抱枕、腰靠,ICAROOM 爱车屋 泥巴卡通狗 舒适腰枕腰靠汽车靠垫 NB-009KT,汽车用品 > 汽车内饰 > 车用腰靠,亚马逊(卓越网),ICAROOM 爱车屋1004006005,汽车摩托|内饰精品|抱枕、腰靠,淇淇 汽车用品腰靠抱枕车用靠垫头枕 可爱靠背抱枕对装,汽车用品>内饰精品>抱枕/腰靠>淇淇>淇淇 汽车用品腰靠抱枕车用靠垫头枕 可爱...,京东商城,在舟车品专营店1004006005,汽车摩托|内饰精品|抱枕、腰靠,JACKDODO 吉客多多 太空记忆棉收身腰靠JD-1305黑色,汽车用品 > 汽车内饰 > 车用腰靠,亚马逊(卓越网),JACKDODO 吉客多多1004006005,汽车摩托|内饰精品|抱枕、腰靠,GiGi 吉吉 太空记忆棉 卡通汽车腰靠腰枕办公室腰垫 G-W111 (咖啡色+白色),汽车用品 > 汽车内饰 > 车用腰靠,亚马逊(卓越网),GiGi 吉吉1004006005,汽车摩托|内饰精品|抱枕、腰靠,GiGi 吉吉 竹炭记忆棉 汽车腰靠腰枕办公室腰垫 G-1224 (灰色),汽车用品 > 汽车内饰 > 车用腰靠,亚马逊(卓越网),GiGi 吉吉1004006005,汽车摩托|内饰精品|抱枕、腰靠,威利 腰靠 跨界之旅(记忆棉 X线款 棕色)对装 40020503,汽车用品 > 汽车内饰 > 车用腰靠,亚马逊(卓越网),WELLY 威利1004006005,汽车摩托|内饰精品|抱枕、腰靠,QiQi 淇淇 汽车内饰用品汽车腰靠 正品淇淇记忆棉护腰靠垫 汽车纯棉靠垫 黑色,汽车用品 > 汽车内饰 > 车用腰靠,亚马逊(卓越网),QiQi 淇淇1004006005,汽车摩托|内饰精品|抱枕、腰靠,Freeman 自由人 记忆棉汽车腰靠头枕至尊版套装(灰色 腰靠垫*1+头枕*1),汽车用品 > 汽车内饰 > 车用腰靠,亚马逊(卓越网),FREEMAN 自由人1004006005,汽车摩托|内饰精品|抱枕、腰靠,美车仔 摩丝娃娃正品车用枕头汽车用品抱枕汽车抱枕腰靠垫 创意可爱卡通 玫红,汽车用品 > 汽车内饰 > 车用腰靠,亚马逊(卓越网),美车仔1004006005,汽车摩托|内饰精品|抱枕、腰靠,铁臂阿童木超纤皮高档商务慢回弹颗粒记忆棉汽车腰靠 护腰靠垫腰垫 对装 棕色,首页>汽车用品>内饰精品>抱枕/腰靠>铁臂阿童木超纤皮高档商务慢回弹颗粒记...,苏宁,1004006005,汽车摩托|内饰精品|抱枕、腰靠,【货到付款】安美弛 维邦粒子呢汽车腰靠 慢回弹记忆棉靠垫 车用腰靠 W029 米色 单个装,汽车用品>内饰精品>抱枕/腰靠>安美弛>【货到付款】安美弛 维邦粒子呢汽车腰靠 ...,京东商城,安美弛车品汇1004006005,汽车摩托|内饰精品|抱枕、腰靠,五福金牛四吉牛汽车内饰腰枕记忆腰靠垫汽车腰靠 黄色,汽车用品>汽车装饰>头枕腰靠>五福金牛>五福金牛四吉牛汽车内饰腰枕记忆腰靠垫汽车...,京东商城,车尚品专营店1004006005,汽车摩托|内饰精品|抱枕、腰靠,【京东自营】铁臂阿童木 汽车抱枕 车用护腰枕靠背垫 卡通灰黑 BZDP-01G,首页 >精品装饰 >头枕/抱枕/腰靠 >铁臂阿童木（Astro Boy） >BZDP-01G,易迅网,1004006005,汽车摩托|内饰精品|抱枕、腰靠,卡里努努(carinono)兔子 汽车腰靠 腰枕 卡通汽车靠垫 可爱车用靠背 免邮 单只,汽车用品 > 车饰精品 > 车内饰品 > 卡里努努(carinono)兔子 汽车腰靠 腰枕 卡通汽车靠垫 可爱车用靠...,当当网,卡里努努1004006005,汽车摩托|内饰精品|抱枕、腰靠,GiGi 太空记忆棉拥抱型腰枕 腰靠 G-1068 (灰色),汽车用品 > 汽车内饰 > 车用腰靠,亚马逊(卓越网),GiGi1004006005,汽车摩托|内饰精品|抱枕、腰靠,GiGi太空记忆棉人体工程腰枕 G-020靠背 腰靠吉吉020腰靠,汽车用品 > 汽车内饰 > 车用腰靠,亚马逊(卓越网),GiGi1004006005,汽车摩托|内饰精品|抱枕、腰靠,Fourtune 富程 超柔软 汽车靠垫腰靠 爱心抱枕 可爱汽车抱枕 单只装 咖啡色 35CM*35CM*12CM,汽车用品/类别/汽车内饰/车用腰靠,亚马逊(卓越网),Fourtune 富程1004006005,汽车摩托|内饰精品|抱枕、腰靠,GiGi 吉吉太空记忆棉至尊腰靠 G-1110 (灰色),汽车用品 > 汽车内饰 > 车用腰靠,亚马逊(卓越网),GiGi 吉吉1004006005,汽车摩托|内饰精品|抱枕、腰靠,GiGi/吉吉 太空记忆棉汽车护椎小腰靠 车用腰靠 腰枕 靠背 G-1109 (黑色),汽车用品 > 汽车内饰 > 车用腰靠,亚马逊(卓越网),GiGi 吉吉1004006005,汽车摩托|内饰精品|抱枕、腰靠,ESSEHOM 艾仕玛 高档记忆棉 3D多色汽车靠垫 豪华版 多色 es030 (浅灰色),家居 > 床上用品 > 抱枕靠垫 汽车用品 > 汽车内饰 > 车用腰靠,亚马逊(卓越网),ESSEHOM 艾仕玛1004006005,汽车摩托|内饰精品|抱枕、腰靠,万年骆驼 WFOO4C竹炭记忆棉减压腰靠汽车腰靠车用护腰靠垫驾驶安全靠背(黑色),汽车用品 > 汽车内饰 > 车用腰靠,亚马逊(卓越网),万年骆驼1004006005,汽车摩托|内饰精品|抱枕、腰靠,GiGi 吉吉 太空记忆棉 汽车腰靠腰枕办公室腰垫 G-1066 (米色),汽车用品 > 汽车内饰 > 车用腰靠,亚马逊(卓越网),GiGi 吉吉1004006005,汽车摩托|内饰精品|抱枕、腰靠,AYA 摩丝娃娃汽车按摩腰靠垫 腰枕 靠垫背垫 记忆棉车用腰靠 (粉色记忆棉腰靠),汽车用品 > 汽车内饰 > 汽车挂件、摆饰 ,亚马逊(卓越网),AYA1004006005,汽车摩托|内饰精品|抱枕、腰靠,Ulion 尤龙 太空记忆棉腰靠 米色,汽车用品 > 汽车内饰 > 车用腰靠,亚马逊(卓越网),Ulion 尤龙1004006005,汽车摩托|内饰精品|抱枕、腰靠,Ulion 尤龙 太空记忆棉腰靠 蓝色,汽车用品 > 汽车内饰 > 车用腰靠,亚马逊(卓越网),Ulion 尤龙1004006005,汽车摩托|内饰精品|抱枕、腰靠,QiQi 淇淇 汽车内饰用品汽车腰靠 正品淇淇记忆棉护腰靠垫 汽车纯棉靠垫 灰色,汽车用品 > 汽车内饰 > 车用腰靠,亚马逊(卓越网),QiQi 淇淇1004006005,汽车摩托|内饰精品|抱枕、腰靠,GiGi 正品吉吉GiGi 太空记忆棉至尊腰靠汽车腰靠 办公车用腰靠 护腰枕,汽车用品 > 汽车内饰 > 车用腰靠,亚马逊(卓越网),GiGi1004006005,汽车摩托|内饰精品|抱枕、腰靠,GiGi 特价 GiGi/吉吉记忆棉拥抱型腰枕G-1068车用腰靠背垫 正品热卖 (黑色(单个)),汽车用品 > 汽车内饰 > 车用腰靠,亚马逊(卓越网),GiGi1004006005,汽车摩托|内饰精品|抱枕、腰靠,Bafa 八发 梦幻星空系列BF12-XK11M 超柔面料 记忆棉填充 尺寸38*38cm 贴背腰靠 米色,汽车用品 > 汽车内饰 > 车用腰靠,亚马逊(卓越网),Bafa 八发1004006005,汽车摩托|内饰精品|抱枕、腰靠,万年骆驼WF016活性炭记忆棉经典肾宝腰靠汽车腰靠车用护腰靠垫 灰色,首页>汽车用品>内饰精品>抱枕/腰靠>万年骆驼WF016活性炭记忆棉经典肾...,苏宁,万年骆驼1004006005,汽车摩托|内饰精品|抱枕、腰靠,电动 汽车按摩腰靠 汽车护腰靠垫 网孔腰靠 腰垫 汽车腰靠,汽车用品>内饰精品>抱枕/腰靠>致星>电动 汽车按摩腰靠 汽车护腰靠垫 网孔腰...,京东商城,晋致汽车用品专营店1004006005,汽车摩托|内饰精品|抱枕、腰靠,汽车用品汽车腰靠吉吉GIGI竹碳记忆棉腰枕靠垫腰托护腰G-1227,首页>汽车用品>内饰精品>抱枕/腰靠>汽车用品汽车腰靠吉吉GIGI竹碳记忆...,苏宁,GiGi1004006005,汽车摩托|内饰精品|抱枕、腰靠,WRC男款牛仔裤，如爱车一样，拥有酷帅的外形，优良的材质，完美的性能激情源于梦想，WRC与你一起前行,首页>WRC>牛仔裤,上品折扣,无1004006005,汽车摩托|内饰精品|抱枕、腰靠,新珀 汽车腰靠/记忆棉汽车腰靠汽车靠背腰垫-腰椎家车用靠垫腰靠 米色,汽车用品>汽车装饰>头枕腰靠>新珀>新珀 汽车腰靠/记忆棉汽车腰靠汽车靠背腰...,京东商城,朵赞汽车用品专营店1004006005,汽车摩托|内饰精品|抱枕、腰靠,汽车用品汽车腰靠吉吉GIGI竹碳记忆棉腰枕靠垫腰托护腰G-1227 灰色,首页>汽车用品>内饰精品>抱枕/腰靠>汽车用品汽车腰靠吉吉GIGI竹碳记忆...,苏宁,GiGi1004006005,汽车摩托|内饰精品|抱枕、腰靠,GREAT LIFE GC-051 2只装 车用座椅网眼腰靠 （网状汽车腰枕 汽车靠垫 汽车腰托 除疲劳 ）,汽车用品 > 汽车内饰 > 车用腰靠,亚马逊(卓越网),Great Life 格雷特1004006005,汽车摩托|内饰精品|抱枕、腰靠,GiGi/吉吉 太空记忆棉舒适腰靠 方形腰枕 G-W110 (米+咖),汽车用品 > 汽车内饰 > 车用腰靠,亚马逊(卓越网),GiGi 吉吉1004006005,汽车摩托|内饰精品|抱枕、腰靠,GiGi 竹炭记忆棉至尊要靠 G-1227 (灰色),汽车用品 > 汽车内饰 > 车用腰靠,亚马逊(卓越网),GiGi1004006005,汽车摩托|内饰精品|抱枕、腰靠,GiGi/吉吉 太空记忆棉腰枕 拥抱型汽车靠背 商务车用腰靠G-1209 (灰色),汽车用品 > 汽车内饰 > 车用腰靠,亚马逊(卓越网),GiGi 吉吉1004006005,汽车摩托|内饰精品|抱枕、腰靠,韩国HelloKitty汽车腰靠 卡通腰靠 凯蒂猫腰靠 四季可爱靠垫 (玫红色),汽车用品 > 汽车内饰 > 车用腰靠,亚马逊(卓越网),Hello Kitty1004006005,汽车摩托|内饰精品|抱枕、腰靠,GiGi 竹炭记忆棉汽车护椎腰车用按摩腰靠靠靠垫G1226,汽车用品/类别/汽车内饰/车用腰靠,亚马逊(卓越网),GIGI1004006005,汽车摩托|内饰精品|抱枕、腰靠,麻王 WMJ-001 汽车内饰亚麻 记忆棉腰靠 米色,汽车用品>内饰精品>抱枕/腰靠>麻王>麻王WMJ-001,京东商城,麻王1004006005,汽车摩托|内饰精品|抱枕、腰靠,韩国HelloKitty汽车腰靠 卡通腰靠 凯蒂猫腰靠 四季可爱靠垫 (粉色),汽车用品 > 汽车内饰 > 车用腰靠,亚马逊(卓越网),Hello Kitty1004006005,汽车摩托|内饰精品|抱枕、腰靠,SINBAWA 碳碳 卡通汽车记忆棉按摩腰靠 酒红色,汽车用品>内饰精品>抱枕/腰靠>其它>SINBAWA 碳碳 卡通汽车记忆棉按摩...,京东商城,狼巴克专营店1004006005,汽车摩托|内饰精品|抱枕、腰靠,GiGi 吉吉 竹碳记忆棉 至尊腰靠腰垫护腰枕 G-1227 (黑色),汽车用品 > 汽车内饰 > 车用腰靠,亚马逊(卓越网),GiGi 吉吉1004006005,汽车摩托|内饰精品|抱枕、腰靠,CARCHAD 卡饰得 高级冰丝网眼按摩腰靠 弹性足 手工编织 对装*2个装,汽车用品 > 汽车内饰 > 车用腰靠,亚马逊(卓越网),CARCHAD 卡饰得1004006005,汽车摩托|内饰精品|抱枕、腰靠,AYA 摩丝娃娃汽车按摩腰靠垫 腰枕 靠垫背垫 记忆棉车用腰靠 (红色记忆棉腰靠),汽车用品 > 汽车内饰 > 汽车挂件、摆饰 ,亚马逊(卓越网),AYA1004006005,汽车摩托|内饰精品|抱枕、腰靠,ii 汽车内饰用品头枕腰靠 记忆棉背靠腰垫枕靠背腰靠垫夏季 更多款式请咨询客服MM,汽车用品 > 汽车内饰 > 车用腰靠,亚马逊(卓越网),1004006005,汽车摩托|内饰精品|抱枕、腰靠,GREAT LIFE 格雷特 GLT-125 记忆棉立体腰枕,汽车用品 > 汽车内饰 > 车用腰靠,亚马逊(卓越网),Great Life 格雷特1004006005,汽车摩托|内饰精品|抱枕、腰靠,威利 腰靠 跨界之旅(记忆棉 X线款 米色)对装 40020502,汽车用品 > 汽车内饰 > 车用腰靠,亚马逊(卓越网),WELLY 威利1004006005,汽车摩托|内饰精品|抱枕、腰靠,QiQi 淇淇 汽车内饰用品汽车腰靠 正品淇淇记忆棉护腰靠垫 汽车纯棉靠垫 宝蓝色,汽车用品 > 汽车内饰 > 车用腰靠,亚马逊(卓越网),QiQi 淇淇1004006005,汽车摩托|内饰精品|抱枕、腰靠,QiQi 淇淇 汽车内饰用品汽车腰靠 正品淇淇记忆棉护腰靠垫 汽车纯棉靠垫 橘黄色,汽车用品 > 汽车内饰 > 车用腰靠,亚马逊(卓越网),QiQi 淇淇1004006005,汽车摩托|内饰精品|抱枕、腰靠,达令河 奢华时尚豹纹抱枕 汽车抱枕靠垫靠背腰靠 汽车用品 黑白款单个,汽车用品 > 汽车内饰 > 汽车挂件、摆饰,亚马逊(卓越网),达令河1004006005,汽车摩托|内饰精品|抱枕、腰靠,达令河 奢华时尚豹纹抱枕 汽车抱枕靠垫靠背腰靠 汽车用品 黑金款单个,汽车用品 > 汽车内饰 > 汽车挂件、摆饰,亚马逊(卓越网),达令河1004006005,汽车摩托|内饰精品|抱枕、腰靠,蒙妮妮 汽车按摩颗粒腰靠 汽车腰靠 (粉色),汽车用品 > 汽车内饰 > 车用腰靠,亚马逊(卓越网),蒙妮妮1004006005,汽车摩托|内饰精品|抱枕、腰靠,Freeman 自由人 记忆棉汽车腰靠头枕至尊版套装(米色 腰靠垫*1+头枕*1),汽车用品 > 汽车内饰 > 车用腰靠,亚马逊(卓越网),FREEMAN 自由人1004006005,汽车摩托|内饰精品|抱枕、腰靠,喜车郎 汽车车用记忆棉腰靠背靠靠垫 慢回弹车内腰靠 B款-灰色,汽车用品>内饰精品>抱枕/腰靠>喜车郎（XICHELANG）>喜车郎 汽车车用记忆棉腰靠背靠靠垫 慢回...,京东商城,喜车郎1004006005,汽车摩托|内饰精品|抱枕、腰靠,维康 汽车靠垫家具福字抱枕 护腰垫汽车家用腰靠靠背婚礼抱枕靠垫腰垫靠背垫 500g炭包 福字抱枕 6个装,汽车用品>内饰精品>抱枕/腰靠>车盟海饰>维康 汽车靠垫家具福字抱枕 护腰垫汽车家...,京东商城,1004006005,汽车摩托|内饰精品|抱枕、腰靠,香车一品 汽车腰靠垫 四季通用卡通可爱车用腰靠 护腰靠枕头 对装 雪尼尔 米白色 YP801-Y,汽车用品>内饰精品>抱枕/腰靠>香车一品>香车一品 汽车腰靠垫 四季通用卡通可爱车...,京东商城,香车一品官方旗舰店1004006005,汽车摩托|内饰精品|抱枕、腰靠,米菲（MIFFY）MFSJ-11P汽车记忆棉舒适腰靠（粉色）,首页 >精品装饰 >头枕/抱枕/腰靠 >Miffy 米菲 >MFSJ-11P,易迅网,Miffy/米菲1004006005,汽车摩托|内饰精品|抱枕、腰靠,WRC男款牛仔裤，如爱车一样，拥有酷帅的外形，优良的材质，完美的性能激情源于梦想，WRC与你一起前行,首页>WRC>牛仔裤,上品折扣,无1004006005,汽车摩托|内饰精品|抱枕、腰靠,monloll 汽车腰靠 蒙妮妮卡通 可爱腰靠 汽车靠垫 抱枕 腰枕 记忆棉腰靠 车用腰靠 (咖啡色),汽车用品 > 汽车内饰 > 车用腰靠,亚马逊(卓越网),monloll1004006005,汽车摩托|内饰精品|抱枕、腰靠,汽车用品汽车腰靠吉吉GIGI竹碳记忆棉腰枕靠垫腰托护腰G-1227 黑色,首页>汽车用品>内饰精品>抱枕/腰靠>汽车用品汽车腰靠吉吉GIGI竹碳记忆...,苏宁,1004006005,汽车摩托|内饰精品|抱枕、腰靠,【京东自营】铁臂阿童木 汽车腰靠车用护腰枕靠背垫 卡通红黑 YK-05R,首页 >精品装饰 >头枕/抱枕/腰靠 >铁臂阿童木（Astro Boy） >汽车腰靠 YK-05R,易迅网,1004006005,汽车摩托|内饰精品|抱枕、腰靠,【京东自营】铁臂阿童木 汽车腰靠车用记忆棉护腰枕靠背垫 灰色 JYYK-01,首页 >精品装饰 >头枕/抱枕/腰靠 >铁臂阿童木（Astro Boy） >JYYK-01,易迅网,1004006005,汽车摩托|内饰精品|抱枕、腰靠,万年骆驼 WFO16G土黄 肾宝双肾增强保护竹炭记忆棉腰靠汽车腰靠车用护腰靠驾驶安全靠背,首页 >精品装饰 >头枕/抱枕/腰靠 >万年骆驼 >WF016G土黄,易迅网,1004006005,汽车摩托|内饰精品|抱枕、腰靠,GIGI 吉吉 G-1227B 竹炭记忆棉至尊腰靠 黑色,汽车、保养、装饰 > 汽车装饰 > 抱枕腰靠,易迅网,GIGI 吉吉1004006005,汽车摩托|内饰精品|抱枕、腰靠,爱车屋 ICAROOM 喜羊羊与灰太狼 X-052B 太空记忆棉舒适腰靠（保护腰部,是长途驾车的必需品 粉红色）,汽车用品 > 汽车内饰 > 车用腰靠,亚马逊(卓越网),ICAROOM 爱车屋1004006005,汽车摩托|内饰精品|抱枕、腰靠,GiGi 竹炭记忆棉人体工程腰靠 G-1224 (杏色),汽车用品 > 汽车内饰 > 车用腰靠,亚马逊(卓越网),GiGi1004006005,汽车摩托|内饰精品|抱枕、腰靠,百易达 可爱保暖汽车腰靠 熊猫脸蛋腰垫,汽车用品 > 汽车内饰 > 车用腰靠,亚马逊(卓越网),百易达1004006005,汽车摩托|内饰精品|抱枕、腰靠,ALLRIDE 欧莱卡 记忆棉靠腰靠,汽车用品 > 汽车内饰 > 车用腰靠,亚马逊(卓越网),ALLRIDE 欧莱卡1004006005,汽车摩托|内饰精品|抱枕、腰靠,GiGi 吉吉 太空记忆棉拥抱型腰枕 W-203 (咖啡色),汽车用品 > 汽车内饰 > 车用腰靠,亚马逊(卓越网),GiGi 吉吉1004006005,汽车摩托|内饰精品|抱枕、腰靠,御指环 记忆棉圆头大腰靠 车用腰靠 车用靠垫 汽车腰枕 014-米色,汽车用品>内饰精品>抱枕/腰靠>御指环 记忆棉圆头大腰靠 车用腰靠 车用...,京东商城,翱途车品专营店1004006005,汽车摩托|内饰精品|抱枕、腰靠,GiGi 竹炭记忆棉人体工程腰枕 方形竹炭腰靠 腰枕 G-1224 (杏色),汽车用品 > 汽车内饰 > 车用腰靠,亚马逊(卓越网),GiGi 吉吉1004006005,汽车摩托|内饰精品|抱枕、腰靠,溢派 汽车腰靠 腰枕 腰垫 办公靠 靠背垫,汽车用品 > 汽车内饰 > 车用腰靠,亚马逊(卓越网),溢派1004006005,汽车摩托|内饰精品|抱枕、腰靠,GiGi /吉吉 太空记忆棉 人体工程腰靠/腰枕 防水透气 G-1066 (灰色),汽车用品 > 汽车内饰 > 车用腰靠,亚马逊(卓越网),GiGi 吉吉1004006005,汽车摩托|内饰精品|抱枕、腰靠,GiGi/吉吉 太空记忆棉腰枕 拥抱型汽车靠背 商务车用腰靠G-1209 (黑色),汽车用品 > 汽车内饰 > 车用腰靠,亚马逊(卓越网),GiGi 吉吉1004006005,汽车摩托|内饰精品|抱枕、腰靠,GiGi 腰靠G1210记忆棉腰靠 汽车腰靠垫 车用家用腰枕 黑色,汽车用品 > 汽车内饰 > 车用腰靠,亚马逊(卓越网),GiGi1004006005,汽车摩托|内饰精品|抱枕、腰靠,ESSEHOM 艾仕玛 高档记忆棉 汽车豪华腰靠 靠背 深蓝色 PU134,家居 > 床上用品 > 抱枕靠垫 汽车用品 > 汽车内饰 > 车用腰靠,亚马逊(卓越网),ESSEHOM 艾仕玛1004006005,汽车摩托|内饰精品|抱枕、腰靠,米菲 汽车抱枕车家两用精工刺绣卡通多功能靠垫 黑色MFSJ-07B,汽车用品>内饰精品>抱枕/腰靠>米菲（MIFFY）>米菲MFSJ-07B,京东商城,米菲（MIFFY）1004006005,汽车摩托|内饰精品|抱枕、腰靠,万年骆驼 WF003B竹炭记忆棉汽车腰靠舒适腰靠车用护腰靠垫安全健康(灰色),汽车用品 > 汽车内饰 > 车用腰靠,亚马逊(卓越网),万年骆驼1004006005,汽车摩托|内饰精品|抱枕、腰靠,GiGi 吉吉 太空记忆棉 卡通至尊车用腰靠 G-W008 (黑色+白色),汽车用品 > 汽车内饰 > 车用腰靠,亚马逊(卓越网),GiGi 吉吉1004006005,汽车摩托|内饰精品|抱枕、腰靠,GiGi 吉吉 太空记忆棉 卡通可爱 办公家用两用护椎小腰靠 GT-W006 (黑色+白色),汽车用品 > 汽车内饰 > 车用腰靠,亚马逊(卓越网),GiGi 吉吉1004006005,汽车摩托|内饰精品|抱枕、腰靠,GiGi 吉吉 太空记忆棉 汽车腰靠拥抱型腰枕G-1209 (米色),汽车用品 > 汽车内饰 > 车用腰靠,亚马逊(卓越网),GiGi 吉吉1004006005,汽车摩托|内饰精品|抱枕、腰靠,魅驹 天鹅绒记忆腰靠 汽车腰靠 家用 家具腰靠   全国包邮【加20元支持货到付款】,汽车用品 > 车饰精品 > 车内功能用品 > 商品详情,当当网,魅驹1004006005,汽车摩托|内饰精品|抱枕、腰靠,路奈 酷拉蒂菲魔术师系列C-2411 汽车卡通可爱腰靠 创意车用靠背护腰枕 DD-38,所有分类>大小家电、厨电、汽车>汽车生活>汽车内饰>抱枕靠枕>路奈>路奈 酷拉蒂菲魔术师...,1号店,路奈1004006005,汽车摩托|内饰精品|抱枕、腰靠,iCar 以轩 汽车保健按摩腰靠 NS-04-001-01 黑色,汽车用品 > 汽车内饰 > 车用腰靠,亚马逊(卓越网),iCar 以轩1004006005,汽车摩托|内饰精品|抱枕、腰靠,CARTUPPER 车百乐 记忆棉腰靠 家车两用腰枕 四季通用 C3SN008（通用）灰色,汽车用品 > 汽车内饰 > 车用腰靠,亚马逊(卓越网),CARTUPPER 车百乐1004006005,汽车摩托|内饰精品|抱枕、腰靠,车居良品 记忆棉车用腰靠垫腰枕腰垫 舒适慢回弹 (腰靠, 灰色),汽车用品 > 汽车内饰 > 车用腰靠,亚马逊(卓越网),车居良品1004006005,汽车摩托|内饰精品|抱枕、腰靠,GiGi 特价 GiGi/吉吉记忆棉拥抱型腰枕G-1068车用腰靠背垫 正品热卖 杏色(单个),汽车用品 > 汽车内饰 > 车用腰靠,亚马逊(卓越网),GiGi1004006005,汽车摩托|内饰精品|抱枕、腰靠,蒙妮妮 汽车按摩颗粒腰靠 汽车腰靠 (黑色),汽车用品 > 汽车内饰 > 车用腰靠,亚马逊(卓越网),蒙妮妮1004006005,汽车摩托|内饰精品|抱枕、腰靠,VACARX 威卡司 VA-787 加热+按摩腰垫(加热迅速均匀 震动按摩 消除疲劳 加热独立开关 银灰色),汽车用品 > 汽车内饰 > 车用腰靠,亚马逊(卓越网),Vacarx 威卡司1004006005,汽车摩托|内饰精品|抱枕、腰靠,御指环 御指环VISUAL记忆棉腰靠车用腰枕Y型工学护背腰靠保护腰椎腰枕 米色,汽车用品 > 汽车内饰 > 车用腰靠,亚马逊(卓越网),御指环1004006005,汽车摩托|内饰精品|抱枕、腰靠,阿狸ALI 英伦系列可爱卡通毛绒汽车记忆棉按摩腰靠 车用腰枕 办公室护腰垫 玫红色,汽车用品>内饰精品>抱枕/腰靠>阿狸（ali）>阿狸ALI 英伦系列可爱卡通毛绒汽车记忆...,京东商城,狼巴克专营店1004006005,汽车摩托|内饰精品|抱枕、腰靠,五福金牛 四吉牛腰枕 记忆腰靠垫 汽车腰靠 棕色 一个装,汽车用品>内饰精品>抱枕/腰靠>五福金牛>五福金牛 四吉牛腰枕 记忆腰靠垫 汽车腰...,京东商城,车尚品专营店1004006005,汽车摩托|内饰精品|抱枕、腰靠,iCar 以轩 汽车腰靠 座椅靠垫 电动按摩腰靠 司机必备品 NS-XH-498 米色,汽车用品 > 汽车内饰 > 车用腰靠,亚马逊(卓越网),iCar 以轩1004006005,汽车摩托|内饰精品|抱枕、腰靠,iCar 以轩 12V电动按摩腰靠/车用电动腰靠/保健按摩腰靠垫/汽车腰垫 NS-XH-504 黑夹红色,汽车用品 > 汽车内饰 > 车用腰靠,亚马逊(卓越网),iCar 以轩1004006005,汽车摩托|内饰精品|抱枕、腰靠,五福金牛四吉牛汽车内饰腰枕记忆腰靠垫汽车腰靠 棕色,汽车用品>汽车装饰>头枕腰靠>五福金牛>五福金牛四吉牛汽车内饰腰枕记忆腰靠垫汽车...,京东商城,车尚品专营店1004006005,汽车摩托|内饰精品|抱枕、腰靠,零听慢回弹靶向防护腰垫 办公室靠背垫腰枕 汽车腰垫护腰靠,汽车用品 > 汽车内饰 > 车用腰靠,亚马逊(卓越网),零听1004006005,汽车摩托|内饰精品|抱枕、腰靠,Anjuny安程 汽车腰垫靠垫 车用座垫气囊超薄腰枕 腰靠背靠垫 单片 马鞍棕,首页>汽车用品>内饰精品>抱枕/腰靠>Anjuny安程汽车腰垫靠垫车用...,苏宁,1004006005,汽车摩托|内饰精品|抱枕、腰靠,铁臂阿童木 汽车腰靠 3D办公记忆棉护腰枕靠背垫 米 单个装,首页 >精品装饰 >头枕/抱枕/腰靠 >铁臂阿童木（Astro Boy） >汽车腰靠,易迅网,1004006005,汽车摩托|内饰精品|抱枕、腰靠,米菲 汽车抱枕 车用护腰枕靠背垫 粉色 MFSJ-07P,首页 >精品装饰 >头枕/抱枕/腰靠 >米菲（MIFFY） >MFSJ-07P,易迅网,1004006005,汽车摩托|内饰精品|抱枕、腰靠,万年骆驼 WFO16C黑 肾宝双肾增强保护竹炭记忆棉腰靠汽车腰靠车用护腰靠驾驶安全靠背,首页 >精品装饰 >头枕/抱枕/腰靠 >万年骆驼 >WF016C黑,易迅网,1004006005,汽车摩托|内饰精品|抱枕、腰靠,GiGi/吉吉 太空记忆棉至尊腰靠 腰枕 G-1110 黑色,汽车用品 > 汽车内饰 > 车用腰靠,亚马逊(卓越网),GiGi 吉吉1004006005,汽车摩托|内饰精品|抱枕、腰靠,GIGI 吉吉G-1108太空记忆棉守护腰靠 米色,汽车用品 > 汽车内饰 > CD袋,亚马逊(卓越网),GiGi 吉吉