1004006005,汽车摩托|内饰精品|抱枕、腰靠,GiGi 太空记忆棉弓形腰枕 G-1067 (黑色),汽车用品 > 汽车内饰 > 车用腰靠,亚马逊(卓越网),GiGi1004006005,汽车摩托|内饰精品|抱枕、腰靠,GiGi 竹炭记忆棉至尊要靠 G-1227 (黑色),汽车用品 > 汽车内饰 > 车用腰靠,亚马逊(卓越网),GiGi1004006005,汽车摩托|内饰精品|抱枕、腰靠,四季花卉轻松拍,china-pub网上书店 > 家居/休闲 > 家庭园艺 > 四季花卉轻松拍,互动出版网,1004006005,汽车摩托|内饰精品|抱枕、腰靠,御指环 记忆棉圆头大腰靠 车用腰靠 车用靠垫 汽车腰枕 014-灰色,汽车用品>内饰精品>抱枕/腰靠>御指环 记忆棉圆头大腰靠 车用腰靠 车用...,京东商城,翱途车品专营店1004006005,汽车摩托|内饰精品|抱枕、腰靠,美车仔摩丝摩丝娃娃 汽车内饰用品 车用记忆棉腰枕 腰靠腰垫 浅粉色,玩具乐器>毛绒布艺>靠垫/抱枕>intex>美车仔摩丝摩丝娃娃 汽车内饰用品 车用记...,京东商城,竹马玩具汇1004006005,汽车摩托|内饰精品|抱枕、腰靠,GiGi 太空记忆棉护椎小腰靠 G-1109 (灰色),汽车用品 > 汽车内饰 > 车用腰靠,亚马逊(卓越网),GiGi1004006005,汽车摩托|内饰精品|抱枕、腰靠,GiGi 吉吉 太空记忆棉尊享型腰枕 G-1306 (卡其色),汽车用品 > 汽车内饰 > 车用腰靠,亚马逊(卓越网),GiGi 吉吉1004006005,汽车摩托|内饰精品|抱枕、腰靠,Alilula 阿里路拉 新款汽车座按摩保健冰丝细透气网格车内专用 靠垫 背靠 腰靠 黑色,汽车用品 > 汽车内饰 > 车用腰靠,亚马逊(卓越网),Alilula 阿里路拉1004006005,汽车摩托|内饰精品|抱枕、腰靠,正版阿狸 英伦系列可爱卡通毛绒汽车记忆棉按摩腰靠 车用腰枕 办公室护腰垫 奶茶色,汽车用品 > 汽车内饰 > 车用腰靠,亚马逊(卓越网),A-Li 阿狸1004006005,汽车摩托|内饰精品|抱枕、腰靠,御指环 御指环VISUAL记忆棉腰靠车用腰枕Y型工学护背腰靠保护腰椎腰枕 灰色,汽车用品 > 汽车内饰 > 车用腰靠,亚马逊(卓越网),御指环1004006005,汽车摩托|内饰精品|抱枕、腰靠,铁臂阿童木超纤皮高档商务慢回弹颗粒记忆棉汽车腰靠 护腰靠垫腰垫 对装 米色,首页>汽车用品>内饰精品>抱枕/腰靠>铁臂阿童木超纤皮高档商务慢回弹颗粒记...,苏宁,1004006005,汽车摩托|内饰精品|抱枕、腰靠,吉吉（GiGi） G-W111黑+白 太空记忆棉腰枕靠背 卡通车用家用腰靠垫 黑色+白色,首页>汽车用品>内饰精品>抱枕/腰靠>吉吉（GiGi）G-W111黑+白...,苏宁,吉吉(GiGi)1004006005,汽车摩托|内饰精品|抱枕、腰靠,依然(ERILL)正品记忆棉高级商务用汽车/家庭护腰靠腰垫ZK-2804,首页>汽车用品>内饰精品>抱枕/腰靠>依然(ERILL)正品记忆棉高级商务...,苏宁,ERILL/依然1004006005,汽车摩托|内饰精品|抱枕、腰靠,【货到付款】安美弛 维邦亚麻四季汽车腰靠 慢回弹记忆棉靠垫 车用腰靠 W025 灰色 单个装,汽车用品>内饰精品>抱枕/腰靠>安美弛>【货到付款】安美弛 维邦亚麻四季汽车腰靠...,京东商城,安美弛车品汇1004006005,汽车摩托|内饰精品|抱枕、腰靠,五福金牛四吉牛汽车内饰腰枕记忆腰靠垫汽车腰靠 黑色,汽车用品>汽车装饰>头枕腰靠>五福金牛>五福金牛四吉牛汽车内饰腰枕记忆腰靠垫汽车...,京东商城,车尚品专营店1004006005,汽车摩托|内饰精品|抱枕、腰靠,米菲（MIFFY）MFSJ-11B汽车记忆棉舒适腰靠（黑色）,首页 >精品装饰 >头枕/抱枕/腰靠 >Miffy 米菲 >MFSJ-11B,易迅网,Miffy/米菲1004006005,汽车摩托|内饰精品|抱枕、腰靠,Fortune Auto Supplies 富晨车业 哈佛H6 RAV4 途观 翼虎 逍客M4 IX35 CRV汽车座套 秋冬座套 棕色+记忆棉枕,汽车用品 > 汽车内饰 > 车用腰靠,亚马逊(卓越网),Fortune Auto Supplies 富晨车1004006005,汽车摩托|内饰精品|抱枕、腰靠,米菲 汽车腰靠 车用记忆棉弓型护腰枕靠背垫 粉色 MFSJ-13P,首页 >精品装饰 >头枕/抱枕/腰靠 >米菲（MIFFY） >MFSJ-13P,易迅网,1004006005,汽车摩托|内饰精品|抱枕、腰靠,【京东自营】富程 超柔软 爱心满满抱枕 可爱汽车抱枕 汽车靠垫 腰靠 米色,汽车用品>内饰精品>抱枕/腰靠>富程>富程抱枕,京东商城,富程1004006005,汽车摩托|内饰精品|抱枕、腰靠,自由人 双珠地太空记忆棉弓形腰靠 838(4442)   ,汽车用品>汽车内饰>抱枕腰靠>自由人 双珠地太空记忆棉弓形腰靠 838(4442)   ,为为网,自由人1004006005,汽车摩托|内饰精品|抱枕、腰靠,GiGi 太空记忆棉弓形腰枕 G-1067 (杏色),汽车用品 > 汽车内饰 > 车用腰靠,亚马逊(卓越网),GiGi1004006005,汽车摩托|内饰精品|抱枕、腰靠,GiGi 太空记忆棉弓形腰靠 靠背 腰枕 G-1208 (灰色),汽车用品 > 汽车内饰 > 车用腰靠,亚马逊(卓越网),GiGi1004006005,汽车摩托|内饰精品|抱枕、腰靠,SINBAWA 碳碳 卡通汽车记忆棉按摩腰靠 酒红色,汽车用品>内饰精品>抱枕/腰靠>其他>SINBAWA 碳碳 卡通汽车记忆棉按摩...,京东商城,狼巴克专营店1004006005,汽车摩托|内饰精品|抱枕、腰靠,爱图腾 护腰垫 夏季 靠背腰垫腰枕【黑色】40CMx40CM,汽车用品/类别/汽车内饰/车用腰靠,亚马逊(卓越网),爱图腾1004006005,汽车摩托|内饰精品|抱枕、腰靠,富程 超柔软 爱心满满抱枕 可爱汽车抱枕 汽车靠垫 腰靠 红色,首页>汽车用品>内饰精品>抱枕/腰靠>富程超柔软爱心满满抱枕可爱汽车...,苏宁,富程 产品:爱心抱枕 颜色:米色,红色,咖啡色 尺1004006005,汽车摩托|内饰精品|抱枕、腰靠,美车仔摩丝摩丝娃娃 汽车内饰用品 车用记忆棉腰枕 腰靠腰垫 玫红色,玩具乐器>毛绒布艺>靠垫/抱枕>intex>美车仔摩丝摩丝娃娃 汽车内饰用品 车用记...,京东商城,竹马玩具汇1004006005,汽车摩托|内饰精品|抱枕、腰靠,溢派 汽车腰靠 腰枕 腰垫 办公靠 靠背垫,汽车用品 > 汽车内饰 > 车用腰靠,亚马逊(卓越网),溢派1004006005,汽车摩托|内饰精品|抱枕、腰靠,SUV 爱思优威 太空记忆棉兔耳腰靠 腰枕 高定型 不变形 (灰色),汽车用品 > 汽车内饰 > 车用腰靠,亚马逊(卓越网),SUV 爱思优威1004006005,汽车摩托|内饰精品|抱枕、腰靠,万年骆驼 WFOO4B竹炭记忆棉减压腰靠汽车腰靠车用护腰靠垫驾驶安全靠背(灰色),汽车用品 > 汽车内饰 > 车用腰靠,亚马逊(卓越网),万年骆驼1004006005,汽车摩托|内饰精品|抱枕、腰靠,万年骆驼 WF003A竹炭记忆棉汽车腰靠舒适腰靠车用护腰靠垫安全健康(米色),汽车用品 > 汽车内饰 > 车用腰靠,亚马逊(卓越网),万年骆驼1004006005,汽车摩托|内饰精品|抱枕、腰靠,GiGi 吉吉 太空记忆棉 卡通至尊车用腰靠 G-W008 (咖啡色+白色),汽车用品 > 汽车内饰 > 车用腰靠,亚马逊(卓越网),GiGi 吉吉1004006005,汽车摩托|内饰精品|抱枕、腰靠,阿狸 英伦系列可爱卡通毛绒汽车记忆棉按摩腰靠 车用腰枕 办公室护腰垫 奶茶色,汽车用品>内饰精品>抱枕/腰靠>其他>阿狸 英伦系列可爱卡通毛绒汽车记忆棉按摩...,京东商城,来此购车品专营店1004006005,汽车摩托|内饰精品|抱枕、腰靠,Ulion 尤龙 太空记忆棉腰靠 红色,汽车用品 > 汽车内饰 > 车用腰靠,亚马逊(卓越网),Ulion 尤龙1004006005,汽车摩托|内饰精品|抱枕、腰靠,喜车郎 汽车车用记忆棉腰靠背靠靠垫 慢回弹车内腰靠 A款-灰色,汽车用品>内饰精品>抱枕/腰靠>喜车郎（XICHELANG）>喜车郎 汽车车用记忆棉腰靠背靠靠垫 慢回...,京东商城,喜车郎1004006005,汽车摩托|内饰精品|抱枕、腰靠,维康 汽车靠垫家具福字抱枕 护腰垫汽车家用腰靠靠背婚礼抱枕靠垫腰垫靠背垫 500g炭包 福字抱枕 1个装,汽车用品>内饰精品>抱枕/腰靠>车盟海饰>维康 汽车靠垫家具福字抱枕 护腰垫汽车家...,京东商城,1004006005,汽车摩托|内饰精品|抱枕、腰靠,香车一品 汽车腰靠垫 四季通用卡通可爱车用腰靠 护腰靠枕头 对装 冰虹丝 枚红色 YP506-Y,汽车用品>内饰精品>抱枕/腰靠>香车一品>香车一品 汽车腰靠垫 四季通用卡通可爱车...,京东商城,香车一品官方旗舰店1004006005,汽车摩托|内饰精品|抱枕、腰靠,铁臂阿童木（Astroboy）JYJZ-01汽车记忆棉U型枕（灰色）,首页 >精品装饰 >头枕/抱枕/腰靠 >铁臂阿童木(Astro Boy) >JYJZ-01,易迅网,Astroboy/铁臂阿童木1004006005,汽车摩托|内饰精品|抱枕、腰靠,Anjuny安程 汽车腰垫靠垫 车用座垫气囊超薄腰枕 腰靠背靠垫 单片 马鞍棕,首页>汽车用品>内饰精品>抱枕/腰靠>Anjuny安程汽车腰垫靠垫车用...,苏宁,安程1004006005,汽车摩托|内饰精品|抱枕、腰靠,Fortune Auto Supplies 富晨车业 尚酷 蒙迪欧 天籁 迈腾 帕萨特 K5 索纳塔八锐志专用汽车座套车套 棕色+记忆棉枕,汽车用品 > 汽车内饰 > 车用腰靠,亚马逊(卓越网),Fortune Auto Supplies 富晨车1004006005,汽车摩托|内饰精品|抱枕、腰靠,自由人 新款车用太空记忆棉至尊腰靠 汽车舒适腰枕 车用腰垫靠背 (米白色单品至尊腰靠),,亚马逊(卓越网),自由人1004006005,汽车摩托|内饰精品|抱枕、腰靠,依然(ERILL)正品记忆棉高级商务用汽车/家庭护腰靠腰垫ZK-2804 米色,首页>汽车用品>内饰精品>抱枕/腰靠>依然(ERILL)正品记忆棉高级商务...,苏宁,1004006005,汽车摩托|内饰精品|抱枕、腰靠,汽车用品汽车腰靠吉吉GIGI竹碳记忆棉腰枕靠垫腰托护腰G-1227 黑色,首页>汽车用品>内饰精品>抱枕/腰靠>汽车用品汽车腰靠吉吉GIGI竹碳记忆...,苏宁,1004006005,汽车摩托|内饰精品|抱枕、腰靠,沿途汽车头枕腰靠套装 车用腰靠垫颈枕 车靠腰垫 汽车护腰靠背垫 米色,首页>汽车用品>内饰精品>抱枕/腰靠>沿途汽车头枕腰靠套装车用腰靠垫颈枕...,苏宁,1004006005,汽车摩托|内饰精品|抱枕、腰靠,尤师傅 高档慢回弹记忆棉腰靠垫 车用汽车腰靠背垫 汽车真皮腰靠 (米色单线),,亚马逊(卓越网),尤师傅1004006005,汽车摩托|内饰精品|抱枕、腰靠,铁臂阿童木 汽车腰靠 3D办公记忆棉护腰枕靠背垫 黑 单个装,首页 >精品装饰 >头枕/抱枕/腰靠 >铁臂阿童木（Astro Boy） >汽车腰靠,易迅网,1004006005,汽车摩托|内饰精品|抱枕、腰靠,【京东自营】铁臂阿童木 汽车腰靠车用记忆棉护腰枕靠背垫 米色 JYYK-01,首页 >精品装饰 >头枕/抱枕/腰靠 >铁臂阿童木（Astro Boy） >JYYK-01,易迅网,1004006005,汽车摩托|内饰精品|抱枕、腰靠,时尚梵迪时尚汽车用品--可爱猫腰靠(米色),汽车用品 > 汽车内饰 > 车用腰靠,亚马逊(卓越网),Typer 泰普尔1004006005,汽车摩托|内饰精品|抱枕、腰靠,GiGi/吉吉 太空记忆棉守护腰靠 腰靠 腰枕 靠背 G-1108 灰色,汽车用品 > 汽车内饰 > 车用腰靠,亚马逊(卓越网),GiGi 吉吉1004006005,汽车摩托|内饰精品|抱枕、腰靠,GiGi/吉吉 竹炭记忆棉护椎小腰靠 G-1226 腰靠 灰色,汽车用品 > 汽车内饰 > 车用腰靠,亚马逊(卓越网),GiGi 吉吉1004006005,汽车摩托|内饰精品|抱枕、腰靠,自由人 韩国绒太空记忆棉弓形腰靠 815(4428)   ,汽车用品>汽车内饰>抱枕腰靠>自由人 韩国绒太空记忆棉弓形腰靠 815(4428)   ,为为网,自由人1004006005,汽车摩托|内饰精品|抱枕、腰靠,GiGi 卡通系列 太空记忆棉舒适腰枕 腰靠 靠背 G-W110 (咖啡+米色),家居 > 床上用品 > 抱枕靠垫 汽车用品 > 汽车内饰 > 车用腰靠,亚马逊(卓越网),GiGi1004006005,汽车摩托|内饰精品|抱枕、腰靠,GiGi 太空记忆棉护椎小腰靠 G-1109 (杏色),汽车用品 > 汽车内饰 > 车用腰靠,亚马逊(卓越网),GiGi1004006005,汽车摩托|内饰精品|抱枕、腰靠,freeman FREEMAN透气不变形 双珠地太空记忆棉 弓形腰枕 汽车腰枕腰靠,汽车用品 > 汽车内饰 > 车用腰靠,亚马逊(卓越网),freeman1004006005,汽车摩托|内饰精品|抱枕、腰靠,Larento 老人头精品牛津布腰靠 汽车护腰靠垫 腰枕靠背垫JLR-120,汽车用品 > 汽车内饰 > 车用腰靠,亚马逊(卓越网),LAORENTOU 老人头1004006005,汽车摩托|内饰精品|抱枕、腰靠,【品质源于专注】爱思优威汽车腰枕垫腰靠太空记忆棉 YK12军绿,汽车用品>内饰精品>抱枕/腰靠>爱思优威（SUV）>【品质源于专注】爱思优威汽车腰枕垫腰靠太...,京东商城,美斯优唐汽车用品专营店1004006005,汽车摩托|内饰精品|抱枕、腰靠,韩国HelloKitty汽车腰靠 卡通腰靠 凯蒂猫腰靠 绒面刺绣可爱靠垫,汽车用品 > 汽车内饰 > 车用腰靠,亚马逊(卓越网),Hello Kitty1004006005,汽车摩托|内饰精品|抱枕、腰靠,车仆（chief）车仆之家太空记忆棉腰靠腰枕汽车办公腰垫,汽车用品>内饰精品>抱枕/腰靠>其他>车仆（chief）车仆之家太空记忆棉腰靠...,京东商城,车仆旗舰店1004006005,汽车摩托|内饰精品|抱枕、腰靠,路派 热销 汽车按摩垫 车用腰靠 冰丝靠垫 带按摩珠,汽车用品 > 汽车内饰 > 车用腰靠,亚马逊(卓越网),路派1004006005,汽车摩托|内饰精品|抱枕、腰靠,酷拉蒂菲 魔术师 汽车卡通可爱腰靠 创意车用靠背护腰枕垫腰托,所有分类>大小家电、厨电、汽车>汽车生活>汽车内饰>抱枕靠枕>酷拉蒂菲>酷拉蒂菲 魔术师 汽...,1号店,酷拉蒂菲1004006005,汽车摩托|内饰精品|抱枕、腰靠,阿狸 英伦系列可爱卡通毛绒汽车记忆棉按摩腰靠 车用腰枕 办公室护腰垫 黑色,汽车用品>内饰精品>抱枕/腰靠>其他>阿狸 英伦系列可爱卡通毛绒汽车记忆棉按摩...,京东商城,来此购车品专营店1004006005,汽车摩托|内饰精品|抱枕、腰靠,Freeman 自由人 记忆棉汽车至尊腰靠骨头枕套装(岩石灰 腰靠垫*1+骨头枕*1),汽车用品 > 汽车内饰 > 车用腰靠,亚马逊(卓越网),FREEMAN 自由人1004006005,汽车摩托|内饰精品|抱枕、腰靠,iCar 以轩 德国B2超炫汽车腰靠 潮人必备 运动型 记忆棉 汽车腰垫 NS-XH-495 黑色,汽车用品 > 汽车内饰 > 车用腰靠,亚马逊(卓越网),iCar 以轩1004006005,汽车摩托|内饰精品|抱枕、腰靠,五福金牛四吉牛汽车内饰腰枕记忆腰靠垫汽车腰靠 黄色,汽车用品>汽车装饰>头枕腰靠>五福金牛>五福金牛四吉牛汽车内饰腰枕记忆腰靠垫汽车...,京东商城,车尚品专营店1004006005,汽车摩托|内饰精品|抱枕、腰靠,商佑BLESS 四季护腰靠垫四季座椅靠背垫护腰枕垫 汽车护腰垫车用座椅按摩垫 孕妇靠垫 米色花,汽车用品>汽车装饰>头枕腰靠>商佑（BLESS）>商佑BLESS 四季护腰靠垫四季座椅靠背...,京东商城,商佑车品专营店1004006005,汽车摩托|内饰精品|抱枕、腰靠,monloll 汽车腰靠 蒙妮妮卡通 可爱腰靠 汽车靠垫 抱枕 腰枕 记忆棉腰靠 车用腰靠 (大红圆点),汽车用品 > 汽车内饰 > 车用腰靠,亚马逊(卓越网),monloll1004006005,汽车摩托|内饰精品|抱枕、腰靠,车当家 透气隐形机腰靠 记忆棉慢回弹汽车靠垫 单只装 驼色,汽车用品>内饰精品>抱枕/腰靠>车当家>车当家 透气隐形机腰靠 记忆棉慢回弹汽车...,京东商城,车当家京东旗舰店1004006005,汽车摩托|内饰精品|抱枕、腰靠,GiGi/吉吉 太空记忆棉 拥抱型腰靠 腰枕 1068 (灰色),汽车用品 > 汽车内饰 > 车用腰靠,亚马逊(卓越网),GiGi 吉吉1004006005,汽车摩托|内饰精品|抱枕、腰靠,GiGi 太空记忆棉弓形腰靠 靠背 腰枕 G-1208 (杏色),汽车用品 > 汽车内饰 > 车用腰靠,亚马逊(卓越网),GiGi1004006005,汽车摩托|内饰精品|抱枕、腰靠,舒活热能按摩腰靠,汽车用品 > 汽车内饰 > 车用腰靠,亚马逊(卓越网),北京易诚博信有限公司1004006005,汽车摩托|内饰精品|抱枕、腰靠,优踏 家车办公多用途按摩颗粒腰靠,汽车用品 > 汽车内饰 > 车用腰靠,亚马逊(卓越网),iCar 以轩1004006005,汽车摩托|内饰精品|抱枕、腰靠,GiGi /吉吉 太空记忆棉 人体工程腰靠/腰枕 防水透气 G-1066 (杏色),汽车用品 > 汽车内饰 > 车用腰靠,亚马逊(卓越网),GiGi 吉吉1004006005,汽车摩托|内饰精品|抱枕、腰靠,2012新品GiGi /吉吉汽车记忆棉亚麻 腰靠靠垫 腰垫腰枕车枕G-1146,汽车用品 > 汽车内饰 > 车用腰靠,亚马逊(卓越网),GiGi 吉吉1004006005,汽车摩托|内饰精品|抱枕、腰靠,卡诺特 高档记忆棉汽车腰靠 腰垫 车用腰靠护腰靠垫 汽车腰枕靠垫 碳纤纹一条白,汽车用品>内饰精品>抱枕/腰靠>卡诺特 高档记忆棉汽车腰靠 腰垫 车用腰...,京东商城,卡诺特车品专营店1004006005,汽车摩托|内饰精品|抱枕、腰靠,万年骆驼 WFO16G竹炭记忆棉经典肾宝腰靠汽车腰靠车用护腰靠驾驶安全靠背(土黄色),汽车用品 > 汽车内饰 > 车用腰靠,亚马逊(卓越网),万年骆驼1004006005,汽车摩托|内饰精品|抱枕、腰靠,万年骆驼 WF003C竹炭记忆棉汽车腰靠舒适腰靠车用护腰靠垫安全健康(黑色),汽车用品 > 汽车内饰 > 车用腰靠,亚马逊(卓越网),万年骆驼1004006005,汽车摩托|内饰精品|抱枕、腰靠,mocmoc摩丝娃娃 卡通造型抱枕 车用腰靠垫 汽车护腰枕 单只 粉色蝴蝶结,汽车用品>内饰精品>抱枕/腰靠>摩丝娃娃>mocmoc摩丝娃娃 卡通造型抱枕 车用...,京东商城,来此购车品专营店1004006005,汽车摩托|内饰精品|抱枕、腰靠,CARTUPPER 车百乐 记忆棉腰靠 家车两用腰枕 四季通用 C3SN008（通用）黑色,汽车用品 > 汽车内饰 > 车用腰靠,亚马逊(卓越网),CARTUPPER 车百乐1004006005,汽车摩托|内饰精品|抱枕、腰靠,心飞 汽车按摩钉腰枕 夏季冰丝腰靠 办公室腰靠 网钉靠背,汽车用品>汽车装饰>头枕腰靠>心飞>心飞 汽车按摩钉腰枕 夏季冰丝腰靠 办公...,京东商城,心飞车品专营店1004006005,汽车摩托|内饰精品|抱枕、腰靠,GiGi 特价GiGi车用记忆棉慢回弹腰枕GW111可爱卡通四季通用 特价 咖啡+米(单个),汽车用品 > 汽车内饰 > 车用腰靠,亚马逊(卓越网),GiGi1004006005,汽车摩托|内饰精品|抱枕、腰靠,Freeman 自由人 记忆棉汽车至尊腰靠骨头枕套装(米白色 腰靠垫*1+骨头枕*1),汽车用品 > 汽车内饰 > 车用腰靠,亚马逊(卓越网),FREEMAN 自由人1004006005,汽车摩托|内饰精品|抱枕、腰靠,Bafa 八发 华都风尚系列KL-FS06H 超柔面料 记忆棉填充 尺寸39*35cm 大腰靠 灰色,汽车用品 > 汽车内饰 > 车用腰靠,亚马逊(卓越网),Bafa 八发1004006005,汽车摩托|内饰精品|抱枕、腰靠,Monlill 汽车头枕腰靠套装 腰垫腰靠 汽车按摩腰枕 卡通可爱公仔 腰靠垫 A007豹纹,汽车用品 > 汽车内饰 > 头枕,亚马逊(卓越网),Monlill1004006005,汽车摩托|内饰精品|抱枕、腰靠,SIMB 狮博 真羊皮汽车腰靠头枕鳄鱼纹记忆棉靠垫套装SM-TZYK-301米色,汽车用品 > 汽车内饰 > 车用腰靠,亚马逊(卓越网),SIMB 狮博1004006005,汽车摩托|内饰精品|抱枕、腰靠,iCar 以轩 太空记忆棉至尊腰靠 米色 MR-JL-177,汽车用品 > 汽车内饰 > 车用腰靠,亚马逊(卓越网),iCar 以轩1004006005,汽车摩托|内饰精品|抱枕、腰靠,吉吉（GiGi） G-W111咖啡+米 太空记忆棉腰枕靠背 卡通车用家用腰靠垫米色+咖啡,首页>汽车用品>内饰精品>抱枕/腰靠>吉吉（GiGi）G-W111咖啡+...,苏宁,吉吉(GiGi)1004006005,汽车摩托|内饰精品|抱枕、腰靠,维康 汽车靠垫家具福字抱枕 护腰垫汽车家用腰靠靠背婚礼抱枕靠垫腰垫靠背垫 500g炭包 福字抱枕 5个装,汽车用品>内饰精品>抱枕/腰靠>车盟海饰>维康 汽车靠垫家具福字抱枕 护腰垫汽车家...,京东商城,1004006005,汽车摩托|内饰精品|抱枕、腰靠,正品GiGi 高品质记忆棉汽车腰靠 车用腰枕 办公室腰垫 G-1066,汽车用品 > 车饰精品 > 车内功能用品 > 商品详情,当当网,GiGi1004006005,汽车摩托|内饰精品|抱枕、腰靠,爱图腾 汽车腰靠 垫背 靠背 汽车靠垫 电动按摩腰靠 车家两用 缓解疲劳 米色,首页>汽车用品>内饰精品>抱枕/腰靠>爱图腾汽车腰靠垫背靠背汽车靠...,苏宁,1004006005,汽车摩托|内饰精品|抱枕、腰靠,【京东自营】米菲 汽车腰靠 车用记忆棉护腰枕靠背垫 黑色 MFSJ-11B,首页 >精品装饰 >头枕/抱枕/腰靠 >米菲（MIFFY） >MFSJ-11B,易迅网,1004006005,汽车摩托|内饰精品|抱枕、腰靠,汽车腰靠记忆棉靠垫 汽车靠枕垫 车用夏季腰垫靠背包邮护腰防汗夏 米色,首页>汽车用品>内饰精品>抱枕/腰靠>汽车腰靠记忆棉靠垫汽车靠枕垫车用...,苏宁,卡斯兰