1004006004,汽车摩托|内饰精品|颈枕、头枕,【京东自营】车德克 清新茶沫竹炭透气棉格四季骨头颈枕2个装 米白色DK007,汽车用品>内饰精品>颈枕/头枕>车德克（CEDEKE）>车德克颈枕,京东商城,车德克（CEDEKE）1004006004,汽车摩托|内饰精品|颈枕、头枕,爱车屋（H-201H-B）车用护颈枕（红色）,汽车用品>内饰精品>颈枕/头枕>爱车屋（ICAROOM）>爱车屋H-201H-B,京东商城,爱车屋（ICAROOM）1004006004,汽车摩托|内饰精品|颈枕、头枕,艺芙蓉Y11J001D米色 汽车饰品 车用抱枕/靠枕 颈枕/头枕 腰靠/腰枕组合5件套装,汽车用品>内饰精品>抱枕/腰靠>艺芙蓉>艺芙蓉Y11J001D,京东商城,艺芙蓉1004006004,汽车摩托|内饰精品|颈枕、头枕,快美特CARMATE<康芙特> CSZ142 睡眠靠枕(黑色),汽车用品 > 汽车内饰 > 头枕,亚马逊(卓越网),Carmate 快美特1004006004,汽车摩托|内饰精品|颈枕、头枕,爱车屋车用骨头枕对装H-100M,首页>汽车用品>内饰精品>头枕/颈枕>爱车屋车用骨头枕对装H-100M,苏宁,爱车屋1004006004,汽车摩托|内饰精品|颈枕、头枕,爱车屋小熊KOKO太空记忆棉护颈枕2个入K-048A,当当网 > 汽车用品 > 车内饰品 > 抱枕/头枕/颈枕,当当网,冻不冷1004006004,汽车摩托|内饰精品|颈枕、头枕,卡饰社（Carsetcity）CD置物袋　CS-27775,汽车用品 > 汽车内饰 > 头枕,亚马逊(卓越网),Carsetcity 卡饰社1004006004,汽车摩托|内饰精品|颈枕、头枕,爱车屋喜羊羊与灰太狼喜羊羊抱枕X-310A,首页>汽车用品>内饰精品>头枕/颈枕>爱车屋喜羊羊与灰太狼喜羊羊抱枕X-3...,苏宁,爱车屋 材质:超柔剪毛绒 填充物:中空棉 颜色:杏1004006004,汽车摩托|内饰精品|颈枕、头枕,爱车屋车用骨头枕单装H-101N,首页>汽车用品>内饰精品>头枕/颈枕>爱车屋车用骨头枕单装H-101N,苏宁,爱车屋 面料:磨毛布  内填充物:中空绵 颜色:杏1004006004,汽车摩托|内饰精品|颈枕、头枕,多奇 中国风系列 如意护颈枕/头枕/靠枕(对装)H-401C,当当网 > 汽车用品 > 车内饰品 > 抱枕/头枕/颈枕,当当网,冻不冷1004006004,汽车摩托|内饰精品|颈枕、头枕,爱车屋官方店 中国风迎瑞 汽车骨头枕/护颈枕/头枕 H-201I护颈枕,当当网 > 汽车用品 > 车内饰品 > 抱枕/头枕/颈枕,当当网,爱车屋1004006004,汽车摩托|内饰精品|颈枕、头枕,小破孩/靠枕/婚庆/礼品/正版 XPHBZ003献花款-05,当当网 > 汽车用品 > 车内饰品 > 抱枕/头枕/颈枕,当当网,小破孩1004006004,汽车摩托|内饰精品|颈枕、头枕,爱车屋 田园系列 车用骨头枕/颈枕 NB-102T 一个装,当当网 > 汽车用品 > 车内饰品 > 抱枕/头枕/颈枕,当当网,爱车屋1004006004,汽车摩托|内饰精品|颈枕、头枕,车之颜钛白系列 车用太空记忆棉蝴蝶枕 头枕 颈枕 C-1306,当当网 > 汽车用品 > 车内饰品 > 抱枕/头枕/颈枕,当当网,车之颜1004006004,汽车摩托|内饰精品|颈枕、头枕,泡泡酷（popoku）PTB 天使植绒骨头形汽车头枕（黑色）,汽车用品>内饰精品>颈枕/头枕>泡泡酷（popoku）>泡泡酷头枕,京东商城,泡泡酷（popoku）1004006004,汽车摩托|内饰精品|颈枕、头枕,泡泡酷（popoku）PFT-HO 汽车头枕抱枕精品四合一（红色）,汽车用品>内饰精品>抱枕/腰靠>泡泡酷（popoku）>泡泡酷PFT-HO,京东商城,泡泡酷（popoku）1004006004,汽车摩托|内饰精品|颈枕、头枕,GiGi/吉吉 汽车颈枕 太空记忆棉骨头枕 G-W107,所有分类>大小家电、厨电、汽车>汽车生活>汽车内饰>抱枕靠枕>GiGi/吉吉>GiGi/吉吉 汽车...,1号店,GiGi/吉吉1004006004,汽车摩托|内饰精品|颈枕、头枕,WellHouse 天鹅绒汽车头枕/护颈枕/充气枕头/U型枕/旅行枕/午睡枕 WH11 (紫色WH118),汽车用品 > 汽车内饰 > 头枕,亚马逊(卓越网),WellHouse1004006004,汽车摩托|内饰精品|颈枕、头枕,GIGI 吉吉 G-W110-01 太空记忆棉舒适腰枕,首页 > 汽车用品 > 颈枕/腰靠 > GiGi 吉吉 > 产品编号: A0S-1QL-0DF,新蛋商城,GiGi 吉吉1004006004,汽车摩托|内饰精品|颈枕、头枕,GIGI 吉吉 G-1222G 竹炭记忆棉组合头枕,首页 > 汽车用品 > 颈枕/腰靠 > GiGi 吉吉 > 产品编号: A0S-1QL-0EJ,新蛋商城,GiGi 吉吉1004006004,汽车摩托|内饰精品|颈枕、头枕,GIGI吉吉 太空记忆棉 骨头枕 颈枕 车用头枕,汽车用品 > 车饰精品 > 车内饰品 > 商品详情,当当网,GIGI 吉吉1004006004,汽车摩托|内饰精品|颈枕、头枕,路盛品尚车居 Pscar 太空棉骨头枕(米黄)P041路盛让开车成为一种享受,当当网 > 汽车用品 > 车内饰品 > 抱枕/头枕/颈枕,当当网,品尚车居1004006004,汽车摩托|内饰精品|颈枕、头枕,品尚车居 卡比狗 卡通可爱情侣汽车头枕 汽车颈枕 汽车舒适护颈枕 汽车骨头枕 AB对装,汽车用品>内饰精品>颈枕/头枕>品尚车居 卡比狗 卡通可爱情侣汽车头枕 ...,京东商城,广州信雅1004006004,汽车摩托|内饰精品|颈枕、头枕,利特尔 四季保健养生亚麻车用头枕/汽车颈枕对装*2个 灰色,汽车用品>内饰精品>颈枕/头枕>利特尔>利特尔头枕,京东商城,利特尔1004006004,汽车摩托|内饰精品|颈枕、头枕,马车夫COACHMAN 超纤皮革汽车头枕 皮革护颈枕 慢回弹记忆棉头枕（单只） 卡宴黄--单只,汽车用品>内饰精品>颈枕/头枕>马车夫COACHMAN 超纤皮革汽车头枕...,京东商城,马车夫旗舰店1004006004,汽车摩托|内饰精品|颈枕、头枕,品尚车居 传奇决明子冰丝亚麻养生舒适汽车头枕 汽车颈枕 汽车护颈枕 汽车骨头枕 单个装,汽车用品>内饰精品>颈枕/头枕>品尚车居 传奇决明子冰丝亚麻养生舒适汽车...,京东商城,广州信雅1004006004,汽车摩托|内饰精品|颈枕、头枕,利特尔 三明治舒适透气车用头枕/汽车颈枕对装*2个 灰黑色,汽车用品>内饰精品>颈枕/头枕>利特尔>利特尔头枕,京东商城,利特尔1004006004,汽车摩托|内饰精品|颈枕、头枕,SNOOPY可可系列颈枕D,汽车用品 > 汽车内饰 > 头枕,亚马逊(卓越网),SNOOPY 史努比1004006004,汽车摩托|内饰精品|颈枕、头枕,泰普尔TR-1001 护颈垫(网黑),汽车用品 > 汽车内饰 > 头枕,亚马逊(卓越网),Typer 泰普尔1004006004,汽车摩托|内饰精品|颈枕、头枕,爱车屋 ICAROOM I-005A 太空棉头枕,汽车用品 > 汽车内饰 > 头枕,亚马逊(卓越网),ICAROOM 爱车屋1004006004,汽车摩托|内饰精品|颈枕、头枕,泰普尔TR-1003 护颈枕(绒/黑红黑),汽车用品 > 汽车内饰 > 头枕,亚马逊(卓越网),Typer 泰普尔1004006004,汽车摩托|内饰精品|颈枕、头枕,大耳狗 缤纷系列 超柔软毛绒 汽车 对装颈枕,汽车用品 > 驾车个人用品 > 钥匙链,亚马逊(卓越网),Cinnamoroll 大耳狗1004006004,汽车摩托|内饰精品|颈枕、头枕,icaroom 爱车屋 车用骨头2个入 I-100E 纯棉生活E,汽车用品 > 汽车内饰 > 头枕,亚马逊(卓越网),ICAROOM 爱车屋1004006004,汽车摩托|内饰精品|颈枕、头枕,中腾 太空记忆棉U型枕 灰色,汽车用品 > 汽车内饰 > 头枕,亚马逊(卓越网),中腾1004006004,汽车摩托|内饰精品|颈枕、头枕,麂皮绒雪佛兰车标头枕/颈枕/骨头枕,汽车用品 > 汽车内饰 > 头枕,亚马逊(卓越网),凡卡先锋1004006004,汽车摩托|内饰精品|颈枕、头枕,百维 托比熊棒球队系列汽车小头枕 PW0605,汽车用品 > 汽车内饰 > 头枕,亚马逊(卓越网),百维1004006004,汽车摩托|内饰精品|颈枕、头枕,爱车屋 田园系列 车用骨头枕 汽车头枕 NB-102T 29CM×16CM×10CM,汽车用品 > 汽车内饰 > 头枕,亚马逊(卓越网),ICAROOM 爱车屋1004006004,汽车摩托|内饰精品|颈枕、头枕,爱车屋 太空棉 汽车用U型头枕护颈枕 I-006A 淡棕色,汽车用品 > 汽车内饰 > 头枕,亚马逊(卓越网),ICAROOM 爱车屋1004006004,汽车摩托|内饰精品|颈枕、头枕,GiGiG-1069E,汽车用品>头枕/颈枕/抱枕>GiGi>GiGiG-1069E,国美电器网上商城,GiGi1004006004,汽车摩托|内饰精品|颈枕、头枕,淇淇8321,汽车用品>头枕/颈枕/抱枕>淇淇>淇淇8321,国美电器网上商城,淇淇1004006004,汽车摩托|内饰精品|颈枕、头枕,品尚车居 炫风系列 高档蚕丝纯棉面料太空棉汽车头枕 汽车颈枕 汽车护颈枕 汽车骨头枕 对装,汽车用品>内饰精品>颈枕/头枕>品尚车居 炫风系列 高档蚕丝纯棉面料太空...,京东商城,广州信雅1004006004,汽车摩托|内饰精品|颈枕、头枕,华鹿 竹炭记忆棉麂皮绒头枕(个)米色,汽车、保养、装饰 > 汽车内饰 > 抱枕腰靠,易迅网,华鹿1004006004,汽车摩托|内饰精品|颈枕、头枕,GiGiG-W112-02,汽车用品>头枕/颈枕/抱枕>GiGi>GiGiG-W112-02,国美电器网上商城,GiGi1004006004,汽车摩托|内饰精品|颈枕、头枕,爱车屋（ICAROOM）尊享系列I-111I-2舒适抱枕,汽车用品>头枕/颈枕/抱枕>爱车屋>爱车屋（ICAROOM）尊享系列I-111I-2舒适抱枕,国美电器网上商城,爱车屋1004006004,汽车摩托|内饰精品|颈枕、头枕,优尔卡 真皮全打孔头枕/颈枕 米色(对装)9811   ,汽车用品>汽车内饰>汽车头枕>优尔卡 真皮全打孔头枕/颈枕 米色(对装)9811   ,为为网,优尔卡1004006004,汽车摩托|内饰精品|颈枕、头枕,WellHouse 植绒 汽车枕/护颈枕/充气枕头/U型枕/旅行枕 WH15 (灰色WH152),汽车用品 > 汽车内饰 > 头枕,亚马逊(卓越网),WellHouse1004006004,汽车摩托|内饰精品|颈枕、头枕,车之颜回声系列C-1113考拉车用圆形凉被抱枕,汽车用品>头枕/颈枕/抱枕>车之颜>车之颜回声系列C-1113考拉车用圆形凉被抱枕,国美电器网上商城,车之颜1004006004,汽车摩托|内饰精品|颈枕、头枕,爱车屋（ICAROOM）丽丽绒灰色商务系列I-111U-2舒适抱枕,汽车用品>头枕/颈枕/抱枕>爱车屋>爱车屋（ICAROOM）丽丽绒灰色商务系列I-111U-2舒适抱枕,国美电器网上商城,爱车屋1004006004,汽车摩托|内饰精品|颈枕、头枕,爱车屋 ICAROOM NB-122KT 舒适U枕,汽车用品 > 汽车内饰 > 头枕,亚马逊(卓越网),ICAROOM 爱车屋1004006004,汽车摩托|内饰精品|颈枕、头枕,张小盒商务米色系列舒适颈枕B款ZXH-S-09A,汽车用品 > 汽车内饰 > 头枕,亚马逊(卓越网),张小盒1004006004,汽车摩托|内饰精品|颈枕、头枕,GiGi 竹炭记忆棉行车头枕 G-1225 (黑色),汽车用品 > 汽车内饰 > 头枕,亚马逊(卓越网),GiGi1004006004,汽车摩托|内饰精品|颈枕、头枕,GiGi 吉吉 G-W108-02 太空记忆棉蝴蝶头枕,首页 > 汽车用品 > 颈枕/腰靠 > GiGi 吉吉 > 产品编号: A0S-1QL-0F4,新蛋商城,GiGi 吉吉1004006004,汽车摩托|内饰精品|颈枕、头枕,GiGi 吉吉 G-1224A 竹炭记忆棉人体工程腰靠,首页 > 汽车用品 > 颈枕/腰靠 > GiGi 吉吉 > 产品编号: A0S-1QL-0EP,新蛋商城,GiGi 吉吉1004006004,汽车摩托|内饰精品|颈枕、头枕,GiGi 吉吉 太空记忆棉环绕式头枕 G-1106-B (黑色),汽车用品 > 汽车内饰 > 头枕,亚马逊(卓越网),GiGi 吉吉1004006004,汽车摩托|内饰精品|颈枕、头枕,摩丝摩丝娃娃可爱卡通汽车内饰用品造型车用头枕颈枕竹炭护枕 (闪烁兔耳对装),汽车用品 > 汽车内饰 > 头枕,亚马逊(卓越网),摩丝1004006004,汽车摩托|内饰精品|颈枕、头枕,驾适宝 太空记忆棉骨头枕汽车记忆棉头枕 靠枕颈枕 护颈枕垫枕,汽车用品 > 汽车内饰 > 头枕,亚马逊(卓越网),上海驾适宝电子商务有限公司1004006004,汽车摩托|内饰精品|颈枕、头枕,益尔健 家用仰卧起坐减肥健身器材 懒人运动收腹机 卓越版 橡果国际正品 (送紫环远红外记忆枕+围巾),汽车用品 > 汽车内饰 > 头枕 运动户外休闲 > 健身、训练 运动户外休闲 > 运动迷用品 > 运动器材,亚马逊(卓越网),益尔健1004006004,汽车摩托|内饰精品|颈枕、头枕,KingPhoenix 金火鸟 亚麻竹炭汽车颈枕 一对装 灰色,汽车用品 > 汽车内饰 > 脚垫,亚马逊(卓越网),金火鸟1004006004,汽车摩托|内饰精品|颈枕、头枕,GIGI 吉吉G-1104太空记忆棉阶梯式头枕 黑色,汽车用品 > 汽车内饰 > CD袋,亚马逊(卓越网),GiGi 吉吉1004006004,汽车摩托|内饰精品|颈枕、头枕,奥特莱芙 蕾丝豹纹系列汽车内饰颈枕靠枕 棕豹纹,汽车用品>内饰精品>颈枕/头枕>奥特莱芙 蕾丝豹纹系列汽车内饰颈枕靠枕 ...,京东商城,奥特莱芙旗舰店1004006004,汽车摩托|内饰精品|颈枕、头枕,摩丝娃娃 单只 卡通造型车用头枕 粉色蝴蝶结(粉条纹),汽车用品>内饰精品>颈枕/头枕>其他>摩丝娃娃 单只 卡通造型车用头枕 粉色蝴...,京东商城,狼巴克专营店1004006004,汽车摩托|内饰精品|颈枕、头枕,御指环 记忆棉颈椎依附骨头型头枕 车用骨头枕 汽车护颈枕通用型 010-包装盒,汽车用品>内饰精品>颈枕/头枕>御指环 记忆棉颈椎依附骨头型头枕 车用骨...,京东商城,翱途车品专营店1004006004,汽车摩托|内饰精品|颈枕、头枕,福客思魅惑档把套(手自一体波),汽车用品 > 汽车内饰 > 头枕,亚马逊(卓越网),福客思1004006004,汽车摩托|内饰精品|颈枕、头枕,福客思 F款记忆棉护腰腰枕 F-YM01F-B,汽车用品 > 汽车内饰 > 头枕,亚马逊(卓越网),福客思1004006004,汽车摩托|内饰精品|颈枕、头枕,爱车屋 ICAROOM I-101A 车用骨头枕1个入,汽车用品 > 汽车内饰 > 头枕,亚马逊(卓越网),ICAROOM 爱车屋1004006004,汽车摩托|内饰精品|颈枕、头枕,爱车屋 ICAROOM BQ-10301B 汽车荞麦护颈枕,汽车用品 > 汽车内饰 > 头枕,亚马逊(卓越网),ICAROOM 爱车屋1004006004,汽车摩托|内饰精品|颈枕、头枕,爱车屋 经典B系列安睡舒适U枕 颈枕 U型枕 I-110B 30CM*26CM 深棕色+浅棕色,汽车用品 > 汽车内饰 > 头枕,亚马逊(卓越网),ICAROOM 爱车屋1004006004,汽车摩托|内饰精品|颈枕、头枕,爱图腾 汽车头枕 PU皮革 护颈枕 车用头枕 汽车用品（对装）土黄色,汽车用品/类别/汽车内饰/头枕,亚马逊(卓越网),爱图腾1004006004,汽车摩托|内饰精品|颈枕、头枕,Astroboy 铁臂阿童木斜纹麂皮绒 精工电绣家居 车用方形大抱枕 单个 BZDP-01G （阿童木站姿灰色）,首页>汽车用品>内饰精品>头枕/颈枕>Astroboy铁臂阿童木斜纹麂皮...,苏宁,阿童木1004006004,汽车摩托|内饰精品|颈枕、头枕,沿途I24 打孔汽车头枕 护颈枕 车枕骨头枕靠枕 汽车用品车饰 对装 黑红,首页>汽车用品>内饰精品>头枕/颈枕>沿途I24打孔汽车头枕护颈枕车...,苏宁,沿途1004006004,汽车摩托|内饰精品|颈枕、头枕,Circle搜酷 新款高档透气 骨头枕 汽车头枕 枕颈 记忆棉头枕 汽车头靠枕一对装车饰品 米色,汽车用品>汽车装饰>头枕腰靠>其它>Circle搜酷 新款高档透气 骨头枕 ...,京东商城,圣地亚格汽车用品专营店1004006004,汽车摩托|内饰精品|颈枕、头枕,马迪奥（MATTEO） MA-T01 时尚豹纹记忆棉骨头枕 2只装（黑色）,汽车用品>内饰精品>颈枕/头枕>马迪奥（MATTEO）>马迪奥MA-T01,京东商城,马迪奥（MATTEO）1004006004,汽车摩托|内饰精品|颈枕、头枕,研美车配 U型枕（炭制品）,汽车用品 > 汽车内饰 > 头枕,亚马逊(卓越网),研美车配1004006004,汽车摩托|内饰精品|颈枕、头枕,沿途I24 头枕 真皮A款 打孔 对装 黑色,汽车用品 > 颈枕/抱枕/腰靠 > 沿途,国美电器网上商城,1004006004,汽车摩托|内饰精品|颈枕、头枕,爱车屋(Icaroom)H-101N车用1个入骨头枕(咖啡色)(悠闲生活),汽车用品 > 颈枕/抱枕/腰靠 > 爱车屋,国美电器网上商城,1004006004,汽车摩托|内饰精品|颈枕、头枕,淇淇(QIQI)D-K系列8112记忆棉舒适颈枕(米色),汽车用品 > 颈枕/抱枕/腰靠 > 淇淇,国美电器网上商城,1004006004,汽车摩托|内饰精品|颈枕、头枕,淇淇(QIQI)D-K系列8312记忆棉舒适颈枕(灰色),汽车用品 > 颈枕/抱枕/腰靠 > 淇淇,国美电器网上商城,1004006004,汽车摩托|内饰精品|颈枕、头枕,汽车毛绒颈枕/可爱熊猫头枕/车用护颈枕/汽车头枕 座椅头枕 单只,汽车用品 > 颈枕/抱枕/腰靠 > 卡客,国美电器网上商城,1004006004,汽车摩托|内饰精品|颈枕、头枕,FREEMAN透气 不变形 双珠地太空记忆绵 汽车头枕 颈枕 车用头枕,汽车用品 > 颈枕/抱枕/腰靠 > 自由人,国美电器网上商城,1004006004,汽车摩托|内饰精品|颈枕、头枕,车之颜CB523运动休闲记忆棉舒爽腰靠(灰色),汽车用品 > 颈枕/抱枕/腰靠 > 车之颜,国美电器网上商城,1004006004,汽车摩托|内饰精品|颈枕、头枕,车之颜水曜系列C-1202车用太空记忆棉骨头枕,汽车用品 > 颈枕/抱枕/腰靠 > 车之颜,国美电器网上商城,1004006004,汽车摩托|内饰精品|颈枕、头枕,希为尔竹炭抱枕 骨头枕 汽车抱枕颈枕头枕 腰靠 四件套 (BJZ013),家用/类别/家居/床上用品/抱枕靠垫,亚马逊(卓越网),希为尔1004006004,汽车摩托|内饰精品|颈枕、头枕,史努比慢回弹记忆棉保健骨头枕 汽车头枕 颈枕 靠枕对装 (红色),汽车用品/类别,亚马逊(卓越网),-1004006004,汽车摩托|内饰精品|颈枕、头枕,GiGi 吉吉 太空记忆棉行车头枕 G-1107-G (灰色),汽车用品 > 汽车内饰 > 头枕,亚马逊(卓越网),GiGi 吉吉1004006004,汽车摩托|内饰精品|颈枕、头枕,【 法国品尚车居】丽影太空棉护颈枕P251 品尚车居高档 记忆棉 汽车头枕颈枕 车用护颈枕 慢回弹车枕精品内饰,汽车用品/类别/汽车内饰/头枕,亚马逊(卓越网),法国品尚车居1004006004,汽车摩托|内饰精品|颈枕、头枕,SUV 爱思优威 征服系列颈枕 头枕 进口绒布 细腻防皱 (黑色),汽车用品 > 汽车内饰 > 头枕 ,亚马逊(卓越网),SUV 爱思优威1004006004,汽车摩托|内饰精品|颈枕、头枕,科馀 加大吉吉真皮颈枕 真皮头枕 汽车头枕 车颈枕对装 灰色竖条,汽车用品 > 汽车内饰 > 头枕,亚马逊(卓越网),科馀1004006004,汽车摩托|内饰精品|颈枕、头枕,睿博 加厚毛绒汽车抱枕被 喜羊羊卡通车空调被 空调被抱枕 粉红色,汽车用品 > 汽车内饰 > 头枕,亚马逊(卓越网),睿博1004006004,汽车摩托|内饰精品|颈枕、头枕,奔克 现代瑞纳专免打孔扶手箱 带杯架烟缸 米 灰 黑 黑色,汽车用品/类别/汽车内饰/头枕,亚马逊(卓越网),奔克1004006004,汽车摩托|内饰精品|颈枕、头枕,睿博 加厚毛绒汽车抱枕被 机器猫卡通车空调被 空调被抱枕 蓝色,汽车用品 > 汽车内饰 > 头枕,亚马逊(卓越网),睿博1004006004,汽车摩托|内饰精品|颈枕、头枕,卡饰社 舒适抱枕被 咖啡色 CS-27317,汽车用品>头枕/颈枕/抱枕>卡饰社>卡饰社 舒适抱枕被 咖啡色 CS-27317,国美电器网上商城,东莞港威车品专营店1004006004,汽车摩托|内饰精品|颈枕、头枕,欧美佳 竹炭记忆棉U形枕汽车用头枕护颈枕午睡枕旅行枕护脖子u型枕 米色单个,汽车用品 > 汽车内饰 > 头枕,亚马逊(卓越网),欧美佳1004006004,汽车摩托|内饰精品|颈枕、头枕,QIQI 淇淇 汽车用品车用抱枕头枕 汽车抱枕汽车颈枕靠枕套装 不言中抱枕四件套,汽车用品 > 汽车内饰 > 车用腰靠,亚马逊(卓越网),QiQi 淇淇1004006004,汽车摩托|内饰精品|颈枕、头枕,WRC汽车用奢华碳纤纹 头颈枕骨头枕腰靠枕 两头枕一腰靠 三款一体 组合套装办公家用 黑红色,汽车用品 > 汽车内饰 > 头枕,亚马逊(卓越网),WRC1004006004,汽车摩托|内饰精品|颈枕、头枕,爱车屋 皇家风范达芬奇紫色系头枕颈枕(单个装)D-233Z,汽车用品 > 汽车内饰 > 头枕,亚马逊(卓越网),ICAROOM 爱车屋1004006004,汽车摩托|内饰精品|颈枕、头枕,法国 品尚车居简爱自动波三件套P245(自动波保护套，减少手出汗带来的不舒服感，汽车内饰),汽车用品 > 汽车内饰 > 头枕,亚马逊(卓越网),品尚车居 旗舰店1004006004,汽车摩托|内饰精品|颈枕、头枕,法国 品尚车居星羽记忆棉舒适腰枕P288(记忆太空棉腰靠，汽车内饰，舒适腰靠),汽车用品 > 汽车内饰 > 头枕,亚马逊(卓越网),品尚车居 旗舰店1004006004,汽车摩托|内饰精品|颈枕、头枕,MephisCar 墨菲斯卡 MF-830 福特嘉年华专车专用带颈枕三明治全车套 (黑灰),汽车用品 > 汽车内饰 > 汽车座套 > 专车专用座套,亚马逊(卓越网),MephisCar 墨菲斯卡1004006004,汽车摩托|内饰精品|颈枕、头枕,MephisCar 墨菲斯卡 MF-811 别克君越专车专用带颈枕三明治全车套 (黑红),汽车用品 > 汽车内饰 > 汽车座套 > 专车专用座套,亚马逊(卓越网),MephisCar 墨菲斯卡1004006004,汽车摩托|内饰精品|颈枕、头枕,MephisCar 墨菲斯卡 MF-834 奇瑞QQ3专车专用带颈枕三明治全车套 (黑灰),汽车用品 > 汽车内饰 > 汽车座套 > 专车专用座套,亚马逊(卓越网),MephisCar 墨菲斯卡1004006004,汽车摩托|内饰精品|颈枕、头枕,MephisCar 墨菲斯卡 MF-874 铃木福瑞达专车专用带颈枕三明治全车套 (黑灰),汽车用品 > 汽车内饰 > 汽车座套 > 专车专用座套,亚马逊(卓越网),MephisCar 墨菲斯卡1004006004,汽车摩托|内饰精品|颈枕、头枕,MephisCar 墨菲斯卡 MF-709 丰田花冠专车专用带颈枕三明治全车套 (黑红),汽车用品 > 汽车内饰 > 汽车座套 > 专车专用座套,亚马逊(卓越网),MephisCar 墨菲斯卡1004006004,汽车摩托|内饰精品|颈枕、头枕,MephisCar 墨菲斯卡 MF-702 本田思迪专车专用带颈枕三明治全车套 (黑灰),汽车用品 > 汽车内饰 > 汽车座套 > 专车专用座套,亚马逊(卓越网),MephisCar 墨菲斯卡1004006004,汽车摩托|内饰精品|颈枕、头枕,MephisCar 墨菲斯卡 MF-809 别克凯越专车专用带颈枕三明治全车套 (黑红),汽车用品 > 汽车内饰 > 汽车座套 > 专车专用座套,亚马逊(卓越网),MephisCar 墨菲斯卡1004006004,汽车摩托|内饰精品|颈枕、头枕,MephisCar 墨菲斯卡 MF-852 长城腾翼C30专车专用带颈枕三明治全车套 (黑灰),汽车用品 > 汽车内饰 > 汽车座套 > 专车专用座套,亚马逊(卓越网),MephisCar 墨菲斯卡1004006004,汽车摩托|内饰精品|颈枕、头枕,MephisCar 墨菲斯卡 MF-734 马自达马2专车专用带颈枕三明治全车套 (黑灰),汽车用品 > 汽车内饰 > 汽车座套 > 专车专用座套,亚马逊(卓越网),MephisCar 墨菲斯卡1004006004,汽车摩托|内饰精品|颈枕、头枕,MephisCar 墨菲斯卡 MF-829 福特嘉年华专车专用带颈枕三明治全车套 (黑红),汽车用品 > 汽车内饰 > 汽车座套 > 专车专用座套,亚马逊(卓越网),MephisCar 墨菲斯卡1004006004,汽车摩托|内饰精品|颈枕、头枕,MephisCar 墨菲斯卡 MF-790 现代瑞纳专车专用带颈枕三明治全车套 (黑灰),汽车用品 > 汽车内饰 > 汽车座套 > 专车专用座套,亚马逊(卓越网),MephisCar 墨菲斯卡1004006004,汽车摩托|内饰精品|颈枕、头枕,GiGi 竹炭记忆棉骨头枕 护颈靠枕颈枕 护颈枕垫枕G1221 黑色,汽车用品 > 汽车内饰 > 头枕,亚马逊(卓越网),GiGi1004006004,汽车摩托|内饰精品|颈枕、头枕,GiGi/吉吉 汽车颈枕 太空记忆棉骨头枕 G-W107,所有分类>大小家电、厨电、汽车>汽车生活>汽车内饰>抱枕靠枕>GiGi/吉吉>GiGi/吉吉 汽车...,1号店,GiGi/吉吉1004006004,汽车摩托|内饰精品|颈枕、头枕,路奈 汽车头枕 车用骨颈枕 汽车靠枕 QC-24,所有分类>大小家电、厨电、汽车>汽车生活>汽车内饰>抱枕靠枕>路奈>路奈 汽车头枕 车用...,1号店,路奈1004006004,汽车摩托|内饰精品|颈枕、头枕,奥特莱芙 可可公主裙摆 汽车头枕 车用颈枕 可爱护颈枕对装,汽车用品 > 汽车内饰 > 头枕,亚马逊(卓越网),奥特莱芙1004006004,汽车摩托|内饰精品|颈枕、头枕,GiGi 吉吉 太空记忆棉简约头枕G1207 (黑色),汽车用品 > 汽车内饰 > 头枕,亚马逊(卓越网),GiGi1004006004,汽车摩托|内饰精品|颈枕、头枕,张小盒卡通汽车内饰装饰 夏季可爱车用内饰 亚麻材料舒适清凉 海洋舒适U枕(记忆棉)(米色),汽车用品 > 汽车内饰 > 头枕,亚马逊(卓越网),张小盒1004006004,汽车摩托|内饰精品|颈枕、头枕,蒙奇奇汽车骨头枕 车用靠枕 车枕 颈枕 可爱 卡通 奶茶色汽车头枕,汽车用品 > 汽车内饰 > 头枕,亚马逊(卓越网),美车仔1004006004,汽车摩托|内饰精品|颈枕、头枕,【厂家直销】圣洁亚 亚麻车用颈枕 头枕 灰色,汽车用品>内饰精品>颈枕/头枕>其它>【厂家直销】圣洁亚 亚麻车用颈枕 头枕 ...,京东商城,圣洁亚专营店1004006004,汽车摩托|内饰精品|颈枕、头枕,【货到付款】【免邮】淇淇D-K 记忆棉车用颈枕 汽车头枕 护颈枕 亚麻车内靠枕车枕,淇淇（QIQI）>【货到付款】【免邮】淇淇D-K 记忆棉车...,京东商城,在舟车品专营店1004006004,汽车摩托|内饰精品|颈枕、头枕,单车岁月 汽车头枕 太空记忆棉颈枕 护颈枕头 汽车用品 车用骨头枕 sports款 单个装,生活电器、汽车生活>汽车生活>车饰精品>抱枕靠枕,1号店,单车岁月