1004006006,汽车摩托|内饰精品|方向盘套,【京东自营】车德克 中号 超手感3D立体麂皮绒汽车方向盘套 红色,汽车用品>内饰精品>方向盘套>车德克（CEDEKE）>车德克方向盘套,京东商城,车德克（CEDEKE）1004006006,汽车摩托|内饰精品|方向盘套,车之秀品 秋冬款 38cm 毛绒汽车方向把套 方向盘套 BT02 米色,汽车用品>内饰精品>方向盘套>车之秀品 秋冬款 38cm 毛绒汽车方向...,京东商城,车之秀品汽车用品旗舰店1004006006,汽车摩托|内饰精品|方向盘套,威卡司Vacarx 高级汽车方向盘套 VA-106C,汽车用品>内饰精品>方向盘套>威卡司（Vacarx）>威卡司VA-106C,京东商城,威卡司（Vacarx）1004006006,汽车摩托|内饰精品|方向盘套,TYPE-R TR-C085 真皮方向盘套--简尚风范 米色,汽车、保养、装饰 > 汽车装饰 > 方向盘套,易迅网,TYPE-R1004006006,汽车摩托|内饰精品|方向盘套,佳露思（CARAX) 冬季毛绒方向盘套 CR-117,汽车用品>内饰精品>方向盘套>卡莱饰（Car lives）>佳露思CR-117,京东商城,卡莱饰（Car lives）1004006006,汽车摩托|内饰精品|方向盘套,悠嘻猴 夏季冰丝方向盘套 卡通环保把套 中号米色款,汽车、保养、装饰 > 汽车装饰 > 方向盘套,易迅网,1004006006,汽车摩托|内饰精品|方向盘套,北通169方向盘 BT3169 新款游戏方向盘北通方向 yxw,当当网 > 电脑办公 > 电脑外设 > 游戏设备,当当网,北通1004006006,汽车摩托|内饰精品|方向盘套,TYPE-R TR-C039 手缝式方向盘套 灰色,汽车、保养、装饰 > 汽车装饰 > 方向盘套,易迅网,TYPE-R1004006006,汽车摩托|内饰精品|方向盘套,伊仕百得（Exspider）高级炫酷3D汽车方向盘套 SW007BR 炫惑红,汽车用品>内饰精品>方向盘套>伊仕百得（exsoider）>伊仕百得SW007BR,京东商城,伊仕百得（exsoider）1004006006,汽车摩托|内饰精品|方向盘套,佳露思（CARAX) 冬季毛绒方向盘套 CR-113,汽车用品>内饰精品>方向盘套>卡莱饰（Car lives）>佳露思CR-113,京东商城,卡莱饰（Car lives）1004006006,汽车摩托|内饰精品|方向盘套,美奈高级汽车把套 (名格系列 FPM-5103X 黑色),汽车用品 > 汽车内饰 > 方向盘套,亚马逊(卓越网),美奈1004006006,汽车摩托|内饰精品|方向盘套,TYPE-R TR-C092 方向盘套系列之炫彩风情 米色,汽车、保养、装饰 > 汽车装饰 > 方向盘套,易迅网,TYPE-R1004006006,汽车摩托|内饰精品|方向盘套,尤师傅 新款汽车方向盘套 真皮牛皮把套 黄牛皮顶级头层 中号无论品质和手感都是一流,当当网 > 汽车用品 > 车内饰品 > 方向盘套,当当网,尤师傅1004006006,汽车摩托|内饰精品|方向盘套,美每车 镖王运动型把套 汽车方向盘套 真皮把套 四季通用 牛皮系列 手握黑色,汽车用品 > 汽车内饰 > 方向盘套,亚马逊(卓越网),镖王1004006006,汽车摩托|内饰精品|方向盘套,艾瑞司 威卡司 Vacarx VA-105B 红蝶梦方向盘套（舒适的手感,带给您愉快的好心情 红色）,汽车用品 > 汽车内饰 > 方向盘套,亚马逊(卓越网),Vacarx 威卡司1004006006,汽车摩托|内饰精品|方向盘套,尤师傅新款胜羊羔皮汽车方向盘套福克斯明锐POLO速腾红汽车把套真皮把套,四色可选,当当网 > 汽车用品 > 车内饰品 > 方向盘套,当当网,尤师傅1004006006,汽车摩托|内饰精品|方向盘套,镖王 高级毛绒汽车方向盘套 冬季毛把套 高档舒棉绒把套 黑色带花纹,汽车用品 > 汽车内饰 > 方向盘套 ,亚马逊(卓越网),镖王1004006006,汽车摩托|内饰精品|方向盘套,中腾 麂皮绒超手感3D方向盘套 中号 灰色,汽车用品 > 汽车内饰 > 方向盘套,亚马逊(卓越网),中腾1004006006,汽车摩托|内饰精品|方向盘套,泰普尔TR-C033 QQ方向盘套(黑.中),汽车用品 > 汽车内饰 > 方向盘套,亚马逊(卓越网),Typer 泰普尔1004006006,汽车摩托|内饰精品|方向盘套,泰普尔TYPE-R 车用进口小牛皮方向盘套 TR-8008 （ 米色）,汽车用品 > 汽车内饰 > 方向盘套,亚马逊(卓越网),Typer 泰普尔1004006006,汽车摩托|内饰精品|方向盘套,车德克中号超手感3D立体麂皮绒汽车方向盘套(米色),首页>汽车用品>内饰精品>方向盘套>车德克中号超手感3D立体麂皮绒汽车方...,苏宁,车德克1004006006,汽车摩托|内饰精品|方向盘套,新款蒙奇奇方向盘套 奶茶色卡通毛绒把套 刺绣蒙奇奇把套,汽车用品 > 车饰精品 > 车内饰品 > 商品详情,当当网,蒙奇奇1004006006,汽车摩托|内饰精品|方向盘套,泰普尔TR-8035 台湾小牛皮方向盘套,汽车用品 > 汽车内饰 > 方向盘套,亚马逊(卓越网),Typer 泰普尔1004006006,汽车摩托|内饰精品|方向盘套,泰普尔TR-C005 凌捷方向盘套(黑+银),汽车用品 > 汽车内饰 > 方向盘套,亚马逊(卓越网),Typer 泰普尔1004006006,汽车摩托|内饰精品|方向盘套,CEDEKE 车德克方向盘套纯色仿羊绒中号(黄色),汽车用品 > 汽车内饰 > 方向盘套,亚马逊(卓越网),Cedeke 车德克1004006006,汽车摩托|内饰精品|方向盘套,虎贝尔 方向盘套 冰丝 新款汽车把套 科鲁兹福克斯凯越朗逸新速腾 单个H410,所有分类>大小家电、厨电、汽车>汽车生活>汽车内饰>方向盘套>虎贝尔>虎贝尔 方向盘套 冰...,1号店,虎贝尔1004006006,汽车摩托|内饰精品|方向盘套,安美弛 高级冰丝方向盘套B款 中号 四季通用 米黄,所有分类>大小家电、厨电、汽车>汽车生活>汽车内饰>方向盘套>安美弛>安美弛 高级冰丝方向...,1号店,安美弛1004006006,汽车摩托|内饰精品|方向盘套,虎贝尔 3D冬季麂皮绒方向盘套38CM H407,所有分类>大小家电、厨电、汽车>汽车生活>汽车内饰>方向盘套>虎贝尔>虎贝尔 3D冬季麂皮...,1号店,虎贝尔1004006006,汽车摩托|内饰精品|方向盘套,木丁西 手缝方向盘套汽车把套 DIY手缝 真皮方向盘套 整张皮单接头牛皮把套,所有分类>大小家电、厨电、汽车>汽车生活>汽车内饰>方向盘套>木丁西>木丁西 手缝方向盘套...,1号店,木丁西1004006006,汽车摩托|内饰精品|方向盘套,TYPER TR-V099a 超柔真皮手缝激光刺方向盘套,所有分类 > 汽车生活 > 内饰用品 > 方向盘套 > TYPER,1号店,1004006006,汽车摩托|内饰精品|方向盘套,仟丝结 冬季毛绒方向盘套 金丝绒+仿貂毛 红黑色(白色环保内圈 超柔绒毛 手感舒适 不掉毛吸汗防滑 耐磨不褪色 冬季爱车必备！),汽车用品 > 汽车内饰 > 方向盘套,亚马逊(卓越网),仟丝结1004006006,汽车摩托|内饰精品|方向盘套,Karcle新款 高档 真皮 头层 牛皮 汽车方向盘套 运动款 汽车把套,汽车用品 > 车饰精品 > 车内饰品 > 商品详情,当当网,Karcle1004006006,汽车摩托|内饰精品|方向盘套,【京东自营】卡莱饰 3D透气三明治汽车方向盘套 中号 黑色,汽车用品>内饰精品>方向盘套>卡莱饰（Car lives）>卡莱饰方向盘套,京东商城,卡莱饰（Car lives）1004006006,汽车摩托|内饰精品|方向盘套,魅驹 高档超纤皮方向盘套 波浪形把套 方向盘 套 四季通用 黑色,汽车用品>内饰精品>方向盘套>魅驹 高档超纤皮方向盘套 波浪形把套 方...,京东商城,魅驹车品旗舰店1004006006,汽车摩托|内饰精品|方向盘套,马车夫COACHMAN 毛绒方向盘套 暖冬仿羊绒车用把套 黑色,汽车用品>内饰精品>方向盘套>马车夫（COACHMAN）>马车夫COACHMAN 毛绒方向盘套 暖...,京东商城,马车夫旗舰店1004006006,汽车摩托|内饰精品|方向盘套,魅驹 防滑方向盘套 夏季把套 四季通用 把套 方向盘 套 棕色,汽车用品>内饰精品>方向盘套>魅驹 防滑方向盘套 夏季把套 四季通用...,京东商城,魅驹车品旗舰店1004006006,汽车摩托|内饰精品|方向盘套,嗨车族 （头层牛皮）真皮汽车方向盘套 真皮吸汗防滑把套 时尚款BT-101 暗红+米,汽车用品>内饰精品>方向盘套>嗨车族>嗨车族 （头层牛皮）真皮汽车方向盘套 真...,京东商城,嗨车族旗舰店1004006006,汽车摩托|内饰精品|方向盘套,振飞 汽车用品 日本Napolex万圣节幽灵杰克Jack汽车方向盘套NT-11,汽车用品 > 汽车内饰 > 方向盘套,亚马逊(卓越网),NAPOLEX1004006006,汽车摩托|内饰精品|方向盘套,悠嘻猴 四季通用超柔绒方向盘套 卡通环保把套 中号灰黑色款,汽车、保养、装饰 > 汽车装饰 > 方向盘套,易迅网,悠嘻猴1004006006,汽车摩托|内饰精品|方向盘套,悠嘻猴四季通用超柔绒方向盘套（米啡色）（卡通环保把套/中号）,汽车用品>方向盘套>悠嘻猴>悠嘻猴四季通用超柔绒方向盘套（米啡色）（卡通环保把套/中号）,国美电器网上商城,悠嘻猴1004006006,汽车摩托|内饰精品|方向盘套,当家 优质超柔毛绒汽车方向盘套 超柔毛绒把套超柔毛绒把套,当当网 > 汽车用品 > 车内饰品 > 方向盘套,当当网,车当家1004006006,汽车摩托|内饰精品|方向盘套,车当家 优质超柔毛绒汽车方向盘套 超柔毛绒把套 灰色,车当家>车当家 优质超柔毛绒汽车方向盘套 超柔...,京东商城,车当家京东旗舰店1004006006,汽车摩托|内饰精品|方向盘套,乔氏 车饰精品 冰丝车用方向盘套 中号38cm M码卡其米,汽车用品>内饰精品>方向盘套>乔氏>乔氏 车饰精品 冰丝车用方向盘套 中号3...,京东商城,乔氏车品旗舰店1004006006,汽车摩托|内饰精品|方向盘套,安美弛 汽车毛绒方向盘套 冬季圈圈方向盘把套 AM-2148 米色,汽车用品>内饰精品>方向盘套>安美弛>安美弛 汽车毛绒方向盘套 冬季圈圈方向盘...,京东商城,安美弛旗舰店1004006006,汽车摩托|内饰精品|方向盘套,迪加伦 手感舒适毛绒汽车方向盘套 冬季防羊毛车用把套用品 灰色,汽车用品>内饰精品>方向盘套>其他>迪加伦 手感舒适毛绒汽车方向盘套 冬季防...,京东商城,迪加伦旗舰店1004006006,汽车摩托|内饰精品|方向盘套,魅惑 bt05 汽车把套 可爱车饰 短毛绒方向盘套 四季通用 汽车用品, 汽车、保养、装饰 > 汽车内饰 > 方向盘套 ,易迅网,  魅惑  1004006006,汽车摩托|内饰精品|方向盘套,卡饰社 毛绒方向盘套 灰色 CS-27595,汽车用品 > 车饰精品 > 车内饰品 > 商品详情,当当网,卡饰社1004006006,汽车摩托|内饰精品|方向盘套,魅惑 秋冬短毛绒方向盘套中号 bt05,汽车用品 > 汽车内饰 > 方向盘套,亚马逊(卓越网),魅惑1004006006,汽车摩托|内饰精品|方向盘套,蒂索 TISO 高级真皮汽车方向盘套 TS8005,汽车内饰>方向盘套,为为网,蒂索1004006006,汽车摩托|内饰精品|方向盘套,优尔卡 雕花冰丝方向盘套 黑底红花 17703   ,汽车用品>汽车内饰>方向盘套>优尔卡 雕花冰丝方向盘套 黑底红花 17703   ,为为网,优尔卡1004006006,汽车摩托|内饰精品|方向盘套,美车仔 蒙奇奇方向盘套 卡通毛绒把套 蒙奇奇字母把套,汽车用品 > 汽车内饰 > 方向盘套,亚马逊(卓越网),美车仔1004006006,汽车摩托|内饰精品|方向盘套,GREAT LIFE 格雷特 GLT-278G 新款手编超纤皮方向盘套 四季通用 防滑透气 汽车把手套 灰色,汽车用品 > 汽车内饰 > 垃圾桶,亚马逊(卓越网),Great Life 格雷特1004006006,汽车摩托|内饰精品|方向盘套,威特 方向盘把套 王者系列 1201 灰 小号,汽车用品 > 汽车内饰 > 方向盘套,亚马逊(卓越网),威特1004006006,汽车摩托|内饰精品|方向盘套,larento 老人头 FLR-B8502 3D把套 方向盘套 (灰色),汽车用品 > 汽车内饰 > 方向盘套,亚马逊(卓越网),LAORENTOU 老人头1004006006,汽车摩托|内饰精品|方向盘套,金火鸟 K-BT0513-B 优质生活 真皮成型方向盘套 米色,汽车用品 > 汽车内饰 > 方向盘套,亚马逊(卓越网),金火鸟1004006006,汽车摩托|内饰精品|方向盘套,爱车美 真皮大花纹亮皮方向盘套 中号把套 豪华高档汽车方向盘套 (红色),汽车用品 > 汽车内饰 > 方向盘套,亚马逊(卓越网),爱车美1004006006,汽车摩托|内饰精品|方向盘套,larento 老人头 达芬奇 FLR-B1606 真皮方向套 (米色),汽车用品 > 汽车内饰 > 方向盘套,亚马逊(卓越网),LAORENTOU 老人头1004006006,汽车摩托|内饰精品|方向盘套,MATTEO 马迪奥 个性皮质时尚斑马纹方向盘套, 汽车、保养、装饰 > 汽车内饰 > 方向盘套 ,易迅网,  MATTEO 马迪奥  1004006006,汽车摩托|内饰精品|方向盘套,Vacarx/威卡司 夏季超透气防滑竹炭方向盘套/把套 防手汗 VA-104A,汽车用品 > 汽车内饰 > 方向盘套,亚马逊(卓越网),Vacarx 威卡司1004006006,汽车摩托|内饰精品|方向盘套,派奇士 3D立体超手感三明治方向盘套 灰色,汽车用品 > 汽车内饰 > 方向盘套,亚马逊(卓越网),派奇士1004006006,汽车摩托|内饰精品|方向盘套,TR-7722 依你手牵手方向盘套 (白线),汽车用品 > 汽车内饰 > 方向盘套,亚马逊(卓越网),Typer 泰普尔1004006006,汽车摩托|内饰精品|方向盘套,魅惑 高档韩国名媛时尚方向盘套MF07,汽车用品 > 汽车内饰 > 方向盘套,亚马逊(卓越网),魅惑1004006006,汽车摩托|内饰精品|方向盘套,GREAT LIFE 格雷特 GLT-281G 新款动感超纤立体方向盘套 四季通用 防滑透气 汽车把手套 灰色,汽车用品 > 汽车内饰 > 垃圾桶,亚马逊(卓越网),Great Life 格雷特1004006006,汽车摩托|内饰精品|方向盘套,Leston 莱斯顿 四季通用 真皮 运动型方向盘套 汽车方向盘套 汽车把套 黑白方向盘套 黑白牛皮把套 M码,汽车用品 > 汽车内饰 > 方向盘套,亚马逊(卓越网),Leston 莱斯顿1004006006,汽车摩托|内饰精品|方向盘套,美美熊冰麻丝方向盘套 MM-G1109,汽车内饰>方向盘套,为为网,美美熊1004006006,汽车摩托|内饰精品|方向盘套,贝丝鹭 三宽条花发光仿皮方向盘套 汽车方向盘套 汽车把套,汽车用品 > 汽车内饰 > 方向盘套,亚马逊(卓越网),VESSEL1004006006,汽车摩托|内饰精品|方向盘套,安美弛 AM-2151冬季花纹毛绒方向盘套 (灰色),汽车用品 > 汽车内饰 > 方向盘套,亚马逊(卓越网),安美弛1004006006,汽车摩托|内饰精品|方向盘套,安美弛 汽车毛绒方向盘套 冬季圈圈方向盘把套 AM-2148(米黄色),汽车用品 > 汽车内饰 > 方向盘套,亚马逊(卓越网),安美弛1004006006,汽车摩托|内饰精品|方向盘套,贝丝鹭 仿皮柔革+透气面料方向盘套 汽车方向盘套 汽车把套,汽车用品 > 汽车内饰 > 方向盘套,亚马逊(卓越网),VESSEL1004006006,汽车摩托|内饰精品|方向盘套,TR-C008 铜锣湾方向盘套(黑)(一条接口） (黑),汽车用品 > 汽车内饰 > 方向盘套,亚马逊(卓越网),Typer 泰普尔1004006006,汽车摩托|内饰精品|方向盘套,班卡奴 真皮方向盘套M0015 黑色中号,班卡奴>班卡奴 真皮方向盘套M0015 黑色中号,京东商城,易联保通车饰精品专营店1004006006,汽车摩托|内饰精品|方向盘套,神州泰坦 丰田新锐志 丰田雅力士 专用把套 真皮手缝把套 丰田新锐志黑线不带孔把套,汽车用品>内饰精品>方向盘套>其它>神州泰坦 丰田新锐志 丰田雅力士 专用把...,京东商城,欧华京东旗舰店1004006006,汽车摩托|内饰精品|方向盘套,车之吻 超柔牛奶绒方向盘套 汽车冬季毛绒把套 黑色,汽车用品>内饰精品>方向盘套>车之吻>车之吻汽车冬季毛绒把套,京东商城,车之吻1004006006,汽车摩托|内饰精品|方向盘套,泡泡酷 （popoku）POT 中号 突突长绒汽车方向盘套 (米色),汽车用品>内饰精品>方向盘套>泡泡酷（popoku）>泡泡酷POT,京东商城,泡泡酷（popoku）1004006006,汽车摩托|内饰精品|方向盘套,泡泡酷 （popoku）POT 中号 突突长绒汽车方向盘套 (灰色),汽车用品>内饰精品>方向盘套>泡泡酷（popoku）>泡泡酷POT,京东商城,泡泡酷（popoku）1004006006,汽车摩托|内饰精品|方向盘套,【金秋风暴】奥特莱芙 冬季钻石系列毛绒方向盘把套 A-605,汽车用品>内饰精品>方向盘套>【金秋风暴】奥特莱芙 冬季钻石系列毛绒方...,京东商城,奥特莱芙旗舰店1004006006,汽车摩托|内饰精品|方向盘套,劲迈龙真皮王子 高档真皮汽车方向盘套 四季通用 PL-9101 黑色金线,汽车用品>内饰精品>方向盘套>其他>劲迈龙真皮王子 高档真皮汽车方向盘套 四...,京东商城,劲迈龙车品专营店1004006006,汽车摩托|内饰精品|方向盘套,越野兵 多瑙河羊绒方向盘套 汽车方向盘套 M中号 优雅黑,汽车用品>内饰精品>方向盘套>越野兵 多瑙河羊绒方向盘套 汽车方向盘套...,京东商城,越野兵旗舰店1004006006,汽车摩托|内饰精品|方向盘套,越野兵 汽车方向盘套 毛绒款方向盘套 冬季把套保暖款 毛绒米,汽车用品>内饰精品>方向盘套>越野兵>越野兵 汽车方向盘套 毛绒款方向盘套 冬...,京东商城,越野兵车品专营店1004006006,汽车摩托|内饰精品|方向盘套,神州泰坦 年终热卖东风标致307 308 408 508 真皮手缝专用把套 东风标致408,汽车用品>内饰精品>方向盘套>其它>神州泰坦 年终热卖东风标致307 308...,京东商城,欧华京东旗舰店1004006006,汽车摩托|内饰精品|方向盘套,搜酷 冬季毛绒把套新款大众CC速腾迈腾朗行高尔夫朗境捷达朗逸方向盘套 汽车通用方向盘套 红加黑色,汽车用品>内饰精品>方向盘套>搜酷>搜酷 冬季毛绒把套新款大众CC速腾迈腾朗...,京东商城,圣地亚格汽车用品专营店1004006006,汽车摩托|内饰精品|方向盘套,班卡奴 真皮方向盘套M0046 米色中号,班卡奴>班卡奴 真皮方向盘套M0046 米色中号,京东商城,易联保通车饰精品专营店1004006006,汽车摩托|内饰精品|方向盘套,班卡奴 真皮方向盘套Y0015 黑色中号,班卡奴>班卡奴 真皮方向盘套Y0015 黑色中号,京东商城,易联保通车饰精品专营店1004006006,汽车摩托|内饰精品|方向盘套,劲迈龙真皮王子 优质毛绒汽车方向盘套 W-506 灰色(中号),汽车用品>内饰精品>方向盘套>其他>劲迈龙真皮王子 优质毛绒汽车方向盘套 W...,京东商城,劲迈龙车品专营店1004006006,汽车摩托|内饰精品|方向盘套,魔焕 汽车 方向盘套 冬季 新款 毛绒 超柔 不掉毛 中号 七色可选 灰色 中码38厘米,汽车用品>内饰精品>方向盘套>其它>魔焕 汽车 方向盘套 冬季 新款 毛绒 ...,京东商城,魔焕旗舰店1004006006,汽车摩托|内饰精品|方向盘套,索瑞尔Sorer 真皮汽车方向盘套 四季把套 黑咖色8149,汽车用品>内饰精品>方向盘套>索瑞尔>索瑞尔Sorer 真皮汽车方向盘套 四季...,京东商城,铠翼汽车用品专营店1004006006,汽车摩托|内饰精品|方向盘套,索瑞尔Sorer 真皮汽车方向盘套 四季把套 SR8161 米色,汽车用品>内饰精品>方向盘套>索瑞尔Sorer 真皮汽车方向盘套 四季...,京东商城,铠翼汽车用品专营店1004006006,汽车摩托|内饰精品|方向盘套,索瑞尔Sorer 真皮汽车方向盘套 四季把套 SR8160 灰色,汽车用品>内饰精品>方向盘套>索瑞尔Sorer 真皮汽车方向盘套 四...,京东商城,铠翼汽车用品专营店1004006006,汽车摩托|内饰精品|方向盘套,索瑞尔Sorer 真皮汽车方向盘套 四季把套 SR8148 米色,汽车用品>内饰精品>方向盘套>索瑞尔Sorer 真皮汽车方向盘套 四...,京东商城,铠翼汽车用品专营店1004006006,汽车摩托|内饰精品|方向盘套,索瑞尔Sorer 真皮方向盘套 汽车把套 SR8150 灰色,汽车用品>内饰精品>方向盘套>索瑞尔Sorer 真皮方向盘套 汽车把...,京东商城,铠翼汽车用品专营店1004006006,汽车摩托|内饰精品|方向盘套,索瑞尔Sorer 短毛绒汽车方向盘套 冬季把套SR8507 米色8509 大号,汽车用品>内饰精品>方向盘套>索瑞尔>索瑞尔Sorer 短毛绒汽车方向盘套 冬...,京东商城,铠翼汽车用品专营店1004006006,汽车摩托|内饰精品|方向盘套,索瑞尔Sorer 真皮汽车方向盘套 四季把套 SR8419 卡宴,汽车用品>内饰精品>方向盘套>索瑞尔>索瑞尔Sorer 真皮汽车方向盘套 四...,京东商城,铠翼汽车用品专营店1004006006,汽车摩托|内饰精品|方向盘套,思卡华英伦风汽车方向盘套 防滑防冻汽车把套,汽车用品>内饰精品>方向盘套>其它>思卡华英伦风汽车方向盘套 防滑防冻汽车把...,京东商城,思卡华旗舰店1004006006,汽车摩托|内饰精品|方向盘套,【厂价直销】木丁西 3D立体防滑 透气吸汗三明治网布透气乳胶汽车方向盘套 灰色,汽车用品>内饰精品>方向盘套>【厂价直销】木丁西 3D立体防滑 透气吸...,京东商城,狼巴克专营店1004006006,汽车摩托|内饰精品|方向盘套,Anjuny安程 汽车方向盘套系列 炫钻A款 卡其色,其它>Anjuny安程 汽车方向盘套系列 炫钻...,京东商城,车品王国1004006006,汽车摩托|内饰精品|方向盘套,Circle搜酷正品 13新款汽车方向盘套 时尚休闲韩版四季通用把套 白色,汽车用品>内饰精品>方向盘套>其它>Circle搜酷正品 13新款汽车方向盘...,京东商城,圣地亚格汽车用品专营店1004006006,汽车摩托|内饰精品|方向盘套,凤梧桐 新款防滑保暖羊毛把套 5钻灰色毛绒把套,汽车用品>内饰精品>方向盘套>凤梧桐 新款防滑保暖羊毛把套 5钻灰色毛...,京东商城,凤梧桐车品专营店1004006006,汽车摩托|内饰精品|方向盘套,爱思优威SUV真皮手缝方向盘套系列四季通用 黑、米、灰三色008# 米黄色,汽车用品>内饰精品>方向盘套>爱思优威（SUV）>爱思优威SUV真皮手缝方向盘套系列四季通...,京东商城,摩尔国际汽车用品旗舰店1004006006,汽车摩托|内饰精品|方向盘套,紫风铃 加密无内圈毛绒方向盘套 把套 黑色,汽车用品>内饰精品>方向盘套>紫风铃 加密无内圈毛绒方向盘套 把套 黑...,京东商城,紫风铃车品旗舰店1004006006,汽车摩托|内饰精品|方向盘套,立飒 仿羊剪绒汽车方向盘套 冬季汽车把套 可爱型 黑色 中号,汽车用品>内饰精品>方向盘套>立飒>立飒 仿羊剪绒汽车方向盘套 冬季汽车把套...,京东商城,立飒汽车用品专营店1004006006,汽车摩托|内饰精品|方向盘套,路易 新款手缝方向盘套 一节口FZ-2115系列,汽车用品>内饰精品>方向盘套>路易 新款手缝方向盘套 一节口FZ-21...,京东商城,环球汽车用品专营店1004006006,汽车摩托|内饰精品|方向盘套,【会员狂欢节】路易 真皮方向盘套 磁疗芳香系列 CL02款 灰色 中号,路易>【会员狂欢节】路易 真皮方向盘套 磁疗芳...,京东商城,环球汽车用品专营店1004006006,汽车摩托|内饰精品|方向盘套,【新气象-春】点将台 fa06天蚕丝pu汽车方向盘套 a3 下单备注车型,点将台 >【新气象-春】点将台 fa06天蚕丝pu...,京东商城,点将台旗舰店1004006006,汽车摩托|内饰精品|方向盘套,【新气象-春】点将台 fa09鹿皮绒3D汽车方向盘套 a4 下单备注车型,点将台 >【新气象-春】点将台 fa09鹿皮绒3D...,京东商城,点将台旗舰店1004006006,汽车摩托|内饰精品|方向盘套,金邦 高档超纤皮汽车用方向盘套 蓝灰色,金邦（GEIL）>金邦 高档超纤皮汽车用方向盘套 蓝灰色,京东商城,金邦车品旗舰店1004006006,汽车摩托|内饰精品|方向盘套,泰澄 汽车方向盘套新款 按摩珠把套 超纤皮四季通用方向盘套 黑黄,其它>泰澄 汽车方向盘套新款 按摩珠把套 超纤...,京东商城,泰澄车品专营店1004006006,汽车摩托|内饰精品|方向盘套,【会员狂欢节】路易 真皮方向盘套 王者系列 1205款 灰色 小号,路易>【会员狂欢节】路易 真皮方向盘套 王者系...,京东商城,环球汽车用品专营店1004006006,汽车摩托|内饰精品|方向盘套,神州泰坦 11年铃木雨燕 天语专用把套 真皮手缝把套 铃木11款雨燕黑线不带孔把套,汽车用品>内饰精品>方向盘套>其它>神州泰坦 11年铃木雨燕 天语专用把套 ...,京东商城,欧华京东旗舰店1004006006,汽车摩托|内饰精品|方向盘套,神州泰坦 三菱飞腾 三菱翼神 专用把套 真皮手缝把套 三菱飞腾红线不带孔把套,汽车用品>内饰精品>方向盘套>其它>神州泰坦 三菱飞腾 三菱翼神 专用把套 ...,京东商城,欧华京东旗舰店1004006006,汽车摩托|内饰精品|方向盘套,【会员狂欢节】路易 真皮方向盘套 超感真牛皮系列 CN05款 灰色 中号,路易>【会员狂欢节】路易 真皮方向盘套 超感真...,京东商城,环球汽车用品专营店1004006006,汽车摩托|内饰精品|方向盘套,神州泰坦 年终热卖日产骐达天籁本田雅阁思域 专车专用真皮手缝把套 日产颐达,汽车用品>内饰精品>方向盘套>其它>神州泰坦 年终热卖日产骐达天籁本田雅阁思...,京东商城,欧华京东旗舰店1004006006,汽车摩托|内饰精品|方向盘套,神州泰坦 本田12款CRV 老款CRV 新飞度 专用把套 真皮手缝把套 本田12款CRV黑线带孔把套,汽车用品>内饰精品>方向盘套>其它>神州泰坦 本田12款CRV 老款CRV ...,京东商城,欧华京东旗舰店