1004003016,汽车摩托|改装配件|车身装饰,斯沃德 T3专用扶手箱 免打孔专用中央手扶箱 改装专用 黑色 大众迈腾,汽车用品>汽车装饰>车身装饰件>华饰>斯沃德 T3专用扶手箱 免打孔专用中央...,京东商城,华奇饰车品专营店1004003016,汽车摩托|改装配件|车身装饰,斯沃德 T3专用扶手箱 免打孔专用中央手扶箱 改装专用 黑色 长安悦翔V3,汽车用品>汽车装饰>车身装饰件>华饰>斯沃德 T3专用扶手箱 免打孔专用中央...,京东商城,华奇饰车品专营店1004003016,汽车摩托|改装配件|车身装饰,斯沃德 TA专用扶手箱 免打孔专用中央手扶箱 改装专用 米色 本田锋范,汽车用品>汽车装饰>车身装饰件>华饰>斯沃德 TA专用扶手箱 免打孔专用中...,京东商城,华奇饰车品专营店1004003016,汽车摩托|改装配件|车身装饰,华饰 现代IX35专用前后大灯框 前后大灯罩 IX35改装 IX35尾灯框 改装 后灯罩,汽车用品>汽车装饰>车身装饰件>华饰>华饰 现代IX35专用前后大灯框 前后大...,京东商城,华奇饰车品专营店1004003016,汽车摩托|改装配件|车身装饰,华饰 T3拉手外拉手门把手 汽车改装专用外门碗保护装饰贴 门碗+拉手 雪弗兰新景程,华饰>华饰 T3拉手外拉手门把手 汽车改装专用...,京东商城,华奇饰车品专营店1004003016,汽车摩托|改装配件|车身装饰,华饰 2013款新宝来车窗饰条 13宝来车窗亮条 不锈钢包边 改装专用 全套车窗+中柱,华饰>华饰 2013款新宝来车窗饰条 13宝来...,京东商城,华奇饰车品专营店1004003016,汽车摩托|改装配件|车身装饰,华饰 11款新阳光 车窗饰条 车窗亮条 新阳光专用 新阳光改装 亮条 全套车窗亚光款,华饰>华饰 11款新阳光 车窗饰条 车窗亮条 ...,京东商城,华奇饰车品专营店1004003016,汽车摩托|改装配件|车身装饰,华饰 B50车窗饰条 奔腾b50车窗亮条 奔腾B50改装 车窗条 不锈钢装饰条 全车8件套,汽车用品>汽车装饰>车身装饰件>华饰>华饰 B50车窗饰条 奔腾b50车窗亮条...,京东商城,华奇饰车品专营店1004003016,汽车摩托|改装配件|车身装饰,华饰 荣威车窗饰条 荣威专用车窗亮条 荣威改装专用 不锈钢装饰条 全套车窗+中柱 荣威350,汽车用品>汽车装饰>车身装饰件>华饰>华饰 荣威车窗饰条 荣威专用车窗亮条 荣...,京东商城,华奇饰车品专营店1004003016,汽车摩托|改装配件|车身装饰,华饰 现代悦动车窗饰条 新悦动车窗亮条 08-12悦动改装 不锈钢装饰条 上车窗,汽车用品>汽车装饰>车身装饰件>华饰>华饰 现代悦动车窗饰条 新悦动车窗亮条 ...,京东商城,华奇饰车品专营店1004003016,汽车摩托|改装配件|车身装饰,华饰 全球鹰GC7车窗饰条 车窗亮条 GC7改装专用 不锈钢全窗装饰条 全套车窗,汽车用品>汽车装饰>车身装饰件>华饰>华饰 全球鹰GC7车窗饰条 车窗亮条 G...,京东商城,华奇饰车品专营店1004003016,汽车摩托|改装配件|车身装饰,华饰 中华H530 H320 V5 骏捷 车窗装饰亮条 不锈钢车窗饰条 全套车窗不含中柱 中华H530,汽车用品>汽车装饰>车身装饰件>华饰>华饰 中华H530 H320 V5 骏捷...,京东商城,华奇饰车品专营店1004003016,汽车摩托|改装配件|车身装饰,华饰 众泰Z300专用改装门碗贴 ABS电镀门碗 Z300装饰门碗贴 四片装,汽车用品>汽车装饰>车身装饰件>华饰>华饰 众泰Z300专用改装门碗贴 ABS...,京东商城,华奇饰车品专营店1004003016,汽车摩托|改装配件|车身装饰,华饰 T1拉手外拉手门把手 汽车外门碗保护 门碗 日产轩逸,汽车用品>汽车装饰>车身装饰件>华饰>华饰 T1拉手外拉手门把手 汽车外门碗保...,京东商城,华奇饰车品专营店1004003016,汽车摩托|改装配件|车身装饰,华饰 T1拉手外拉手门把手 汽车外门碗保护 拉手 起亚赛拉图,汽车用品>汽车装饰>车身装饰件>华饰>华饰 T1拉手外拉手门把手 汽车外门碗保...,京东商城,华奇饰车品专营店1004003016,汽车摩托|改装配件|车身装饰,华饰 T3 专车专用汽车注塑晴雨挡 注塑亮条晴雨挡雨眉 注塑透明带亮条带卡扣,汽车用品>汽车装饰>车身装饰件>华饰>华饰 T3 专车专用汽车注塑晴雨挡 注...,京东商城,华奇饰车品专营店1004003016,汽车摩托|改装配件|车身装饰,旋乐 18/19/20寸CV3改装款灰色银色亚黑 各数据全 汽车改装轮毂 前后配 19*9.5,汽车用品 > 轮胎 > 配件 > 轮毂罩,亚马逊(卓越网),旋乐1004003016,汽车摩托|改装配件|车身装饰,华饰 大众 车窗饰条 车窗亮条 不锈钢装饰条 改装专用 全套车窗+中柱 大众高尔夫6,汽车用品>汽车装饰>车身装饰件>华饰>华饰 大众 车窗饰条 车窗亮条 不锈钢装...,京东商城,华奇饰车品专营店1004003016,汽车摩托|改装配件|车身装饰,华饰 日产逍客 车窗饰条 车窗亮条 逍客不锈钢装饰条 逍客改装专用 全套车窗,汽车用品>汽车装饰>车身装饰件>华饰>华饰 日产逍客 车窗饰条 车窗亮条 逍客...,京东商城,华奇饰车品专营店1004003016,汽车摩托|改装配件|车身装饰,华饰 起亚狮跑 智跑车窗饰条 不锈钢车窗改装亮条饰条 中柱 起亚狮跑,汽车用品>汽车装饰>车身装饰件>华饰>华饰 起亚狮跑 智跑车窗饰条 不锈钢车窗...,京东商城,华奇饰车品专营店1004003016,汽车摩托|改装配件|车身装饰,华饰 奔驰GLK300车窗饰条 GLK350车窗亮条 车窗装饰条 改装专用 上车窗,汽车用品>汽车装饰>车身装饰件>华饰>华饰 奔驰GLK300车窗饰条 GLK3...,京东商城,华奇饰车品专营店1004003016,汽车摩托|改装配件|车身装饰,华饰 江淮瑞风S5车窗饰条 S5改装专用 车窗装饰亮条 s5不锈钢装饰条 中柱,汽车用品>汽车装饰>车身装饰件>华饰>华饰 江淮瑞风S5车窗饰条 S5改装专用...,京东商城,华奇饰车品专营店1004003016,汽车摩托|改装配件|车身装饰,华饰 雷诺风朗车窗饰条 风朗改装专用 车窗亮条 车身外装饰不锈钢亮片 亮条 中柱,汽车用品>汽车装饰>车身装饰件>华饰>华饰 雷诺风朗车窗饰条 风朗改装专用 车...,京东商城,华奇饰车品专营店1004003016,汽车摩托|改装配件|车身装饰,华饰 马自达CX-5车窗饰条 车窗改装亮条饰条 全套车窗,汽车用品>汽车装饰>车身装饰件>华饰>华饰 马自达CX-5车窗饰条 车窗改装亮...,京东商城,华奇饰车品专营店1004003016,汽车摩托|改装配件|车身装饰,华饰 丰田逸致EZ车窗饰条 车窗亮条 逸致改装专用 车窗亮条 车窗装饰条 上车窗,汽车用品>汽车装饰>车身装饰件>华饰>华饰 丰田逸致EZ车窗饰条 车窗亮条 逸...,京东商城,华奇饰车品专营店1004003016,汽车摩托|改装配件|车身装饰,宾马 现代新胜达汽车专用车窗饰条 亮条 不锈钢 中柱10件套,宾马 >宾马 现代新胜达汽车专用车窗饰条 亮条 ...,京东商城,天州车品专营店1004003016,汽车摩托|改装配件|车身装饰,宾马 起亚新索兰托汽车专用车窗饰条 亮条 不锈钢 中柱6件套,宾马 >宾马 起亚新索兰托汽车专用车窗饰条 亮条...,京东商城,天州车品专营店1004003016,汽车摩托|改装配件|车身装饰,宾马 O01汽车专车专用不锈钢油箱盖贴 永不掉色 奇瑞QQ,汽车用品>改装配件>其他配件>城市漫步>宾马 O01汽车专车专用不锈钢油箱盖贴 ...,京东商城,天州车品专营店1004003016,汽车摩托|改装配件|车身装饰,宾马 O01汽车专车专用不锈钢油箱盖贴 永不掉色 桑塔纳2000,汽车用品>改装配件>其他配件>城市漫步>宾马 O01汽车专车专用不锈钢油箱盖贴 ...,京东商城,天州车品专营店1004003016,汽车摩托|改装配件|车身装饰,B2 长城腾翼C30/C20R 凌傲/酷熊 炫丽 H5下窗不锈钢车窗饰条 改装亮 酷熊,汽车用品 > 汽车零件 > 内部零件 > 太阳防晒遮挡 > 隔热窗帘,亚马逊(卓越网),B2