1004008009,汽车摩托|摩托车装备|头盔,摩托车头盔 哈雷头盔 太子盔冬盔半盔 不含眼镜送围脖和帽檐,汽车用品 > 摩托车用品 > 头盔 > 商品详情,当当网,IBK1004008009,汽车摩托|摩托车装备|头盔,Justyle赛车头盔时尚纯棉短T恤 HWM1128057 军绿 S,服饰鞋帽>男装>T恤>Justyle>Justyle赛车头盔时尚纯棉短T恤 H...,京东商城,Justyle1004008009,汽车摩托|摩托车装备|头盔,Tanked Racing坦克T105摩托车电动车头盔全盔(L号 黑色GEISHA),汽车用品 > 摩托车用品 > 骑士护具 > 摩托车头盔 > 全盔,亚马逊(卓越网),Tanked Racing 坦克1004008009,汽车摩托|摩托车装备|头盔,TORC V210 美国品牌 双镜片 揭面盔 两用盔 摩托车头盔 全盔 (黑色AVIATOR XL),汽车用品 > 摩托车用品 > 骑士护具 > 摩托车头盔 > 全盔,亚马逊(卓越网),TORC1004008009,汽车摩托|摩托车装备|头盔,Tanked Racing 坦克 T523 摩托车 电动车 头盔 半盔(M号 黄色心心相印),汽车用品 > 摩托车用品 > 骑士护具 > 摩托车头盔 > 半盔,亚马逊(卓越网),Tanked Racing 坦克1004008009,汽车摩托|摩托车装备|头盔,Tanked Racing 坦克 T536摩托车 电动车 头盔 半盔(XL号 黑色HURR-1),汽车用品 > 摩托车用品 > 骑士护具 > 摩托车头盔 > 半盔,亚马逊(卓越网),Tanked Racing 坦克1004008009,汽车摩托|摩托车装备|头盔,TORC V541 美国品牌 复古半盔 摩托车头盔 哈雷版头盔 (白色 LOS XXL),汽车用品 > 摩托车用品 > 骑士护具 > 摩托车头盔 > 半盔,亚马逊(卓越网),TORC1004008009,汽车摩托|摩托车装备|头盔,Tanked Racing 坦克 T107摩托车 电动车 头盔 全盔(L号新蓝百家乐),汽车用品 > 摩托车用品 > 骑士护具 > 摩托车头盔 > 全盔,亚马逊(卓越网),Tanked Racing 坦克1004008009,汽车摩托|摩托车装备|头盔,Tanked Racing 坦克 T523 摩托车 电动车 头盔 半盔(L号 白色爱之初),汽车用品 > 摩托车用品 > 骑士护具 > 摩托车头盔 > 半盔,亚马逊(卓越网),Tanked Racing 坦克1004008009,汽车摩托|摩托车装备|头盔,Tanked Racing 坦克 T527 摩托车 电动车 头盔 半盔(M号 黑色),汽车用品 > 摩托车用品 > 骑士护具 > 摩托车头盔 > 半盔,亚马逊(卓越网),Tanked Racing 坦克1004008009,汽车摩托|摩托车装备|头盔,Tanked Racing 坦克 T340摩托车 电动车 头盔 越野盔(L号珠光白YBX),汽车用品 > 摩托车用品 > 骑士护具 > 摩托车头盔 > 越野摩托车头盔,亚马逊(卓越网),Tanked Racing 坦克1004008009,汽车摩托|摩托车装备|头盔,Tanked Racing 坦克 X370摩托车 电动车 头盔 公路越野 两用盔(L号亚黑零度),汽车用品 > 摩托车用品 > 骑士护具 > 摩托车头盔 > 越野摩托车头盔,亚马逊(卓越网),Tanked Racing 坦克1004008009,汽车摩托|摩托车装备|头盔,Tanked Racing 坦克 T527 摩托车 电动车 头盔 半盔(M号 新蓝),汽车用品 > 摩托车用品 > 骑士护具 > 摩托车头盔 > 半盔,亚马逊(卓越网),Tanked Racing 坦克1004008009,汽车摩托|摩托车装备|头盔,Tanked Racing 坦克 T200摩托车 电动车 头盔 揭面盔 两用盔(XL号白色),汽车用品 > 摩托车用品 > 骑士护具 > 摩托车头盔 > 全盔,亚马逊(卓越网),Tanked Racing 坦克1004008009,汽车摩托|摩托车装备|头盔,雨盛创导者YS-838单人大号摩托车雨衣电动车雨披 头盔式帽檐 宝蓝 838-XJ大号(配反光镜),家居家装>生活日用>雨伞雨具>雨盛创导者>雨盛创导者YS-838单人大号摩托车雨衣...,京东商城,强迪家居专营店1004008009,汽车摩托|摩托车装备|头盔,BAKMK芭卡玛卡 德军军用头盔 摩托车安全头盔 防暴钢盔 战术专用P1005,运动健康>户外鞋服>户外配饰>BAKMK芭卡玛卡 德军军用头盔 摩托车...,京东商城,德龙锐霸户外1004008009,汽车摩托|摩托车装备|头盔,X-DOT 进口摩托车头盔/电动车头盔 半盔 双镜片,汽车用品/类别/车用电子/摩托车电子/摩托车头盔耳机,亚马逊(卓越网),X-DOT1004008009,汽车摩托|摩托车装备|头盔,Tanked Racing 坦克 T502 摩托车电动车头盔夏盔(L号新蓝C),汽车用品 > 摩托车用品 > 骑士护具 > 摩托车头盔 > 半盔,亚马逊(卓越网),Tanked Racing 坦克1004008009,汽车摩托|摩托车装备|头盔,Tanked Racing 坦克 T502 摩托车电动车头盔夏盔(XL号亚黑C),汽车用品 > 摩托车用品 > 骑士护具 > 摩托车头盔 > 半盔,亚马逊(卓越网),Tanked Racing 坦克1004008009,汽车摩托|摩托车装备|头盔,Tanked Racing 坦克 T505摩托车电动车头盔夏盔(L号红色),汽车用品 > 摩托车用品 > 骑士护具 > 摩托车头盔 > 半盔,亚马逊(卓越网),Tanked Racing 坦克1004008009,汽车摩托|摩托车装备|头盔,坦克（Tanked Racing） T505 电动车 摩托车 头盔 夏盔 （L号 黑色 极光）,汽车用品>安全自驾>摩托车装备>坦克>坦克T505,京东商城,坦克1004008009,汽车摩托|摩托车装备|头盔,坦克（Tanked Racing） T502 电动车 摩托车 头盔 夏盔 （L号 红色 魔法小子）,汽车用品>安全自驾>摩托车装备>坦克>坦克T502,京东商城,坦克1004008009,汽车摩托|摩托车装备|头盔,正品 摩托车头盔 电动车头盔 安全帽 半盔 保暖头盔 防寒保暖 夏盔冬盔 四 515-1纯白配镀银镜片 515-1纯白,IBK>正品 摩托车头盔 电动车头盔 安全帽 ...,京东商城,美居雅车品专营店1004008009,汽车摩托|摩托车装备|头盔,maiyu麦雨022大帽檐头盔式电动车加厚加大牛津面料雨披 宝兰,汽车用品 > 摩托车用品 > 骑士护具 > 骑士服装,亚马逊(卓越网),麦雨1004008009,汽车摩托|摩托车装备|头盔,永明头盔 摩托车电动车头盔 半盔 超大镜片 安全帽 保暖头盔 春秋盔 912粉红配镀银镜片 54-60厘米头围适用,汽车用品>安全自驾>自驾野营>永明>永明头盔 摩托车电动车头盔 半盔 超大镜...,京东商城,美居雅车品专营店1004008009,汽车摩托|摩托车装备|头盔,Andes电瓶车头盔 电动车头盔 男女式 防紫外线夏盔 安全帽 时尚新颖 V5亮黑配茶色镜片 V5亮黑,汽车用品>安全自驾>自驾野营>其它>Andes电瓶车头盔 电动车头盔 男女式...,京东商城,美居雅车品专营店1004008009,汽车摩托|摩托车装备|头盔,SMS AXO-JET 意式复古风摩托车／机车头盔 L号 (四色) (红色),汽车用品/类别/摩托车用品,亚马逊(卓越网),SMS1004008009,汽车摩托|摩托车装备|头盔,Tanked Racing 坦克 T505摩托车电动车头盔夏盔(L号浅粉色牵牛花),汽车用品 > 摩托车用品 > 骑士护具 > 摩托车头盔 > 半盔,亚马逊(卓越网),Tanked Racing 坦克1004008009,汽车摩托|摩托车装备|头盔,Tanked Racing 坦克 T502 摩托车电动车头盔夏盔(M号亚黑),汽车用品 > 摩托车用品,亚马逊(卓越网),Tanked Racing 坦克1004008009,汽车摩托|摩托车装备|头盔,美洲狮儿童轮滑安全帽 轮滑头盔 护具 专业运动装备 黑红 M,运动健康>运动器械>极限轮滑>美洲狮儿童轮滑安全帽 轮滑头盔 护具 专...,京东商城,普强体育专卖店1004008009,汽车摩托|摩托车装备|头盔,Andes电瓶车头盔 电动车头盔 男女式 防紫外线夏盔 安全帽 时尚新颖 V5碧蓝色配茶色镜片 V5碧蓝,汽车用品>安全自驾>自驾野营>其它>Andes电瓶车头盔 电动车头盔 男女式...,京东商城,美居雅车品专营店1004008009,汽车摩托|摩托车装备|头盔,Justyle赛车头盔时尚纯棉短T恤 HWM1128057 浅灰 M,服饰鞋帽>男装>T恤>Justyle>Justyle赛车头盔时尚纯棉短T恤 H...,京东商城,Justyle1004008009,汽车摩托|摩托车装备|头盔,雨盛创导者大号摩托车双人雨披 双人双头电动车雨衣YS-888-X 头盔式帽檐设计 宝蓝 加大号,家居家装>生活日用>雨伞雨具>雨盛创导者>雨盛创导者大号摩托车双人雨披 双人双头...,京东商城,强迪家居专营店1004008009,汽车摩托|摩托车装备|头盔,Tanked Racing 坦克T112-WF 带围脖防雾镜片 摩托车头盔 全盔(亚黑 XXL)(此款产品新老包装更替中，随机发货),汽车用品 > 摩托车用品 > 骑士护具 > 摩托车头盔 > 全盔,亚马逊(卓越网),Tanked Racing 坦克1004008009,汽车摩托|摩托车装备|头盔,Tanked Racing 坦克T112-W 带围脖 摩托车头盔 全盔(白色 XL)(此款产品新老包装更替中，随机发货),汽车用品 > 摩托车用品 > 骑士护具 > 摩托车头盔 > 全盔,亚马逊(卓越网),Tanked Racing 坦克1004008009,汽车摩托|摩托车装备|头盔,Tanked Racing 坦克T112-W 带围脖 摩托车头盔 全盔(黑色 L)(此款产品新老包装更替中，随机发货),汽车用品 > 摩托车用品 > 骑士护具 > 摩托车头盔 > 全盔,亚马逊(卓越网),Tanked Racing 坦克1004008009,汽车摩托|摩托车装备|头盔,Tanked Racing 坦克T112-WF 带围脖防雾镜片 摩托车头盔 全盔(黑色 雷 XL)(此款产品新老包装更替中，随机发货),汽车用品 > 摩托车用品 > 骑士护具 > 摩托车头盔 > 全盔,亚马逊(卓越网),Tanked Racing 坦克1004008009,汽车摩托|摩托车装备|头盔,两用带镜片越野盔 摩托车赛车越野车全盔跑盔 冬盔头盔,运动户外 > 运动器材 > 运动护具 > 商品详情,当当网,中更体育1004008009,汽车摩托|摩托车装备|头盔,正品 儿童头盔 摩托车 儿童夏盔 小孩夏盔 半盔 小孩头盔,运动户外 > 运动器材 > 运动护具,当当网,中更体育1004008009,汽车摩托|摩托车装备|头盔,Tanked Raci 坦克506 加长镜片电动车 摩托车头盔 防紫外线夏盔 白色克利丝配茶色镜片 XL,汽车用品 > 摩托车用品 > 骑士护具 > 摩托车头盔 > 半盔,亚马逊(卓越网),Tanked Raci1004008009,汽车摩托|摩托车装备|头盔,AK 艾凯 AKFE夏盔 防晒摩托车头盔 电动车头盔 超大镜片ABS材料抗摔 玫红色配七彩镜片 均码,汽车用品 > 摩托车用品 > 骑士护具 > 摩托车头盔 > 半盔,亚马逊(卓越网),AK 艾凯1004008009,汽车摩托|摩托车装备|头盔,野马 野马 205 小孩保暖头盔 卡通 儿童头盔 全盔 可配防雾镜 红色喜羊羊配透明耐磨镜片 均码,汽车用品 > 摩托车用品 > 骑士护具 > 摩托车头盔 > 半盔,亚马逊(卓越网),野马1004008009,汽车摩托|摩托车装备|头盔,Tanked Raci 2012年新款 TK-T502 坦克夏盔 骑士半盔 送礼品男女盔 银色 M,汽车用品 > 摩托车用品 > 骑士护具 > 摩托车头盔 > 半盔,亚马逊(卓越网),Tanked Raci1004008009,汽车摩托|摩托车装备|头盔,AK 艾凯 AKFE夏盔 防晒摩托车头盔 电动车头盔 超大镜片ABS材料抗摔 银色配茶色镜片 均码,汽车用品 > 摩托车用品 > 骑士护具 > 摩托车头盔 > 半盔,亚马逊(卓越网),AK 艾凯1004008009,汽车摩托|摩托车装备|头盔,Tanked Raci 新春 Tanked503防紫外线 摩托车头盔 电动车 夏盔 送礼品 黄色YBG L,汽车用品 > 摩托车用品 > 骑士护具 > 摩托车头盔 > 半盔,亚马逊(卓越网),Tanked Raci1004008009,汽车摩托|摩托车装备|头盔,Tanked Raci t112 坦克全盔 男女冬盔 坦克亮黑色 摩托车跑盔 白色德国 L,汽车用品 > 摩托车用品 > 骑士护具 > 摩托车头盔 > 半盔,亚马逊(卓越网),Tanked Raci1004008009,汽车摩托|摩托车装备|头盔,Tanked Raci 2012年新款 TK-T502 坦克夏盔 骑士半盔 送礼品男女盔 红色魔法小子 M,汽车用品 > 摩托车用品 > 骑士护具 > 摩托车头盔 > 半盔,亚马逊(卓越网),Tanked Raci1004008009,汽车摩托|摩托车装备|头盔,YOHE 永恒 永恒959S 男童 女童保暖 头盔 摩托车头盔 全盔 带围脖 黄色奥特曼 L,汽车用品 > 摩托车用品 > 骑士护具 > 摩托车头盔 > 半盔,亚马逊(卓越网),YOHE 永恒1004008009,汽车摩托|摩托车装备|头盔,野马 冰点 野马 电动车 摩托车头盔 帽子 保暖全盔 揭面盔 黄色红盾 XL,汽车用品 > 摩托车用品 > 骑士护具 > 摩托车头盔 > 半盔,亚马逊(卓越网),野马1004008009,汽车摩托|摩托车装备|头盔,Tanked Raci 2012年新款 TK-T502 坦克夏盔 骑士半盔 送礼品男女盔 白色兰花 M,汽车用品 > 摩托车用品 > 骑士护具 > 摩托车头盔 > 半盔,亚马逊(卓越网),Tanked Raci1004008009,汽车摩托|摩托车装备|头盔,Tanked Raci 新款 坦克 男女夏盔 轻便式头盔夏盔T505 防紫外线头盔 亮黑极光 L,汽车用品 > 摩托车用品 > 骑士护具 > 摩托车头盔 > 半盔,亚马逊(卓越网),Tanked Raci1004008009,汽车摩托|摩托车装备|头盔,Tanked Raci T523桔色 男女头盔 女士电动车半盔 四季通用 钛金灰 M,汽车用品 > 摩托车用品 > 骑士护具 > 摩托车头盔 > 半盔,亚马逊(卓越网),Tanked Raci1004008009,汽车摩托|摩托车装备|头盔,光明 看谁手快 时尚哈雷 男 女 头盔 电动车 摩托车头盔 冬 夏 半盔 配透明护目镜（头盔颜色请备注） 均码,汽车用品 > 摩托车用品 > 骑士护具 > 摩托车头盔 > 半盔,亚马逊(卓越网),光明1004008009,汽车摩托|摩托车装备|头盔,Tanked Raci t112 坦克全盔 男女冬盔 坦克亮黑色 摩托车跑盔 黑色墨 M,汽车用品 > 摩托车用品 > 骑士护具 > 摩托车头盔 > 半盔,亚马逊(卓越网),Tanked Raci1004008009,汽车摩托|摩托车装备|头盔,AK 艾凯 艾凯AK601夏电动车安全帽 防紫外线头盔 摩托车防晒半盔 金黄色底带四星（镜片颜色请备） 均码,汽车用品 > 摩托车用品 > 骑士护具 > 摩托车头盔 > 半盔,亚马逊(卓越网),AK 艾凯1004008009,汽车摩托|摩托车装备|头盔,Tanked Raci 坦克T501男 女 半盔 摩托车头盔 夏盔 防紫外线 钛金灰 M,汽车用品 > 摩托车用品 > 骑士护具 > 摩托车头盔 > 半盔,亚马逊(卓越网),Tanked Raci1004008009,汽车摩托|摩托车装备|头盔,AK 艾凯 砸不坏头盔 艾凯半盔 电动车夏盔 防紫外线头盔AK601头 红色（镜片颜色请备注） 均码,汽车用品 > 摩托车用品 > 骑士护具 > 摩托车头盔 > 半盔,亚马逊(卓越网),AK 艾凯1004008009,汽车摩托|摩托车装备|头盔,Tanked Raci 摩托车电动车半盔 骑士夏盔 坦克502粉色半盔 红色魔法小子 M,汽车用品 > 摩托车用品 > 骑士护具 > 摩托车头盔 > 半盔,亚马逊(卓越网),Tanked Raci1004008009,汽车摩托|摩托车装备|头盔,Tanked Raci t112 坦克全盔 男女冬盔 坦克亮黑色 摩托车跑盔 银色 XL,汽车用品 > 摩托车用品 > 骑士护具 > 摩托车头盔 > 半盔,亚马逊(卓越网),Tanked Raci1004008009,汽车摩托|摩托车装备|头盔,Tanked Raci 坦克505 2012最新款 电动车/摩托车头盔 夏天头盔 粉色牵牛花 M,汽车用品 > 摩托车用品 > 骑士护具 > 摩托车头盔 > 半盔,亚马逊(卓越网),Tanked Raci1004008009,汽车摩托|摩托车装备|头盔,Tanked Raci 2012年新款 TK-T502 坦克夏盔 骑士半盔 送礼品男女盔 白色 M,汽车用品 > 摩托车用品 > 骑士护具 > 摩托车头盔 > 半盔,亚马逊(卓越网),Tanked Raci1004008009,汽车摩托|摩托车装备|头盔,野马 买一就送四 野马揭面盔 电动车摩托车头盔 保暖全盔 可配防雾镜片 亮黑羽毛 XXL,汽车用品 > 摩托车用品 > 骑士护具 > 摩托车头盔 > 半盔,亚马逊(卓越网),野马1004008009,汽车摩托|摩托车装备|头盔,YOHE 永恒 永恒 摩托车头盔电动车头盔 935全盔带围脖 送礼品 本田灰 L,汽车用品 > 摩托车用品 > 骑士护具 > 摩托车头盔 > 半盔,亚马逊(卓越网),YOHE 永恒1004008009,汽车摩托|摩托车装备|头盔,Tanked Raci 摩托车电动车半盔 骑士夏盔 坦克502粉色半盔 亚黑圣火 M,汽车用品 > 摩托车用品 > 骑士护具 > 摩托车头盔 > 半盔,亚马逊(卓越网),Tanked Raci1004008009,汽车摩托|摩托车装备|头盔,Tanked Raci 2012年新款 TK-T502 坦克夏盔 骑士半盔 送礼品男女盔 哑黑圣火 XL,汽车用品 > 摩托车用品 > 骑士护具 > 摩托车头盔 > 半盔,亚马逊(卓越网),Tanked Raci1004008009,汽车摩托|摩托车装备|头盔,野马 买一就送四 野马揭面盔 电动车摩托车头盔 保暖全盔 可配防雾镜片 黄色青花瓷 XL,汽车用品 > 摩托车用品 > 骑士护具 > 摩托车头盔 > 半盔,亚马逊(卓越网),野马1004008009,汽车摩托|摩托车装备|头盔,Tanked Raci 坦克头盔 摩托车全款 骑士装备 全盔 公路 高档 X192 黑色LIA 黑色LIA L,汽车用品 > 摩托车用品 > 骑士护具 > 摩托车头盔 > 半盔,亚马逊(卓越网),Tanked Raci1004008009,汽车摩托|摩托车装备|头盔,Tanked Raci 电动车夏盔 坦克头盔 摩托车头盔 T505夏盔防紫外线 送礼品 红色浪花 XL,汽车用品 > 摩托车用品 > 骑士护具 > 摩托车头盔 > 半盔,亚马逊(卓越网),Tanked Raci1004008009,汽车摩托|摩托车装备|头盔,野马 买一就送四 野马揭面盔 电动车摩托车头盔 保暖全盔 可配防雾镜片 蓝色摇滚之夜 XL,汽车用品 > 摩托车用品 > 骑士护具 > 摩托车头盔 > 半盔,亚马逊(卓越网),野马1004008009,汽车摩托|摩托车装备|头盔,光明 X15摔不烂头盔宝宝头盔摩托车头盔儿童电动车头盔夏盔6色可选 红色配茶色镜片 S,汽车用品 > 摩托车用品 > 骑士护具 > 摩托车头盔 > 半盔,亚马逊(卓越网),1004008009,汽车摩托|摩托车装备|头盔,野马 买一就送四 野马揭面盔 电动车摩托车头盔 保暖全盔 可配防雾镜片 蓝色羽毛 XXL,汽车用品 > 摩托车用品 > 骑士护具 > 摩托车头盔 > 半盔,亚马逊(卓越网),野马1004008009,汽车摩托|摩托车装备|头盔,光明 X15摔不烂头盔宝宝头盔摩托车头盔儿童电动车头盔夏盔6色可选 玫红配七彩镜片 S,汽车用品 > 摩托车用品 > 骑士护具 > 摩托车头盔 > 半盔,亚马逊(卓越网),1004008009,汽车摩托|摩托车装备|头盔,Tanked Raci 2012年新款 TK-T502 坦克夏盔 骑士半盔 送礼品男女盔 粉色蝴蝶 L,汽车用品 > 摩托车用品 > 骑士护具 > 摩托车头盔 > 半盔,亚马逊(卓越网),Tanked Raci1004008009,汽车摩托|摩托车装备|头盔,Tanked Raci 坦克505 2012最新款 电动车/摩托车头盔 夏天头盔 亚黑 L,汽车用品 > 摩托车用品 > 骑士护具 > 摩托车头盔 > 半盔,亚马逊(卓越网),Tanked Raci1004008009,汽车摩托|摩托车装备|头盔,野马 冰点 野马 电动车 摩托车头盔 帽子 保暖全盔 揭面盔 亚黑 XL,汽车用品 > 摩托车用品 > 骑士护具 > 摩托车头盔 > 半盔,亚马逊(卓越网),野马1004008009,汽车摩托|摩托车装备|头盔,AK 艾凯 顶级ABS抗摔材料 AKFE 夏盔 电动车 摩托车 头盔 男 女防晒头盔 银色配透明镜片 均码,汽车用品 > 摩托车用品 > 骑士护具 > 摩托车头盔 > 半盔,亚马逊(卓越网),AK 艾凯1004008009,汽车摩托|摩托车装备|头盔,Tanked Raci Tanked Racing 摩托车头盔 半盔 秋冬盔 T519黑色 黑红海王星 L,汽车用品 > 摩托车用品 > 骑士护具 > 摩托车头盔 > 半盔,亚马逊(卓越网),Tanked Raci1004008009,汽车摩托|摩托车装备|头盔,AK 艾凯 男 女头盔 AK620头盔 电动车摩托车头盔 防紫外线头盔 白色配镀银镜片 L,汽车用品 > 摩托车用品 > 骑士护具 > 摩托车头盔 > 半盔,亚马逊(卓越网),AK 艾凯1004008009,汽车摩托|摩托车装备|头盔,Tanked Raci 新款 坦克503 防晒 防雨 男 女 夏盔 摩托车头盔 送防晒垫 浅粉色 L,汽车用品 > 摩托车用品 > 骑士护具 > 摩托车头盔 > 半盔,亚马逊(卓越网),Tanked Raci1004008009,汽车摩托|摩托车装备|头盔,Tanked Raci 新款 坦克503 防晒 防雨 男 女 夏盔 摩托车头盔 送防晒垫 亚黑 M,汽车用品 > 摩托车用品 > 骑士护具 > 摩托车头盔 > 半盔,亚马逊(卓越网),Tanked Raci1004008009,汽车摩托|摩托车装备|头盔,AK 艾凯 AKFE头盔冬盔 电动车 摩托车头盔 男、女士半盔 春秋盔 玫红配普通镜片 均码,汽车用品 > 摩托车用品 > 骑士护具 > 摩托车头盔 > 半盔,亚马逊(卓越网),AK 艾凯1004008009,汽车摩托|摩托车装备|头盔,Tanked Raci 新春 Tanked503防紫外线 摩托车头盔 电动车 夏盔 送礼品 黑色鬼火 M,汽车用品 > 摩托车用品 > 骑士护具 > 摩托车头盔 > 半盔,亚马逊(卓越网),Tanked Raci1004008009,汽车摩托|摩托车装备|头盔,Tanked Raci 新春 Tanked503防紫外线 摩托车头盔 电动车 夏盔 送礼品 黑色鬼火 XL,汽车用品 > 摩托车用品 > 骑士护具 > 摩托车头盔 > 半盔,亚马逊(卓越网),Tanked Raci1004008009,汽车摩托|摩托车装备|头盔,AK 艾凯 头盔 摩托车头盔 电动车夏盔 防晒AK621半盔 防紫外线 砸不烂 配茶色镜片（头盔颜色请备注） 均码,汽车用品 > 摩托车用品 > 骑士护具 > 摩托车头盔 > 半盔,亚马逊(卓越网),AK 艾凯1004008009,汽车摩托|摩托车装备|头盔,Tanked Raci 新春 Tanked503防紫外线 摩托车头盔 电动车 夏盔 送礼品 浅粉色 L,汽车用品 > 摩托车用品 > 骑士护具 > 摩托车头盔 > 半盔,亚马逊(卓越网),Tanked Raci1004008009,汽车摩托|摩托车装备|头盔,Tanked Raci 新春 Tanked503防紫外线 摩托车头盔 电动车 夏盔 送礼品 亚黑 XL,汽车用品 > 摩托车用品 > 骑士护具 > 摩托车头盔 > 半盔,亚马逊(卓越网),Tanked Raci1004008009,汽车摩托|摩托车装备|头盔,光明 30V3冬 冬盔男 女 摩托车头盔 电动车头盔 配围脖可拆 玫红配普通镜片 均码,汽车用品 > 摩托车用品 > 骑士护具 > 摩托车头盔 > 半盔,亚马逊(卓越网),光明1004008009,汽车摩托|摩托车装备|头盔,野马 特价正品头盔 摩托车头盔 电动车头盔 防紫外线头盔 男女夏盔 均码 白色蝴蝶花,汽车用品 > 摩托车用品 > 骑士护具 > 摩托车头盔 > 半盔,亚马逊(卓越网),1004008009,汽车摩托|摩托车装备|头盔,野马 特价正品头盔 摩托车头盔 电动车头盔 防紫外线头盔 男女夏盔 均码 亚黑,汽车用品 > 摩托车用品 > 骑士护具 > 摩托车头盔 > 半盔,亚马逊(卓越网),1004008009,汽车摩托|摩托车装备|头盔,野马 特价315夏盔 电动车摩托车头盔 夏盔 防紫外线夏盔 男女通用 均码 粉红,汽车用品 > 摩托车用品 > 骑士护具 > 摩托车头盔 > 半盔,亚马逊(卓越网),1004008009,汽车摩托|摩托车装备|头盔,HUADUN 头盔 HD-988揭面盔双镜片 赛车盔 电动车 摩托车头盔 XL 红色鬼爪,汽车用品 > 摩托车用品 > 骑士护具 > 摩托车头盔 > 全盔,亚马逊(卓越网),1004008009,汽车摩托|摩托车装备|头盔,HUADUN 头盔 HD-988揭面盔双镜片 赛车盔 电动车 摩托车头盔 XL 柠檬黄,汽车用品 > 摩托车用品 > 骑士护具 > 摩托车头盔 > 全盔,亚马逊(卓越网),HUADUN1004008009,汽车摩托|摩托车装备|头盔,正招 气囊式自动排水头盔式帽檐摩托车雨披电动车雨衣单人,家居 > 居家防护 > 雨伞雨具 > 雨衣雨披,亚马逊(卓越网),1004008009,汽车摩托|摩托车装备|头盔,头盔4/3全盔 摩托车头盔 电动车安全帽双镜片半盔 男女款 珍珠灰,运动健康>运动器械>骑行运动>头盔4/3全盔 摩托车头盔 电动车安全帽...,京东商城,享瘦运动专营店1004008009,汽车摩托|摩托车装备|头盔,摩托车头盔夏盔男女式电动车夏季防紫外线防晒防风沙 红色,运动健康>运动器械>骑行运动>索维尔>摩托车头盔夏盔男女式电动车夏季防紫外线防...,京东商城,享瘦运动专营店1004008009,汽车摩托|摩托车装备|头盔,全球首创头盔式帽檐雨披 雨盛摩托车雨衣套装 超强防水 雨衣+雨裤 雨盛套装2068藏青色 L号,家居家装>生活日用>雨伞雨具>全球首创头盔式帽檐雨披 雨盛摩托车雨衣套...,京东商城,忆家家居专营店1004008009,汽车摩托|摩托车装备|头盔,YOHE永恒头盔 YH-837 摩托车头盔 电动车安全帽 半盔冬盔 多色 磨砂黑 XXL,汽车用品>安全自驾>摩托车装备>YOHE永恒头盔 YH-837 摩托车头...,京东商城,永恒头盔旗舰店1004008009,汽车摩托|摩托车装备|头盔,YOHE永恒头盔 YH-837 摩托车头盔 电动车安全帽 半盔冬盔 多色 黄色 XL,汽车用品>安全自驾>摩托车装备>YOHE永恒头盔 YH-837 摩托车头...,京东商城,永恒头盔旗舰店1004008009,汽车摩托|摩托车装备|头盔,YOHE永恒头盔 YH-837 摩托车头盔 电动车安全帽 半盔冬盔 多色 橘红色 XXL,汽车用品>安全自驾>摩托车装备>YOHE永恒头盔 YH-837 摩托车头...,京东商城,永恒头盔旗舰店1004008009,汽车摩托|摩托车装备|头盔,YOHE永恒头盔 YH-837 摩托车头盔 电动车安全帽 半盔冬盔 多色 磨砂深红 XXL,汽车用品>安全自驾>摩托车装备>YOHE永恒头盔 YH-837 摩托车头...,京东商城,永恒头盔旗舰店1004008009,汽车摩托|摩托车装备|头盔,YOHE永恒头盔 YH-993 摩托车头盔 电动车安全帽 全盔冬盔 多色多花纸 柠檬黄 L,汽车用品>安全自驾>摩托车装备>永恒头盔（YOHE）>YOHE永恒头盔 YH-993 摩托车头...,京东商城,永恒头盔旗舰店1004008009,汽车摩托|摩托车装备|头盔,YOHE永恒头盔 YH-993 摩托车头盔 电动车安全帽 全盔冬盔 多色多花纸 银色眼镜蛇 S,汽车用品>安全自驾>摩托车装备>永恒头盔（YOHE）>YOHE永恒头盔 YH-993 摩托车头...,京东商城,永恒头盔旗舰店1004008009,汽车摩托|摩托车装备|头盔,YOHE永恒头盔 YH-993 摩托车头盔 电动车安全帽 全盔冬盔 多色多花纸 黑红涡轮增压 XXL,汽车用品>安全自驾>摩托车装备>永恒头盔（YOHE）>YOHE永恒头盔 YH-993 摩托车头...,京东商城,永恒头盔旗舰店