1004006006,汽车摩托|内饰精品|方向盘套,徐记(XUJI) 标致 206/207/307/308/408专用手缝真皮方向盘套 黑皮+黑线 标志307,徐记（xuji）>徐记(XUJI) 标致 206/207/...,京东商城,欣蓓商贸1004006006,汽车摩托|内饰精品|方向盘套,徐记(XUJI) 标致 206/207/307/308/408专用手缝真皮方向盘套 黑皮+黑线 标志408,徐记（xuji）>徐记(XUJI) 标致 206/207/...,京东商城,欣蓓商贸1004006006,汽车摩托|内饰精品|方向盘套,安美弛 真皮方向盘套 四季通用把套 AM-2122 灰色,安美弛>安美弛 真皮方向盘套 四季通用把套 AM...,京东商城,安美弛旗舰店1004006006,汽车摩托|内饰精品|方向盘套,Disney 迪士尼 进口特级毛绒 维尼熊 车用抱枕,汽车、保养、装饰 > 汽车内饰 > 抱枕腰靠,易迅网,Disney 迪士尼1004006006,汽车摩托|内饰精品|方向盘套,路易 方向盘把套 王者牛皮 1202 灰 小号,汽车用品 > 汽车内饰 > 方向盘套,亚马逊(卓越网),路易1004006006,汽车摩托|内饰精品|方向盘套,TAICHENG 泰澄 按摩珠超纤皮方向盘套 (红黑色),汽车用品 > 汽车内饰 > 方向盘套,亚马逊(卓越网),TAICHENG 泰澄1004006006,汽车摩托|内饰精品|方向盘套,YOOCAR 优尔卡 尊雅红调-中号 冰丝汽车 方向盘套 汽车把套 汽车用品,汽车用品/类别/汽车零件/内部零件/方向盘、助力球/方向盘套,亚马逊(卓越网),YOOCAR 优尔卡1004006006,汽车摩托|内饰精品|方向盘套,路易 方向盘把套 超感真牛皮 CN01 米 中号,汽车用品 > 汽车内饰 > 方向盘套,亚马逊(卓越网),路易1004006006,汽车摩托|内饰精品|方向盘套,YooCar 汽车把套 真皮防滑透气孔 通用 方向盘套 把套 8006 中号 黑色,首页>汽车用品>内饰精品>方向盘套>YooCar汽车把套真皮防滑透气...,苏宁,优尔卡 YOOCAR 产地:中国 尺寸:直径38c1004006006,汽车摩托|内饰精品|方向盘套,福禄莱 手缝真皮方向盘套头层牛皮日产骐达 新阳光 骊威 轩逸 颐达 NV200 两侧打孔+黑线 骊威,汽车用品>内饰精品>方向盘套>福禄莱 >福禄莱 手缝真皮方向盘套头层牛皮日产骐达...,京东商城,翊惠车品专营店1004006006,汽车摩托|内饰精品|方向盘套,[京东自营] 卡莱饰（Car lives）冬季毛绒方向盘套 节节高 米色,汽车用品>内饰精品>方向盘套>卡莱饰（Car lives）>卡莱饰方向盘套,京东商城,卡莱饰（Car lives）1004006006,汽车摩托|内饰精品|方向盘套,福禄莱真皮手缝方向盘套汽车把套四季通用起亚福瑞迪 锐欧 狮跑 智跑 K2 K5 赛拉图 两侧打孔+红线 K2,汽车用品>内饰精品>方向盘套>福禄莱 >福禄莱真皮手缝方向盘套汽车把套四季通用起...,京东商城,翊惠车品专营店1004006006,汽车摩托|内饰精品|方向盘套,福禄莱真皮手缝方向盘套汽车把套四季通用丰田凯美瑞 卡罗拉 汉兰达 花冠 锐志 RAV4 两侧打孔+黑线 老款卡罗,汽车用品>内饰精品>方向盘套>福禄莱 >福禄莱真皮手缝方向盘套汽车把套四季通用丰...,京东商城,翊惠车品专营店1004006006,汽车摩托|内饰精品|方向盘套,福禄莱真皮手缝方向盘套汽车把套四季通用本田飞度 锋范 八代雅阁 奥德赛 思域 思迪 CRV 两侧打孔+红线 八代,汽车用品>内饰精品>方向盘套>福禄莱 >福禄莱真皮手缝方向盘套汽车把套四季通用本...,京东商城,翊惠车品专营店1004006006,汽车摩托|内饰精品|方向盘套,浩优 别克昂科雷/GL8/老君威/老君越/林荫大道 汽车真皮方向盘套 四季把套 黑色,汽车用品>内饰精品>方向盘套>其他>浩优 别克昂科雷/GL8/老君威/老君越...,京东商城,连顺车品专卖店1004006006,汽车摩托|内饰精品|方向盘套,福禄莱真皮手缝方向盘套汽车把套四季通用本田飞度 锋范 八代雅阁 奥德赛 思域 思迪 CRV 两侧打孔+红线 新奥,汽车用品>内饰精品>方向盘套>福禄莱 >福禄莱真皮手缝方向盘套汽车把套四季通用本...,京东商城,翊惠车品专营店1004006006,汽车摩托|内饰精品|方向盘套,神州泰坦 比亚迪S6 专用把套 真皮手缝把套 比亚迪S6红线带孔把套,汽车用品>内饰精品>方向盘套>其它>神州泰坦 比亚迪S6 专用把套 真皮手缝...,京东商城,欧华京东旗舰店1004006006,汽车摩托|内饰精品|方向盘套,車玛仕CHEMAS汽车高档方向盘套13003耐磨耐用,汽车用品>内饰精品>方向盘套>車玛仕CHEMAS汽车高档方向盘套130...,京东商城,車玛仕CMS汽车用品店1004006006,汽车摩托|内饰精品|方向盘套,福禄莱真皮手缝方向盘套汽车把套四季宝马320 325I 330 530 X3 X5 两侧打孔+黑线 523Li(原车带真皮加缝版),汽车用品>内饰精品>方向盘套>福禄莱 >福禄莱真皮手缝方向盘套汽车把套四季宝马3...,京东商城,翊惠车品专营店1004006006,汽车摩托|内饰精品|方向盘套,沿途 汽车方向盘套四季 新冬季毛绒把套科鲁兹别克凯越经典福克斯 素色珍珠灰色,沿途>沿途 汽车方向盘套四季 新冬季毛绒把套科...,京东商城,沿途车品旗舰店1004006006,汽车摩托|内饰精品|方向盘套,福禄莱真皮手缝方向盘套 汽车把套 四季通用 标致206 307 308 408 508 两侧打孔+红线 206CC,汽车用品>内饰精品>方向盘套>福禄莱 >福禄莱真皮手缝方向盘套 汽车把套 四季通...,京东商城,翊惠车品专营店1004006006,汽车摩托|内饰精品|方向盘套,福禄莱真皮手缝方向盘套汽车把套四季通用 雪佛兰科鲁兹迈锐宝新乐风乐骋 两侧打孔+红线 爱唯欧,汽车用品>内饰精品>方向盘套>福禄莱 >福禄莱真皮手缝方向盘套汽车把套四季通用 ...,京东商城,翊惠车品专营店1004006006,汽车摩托|内饰精品|方向盘套,浩优 陆风X6/X8/X9风尚/欧宝安德拉/雅特/赛飞利汽车方向盘套四季把套 棕色,汽车用品>内饰精品>方向盘套>其他>浩优 陆风X6/X8/X9风尚/欧宝安德...,京东商城,连顺车品专卖店1004006006,汽车摩托|内饰精品|方向盘套,浩优 长城哈弗/赛弗/炫丽/精灵汽车超纤皮方向盘套 四季把套 棕色,汽车用品>内饰精品>方向盘套>其他>浩优 长城哈弗/赛弗/炫丽/精灵汽车超纤...,京东商城,连顺车品专卖店1004006006,汽车摩托|内饰精品|方向盘套,浩优 广汽传祺GS5 纳智捷 奇瑞A1/A5/A3/东方之子 汽车超纤皮方向盘套 把套 棕色-请备注车型,汽车用品>内饰精品>方向盘套>其他>浩优 广汽传祺GS5 纳智捷 奇瑞A1/...,京东商城,连顺车品专卖店1004006006,汽车摩托|内饰精品|方向盘套,浩优 本田CRVCIVIC雅阁奥德赛标致307308206207407汽车真皮方向盘套 黑色-请备注车型,汽车用品>内饰精品>方向盘套>其他>浩优 本田CRVCIVIC雅阁奥德赛标致...,京东商城,连顺车品专卖店1004006006,汽车摩托|内饰精品|方向盘套,浩优 奥迪A4/A4L/A8L/A6/A6L/Q5/Q7/A1/A3汽车真皮方向盘套 牛皮 黑色,汽车用品>内饰精品>方向盘套>其他>浩优 奥迪A4/A4L/A8L/A6/A...,京东商城,连顺车品专卖店1004006006,汽车摩托|内饰精品|方向盘套,浩优 江淮瑞鹰/同悦/宾悦/和悦RS/红旗世纪星/HQ3汽车方向盘套 四季把套 米色,汽车用品>内饰精品>方向盘套>其他>浩优 江淮瑞鹰/同悦/宾悦/和悦RS/红...,京东商城,连顺车品专卖店1004006006,汽车摩托|内饰精品|方向盘套,浩优 雪铁龙富康/爱丽舍/毕加索/凯旋世嘉C2C4C5汽车方向盘套把套 四季把套 黑色,汽车用品>内饰精品>方向盘套>其他>浩优 雪铁龙富康/爱丽舍/毕加索/凯旋世...,京东商城,连顺车品专卖店1004006006,汽车摩托|内饰精品|方向盘套,浩优 RAV4全系/汉兰达/佳美/陆地巡洋舰/普拉多/红杉汽车方向盘套 四季把套 黑色,汽车用品>内饰精品>方向盘套>其他>浩优 RAV4全系/汉兰达/佳美/陆地巡...,京东商城,连顺车品专卖店1004006006,汽车摩托|内饰精品|方向盘套,虎贝尔 汽车方向盘套 防滑真皮科鲁新兹福克斯把套h401 黑色 中号,虎贝尔（HBR）>虎贝尔 汽车方向盘套 防滑真皮科鲁新兹福...,京东商城,虎贝尔旗舰店1004006006,汽车摩托|内饰精品|方向盘套,larento 老人头 莎士比亚 FLR-B2204 真皮方向套 (米色),汽车用品 > 汽车内饰 > 方向盘套,亚马逊(卓越网),LAORENTOU 老人头1004006006,汽车摩托|内饰精品|方向盘套,larento 老人头 莎士比亚 FLR-B2208 真皮方向套 (黑色),汽车用品 > 汽车内饰 > 方向盘套,亚马逊(卓越网),LAORENTOU 老人头1004006006,汽车摩托|内饰精品|方向盘套,乔氏三明治方向盘套 汽车内饰 三明治方向盘套 汽车用品-银灰款,汽车用品 > 方向盘套 > 乔氏,国美电器网上商城,1004006006,汽车摩托|内饰精品|方向盘套,安美弛 AM-2148冬季圈圈毛绒方向盘套 红色,汽车用品 > 方向盘套 > 安美弛,国美电器网上商城,1004006006,汽车摩托|内饰精品|方向盘套,虎贝尔(Hbr)冰丝H410汽车方向盘套(灰色),汽车用品 > 方向盘套 > 虎贝尔,国美电器网上商城,1004006006,汽车摩托|内饰精品|方向盘套,点将台 冬季超柔毛绒汽车方向盘套 fs18黑色 中号,汽车用品 > 方向盘套 > 点将台,国美电器网上商城,1004006006,汽车摩托|内饰精品|方向盘套,披甲熊仿羊绒毛绒汽车方向盘套 方向盘套 汽车把套 秋冬新款 米色,汽车用品 > 方向盘套 > 披甲熊,国美电器网上商城,1004006006,汽车摩托|内饰精品|方向盘套,极限 冰丝汽车方向盘把套 JX0013 米色,汽车用品 > 方向盘套 > 极限,国美电器网上商城,1004006006,汽车摩托|内饰精品|方向盘套,极限 真皮DIY方向盘套 JX0012 米色,汽车用品 > 方向盘套 > 极限,国美电器网上商城,1004006006,汽车摩托|内饰精品|方向盘套,点将台 汽车方向盘套fa19灰色 中号,汽车用品 > 方向盘套 > 点将台,国美电器网上商城,1004006006,汽车摩托|内饰精品|方向盘套,Label 乐标 真皮 手缝把套 头层小牛皮真皮方向盘套海马 吉普 吉利雷诺专用咖啡色,汽车用品/类别/汽车内饰/方向盘套,亚马逊(卓越网),Label 乐标1004006006,汽车摩托|内饰精品|方向盘套,Label 乐标 广汽本田 飞度 思迪 锋范 雅阁 奥德赛 手缝方向盘套 把套飞度 黑,汽车用品/类别/汽车内饰/方向盘套,亚马逊(卓越网),Label 乐标1004006006,汽车摩托|内饰精品|方向盘套,Label 乐标 一汽丰田 花冠 威驰 卡罗拉 皇冠 RAV4手缝方向盘套 把套RAV4 米,汽车用品/类别/汽车内饰/方向盘套,亚马逊(卓越网),Label 乐标1004006006,汽车摩托|内饰精品|方向盘套,Label 乐标 起亚 福瑞迪 狮跑 千里马 赛拉图 锐欧手缝方向盘套 把套赛拉图 灰,汽车用品/类别/汽车内饰/方向盘套,亚马逊(卓越网),Label 乐标1004006006,汽车摩托|内饰精品|方向盘套,WRC碳纤方向盘套B款黑红色W-TX003,汽车用品 > 汽车零件 > 内部零件 > 方向盘、助力球 > 赛车方向盘,亚马逊(卓越网),WRC1004006006,汽车摩托|内饰精品|方向盘套,FLYING STONE飞石 手缝真皮方向盘套A款加长 LA 39CM外径方向盘 两侧双红线,汽车、保养、装饰 > 汽车内饰 > 方向盘套,易迅网,FLYING STONE 飞石1004006006,汽车摩托|内饰精品|方向盘套,车友趣 汽车方向盘套 6D立体仿麂皮绒中号吸汗四季把套(灰色),汽车用品 > 汽车内饰 > 方向盘套,亚马逊(卓越网),车友趣1004006006,汽车摩托|内饰精品|方向盘套,LARENTO老人头 FLR-B2209 莎士比亚汽车方向盘套 (黑色),汽车用品 > 汽车内饰 > 方向盘套,亚马逊(卓越网),LAORENTOU 老人头1004006006,汽车摩托|内饰精品|方向盘套,Mephiscar 墨菲斯卡 MF-642 真皮压花方向盘套 (灰色),汽车用品 > 汽车内饰 > 方向盘套,亚马逊(卓越网),MephisCar 墨菲斯卡1004006006,汽车摩托|内饰精品|方向盘套,Mephiscar 墨菲斯卡 MF-651 真皮压花方向盘套 (灰色),汽车用品 > 汽车内饰 > 方向盘套,亚马逊(卓越网),MephisCar 墨菲斯卡1004006006,汽车摩托|内饰精品|方向盘套,Mephiscar 墨菲斯卡 MF-591 真皮平纹方向盘套 (灰色),汽车用品 > 汽车内饰 > 方向盘套,亚马逊(卓越网),MephisCar 墨菲斯卡1004006006,汽车摩托|内饰精品|方向盘套,Mephiscar 墨菲斯卡 MF-691 真皮压花方向盘套 (黑色),汽车用品 > 汽车内饰 > 方向盘套,亚马逊(卓越网),MephisCar 墨菲斯卡1004006006,汽车摩托|内饰精品|方向盘套,Mephiscar 墨菲斯卡 MF-625 真皮平纹方向盘套 (黑色),汽车用品 > 汽车内饰 > 方向盘套,亚马逊(卓越网),MephisCar 墨菲斯卡1004006006,汽车摩托|内饰精品|方向盘套,(Miffy)米菲 卡通环保 汽车秋冬季短毛绒方向盘套 汽车把套 MFBT-02（米咖色）,所有分类>大小家电、厨电、汽车>汽车生活>汽车内饰>方向盘套>Miffy/米菲>(Miffy)米菲 ...,1号店,Miffy/米菲1004006006,汽车摩托|内饰精品|方向盘套,GREAT LIFE 新款手编超纤皮方向盘套 四季通用 防滑透气 汽车把手套 米色,所有分类>大小家电、厨电、汽车>汽车生活>汽车内饰>方向盘套>GREAT LIFE>GREAT LIFE...,1号店,GREAT LIFE1004006006,汽车摩托|内饰精品|方向盘套,飞石 冰丝方向盘套SW-30G灰色 双层冰丝制作 加倍凉爽中号 透气 中号 38CM方向盘外径,汽车用品 > 汽车内饰 > 方向盘套,亚马逊(卓越网),FLYING STONE 飞石1004006006,汽车摩托|内饰精品|方向盘套,路易 方向盘把套 王者牛皮 1205 米 小号,汽车用品 > 汽车内饰 > 方向盘套,亚马逊(卓越网),路易1004006006,汽车摩托|内饰精品|方向盘套,睿博 冬季方向盘套毛绒把套冬季方向盘套毛绒把套/毛绒把套 灰色,汽车用品 > 汽车内饰 > 方向盘套,亚马逊(卓越网),睿博1004006006,汽车摩托|内饰精品|方向盘套,科馀 御指环monkiki方向盘套公仔方向盘套汽车把套 两色可选 优雅枣红,汽车用品 > 汽车内饰 > 方向盘套,亚马逊(卓越网),科馀1004006006,汽车摩托|内饰精品|方向盘套,睿博 冬季方向盘套毛绒把套冬季方向盘套毛绒把套/毛绒把套 红色,汽车用品 > 汽车内饰 > 方向盘套,亚马逊(卓越网),睿博1004006006,汽车摩托|内饰精品|方向盘套,科馀 汽车方向盘套 各种车型细毛绒把套 四季车把套 车饰,汽车用品 > 汽车内饰 > 方向盘套,亚马逊(卓越网),科馀1004006006,汽车摩托|内饰精品|方向盘套,科馀 御指环冬季毛绒方向盘套 高档仿羊绒把套 澳绒丝滑触感SW-02 110,汽车用品 > 汽车内饰 > 方向盘套,亚马逊(卓越网),科馀1004006006,汽车摩托|内饰精品|方向盘套,睿博 三明治 立体运动把套 汽车方向盘套 车方向盘套汽车品 三明治-红黑,汽车用品/类别/汽车内饰/方向盘套,亚马逊(卓越网),睿博1004006006,汽车摩托|内饰精品|方向盘套,WRC 汽车用四季方向盘套 把套 奢华碳纤纹 耐磨 耐老化 通用 米色,汽车用品 > 汽车内饰 > 方向盘套,亚马逊(卓越网),WRC1004006006,汽车摩托|内饰精品|方向盘套,安美弛AM-2077冬季毛绒方向盘套 咖啡色,汽车用品>方向盘套>安美弛>安美弛AM-2077冬季毛绒方向盘套 咖啡色,国美电器网上商城,安美弛车品旗舰店1004006006,汽车摩托|内饰精品|方向盘套,威特 方向盘把套 手缝系列 fz-2112 黑 中号,汽车用品 > 汽车内饰 > 方向盘套,亚马逊(卓越网),威特1004006006,汽车摩托|内饰精品|方向盘套,新族3D透气方向盘套 通用 米色,汽车用品 > 汽车内饰 > 方向盘套,亚马逊(卓越网),新族1004006006,汽车摩托|内饰精品|方向盘套,路易 方向盘把套 磁疗芳香 CL05 橙 中号,汽车用品 > 汽车内饰 > 方向盘套,亚马逊(卓越网),路易1004006006,汽车摩托|内饰精品|方向盘套,LARENTO老人头 FLR-B2206 莎士比亚汽车方向盘套 (黑色),汽车用品 > 汽车内饰 > 方向盘套,亚马逊(卓越网),LAORENTOU 老人头1004006006,汽车摩托|内饰精品|方向盘套,卡饰社 真皮方向盘套 D02H 黑色 直径38cm CS-27324,汽车用品 > 汽车内饰 > 方向盘套,亚马逊(卓越网),Carsetcity 卡饰社1004006006,汽车摩托|内饰精品|方向盘套,Great Life GLT-104G 三明治防汗防滑透气方向盘套-灰色,汽车用品 > 汽车内饰 > 方向盘套,亚马逊(卓越网),Great Life 格雷特1004006006,汽车摩托|内饰精品|方向盘套,路易 方向盘把套 花样年华 yn01 黑 中号,汽车用品 > 汽车内饰 > 方向盘套,亚马逊(卓越网),路易1004006006,汽车摩托|内饰精品|方向盘套,Mocmoc/美车仔 摩丝娃娃枣红 四季汽车方向盘套 韩国可爱车用把手套 车内装饰品,所有分类>大小家电、厨电、汽车>汽车生活>汽车内饰>方向盘套>Mocmoc/美车仔>Mocmoc/美车仔...,1号店,Mocmoc/美车仔1004006006,汽车摩托|内饰精品|方向盘套,WRC 汽车方向盘套 高级碳纤纤皮车用把套 科鲁兹 福克斯 高尔夫6 红色 中号,汽车用品 > 汽车内饰 > 方向盘套,亚马逊(卓越网),WRC1004006006,汽车摩托|内饰精品|方向盘套,卡客 Karcle雕花 汽车方向盘套 透气 夏季 车用把套 汽车把套 四季把套 雍容鎏金 中号37cm-38cm,汽车用品>内饰精品>方向盘套>其它>卡客 Karcle雕花 汽车方向盘套 透...,京东商城,润卡车品专营店1004006006,汽车摩托|内饰精品|方向盘套,石家垫 雪花毛绒 汽车方向盘套 把套 驼色 38CM,汽车用品>汽车装饰>车内饰品>石家垫>石家垫 雪花毛绒 汽车方向盘套 把套 驼...,京东商城,石家垫车品旗舰店1004006006,汽车摩托|内饰精品|方向盘套,缪斯 订做纳米布艺座套 斯柯达明锐大众朗逸骊威别克凯越 专用汽车坐套四季通用新款 锋驭 啡色211B,缪斯>缪斯 订做纳米布艺座套 斯柯达明锐大众朗...,京东商城,缪斯旗舰店1004006006,汽车摩托|内饰精品|方向盘套,YooCar 优尔卡 夏季 冰丝皮革方向盘套 四季通用把套 科鲁兹 凯越 大众 高尔夫等,所有分类>大小家电、厨电、汽车>汽车生活>汽车内饰>方向盘套>YooCar>YooCar 优尔卡...,1号店,YooCar1004006006,汽车摩托|内饰精品|方向盘套,搜酷汽车方向盘套奥迪Q5 A4L A6L A8L 宝马 现代 网布系列通用把套 (M（37-38cm）, 黑色),汽车用品 > 汽车内饰 > 方向盘套,亚马逊(卓越网),BaiShuo1004006006,汽车摩托|内饰精品|方向盘套,搜酷车用方向盘套 奥迪宝马现代大众别克 运动时尚 高档皮质汽车方向盘套 (M（37-38cm）, 黑黄),汽车用品 > 汽车内饰 > 方向盘套,亚马逊(卓越网),BaiShuo 柏烁1004006006,汽车摩托|内饰精品|方向盘套,浩优 现代IX30/IX35/途胜/索塔纳/瑞纳朗动汽车超纤皮方向盘套 四季把套 黑色,汽车用品>内饰精品>方向盘套>其他>浩优 现代IX30/IX35/途胜/索塔...,京东商城,连顺车品专卖店1004006006,汽车摩托|内饰精品|方向盘套,正版mocmoc摩丝娃娃 卡通乳胶汽车方向盘套 可爱韩国四季汽车把套 F06爱心红唇粉色,汽车用品 > 汽车内饰 > 方向盘套,亚马逊(卓越网),MOCMOC 摩丝娃娃1004006006,汽车摩托|内饰精品|方向盘套,正版mocmoc摩丝娃娃 卡通乳胶汽车方向盘套 可爱韩国四季汽车把套 F01摩丝logo粉色,汽车用品 > 汽车内饰 > 方向盘套,亚马逊(卓越网),MOCMOC 摩丝娃娃1004006006,汽车摩托|内饰精品|方向盘套,GREAT LIFE GLT-089 折叠式汽车方向盘锁,汽车用品>安全自驾>车锁地锁>GREAT LIFE>GREAT LIFEGLT-089,京东商城,GREAT LIFE1004006006,汽车摩托|内饰精品|方向盘套,荣立诚 毛绒方向盘套 仿羊毛汽车把套 冬季毛绒方向盘套 超柔软,汽车用品 > 汽车内饰 > 方向盘套,亚马逊(卓越网),荣立诚1004006006,汽车摩托|内饰精品|方向盘套,思卡丽 新款汽车专用布套定做 大众新宝来速腾朗逸尚酷捷达途观高尔夫CC帕萨特 四季通用座套坐 炫酷黑 宝来,思卡丽>思卡丽 新款汽车专用布套定做 大众新宝来...,京东商城,思卡丽京东旗舰店1004006006,汽车摩托|内饰精品|方向盘套,思卡丽 新款汽车专用布套定做 大众新宝来速腾朗逸尚酷捷达途观高尔夫CC帕萨特 四季通用座套坐 炫酷黑 朗逸,思卡丽>思卡丽 新款汽车专用布套定做 大众新宝来...,京东商城,思卡丽京东旗舰店1004006006,汽车摩托|内饰精品|方向盘套,新标致408/308福克斯科鲁兹英朗世嘉polo速腾朗逸迈腾途观汽车真皮方向盘套把套 包邮 1158经典款米色 M,汽车用品>内饰精品>方向盘套>其它>新标致408/308福克斯科鲁兹英朗世嘉...,京东商城,壹家亲车品专营店1004006006,汽车摩托|内饰精品|方向盘套,友福 7688仿皮方向盘套中号38cm手把套时尚朗逸迈腾帕萨特福克斯凯美瑞凯越天籁沃尔沃 黑红,友福>友福 7688仿皮方向盘套中号38cm手...,京东商城,友福汽车用品旗舰店1004006006,汽车摩托|内饰精品|方向盘套,车之吻 高档超纤皮汽车方向盘套 超手感防滑 四季通用/灰色(中号、轿车通用、环保透气、吸汗防滑无异味) (北京地区已开通线下安装及保养服务！仅限亚马逊自营商品，详见商品描述),汽车用品 > 汽车内饰 > 方向盘套,亚马逊(卓越网),车之吻1004006006,汽车摩托|内饰精品|方向盘套,车之吻 高档超纤皮汽车方向盘套 超手感防滑 四季通用/白色+棕色 (中号、轿车通用、环保透气、吸汗防滑无异味) (北京地区已开通线下安装及保养服务！仅限亚马逊自营商品，详见商品描述),汽车用品 > 汽车内饰 > 方向盘套,亚马逊(卓越网),车之吻1004006006,汽车摩托|内饰精品|方向盘套,思卡丽 专用汽车座套订做 四季通用坐套 三菱菱帅菱悦 翼神 蓝瑟 戈蓝 帕杰罗 欧蓝德汽车布套 时尚灰 菱帅,思卡丽>思卡丽 专用汽车座套订做 四季通用坐套 ...,京东商城,思卡丽京东旗舰店1004006006,汽车摩托|内饰精品|方向盘套,思卡丽 订做四季新款坐套布套 菲亚特西耶那菲翔领雅 博悦新雅途周末风派力奥派朗汽车专用座 炫酷黑 派力奥,思卡丽>思卡丽 订做四季新款坐套布套 菲亚特西耶...,京东商城,思卡丽京东旗舰店1004006006,汽车摩托|内饰精品|方向盘套,思卡丽 订做四季新款坐套布套现代伊兰特索纳塔雅绅特悦动朗动IX35 IX30瑞纳领翔 汽车专用座 优雅米 伊兰特,思卡丽>思卡丽 订做四季新款坐套布套现代伊兰特索...,京东商城,思卡丽京东旗舰店1004006006,汽车摩托|内饰精品|方向盘套,思卡丽 订做四季新款坐套布套现代伊兰特索纳塔雅绅特悦动朗动IX35 IX30瑞纳领翔 汽车专用座套 优雅米 朗动,思卡丽>思卡丽 订做四季新款坐套布套现代伊兰特索...,京东商城,思卡丽京东旗舰店1004006006,汽车摩托|内饰精品|方向盘套,思卡丽 订做四季新款坐套布套本田雅阁思迪飞度CRV锋范思铂睿歌诗图传奇 汽车座套专车 时尚灰 五座-备注车型,思卡丽>思卡丽 订做四季新款坐套布套本田雅阁思迪...,京东商城,思卡丽京东旗舰店1004006006,汽车摩托|内饰精品|方向盘套,思卡丽 订做四季新款坐套布套本田雅阁思迪飞度CRV锋范思铂睿歌诗图传奇 汽车座套专车专用 激情红 锋范,思卡丽>思卡丽 订做四季新款坐套布套本田雅阁思迪...,京东商城,思卡丽京东旗舰店1004006006,汽车摩托|内饰精品|方向盘套,虎贝尔 汽车方向盘套 防滑真皮科鲁新兹福克斯把套h401 黑色 大号,虎贝尔（HBR）>虎贝尔 汽车方向盘套 防滑真皮科鲁新兹福...,京东商城,虎贝尔旗舰店1004006006,汽车摩托|内饰精品|方向盘套,奕伶 正品 羔羊皮 减震防滑保护 超手感超好 汽车方向盘套 把套 灰色羔羊皮把套 M号,汽车用品>内饰精品>方向盘套>奕伶 正品 羔羊皮 减震防滑保护 超手感...,京东商城,奕伶车品旗舰店1004006006,汽车摩托|内饰精品|方向盘套,石家垫 欧洲皇室风格 汽车方向盘套 把套 爵士棕 38CM,汽车用品>内饰精品>方向盘套>石家垫>石家垫 欧洲皇室风格 汽车方向盘套 把套...,京东商城,石家垫车品旗舰店1004006006,汽车摩托|内饰精品|方向盘套,木丁西 高弹力超透气高弹力超纤皮汽车方向盘套 四季通用车把套用品 黑色,汽车用品 > 汽车内饰 > 方向盘套,亚马逊(卓越网),木丁西1004006006,汽车摩托|内饰精品|方向盘套,石家垫 推荐 四季方向盘套 手缝头层牛皮 汽车方向盘套 真皮 把套 黑色 中号,汽车用品>内饰精品>方向盘套>石家垫>石家垫 推荐 四季方向盘套 手缝头层牛皮...,京东商城,石家垫车品旗舰店1004006006,汽车摩托|内饰精品|方向盘套,货到付款 中德优质防滑网眼透气三明治车用把套中号环保内胶圈（环保圈）汽车方向盘套夏季车用 灰色BT-0004,汽车用品>内饰精品>方向盘套>其它>货到付款 中德优质防滑网眼透气三明治车用...,京东商城,中德旗舰店1004006006,汽车摩托|内饰精品|方向盘套,索瑞尔（Sorer）冰丝方向盘套 汽车把套 透气 SR8318 汽车用品 米色,汽车用品>内饰精品>方向盘套>索瑞尔（Sorer）冰丝方向盘套 汽车把...,京东商城,铠翼汽车用品专营店