1004003016,汽车摩托|改装配件|车身装饰,帕飞克 新交规航空铝合金车牌架 防盗牌照架 可拆卸车牌框 牌照框 丰田 杰路驰ZELAS (送牌照平头螺丝2套+防震垫2片) 两片装 玫红色,汽车用品 > 汽车外饰 > 车牌框架,亚马逊(卓越网),Cactus1004003016,汽车摩托|改装配件|车身装饰,帕飞克 新交规航空铝合金车牌架 防盗牌照架 可拆卸车牌框 牌照框 宝马6系双门硬顶轿跑 640i 650i (送牌照平头螺丝2套+防震垫2片) 两片装 金黄色,汽车用品 > 汽车外饰 > 车牌框架,亚马逊(卓越网),Cactus1004003016,汽车摩托|改装配件|车身装饰,帕飞克 新交规航空铝合金车牌架 防盗牌照架 可拆卸车牌框 牌照框 福特 嘉年华三厢 2009 (送牌照平头螺丝2套+防震垫2片) 两片装 玫红色,汽车用品 > 汽车外饰 > 车牌框架,亚马逊(卓越网),Cactus1004003016,汽车摩托|改装配件|车身装饰,帕飞克 新交规航空铝合金车牌架 防盗牌照架 可拆卸车牌框 牌照框 雪铁龙 C5 2010 (送牌照平头螺丝2套+防震垫2片) 两片装 金黄色,汽车用品 > 汽车外饰 > 车牌框架,亚马逊(卓越网),Cactus1004003016,汽车摩托|改装配件|车身装饰,帕飞克 新交规航空铝合金车牌架 防盗牌照架 可拆卸车牌框 牌照框 别克 英朗GT 三厢 (送牌照平头螺丝2套+防震垫2片) 两片装 金黄色,汽车用品 > 汽车外饰 > 车牌框架,亚马逊(卓越网),Cactus1004003016,汽车摩托|改装配件|车身装饰,帕飞克 新交规航空铝合金车牌架 防盗牌照架 可拆卸车牌框 牌照框 奔驰ML ML300 ML350 2012款 (送牌照平头螺丝2套+防震垫2片) 两片装 金黄色,汽车用品 > 汽车外饰 > 车牌框架,亚马逊(卓越网),Cactus1004003016,汽车摩托|改装配件|车身装饰,帕飞克 新交规航空铝合金车牌架 防盗牌照架 可拆卸车牌框 牌照框 现代 伊兰特悦动 2008款 (送牌照平头螺丝2套+防震垫2片) 两片装 玫红色,汽车用品 > 汽车外饰 > 车牌框架,亚马逊(卓越网),Cactus1004003016,汽车摩托|改装配件|车身装饰,帕飞克 新交规航空铝合金车牌架 防盗牌照架 可拆卸车牌框 牌照框 奇瑞A3三厢 2010 (送牌照平头螺丝2套+防震垫2片) 两片装 玫红色,汽车用品 > 汽车外饰 > 车牌框架,亚马逊(卓越网),Cactus1004003016,汽车摩托|改装配件|车身装饰,帕飞克 新交规航空铝合金车牌架 防盗牌照架 可拆卸车牌框 牌照框 福特 蒙迪欧 2002款 (送牌照平头螺丝2套+防震垫2片) 两片装 金黄色,汽车用品 > 汽车外饰 > 车牌框架,亚马逊(卓越网),Cactus1004003016,汽车摩托|改装配件|车身装饰,帕飞克 新交规航空铝合金车牌架 防盗牌照架 可拆卸车牌框 牌照框 宝马老3系 320i 325 330(送牌照平头螺丝2套+防震垫2片) 两片装 金黄色,汽车用品 > 汽车外饰 > 车牌框架,亚马逊(卓越网),Cactus1004003016,汽车摩托|改装配件|车身装饰,帕飞克 新交规航空铝合金车牌架 防盗牌照架 可拆卸车牌框 牌照框 雪佛兰 SPARK 斯帕克 进口 (送牌照平头螺丝2套+防震垫2片) 两片装 玫红色,汽车用品 > 汽车外饰 > 车牌框架,亚马逊(卓越网),Cactus1004003016,汽车摩托|改装配件|车身装饰,帕飞克 新交规航空铝合金车牌架 防盗牌照架 可拆卸车牌框 牌照框 丰田 凯美瑞 2006款 (送牌照平头螺丝2套+防震垫2片) 两片装 玫红色,汽车用品 > 汽车外饰 > 车牌框架,亚马逊(卓越网),Cactus1004003016,汽车摩托|改装配件|车身装饰,帕飞克 新交规航空铝合金车牌架 防盗牌照架 可拆卸车牌框 牌照框 路虎 陆虎 小揽胜 览胜运动版 2010 (送牌照平头螺丝2套+防震垫2片) 两片装 金黄色,汽车用品 > 汽车外饰 > 车牌框架,亚马逊(卓越网),Cactus1004003016,汽车摩托|改装配件|车身装饰,帕飞克 新交规航空铝合金车牌架 防盗牌照架 可拆卸车牌框 牌照框 大众 途安七座 7座 (送牌照平头螺丝2套+防震垫2片) 两片装 金黄色,汽车用品 > 汽车外饰 > 车牌框架,亚马逊(卓越网),Cactus1004003016,汽车摩托|改装配件|车身装饰,帕飞克 新交规航空铝合金车牌架 防盗牌照架 可拆卸车牌框 牌照框 日产尼桑 玛驰 2010 (送牌照平头螺丝2套+防震垫2片) 两片装 黑色,汽车用品 > 汽车外饰 > 车牌框架,亚马逊(卓越网),Cactus1004003016,汽车摩托|改装配件|车身装饰,帕飞克 新交规航空铝合金车牌架 防盗牌照架 可拆卸车牌框 牌照框 起亚 索兰托 SUV (送牌照平头螺丝2套+防震垫2片) 两片装 黑色,汽车用品 > 汽车外饰 > 车牌框架,亚马逊(卓越网),Cactus1004003016,汽车摩托|改装配件|车身装饰,帕飞克 新交规航空铝合金车牌架 防盗牌照架 可拆卸车牌框 牌照框 起亚 新佳乐七座专用 2010 (送牌照平头螺丝2套+防震垫2片) 两片装 黑色,汽车用品 > 汽车外饰 > 车牌框架,亚马逊(卓越网),Cactus1004003016,汽车摩托|改装配件|车身装饰,帕飞克 新交规航空铝合金车牌架 防盗牌照架 可拆卸车牌框 牌照框 奔驰C级旅行车 (送牌照平头螺丝2套+防震垫2片) 两片装 黑色,汽车用品 > 汽车外饰 > 车牌框架,亚马逊(卓越网),Cactus1004003016,汽车摩托|改装配件|车身装饰,帕飞克 新交规航空铝合金车牌架 防盗牌照架 可拆卸车牌框 牌照框 马自达2 三厢 (送牌照平头螺丝2套+防震垫2片) 两片装 黑色,汽车用品 > 汽车外饰 > 车牌框架,亚马逊(卓越网),Cactus1004003016,汽车摩托|改装配件|车身装饰,帕飞克 新交规航空铝合金车牌架 防盗牌照架 可拆卸车牌框 牌照框 标志 标致 307三厢 (送牌照平头螺丝2套+防震垫2片) 两片装 黑色,汽车用品 > 汽车外饰 > 车牌框架,亚马逊(卓越网),Cactus1004003016,汽车摩托|改装配件|车身装饰,帕飞克 新交规航空铝合金车牌架 防盗牌照架 可拆卸车牌框 牌照框 本田七代雅阁 2003款 (送牌照平头螺丝2套+防震垫2片) 两片装 黑色,汽车用品 > 汽车外饰 > 车牌框架,亚马逊(卓越网),Cactus1004003016,汽车摩托|改装配件|车身装饰,帕飞克 新交规航空铝合金车牌架 防盗牌照架 可拆卸车牌框 牌照框 起亚 赛拉图 三厢 (送牌照平头螺丝2套+防震垫2片) 两片装 粉红色,汽车用品 > 汽车外饰 > 车牌框架,亚马逊(卓越网),Cactus1004003016,汽车摩托|改装配件|车身装饰,帕飞克 新交规航空铝合金车牌架 防盗牌照架 可拆卸车牌框 牌照框 马自达5加扩展件 (送牌照平头螺丝2套+防震垫2片) 两片装 粉红色,汽车用品 > 汽车外饰 > 车牌框架,亚马逊(卓越网),Cactus1004003016,汽车摩托|改装配件|车身装饰,帕飞克 新交规航空铝合金车牌架 防盗牌照架 可拆卸车牌框 牌照框 奇瑞 威麟V5 7座 (送牌照平头螺丝2套+防震垫2片) 两片装 粉红色,汽车用品 > 汽车外饰 > 车牌框架,亚马逊(卓越网),Cactus1004003016,汽车摩托|改装配件|车身装饰,帕飞克 新交规航空铝合金车牌架 防盗牌照架 可拆卸车牌框 牌照框 马自达M6睿翼 轿跑 (送牌照平头螺丝2套+防震垫2片) 两片装 黑色,汽车用品 > 汽车外饰 > 车牌框架,亚马逊(卓越网),Cactus1004003016,汽车摩托|改装配件|车身装饰,帕飞克 新交规航空铝合金车牌架 防盗牌照架 可拆卸车牌框 牌照框 名爵 MG3 2010 (送牌照平头螺丝2套+防震垫2片) 两片装 粉红色,汽车用品 > 汽车外饰 > 车牌框架,亚马逊(卓越网),Cactus1004003016,汽车摩托|改装配件|车身装饰,帕飞克 新交规航空铝合金车牌架 防盗牌照架 可拆卸车牌框 牌照框 本田 理念S1 (送牌照平头螺丝2套+防震垫2片) 两片装 黑色,汽车用品 > 汽车外饰 > 车牌框架,亚马逊(卓越网),Cactus1004003016,汽车摩托|改装配件|车身装饰,帕飞克 新交规航空铝合金车牌架 防盗牌照架 可拆卸车牌框 牌照框 雪铁龙 世嘉三厢 2006款 (送牌照平头螺丝2套+防震垫2片) 两片装 黑色,汽车用品 > 汽车外饰 > 车牌框架,亚马逊(卓越网),Cactus1004003016,汽车摩托|改装配件|车身装饰,帕飞克 新交规航空铝合金车牌架 防盗牌照架 可拆卸车牌框 牌照框 现代 伊兰特 2002款 (送牌照平头螺丝2套+防震垫2片) 两片装 黑色,汽车用品 > 汽车外饰 > 车牌框架,亚马逊(卓越网),Cactus1004003016,汽车摩托|改装配件|车身装饰,帕飞克 新交规航空铝合金车牌架 防盗牌照架 可拆卸车牌框 牌照框 斯巴鲁 森林人 (送牌照平头螺丝2套+防震垫2片) 两片装 粉红色,汽车用品 > 汽车外饰 > 车牌框架,亚马逊(卓越网),Cactus1004003016,汽车摩托|改装配件|车身装饰,帕飞克 新交规航空铝合金车牌架 防盗牌照架 可拆卸车牌框 牌照框 大众 朗逸 2008款 (送牌照平头螺丝2套+防震垫2片) 两片装 粉红色,汽车用品 > 汽车外饰 > 车牌框架,亚马逊(卓越网),Cactus1004003016,汽车摩托|改装配件|车身装饰,帕飞克 新交规航空铝合金车牌架 防盗牌照架 可拆卸车牌框 牌照框 别克凯越HRV (送牌照平头螺丝2套+防震垫2片) 两片装 大红色,汽车用品 > 汽车外饰 > 车牌框架,亚马逊(卓越网),Cactus1004003016,汽车摩托|改装配件|车身装饰,帕飞克 新交规航空铝合金车牌架 防盗牌照架 可拆卸车牌框 牌照框 别克 老凯越 2004 (送牌照平头螺丝2套+防震垫2片) 两片装 粉红色,汽车用品 > 汽车外饰 > 车牌框架,亚马逊(卓越网),Cactus1004003016,汽车摩托|改装配件|车身装饰,帕飞克 新交规航空铝合金车牌架 防盗牌照架 可拆卸车牌框 牌照框 大众 迈腾 2007款 (送牌照平头螺丝2套+防震垫2片) 两片装 粉红色,汽车用品 > 汽车外饰 > 车牌框架,亚马逊(卓越网),Cactus1004003016,汽车摩托|改装配件|车身装饰,帕飞克 新交规航空铝合金车牌架 防盗牌照架 可拆卸车牌框 牌照框 沃尔沃 S80L (送牌照平头螺丝2套+防震垫2片) 两片装 粉红色,汽车用品 > 汽车外饰 > 车牌框架,亚马逊(卓越网),Cactus1004003016,汽车摩托|改装配件|车身装饰,帕飞克 新交规航空铝合金车牌架 防盗牌照架 可拆卸车牌框 牌照框 英菲尼迪QX56 七座 三排 2011 (送牌照平头螺丝2套+防震垫2片) 两片装 粉红色,汽车用品 > 汽车外饰 > 车牌框架,亚马逊(卓越网),Cactus1004003016,汽车摩托|改装配件|车身装饰,帕飞克 新交规航空铝合金车牌架 防盗牌照架 可拆卸车牌框 牌照框 沃尔沃 S60 2011 (送牌照平头螺丝2套+防震垫2片) 两片装 大红色,汽车用品 > 汽车外饰 > 车牌框架,亚马逊(卓越网),Cactus1004003016,汽车摩托|改装配件|车身装饰,帕飞克 新交规航空铝合金车牌架 防盗牌照架 可拆卸车牌框 牌照框丰田 新锐志 2010 (送牌照平头螺丝2套+防震垫2片) 两片装 粉红色,汽车用品 > 汽车外饰 > 车牌框架,亚马逊(卓越网),Cactus1004003016,汽车摩托|改装配件|车身装饰,帕飞克 新交规航空铝合金车牌架 防盗牌照架 可拆卸车牌框 牌照框 起亚 秀儿 (送牌照平头螺丝2套+防震垫2片) 两片装 大红色,汽车用品 > 汽车外饰 > 车牌框架,亚马逊(卓越网),Cactus1004003016,汽车摩托|改装配件|车身装饰,帕飞克 新交规航空铝合金车牌架 防盗牌照架 可拆卸车牌框 牌照框 长城嘉誉 (送牌照平头螺丝2套+防震垫2片) 两片装 大红色,汽车用品 > 汽车外饰 > 车牌框架,亚马逊(卓越网),Cactus1004003016,汽车摩托|改装配件|车身装饰,帕飞克 新交规航空铝合金车牌架 防盗牌照架 可拆卸车牌框 牌照框 标志 标志508 2011 (送牌照平头螺丝2套+防震垫2片) 两片装 大红色,汽车用品 > 汽车外饰 > 车牌框架,亚马逊(卓越网),Cactus1004003016,汽车摩托|改装配件|车身装饰,帕飞克 新交规航空铝合金车牌架 防盗牌照架 可拆卸车牌框 牌照框 奔驰GL450 GL550(送牌照平头螺丝2套+防震垫2片) 两片装 粉红色,汽车用品 > 汽车外饰 > 车牌框架,亚马逊(卓越网),Cactus1004003016,汽车摩托|改装配件|车身装饰,帕飞克 新交规航空铝合金车牌架 防盗牌照架 可拆卸车牌框 牌照框 荣威550 (送牌照平头螺丝2套+防震垫2片) 两片装 大红色,汽车用品 > 汽车外饰 > 车牌框架,亚马逊(卓越网),Cactus1004003016,汽车摩托|改装配件|车身装饰,帕飞克 新交规航空铝合金车牌架 防盗牌照架 可拆卸车牌框 牌照框 丰田 凯美瑞混合动力 2009 (送牌照平头螺丝2套+防震垫2片) 两片装 大红色,汽车用品 > 汽车外饰 > 车牌框架,亚马逊(卓越网),Cactus1004003016,汽车摩托|改装配件|车身装饰,帕飞克 新交规航空铝合金车牌架 防盗牌照架 可拆卸车牌框 牌照框 别克 新君越 2009 (送牌照平头螺丝2套+防震垫2片) 两片装 大红色,汽车用品 > 汽车外饰 > 车牌框架,亚马逊(卓越网),Cactus1004003016,汽车摩托|改装配件|车身装饰,帕飞克 新交规航空铝合金车牌架 防盗牌照架 可拆卸车牌框 牌照框 雪佛兰 科鲁兹 克鲁泽 (送牌照平头螺丝2套+防震垫2片) 两片装 大红色,汽车用品 > 汽车外饰 > 车牌框架,亚马逊(卓越网),Cactus1004003016,汽车摩托|改装配件|车身装饰,帕飞克 新交规航空铝合金车牌架 防盗牌照架 可拆卸车牌框 牌照框 雷克萨斯CT200H (送牌照平头螺丝2套+防震垫2片) 两片装 大红色,汽车用品 > 汽车外饰 > 车牌框架,亚马逊(卓越网),Cactus1004003016,汽车摩托|改装配件|车身装饰,帕飞克 新交规航空铝合金车牌架 防盗牌照架 可拆卸车牌框 牌照框丰田 新锐志 2010 (送牌照平头螺丝2套+防震垫2片) 两片装 大红色,汽车用品 > 汽车外饰 > 车牌框架,亚马逊(卓越网),Cactus1004003016,汽车摩托|改装配件|车身装饰,帕飞克 新交规航空铝合金车牌架 防盗牌照架 可拆卸车牌框 牌照框 丰田 新凯美瑞 2012款 (送牌照平头螺丝2套+防震垫2片) 两片装 大红色,汽车用品 > 汽车外饰 > 车牌框架,亚马逊(卓越网),Cactus1004003016,汽车摩托|改装配件|车身装饰,Karcle 卡客 镁铝合金 个性汽车牌架 车牌框 牌照架 牌照框 对装 防盗送防震垫 (黑色),汽车用品 > 汽车外饰 > 车牌框架,亚马逊(卓越网),Karcle1004003016,汽车摩托|改装配件|车身装饰,3M 双面胶 车家两用超强力无痕泡沫胶带(10卷装)5mm*3m,汽车用品 > 汽车外饰 > 防撞、装饰条 > 防撞条,亚马逊(卓越网),3M1004003016,汽车摩托|改装配件|车身装饰,Mgobi高贝黑色氧化铝牌照架新交规车牌架车牌框,汽车用品 > 汽车外饰 > 车牌框架,亚马逊(卓越网),Mgobi 高贝1004003016,汽车摩托|改装配件|车身装饰,威利 车窗饰条 福克斯两厢不锈钢整窗饰条/车窗亮条 16件 2012年 21151301【厂家直发】,汽车用品>改装配件>车身装饰>威利（WELLY）>威利车窗饰条,京东商城,威利（WELLY）1004003016,汽车摩托|改装配件|车身装饰,B2 雪铁龙世嘉车窗饰条 爱丽舍车窗装饰亮条不锈钢下车窗条 B2 世嘉三厢,汽车用品 > 汽车零件 > 内部零件 > 太阳防晒遮挡 > 隔热窗帘,亚马逊(卓越网),B21004003016,汽车摩托|改装配件|车身装饰,帕飞克 新交规高品质锌合金，不生锈，硬度强，不变形，抗磨损，立体感强，大气稳重车牌架 防盗牌照架 可拆卸车牌框 牌照框 铃木 雨燕2012款 磨砂 车牌托盘 两片装 黑色亚光,汽车用品 > 汽车外饰 > 车牌框架,亚马逊(卓越网),Cactus1004003016,汽车摩托|改装配件|车身装饰,帕飞克 新交规高品质锌合金，不生锈，硬度强，不变形，抗磨损，立体感强，大气稳重车牌架 防盗牌照架 可拆卸车牌框 牌照框 大众 新帕萨特 2011 磨砂 车牌托盘 两片装 黑色亚光,汽车用品 > 汽车外饰 > 车牌框架,亚马逊(卓越网),Cactus1004003016,汽车摩托|改装配件|车身装饰,帕飞克 新交规高品质锌合金，不生锈，硬度强，不变形，抗磨损，立体感强，大气稳重车牌架 防盗牌照架 可拆卸车牌框 牌照框 本田 思域 磨砂 车牌托盘 两片装 黑色亚光,汽车用品 > 汽车外饰 > 车牌框架,亚马逊(卓越网),Cactus1004003016,汽车摩托|改装配件|车身装饰,帕飞克 新交规高品质锌合金，不生锈，硬度强，不变形，抗磨损，立体感强，大气稳重车牌架 防盗牌照架 可拆卸车牌框 牌照框 雷诺 雷科傲 磨砂 车牌托盘 两片装 黑色亚光,汽车用品 > 汽车外饰 > 车牌框架,亚马逊(卓越网),Cactus1004003016,汽车摩托|改装配件|车身装饰,帕飞克 新交规高品质锌合金，不生锈，硬度强，不变形，抗磨损，立体感强，大气稳重车牌架 防盗牌照架 可拆卸车牌框 牌照框 奔驰G500 2012款 磨砂 车牌托盘 两片装 黑色亚光,汽车用品 > 汽车外饰 > 车牌框架,亚马逊(卓越网),Cactus1004003016,汽车摩托|改装配件|车身装饰,帕飞克 新交规高品质锌合金，不生锈，硬度强，不变形，抗磨损，立体感强，大气稳重车牌架 防盗牌照架 可拆卸车牌框 牌照框 雪佛兰 老赛欧SRV 磨砂 车牌托盘 两片装 黑色亚光,汽车用品 > 汽车外饰 > 车牌框架,亚马逊(卓越网),Cactus1004003016,汽车摩托|改装配件|车身装饰,帕飞克 新交规高品质锌合金，不生锈，硬度强，不变形，抗磨损，立体感强，大气稳重车牌架 防盗牌照架 可拆卸车牌框 牌照框 大众途安七座 加扩展件 磨砂 车牌托盘 两片装 黑色亚光,汽车用品 > 汽车外饰 > 车牌框架,亚马逊(卓越网),Cactus1004003016,汽车摩托|改装配件|车身装饰,帕飞克 新交规高品质锌合金，不生锈，硬度强，不变形，抗磨损，立体感强，大气稳重车牌架 防盗牌照架 可拆卸车牌框 牌照框 日产尼桑 新天籁 2008 磨砂 车牌托盘 两片装 黑色亚光,汽车用品 > 汽车外饰 > 车牌框架,亚马逊(卓越网),Cactus1004003016,汽车摩托|改装配件|车身装饰,帕飞克 新交规高品质锌合金，不生锈，硬度强，不变形，抗磨损，立体感强，大气稳重车牌架 防盗牌照架 可拆卸车牌框 牌照框 标志 标志508 2011 磨砂 车牌托盘 两片装 黑色亚光,汽车用品 > 汽车外饰 > 车牌框架,亚马逊(卓越网),Cactus1004003016,汽车摩托|改装配件|车身装饰,帕飞克 新交规高品质锌合金，不生锈，硬度强，不变形，抗磨损，立体感强，大气稳重车牌架 防盗牌照架 可拆卸车牌框 牌照框 宝马X5 五座专用 磨砂 车牌托盘 两片装 黑色亚光,汽车用品 > 汽车外饰 > 车牌框架,亚马逊(卓越网),Cactus1004003016,汽车摩托|改装配件|车身装饰,帕飞克 新交规高品质锌合金，不生锈，硬度强，不变形，抗磨损，立体感强，大气稳重车牌架 防盗牌照架 可拆卸车牌框 牌照框 起亚 霸锐 加扩展套件 磨砂 车牌托盘 两片装 黑色亚光,汽车用品 > 汽车外饰 > 车牌框架,亚马逊(卓越网),Cactus1004003016,汽车摩托|改装配件|车身装饰,正品美国3M双面胶 汽车用3M胶 3M胶带 1cm*3M 双面汽车胶带,汽车用品 > 汽车外饰 > 防撞、装饰条 > 防撞条,亚马逊(卓越网),3M胶1004003016,汽车摩托|改装配件|车身装饰,疯狂爱车-美霸 上海大众新polo波罗专用挡泥板 上海大众新polo波罗专用挡泥皮 黑色 4S店汽车装饰改装专用 正品汽车挡泥板 (厂家直接发货)+随机赠送小礼品（打蜡海绵、擦车巾、停车牌等） DIY自己的爱车 让它不再受伤！,汽车用品 > 汽车外饰 > 挡泥板,亚马逊(卓越网),疯狂爱车-美霸1004003016,汽车摩托|改装配件|车身装饰,疯狂爱车-美霸 别克新君威2.4T专用挡泥板 别克新君威2.4T专用挡泥皮 黑色 4S店汽车装饰改装专用 正品汽车挡泥板 (厂家直接发货)+随机赠送小礼品（打蜡海绵、擦车巾、停车牌等） DIY自己的爱车 让它不再受伤！,汽车用品 > 汽车外饰 > 挡泥板,亚马逊(卓越网),疯狂爱车-美霸1004003016,汽车摩托|改装配件|车身装饰,疯狂爱车-美霸 现代新索纳塔专用挡泥板 现代新索纳塔专用挡泥皮 黑色 4S店汽车装饰改装专用 正品汽车挡泥板 (厂家直接发货)+随机赠送小礼品（打蜡海绵、擦车巾、停车牌等） DIY自己的爱车 让它不再受伤！,汽车用品 > 汽车外饰 > 挡泥板,亚马逊(卓越网),疯狂爱车-美霸1004003016,汽车摩托|改装配件|车身装饰,疯狂爱车-美霸 日产骊威专用挡泥板 日产骊威专用挡泥皮 黑色 4S店汽车装饰改装专用 正品汽车挡泥板 (厂家直接发货)+随机赠送小礼品（打蜡海绵、擦车巾、停车牌等） DIY自己的爱车 让它不再受伤！,汽车用品 > 汽车外饰 > 挡泥板,亚马逊(卓越网),疯狂爱车-美霸1004003016,汽车摩托|改装配件|车身装饰,疯狂爱车-美霸 海马福美来二代 专用挡泥板 海马福美来二代 专用挡泥皮 黑色 4S店汽车装饰改装专用 正品汽车挡泥板 (厂家直接发货)+随机赠送小礼品（打蜡海绵、擦车巾、停车牌等） DIY自己的爱车 让它不再受伤！,汽车用品 > 汽车外饰 > 挡泥板,亚马逊(卓越网),疯狂爱车-美霸1004003016,汽车摩托|改装配件|车身装饰,疯狂爱车-美霸 现代朗动专用挡泥板 现代朗动专用挡泥皮 黑色 4S店汽车装饰改装专用 正品汽车挡泥板 (厂家直接发货)+随机赠送小礼品（打蜡海绵、擦车巾、停车牌等） DIY自己的爱车 让它不再受伤！,汽车用品 > 汽车外饰 > 挡泥板,亚马逊(卓越网),疯狂爱车-美霸1004003016,汽车摩托|改装配件|车身装饰,魔焕 车牌架 新交规 车牌照框 铝合金配螺丝 双轨加厚镁合金【一对装】 银色 单轨铝合金,汽车用品>改装配件>其他配件>其他>魔焕 车牌架 新交规 车牌照框 铝合金配...,京东商城,魔焕旗舰店1004003016,汽车摩托|改装配件|车身装饰,Dian bin 点缤 宝马车系侧标 5系 7系X1 X3 X5 X6银色麦穗标 车标 改装标贴 对装,汽车用品 > 汽车外饰 > 车标,亚马逊(卓越网),Dian bin 点缤1004003016,汽车摩托|改装配件|车身装饰,疯狂爱车-晶贵 新交规304纯不锈钢铃木车型专用车牌架 无车标（新交规专用）默认发货、带车标（验车不行）两款可选牌照架 铃木牌照框 车管所指定专用车牌架 爱车年检必备,汽车用品 > 汽车外饰 > 车牌框架,亚马逊(卓越网),疯狂爱车-晶贵1004003016,汽车摩托|改装配件|车身装饰,疯狂爱车-美霸 铃木羚羊专用挡泥板 铃木羚羊专用挡泥皮 黑色 4S店汽车装饰改装专用 正品汽车挡泥板 (厂家直接发货)+随机赠送小礼品（打蜡海绵、擦车巾、停车牌等） DIY自己的爱车 让它不再受伤！,汽车用品 > 汽车外饰 > 挡泥板,亚马逊(卓越网),疯狂爱车-美霸1004003016,汽车摩托|改装配件|车身装饰,疯狂爱车-美霸 铃木天语三厢专用挡泥板 铃木天语三厢专用挡泥皮 黑色 4S店汽车装饰改装专用 正品汽车挡泥板 (厂家直接发货)+随机赠送小礼品（打蜡海绵、擦车巾、停车牌等） DIY自己的爱车 让它不再受伤！,汽车用品 > 汽车外饰 > 挡泥板,亚马逊(卓越网),疯狂爱车-美霸1004003016,汽车摩托|改装配件|车身装饰,疯狂爱车-美霸 东风标致307专用挡泥板 东风标致307专用挡泥皮 黑色 4S店汽车装饰改装专用 正品汽车挡泥板 (厂家直接发货)+随机赠送小礼品（打蜡海绵、擦车巾、停车牌等） DIY自己的爱车 让它不再受伤！,汽车用品 > 汽车外饰 > 挡泥板,亚马逊(卓越网),疯狂爱车-美霸1004003016,汽车摩托|改装配件|车身装饰,九文 车牌架 2013新交规车牌框 汽车牌照框 航空铝合金牌照架包邮 紫色,汽车用品>内饰精品>功能用品>其它>九文 车牌架 2013新交规车牌框 汽车...,京东商城,九文车品旗舰店1004003016,汽车摩托|改装配件|车身装饰,奥克龙 不锈钢 汽车临时停车牌 告示牌 留言卡 停靠牌 带自编号码,其它>奥克龙 不锈钢 汽车临时停车牌 告示牌 ...,京东商城,奥克龙旗舰店1004003016,汽车摩托|改装配件|车身装饰,疯狂爱车-美霸 丰田普拉多专用挡泥板 丰田普拉多专用挡泥皮 黑色 4S店汽车装饰改装专用 正品汽车挡泥板 (厂家直接发货)+随机赠送小礼品（打蜡海绵、擦车巾、停车牌等） DIY自己的爱车 让它不再受伤！,汽车用品 > 汽车外饰 > 挡泥板,亚马逊(卓越网),疯狂爱车-美霸1004003016,汽车摩托|改装配件|车身装饰,华饰 汽车尾喉 改装专用件 304不锈钢 高品质直插式尾喉 烤蓝款一对装 大众高尔夫6旅行版,华饰>华饰 汽车尾喉 改装专用件 304不锈钢...,京东商城,华奇饰车品专营店1004003016,汽车摩托|改装配件|车身装饰,华饰 汽车尾喉 改装专用件 304不锈钢 高品质直插式尾喉 全银款单个装 大众高尔夫6,华饰>华饰 汽车尾喉 改装专用件 304不锈钢...,京东商城,华奇饰车品专营店