1004001016,汽车摩托|电子电器|胎压监测,JIANKUN 高精度上下限报警计数秤3kg/0.05g称6万精度媲美天平6kg/0.1g数量报警计数秤,所有分类>家居家纺、锅具餐具>家具家装>电子电工>其它>JIANKUN>JIANKUN 高精...,1号店,JIANKUN1004001016,汽车摩托|电子电器|胎压监测,胎压计安耐驰胎压监测无线帽汽车胎压表胎压帽4个胎压测量气压表,汽车用品>胎压计>安耐驰>胎压计安耐驰胎压监测无线帽汽车胎压表胎压帽4个胎压测量气压表,国美电器网上商城,安耐驰1004001016,汽车摩托|电子电器|胎压监测,铁将军胎压监测T159胎压报警器无线TPMS报警器胎压计 T159,汽车用品>安全自驾>胎压充气>铁将军>铁将军胎压监测T159胎压报警器无线TP...,京东商城,铁将军恒煦专卖店1004001016,汽车摩托|电子电器|胎压监测,邦立得Protector无线外置内置式高精度胎压监测仪胎温胎压计胎压表 外置260C,汽车用品>安全自驾>胎压充气> 邦立得（Protector）>邦立得Protector无线外置内置式高...,京东商城,邦立得汽车用品专营店1004001016,汽车摩托|电子电器|胎压监测,【京东自营】维科朗宁智感VR-211C 内置 无线胎压检测 胎压计 胎压报警器 TPMS24小时全面监测,汽车用品>安全自驾>胎压充气> 维科朗宁>维科朗宁VR-211,京东商城,维科朗宁1004001016,汽车摩托|电子电器|胎压监测,铁将军iPhone版胎压监测TPMS8886 苹果公司MFi认证 省燃油 防爆胎 减磨损 黑色,汽车用品>安全自驾>胎压充气>铁将军>铁将军iPhone版胎压监测TPMS88...,京东商城,铁将军旗舰店1004001016,汽车摩托|电子电器|胎压监测,【京东自营】维科朗宁智感VR-223C 外置 无线胎压检测 胎压计 胎压报警器 TPMS24小时全面监测,汽车用品>安全自驾>胎压充气> 维科朗宁>维科朗宁VR-223C,京东商城,维科朗宁1004001016,汽车摩托|电子电器|胎压监测,四轮巡卫 无线胎压监测系统 高精度TPMS胎压计胎压表内置HKLM003,汽车用品>安全自驾>胎压充气> 四轮巡卫>四轮巡卫 无线胎压监测系统 高精度TPM...,京东商城,乐途车品专营店1004001016,汽车摩托|电子电器|胎压监测,铁将军 T181 胎压监测 高精度胎压表 胎压计 汽车轮胎气压表 车用监测器 橙色,首页 >安全自驾 >胎压监测 >铁将军 >T181,易迅网,Steelmate/铁将军1004001016,汽车摩托|电子电器|胎压监测,Tyredog KTD9000B （内置）无线胎压监测系统胎压监,汽车用品>安全自驾>胎压充气> tyredog>Tyredog KTD9000B （内...,京东商城,虎翼汽车用品专营店1004001016,汽车摩托|电子电器|胎压监测,建设项目竣工环境保护验收监测:实用手册(上中下),china-pub网上 > 建筑 > 房地产与工程经济 > 其他 > 建设项目竣工环境保护验收监测:实用手册(上中下),互动出版网,1004001016,汽车摩托|电子电器|胎压监测,铁将军 智感750 胎压监测无线胎压检测 胎压计 胎压报警器 智感700升级版,汽车用品>安全自驾>胎压充气>铁将军>铁将军 智感750 胎压监测无线胎压检测...,京东商城,华奇饰车品专营店1004001016,汽车摩托|电子电器|胎压监测,轮行天下TPMS胎压监测传感器、发射器 10年电池寿命 无线,汽车用品>安全自驾>胎压充气>其它>轮行天下TPMS胎压监测传感器、发射器 ...,京东商城,轮行天下专营店1004001016,汽车摩托|电子电器|胎压监测,瑞世泰 胎压计 高精度汽车胎压测量计 车用胎压表 气压表 出行必备 高精度数显胎压计B,汽车用品>安全自驾>胎压充气> 瑞世泰>瑞世泰 胎压计 高精度汽车胎压测量计 车...,京东商城,贵瑞源汽车用品专营店1004001016,汽车摩托|电子电器|胎压监测,波尔 胎压计胎压表轮胎气压表TPMS胎压监测无线汽车用品,汽车用品>安全自驾>胎压充气> 波尔>波尔 胎压计胎压表轮胎气压表TPMS胎压...,京东商城,爱车人汽车用品专营店1004001016,汽车摩托|电子电器|胎压监测,乐炫 安全自驾胎压充气 车用气压表计 汽车轮胎压力表 打气枪 放气枪 第六代-指标式,汽车用品>安全自驾>胎压充气> 乐炫>乐炫 安全自驾胎压充气 车用气压表计 汽...,京东商城,宝鑫车品专营店1004001016,汽车摩托|电子电器|胎压监测,瑞柯 胎压监测仪系统 无线胎压监测器胎压仪RCG-B1,汽车用品>安全自驾>胎压充气> 瑞柯（WINDEK）>瑞柯 胎压监测仪系统 无线胎压监测器胎压...,京东商城,爱车人汽车用品专营店1004001016,汽车摩托|电子电器|胎压监测,励天行 精准汽车胎压计 可放气胎压表 轮胎气压计 汽车轮胎气压表胎压检测,汽车用品>电子电器>胎压监测>励天行>励天行 精准汽车胎压计 可放气胎压表 轮...,京东商城,励天励行车品店1004001016,汽车摩托|电子电器|胎压监测,CAREUD凯佑U901外置式胎压实时监测系统无线胎压监测器气压表传感器抬压计,汽车用品>安全自驾>胎压充气>凯佑>CAREUD凯佑U901外置式胎压实时监...,京东商城,凯裕盛汽车用品专营店1004001016,汽车摩托|电子电器|胎压监测,品悦高科 胎压监测器 大卡车外置,首页>汽车用品>电子/电器>胎压胎测>品悦高科胎压监测器大卡车外置,苏宁,品悦高科1004001016,汽车摩托|电子电器|胎压监测,铁将军胎压监测T159胎压报警器无线TPMS报警器胎压计 T157,汽车用品>安全自驾>胎压充气>铁将军>铁将军胎压监测T159胎压报警器无线TP...,京东商城,铁将军恒煦专卖店1004001016,汽车摩托|电子电器|胎压监测,波尔 胎压计胎压表轮胎气压表TPMS胎压监测无线汽车用品,汽车用品>安全自驾>胎压充气> 波尔>波尔 胎压计胎压表轮胎气压表TPMS胎压...,京东商城,爱车人汽车用品专营店1004001016,汽车摩托|电子电器|胎压监测,风劲霸TG09三合一胎压表 高精度机械式汽车轮胎气压表 车用胎压计 TG09,首页>汽车用品>电子/电器>胎压胎测>风劲霸TG09三合一胎压表高精度机...,苏宁,风劲霸1004001016,汽车摩托|电子电器|胎压监测,BLD 邦立得 汽车轮胎监测器信号转发器 (个),汽车用品 > 维修工具 > 胎温胎压检测,亚马逊(卓越网),BLD 邦立得1004001016,汽车摩托|电子电器|胎压监测,BLD 邦立得 汽车轮胎胎压胎温监测器 外置式 实时监测 (个),汽车用品 > 维修工具 > 胎温胎压检测,亚马逊(卓越网),BLD 邦立得1004001016,汽车摩托|电子电器|胎压监测,正品赛王 精密机械式轮胎气压表 MG-05 胎压表 自带放气功能,汽车用品 > 维修工具 > 胎温胎压检测,亚马逊(卓越网),AIRME 赛王1004001016,汽车摩托|电子电器|胎压监测,米卡萨 专柜正品 米卡萨气压表 MIKASA电子数字式气压表AG500,所有分类>运动户外>球类/健身>其它运动用品>米卡萨>米卡萨 专柜正品 米...,1号店,米卡萨1004001016,汽车摩托|电子电器|胎压监测,铁将军高精度胎压计胎压表TPMS胎压监测装置无线汽车用品智感700,汽车用品>电子电器>胎压监测>铁将军>铁将军高精度胎压计胎压表TPMS胎压监测...,京东商城,爱驾车品专营店1004001016,汽车摩托|电子电器|胎压监测,冠格（GUANGE） KTD8000A 汽车轮胎胎压监测 胎温监测 TPMS 无线智能监测,汽车用品>安全自驾>胎压充气>冠格（GUANGE）>冠格KTD8000A,京东商城,冠格（GUANGE）1004001016,汽车摩托|电子电器|胎压监测,英国SCHRADER协瑞德无线胎压监测系统TPMS专用金属气门帽(4只),汽车用品>电子电器>胎压监测>其它>英国SCHRADER协瑞德无线胎压监测系...,京东商城,1004001016,汽车摩托|电子电器|胎压监测,铁将军 智感300 胎压监测无线胎压检测 胎压计 胎压报警器 四轮循环显示胎压报警器,汽车用品>安全自驾>胎压充气>铁将军>铁将军 智感300 胎压监测无线胎压检测...,京东商城,铁将军恒煦专卖店1004001016,汽车摩托|电子电器|胎压监测,瑞世泰 胎压计 高精度汽车胎压测量计 车用胎压表 气压表 出行必备 高精度数显胎压计A,汽车用品>安全自驾>胎压充气> 瑞世泰>瑞世泰 胎压计 高精度汽车胎压测量计 车...,京东商城,贵瑞源汽车用品专营店1004001016,汽车摩托|电子电器|胎压监测,奥斯特工具 二氧化碳表 压力表 气压表 压力计 36V/加热,家装建材>五金工具>手动工具>奥斯特>奥斯特工具 二氧化碳表 压力表 气压表...,京东商城,奥斯特工具1004001016,汽车摩托|电子电器|胎压监测,YREDOG TD1500A-X 无线胎压监测系统TPMS（外置式）,汽车用品>安全自驾>胎压充气> tyredog>YREDOG TD1500A-X 无线胎...,京东商城,虎翼汽车用品专营店1004001016,汽车摩托|电子电器|胎压监测,尤利特 数显胎压表数显胎压表 YLT-6029,汽车用品>安全自驾>胎压充气>尤利特（UNIT）>尤利特 数显胎压表数显胎压表 YLT-6...,京东商城,北京梦启程汽车用品专营店1004001016,汽车摩托|电子电器|胎压监测,铁将军 智感800 胎压监测无线胎压检测 胎压计 胎压报警器,汽车用品>安全自驾>胎压充气>铁将军>铁将军 智感800 胎压监测无线胎压检测...,京东商城,铁将军恒煦专卖店1004001016,汽车摩托|电子电器|胎压监测,铁将军智感700胎压监测 无线外置传感器 DIY自主安装 防爆胎 减磨损 省燃油 防漏气 银色,汽车用品>安全自驾>胎压充气>铁将军>铁将军智感700胎压监测 无线外置传感器...,京东商城,铁将军旗舰店