1004004011,汽车摩托|汽车美容|车掸,普润 雪尼尔除尘掸子可伸缩汽车长柄除尘扫鸡毛掸子家用清洁掸 双面可弯曲超细纤维细毛雪尼尔 粉色 一只装  H1201,家居日用 > 清洁护理 > 清洁工具 > 商品详情,当当网,普润1004004011,汽车摩托|汽车美容|车掸,湖国洗车除尘刷 汽车蜡拖 车掸子 蜡刷套装 车用汽车拖把汽车清洁（颜色随机发）,汽车用品 > 汽车保养 > 洗车工具 > 尘掸,亚马逊(卓越网),LAKE COUNTRY/湖国1004004011,汽车摩托|汽车美容|车掸,红兔子 二只装 家居除尘刷 超细纤维伸缩尘掸 除尘清扫尘掸 加密长毛雪尼尔除尘掸 挂式不锈钢清洁刷 亮绿色 J2303,首页>家居/家装建材/厨具>清洁用品>清洁工具>红兔子二只装家居除尘刷超细纤维...,苏宁,红兔子1004004011,汽车摩托|汽车美容|车掸,普润 五只装雪尼尔 超细纤维伸缩尘掸 除尘清扫尘掸 加密长毛 车用 鸡毛掸子清洁掸 可伸缩 亮绿色,家居家装>清洁用品>清洁工具> 普润（PU RUN）>普润 五只装雪尼尔 超细纤维伸缩尘掸 除...,京东商城,天瑞家居专营店1004004011,汽车摩托|汽车美容|车掸,尚品车酷 汽车清洁美容拖把 车用蜡拖 车载擦车蜡刷掸子,汽车用品>美容清洗>洗车配件> 尚品车酷>尚品车酷 汽车清洁美容拖把 车用蜡拖 车...,京东商城,尚品先锋汽车用品专营店1004004011,汽车摩托|汽车美容|车掸,佳百丽 汽车蜡拖 汽车刷 擦车拖把 汽车掸子洗车刷子车用清洁用品,首页 >美容清洁 >其他清洗工具 >Gabree/佳百丽 >全效清洁-伸缩蜡,易迅网,其他1004004011,汽车摩托|汽车美容|车掸,卡饰社 纳米纤维可伸缩360度掸子扫 蓝灰色,首页 > 港威汽车用品专场 > 卡饰社 纳米纤维可伸缩360度掸子扫 蓝灰色,唯品会,无1004004011,汽车摩托|汽车美容|车掸,普润 雪尼尔尘掸 超细纤维可弯曲擦车掸子 新款鸡毛掸子 双面 橙色静电可弯曲超细纤维雪尼尔清洁掸 除尘擦车鸡毛掸子可拆洗       N2109-4,家居日用 > 清洁护理 > 清洁工具 > 普润 雪尼尔尘掸 超细纤维可弯曲擦车掸子 新款鸡毛掸子 双面 橙...,当当网,普润1004004011,汽车摩托|汽车美容|车掸,普润 雪尼尔 超细纤维伸缩尘掸 除尘清扫尘掸 加密长毛 亮绿色J2303,家居日用 > 清洁护理 > 清洁工具 > 普润 雪尼尔 超细纤维伸缩尘掸 除尘清扫尘掸 加密长毛 亮绿色J23...,当当网,普润1004004011,汽车摩托|汽车美容|车掸,卡饰社 超细纤维 可伸缩 360度 掸子扫 蓝色,首页 > 港威汽车用品专场 > 卡饰社 超细纤维 可伸缩 360度 掸子扫 蓝色,唯品会,无1004004011,汽车摩托|汽车美容|车掸,曼科家居 鸡毛掸子 正品贡掸 除尘家用车掸子 规格多 包邮,家居日用 > 清洁护理 > 清洁工具 > 曼科家居 鸡毛掸子 正品贡掸 除尘家用车掸子 规格多 包邮,当当网,大浩昌CDHC1004004011,汽车摩托|汽车美容|车掸,车之吻 彩盒装环保塑胶软面360度旋转蜡掸 折叠掸子 （赠掸子蜡/擦车巾）,首页 >美容清洁 >其他清洗工具 >车之吻 >彩盒装环保塑胶软面360度旋转蜡掸,易迅网,1004004011,汽车摩托|汽车美容|车掸,Great Life 超细纤维子母蜡拖 GLT-042,首页 >美容清洁 >其他清洗工具 >Great Life >GLT-042,易迅网,1004004011,汽车摩托|汽车美容|车掸,港威 卡饰社 超细纤维 可伸缩 360度 掸子扫 蓝色,首页 > 港威汽车用品专场 > 卡饰社 超细纤维 可伸缩 360度 掸子扫 蓝色,唯品会,无1004004011,汽车摩托|汽车美容|车掸,港威 卡饰社 超细纤维子母掸子扫 灰色,首页 > 港威汽车用品专场 > 卡饰社 超细纤维子母掸子扫 灰色,唯品会,无