1004004011,汽车摩托|汽车美容|车掸,汽车用品 车掸 蜡拖 TYPE-R蜡刷TYPER蜡拖 可拆卸式纳米彩棉蜡刷,汽车用品 > 汽车美容 > 蜡扫/掸子,当当网,汽车用品 车掸 蜡拖1004004011,汽车摩托|汽车美容|车掸,宝家洁百变除尘掸雪尼尔汽车除尘掸,家居家装>清洁用品>清洁工具>宝家洁（BAOJIAJIE）>宝家洁百变除尘掸雪尼尔汽车除尘掸,京东商城,宝家洁旗舰店1004004011,汽车摩托|汽车美容|车掸,卡饰社 超细纤维可伸缩掸子扫 紫色,汽车用品 > 汽车美容 > 蜡扫/掸子 > 商品详情,当当网,卡饰社1004004011,汽车摩托|汽车美容|车掸,车德克（CEDEKE） 扁形可伸缩超细纳米纤维蜡刷除尘掸子 白色,汽车用品>汽车美容>车掸>车德克（CEDEKE）>车德克除尘掸子,京东商城,车德克（CEDEKE）1004004011,汽车摩托|汽车美容|车掸,龟博士龟牌汽车掸子蜡G-128 三合一手喷液体掸子蜡汽车蜡 掸子油,当当网 > 汽车用品 > 养护用品 > 车蜡,当当网,龟牌1004004011,汽车摩托|汽车美容|车掸,多用除尘掸子/车用掸子 铝合金把柄 汽车用品/清洁掸子 蜡刷多功能掸子不掉毛噢,当当网 > 汽车用品 > 养护用品 > 蜡扫/掸子/海绵,当当网,乐车派1004004011,汽车摩托|汽车美容|车掸,洁诺360度旋转 纯棉蜡掸 汽车掸子 擦车掸子 棕线洁诺掸子,当当网 > 汽车用品 > 养护用品 > 蜡扫/掸子/海绵,当当网,1004004011,汽车摩托|汽车美容|车掸,韩国泡泡酷 麦特至尊系列 盒掸子 蜡刷 蜡掸子(圆形、方形),汽车用品 > 汽车美容 > 蜡扫/掸子 > 商品详情,当当网,泡泡酷1004004011,汽车摩托|汽车美容|车掸,卡饰社 超细纤维可伸缩掸子扫 灰色,汽车用品 > 汽车美容 > 洗车配件 > 商品详情,当当网,卡饰社1004004011,汽车摩托|汽车美容|车掸,Carsetcity卡饰社 超细纤维 可伸缩 360度 掸子扫 白色 CS-28010 (北京地区已开通线下安装及保养服务！仅限亚马逊自营商品，详见商品描述),汽车用品 > 汽车保养 > 洗车工具 > 尘掸,亚马逊(卓越网),Carsetcity 卡饰社1004004011,汽车摩托|汽车美容|车掸,麦特纯棉蜡刷(伸缩柄),首页 > 汽车用品 > 掸子/擦车巾 > 麦特,国美电器网上商城,1004004011,汽车摩托|汽车美容|车掸,洁诺 超细纤维蜡掸子 车用蜡拖 汽车蜡扫(白线王),当当网 > 汽车用品 > 养护用品 > 蜡扫/掸子/海绵,当当网,洁诺1004004011,汽车摩托|汽车美容|车掸,汽车拖把 冰星 汽车除尘掸子 车用蜡刷/蜡拖/蜡扫/汽车掸子 A-1,当当网 > 汽车用品 > 养护用品 > 蜡扫/掸子/海绵,当当网,静电宝宝1004004011,汽车摩托|汽车美容|车掸,唯美 可伸缩 手柄雪绒蜡刷/超细纤维蜡刷/蜡拖/蜡扫/除尘扫,汽车用品 > 汽车美容 > 蜡扫/掸子 > 商品详情,当当网,无1004004011,汽车摩托|汽车美容|车掸,冰星正品 汽车用品 蜡托 拖把 蜡拖 车掸子多种用途 E-07 热卖,当当网 > 汽车用品 > 养护用品 > 蜡扫/掸子/海绵,当当网,冰星1004004011,汽车摩托|汽车美容|车掸,佳百丽 蜡拖 汽车刷 蜡刷尘刷 洗车拖把 掸子车掸除尘刷 除尘掸z,汽车用品 > 汽车美容 > 蜡扫/掸子 > 商品详情,当当网,佳百丽1004004011,汽车摩托|汽车美容|车掸,冰星 汽车掸子 正品 汽车拖把蜡拖除尘掸子清洁刷车用 A-6,汽车用品 > 汽车美容 > 蜡扫/掸子 > 商品详情,当当网,冰星1004004011,汽车摩托|汽车美容|车掸,正品 冰星 汽车车掸子擦车蜡拖除尘掸 雪绒蜡刷 A360清洁用品汽车护理,当当网 > 汽车用品 > 养护用品 > 蜡扫/掸子/海绵,当当网,冰星1004004011,汽车摩托|汽车美容|车掸,洁诺 黑旋风棕色棉线汽车蜡掸子 旋转蜡拖 车用蜡刷,当当网 > 汽车用品 > 养护用品 > 蜡扫/掸子/海绵 ,当当网,洁诺1004004011,汽车摩托|汽车美容|车掸,盒装可旋转蜡刷 车掸子 子母掸洗车刷 除尘蜡拖不伤漆 送掸子蜡,汽车用品 > 汽车保养 > 洗车工具 > 尘掸,亚马逊(卓越网),北京格林奇商贸有限公司1004004011,汽车摩托|汽车美容|车掸,泰澄 汽车擦车刷子 可伸缩除尘蜡拖 车掸 车用蜡刷 汽车掸子车刷 腊刷洗车工具,泰澄>泰澄 汽车擦车刷子 可伸缩除尘蜡拖 车掸...,京东商城,泰澄车品专营店1004004011,汽车摩托|汽车美容|车掸,车用纳米伸缩汽车蜡拖 正品除尘洗车掸子擦车拖把蜡掸 灰色,汽车用品 > 汽车保养 > 洗车工具 > 尘掸,亚马逊(卓越网),北京易诚博信有限公司1004004011,汽车摩托|汽车美容|车掸,车德克(CEDEKE) 扁形可伸缩超细纳米纤维蜡刷除尘掸子 白色,汽车、保养、装饰 > 美容清洁 > 清洁工具,易迅网,提供OEM 、ODM服务。“全方位成本优势”使人们1004004011,汽车摩托|汽车美容|车掸,Koocar雪尼尔珊瑚虫汽车蜡拖清洁除尘掸子可弯曲折叠家用车用蜡掸 四色,汽车用品>汽车美容>车掸>其它>Koocar雪尼尔珊瑚虫汽车蜡拖清洁除尘...,京东商城,邦诺车品专营店1004004011,汽车摩托|汽车美容|车掸,卡饰社 超细纤维 可伸缩 掸子扫 蓝色 CS-28011-4,汽车用品 > 掸子/擦车巾 > 卡饰社,国美电器网上商城,1004004011,汽车摩托|汽车美容|车掸,ALLRIDE 欧莱卡 伸缩蜡刷 车用纳米纤维蜡拖 洗车掸子 除尘刷 擦车拖把,汽车用品 > 汽车保养 > 车漆保养 > 洗车蜡,亚马逊(卓越网),ALLRIDE 欧莱卡1004004011,汽车摩托|汽车美容|车掸,宝家洁 雪尼尔除尘掸尘掸子 可弯曲除尘掸,所有分类>厨卫清洁、纸、清洁剂>清洁用具>除尘工具>除尘掸/掸头>宝家洁>宝家洁 雪尼尔除尘掸...,1号店,宝家洁1004004011,汽车摩托|汽车美容|车掸,卡客超细纤维 汽车 蜡刷 蜡拖 除尘刷 车刷 车掸子,汽车用品>掸子>卡客>卡客超细纤维 汽车 蜡刷 蜡拖 除尘刷 车刷 车掸子,国美电器网上商城,天台爱卡专营店1004004011,汽车摩托|汽车美容|车掸,美每车 酷亮正品 汽车蜡拖 蜡刷 子母掸子 送掸子蜡 夏季热卖,汽车用品 > 汽车保养 > 洗车工具 > 尘掸,亚马逊(卓越网),酷亮1004004011,汽车摩托|汽车美容|车掸,SURKR超细纤维雪尼尔 清洁除尘掸 洗车掸子 免伤车漆 家用扫灰 粉色,家居家装>生活日用>浴室用品>SURKR >SURKR超细纤维雪尼尔 清洁除尘掸 ...,京东商城,天使爱韩国生活馆1004004011,汽车摩托|汽车美容|车掸,冰星 汽车伸缩式超细纤维除尘蜡拖掸子 E系列 E01,冰星>冰星 汽车伸缩式超细纤维除尘蜡拖掸子 E...,京东商城,环球汽车用品专营店1004004011,汽车摩托|汽车美容|车掸,冰星 汽车伸缩式超细纤维除尘蜡拖掸子 E系列 E11,冰星>冰星 汽车伸缩式超细纤维除尘蜡拖掸子 E...,京东商城,环球汽车用品专营店1004004011,汽车摩托|汽车美容|车掸,悦卡 超细纤维可伸缩手柄汽车掸子 车用除尘蜡拖（方形款）,汽车用品>汽车美容>车掸>悦卡>悦卡掸子,京东商城,悦卡1004004011,汽车摩托|汽车美容|车掸,车之吻 福字系列桃形塑胶软面除尘蜡掸 灰色棉纱线/黑色手柄,汽车用品>汽车美容>车掸>车之吻>车之吻福字系列桃形塑胶软面除尘蜡掸,京东商城,车之吻1004004011,汽车摩托|汽车美容|车掸,日光生活 除尘掸子桌面刷 可拆卸 家用 车用 超简约主义实用派 Q551-绿色,家居家装>清洁用品>居室清洁>日光生活>日光生活 除尘掸子桌面刷 可拆卸 家用 ...,京东商城,日光生活1004004011,汽车摩托|汽车美容|车掸,【免运费】勤晨 汽车蜡拖 车蜡掸超细纤维纳米车掸子 蜡刷车掸擦车拖把车刷 洗车工具汽车用 女款替换装一个,汽车用品>汽车美容>车掸>勤晨>【免运费】勤晨 汽车蜡拖 车蜡掸超细纤维...,京东商城,勤晨专营店1004004011,汽车摩托|汽车美容|车掸,【热卖年货】车玛仕（CHEMAS）汽车掸子套装 360度旋转高级蜡拖 掸子蜡 紫色,车玛仕（CHEMAS） >【热卖年货】车玛仕（CHEMAS）汽车掸...,京东商城,車玛仕CMS汽车用品店1004004011,汽车摩托|汽车美容|车掸,魔洗MOXI擦车洗车除尘掸子蜡扫,魔洗（MOXI）>魔洗MOXI擦车洗车除尘掸子蜡扫,京东商城,惠购在线1004004011,汽车摩托|汽车美容|车掸,魔洗MOXI擦车洗车除尘掸子蜡扫 蓝色,魔洗（MOXI）>魔洗MOXI擦车洗车除尘掸子蜡扫 蓝色,京东商城,惠购在线1004004011,汽车摩托|汽车美容|车掸,虎贝尔 汽车车掸 超纳米纤维伸缩型汽车蜡拖 蜡刷 除尘掸 擦车 H801,虎贝尔 汽车车掸 超纳米纤维伸缩型汽车蜡...,京东商城,虎贝尔旗舰店1004004011,汽车摩托|汽车美容|车掸,圣地亚格 车用纳米纤维洗车除尘掸子蜡拖汽车清洗工具 擦车拖把除尘刷 深灰色,圣地亚格 车用纳米纤维洗车除尘掸子蜡拖汽...,京东商城,圣地亚格汽车用品专营店1004004011,汽车摩托|汽车美容|车掸,冰星 蜡拖多种用途车掸子汽车清洁工具 纳米材质 E-07,冰星>冰星 蜡拖多种用途车掸子汽车清洁工具 纳...,京东商城,翊惠车品专营店1004004011,汽车摩托|汽车美容|车掸,天盾 汽车刷蜡拖 伸缩蜡刷 洗车刷擦车拖把洗车拖把 圆柱式掸子汽车清洁用品 圆柱式白色,其它>天盾 汽车刷蜡拖 伸缩蜡刷 洗车刷擦车拖...,京东商城,佳合车品专营店1004004011,汽车摩托|汽车美容|车掸,夏恩 车掸蜡拖 洗车拖把 擦车拖把 汽车掸子 除尘掸 车用 汽车刷 不锈钢伸缩蜡刷,汽车用品>汽车美容>车掸>其它>夏恩 车掸蜡拖 洗车拖把 擦车拖把 汽车...,京东商城,Shineon夏恩旗舰店1004004011,汽车摩托|汽车美容|车掸,Car Set City 卡饰社 超细纤维子母掸子扫 灰色,首页 > 汽车用品 > 汽车清洁 > CARSETCITY 卡饰社 > 产品编号: A0G-0M8-15C,新蛋商城,CARSETCITY 卡饰社1004004011,汽车摩托|汽车美容|车掸,雪尼尔除尘掸子可伸缩 家用车用鸡毛掸子尘刷清洁掸 大号,家居家装>生活日用>洗晒用品>百露>雪尼尔除尘掸子可伸缩 家用车用鸡毛掸子尘...,京东商城,百露旗舰店1004004011,汽车摩托|汽车美容|车掸,奥瑞驰 圆筒可伸缩蜡拖 防静电除尘掸 金属手柄车掸防划伤纳米棉洗车刷子 圆筒白色,其它>奥瑞驰 圆筒可伸缩蜡拖 防静电除尘掸 金...,京东商城,牧耐汽车用品专营店1004004011,汽车摩托|汽车美容|车掸,披甲熊 蜡拖 超细纤维伸缩 除尘掸 擦车 掸子 汽车用品,所有分类>大小家电、厨电、汽车>汽车生活>美容清洗>清洁工具>披甲熊>披甲熊 蜡拖 超细纤...,1号店,披甲熊1004004011,汽车摩托|汽车美容|车掸,耐实达 伸缩汽车蜡把 汽车掸子 除尘掸 车用擦车蜡拖把 蜡刷 花色扁蜡拖,汽车用品>美容清洗>洗车配件>其它>耐实达 伸缩汽车蜡把 汽车掸子 除尘掸 ...,京东商城,耐实达京东专卖店1004004011,汽车摩托|汽车美容|车掸,scx 可伸缩超细纤维蜡拖 车用除尘掸 擦车拖把 汽车清洁用品 扁形,汽车用品 > 汽车保养 > 洗车工具 > 尘掸,亚马逊(卓越网),SCX1004004011,汽车摩托|汽车美容|车掸,茶花 除尘掸 汽车清洁掸子 家用卫生清理掸子 4805 qc,所有分类>厨卫清洁、纸、清洁剂>清洁用具>除尘工具>除尘掸/掸头>茶花>茶花 除尘掸 汽车清...,1号店,茶花1004004011,汽车摩托|汽车美容|车掸,驰航 汽车刷蜡 洗车刷除尘车掸 可伸缩 掸子汽车清洁用品 (子母刷),汽车用品 > 汽车保养 > 洗车工具 > 尘掸 ,亚马逊(卓越网),1004004011,汽车摩托|汽车美容|车掸,车仕盾掸子除尘车掸蜡刷蜡拖,其它>车仕盾掸子除尘车掸蜡刷蜡拖,京东商城,车仕盾专营店1004004011,汽车摩托|汽车美容|车掸,楼龙 扁形纳米棉 伸缩式蜡拖 家用车用用除尘拖 拖把车 掸子QC-30 随机色,家居家装>清洁用品>清洁工具>楼龙(Loulong)>楼龙 扁形纳米棉 伸缩式蜡拖 家用车用用...,京东商城,楼龙旗舰店1004004011,汽车摩托|汽车美容|车掸,康多多CONDOR超细纤维刷静电吸附家用鸡毛掸子/汽车除尘刷 除尘掸,,亚马逊(卓越网),康多多1004004011,汽车摩托|汽车美容|车掸,石家垫 特价 纳米纤维洗车掸子蜡拖 汽车清洗工具 擦车拖把除尘刷,汽车用品 > 汽车美容 > 蜡扫/掸子 > 商品详情,当当网,石家垫1004004011,汽车摩托|汽车美容|车掸,车仆（CHIEF）圆形伸缩蜡扫（灰色）/掸子扫，携带方便快捷干湿两用,汽车用品>掸子>车仆>车仆（CHIEF）圆形伸缩蜡扫（灰色）/掸子扫，携带方便快捷干湿两用,国美电器网上商城,车仆1004004011,汽车摩托|汽车美容|车掸,威圣 伸缩汽车蜡拖 蜡刷蜡托 掸子 车用擦车拖把 洗车用品,所有分类>大小家电、厨电、汽车>汽车生活>美容清洗>清洁工具>威圣>威圣 伸缩汽车蜡拖 ...,1号店,威圣1004004011,汽车摩托|汽车美容|车掸,观祺Quicky 迷你型小蜡拖 汽车清洁 汽车用蜡刷 掸子 拖把 汽车用品,所有分类>大小家电、厨电、汽车>汽车生活>美容清洗>清洁工具>观祺Quicky>观祺Quicky 迷...,1号店,观祺Quicky1004004011,汽车摩托|汽车美容|车掸,豫香 YUXIANG 汽车刷 蜡拖 擦车拖把 车用清洁除尘掸子 洗车刷 汽车用品,所有分类>大小家电、厨电、汽车>汽车生活>美容清洗>清洁工具>豫香 YUXIANG>豫香 YUXIANG...,1号店,豫香 YUXIANG1004004011,汽车摩托|汽车美容|车掸,车盟海饰 CMHS 汽车掸子除尘蜡拖车用伸缩 洗车刷 擦车拖把车掸车刷子车拖把,所有分类>大小家电、厨电、汽车>汽车生活>美容清洗>清洁工具>车盟海饰 CMHS>车盟海饰 CMHS ...,1号店,车盟海饰 CMHS1004004011,汽车摩托|汽车美容|车掸,掌舵者 静电除尘掸子 家用车用清洁掸子 超细纤维灰尘掸子,所有分类>大小家电、厨电、汽车>汽车生活>美容清洗>清洁工具>掌舵者>掌舵者 静电除尘掸子...,1号店,掌舵者1004004011,汽车摩托|汽车美容|车掸,继红 雪尼尔超细纤维 除尘掸+擦车手套+三角除尘刷+拖把+鞋套 清洁套餐5件套,所有分类>大小家电、厨电、汽车>汽车生活>美容清洗>清洁工具>继红>继红 雪尼尔超细纤维...,1号店,继红1004004011,汽车摩托|汽车美容|车掸,魅驹 汽车掸子 正品 汽车拖把蜡拖除尘掸子清洁刷车用拖把刷车掸,汽车用品>掸子>魅驹>魅驹 汽车掸子 正品 汽车拖把蜡拖除尘掸子清洁刷车用拖把刷车掸,国美电器网上商城,魅驹1004004011,汽车摩托|汽车美容|车掸,冰星 超柔雪绒汽车蜡刷 E09除尘刷 除尘掸 灰尘掸 汽车蜡拖车掸,汽车用品>掸子>冰星>冰星 超柔雪绒汽车蜡刷 E09除尘刷 除尘掸 灰尘掸 汽车蜡拖车掸,国美电器网上商城,冰星1004004011,汽车摩托|汽车美容|车掸,E路驰 360°高级除尘掸-白线B-04,所有分类>大小家电、厨电、汽车>汽车生活>美容清洗>清洁工具>E路驰>E路驰 360°高级...,1号店,E路驰1004004011,汽车摩托|汽车美容|车掸,佳百丽 360全效清洁用品 汽车蜡拖 除尘擦车拖把车掸子车刷子蜡刷 B-1,首页>汽车用品>清洁美容>美容清洁工具>佳百丽360全效清洁用品汽车蜡拖...,苏宁,佳百丽1004004011,汽车摩托|汽车美容|车掸,Alilon 汽车伸缩加长蜡掸子,阿里郎（ALILON）>Alilon 汽车伸缩加长蜡掸子,京东商城,怡趣车饰界1004004011,汽车摩托|汽车美容|车掸,掌舵者 静电除尘掸子 家用车用清洁掸子 超细纤维灰尘掸子,所有分类>大小家电、厨电、汽车>汽车生活>美容清洗>清洁工具>掌舵者>掌舵者 静电除尘掸子...,1号店,掌舵者1004004011,汽车摩托|汽车美容|车掸,泰澄 正品 汽车蜡拖 车刷 汽车 掸子 蜡拖车用 汽车拖把除尘车掸(海蓝),汽车用品>洗车/美容工具>泰澄>泰澄 正品 汽车蜡拖 车刷 汽车 掸子 蜡拖车用 汽车拖把除尘车掸(海蓝),国美电器网上商城,泰澄车品旗舰店1004004011,汽车摩托|汽车美容|车掸,BOLD 豪迈 豪迈伸缩型车掸 蜡拖 除尘掸 洗车工具 擦车拖把 汽车掸子 蜡刷 扁紫刷 送小手刷,,亚马逊(卓越网),BOLD 豪迈1004004011,汽车摩托|汽车美容|车掸,玫瑰彩盒装环保塑胶软面360度旋转蜡掸(赠送掸子蜡/擦车巾)(高效除尘、不掉毛絮、超柔棉纱线、掸线含清洁上光保护蜡剂、去污、清洁、上光一次完成),汽车用品 > 汽车保养 > 洗车工具 > 尘掸,亚马逊(卓越网),铭心1004004011,汽车摩托|汽车美容|车掸,开能 汽车除尘蜡刷 清洁掸子 车用拖把 洗车蜡刷 清洁用品 扁把,首页>汽车用品>清洁美容>美容清洁工具>开能汽车除尘蜡刷清洁掸子车用拖...,苏宁,开能1004004011,汽车摩托|汽车美容|车掸,Carsetcity 卡饰社 超细纤维 可伸缩 360度 掸子扫 CS-28010-3 紫色,所有分类>大小家电、厨电、汽车>汽车生活>美容清洗>清洁工具>Carsetcity/卡饰社>Carsetcity...,1号店,Carsetcity/卡饰社1004004011,汽车摩托|汽车美容|车掸,冰星 超柔雪绒汽车蜡刷 汽车除尘刷 除尘掸 灰尘掸 汽车蜡拖车掸,汽车用品 > 汽车美容 > 洗车机 > 商品详情,当当网,冰星1004004011,汽车摩托|汽车美容|车掸,石家垫 纳米伸缩式汽车车掸/蜡拖/拖把/蜡刷/除尘掸,汽车用品 > 汽车美容 > 蜡扫/掸子 > 商品详情,当当网,石家垫1004004011,汽车摩托|汽车美容|车掸,研美车配 雪尼尔 除尘掸 MLJ-7097 多色,所有分类>大小家电、厨电、汽车>汽车生活>美容清洗>清洁工具>研美车配>研美车配 雪尼尔 除...,1号店,研美车配1004004011,汽车摩托|汽车美容|车掸,highcook新品除尘掸超细纤维静电除尘掸汽车用除尘家用鸡毛掸子,家居家装>清洁用品>清洁工具>韩库（Highcook）>highcook新品除尘掸超细纤维静电除...,京东商城,韩库家居生活馆1004004011,汽车摩托|汽车美容|车掸,淘乐士 加长伸缩雪尼尔车掸扫尘刷家用车用多用除尘掸子清洁高处用2个装,,亚马逊(卓越网),淘乐士1004004011,汽车摩托|汽车美容|车掸,CARARTS車雅風 360度自由旋转蜡刷 汽车刷子 清洁蜡拖把 擦车拖把 车用清洁除尘掸子 转向刷,汽车用品 > 汽车保养 > 洗车工具 > 尘掸,亚马逊(卓越网),CARARTS 車雅風1004004011,汽车摩托|汽车美容|车掸,Koocar雪尼尔珊瑚虫汽车蜡拖清洁除尘掸子可弯曲折叠家用车用蜡掸 橙色,汽车用品>掸子>KOOCAR>Koocar雪尼尔珊瑚虫汽车蜡拖清洁除尘掸子可弯曲折叠家用车用蜡掸 橙色,国美电器网上商城,邦诺车品专营店1004004011,汽车摩托|汽车美容|车掸,卡饰社 超细纤维 可伸缩 掸子扫 灰色 CS-28011-2,汽车用品>掸子>卡饰社>卡饰社 超细纤维 可伸缩 掸子扫 灰色 CS-28011-2,国美电器网上商城,东莞港威车品专营店1004004011,汽车摩托|汽车美容|车掸,GREAT LIFE 新车必备伸缩铝杆擦车拖把汽车蜡拖车掸子除尘掸车刷蜡刷清洁用品 雪尼尔拖把(绿色杆子）,汽车用品 > 汽车保养 > 洗车工具 > 尘掸,亚马逊(卓越网),GREAT LIFE1004004011,汽车摩托|汽车美容|车掸,两只装雪尼尔除尘掸子可伸缩汽车长柄除尘扫鸡毛掸子家用清洁掸 实用性家用车用双面可弯曲超细纤维细毛 绿色 二只装,家居日用 > 清洁护理 > 清洁工具 > 商品详情,当当网,普润1004004011,汽车摩托|汽车美容|车掸,普润 雪尼尔拖把头 好神拖旋转平板拖布头替换 家具除尘/洗车 好神托拖布头 墩布头 通用 2只装,家居家装>清洁用品>清洁工具>普润（PU RUN）>普润 雪尼尔拖把头 好神拖旋转平板拖布头...,京东商城,米悦家居专营店1004004011,汽车摩托|汽车美容|车掸,普润 雪尼尔除尘掸子可伸缩汽车长柄除尘扫鸡毛掸子家用清洁掸 双面可弯曲超细纤维细毛雪尼尔 黄色 一只装,家居家装>清洁用品>清洁工具>普润（PU RUN）>普润 雪尼尔除尘掸子可伸缩汽车长柄除尘扫...,京东商城,维双家居专营店1004004011,汽车摩托|汽车美容|车掸,【货到付款】安美弛 雪尼尔汽车除尘掸 车用除尘蜡托AM-2252 咖啡色,汽车用品>汽车美容>车掸>安美弛>【货到付款】安美弛 雪尼尔汽车除尘掸 车...,京东商城,安美弛车品汇1004004011,汽车摩托|汽车美容|车掸,港威 纳米纤维可伸缩360度掸子扫蓝灰色,首页 > 港威汽车用品专场 > 纳米纤维可伸缩360度掸子扫蓝灰色,唯品会,无1004004011,汽车摩托|汽车美容|车掸,普润 两只装雪尼尔除尘掸子可伸缩汽车长柄除尘扫鸡毛掸子家用清洁掸 双面可弯曲超细纤维细毛 二只装 绿色,家居日用 > 清洁护理 > 清洁工具 > 商品详情,当当网,普润1004004011,汽车摩托|汽车美容|车掸,豫香 汽车刷 蜡拖 擦车拖把 车用清洁除尘掸子 洗车刷 汽车用品,首页 >美容清洁 >其他清洗工具 >豫香 >蜡拖,易迅网,其他1004004011,汽车摩托|汽车美容|车掸,COX汽车掸子 车用清洁用品 除尘掸洗车刷蜡拖蜡刷 汽车擦车拖把,汽车用品>洗车/美容工具>酷克斯>COX汽车掸子 车用清洁用品 除尘掸洗车刷蜡拖蜡刷 汽车擦车拖把,国美电器网上商城,酷克斯1004004011,汽车摩托|汽车美容|车掸,路趣 汽车伸缩扁蜡刷 车用蜡拖 洗车掸子 除尘刷擦车拖把清洁用品 车用除尘 蓝色 单个清理内室小掸子(小号),汽车用品>美容清洗>洗车配件>路趣>路趣 汽车伸缩扁蜡刷 车用蜡拖 洗车掸子...,京东商城,路趣车品专营店1004004011,汽车摩托|汽车美容|车掸,OMN 欧曼尼 汽车刷蜡拖 大小刷伸缩式车刷 不掉毛干湿两用 蜡刷掸子 黑+灰,,亚马逊(卓越网),OMN 欧曼尼1004004011,汽车摩托|汽车美容|车掸,E路驰 360°高级除尘掸-灰线 B-03,所有分类>大小家电、厨电、汽车>汽车生活>美容清洗>清洁工具>E路驰>E路驰 360°高级...,1号店,E路驰1004004011,汽车摩托|汽车美容|车掸,龟丞相GUICHENGXIANG 蜡拖 车用掸子除尘掸擦洗车拖把汽车清洁用品掸子 洗车刷,所有分类>大小家电、厨电、汽车>汽车生活>美容清洗>清洁工具>龟丞相GUICHENGXIANG>龟丞相GUICHEN...,1号店,龟丞相GUICHENGXIANG1004004011,汽车摩托|汽车美容|车掸,红兔子  雪尼尔除尘掸子可伸缩汽车长柄除尘扫鸡毛掸子家用清洁掸 双面可弯曲超细纤维细毛雪尼 颜色随机 H1201,家居日用 > 清洁护理 > 清洁工具 > 商品详情,当当网,红兔子1004004011,汽车摩托|汽车美容|车掸,SAKES汽车刷蜡拖 伸缩蜡刷 家居除尘车掸刷 擦车拖把 办公室爱车清洁用 紫色 大蜡拖,汽车用品>美容清洗>洗车配件> 萨克斯（SAKES）>SAKES汽车刷蜡拖 伸缩蜡刷 家居除尘...,京东商城,萨克斯车品专营店1004004011,汽车摩托|汽车美容|车掸,普润PURUN 雪尼尔除尘掸子 鸡毛掸子家用清洁掸 双面可弯曲超细纤维细毛雪尼尔 绿色,所有分类>厨卫清洁、纸、清洁剂>清洁用具>除尘工具>除尘掸/掸头>普润PURUN>普润PURUN 雪尼...,1号店,普润PURUN1004004011,汽车摩托|汽车美容|车掸,普润 雪尼尔除尘掸子可伸缩汽车长柄除尘扫鸡毛掸子家用清洁掸 双面可弯曲超细纤维细毛雪尼尔 绿色 一只装  H1201,家居日用 > 清洁护理 > 清洁工具 > 商品详情,当当网,普润1004004011,汽车摩托|汽车美容|车掸,雪尼尔伸缩除尘掸,家居家装>清洁用品>清洁工具> 京东良品>雪尼尔伸缩除尘掸,京东商城,usn优尚专营店1004004011,汽车摩托|汽车美容|车掸,圣龙 车用纳米伸缩汽车蜡拖 除尘洗车掸子擦车拖把 汽车蜡刷 圆形蜡刷 灰色,汽车用品>美容清洗>洗车工具> 圣龙（St.dragon）>圣龙 车用纳米伸缩汽车蜡拖 除尘洗车掸子...,京东商城,铭诚汽车用品专营店1004004011,汽车摩托|汽车美容|车掸,Circle Cool 旋转式折叠蜡拖 汽车掸子 纯棉车用蜡拖 汽车除尘拖 擦车洗车 可伸缩 蜡刷,汽车用品>美容清洗>洗车配件> Circle Cool>Circle Cool 旋转式折叠蜡拖 ...,京东商城,瑞泰车品专营店1004004011,汽车摩托|汽车美容|车掸,卡琦拉 汽车刷擦车拖把 车用清洁除尘掸子 伸缩蜡拖 洗车用品 蓝色 扁型,汽车用品>美容清洗>洗车配件> 卡琦拉（CARKIRA）>卡琦拉 汽车刷擦车拖把 车用清洁除尘掸子...,京东商城,桓鼎车品专营店1004004011,汽车摩托|汽车美容|车掸,极限 子母掸子洗车工具 扫雪除雪除尘 擦车拖把车用子母掸汽车蜡刷,汽车用品>美容清洗>洗车配件> 极限（Limit）>极限 子母掸子洗车工具 扫雪除雪除尘 擦...,京东商城,蓝城汽车用品专营店1004004011,汽车摩托|汽车美容|车掸,普润 雪尼尔尘掸 超细纤维可弯曲擦车掸子 新款鸡毛掸子 双面 随机发货 一个装,家居家装>清洁用品>清洁工具> 普润（PU RUN）>普润 雪尼尔尘掸 超细纤维可弯曲擦车掸子...,京东商城,圣唐家居馆1004004011,汽车摩托|汽车美容|车掸,伊佰佳 车用纳米纤维洗车除尘掸子蜡拖汽车清洗工具擦车拖把除尘刷,所有分类>大小家电、厨电、汽车>汽车生活>美容清洗>清洁工具>伊佰佳>伊佰佳 车用纳米纤维...,1号店,伊佰佳