1007008008,厨具|厨房清洗用品|防油贴纸,彩家乐防油贴PET铝箔包邮厨房用墙贴耐高温易清洁防油烟贴纸 6卷装每卷45*90cm月季花,家居家装>家装软饰>墙贴/装饰贴> 彩家乐>彩家乐防油贴PET铝箔包邮厨房用墙贴耐高...,京东商城,彩家乐家居专营店1007008008,厨具|厨房清洗用品|防油贴纸,彩家乐防油贴PET铝箔包邮厨房用墙贴耐高温易清洁防油烟贴纸 6卷装每卷45*90cm童趣,家居家装>家装软饰>墙贴/装饰贴> 彩家乐>彩家乐防油贴PET铝箔包邮厨房用墙贴耐高...,京东商城,彩家乐家居专营店1007008008,厨具|厨房清洗用品|防油贴纸,吉睿JiRui 田园铝箔厨房专用耐高温易清洁防油烟贴纸60*90 海底世界KS-D100 三个装,吉睿>吉睿JiRui 田园铝箔厨房专用耐高温易...,京东商城,吉睿家居生活馆1007008008,厨具|厨房清洗用品|防油贴纸,吉睿JiRui 田园铝箔厨房专用耐高温易清洁防油烟贴纸45*75CM 蜻荷款KS-019 六个装,家居家装>家装软饰>墙贴/装饰贴> 吉睿>吉睿JiRui 田园铝箔厨房专用耐高温易...,京东商城,吉睿家居生活馆1007008008,厨具|厨房清洗用品|防油贴纸,大贸商 家用厨房防油贴纸 高档透明油污防水瓷砖墙贴纸,玩具 > 创意生活 > 厨卫用品 > 大贸商 家用厨房防油贴纸 高档透明油污防水瓷砖墙贴纸,当当网,大贸商1007008008,厨具|厨房清洗用品|防油贴纸,普润 四张装 厨房瓷砖贴防油贴纸 耐高温油烟贴铝珀墙贴纸 防水墙贴纸 铝珀灶台贴油烟贴墙贴 防油贴,首页>家居/家装建材/厨具>生活日用>装饰用品>普润四张装厨房瓷砖贴防油贴纸耐...,苏宁,普润1007008008,厨具|厨房清洗用品|防油贴纸,立标（Z-LABEL） 2.85×10.15cm 红框 手写不干胶自粘标签贴纸,电脑、办公>办公文仪>本册/便签> 立标（Z-LABEL）>立标（Z-LABEL） 2.85×10....,京东商城,立标办公专营店1007008008,厨具|厨房清洗用品|防油贴纸,立标(Z-LABEL) Φ1.9cm 彩色 圆形 手写不干胶自粘标签贴纸,电脑、办公>办公文仪>本册/便签> 立标（Z-LABEL）>立标(Z-LABEL) Φ1.9cm 彩...,京东商城,立标办公专营店1007008008,厨具|厨房清洗用品|防油贴纸,普润PURUN 厨房瓷砖贴防油贴纸 耐高温油烟贴铝珀墙贴纸 铝珀灶台贴油烟贴墙贴 一张装,所有分类>家居家纺、锅具餐具>装饰/日用>装饰贴>普润PURUN,1号店,装饰贴1007008008,厨具|厨房清洗用品|防油贴纸,普润大号亮丽韩国厨房防油污贴纸耐高温防油烟灶台瓷砖吸油墙贴非铝箔 颜色随机,家居日用 > 厨房用品 > 厨房杂件 > 厨房配件 > 普润大号亮丽韩国厨房防油污贴纸耐高温防油烟灶台瓷砖吸油墙贴非...,当当网,普润1007008008,厨具|厨房清洗用品|防油贴纸,斯图 (sitoo) 防油贴 ST1033《海豚之恋》3个装 厨房餐厅家居 耐高温防油污贴纸 瓷砖贴,家装建材>墙地面材料>壁纸>斯图 (sitoo) 防油贴 ST103...,京东商城,斯图壁纸1007008008,厨具|厨房清洗用品|防油贴纸,宜美贴（Yimt） 铝箔防油贴纸郁金香F016 厨房灶台专用隔油耐高温,家居家装>家装软饰>墙画墙贴>宜美贴（Yimt） 铝箔防油贴纸郁金香F...,京东商城,宜美贴旗舰店1007008008,厨具|厨房清洗用品|防油贴纸,宜美贴 厨房灶台专用铝箔防油贴纸海底世界F015 74*45CM,家居家装>家装软饰>墙贴/装饰贴>宜美贴（Yimt）>宜美贴 厨房灶台专用铝箔防油贴纸海底世界...,京东商城,宜美贴旗舰店1007008008,厨具|厨房清洗用品|防油贴纸,忆美特EMIT防油贴 厨房灶台隔油污专用 铝箔材料 FY009,忆美特EMIT防油贴 厨房灶台隔油污专用...,京东商城,忆美特时尚家饰1007008008,厨具|厨房清洗用品|防油贴纸,出口韩国 厨房墙贴 高档铝珀防油污贴纸 防油贴纸 装饰贴纸-虞美人（2个装）,厨具 > 烘焙用具 > 锡纸\\油纸,亚马逊(卓越网),爱琪1007008008,厨具|厨房清洗用品|防油贴纸,厨房用贴纸 铝箔耐高温 防油贴纸--浪漫时光,当当网 > 家居日用 > 厨房用品 > 一次性用品,当当网,多功能1007008008,厨具|厨房清洗用品|防油贴纸,一伍一拾 彩色刻心型封口夹14.7cm 5片装 0012664,所有分类 > 厨房用品、清洁用品 > 厨房工具 > 厨房夹子 > 一伍一拾,1号店,1007008008,厨具|厨房清洗用品|防油贴纸,EMIT忆美特厨房铝箔防油贴-家庭主妇好帮手,更换方便 FY006,所有分类 > 家居生活、运动保健 > 生活日用品 > 其他生活日用品 > EMIT,1号店,1007008008,厨具|厨房清洗用品|防油贴纸,EMIT忆美特厨房防油污贴纸-铝箔材料、防水隔油效果好 FY005,所有分类 > 家居生活、运动保健 > 生活日用品 > 其他生活日用品 > EMIT,1号店,1007008008,厨具|厨房清洗用品|防油贴纸,Unitek韩国进口卡通组合墙贴可移除瓷砖装饰贴纸 樱花21x10.5cm/4片装,优越者（UNITEK）>Unitek韩国进口卡通组合墙贴可移除瓷...,京东商城,璜谷家饰1007008008,厨具|厨房清洗用品|防油贴纸,欧唛(oumai) 防油贴 OM1033《海豚之恋》3个装 厨房餐厅家居 耐高温防油污贴纸,家居家装>家装软饰>墙画墙贴>欧唛(oumai) 防油贴 OM1033...,京东商城,欧唛旗舰店1007008008,厨具|厨房清洗用品|防油贴纸,斯图 (sitoo) 防油贴 ST1055《五谷杂粮》3个装 厨房餐厅家居 耐高温防油污贴纸 瓷砖贴,家装建材>墙地面材料>壁纸>斯图 (sitoo) 防油贴 ST105...,京东商城,斯图壁纸1007008008,厨具|厨房清洗用品|防油贴纸,斯图 (sitoo) 防油贴 ST1034《雨后玫瑰》3个装 厨房餐厅家居 耐高温防油污贴纸 瓷砖贴,家装建材>墙地面材料>壁纸>斯图 (sitoo) 防油贴 ST103...,京东商城,斯图壁纸1007008008,厨具|厨房清洗用品|防油贴纸,趣玩网 厨房高档铝珀防油贴纸-粉玫瑰,玩具 > 创意生活 > 居家生活 > 商品详情,当当网,酷品屋1007008008,厨具|厨房清洗用品|防油贴纸,宜美贴（Yimt） 厨房灶台专用铝箔防油贴纸紫色郁金香F034,家居家装>家装软饰>墙画墙贴>宜美贴（Yimt） 厨房灶台专用铝箔防油...,京东商城,宜美贴旗舰店1007008008,厨具|厨房清洗用品|防油贴纸,宜美贴 海底世界 卡通鱼 厨房防油贴纸 铝箔防水防脏耐高温,家装建材 > 时尚家饰 > 墙壁装饰 > 商品详情,当当网,宜美贴1007008008,厨具|厨房清洗用品|防油贴纸,美乐家饰Magicfix韩国进口浴室卫生间瓷砖墙贴纸50X200cm自粘壁纸马赛克P系列 P-081绿马赛克 P-081绿马赛克,Magic Fix>美乐家饰Magicfix韩国进口浴室卫生...,京东商城,美乐家饰1007008008,厨具|厨房清洗用品|防油贴纸,忆美特厨房灶台防油贴 铝箔材料 隔油耐高温45*75cm*2张，无残胶可移除 FY049-50,家用/类别/家居/家居装饰/墙贴、装饰贴/瓷砖贴玻璃贴,亚马逊(卓越网),忆美特EMIT1007008008,厨具|厨房清洗用品|防油贴纸,忆美特铝箔防油贴纸 厨房贴纸 耐高温 实惠组合套装 FY042-45,忆美特（EMIT）>忆美特铝箔防油贴纸 厨房贴纸 耐高温 实...,京东商城,忆美特时尚家饰1007008008,厨具|厨房清洗用品|防油贴纸,Z-LABEL 立标 永久性 彩色文件夹分类索引 不干胶自粘标签贴纸 ZWM3008 标签尺寸:8.25×1.45cm 80张/袋,Z-LABEL® Brand Permanent File Folder Labels, 4/7" x 3-1/4", Assorted Colors, Pack Of 80,办公用品 > 纸类 > 笔记本、便签、随意贴 > 随意贴,亚马逊(卓越网),Z-LABEL 立标1007008008,厨具|厨房清洗用品|防油贴纸,忆美特（EMIT）铝箔防油贴纸 厨房贴纸 耐高温 实惠组合套装 FY011X2,家居家装>家装软饰>墙画墙贴>忆美特（EMIT）铝箔防油贴纸 厨房贴纸...,京东商城,忆美特时尚家饰1007008008,厨具|厨房清洗用品|防油贴纸,彩家乐防油贴马赛克每卷45*90cm 铝箔PET 现代简约厨房专用墙贴耐高温易清洁防油贴纸 咖啡格子,家居家装>家装软饰>墙画墙贴>彩家乐>彩家乐防油贴马赛克每卷45*90cm 铝...,京东商城,彩家乐家居专营店1007008008,厨具|厨房清洗用品|防油贴纸,彩家乐防油贴月季花每卷45*90cm田园PET铝箔厨房装饰墙贴耐高温保护瓷砖防油烟贴纸,家居家装>家装软饰>墙画墙贴>彩家乐>彩家乐防油贴月季花每卷45*90cm田园...,京东商城,彩家乐家居专营店1007008008,厨具|厨房清洗用品|防油贴纸,斯图牌 3个装《玫瑰爱情》厨房 餐厅 高档厨房防油贴纸 墙贴 防油污贴纸 墙纸 铝箔 3pcs ST1050,家用/类别/家居/家居装饰/墙贴、装饰贴/防油贴,亚马逊(卓越网),斯图1007008008,厨具|厨房清洗用品|防油贴纸,彩家乐防油贴马赛克每卷45*90cm 铝箔PET 现代简约厨房专用墙贴耐高温易清洁防油贴纸 咖啡格子 2卷装,家居家装>家装软饰>墙画墙贴>彩家乐>彩家乐防油贴马赛克每卷45*90cm 铝...,京东商城,彩家乐家居专营店1007008008,厨具|厨房清洗用品|防油贴纸,彩家乐防油贴海洋世界每卷45*90cm田园铝箔PET厨房专用墙贴耐高温保护瓷砖防油烟贴纸 2卷装,家居家装>家装软饰>墙画墙贴>彩家乐>彩家乐防油贴海洋世界每卷45*90cm田...,京东商城,彩家乐家居专营店1007008008,厨具|厨房清洗用品|防油贴纸,Up-Hunceo 厨房防油贴纸 锡箔环保耐高温 防油贴 墙贴 3片装(小黑猫+蒲公英+花瓣),所有分类>家居家纺、锅具餐具>装饰/日用>装饰贴>Up-Hunceo,1号店,装饰贴1007008008,厨具|厨房清洗用品|防油贴纸,Up-Hunceo 特大号厨房防油贴纸 60*90 2片装,厨房用品、清洁用品>纸制品>厨房用纸,1号店,Up-Hunceo1007008008,厨具|厨房清洗用品|防油贴纸,手信 厨房防油贴纸/防油贴纸/防油贴 耐高温/ 透明/防油贴整卷,其他/商品/其他,亚马逊(卓越网),手信1007008008,厨具|厨房清洗用品|防油贴纸,彩家乐 大号铝箔防油贴 厨房专用墙纸墙贴 方便清洁 防油贴纸 海洋世界每卷45*90cm,所有分类>家居家纺、锅具餐具>装饰/日用>装饰贴>彩家乐>彩家乐 大号铝箔防油...,1号店,彩家乐1007008008,厨具|厨房清洗用品|防油贴纸,彩家乐 防油铝箔贴2卷装每卷45*90cm 厨房专用墙贴 耐高温保护瓷砖易清洁防油污贴纸 (月季花开),家用/类别/家居/家居装饰/墙贴、装饰贴/防油贴,亚马逊(卓越网),彩家乐1007008008,厨具|厨房清洗用品|防油贴纸,喜利多/Siligo 家居厨房防油铝箔贴纸 4张 猕猴桃,喜利多/Siligo 家居厨房防油铝箔贴...,京东商城,喜利多家居旗舰店1007008008,厨具|厨房清洗用品|防油贴纸,欧唛(oumai) 防油贴 厨房餐厅家居 耐高温防油污贴纸 (绿树成荫)1010,家居家装>家装软饰>墙画墙贴>欧唛(oumai) 防油贴 厨房餐厅家居...,京东商城,欧唛旗舰店1007008008,厨具|厨房清洗用品|防油贴纸,欧唛(oumai) 防油贴 厨房餐厅家居 耐高温防油污贴纸 (粉红郁金花)1051,家居家装>家装软饰>墙画墙贴>欧唛(oumai) 防油贴 厨房餐厅家居...,京东商城,欧唛旗舰店1007008008,厨具|厨房清洗用品|防油贴纸,喜利多siligo 防油贴 厨房餐厅家居 耐高温防油污贴纸 铝箔厨房防油贴纸大号 玫瑰花蕾,喜利多siligo 防油贴 厨房餐厅家居...,京东商城,喜利多家居旗舰店1007008008,厨具|厨房清洗用品|防油贴纸,喜利多/Siligo 厨房防油贴纸 墙贴 防油污贴纸 4张 粉花瓣,喜利多/Siligo 厨房防油贴纸 墙贴...,京东商城,喜利多家居旗舰店1007008008,厨具|厨房清洗用品|防油贴纸,厨房防油贴纸 铝箔瓷砖玻璃贴 耐高温橱柜装饰墙贴纸 5个售 锡箔玉兰花,快乐鱼>厨房防油贴纸 铝箔瓷砖玻璃贴 耐高温橱柜...,京东商城,吉满家居专营店1007008008,厨具|厨房清洗用品|防油贴纸,厨房防油贴纸 铝箔瓷砖玻璃贴 耐高温橱柜装饰墙贴纸 5个售 锡箔黄方块,快乐鱼>厨房防油贴纸 铝箔瓷砖玻璃贴 耐高温橱柜...,京东商城,吉满家居专营店1007008008,厨具|厨房清洗用品|防油贴纸,全悦家饰墙贴纸 可移除防油厨房贴纸 防水防油 多画面可选FY10331,全悦>全悦家饰墙贴纸 可移除防油厨房贴纸 防水...,京东商城,全悦旗舰店1007008008,厨具|厨房清洗用品|防油贴纸,彩家乐防油贴厨房专用铝箔防油贴方便清洁装饰贴纸四叶草,彩家乐防油贴厨房专用铝箔防油贴方便清洁装...,京东商城,彩家乐家居专营店1007008008,厨具|厨房清洗用品|防油贴纸,彩家乐防油贴厨房专用铝箔防油贴方便清洁装饰贴纸童趣,彩家乐防油贴厨房专用铝箔防油贴方便清洁装...,京东商城,彩家乐家居专营店1007008008,厨具|厨房清洗用品|防油贴纸,忆美特厨房铝箔防油贴 隔离灶台油污厨房清洁妙招 FY021 45cm*100cm 家居就旗舰店 45cm*100cm,家居家装>生活日用>家装软饰>忆美特厨房铝箔防油贴 隔离灶台油污厨房清...,京东商城,家居就家装城1007008008,厨具|厨房清洗用品|防油贴纸,【货到付款】up-hunceo 特大号厨房防油贴纸 特大号 2片装 60*90,up-hunceo>【货到付款】up-hunceo 特大号厨...,京东商城,安布安奇家居生活旗舰店1007008008,厨具|厨房清洗用品|防油贴纸,简单生活可移除铝箔耐热防油贴（2个装） 简单生活,首页> 家居生活> 生活日用> 厨房清洁> 防油> 简单生活可移除铝箔耐热防油贴（2个装）,凡客诚品,VANCL 凡客诚品1007008008,厨具|厨房清洗用品|防油贴纸,【货到付款】up-hunceo 特大号厨房防油贴纸 特大号 2片装 60*90 花朵,up-hunceo>【货到付款】up-hunceo 特大号厨...,京东商城,安布安奇家居生活旗舰店1007008008,厨具|厨房清洗用品|防油贴纸,谷典牌 厨房防油防水耐高温贴纸 透明铝箔 厨房贴 粉红郁金花GD1051,家居家装>家装软饰>墙画墙贴>谷典>谷典牌 厨房防油防水耐高温贴纸 透明铝箔...,京东商城,谷典旗舰店1007008008,厨具|厨房清洗用品|防油贴纸,谷典牌 厨房防油防水耐高温贴纸 透明铝箔 厨房贴 果实累累GD1009,家居家装>家装软饰>墙画墙贴>谷典>谷典牌 厨房防油防水耐高温贴纸 透明铝箔...,京东商城,谷典旗舰店1007008008,厨具|厨房清洗用品|防油贴纸,日本inomata厨房挡油铝箔2个装 隔油板 炒菜防油溅挡板 电器隔热板,日本inomata厨房挡油铝箔2个装 隔...,京东商城,加惠家居1007008008,厨具|厨房清洗用品|防油贴纸,特价2013新款厨房贴纸大号铝箔防油贴纸可移除餐厅墙贴瓷砖贴纸,家居家装>家装软饰>墙画墙贴>特价2013新款厨房贴纸大号铝箔防油贴纸...,京东商城,叮叮贴饰1007008008,厨具|厨房清洗用品|防油贴纸,谷典牌 厨房防油防水耐高温贴纸 透明铝箔 厨房贴 海豚之恋GD1033,家居家装>家装软饰>墙画墙贴>谷典>谷典牌 厨房防油防水耐高温贴纸 透明铝箔...,京东商城,谷典旗舰店1007008008,厨具|厨房清洗用品|防油贴纸,小马车品 汽车贴纸 油型提示 请加93 洋葱头 油箱盖贴 0227 黑色13*12.5cm,汽车用品 > 汽车内饰 > 遮阳挡、避光垫 > 车贴,亚马逊(卓越网),小马车品1007008008,厨具|厨房清洗用品|防油贴纸,时尚创意厨房防油污贴纸 瓷砖贴防水墙贴 耐高温可移除墙贴 (树藤心),购买B++商力电商提供的指定商品时花费 ￥ 99.00 或更多，将获得此商品的免费送货 点此查看如何获得促销优惠 (促销说明),亚马逊(卓越网),BJJ1007008008,厨具|厨房清洗用品|防油贴纸,特价秒杀绝不透明 高档铝箔防油贴纸 去除油污灶台厨房贴膜ST1003,电脑办公 > 办公用品 > 其它,当当网,斯图1007008008,厨具|厨房清洗用品|防油贴纸,厨房防油贴纸-蓝天白云JJD155,家居日用 > 清洁护理 > 清洁工具,当当网,暖宝宝1007008008,厨具|厨房清洗用品|防油贴纸,BBMONG 贝贝梦 韩国原装进口贴纸 防水瓷砖贴 装饰墙贴 星星夜光贴 月光下飞舞的彩蝶 NT-24和NT-48 两张,母婴用品 > 育儿房装饰 > 墙贴,亚马逊(卓越网),BBMONG 贝贝梦1007008008,厨具|厨房清洗用品|防油贴纸,普润 厨房瓷砖贴防油贴纸耐高温油烟贴铝箔墙贴纸 单张价,家居日用 > 清洁护理 > 清洁工具 > 商品详情,当当网,普润1007008008,厨具|厨房清洗用品|防油贴纸,振兴 厨房用进口铝箔耐高温 防油贴纸 防油墙纸 壁画防油壁纸 -花瓣--浪漫飞花,家居家纺、锅具餐具>装饰/日用>墙面装饰>振兴,1号店,振兴1007008008,厨具|厨房清洗用品|防油贴纸,耀点100 厨房防污贴纸 瓷砖贴 隔油防油贴纸 蓝天白云 JJD155,所有分类>家居家纺、锅具餐具>装饰/日用>其他生活日用品>耀点100>耀点100 厨房防污...,1号店,耀点1001007008008,厨具|厨房清洗用品|防油贴纸,柠檬树 创意厨房防油防水墙贴镜面墙贴纸 灶台防污染贴瓷砖贴 一套7片装,所有分类>家居家纺、锅具餐具>装饰/日用>装饰贴>柠檬树>柠檬树 创意厨房防油...,1号店,柠檬树1007008008,厨具|厨房清洗用品|防油贴纸,宅人帮墙贴厨房油烟贴防油贴纸防油贴瓷砖贴纸隔油纸2张 90*60 百花齐放图案花纹,厨具>烹饪锅具>厨用杂件>H&3>宅人帮墙贴厨房油烟贴防油贴纸防油贴瓷砖贴...,京东商城,H&3厨具旗舰店1007008008,厨具|厨房清洗用品|防油贴纸,货到付款馨颜墙壁厨房装饰清洁防水耐高温防油贴纸格子款 美味葡园,家居家装>家装软饰>装饰字画>馨颜>货到付款馨颜墙壁厨房装饰清洁防水耐高温防...,京东商城,馨颜生活旗舰店1007008008,厨具|厨房清洗用品|防油贴纸,Z-LABEL 立标 可移除胶粘 白色矩形 不干胶自粘标签贴纸 ZWM3017 标签尺寸:7.6×3.8cm 30张/袋, Z-LABEL® Brand Removable Rectangular Labels, 3" x 1-1/2", White,Write only,Pack Of 30,办公用品 > 纸类 > 笔记本、便签、随意贴 > 随意贴,亚马逊(卓越网),Z-LABEL 立标1007008008,厨具|厨房清洗用品|防油贴纸,Z-LABEL 立标 可移除胶粘 白色矩形 不干胶自粘标签贴纸 ZWM3018 标签尺寸:7.0×3.8cm 40张/袋, Z-LABEL® Brand Removable Rectangular Labels, 2-3/4" x 1-1/2", White,Write only,Pack Of 40,办公用品 > 纸类 > 笔记本、便签、随意贴 > 随意贴,亚马逊(卓越网),Z-LABEL 立标1007008008,厨具|厨房清洗用品|防油贴纸,秒杀 彩家乐大号厨房防油贴 田园 月季花开45*90cm PET+铝箔 耐高温保护瓷砖防油污贴纸 方便清洁 特价促销,家具家装 > 时尚家饰 > 墙壁装饰,当当网,彩家乐1007008008,厨具|厨房清洗用品|防油贴纸,斯图牌 防油贴 3个装 厨房餐厅家居 耐高温防油污贴纸斯图ST1035,家具家装 > 时尚家饰 > 墙壁装饰,当当网,斯图1007008008,厨具|厨房清洗用品|防油贴纸,韩版墙贴 耐高温 创意厨房 油烟贴/防油污贴纸 蒲公英 壁纸,家居日用 > 厨房用品 > 厨房杂件 > 厨房配件,当当网,米索1007008008,厨具|厨房清洗用品|防油贴纸,BBMONG 贝贝梦 时尚厨房防油烟贴纸 韩国原装 可移除瓷砖贴 浴室贴 玻璃贴 小水滴 ST-4,全场免邮，满199立减10元，满399立减30元，满599立减50元！更多选择，更多优惠，欢迎光临 “秀品”商铺！（客服咨询QQ：2355471179） 点此查看如何获得促销优惠 (促销说明),亚马逊(卓越网),BBMONG 贝贝梦1007008008,厨具|厨房清洗用品|防油贴纸,特价厨房防油贴纸 墙贴 防油污贴纸 墙纸 透明铝箔24款,玩具 > 创意生活 > 居家生活 > 商品详情,当当网,三合1007008008,厨具|厨房清洗用品|防油贴纸,斯图 (sitoo) 防油贴 厨房餐厅家居 耐高温防油污贴纸 瓷砖贴 墙纸 墙贴 瓷砖贴 (大风车)ST1035,家装建材>墙地面材料>壁纸>斯图 (sitoo) 防油贴 厨房餐厅家...,京东商城,斯图壁纸1007008008,厨具|厨房清洗用品|防油贴纸,夏至 厨房防污贴纸 瓷砖贴 隔油防油贴纸 蓝天白云 JJD155-2,所有分类>家居家纺、锅具餐具>厨具锅具>厨房工具>厨房杂件>夏至>夏至 厨房防污贴纸 ...,1号店,夏至1007008008,厨具|厨房清洗用品|防油贴纸,彩家乐 大号防油贴 PET+铝箔 厨房装饰墙纸墙贴 防油贴纸 6卷装 每卷尺寸45*90cm,所有分类>家居家纺、锅具餐具>装饰/日用>装饰贴>彩家乐>彩家乐 大号防油贴 ...,1号店,彩家乐1007008008,厨具|厨房清洗用品|防油贴纸,Wheatley 惠特利 高档铝箔防油贴纸 隔油贴纸 防水贴纸(多彩郁金香040)45*75cma1B04-2-015,购买任何家居自营商品加购ELLE全棉毛巾礼盒可享60元优惠！请将商品加入购物车， 在订单确认页面输入I7MLFKR9 点此查看如何获得促销优惠 (促销说明),亚马逊(卓越网),Wheatley 惠特利1007008008,厨具|厨房清洗用品|防油贴纸,Wheatley 惠特利 高档铝箔防油贴纸 隔油贴纸 防水贴纸(玫瑰爱心004)45*75cma1B04-2-016,,亚马逊(卓越网),Wheatley 惠特利1007008008,厨具|厨房清洗用品|防油贴纸,Sitoo 斯图 防油贴 ST1005《美味作料》3个装 厨房餐厅家居 耐高温防油污贴纸 瓷砖贴,,亚马逊(卓越网),sitoo斯图1007008008,厨具|厨房清洗用品|防油贴纸,Sitoo 斯图 防油贴 ST1043《夏日冰爽》3个装 厨房餐厅家居 耐高温防油污贴纸 瓷砖贴,,亚马逊(卓越网),sitoo斯图1007008008,厨具|厨房清洗用品|防油贴纸,Sitoo 斯图 防油贴 ST1031《春暖花开》3个装 厨房餐厅家居 耐高温防油污贴纸 瓷砖贴,,亚马逊(卓越网),sitoo斯图1007008008,厨具|厨房清洗用品|防油贴纸,Sitoo 斯图 防油贴 ST1047《午后红茶》3个装 厨房餐厅家居 耐高温防油污贴纸 瓷砖贴,,亚马逊(卓越网),sitoo斯图1007008008,厨具|厨房清洗用品|防油贴纸,柠檬绿茶 厨房防油贴纸耐高温防油烟贴纸 耐高温墙贴加厚加大多款 J09102,所有分类>家居家纺、锅具餐具>装饰/日用>其他生活日用品>柠檬绿茶>柠檬绿茶 厨房防油贴...,1号店,柠檬绿茶1007008008,厨具|厨房清洗用品|防油贴纸,吉睿JiRui 田园铝箔厨房专用耐高温易清洁防油烟贴纸45*75CM 五个装,家居家装>家装软饰>墙贴/装饰贴>吉睿>吉睿JiRui 田园铝箔厨房专用耐高温易...,京东商城,吉睿家居生活馆1007008008,厨具|厨房清洗用品|防油贴纸,自由城 厨房 防油污贴纸 1套5张 颜色随机发货,自由城>自由城 厨房 防油污贴纸 1套5张 颜色随机发货,国美电器网上商城,自由城1007008008,厨具|厨房清洗用品|防油贴纸,孖堡家居 高档厨房防油贴 铝箔材质耐高温瓷砖贴 加厚防水防油烟灶台墙贴纸 绿树成荫,所有分类>家居家纺、锅具餐具>装饰/日用>装饰贴>孖堡家居>孖堡家居 高档厨房防...,1号店,孖堡家居1007008008,厨具|厨房清洗用品|防油贴纸,孖堡家居 高档厨房防油贴 铝箔材质耐高温瓷砖墙贴 加厚防水防油烟灶台墙贴纸 蘑菇屋装饰贴,家装建材 > 时尚家饰 > 墙壁装饰 > 商品详情,当当网,孖堡家居1007008008,厨具|厨房清洗用品|防油贴纸,厨房防污贴纸 瓷砖贴 隔油防油贴纸 厨房瓷砖贴防油贴纸 耐高温油烟贴铝珀墙贴纸 蒲公英Y1008,家居家装>家装软饰>其他>红兔子>厨房防污贴纸 瓷砖贴 隔油防油贴纸 厨房...,京东商城,1007008008,厨具|厨房清洗用品|防油贴纸,柠檬树 高档铝箔加厚款 10片装厨房防油贴纸 耐高温 防油免清洗 10片装混搭 买二套送一张,家居家装>家装软饰>墙贴/装饰贴>柠檬树（LEMONTREE）>柠檬树 高档铝箔加厚款 10片装厨房防油...,京东商城,柠檬树家居旗舰店1007008008,厨具|厨房清洗用品|防油贴纸,简家 高档厨房特大防油污贴纸 防油烟贴瓷砖橱柜装饰贴纸 E7419 粉心1004,家居家装>清洁用品>家庭清洁>简家>简家 高档厨房特大防油污贴纸 防油烟贴瓷...,京东商城,简家家居旗舰店1007008008,厨具|厨房清洗用品|防油贴纸,简家 高档厨房特大防油污贴纸 防油烟贴瓷砖橱柜装饰贴纸 E7419 大号粉簇玫瑰Y2013,家居家装>清洁用品>家庭清洁>简家>简家 高档厨房特大防油污贴纸 防油烟贴瓷...,京东商城,简家家居旗舰店1007008008,厨具|厨房清洗用品|防油贴纸,厨房防污贴纸 瓷砖贴 隔油防油贴纸 厨房瓷砖贴防油贴纸 耐高温油烟贴铝珀墙贴纸 浪漫桃心Y1004,家居家装>家装软饰>其他>红兔子>厨房防污贴纸 瓷砖贴 隔油防油贴纸 厨房...,京东商城,祥韧家居生活馆1007008008,厨具|厨房清洗用品|防油贴纸,简家 厨房大号防油贴纸 防油烟贴瓷砖橱柜装饰贴纸 LXYS1029 绿色四叶草,家居家装>家装软饰>墙画墙贴>简家 厨房大号防油贴纸 防油烟贴瓷砖橱柜...,京东商城,简家家居旗舰店1007008008,厨具|厨房清洗用品|防油贴纸,简家 厨房大号防油贴纸 防油烟贴瓷砖橱柜装饰贴纸 LXYS1029 蓝色菱形,家居家装>家装软饰>墙画墙贴>简家 厨房大号防油贴纸 防油烟贴瓷砖橱柜...,京东商城,简家家居旗舰店1007008008,厨具|厨房清洗用品|防油贴纸,韩式厨房防油贴纸 厨房贴玻璃贴 耐高温 1张,家居家装>家装软饰>墙画墙贴>魅之优品>韩式厨房防油贴纸 厨房贴玻璃贴 耐高温 ...,京东商城,义乌仁璟家居