1007007008,厨具|茶具、咖啡具|茶宠摆件,郑品 汝窑十二生肖茶宠摆件 生肖印章 生肖装饰礼品 摆件装饰WP12YYSX 猴,厨具>茶具/咖啡具>茶宠摆件>郑品>郑品 汝窑十二生肖茶宠摆件 生肖印章 生...,京东商城,郑品茶具旗舰店1007007008,厨具|茶具、咖啡具|茶宠摆件,唐丰 招财 紫砂金蟾蜍 茶玩茶宠摆件 超灵气 高背金蟾TF-1370 小号高背金蟾,厨具>茶具/咖啡具>茶宠摆件>唐丰>唐丰 招财 紫砂金蟾蜍 茶玩茶宠摆件 超...,京东商城,1007007008,厨具|茶具、咖啡具|茶宠摆件,唐丰开片汝瓷茶宠 十二生肖可养开片茶道汝窑茶宠 收藏品TF-1436 鼠,厨具>茶具/咖啡具>茶宠摆件>唐丰>唐丰开片汝瓷茶宠 十二生肖可养开片茶道汝...,京东商城,1007007008,厨具|茶具、咖啡具|茶宠摆件,唐丰开片汝瓷茶宠 十二生肖可养开片茶道汝窑茶宠 收藏品TF-1436 蛇,厨具>茶具/咖啡具>茶宠摆件>唐丰>唐丰开片汝瓷茶宠 十二生肖可养开片茶道汝...,京东商城,1007007008,厨具|茶具、咖啡具|茶宠摆件,唐丰开片汝瓷茶宠 十二生肖可养开片茶道汝窑茶宠 收藏品TF-1436 猴,厨具>茶具/咖啡具>茶宠摆件>唐丰>唐丰开片汝瓷茶宠 十二生肖可养开片茶道汝...,京东商城,1007007008,厨具|茶具、咖啡具|茶宠摆件,莲品茶宠 哥窑茶宠 摆件德化陶瓷 手工制作茶盘必备收藏送亲朋 悟禅,厨具>茶具/咖啡具>茶宠摆件>莲品>莲品茶宠 哥窑茶宠 摆件德化陶瓷 手工制...,京东商城,热巢家居旗舰店1007007008,厨具|茶具、咖啡具|茶宠摆件,礼米 十二生肖 精雕天青汝窑 开片可养 茶宠茶玩WP12YYSX 鼠,厨具>茶具/咖啡具>茶宠摆件>礼米>礼米 十二生肖 精雕天青汝窑 开片可养 ...,京东商城,礼米官方旗舰店1007007008,厨具|茶具、咖啡具|茶宠摆件,丰陶张生 精品哥窑茶宠 茶道配件 开片可养 历史人物 诸葛亮,厨具>茶具/咖啡具>茶宠摆件>丰陶张生>丰陶张生 精品哥窑茶宠 茶道配件 开片可...,京东商城,丰陶张生家居馆1007007008,厨具|茶具、咖啡具|茶宠摆件,丰陶张生 精品哥窑茶宠 茶道配件 开片可养 历史人物 曹操,厨具>茶具/咖啡具>茶宠摆件>丰陶张生>丰陶张生 精品哥窑茶宠 茶道配件 开片可...,京东商城,丰陶张生家居馆1007007008,厨具|茶具、咖啡具|茶宠摆件,尚言坊 茶具配件 茶玩摆件 汝瓷工艺品 汝窑茶宠 可养开片 9款 汝窑哈哈佛,厨具>茶具/咖啡具>茶宠摆件>尚言坊>尚言坊 茶具配件 茶玩摆件 汝瓷工艺品 ...,京东商城,尚言坊旗舰店1007007008,厨具|茶具、咖啡具|茶宠摆件,尚言坊 乡仕茶宠 茶玩摆件 哥窑茶宠 开片可养 历史人物17款 哥窑李白醉酒,厨具>茶具/咖啡具>茶宠摆件>尚言坊>尚言坊 乡仕茶宠 茶玩摆件 哥窑茶宠 开...,京东商城,尚言坊旗舰店1007007008,厨具|茶具、咖啡具|茶宠摆件,尚言坊 茶具茶道零配 茶玩摆件 紫砂茶宠 招财进宝招财小猴 3选1,厨具>茶具/咖啡具>茶宠摆件>尚言坊>尚言坊 茶具茶道零配 茶玩摆件 紫砂茶宠...,京东商城,尚言坊旗舰店1007007008,厨具|茶具、咖啡具|茶宠摆件,藏壶者宜兴紫砂茶宠摆件 王国文（心想事成摆件）黄龙山原矿段泥 茶道配件,厨具>茶具/咖啡具>茶宠摆件>藏壶者 >藏壶者宜兴紫砂茶宠摆件 王国文（心想事成...,京东商城,藏壶者旗舰店1007007008,厨具|茶具、咖啡具|茶宠摆件,尚言坊 乡仕茶宠 茶玩摆件 哥窑茶宠 蝉翼开片可养 龙生九子 哥窑椒图,厨具>茶具/咖啡具>茶宠摆件>尚言坊>尚言坊 乡仕茶宠 茶玩摆件 哥窑茶宠 蝉...,京东商城,尚言坊旗舰店1007007008,厨具|茶具、咖啡具|茶宠摆件,尚言坊 茶具配件 茶玩摆件 陶制小雕塑 汝窑如来佛茶宠 单个(小) 汝窑开心如来,厨具>茶具/咖啡具>茶宠摆件>尚言坊>尚言坊 茶具配件 茶玩摆件 陶制小雕塑 ...,京东商城,尚言坊旗舰店1007007008,厨具|茶具、咖啡具|茶宠摆件,尚言坊 茶具茶道配件茶玩摆件 汝窑哥窑可养开片 茶宠蕴香(大) 哥窑绿蕴香茶宠,厨具>茶具/咖啡具>茶宠摆件>尚言坊>尚言坊 茶具茶道配件茶玩摆件 汝窑哥窑可...,京东商城,尚言坊旗舰店1007007008,厨具|茶具、咖啡具|茶宠摆件,三义成景德镇手绘文房五宝富贵寿考图 余全宏作品 孤品收藏,厨具>茶具/咖啡具>茶宠摆件>三义成>三义成景德镇手绘文房五宝富贵寿考图 余全...,京东商城,三义成1007007008,厨具|茶具、咖啡具|茶宠摆件,尚言坊 茶具配件 茶玩摆件 陶制小雕塑 汝窑不倒翁招财茶宠 单个 招财生肖-猴,厨具>茶具/咖啡具>茶宠摆件>尚言坊>尚言坊 茶具配件 茶玩摆件 陶制小雕塑 ...,京东商城,1007007008,厨具|茶具、咖啡具|茶宠摆件,东茶西壶 十二12生肖马年礼品生日礼物居家摆件 马到成功树脂变色茶宠GA3159 单个茶宠无礼盒包装,厨具>茶具/咖啡具>茶宠摆件>东茶西壶>东茶西壶 十二12生肖马年礼品生日礼物居...,京东商城,东茶西壶旗舰店1007007008,厨具|茶具、咖啡具|茶宠摆件,水善品 【马上有钱】马年吉祥物汝窑哥窑开片茶宠 茶道配件 家居书房摆件 汽车饰品 第8款,厨具>茶具/咖啡具>茶宠摆件>水善品>水善品 【马上有钱】马年吉祥物汝窑哥窑开...,京东商城,水善品瓷艺家居1007007008,厨具|茶具、咖啡具|茶宠摆件,水善品 【马上有钱】马年吉祥物汝窑哥窑开片茶宠 茶道配件 家居书房摆件 汽车饰品 第10款,厨具>茶具/咖啡具>茶宠摆件>水善品>水善品 【马上有钱】马年吉祥物汝窑哥窑开...,京东商城,水善品瓷艺家居1007007008,厨具|茶具、咖啡具|茶宠摆件,三义成人物茶宠达摩哥窑系列 悟闲,厨具>茶具/咖啡具>茶宠摆件>三义成>三义成人物茶宠达摩哥窑系列 悟闲,京东商城,三义成1007007008,厨具|茶具、咖啡具|茶宠摆件,三义成人物茶宠达摩哥窑系列 悟学,厨具>茶具/咖啡具>茶宠摆件>三义成>三义成人物茶宠达摩哥窑系列 悟学,京东商城,三义成1007007008,厨具|茶具、咖啡具|茶宠摆件,三义成人物茶宠仿汝窑佛珠和尚系列 心怀天下,厨具>茶具/咖啡具>茶宠摆件>三义成>三义成人物茶宠仿汝窑佛珠和尚系列 心怀天...,京东商城,三义成1007007008,厨具|茶具、咖啡具|茶宠摆件,【爱壶人】精品手工宜兴紫砂茶宠摆件茶具 小猪哼哼 欢天喜地 黑色,厨具>茶具/咖啡具>茶宠摆件>爱壶人>【爱壶人】精品手工宜兴紫砂茶宠摆件茶具 ...,京东商城,爱壶人紫砂旗舰店1007007008,厨具|茶具、咖啡具|茶宠摆件,【爱壶人】精品手工宜兴紫砂茶宠摆件茶具坐井观天井底之蛙喷水 单个价 新款绿色,厨具>茶具/咖啡具>茶宠摆件>爱壶人>【爱壶人】精品手工宜兴紫砂茶宠摆件茶具坐...,京东商城,爱壶人紫砂旗舰店1007007008,厨具|茶具、咖啡具|茶宠摆件,【爱壶人】精品手工宜兴紫砂茶宠摆件茶具 寿比南山刻字老寿星喷水,厨具>茶具/咖啡具>茶宠摆件>爱壶人>【爱壶人】精品手工宜兴紫砂茶宠摆件茶具 ...,京东商城,爱壶人紫砂旗舰店1007007008,厨具|茶具、咖啡具|茶宠摆件,推荐精品【爱壶人】宜兴茶具茶宠 龙生九子龙龟 招财辟邪,厨具>茶具/咖啡具>茶宠摆件>爱壶人>推荐精品【爱壶人】宜兴茶具茶宠 龙生九子...,京东商城,爱壶人紫砂旗舰店1007007008,厨具|茶具、咖啡具|茶宠摆件,黄龙壶缘 宜兴紫砂手工茶宠（达摩香炉摆件）原矿段泥 紫砂精品茶宠摆件,厨具>茶具/咖啡具>茶宠摆件>黄龙壶缘>黄龙壶缘 宜兴紫砂手工茶宠（达摩香炉摆件...,京东商城,黄龙壶缘1007007008,厨具|茶具、咖啡具|茶宠摆件,黄龙壶缘 宜兴紫砂手工茶宠（狮子辟邪茶宠）原矿紫泥 紫砂精品茶宠摆件,厨具>茶具/咖啡具>茶宠摆件>黄龙壶缘>黄龙壶缘 宜兴紫砂手工茶宠（狮子辟邪茶宠...,京东商城,黄龙壶缘1007007008,厨具|茶具、咖啡具|茶宠摆件,汉唐茶宠茶玩紫砂摆件 紫砂小茶壶 茶具摆件 汉唐茶盘摆件 紫色小茶壶4,厨具>茶具/咖啡具>茶宠摆件>汉唐（hantang）>汉唐茶宠茶玩紫砂摆件 紫砂小茶壶 茶具摆...,京东商城,汉唐家居官方旗舰店1007007008,厨具|茶具、咖啡具|茶宠摆件,关耳窑 茶具摆件 可爱陶瓷茶宠 猪猪茶宠 超萌肥肥猪 茶具配件 茶宠CCFGZBJ3 黑色猪茶宠,厨具>茶具/咖啡具>茶宠摆件>关耳窑>关耳窑 茶具摆件 可爱陶瓷茶宠 猪猪茶宠...,京东商城,关耳窑旗舰店1007007008,厨具|茶具、咖啡具|茶宠摆件,百鸿 茶宠摆件 变色茶宠茶玩 功夫茶具配件 茶道配件 茶道必备CC41ZSVV17K 翡翠玉白菜,厨具>茶具/咖啡具>茶具配件>百鸿>百鸿 茶宠摆件 变色茶宠茶玩 功夫茶具配...,京东商城,百鸿旗舰店1007007008,厨具|茶具、咖啡具|茶宠摆件,百鸿 茶宠摆件 变色茶宠茶玩 功夫茶具配件 茶道配件 茶道必备CC41ZSVV17K 变色金蟾,厨具>茶具/咖啡具>茶具配件>百鸿>百鸿 茶宠摆件 变色茶宠茶玩 功夫茶具配...,京东商城,百鸿旗舰店1007007008,厨具|茶具、咖啡具|茶宠摆件,百鸿 茶宠摆件 变色茶宠茶玩 功夫茶具配件 茶道配件 茶道必备CC41ZSVV17K 招财元宝虎,厨具>茶具/咖啡具>茶具配件>百鸿>百鸿 茶宠摆件 变色茶宠茶玩 功夫茶具配...,京东商城,百鸿旗舰店1007007008,厨具|茶具、咖啡具|茶宠摆件,【爱壶人】精品宜兴紫砂茶宠茶玩 双色大号金蟾王 17cm 王桂良,厨具>茶具/咖啡具>茶宠摆件>爱壶人>【爱壶人】精品宜兴紫砂茶宠茶玩 双色大号...,京东商城,爱壶人紫砂旗舰店1007007008,厨具|茶具、咖啡具|茶宠摆件,【爱壶人】宜兴紫砂茶道 竹报平安 大号茶洗水洗 两色选 紫色,厨具>茶具/咖啡具>茶宠摆件>爱壶人>【爱壶人】宜兴紫砂茶道 竹报平安 大号茶...,京东商城,爱壶人紫砂旗舰店1007007008,厨具|茶具、咖啡具|茶宠摆件,关耳窑 茶宠摆件 变色茶宠茶玩 功夫茶具配件 茶道配件 茶道必备CC41ZSVV17K 变色玉蟾,厨具>茶具/咖啡具>茶宠摆件>关耳窑>关耳窑 茶宠摆件 变色茶宠茶玩 功夫茶...,京东商城,关耳窑旗舰店1007007008,厨具|茶具、咖啡具|茶宠摆件,关耳窑 茶宠摆件 变色茶宠茶玩 功夫茶具配件 茶道配件 茶道必备CC41ZSVV17K 口含元宝玉蟾,厨具>茶具/咖啡具>茶宠摆件>关耳窑>关耳窑 茶宠摆件 变色茶宠茶玩 功夫茶...,京东商城,关耳窑旗舰店1007007008,厨具|茶具、咖啡具|茶宠摆件,玄雕窑 线香盒装上等纯天然家居香 贡香 佛教用香 怡情养性 藏香,厨具>茶具/咖啡具>茶宠摆件>玄雕窑>玄雕窑 线香盒装上等纯天然家居香 贡香 ...,京东商城,冠通茶业1007007008,厨具|茶具、咖啡具|茶宠摆件,尚帝 茶宠摆件 变色茶宠茶玩 功夫茶具配件 茶道配件 茶道必备CC41ZSVV17K 三脚金蟾,厨具>茶具/咖啡具>茶宠摆件>尚帝（shangdi）>尚帝 茶宠摆件 变色茶宠茶玩 功夫茶具配...,京东商城,尚帝旗舰店1007007008,厨具|茶具、咖啡具|茶宠摆件,藏壶者宜兴紫砂茶宠 （精品坐禅达摩摆件）原矿清水泥 茶道配件,厨具>茶具/咖啡具>茶宠摆件>藏壶者 >藏壶者宜兴紫砂茶宠 （精品坐禅达摩摆件）...,京东商城,藏壶者旗舰店1007007008,厨具|茶具、咖啡具|茶宠摆件,郑品 汝窑开片茶宠 茶道摆件 功夫茶具茶宠 可养茶宠 DP-RYTQCC12 生肖馬,厨具>茶具/咖啡具>茶宠摆件>郑品>郑品 汝窑开片茶宠 茶道摆件 功夫茶具茶...,京东商城,郑品茶具旗舰店1007007008,厨具|茶具、咖啡具|茶宠摆件,陶先生宜兴精品紫砂汉唐马茶宠马茶玩摆件茶具茶盘配件 喜马,厨具>茶具/咖啡具>茶宠摆件>陶先生（Mrtao） >陶先生宜兴精品紫砂汉唐马茶宠马茶玩摆件茶...,京东商城,陶家庄茶具专营店1007007008,厨具|茶具、咖啡具|茶宠摆件,三义成茶宠新年茶礼功夫小子系列摆件茶玩 哥窑功夫龙威,厨具>茶具/咖啡具>茶宠摆件>三义成>三义成茶宠新年茶礼功夫小子系列摆件茶玩 ...,京东商城,三义成1007007008,厨具|茶具、咖啡具|茶宠摆件,三义成茶宠仿汝窑茶玩摆件两如来 两如来,厨具>茶具/咖啡具>茶宠摆件>三义成>三义成茶宠仿汝窑茶玩摆件两如来 两如来,京东商城,三义成1007007008,厨具|茶具、咖啡具|茶宠摆件,三义成仿汝窑茶宠三个和尚没水喝系列,厨具>茶具/咖啡具>茶宠摆件>三义成>三义成仿汝窑茶宠三个和尚没水喝系列,京东商城,三义成1007007008,厨具|茶具、咖啡具|茶宠摆件,黄龙壶缘 宜兴紫砂手工茶宠（ 朱泥全手工小花瓶六）原矿朱泥 紫砂精品茶宠摆件 刻绘六,厨具>茶具/咖啡具>茶宠摆件>黄龙壶缘>黄龙壶缘 宜兴紫砂手工茶宠（ 朱泥全手工...,京东商城,黄龙壶缘1007007008,厨具|茶具、咖啡具|茶宠摆件,【爱壶人东亚紫砂】宜兴紫砂 精品茶宠摆件 养壶垫 壶盖托 如意小牛 黑色,厨具>茶具/咖啡具>茶具配件>爱壶人>【爱壶人东亚紫砂】宜兴紫砂 精品茶宠摆件...,京东商城,爱壶人紫砂旗舰店1007007008,厨具|茶具、咖啡具|茶宠摆件,郑品 月白茶宠 茶道摆件 功夫茶具茶宠 多款月白茶宠摆件 DP-RYYBCC12K 马茶宠,厨具>茶具/咖啡具>茶宠摆件>郑品>郑品 月白茶宠 茶道摆件 功夫茶具茶宠 ...,京东商城,郑品茶具旗舰店1007007008,厨具|茶具、咖啡具|茶宠摆件,素芳轩 宜兴手工紫砂茶宠 沙皮,厨具>茶具/咖啡具>茶宠摆件>素芳轩>素芳轩 宜兴手工紫砂茶宠 沙皮,京东商城,素芳轩旗舰店1007007008,厨具|茶具、咖啡具|茶宠摆件,黄龙壶缘 宜兴紫砂茶宠摆件 2013年全手工大赛二等奖王国文(心想事成摆件一)紫砂茶宠摆件,厨具>茶具/咖啡具>茶宠摆件>黄龙壶缘>黄龙壶缘 宜兴紫砂茶宠摆件 2013年全...,京东商城,黄龙壶缘1007007008,厨具|茶具、咖啡具|茶宠摆件,素芳轩 变色树脂茶宠摆件 绿色 小貔貅,厨具>茶具/咖啡具>茶宠摆件>素芳轩>素芳轩 变色树脂茶宠摆件 绿色 小貔貅,京东商城,素芳轩旗舰店1007007008,厨具|茶具、咖啡具|茶宠摆件,悦目清心 茶宠摆件 宜兴陶土紫砂 茶宠茶道喷水撒尿童子,厨具>茶具/咖啡具>茶宠摆件>悦目清心>悦目清心 茶宠摆件 宜兴陶土紫砂 茶宠茶...,京东商城,悦目清心旗舰店1007007008,厨具|茶具、咖啡具|茶宠摆件,郑品 茶具摆件 可爱陶瓷茶宠 猪猪茶宠 超萌肥肥猪 茶具配件 茶宠CCFGZBJ3 黄色猪茶宠,厨具>茶具/咖啡具>茶宠摆件>郑品>郑品 茶具摆件 可爱陶瓷茶宠 猪猪茶宠 ...,京东商城,郑品茶具旗舰店1007007008,厨具|茶具、咖啡具|茶宠摆件,祥福 茶宠摆件 精品紫砂茶宠 茶玩茶趣 宜兴功夫茶具茶盘摆件CC01 随心,厨具>茶具/咖啡具>茶宠摆件>祥福>祥福 茶宠摆件 精品紫砂茶宠 茶玩茶趣 ...,京东商城,祥福官方旗舰店1007007008,厨具|茶具、咖啡具|茶宠摆件,素芳轩 宜兴手工紫砂茶宠 鱼盖托,厨具>茶具/咖啡具>茶宠摆件>素芳轩>素芳轩 宜兴手工紫砂茶宠 鱼盖托,京东商城,素芳轩旗舰店1007007008,厨具|茶具、咖啡具|茶宠摆件,素芳轩 宜兴手工紫砂茶宠 三不猴,厨具>茶具/咖啡具>茶宠摆件>素芳轩>素芳轩 宜兴手工紫砂茶宠 三不猴,京东商城,素芳轩旗舰店1007007008,厨具|茶具、咖啡具|茶宠摆件,素芳轩 宜兴手工紫砂茶宠 拉毛狗,厨具>茶具/咖啡具>茶宠摆件>素芳轩>素芳轩 宜兴手工紫砂茶宠 拉毛狗,京东商城,素芳轩旗舰店1007007008,厨具|茶具、咖啡具|茶宠摆件,素芳轩 宜兴手工紫砂茶宠 老鼠,厨具>茶具/咖啡具>茶宠摆件>素芳轩>素芳轩 宜兴手工紫砂茶宠 老鼠,京东商城,素芳轩旗舰店1007007008,厨具|茶具、咖啡具|茶宠摆件,素芳轩 宜兴手工紫砂茶宠 鼓形壶托,厨具>茶具/咖啡具>茶宠摆件>素芳轩>素芳轩 宜兴手工紫砂茶宠 鼓形壶托,京东商城,素芳轩旗舰店1007007008,厨具|茶具、咖啡具|茶宠摆件,其乐居舍 茶宠摆件 哈哈佛 乐喜,所有分类>家居家纺、锅具餐具>餐具水具>茶具1>茶宠摆件>其乐居舍>其乐居舍 茶宠摆件 ...,1号店,其乐居舍1007007008,厨具|茶具、咖啡具|茶宠摆件,莫耶 龙泉青瓷茶道配件玉手香插座插香座摆件 SSL7042,所有分类>家居家纺、锅具餐具>餐具水具>茶具1>茶宠摆件>莫耶>莫耶 龙泉青瓷茶道配...,1号店,莫耶1007007008,厨具|茶具、咖啡具|茶宠摆件,描金紫砂茶宠精品风水摆件镇宅 招财茶宠茶道宜兴紫砂包邮,厨具>茶具/咖啡具>茶宠摆件>踞虎堂>描金紫砂茶宠精品风水摆件镇宅 招财茶宠茶...,京东商城,踞虎堂茶具专营店1007007008,厨具|茶具、咖啡具|茶宠摆件,【柿子原创】汝窑开片十八罗汉茶宠汝瓷蝉翼开片可养创意茶玩摆件 看门罗汉,厨具>茶具/咖啡具>茶宠摆件>柿子>【柿子原创】汝窑开片十八罗汉茶宠汝瓷蝉翼...,京东商城,龙颜堂旗舰店1007007008,厨具|茶具、咖啡具|茶宠摆件,尚帝 （地）招财纳福《欢天喜地》憨态可掬茶宠摆件,首页 > 尚帝茶具专场 > （地）招财纳福《欢天喜地》憨态可掬茶宠摆件,唯品会,无1007007008,厨具|茶具、咖啡具|茶宠摆件,尚帝 左招财童子纯手工雕刻彩砂陶茶宠摆件（小号）,首页 > 尚帝茶具专场 > 左招财童子纯手工雕刻彩砂陶茶宠摆件（小号）,唯品会,无1007007008,厨具|茶具、咖啡具|茶宠摆件,德化商城茶道配件 汝窑开片茶宠摆件观音如来茶宠精品 茶宠精品 事事平安,厨具>茶具/咖啡具>茶宠摆件>淘德瓷（TAO DE CI）>德化商城茶道配件 汝窑开片茶宠摆件观音如...,京东商城,德化商城专营店1007007008,厨具|茶具、咖啡具|茶宠摆件,茶宠配件 精品宜兴紫砂 手工茶艺茶具摆件 茶道配件 可爱莲蓬茶玩 喷水 莲蓬茶玩,厨具>茶具/咖啡具>茶宠摆件>汇茶>茶宠配件 精品宜兴紫砂 手工茶艺茶具摆件...,京东商城,汇茶官方旗舰店1007007008,厨具|茶具、咖啡具|茶宠摆件,宏中 宜兴全手工紫砂茶宠摆件 紫砂茶玩工艺葫芦福娃茶宠摆件 葫芦福娃,家居 > 家居装饰 > 装饰摆件、挂件 > 佛像、八卦摆件,亚马逊(卓越网),宏中1007007008,厨具|茶具、咖啡具|茶宠摆件,束氏 哥窑茶宠 精品茶玩 茶盘摆件 陶瓷功夫茶具配件 多款 欢天036265,厨具>茶具/咖啡具>茶宠摆件>束氏>束氏 哥窑茶宠 精品茶玩 茶盘摆件 陶瓷...,京东商城,束氏旗舰店1007007008,厨具|茶具、咖啡具|茶宠摆件,【柿子原创】紫砂变色螃蟹茶宠 和谐茶宠 河蟹螃蟹手工茶玩摆件,厨具>茶具/咖啡具>茶宠摆件>柿子>【柿子原创】紫砂变色螃蟹茶宠 和谐茶宠 ...,京东商城,龙颜堂旗舰店1007007008,厨具|茶具、咖啡具|茶宠摆件,【柿子原创】汝窑蝉翼开片名仕茶宠汝瓷历史人物茶宠开片可养茶玩 关羽,厨具>茶具/咖啡具>茶宠摆件>柿子>【柿子原创】汝窑蝉翼开片名仕茶宠汝瓷历史...,京东商城,龙颜堂旗舰店1007007008,厨具|茶具、咖啡具|茶宠摆件,【柿子原创】汝窑开片龙生九子茶宠汝瓷蝉翼开片可养创意茶玩摆件 睚眦老二,厨具>茶具/咖啡具>茶宠摆件>柿子>【柿子原创】汝窑开片龙生九子茶宠汝瓷蝉翼...,京东商城,龙颜堂旗舰店1007007008,厨具|茶具、咖啡具|茶宠摆件,【紫砂之家】 全手工 宜兴紫砂 核桃 杂件 紫砂泥 尺寸：6*5*6 25978,厨具>茶具/咖啡具>茶宠摆件>紫砂之家>【紫砂之家】 全手工 宜兴紫砂 核桃 杂...,京东商城,紫砂之家官方旗舰店1007007008,厨具|茶具、咖啡具|茶宠摆件,福茶荟 钧窑陶瓷茶宠 人物茶宠 四个小和尚 沉睡,厨具>茶具/咖啡具>茶宠摆件>福茶荟>福茶荟 钧窑陶瓷茶宠 人物茶宠 四个小和...,京东商城,福茶荟官方旗舰店1007007008,厨具|茶具、咖啡具|茶宠摆件,尚帝 （财）汉唐四俊马《喜乐财福》憨态可掬茶宠摆件,首页 > 尚帝茶具专场 > （财）汉唐四俊马《喜乐财福》憨态可掬茶宠摆件,唯品会,无1007007008,厨具|茶具、咖啡具|茶宠摆件,麦陶MT 精品紫砂茶宠摆件 汝瓷开片茶宠 十二生肖茶宠茶玩茶道配件,所有分类>家居家纺、锅具餐具>餐具水具>茶具1>茶宠摆件>麦陶MT>麦陶MT 精品紫砂茶...,1号店,麦陶MT1007007008,厨具|茶具、咖啡具|茶宠摆件,白瓷器马工艺品家居笔架摆件 德化白瓷马到成功办公礼品摆设 一鸣惊人,厨具>茶具/咖啡具>茶宠摆件>君肴>白瓷器马工艺品家居笔架摆件 德化白瓷马到...,京东商城,君肴家瓷生活馆1007007008,厨具|茶具、咖啡具|茶宠摆件,家装节 品茶忆友宜兴紫砂茶宠茶玩茶摆件金钱羊纯手工制作茶道配件,厨具>茶具/咖啡具>茶宠摆件>品茶忆友>家装节 品茶忆友宜兴紫砂茶宠茶玩茶摆件金...,京东商城,品茶忆友旗舰店1007007008,厨具|茶具、咖啡具|茶宠摆件,福茶荟 紫砂茶宠 动物茶宠 福字猪 小猪系列 圆猪黑色,厨具>茶具/咖啡具>茶宠摆件>福茶荟>福茶荟 紫砂茶宠 动物茶宠 福字猪 小...,京东商城,福茶荟官方旗舰店1007007008,厨具|茶具、咖啡具|茶宠摆件,百工制器CRAFTS CREATE 哥窑财缘小和尚茶宠 汝窑紫砂茶宠摆件 居家装饰摆件 车载摆件 桌面摆件,所有分类>家居家纺、锅具餐具>餐具水具>茶具1>茶宠摆件>百工制器CRAFTS CREATE>百工制器CRAFTS...,1号店,百工制器CRAFTS CREATE1007007008,厨具|茶具、咖啡具|茶宠摆件,家装节 品茶忆友 福禄寿紫砂茶宠 纯手工紫砂茶玩精品摆件紫泥朱泥茶配件 红色,厨具>茶具/咖啡具>茶宠摆件>品茶忆友>家装节 品茶忆友 福禄寿紫砂茶宠 纯手工...,京东商城,品茶忆友旗舰店1007007008,厨具|茶具、咖啡具|茶宠摆件,大彬堂 功夫茶具 紫砂茶宠摆件 刘新华手制 紫泥撒釉烟缸花盆1554,首页>家居/家装建材/厨具>餐厨用具>茶具>大彬堂功夫茶具紫砂茶宠摆件刘新...,苏宁,1007007008,厨具|茶具、咖啡具|茶宠摆件,三义成禅趣摆件茶宠弥勒佛系列 哥窑布袋弥勒佛1,厨具>茶具/咖啡具>茶宠摆件>三义成>三义成禅趣摆件茶宠弥勒佛系列 哥窑布袋弥...,京东商城,三义成1007007008,厨具|茶具、咖啡具|茶宠摆件,光合生活平平安安茶宠 月白色茶宠摆件,首页>家居>居家用品>茶具,银泰网,光合生活1007007008,厨具|茶具、咖啡具|茶宠摆件,光合生活童男茶宠 铁釉色茶宠摆件,首页>家居>居家用品>茶具,银泰网,光合生活1007007008,厨具|茶具、咖啡具|茶宠摆件,福茶荟 紫砂茶宠 日常摆件 人物茶宠 福到财到弥勒佛茶宠 铜钱弥勒,厨具>茶具/咖啡具>茶宠摆件>福茶荟>福茶荟 紫砂茶宠 日常摆件 人物茶宠...,京东商城,福茶荟官方旗舰店1007007008,厨具|茶具、咖啡具|茶宠摆件,福茶荟 紫砂茶宠 日常摆件 福娃茶宠 鱼抱娃茶宠 蛤蟆娃,厨具>茶具/咖啡具>茶宠摆件>福茶荟>福茶荟 紫砂茶宠 日常摆件 福娃茶宠...,京东商城,福茶荟官方旗舰店1007007008,厨具|茶具、咖啡具|茶宠摆件,三义成茶玩文玩茶宠竹林七贤 粉青嵇康,厨具>茶具/咖啡具>茶宠摆件>三义成>三义成茶玩文玩茶宠竹林七贤 粉青嵇康,京东商城,三义成1007007008,厨具|茶具、咖啡具|茶宠摆件,三义成茶玩文玩茶宠行运系列 汉白天禄行运,厨具>茶具/咖啡具>茶宠摆件>三义成>三义成茶玩文玩茶宠行运系列 汉白天禄行运,京东商城,三义成1007007008,厨具|茶具、咖啡具|茶宠摆件,三义成茶玩文玩茶宠童趣系列 哥窑尿童,厨具>茶具/咖啡具>茶宠摆件>三义成>三义成茶玩文玩茶宠童趣系列 哥窑尿童,京东商城,三义成1007007008,厨具|茶具、咖啡具|茶宠摆件,三义成茶玩文玩茶宠童趣系列 汝窑组合,厨具>茶具/咖啡具>茶宠摆件>三义成>三义成茶玩文玩茶宠童趣系列 汝窑组合,京东商城,三义成1007007008,厨具|茶具、咖啡具|茶宠摆件,淘瓷公社 汝窑兔子可养开片汝窑茶宠摆件 陶瓷精品汝瓷工艺品 翘耳兔茶宠,厨具>茶具/咖啡具>茶宠摆件>淘瓷公社>淘瓷公社 汝窑兔子可养开片汝窑茶宠摆件 ...,京东商城,淘瓷公社1007007008,厨具|茶具、咖啡具|茶宠摆件,三义成禅趣茶玩茶宠小沙弥系列 哥窑练功,厨具>茶具/咖啡具>茶宠摆件>三义成>三义成禅趣茶玩茶宠小沙弥系列 哥窑练功,京东商城,三义成1007007008,厨具|茶具、咖啡具|茶宠摆件,陶瓷故事 精品宜兴紫砂茶宠摆件知足常乐茶玩茶趣摆件工艺品摆件茶道用品 右脚常乐,家居日用 > 厨房用品 > 水具茶具酒具 > 茶具 > 商品详情,当当网,陶瓷故事