1007004009,厨具|收纳保鲜|餐具笼、餐具架,ASVEL阿司倍鹭餐具架4340,购买任何家居自营商品加购ELLE全棉毛巾礼盒可享60元优惠！请将商品加入购物车， 在订单确认页面输入I7MLFKR9 点此查看如何获得促销优惠 (促销说明),亚马逊(卓越网),ASVEL1007004009,厨具|收纳保鲜|餐具笼、餐具架,心情生活 厨房置物架 调料架 汤瓢架 锅铲架 多功能架 厨房整理餐具架 CSCF0017A,家具>储物家具>储物/收纳用品>心情生活 厨房置物架 调料架 汤瓢架 锅...,京东商城,心情生活家具旗舰店1007004009,厨具|收纳保鲜|餐具笼、餐具架,丽厨 钢镀铬碗碟架 置物架 沥水架 多功能碗碟架 餐具架 接水盘颜色随机LC107A,家装建材>厨房卫浴>厨卫五金/挂件>丽厨>丽厨 钢镀铬碗碟架 置物架 沥水架 多功...,京东商城,星上风盛1007004009,厨具|收纳保鲜|餐具笼、餐具架,海尔(Haier)ZQD100F-8消毒柜 独立式餐具架,整体成型托架,厨卫电器 > 消毒柜 > 海尔 ,国美电器网上商城,1007004009,厨具|收纳保鲜|餐具笼、餐具架,振兴 带盖欧式滴水碗盆 盛碗柜 沥水架 餐具架 封闭碗架 小号 403,所有分类>家居家纺、锅具餐具>厨具锅具>厨房置物架>振兴>振兴 带盖欧式滴水碗...,1号店,振兴1007004009,厨具|收纳保鲜|餐具笼、餐具架,百润 餐具架 ZR575,厨房置物架 > 不锈钢 > ,1号店,百润1007004009,厨具|收纳保鲜|餐具笼、餐具架,好空间置物架碗碟架厨房调味瓶收纳架沥水架餐具架C057,厨具 > 厨房保鲜、收纳 > 厨房置物架 > 碗盘架,亚马逊(卓越网),好空间1007004009,厨具|收纳保鲜|餐具笼、餐具架,诗美嘉 单层餐具架/收纳架/置物架/厨房用整理架 SAE-514,诗美嘉 单层餐具架/收纳架/置物架/厨房...,京东商城,众盟时代1007004009,厨具|收纳保鲜|餐具笼、餐具架,和兴304不锈钢碗架沥水架碗碟架餐具架厨房置物架滤水带盘 二层碗碟架,和兴304不锈钢碗架沥水架碗碟架餐具架厨...,京东商城,泉州和兴旗舰店1007004009,厨具|收纳保鲜|餐具笼、餐具架,简家 厨房多用置物架墙壁置物架汤瓢架多功能架餐具架 K1324,所有分类>家居家纺、锅具餐具>厨具锅具>厨房置物架>简家>简家 厨房多用置物架...,1号店,简家1007004009,厨具|收纳保鲜|餐具笼、餐具架,继红 厨房滴水碗架收纳 置物餐具架 多用碗碟架,所有分类>家居家纺、锅具餐具>厨具锅具>厨房置物架>继红>继红 厨房滴水碗架收...,1号店,继红1007004009,厨具|收纳保鲜|餐具笼、餐具架,hesinly高档顶级304不锈钢厨具锅铲勺套装炒铲饭勺汤勺漏勺餐具笼 炒铲,厨具>烹饪锅具>厨用杂件>hesinly高档顶级304不锈钢厨具锅...,京东商城,合兴利家居馆1007004009,厨具|收纳保鲜|餐具笼、餐具架,hesinly高档顶级304不锈钢厨具锅铲勺套装炒铲饭勺汤勺漏勺餐具笼 漏杓,厨具>烹饪锅具>厨用杂件>hesinly高档顶级304不锈钢厨具锅...,京东商城,合兴利家居馆1007004009,厨具|收纳保鲜|餐具笼、餐具架,NEWREA 新锐/筷笼/乌木筷子筒/餐具架/工艺品/节日礼品,厨具>餐具>筷勺/刀叉>信柏SURPAQ >NEWREA 新锐/筷笼/乌木筷子筒/餐...,京东商城,卡冉柏家居专营店1007004009,厨具|收纳保鲜|餐具笼、餐具架,糖果色三格餐具筷子盒沥水筷子笼餐具架置物架勺叉餐具盒带接水盒 (蓝色),厨具 > 厨房保鲜、收纳 > 厨房置物架 > 筷笼,亚马逊(卓越网),淘乐士1007004009,厨具|收纳保鲜|餐具笼、餐具架,业达豪华餐具架,所有分类>家居家纺、锅具餐具>厨具锅具>厨房置物架>业达>业达豪华餐具架,1号店,业达1007004009,厨具|收纳保鲜|餐具笼、餐具架,家逸 多功能层架 置物架 大空间收纳架 书报架 橱房餐具架 宜家书柜 花架 书架RF109,首页>家居/家装建材/厨具>家具>书房家具>家逸多功能层架置物架大空间收纳...,苏宁,家逸家居1007004009,厨具|收纳保鲜|餐具笼、餐具架,淘乐士 多功能刀架砧板菜板架筷子餐具架杯子架 厨房收纳置物架 铁艺挂架,所有分类>家居家纺、锅具餐具>厨具锅具>厨房置物架>淘乐士>淘乐士 多功能刀架砧...,1号店,淘乐士1007004009,厨具|收纳保鲜|餐具笼、餐具架,瑾瑜御瓷 景德镇陶瓷筷子筒防霉花色筷笼创意带铁架骨瓷餐具笼 C款,厨具 > 餐具 > 筷子,亚马逊(卓越网),瑾瑜御瓷1007004009,厨具|收纳保鲜|餐具笼、餐具架,简家 多彩果蔬水槽沥水架滴水洗菜洗碗置物架厨房餐具架C1496,家居日用 > 厨房用品 > 厨房杂件 > 置物架 > 商品详情,当当网,简家1007004009,厨具|收纳保鲜|餐具笼、餐具架,维艾 超厚不锈钢筷筒/筷子筒/餐具笼/架/筷子盒厨房餐饮用具品,厨具 > 厨房保鲜、收纳 > 厨房置物架 > 筷笼,亚马逊(卓越网),NEWAIR 维艾1007004009,厨具|收纳保鲜|餐具笼、餐具架,金利娴 厨房滴水碗架沥水收纳架碗架子餐具架多用碗碟架JL2179绿色,金利>金利娴 厨房滴水碗架沥水收纳架碗架子餐具...,京东商城,尚庭美家生活馆1007004009,厨具|收纳保鲜|餐具笼、餐具架,日光生活 多功能碗碟架，金属双层餐具架，大容量，抗磨损，不沾水，耐久实用，历久如新,首页 > 日光生活HIKARI家居专场 > 多功能碗碟架,唯品会,无1007004009,厨具|收纳保鲜|餐具笼、餐具架,淘乐士 宜家风格创意日式波浪锅盖架 厨房汤勺餐具架 防滑置物架 （4色各一个 4个装）,厨具>厨房配件>储物/置物架>淘乐士>淘乐士 宜家风格创意日式波浪锅盖架 厨房...,京东商城,陶钰源家居专营店1007004009,厨具|收纳保鲜|餐具笼、餐具架,煌鹰 不锈钢 筷子筒 筷子篮 餐具笼 冲孔 HY1646 小号,厨具>厨房配件>储物/置物架>煌鹰>煌鹰 不锈钢 筷子筒 筷子篮 餐具笼 冲...,京东商城,煌鹰家居1007004009,厨具|收纳保鲜|餐具笼、餐具架,dehub 超级吸盘筷子筒 沥水通风吸壁式餐具架 刀叉勺子收纳盒 防水干燥卫生 白色,所有分类>家居家纺、锅具餐具>厨具锅具>厨房收纳>筷笼>dehub>dehub 超级吸盘...,1号店,dehub1007004009,厨具|收纳保鲜|餐具笼、餐具架,振兴 筷子筒 四格餐具筒 优质食品级PP原料餐具架YH5892 餐具笼 筷子笼,所有分类>家居家纺、锅具餐具>厨具锅具>厨房收纳>筷笼>振兴>振兴 筷子筒 四格餐...,1号店,振兴1007004009,厨具|收纳保鲜|餐具笼、餐具架,藏乐单层塑料碗架沥水架大号沥水篮厨房餐具架碗碟架碗盘滴水架柜 粉红色,厨具>厨房配件>储物/置物架>藏乐（Cangle）>藏乐单层塑料碗架沥水架大号沥水篮厨房餐具...,京东商城,文武家居生活馆1007004009,厨具|收纳保鲜|餐具笼、餐具架,金利娴子分格餐具笼 创意餐具盒子筷子盒筷子筒 沥水塑料筷子盒子 绿色,厨具>厨房配件>储物/置物架> 金利娴子>金利娴子分格餐具笼 创意餐具盒子筷子盒筷...,京东商城,墨森家居专营店1007004009,厨具|收纳保鲜|餐具笼、餐具架,开馨宝 家英大号滴水碗盆收纳架 沥水碗架 厨房置物架 餐具架 收纳框,所有分类>家居家纺、锅具餐具>厨具锅具>厨房置物架>开馨宝>开馨宝 家英大号滴水...,1号店,开馨宝1007004009,厨具|收纳保鲜|餐具笼、餐具架,千顺陶瓷欧式筷子筒沥水筷子笼创意陶瓷厨房置物架优质陶瓷餐具笼 紫荆花筷子筒,厨具>餐具>筷勺/刀叉> 千顺>千顺陶瓷欧式筷子筒沥水筷子笼创意陶瓷厨房...,京东商城,千顺陶瓷1007004009,厨具|收纳保鲜|餐具笼、餐具架,好空间置物架碗碟架厨房调味瓶收纳架沥水架餐具架,家具>餐厅家具>餐边柜>好空间>好空间置物架碗碟架厨房调味瓶收纳架沥水架...,京东商城,欣圣佳美家居专营店1007004009,厨具|收纳保鲜|餐具笼、餐具架,瑞帝厨房置物架 微波炉架 碗碟架 整理储物收纳架角架 电器层架餐具架 烤漆 长60宽37高93四层,家具>储物家具>层架/置物架>瑞帝（RUIDI）>瑞帝厨房置物架 微波炉架 碗碟架 整理储...,京东商城,瑞帝专营店1007004009,厨具|收纳保鲜|餐具笼、餐具架,普润 不锈钢伸缩水槽沥水架洗菜篮 厨房置物架 碗架 餐具架 沥水架滴水架碗具碟子架 绿色 W9107,首页>家居/家装建材/厨具>餐厨用具>收纳/储物>普润不锈钢伸缩水槽沥水架洗菜篮厨...,苏宁,普润1007004009,厨具|收纳保鲜|餐具笼、餐具架,JM  优质S型碗碟架，双层餐具架，大容量，抗磨损，不沾水，耐久实用，历久如新,首页 > JM家居用品专场 > 优质S型碗碟架，双层餐具架，大容量，抗磨损，不沾水，耐久实用，历久如新,唯品会,无1007004009,厨具|收纳保鲜|餐具笼、餐具架,Living MORE 厨用好帮手折叠餐具架,首页 > Living MORE家居专场 > 厨用好帮手折叠餐具架,唯品会,无1007004009,厨具|收纳保鲜|餐具笼、餐具架,唐宗 日式厨具木质 大汤勺饭勺 餐具架 不粘锅木铲 六件套装+送铁架,厨具>厨房配件>厨房DIY/小工具> 唐宗>唐宗 日式厨具木质 大汤勺饭勺 餐具架 ...,京东商城,唐宗家居专营店1007004009,厨具|收纳保鲜|餐具笼、餐具架,双庆 1002金属餐具架 放碗碟沥水架厨房餐具架,家居日用 > 厨房用品 > 厨房杂件 > 置物架 > 双庆 1002金属餐具架 放碗碟沥水架厨房餐具架,当当网,双庆1007004009,厨具|收纳保鲜|餐具笼、餐具架,超实用实木两格筷子筒 筷子架 餐具架 带沥水孔c154支持全国货到付款,当当网 > 运动户外 > 户外用品 > 野营用品 > 野营家具,当当网,舞神1007004009,厨具|收纳保鲜|餐具笼、餐具架,和兴 正304不锈钢碗碟架厨房用品收纳架餐具架双层碗架沥水架置物架98763,当您购买 1 或由和兴家居旗舰店提供的更多指定商品时，您将免运费获得此商品 点此查看如何获得促销优惠 (促销说明),亚马逊(卓越网),和兴1007004009,厨具|收纳保鲜|餐具笼、餐具架,振兴 厨房滴水碗盆收纳架 餐具架 沥水架 3551 小号,所有分类>家居家纺、锅具餐具>厨具锅具>厨房置物架>振兴>振兴 厨房滴水碗盆收...,1号店,振兴1007004009,厨具|收纳保鲜|餐具笼、餐具架,巢屋居 置物架水槽篮沥水架厨房滴水碗架不锈钢碗碟架餐具架晾碗架 30*30cm 30*30cm,家居装修 > 厨卫用具 > 浴室用具 > 淋浴柱,亚马逊(卓越网),巢屋居1007004009,厨具|收纳保鲜|餐具笼、餐具架,淘乐士 多功能刀架砧板菜板架筷子餐具架杯子架 厨房收纳置物架 铁艺挂架 非不锈钢色 见实物图,家用/类别/厨具/刀剪具/水果分割器,亚马逊(卓越网),淘乐士1007004009,厨具|收纳保鲜|餐具笼、餐具架,淘乐士 振兴创意厨房 台座双格筷子盒 沥水筷子笼餐具架置物架勺叉餐具盒 白色,家用/类别/厨具/餐具/餐勺/汤匙、调羹,亚马逊(卓越网),淘乐士1007004009,厨具|收纳保鲜|餐具笼、餐具架,邑彩居icaiju美厨多功能炫银餐具架沥水架双层碗碟架F003,厨具>烹饪锅具>厨用杂件>邑彩居icaiju美厨多功能炫银餐具架沥...,京东商城,邑彩生活馆1007004009,厨具|收纳保鲜|餐具笼、餐具架,百润 餐具架 筷子筒 筷子架 筷子笼 不锈钢餐具架 厨具架 餐具筒 ZR575,厨具>烹饪锅具>厨用杂件>百润>百润 餐具架 筷子筒 筷子架 筷子笼 不...,京东商城,双诚家居专营店1007004009,厨具|收纳保鲜|餐具笼、餐具架,贸号MOHO-ZOOM新款多功能刀架 砧板架 筷子架 可挂式厨房菜板架 餐具架 杂物架,家居家装>生活日用>收纳用品>上海嘉居>贸号MOHO-ZOOM新款多功能刀架 砧...,京东商城,贸号专营店1007004009,厨具|收纳保鲜|餐具笼、餐具架,艺柳园 多功能层架置物架/收纳架/书报架/餐具架/层架/书柜,艺柳园 多功能层架置物架/收纳架/书报架...,京东商城,家逸家居1007004009,厨具|收纳保鲜|餐具笼、餐具架,淘乐士收纳架厨房浴室折叠置物架多用储物架整理棚收纳架杂物架餐具架4个装,家居家装>生活日用>收纳用品>淘乐士收纳架厨房浴室折叠置物架多用储物架...,京东商城,陶钰源家居专营店1007004009,厨具|收纳保鲜|餐具笼、餐具架,和兴304不锈钢碗架沥水架碗碟架餐具架厨房置物架滤水带盘 三层碗碟架,和兴304不锈钢碗架沥水架碗碟架餐具架厨...,京东商城,泉州和兴旗舰店1007004009,厨具|收纳保鲜|餐具笼、餐具架,振兴 台座筷子盒 /餐具笼/筷子架/筷子盒/筷笼 YH5983,厨具>烹饪锅具>厨用杂件>振兴>振兴 台座筷子盒 /餐具笼/筷子架/筷子...,京东商城,生活演义创意家居1007004009,厨具|收纳保鲜|餐具笼、餐具架,仁品不锈钢筷子筒 沥水筷子笼 筷子架筷盒 创意餐具笼刀叉收纳盒,厨具>烹饪锅具>厨用杂件>仁品>仁品不锈钢筷子筒 沥水筷子笼 筷子架筷盒...,京东商城,铭森专营店1007004009,厨具|收纳保鲜|餐具笼、餐具架,爱尚活LOFALi不锈钢沥水碗碟架碗架双层厨房用具置物架收纳架层架餐具架滴水架NO.288,厨具>烹饪锅具>厨用杂件>爱尚活（LOFALI）>爱尚活LOFALi不锈钢沥水碗碟架碗架双...,京东商城,爱尚活旗舰店1007004009,厨具|收纳保鲜|餐具笼、餐具架,不锈钢汤勺架 酒店火锅店汤勺座餐具架 天鹅形 厨房置物架 勺子架 BXG00214-1,莫诺（BONUME）>不锈钢汤勺架 酒店火锅店汤勺座餐具架 天...,京东商城,多比家居旗舰店1007004009,厨具|收纳保鲜|餐具笼、餐具架,爱尚绿点 多功能S型双层碗碟架 厨房置物架 9字型碗架 金属碗架 餐具架 RA001,厨具>烹饪锅具>厨用杂件>爱尚绿点（isungreen） >爱尚绿点 多功能S型双层碗碟架 厨房置物...,京东商城,爱尚绿点家居生活馆1007004009,厨具|收纳保鲜|餐具笼、餐具架,慈氏 筷子笼 不锈钢刀叉筒 可挂式沥水置物架 餐具笼 筷子收纳架,所有分类>家居家纺、锅具餐具>厨具锅具>厨房收纳>筷笼>慈氏>慈氏 筷子笼 不锈钢...,1号店,慈氏1007004009,厨具|收纳保鲜|餐具笼、餐具架,汇丰信佳 日式创意 塑料滴水碗碟收纳架 滴水滤水沥水碗架餐具架,所有分类>家居家纺、锅具餐具>厨具锅具>厨房收纳>其他厨房收纳>汇丰信佳>汇丰信佳 日式创意 ...,1号店,汇丰信佳1007004009,厨具|收纳保鲜|餐具笼、餐具架,宅人帮 企鹅造型金属砧板刀架 餐具架 餐具置物架 厨房收纳架沥水架,所有分类>家居家纺、锅具餐具>厨具锅具>厨房置物架>宅人帮>宅人帮 企鹅造型金属砧板刀架 餐具架 餐具置物架 厨房收纳架沥水架,1号店,宅人帮1007004009,厨具|收纳保鲜|餐具笼、餐具架,千顺陶瓷欧式筷子筒沥水筷子笼创意陶瓷厨房置物架优质陶瓷餐具笼 糖果包包,厨具>餐具>筷勺/刀叉>千顺>千顺陶瓷欧式筷子筒沥水筷子笼创意陶瓷厨房...,京东商城,千顺陶瓷1007004009,厨具|收纳保鲜|餐具笼、餐具架,锐佳 超厚实大号 食品级别304不锈钢 筷子筒 筷子架 餐具笼 筷筒筷子盒 勺筷桶 勺筷架,厨具>厨房配件>储物/置物架>锐佳>锐佳 超厚实大号 食品级别304不锈钢 ...,京东商城,淘易家居1007004009,厨具|收纳保鲜|餐具笼、餐具架,沃德百惠 高端单层不锈钢碗碟架 沥水架沥水篮碗筷架餐具笼餐具架,厨具>厨房配件>储物/置物架>沃德百惠>沃德百惠 高端单层不锈钢碗碟架 沥水架沥...,京东商城,沃德百惠旗舰店1007004009,厨具|收纳保鲜|餐具笼、餐具架,日本进口碗架厨房滴水碗盘架餐具架沥水架大号051868 白色 蓝色,厨具>厨房配件>储物/置物架> FaSoLa>日本进口碗架厨房滴水碗盘架餐具架沥水架大...,京东商城,川木家居用品专营店1007004009,厨具|收纳保鲜|餐具笼、餐具架,瑞帝RUIDI 瑞帝厨房置物架微波炉架碗碟架整理储物收纳架角架电器层架餐具架三层烤漆,所有分类>家居家纺、锅具餐具>家具家装>架类>搁板/置物架>瑞帝RUIDI>瑞帝RUIDI 瑞帝...,1号店,瑞帝RUIDI1007004009,厨具|收纳保鲜|餐具笼、餐具架,LivingMORE  厨用好帮手折叠餐具架,首页 > Living MORE家居专场 > 厨用好帮手折叠餐具架,唯品会,无1007004009,厨具|收纳保鲜|餐具笼、餐具架,JUNQUAN/君泉 厨房 不锈钢 多功能 置物架 菜刀架 调料架 餐具架 筷子筒 400mm单杯 刀架,首页>家居/家装建材/厨具>厨卫装修>厨卫挂件/五金>JUNQUAN/君泉厨房不锈钢...,苏宁,君泉(JunQuan)1007004009,厨具|收纳保鲜|餐具笼、餐具架,Living MORE 厨用好帮手折叠餐具架,首页 > Living MORE家居专场 > 厨用好帮手折叠餐具架,唯品会,无1007004009,厨具|收纳保鲜|餐具笼、餐具架,可丽纳特不锈钢厨房双层置物架收纳架带筷子笼碗碟架餐具架接水盘KC013-800免费送货,厨具 > 厨房收纳、搁置 > 收纳盒、蓝、筐 ,亚马逊(卓越网),1007004009,厨具|收纳保鲜|餐具笼、餐具架,艺柳园 多功能层架置物架/收纳架/书报架/餐具架/宜家层架/逸家书柜 三层110,家具>储物家具>层架/置物架>艺柳园 多功能层架置物架/收纳架/书报架...,京东商城,艺柳园韩式家居1007004009,厨具|收纳保鲜|餐具笼、餐具架,诗诺雅 厨房双层盘子架碗筷沥水架带托盘 不锈钢S放碗碟架餐具架S型碗碟架,家居生活、运动保健>厨具锅具>厨房置物架,1号店,诗诺雅1007004009,厨具|收纳保鲜|餐具笼、餐具架,SINOART 诗诺雅 厨王-多功能餐具架20314,家用/类别/家居/家具/餐厨家具/餐具架,亚马逊(卓越网),SINOART 诗诺雅1007004009,厨具|收纳保鲜|餐具笼、餐具架,淘乐士 宜家风格创意日式波浪锅盖架 厨房汤勺餐具架 防滑置物架 橙黄色,家用/类别/厨具/餐具/餐勺/汤匙、调羹,亚马逊(卓越网),淘乐士1007004009,厨具|收纳保鲜|餐具笼、餐具架,千顺陶瓷欧式筷子筒沥水筷子笼创意陶瓷厨房置物架优质陶瓷餐具笼 春色满园,厨具>餐具>筷勺/刀叉>千顺>千顺陶瓷欧式筷子筒沥水筷子笼创意陶瓷厨房...,京东商城,千顺陶瓷1007004009,厨具|收纳保鲜|餐具笼、餐具架,特为尼（TEVINI） 铁艺 碗架 置物架 沥水架 碗碟收纳架收纳碗架餐具架 T006B,家装建材>厨房卫浴>厨卫五金/挂件>特为尼（TEVINI） 铁艺 碗架 置物...,京东商城,特为尼建材家居馆1007004009,厨具|收纳保鲜|餐具笼、餐具架,千团精工 不锈 钢碗架/沥水架/双层碗碟架餐具架厨房置物架,家居日用 > 保鲜收纳 > 油壶 > 千团精工,国美电器网上商城,千团精工1007004009,厨具|收纳保鲜|餐具笼、餐具架,宝优妮厨房挂件象牙色塑料厨房置物架角架调味瓶架收纳架餐具笼刀架1207,家具建材>厨房挂件>宝优妮>宝优妮厨房挂件象牙色塑料厨房置物架角架调味瓶架收纳架餐具笼刀架1207,国美电器网上商城,宝优妮家居旗舰店1007004009,厨具|收纳保鲜|餐具笼、餐具架,艾能 不易生锈单层碗碟架 碗盘沥水架厨房置物架 餐具架,所有分类>家居家纺、锅具餐具>收纳洗晒>收纳层架>收纳架>艾能>艾能 不易生锈单层碗...,1号店,艾能1007004009,厨具|收纳保鲜|餐具笼、餐具架,易时代 挂壁餐具架 强力吸盘筷子笼/刀叉架 厨房沥水筷子筒 挂壁餐具架,厨具 > 厨房收纳 > 厨房置物架 > 多功能挂架,亚马逊(卓越网),易时代1007004009,厨具|收纳保鲜|餐具笼、餐具架,洁夫人 餐具架 置物架,家居家装>生活日用>浴室用品>寰宇>洁夫人 餐具架 置物架,京东商城,寰宇奢品专营店1007004009,厨具|收纳保鲜|餐具笼、餐具架,淘乐士 创意厨房 台座双格筷子盒 沥水筷子笼餐具架置物架勺叉餐具盒 2个装,所有分类>家居家纺、锅具餐具>厨具锅具>厨房工具>其他厨房工具>淘乐士>淘乐士 创意厨房 台...,1号店,淘乐士1007004009,厨具|收纳保鲜|餐具笼、餐具架,NEWREA 新锐 筷笼 小叶红檀 筷子筒 餐具架 工艺品礼品 KLHT-F/1S,厨具>餐具>筷勺/刀叉>信柏SURPAQ >NEWREA 新锐 筷笼 小叶红檀 筷子...,京东商城,晟维家居专营店1007004009,厨具|收纳保鲜|餐具笼、餐具架,糖果色三格餐具筷子盒沥水筷子笼餐具架置物架勺叉餐具盒带接水盒 蓝色,厨具>厨房配件>储物/置物架>淘乐士>糖果色三格餐具筷子盒沥水筷子笼餐具架置物...,京东商城,陶钰源家居专营店1007004009,厨具|收纳保鲜|餐具笼、餐具架,好空间置物架碗碟架厨房调味瓶收纳架沥水架餐具架,厨具>厨房配件>储物/置物架>好空间>好空间置物架碗碟架厨房调味瓶收纳架沥水架...,京东商城,欣圣佳美家居专营店1007004009,厨具|收纳保鲜|餐具笼、餐具架,藏乐单层塑料碗架沥水架大号沥水篮厨房餐具架碗碟架碗盘滴水架柜 白色,厨具>厨房配件>储物/置物架>藏乐（Cangle）>藏乐单层塑料碗架沥水架大号沥水篮厨房餐具...,京东商城,文武家居生活馆1007004009,厨具|收纳保鲜|餐具笼、餐具架,金利娴子分格餐具笼 创意餐具盒子筷子盒筷子筒 沥水塑料筷子盒子 粉红色,厨具>厨房配件>储物/置物架> 金利娴子>金利娴子分格餐具笼 创意餐具盒子筷子盒筷...,京东商城,墨森家居专营店1007004009,厨具|收纳保鲜|餐具笼、餐具架,千奇QIANQI 滴水碗架 厨房置物架 沥水架 大号餐具架 收纳碗碟架买一送十,所有分类>家居家纺、锅具餐具>厨具锅具>厨房置物架>千奇QIANQI>千奇QIANQI 滴...,1号店,千奇QIANQI1007004009,厨具|收纳保鲜|餐具笼、餐具架,菲迪拉（FIDLA） 餐具架 圆形可手提 809,厨具>厨房配件>储物/置物架> 菲迪拉（FIDLA）>菲迪拉餐具架,京东商城,菲迪拉（FIDLA）1007004009,厨具|收纳保鲜|餐具笼、餐具架,红兔子 不锈钢伸缩水槽沥水架洗菜篮 厨房置物架 碗架 餐具架 沥水架滴水架碗具碟子架 绿色,厨具>厨房配件>储物/置物架> 文博>红兔子 不锈钢伸缩水槽沥水架洗菜篮 厨房...,京东商城,天瑞家居专营店1007004009,厨具|收纳保鲜|餐具笼、餐具架,JM 优质S型碗碟架，双层餐具架，大容量，抗磨损，不沾水，耐久实用，历久如新,首页 > JM家居用品专场 > 优质S型碗碟架，双层餐具架，大容量，抗磨损，不沾水，耐久实用，历久如新,唯品会,无1007004009,厨具|收纳保鲜|餐具笼、餐具架,振兴台座餐具架 筷子架 置物架 筷架 餐具盒家庭厨房餐具架,当当网 > 家居日用 > 厨房用品 > 碗盘餐具,当当网,1007004009,厨具|收纳保鲜|餐具笼、餐具架,收纳碗架 餐具架 防震 透明 中号日本进口,当当网 > 家居日用 > 厨房用品 > 置物架,当当网,生活锦囊1007004009,厨具|收纳保鲜|餐具笼、餐具架,樱花之秀AE-516 多功能餐具架,家居 > 家具 > 餐厨家具 > 餐具架,亚马逊(卓越网),樱花之秀1007004009,厨具|收纳保鲜|餐具笼、餐具架,【工厂直营】韩式浪漫田园多功能四层置物架 收纳架 书报架 餐具架 层架,家具家装 > 家具 > 层架,当当网,家逸1007004009,厨具|收纳保鲜|餐具笼、餐具架,家逸多功能三层置物架/收纳架/书报架/餐具架/层架/书柜 RF-CGA-007 白色,家用/类别/家居/收纳用品/收纳架/书报架,亚马逊(卓越网),家逸1007004009,厨具|收纳保鲜|餐具笼、餐具架,家逸多功能四层置物架/收纳架/书报架/餐具架/层架/书柜 RF-CGA-008 白色,家用/类别/家居/收纳用品/收纳架/书报架,亚马逊(卓越网),家逸1007004009,厨具|收纳保鲜|餐具笼、餐具架,手信 厨具精品 小猫筷子架 餐具架 时尚家居小摆件 新奇特 可爱创意,厨具 > 餐具,亚马逊(卓越网),手信1007004009,厨具|收纳保鲜|餐具笼、餐具架,洁夫人 餐具架 置物架 有使用视频,家居家装>生活日用>浴室用品>洁夫人 餐具架 置物架 有使用视频,京东商城,亨特福旗舰店1007004009,厨具|收纳保鲜|餐具笼、餐具架,易时代 多功能餐具架 ZXD0015 强力吸盘筷子笼 刀叉架 厨房粘钩 筷子筒 防水免钉,所有分类>家居家纺、锅具餐具>厨具锅具>厨房收纳>筷笼>易时代>易时代 多功能餐具架...,1号店,易时代1007004009,厨具|收纳保鲜|餐具笼、餐具架,千顺时尚陶瓷筷子筒 防霉沥水妙曼花香筷笼 创意带铁架骨瓷餐具笼 妙曼花香,厨具>餐具>筷勺/刀叉>千顺>千顺时尚陶瓷筷子筒 防霉沥水妙曼花香筷笼...,京东商城,千顺陶瓷1007004009,厨具|收纳保鲜|餐具笼、餐具架,艺柳园 多功能层架置物架 /收纳架/书报架/餐具架/层架/书柜/逸家/宜家 三层110,家具>储物家具>层架/置物架>艺柳园>艺柳园 多功能层架置物架 /收纳架/书报...,京东商城,艺柳园韩式家居1007004009,厨具|收纳保鲜|餐具笼、餐具架,SURKR 韩国进口 politi 韩式陶瓷汤勺 汤勺架 汤勺座 餐具架 勺子架 一套,厨具 > 餐具 > 餐勺 > 汤匙、调羹,亚马逊(卓越网),SURKR