1007007001,厨具|茶具、咖啡具|整套茶具,百鸿 陶瓷茶具套装 万字佛印 整套功夫茶具 茶壶 公道杯 茶杯 四方平安 DTG76349A084,厨具>茶具/咖啡具>整套茶具>百鸿>百鸿 陶瓷茶具套装 万字佛印 整套功夫...,京东商城,百鸿旗舰店1007007001,厨具|茶具、咖啡具|整套茶具,百鸿 大富陶瓷功夫茶具套装三色DTRY080K2 红色,厨具>茶具/咖啡具>整套茶具>百鸿>百鸿 大富陶瓷功夫茶具套装三色DTRY0...,京东商城,百鸿旗舰店1007007001,厨具|茶具、咖啡具|整套茶具,御雕坊景德镇陶瓷防烫隔热茶杯茶壶青花釉中彩家居双层茶具套装 CJJJ-02LX 和为贵,厨具>茶具/咖啡具>整套茶具>御雕坊景德镇陶瓷防烫隔热茶杯茶壶青花釉中...,京东商城,御雕坊陶瓷旗舰店1007007001,厨具|茶具、咖啡具|整套茶具,百鸿 汝窑茶具 天青/月白 陶瓷茶具 乌金石茶盘 高档茶具套装TZ-DTRY082K2 天青色,厨具>茶具/咖啡具>整套茶具>百鸿>百鸿 汝窑茶具 天青/月白 陶瓷茶具 乌...,京东商城,百鸿旗舰店1007007001,厨具|茶具、咖啡具|整套茶具,百鸿 汝窑茶具套装 整套汝窑功夫茶具套装乌金石茶盘茶具套装TZ-DTRY081K2 月白,厨具>茶具/咖啡具>整套茶具>百鸿>百鸿 汝窑茶具套装 整套汝窑功夫茶具套装...,京东商城,百鸿旗舰店1007007001,厨具|茶具、咖啡具|整套茶具,一屋窑 欧式耐热玻璃冲茶器水壶水杯 玻璃茶具套装 耐高温防爆裂 一壶四杯,厨具>茶具/咖啡具>整套茶具>一屋窑>一屋窑 欧式耐热玻璃冲茶器水壶水杯 玻璃...,京东商城,夏至家居1007007001,厨具|茶具、咖啡具|整套茶具,御雕坊景德镇陶瓷器青花葡萄提梁壶茶具套装 CJJJ-02MD 富贵牡丹,厨具>茶具/咖啡具>整套茶具>御雕坊>御雕坊景德镇陶瓷器青花葡萄提梁壶茶具套装...,京东商城,御雕坊陶瓷旗舰店1007007001,厨具|茶具、咖啡具|整套茶具,尚帝 龙泉青瓷茶具套装 浮雕龙凹凸金边青瓷祥云龙茶具G76157088,厨具>茶具/咖啡具>整套茶具>尚帝（shangdi）>尚帝 龙泉青瓷茶具套装 浮雕龙凹凸金边青...,京东商城,尚帝旗舰店1007007001,厨具|茶具、咖啡具|整套茶具,三义成茶具景德镇手绘青花5头布衣图金钟壶功夫茶具套装,厨具>茶具/咖啡具>整套茶具>三义成>三义成茶具景德镇手绘青花5头布衣图金钟壶...,京东商城,三义成1007007001,厨具|茶具、咖啡具|整套茶具,尚帝 仿古田园式粗陶茶具陶瓷功夫茶具套装DTDZYX55,厨具>茶具/咖啡具>整套茶具>尚帝 仿古田园式粗陶茶具陶瓷功夫茶具套装...,京东商城,尚帝旗舰店1007007001,厨具|茶具、咖啡具|整套茶具,尚帝 汝窑茶具 汝窑陶瓷茶具套装 整套功夫茶具DTRY082K2 月白色,厨具>茶具/咖啡具>整套茶具>尚帝（shangdi）>尚帝 汝窑茶具 汝窑陶瓷茶具套装 整套功...,京东商城,尚帝旗舰店1007007001,厨具|茶具、咖啡具|整套茶具,尚帝 紫砂茶具宜兴紫砂功夫套装24件套 DTZ1Y050,厨具>茶具/咖啡具>整套茶具>尚帝（shangdi）>尚帝 紫砂茶具宜兴紫砂功夫套装24件套 ...,京东商城,尚帝旗舰店1007007001,厨具|茶具、咖啡具|整套茶具,雪狼 精品陶土茶具 稻草烧 醒狮 茶壶套组 高级健康茶具 品茶茗器 HT,厨具>茶具/咖啡具>整套茶具>雪狼（snowwolf）>雪狼 精品陶土茶具 稻草烧 醒狮 茶壶套...,京东商城,苗苗红家居礼品1007007001,厨具|茶具、咖啡具|整套茶具,尚帝 亭窑陶瓷茶具套装 整套功夫茶具陶瓷茶具套装 整套功夫茶具DT1STY55,厨具>茶具/咖啡具>整套茶具>尚帝（shangdi）>尚帝 亭窑陶瓷茶具套装 整套功夫茶具陶瓷...,京东商城,尚帝旗舰店1007007001,厨具|茶具、咖啡具|整套茶具,尚帝 大富陶瓷功夫茶具套装三色DTRY080K2 红,厨具>茶具/咖啡具>整套茶具>尚帝（shangdi）>尚帝 大富陶瓷功夫茶具套装三色DTRY0...,京东商城,尚帝旗舰店1007007001,厨具|茶具、咖啡具|整套茶具,尚帝 苏式茶具套装 陶瓷功夫茶具 茶具酒具酒器青蓝三角杯送礼 DTG76150A084,厨具>茶具/咖啡具>整套茶具>尚帝 苏式茶具套装 陶瓷功夫茶具 茶具酒...,京东商城,尚帝旗舰店1007007001,厨具|茶具、咖啡具|整套茶具,尚帝 创意陶瓷茶具套装 功夫茶具瓷器 整套茶具 勇攀高峰两色 DTG76186A055 白,厨具>茶具/咖啡具>整套茶具>尚帝（shangdi）>尚帝 创意陶瓷茶具套装 功夫茶具瓷器 整...,京东商城,尚帝旗舰店1007007001,厨具|茶具、咖啡具|整套茶具,唐丰茶具套装功夫茶具茶壶套装整套TF-1095 上善若水-一帆风顺,厨具>茶具/咖啡具>整套茶具>信柏SURPAQ >唐丰茶具套装功夫茶具茶壶套装整套TF-1...,京东商城,臻茗尚品茶艺轩1007007001,厨具|茶具、咖啡具|整套茶具,唐丰功夫茶具茶具套装 高档整套TF-1280 黑檀象吉-汝窑巧云,厨具>茶具/咖啡具>整套茶具>信柏SURPAQ >唐丰功夫茶具茶具套装 高档整套TF-12...,京东商城,臻茗尚品茶艺轩1007007001,厨具|茶具、咖啡具|整套茶具,御雕坊景德镇陶瓷青花釉中彩功夫茶具套装 CJ-GF02 青彩荷花,厨具>茶具/咖啡具>整套茶具>御雕坊景德镇陶瓷青花釉中彩功夫茶具套装 ...,京东商城,御雕坊陶瓷旗舰店1007007001,厨具|茶具、咖啡具|整套茶具,欧凯隆景德镇陶瓷器功夫茶具8头礼品大茶盘茶具套装 中国红釉金吉祥如意,厨具>茶具/咖啡具>整套茶具>欧凯隆景德镇陶瓷器功夫茶具8头礼品大茶盘...,京东商城,欧凯隆旗舰店1007007001,厨具|茶具、咖啡具|整套茶具,祥福 整套旅行功夫茶具套装 简约便携式竹制茶盘 带紫砂茶壶陶瓷茶杯 TZ003 利用厚生,厨具>茶具/咖啡具>整套茶具>祥福>祥福 整套旅行功夫茶具套装 简约便携式竹...,京东商城,祥福官方旗舰店1007007001,厨具|茶具、咖啡具|整套茶具,关耳窑8选1高档紫砂茶具 整套功夫茶具茶盘套装ZT-YS13102 养神虎啸套装,厨具>茶具/咖啡具>整套茶具>关耳窑>关耳窑8选1高档紫砂茶具 整套功夫茶具茶...,京东商城,关耳窑旗舰店1007007001,厨具|茶具、咖啡具|整套茶具,关耳窑 整套茶具 陶瓷套装 双龙戏珠杯架 电磁炉茶盘TZ-G75806A064 杯架双龙戏珠茶盘(田园),厨具>茶具/咖啡具>整套茶具>关耳窑>关耳窑 整套茶具 陶瓷套装 双龙戏珠杯架...,京东商城,关耳窑旗舰店1007007001,厨具|茶具、咖啡具|整套茶具,关耳窑 茶具套装 6款 黑檀木茶盘陶瓷功夫茶具套装TZ-G76065A076 黑檀腾龙套装(福字金边),厨具>茶具/咖啡具>整套茶具>关耳窑>关耳窑 茶具套装 6款 黑檀木茶盘陶瓷功...,京东商城,关耳窑旗舰店1007007001,厨具|茶具、咖啡具|整套茶具,百鸿 功夫茶具陶瓷茶具套装 整套实木茶盘TZ-M12K581 鹭栖,厨具>茶具/咖啡具>整套茶具>百鸿 功夫茶具陶瓷茶具套装 整套实木茶盘...,京东商城,百鸿旗舰店1007007001,厨具|茶具、咖啡具|整套茶具,百鸿 宜兴紫砂壶 紫砂功夫茶具套装DTZ3F002,厨具>茶具/咖啡具>整套茶具>百鸿 宜兴紫砂壶 紫砂功夫茶具套装DTZ...,京东商城,百鸿旗舰店1007007001,厨具|茶具、咖啡具|整套茶具,百鸿 千禧龙树脂茶盘 宜兴紫砂茶具套装Z-8KSZBST 荷叶佛汝窑,厨具>茶具/咖啡具>整套茶具>百鸿 千禧龙树脂茶盘 宜兴紫砂茶具套装Z...,京东商城,百鸿旗舰店1007007001,厨具|茶具、咖啡具|整套茶具,关耳窑 千禧龙树脂茶盘 宜兴紫砂茶具套装Z-8KSZBST 布袋佛-手写唐诗套装,厨具>茶具/咖啡具>整套茶具>关耳窑>关耳窑 千禧龙树脂茶盘 宜兴紫砂茶具套装...,京东商城,关耳窑旗舰店1007007001,厨具|茶具、咖啡具|整套茶具,鑫德鸿窑 整套宜兴紫砂功夫茶具套装 配四合一触摸式电磁炉实木茶盘茶具组合TZ015 祥云+电磁炉,厨具>茶具/咖啡具>整套茶具>鑫德鸿窑 整套宜兴紫砂功夫茶具套装 配四...,京东商城,皇茗旗舰店1007007001,厨具|茶具、咖啡具|整套茶具,关耳窑 青龙酒器套装 陶瓷玉瓷茶具DTG76035A085,厨具>茶具/咖啡具>整套茶具>关耳窑 青龙酒器套装 陶瓷玉瓷茶具DTG...,京东商城,关耳窑旗舰店1007007001,厨具|茶具、咖啡具|整套茶具,关耳窑 龙泉青瓷茶具套装 功夫茶具整套瓷器 祥云龙 手抓盖碗 茶杯套装绿 DTG75985A063,厨具>茶具/咖啡具>整套茶具>关耳窑 龙泉青瓷茶具套装 功夫茶具整套瓷...,京东商城,关耳窑旗舰店1007007001,厨具|茶具、咖啡具|整套茶具,雪狼 茶具套装家用红茶茶具花茶茶具祥龙献瑞鱼头壶茶具组 RY,厨具>茶具/咖啡具>整套茶具>雪狼（snowwolf）>雪狼 茶具套装家用红茶茶具花茶茶具祥龙献...,京东商城,苗苗红家居礼品1007007001,厨具|茶具、咖啡具|整套茶具,御雕坊景德镇陶瓷器7头高档釉上彩双层居家茶具套装花之君子 CJJJ-01JZ,厨具>茶具/咖啡具>整套茶具>御雕坊景德镇陶瓷器7头高档釉上彩双层居家...,京东商城,御雕坊陶瓷旗舰店1007007001,厨具|茶具、咖啡具|整套茶具,鑫德鸿窑 整套茶具 乌金石茶盘 茶托 汝窑功夫茶具 黑金石套装组 TZ016 黑色,厨具>茶具/咖啡具>整套茶具>鑫德鸿窑>鑫德鸿窑 整套茶具 乌金石茶盘 茶托 汝...,京东商城,皇茗旗舰店1007007001,厨具|茶具、咖啡具|整套茶具,百鸿 整套茶具茶盘套装 大富陶瓷功夫茶具T-CMPZ3S 黄,厨具>茶具/咖啡具>整套茶具>百鸿 整套茶具茶盘套装 大富陶瓷功夫茶具...,京东商城,百鸿旗舰店1007007001,厨具|茶具、咖啡具|整套茶具,百鸿 龙泉青瓷功夫茶具 花梨木茶盘套装TZ-SSCJ009 龙凤吉祥,厨具>茶具/咖啡具>整套茶具>百鸿 龙泉青瓷功夫茶具 花梨木茶盘套装T...,京东商城,百鸿旗舰店1007007001,厨具|茶具、咖啡具|整套茶具,尚帝 黑金龙 陶瓷 茶具套装 实木茶盘 XMTZ-XQB,厨具>茶具/咖啡具>整套茶具>尚帝（shangdi）>尚帝 黑金龙 陶瓷 茶具套装 实木茶盘 ...,京东商城,尚帝旗舰店1007007001,厨具|茶具、咖啡具|整套茶具,关耳窑 哥窑汝窑茶具黑檀木电磁炉茶盘套装TZ-HTJQ007K 秋风扫叶哥窑,厨具>茶具/咖啡具>整套茶具>关耳窑 哥窑汝窑茶具黑檀木电磁炉茶盘套装...,京东商城,关耳窑旗舰店1007007001,厨具|茶具、咖啡具|整套茶具,鑫德鸿窑 瓷器 整套功夫茶具 精品茶具套装 陶瓷 高档礼盒装 TC502 绿色,厨具>茶具/咖啡具>整套茶具>鑫德鸿窑>鑫德鸿窑 瓷器 整套功夫茶具 精品茶具套...,京东商城,皇茗旗舰店1007007001,厨具|茶具、咖啡具|整套茶具,关耳窑 锦绣中华陶瓷功夫茶具 花梨木茶盘电磁炉TZ-B011XM07KK,厨具>茶具/咖啡具>整套茶具>关耳窑>关耳窑 锦绣中华陶瓷功夫茶具 花梨木茶盘...,京东商城,关耳窑旗舰店1007007001,厨具|茶具、咖啡具|整套茶具,关耳窑 陶瓷功夫茶具套装 四合一电磁炉茶盘XMTZ-DTJC007KG,厨具>茶具/咖啡具>整套茶具>关耳窑 陶瓷功夫茶具套装 四合一电磁炉茶...,京东商城,关耳窑旗舰店1007007001,厨具|茶具、咖啡具|整套茶具,尚帝 精品黑金龙 整套陶瓷茶具套装 功夫茶具 精品 XMTZ-XYHJL1,厨具>茶具/咖啡具>整套茶具>尚帝（shangdi）>尚帝 精品黑金龙 整套陶瓷茶具套装 功夫...,京东商城,尚帝旗舰店1007007001,厨具|茶具、咖啡具|整套茶具,百鸿 高档乌金石实木茶盘套装紫砂茶具TZ-A010B041 青花瓷,厨具>茶具/咖啡具>整套茶具>百鸿>百鸿 高档乌金石实木茶盘套装紫砂茶具TZ...,京东商城,百鸿旗舰店1007007001,厨具|茶具、咖啡具|整套茶具,关耳窑 五款陶瓷功夫茶具黑檀木电磁炉茶盘套装TZ-HTJQ008K 青瓷,厨具>茶具/咖啡具>整套茶具>关耳窑>关耳窑 五款陶瓷功夫茶具黑檀木电磁炉茶盘...,京东商城,关耳窑旗舰店1007007001,厨具|茶具、咖啡具|整套茶具,百鸿 紫砂功夫茶具套装 龙凤TYTC-LFCX,厨具>茶具/咖啡具>整套茶具>百鸿 紫砂功夫茶具套装 龙凤TYTC-L...,京东商城,百鸿旗舰店1007007001,厨具|茶具、咖啡具|整套茶具,关耳窑 电磁炉四合一茶盘 实木茶盘套装 龙泉青瓷茶具TZ-SSCJ007 雪花釉,厨具>茶具/咖啡具>整套茶具>关耳窑 电磁炉四合一茶盘 实木茶盘套装 ...,京东商城,关耳窑旗舰店1007007001,厨具|茶具、咖啡具|整套茶具,百鸿 古陶陶瓷茶具套装 陶盖碗茶杯套装XMDT-XQTSYC,厨具>茶具/咖啡具>整套茶具>百鸿 古陶陶瓷茶具套装 陶盖碗茶杯套装X...,京东商城,百鸿旗舰店1007007001,厨具|茶具、咖啡具|整套茶具,百鸿 3款邑窑功夫茶具 高档鸡翅木茶盘套装TZ-JCXXT083A 荷叶,厨具>茶具/咖啡具>整套茶具>百鸿>百鸿 3款邑窑功夫茶具 高档鸡翅木茶盘套...,京东商城,百鸿旗舰店1007007001,厨具|茶具、咖啡具|整套茶具,百鸿 3款功夫茶具茶盘套装 柏木茶味茶盘TZ-XYGXCH004 大富,厨具>茶具/咖啡具>整套茶具>百鸿>百鸿 3款功夫茶具茶盘套装 柏木茶味茶盘...,京东商城,百鸿旗舰店1007007001,厨具|茶具、咖啡具|整套茶具,KAMJOVE/金灶 A系列精品玻璃茶艺套装 8件套礼品装A-305,所有分类>家居家纺、锅具餐具>餐具水具>茶具1>整套茶具>KAMJOVE/金灶>KAMJOVE/金灶...,1号店,KAMJOVE/金灶1007007001,厨具|茶具、咖啡具|整套茶具,天曦 白色陶瓷茶具 东亭煮雪盖碗组 整套功夫茶道用品 带茶杯茶海,所有分类>家居家纺、锅具餐具>餐具水具>茶具1>整套茶具>天曦>天曦 白色陶瓷茶具 ...,1号店,天曦1007007001,厨具|茶具、咖啡具|整套茶具,瑾瑜御瓷 景德镇陶瓷器茶具套装 精致五福临门保证 11头如意茶具,所有分类>家居家纺、锅具餐具>餐具水具>茶具1>整套茶具>瑾瑜御瓷>瑾瑜御瓷 景德镇陶瓷...,1号店,瑾瑜御瓷1007007001,厨具|茶具、咖啡具|整套茶具,万年利 定窑 整套茶具 送礼必备 企鹅茶杯,所有分类>家居家纺、锅具餐具>餐具水具>茶具1>整套茶具>万年利>万年利 定窑 整套...,1号店,万年利1007007001,厨具|茶具、咖啡具|整套茶具,百鸿 茶味实木茶盘 3款紫砂茶具茶盘套装 整套茶具 功夫茶具套装TZ-XYGXCH004 晨曲,首页 >品牌专区 >百鸿 >百鸿 茶味实木茶盘 3款紫砂茶具茶盘套装 整套茶具 功夫茶具套装TZ-XYGXCH004,vjia,百鸿茶具旗舰店1007007001,厨具|茶具、咖啡具|整套茶具,百鸿 5款雕花 陶瓷功夫茶具套装 整套茶具茶盘套装 电磁炉4合1茶盘TZ-HTJQ008K 哥窑,首页 >品牌专区 >百鸿 >百鸿 5款雕花 陶瓷功夫茶具套装 整套茶具茶盘套装 电磁炉4合1茶盘TZ-HTJQ008K,vjia,百鸿茶具旗舰店1007007001,厨具|茶具、咖啡具|整套茶具,百鸿 紫砂茶具 宜兴功夫 茶具套装 电磁炉实木茶盘 整套茶具Z-11U072 红龙,首页 >家居家装 >厨房餐饮 >水具酒具 >百鸿 紫砂茶具 宜兴功夫 茶具套装 电磁炉实木茶盘 整套茶具Z-11U072,vjia,百鸿茶具旗舰店1007007001,厨具|茶具、咖啡具|整套茶具,百鸿 陶盛窑功夫茶具 整套茶具茶盘套装 高档实木茶盘套装乌金石T-CPZSY4K008 b16,首页 >品牌专区 >百鸿 >百鸿 陶盛窑功夫茶具 整套茶具茶盘套装 高档实木茶盘套装乌金石T-CPZSY4K008,vjia,百鸿茶具旗舰店1007007001,厨具|茶具、咖啡具|整套茶具,建窑 台湾建窑 青花小茶壶长托五件组 功夫陶瓷茶具套装 陶瓷茶具,所有分类>家居家纺、锅具餐具>餐具水具>茶具1>整套茶具>建窑>建窑 台湾建窑 青花...,1号店,建窑1007007001,厨具|茶具、咖啡具|整套茶具,关耳窑 红茶功夫茶具 陶瓷茶具实木茶盘套装 T-X6K99X,所有分类>家居家纺、锅具餐具>餐具水具>茶具1>整套茶具>关耳窑>关耳窑 红茶功夫茶具...,1号店,关耳窑1007007001,厨具|茶具、咖啡具|整套茶具,御雕坊景德镇陶瓷器青花釉中彩单层茶具套装 CJJJ-03FG 青花山水,厨具>茶具/咖啡具>整套茶具>御雕坊景德镇陶瓷器青花釉中彩单层茶具套装...,京东商城,御雕坊陶瓷旗舰店1007007001,厨具|茶具、咖啡具|整套茶具,御雕坊景德镇陶瓷器高档提梁壶茶具套装 CJJJ-02MD 兰滕花,厨具>茶具/咖啡具>整套茶具>御雕坊景德镇陶瓷器高档提梁壶茶具套装 C...,京东商城,御雕坊陶瓷旗舰店1007007001,厨具|茶具、咖啡具|整套茶具,精业 景德镇陶瓷大容量提梁壶茶具套装 青花手绘斗彩JD-B033,厨具>茶具/咖啡具>整套茶具>精业 景德镇陶瓷大容量提梁壶茶具套装 青...,京东商城,千汇陶瓷1007007001,厨具|茶具、咖啡具|整套茶具,南岭窑花茶茶具 手绘系列 7头日式提梁茶具 茶壶 陶瓷茶具 大容量 礼盒 兰山水,厨具>茶具/咖啡具>整套茶具>南岭窑花茶茶具 手绘系列 7头日式提梁茶...,京东商城,南岭窑陶瓷旗舰店1007007001,厨具|茶具、咖啡具|整套茶具,关耳窑 陶圣窑功夫茶具 整套茶具茶盘套装XMTZ-XQTSY6K 款式六,关耳窑 陶圣窑功夫茶具 整套茶具茶盘套装...,京东商城,关耳窑旗舰店1007007001,厨具|茶具、咖啡具|整套茶具,精业 青花瓷 景德镇陶瓷 国粹京剧脸谱茶具套装,厨具>茶具/咖啡具>整套茶具>精业 青花瓷 景德镇陶瓷 国粹京剧脸谱茶...,京东商城,千汇陶瓷1007007001,厨具|茶具、咖啡具|整套茶具,悠家良品 青花瓷-暮归 青花瓷茶具 陶瓷玉瓷功夫茶具套装 礼盒装,厨具>茶具/咖啡具>整套茶具>悠家良品 青花瓷-暮归 青花瓷茶具 陶瓷...,京东商城,悠家良品旗舰店1007007001,厨具|茶具、咖啡具|整套茶具,唐丰高档茶具 黑金乌金石茶盘电磁炉汝窑套装整套TF-6057 第一款,厨具>茶具/咖啡具>整套茶具>唐丰高档茶具 黑金乌金石茶盘电磁炉汝窑套...,京东商城,臻茗尚品茶艺轩1007007001,厨具|茶具、咖啡具|整套茶具,百鸿 陶圣窑功夫茶具 整套陶瓷茶具实木茶盘套装XMTZ-XQTSY3K 款式二,厨具>茶具/咖啡具>整套茶具>百鸿 陶圣窑功夫茶具 整套陶瓷茶具实木茶...,京东商城,百鸿旗舰店1007007001,厨具|茶具、咖啡具|整套茶具,鑫德鸿窑 黑檀四合一电磁炉茶盘 整套茶具 汝窑功夫茶具 茶道配件 TZ018,厨具>茶具/咖啡具>整套茶具>鑫德鸿窑 黑檀四合一电磁炉茶盘 整套茶具...,京东商城,皇茗旗舰店1007007001,厨具|茶具、咖啡具|整套茶具,百鸿 陶圣窑功夫茶具 整套茶具茶盘套装XMTZ-XQTSY6K 款式八,百鸿 陶圣窑功夫茶具 整套茶具茶盘套装X...,京东商城,百鸿旗舰店1007007001,厨具|茶具、咖啡具|整套茶具,雪狼 茶具陶瓷套装 帝王黄牡丹 家用送领导春节礼品 DTY,厨具>茶具/咖啡具>整套茶具>雪狼（snowwolf）>雪狼 茶具陶瓷套装 帝王黄牡丹 家用送领...,京东商城,苗苗红家居礼品1007007001,厨具|茶具、咖啡具|整套茶具,欧凯隆景德镇陶瓷器功夫茶具8头礼品配陶瓷茶盘茶具套装 带茶漏多款花色可选（配礼盒） 龙凤呈祥,厨具>茶具/咖啡具>整套茶具>欧凯隆景德镇陶瓷器功夫茶具8头礼品配陶瓷...,京东商城,欧凯隆旗舰店1007007001,厨具|茶具、咖啡具|整套茶具,欧凯隆 景德镇陶瓷8头大容量双层防烫茶具套装配可拆分陶瓷茶盘 多款花色可选 浮雕金玫瑰,厨具>茶具/咖啡具>整套茶具>欧凯隆 景德镇陶瓷8头大容量双层防烫茶具...,京东商城,欧凯隆旗舰店1007007001,厨具|茶具、咖啡具|整套茶具,古尼 正品汝窑开片 功夫茶具套装 RY004 高档礼盒六瓣杯套组月白色,厨具>茶具/咖啡具>整套茶具>古尼 正品汝窑开片 功夫茶具套装 RY...,京东商城,古尼茶器1007007001,厨具|茶具、咖啡具|整套茶具,北府瓷业红梅.方圆优质骨瓷功夫茶具礼品套装,厨具>茶具/咖啡具>整套茶具>北府瓷业红梅.方圆优质骨瓷功夫茶具礼品套...,京东商城,芊芊家家居旗舰店1007007001,厨具|茶具、咖啡具|整套茶具,唐丰茶具红木花梨木黑金石茶盘配高端铁釉茶具套装 第三款,厨具>茶具/咖啡具>整套茶具>信柏SURPAQ >唐丰茶具红木花梨木黑金石茶盘配高端铁釉茶...,京东商城,臻茗尚品茶艺轩1007007001,厨具|茶具、咖啡具|整套茶具,君礼轩 禾窑羽天目 8头盖碗茶具礼盒,厨具>茶具/咖啡具>整套茶具>君礼轩>君礼轩茶具礼盒,京东商城,君礼轩1007007001,厨具|茶具、咖啡具|整套茶具,君礼轩 汝窑青瓷 8头月白碧波朝日荷壶茶具礼盒,厨具>茶具/咖啡具>整套茶具>君礼轩>君礼轩茶具礼盒,京东商城,君礼轩1007007001,厨具|茶具、咖啡具|整套茶具,品茶忆友 宜兴紫砂茶具套装功夫茶组六件 西施,厨具>茶具/咖啡具>整套茶具>品茶忆友>品茶忆友 宜兴紫砂茶具套装功夫茶组六件 ...,京东商城,品茶忆友旗舰店1007007001,厨具|茶具、咖啡具|整套茶具,唐丰茶具功夫茶具套装整套组合 第六款 棕致-大富,厨具>茶具/咖啡具>整套茶具>信柏SURPAQ >唐丰茶具功夫茶具套装整套组合 第六款 棕...,京东商城,臻茗尚品茶艺轩1007007001,厨具|茶具、咖啡具|整套茶具,唐丰功夫茶具茶盘汝窑套装礼品 第二款,厨具>茶具/咖啡具>整套茶具>唐丰>唐丰功夫茶具茶盘汝窑套装礼品 第二款,京东商城,臻茗尚品茶艺轩1007007001,厨具|茶具、咖啡具|整套茶具,怡品尚瓷茶具套装功夫茶景德镇陶瓷青花瓷茶具 好山好水,厨具>茶具/咖啡具>整套茶具>怡品尚瓷>怡品尚瓷茶具套装功夫茶景德镇陶瓷青花瓷茶...,京东商城,怡品尚瓷1007007001,厨具|茶具、咖啡具|整套茶具,唐丰 整套茶具茶盘功夫茶道茶艺电磁炉套装 第三款,厨具>茶具/咖啡具>整套茶具>信柏SURPAQ >唐丰 整套茶具茶盘功夫茶道茶艺电磁炉套装...,京东商城,臻茗尚品茶艺轩1007007001,厨具|茶具、咖啡具|整套茶具,简宜良品 创意耐热玻璃茶具套装 750ml花茶壶 带茶漏 纯手工制作水具 茶壶+4只杯/5件套,厨具>茶具/咖啡具>整套茶具>简宜良品>简宜良品 创意耐热玻璃茶具套装 750m...,京东商城,简宜良品旗舰店1007007001,厨具|茶具、咖啡具|整套茶具,晟皓景德镇瓷器7头青花玲珑功夫茶具套装茶杯茶壶蝶恋花 CJTZ-01TL,厨具>茶具/咖啡具>整套茶具>晟皓景德镇瓷器7头青花玲珑功夫茶具套装茶...,京东商城,晟皓陶瓷官方旗舰店1007007001,厨具|茶具、咖啡具|整套茶具,怡品尚瓷功夫茶具套装景德镇青花瓷手绘山水 湖光山色,厨具>茶具/咖啡具>整套茶具>怡品尚瓷>怡品尚瓷功夫茶具套装景德镇青花瓷手绘山水...,京东商城,怡品尚瓷1007007001,厨具|茶具、咖啡具|整套茶具,唐丰茶具茶盘紫砂窑茶具套装整套乌金石 第二款,厨具>茶具/咖啡具>整套茶具>信柏SURPAQ >唐丰茶具茶盘紫砂窑茶具套装整套乌金石 第...,京东商城,臻茗尚品茶艺轩1007007001,厨具|茶具、咖啡具|整套茶具,尚帝 陶瓷功夫茶具套装 腾龙黑檀木多功能茶盘套装 功夫茶具TZ-G76065A076 黑檀腾龙套装(福字金边),厨具>茶具/咖啡具>整套茶具>仁品>尚帝 陶瓷功夫茶具套装 腾龙黑檀木多功能...,京东商城,尚帝旗舰店1007007001,厨具|茶具、咖啡具|整套茶具,唐丰茶具套装 紫砂茶具实木茶盘电磁炉整套 第一款,厨具>茶具/咖啡具>整套茶具>信柏SURPAQ >唐丰茶具套装 紫砂茶具实木茶盘电磁炉整套...,京东商城,臻茗尚品茶艺轩1007007001,厨具|茶具、咖啡具|整套茶具,唐丰茶具茶盘紫砂套装整套黑檀实木黑金石 第四款,厨具>茶具/咖啡具>整套茶具>信柏SURPAQ >唐丰茶具茶盘紫砂套装整套黑檀实木黑金石 ...,京东商城,臻茗尚品茶艺轩1007007001,厨具|茶具、咖啡具|整套茶具,a-life最生活 大碗茶茶具二件套 B-2910,厨具>茶具/咖啡具>整套茶具>A-life>a-life最生活 大碗茶茶具二件套 B...,京东商城,最生活旗舰店11007007001,厨具|茶具、咖啡具|整套茶具,晟皓景德镇茶具家居双层隔热防烫茶具套装 CJTZ-01SC 兰滕花,厨具>茶具/咖啡具>整套茶具>晟皓景德镇茶具家居双层隔热防烫茶具套装 ...,京东商城,晟皓陶瓷官方旗舰店1007007001,厨具|茶具、咖啡具|整套茶具,百鸿 功夫冰裂陶瓷茶具 电热水壶茶具套装 T-YFHL009 套装三,厨具>茶具/咖啡具>整套茶具>百鸿>百鸿 功夫冰裂陶瓷茶具 电热水壶茶具套装...,京东商城,百鸿旗舰店1007007001,厨具|茶具、咖啡具|整套茶具,百鸿 乌金石茶盘茶具套装至尊紫砂茶具套装 整套茶具套装 T-YZ2ZL5053 套装一至尊龙,厨具>茶具/咖啡具>整套茶具>百鸿 乌金石茶盘茶具套装至尊紫砂茶具套装...,京东商城,百鸿旗舰店1007007001,厨具|茶具、咖啡具|整套茶具,尚帝 花梨木茶盘四合一套装汝窑开片茶具套装 整套茶具套装 T-WG2HYJ0051 套装一天青,厨具>茶具/咖啡具>整套茶具>尚帝（shangdi）>尚帝 花梨木茶盘四合一套装汝窑开片茶具套...,京东商城,尚帝旗舰店