1007004009,厨具|收纳保鲜|餐具笼、餐具架,糖果色三格餐具筷子盒沥水筷子笼餐具架置物架勺叉餐具盒带接水盒 蓝色,厨具>厨房配件>储物/置物架>淘乐士>糖果色三格餐具筷子盒沥水筷子笼餐具架置物...,京东商城,陶钰源家居专营店1007004009,厨具|收纳保鲜|餐具笼、餐具架,家英 升级版多功能碗架/双层沥水置物架 厨房收纳架餐具架（A301）,家英>家英 升级版多功能碗架/双层沥水置物架 ...,京东商城,楼龙旗舰店1007004009,厨具|收纳保鲜|餐具笼、餐具架,千团精工 碗架 沥水架 双层碗碟架 餐具架厨房置物架 WJ002 绿色,厨具>厨房配件>厨房DIY/小工具>千团精工>千团精工 碗架 沥水架 双层碗碟架 餐具...,京东商城,千团精工烘培器具1007004009,厨具|收纳保鲜|餐具笼、餐具架,茶花筷子盒筒塑料筷子滤水盒子餐具笼2510,厨具>烹饪锅具>厨用杂件>茶花>茶花筷子盒筒塑料筷子滤水盒子餐具笼251...,京东商城,茶花生活馆1007004009,厨具|收纳保鲜|餐具笼、餐具架,拜格BAYCO厨房沥水架不锈钢双层置物架餐具笼架碗碟架盘子架包邮BCX809,家居日用 > 厨房用品 > 厨房杂件 > 置物架 > 商品详情,当当网,Bayco拜格1007004009,厨具|收纳保鲜|餐具笼、餐具架,万能士 餐具架,家装建材>厨房挂件>万能士>万能士 餐具架,国美电器网上商城,居然之家丽屋旗舰店1007004009,厨具|收纳保鲜|餐具笼、餐具架,家英 实用型带盖沥水碗柜饭碗收纳沥水柜滴水柜盒餐具架（A217）,其它>家英 实用型带盖沥水碗柜饭碗收纳沥水柜滴...,京东商城,楼龙旗舰店1007004009,厨具|收纳保鲜|餐具笼、餐具架,千顺陶瓷欧式筷子筒沥水筷子笼创意陶瓷厨房置物架优质陶瓷餐具笼 古典花韵,厨具>餐具>筷勺/刀叉>千顺>千顺陶瓷欧式筷子筒沥水筷子笼创意陶瓷厨房...,京东商城,千顺陶瓷1007004009,厨具|收纳保鲜|餐具笼、餐具架,双庆家居 不锈钢餐具架 置物架 沥水架 厨房用具洗碗架1026 包邮 绿色,家居家装>生活日用>收纳用品>双庆>双庆家居 不锈钢餐具架 置物架 沥水架 ...,京东商城,1007004009,厨具|收纳保鲜|餐具笼、餐具架,红兔子 不锈钢伸缩水槽沥水架洗菜篮 厨房置物架 碗架 餐具架 沥水架滴水架碗具碟子架 绿色,厨具>厨房配件>储物/置物架>红兔子>红兔子 不锈钢伸缩水槽沥水架洗菜篮 厨房...,京东商城,维双家居专营店1007004009,厨具|收纳保鲜|餐具笼、餐具架,豪丰 炫彩台式双格筷子笼 镂空筷子筒 沥水餐具笼筷笼K2585,厨具>厨房配件>储物/置物架>豪丰（HOWFUN）>豪丰 炫彩台式双格筷子笼 镂空筷子筒 沥...,京东商城,简家家居旗舰店1007004009,厨具|收纳保鲜|餐具笼、餐具架,爱尚活 LOFALi不锈钢沥水碗碟架碗架双层厨房用具置物架收纳架层架餐具架滴水架208,所有分类>家居家纺、锅具餐具>厨具锅具>厨房置物架>爱尚活>爱尚活 LOFALi...,1号店,爱尚活1007004009,厨具|收纳保鲜|餐具笼、餐具架,金利娴子 厨房滴水碗架 沥水架 收纳架 碗架子餐具架 多用碗碟架 白色,厨具>厨房配件>储物/置物架>金利娴子>金利娴子 厨房滴水碗架 沥水架 收纳架 ...,京东商城,墨森家居专营店1007004009,厨具|收纳保鲜|餐具笼、餐具架,淘乐士 多用不锈钢双层置物架储物架收纳架杂物架餐具架鞋架书架 白色,首页>家居/家装建材/厨具>生活日用>收纳用品>淘乐士多用不锈钢双层置物架储物架收...,苏宁,1007004009,厨具|收纳保鲜|餐具笼、餐具架,厨房浴室折叠置物架多用储物架整理棚收纳架杂物架餐具架 2个装 白色,首页>家居/家装建材/厨具>生活日用>收纳用品>厨房浴室折叠置物架多用储物架整理棚收...,苏宁,1007004009,厨具|收纳保鲜|餐具笼、餐具架,宝优妮微波炉架微波炉置物架调料架碗架餐具架收纳架厨房置物架储物架DQ-1305 象牙色,家装建材>厨房卫浴>厨卫五金/挂件> 宝优妮>宝优妮微波炉架微波炉置物架调料架碗架餐具...,京东商城,鹤洋工贸专营店1007004009,厨具|收纳保鲜|餐具笼、餐具架,可丽纳特不锈钢厨房收纳架置物架单层带筷子笼碗碟架餐具架接水盘KC011-600免费送货,厨具 > 厨房收纳、搁置 > 收纳盒、蓝、筐 ,亚马逊(卓越网),1007004009,厨具|收纳保鲜|餐具笼、餐具架,可丽纳特不锈钢厨房浴室转角双层置物架收纳架碗碟架餐具架BR025B免费送货,厨具 > 厨房收纳、搁置 家居 > 收纳用品 > 桌面收纳,亚马逊(卓越网),可丽纳特Cleanart1007004009,厨具|收纳保鲜|餐具笼、餐具架,奥蒂卡餐具架807不锈钢板双筒,家居装修 > 五金 > 浴室五金 > 化妆品架,亚马逊(卓越网),Atical 奥蒂卡1007004009,厨具|收纳保鲜|餐具笼、餐具架,家逸多功能三层置物架/收纳架/书报架/餐具架/层架,当当网 > 家具装饰 > 家具 > DIY家具 > 层架,当当网,1007004009,厨具|收纳保鲜|餐具笼、餐具架,安买 厨王多功能不锈钢餐具架(AM-0035),家用/类别/家居/家具/餐厨家具/餐具架,亚马逊(卓越网),Amai18 安买1007004009,厨具|收纳保鲜|餐具笼、餐具架,Fushen弗森蛋型餐具架,家用/类别/厨具/厨房收纳/厨房置物架,亚马逊(卓越网),Fushen 弗森1007004009,厨具|收纳保鲜|餐具笼、餐具架,丽厨 钢镀铬碗碟架LC107A 置物架 沥水架 多功能碗碟架 餐具架 接水盘颜色随机 (400*185*100mm, 亮光电镀),其他 > 其他,亚马逊(卓越网),丽厨1007004009,厨具|收纳保鲜|餐具笼、餐具架,茶花 餐具筒 餐具笼 筷子调羹勺子筒套装 筷子笼 CH-A筷笼2510,厨具>烹饪锅具>厨用杂件>茶花（CHAHUA）>茶花 餐具筒 餐具笼 筷子调羹勺子筒套装...,京东商城,唐宗家居生活馆1007004009,厨具|收纳保鲜|餐具笼、餐具架,艺柳园 多功能层架置物架 /收纳架/书报架/餐具架/层架/书柜/逸家/宜家 二层109,家具>储物家具>层架/置物架>艺柳园>艺柳园 多功能层架置物架 /收纳架/书报...,京东商城,艺柳园韩式家居1007004009,厨具|收纳保鲜|餐具笼、餐具架,爱尚绿点 多功能S型双层碗碟架 厨房置物架 9字型碗架 金属碗架 餐具架 RA001,厨具 > 厨房保鲜、收纳 > 厨房置物架 > 碗盘架,亚马逊(卓越网),爱尚绿点1007004009,厨具|收纳保鲜|餐具笼、餐具架,欧润哲 不锈钢筷子笼 餐具笼 日本筷子筒筷子架无印良品碗筷收纳架,厨具 > 厨房收纳 > 厨房置物架,亚马逊(卓越网),欧润哲1007004009,厨具|收纳保鲜|餐具笼、餐具架,联创 非常6+2套装厨具（八件套） 特配餐具架,首页 > .联创LianC电器专场 > 非常6+2套装厨具（八件套） 特配餐具架,唯品会,无1007004009,厨具|收纳保鲜|餐具笼、餐具架,淘乐士 宜家风格创意日式波浪锅盖架 厨房汤勺餐具架 防滑置物架 （4色各一个 4个装）,厨具>烹饪锅具>厨用杂件>淘乐士 宜家风格创意日式波浪锅盖架 厨房...,京东商城,陶钰源家居专营店1007004009,厨具|收纳保鲜|餐具笼、餐具架,hesinly高档顶级304不锈钢厨具锅铲勺套装炒铲饭勺汤勺漏勺餐具笼 平漏铲,厨具>烹饪锅具>厨用杂件>hesinly高档顶级304不锈钢厨具锅...,京东商城,合兴利家居馆1007004009,厨具|收纳保鲜|餐具笼、餐具架,hesinly高档顶级304不锈钢厨具锅铲勺套装炒铲饭勺汤勺漏勺餐具笼 六件套,厨具>烹饪锅具>厨用杂件>hesinly高档顶级304不锈钢厨具锅...,京东商城,合兴利家居馆1007004009,厨具|收纳保鲜|餐具笼、餐具架,家英 实用型带盖沥水碗柜饭碗收纳沥水柜滴水柜盒餐具架（A218）,家英>家英 实用型带盖沥水碗柜饭碗收纳沥水柜滴...,京东商城,楼龙旗舰店1007004009,厨具|收纳保鲜|餐具笼、餐具架,NEWREA 新锐/筷笼/小叶红檀筷子筒/餐具架/工艺品/节日礼品,厨具>餐具>筷勺/刀叉>信柏SURPAQ >NEWREA 新锐/筷笼/小叶红檀筷子筒...,京东商城,卡冉柏家居专营店1007004009,厨具|收纳保鲜|餐具笼、餐具架,千团精工 碗架 沥水架 双层碗碟架 餐具架厨房置物架 WJ002 蓝色,厨具>厨房配件>厨房DIY/小工具>千团精工>千团精工 碗架 沥水架 双层碗碟架 餐具...,京东商城,千团精工烘培器具1007004009,厨具|收纳保鲜|餐具笼、餐具架,日本 阿司倍鹭（Asvel）托盘沥水架 餐盘餐具架 洗碗架 白色00980110,厨具>厨房配件>储物/置物架>ASVEL>日本 阿司倍鹭（Asvel）托盘沥水架 ...,京东商城,派瑞欧家居生活馆1007004009,厨具|收纳保鲜|餐具笼、餐具架,川木viplife.cn 收纳框 碗架滴水碗盆收纳架 厨房置物架 餐具架 沥水架,所有分类>家居家纺、锅具餐具>厨具锅具>厨房置物架>川木viplife.cn>川木viplife....,1号店,川木viplifecn1007004009,厨具|收纳保鲜|餐具笼、餐具架,盎梾玛特 盎睐玛特不锈钢金属餐具架放碗碟沥水架不带盖厨房用具洗碗架颜色随机k-507,所有分类>家居家纺、锅具餐具>厨具锅具>厨房置物架>盎梾玛特>盎梾玛特 盎睐玛特不...,1号店,盎梾玛特1007004009,厨具|收纳保鲜|餐具笼、餐具架,踊跃YONGYUE 不锈钢双层碗碟架A WDJ-A 餐具架 沥水架 置物架,所有分类>家居家纺、锅具餐具>厨具锅具>厨房工具>厨房杂件>踊跃YONGYUE>踊跃YONGYUE ...,1号店,踊跃YONGYUE1007004009,厨具|收纳保鲜|餐具笼、餐具架,宝芮思 悠品 新款 翻盖式多功能碗柜 收纳箱 置物箱 碗碟篮 餐具架 厨房收纳架,所有分类>家居家纺、锅具餐具>厨具锅具>厨房收纳>其他厨房收纳>宝芮思>宝芮思 悠品 新款 ...,1号店,宝芮思1007004009,厨具|收纳保鲜|餐具笼、餐具架,双庆 金属餐具架 放碗碟沥水架 不带盖厨房用具洗碗架 1002 颜色随机,购买继红新奇特创意家居生活馆提供的本店全场购物满69元即可享受全场免邮不限量时花费 ￥ 69.00 或更多，将获得此商品的免费送货 点此查看如何获得促销优惠 (促销说明) 购买由继红新奇特创意家居生活馆提供的符合条件商品合格购物商品超过 ￥ 200.00 元，立即减免￥ 20.00 元 点此查看如何获得促销优惠 (促销说明) 继红家居旗舰店全场促销，买的越多优惠越多 更多详情联系05548016398 点此查看如何获得促销优惠 (促销说明),亚马逊(卓越网),双庆1007004009,厨具|收纳保鲜|餐具笼、餐具架,奥蒂卡（atical）807不锈钢双筒餐具架,家装建材>厨房挂件>奥蒂卡>奥蒂卡（atical）807不锈钢双筒餐具架,国美电器网上商城,奥蒂卡1007004009,厨具|收纳保鲜|餐具笼、餐具架,HUANXIPO 304不锈钢筷子笼 筷子筒置物架 沥水筒餐具笼架厨房餐饮用具正品特价,厨具>餐具>筷勺/刀叉>HUANXIPO>HUANXIPO 304不锈钢筷子笼 筷...,京东商城,HUANXIPO旗舰店1007004009,厨具|收纳保鲜|餐具笼、餐具架,简家 炫彩台式双格筷子笼 镂空筷子筒 沥水餐具笼筷笼K2585,所有分类>家居家纺、锅具餐具>厨具锅具>厨房收纳>筷笼>简家>简家 炫彩台式双格筷...,1号店,简家1007004009,厨具|收纳保鲜|餐具笼、餐具架,藏乐单层塑料碗架沥水架大号沥水篮厨房餐具架碗碟架碗盘滴水架柜 绿色,厨具>厨房配件>储物/置物架>藏乐（Cangle）>藏乐单层塑料碗架沥水架大号沥水篮厨房餐具...,京东商城,文武家居生活馆1007004009,厨具|收纳保鲜|餐具笼、餐具架,振兴 筷子筒 台座式餐具架YH5938 餐具笼 筷子笼,所有分类>家居家纺、锅具餐具>厨具锅具>厨房收纳>筷笼>振兴>振兴 筷子筒 台座式...,1号店,振兴1007004009,厨具|收纳保鲜|餐具笼、餐具架,金利娴子 塑料餐具盒 花形餐具笼 餐具收纳笼 筷子笼 餐具收纳盒 橙色,厨具>厨房配件>储物/置物架> 金利娴子>金利娴子 塑料餐具盒 花形餐具笼 餐具收...,京东商城,墨森家居专营店1007004009,厨具|收纳保鲜|餐具笼、餐具架,振兴 餐具架 YH6004,所有分类>家居家纺、锅具餐具>厨具锅具>厨房置物架>振兴>振兴 餐具架 YH6...,1号店,振兴1007004009,厨具|收纳保鲜|餐具笼、餐具架,瑞帝厨房置物架 微波炉架 碗碟架 整理储物收纳架角架 电器层架餐具架 烤漆 长40宽30高75三层,家具>储物家具>层架/置物架>瑞帝（RUIDI）>瑞帝厨房置物架 微波炉架 碗碟架 整理储...,京东商城,瑞帝专营店1007004009,厨具|收纳保鲜|餐具笼、餐具架,诗诺雅 厨王多功能餐具架020314,所有分类>家居家纺、锅具餐具>厨具锅具>厨房置物架>诗诺雅>诗诺雅 厨王多功能餐...,1号店,诗诺雅1007004009,厨具|收纳保鲜|餐具笼、餐具架,厨厨动人 碗架 碗碟架沥水架 304不锈钢 双层餐具架 厨房置物架 A01,厨具>厨房配件>储物/置物架> 厨厨动人>厨厨动人 碗架 碗碟架沥水架 304不锈...,京东商城,中国长城厨具专营店1007004009,厨具|收纳保鲜|餐具笼、餐具架,红兔子 不锈钢伸缩水槽沥水架洗菜篮 厨房置物架 碗架 餐具架 沥水架滴水架碗具碟子架 白色,厨具>厨房配件>储物/置物架> 文博>红兔子 不锈钢伸缩水槽沥水架洗菜篮 厨房...,京东商城,天瑞家居专营店1007004009,厨具|收纳保鲜|餐具笼、餐具架,可丽纳特不锈钢厨房浴室方形双层置物架收纳架化妆品架餐具架BR029B免费送货,厨具 > 厨房收纳、搁置 家居 > 浴室用品 > 角架,亚马逊(卓越网),可丽纳特Cleanart1007004009,厨具|收纳保鲜|餐具笼、餐具架,宅生活M8104美宅空间多功能炫银双层餐具架沥水碗碟架,厨具>烹饪锅具>厨用杂件>宅生活M8104美宅空间多功能炫银双层餐...,京东商城,宅生活1007004009,厨具|收纳保鲜|餐具笼、餐具架,莫诺（BONUME） 陶瓷碎花沥水筷子筒餐具笼 TC00062 bu,厨具>烹饪锅具>厨用杂件>莫诺（BONUME） 陶瓷碎花沥水筷子筒...,京东商城,多比家居专营店1007004009,厨具|收纳保鲜|餐具笼、餐具架,【工厂直营】创意家居 整理收纳 多功能二层置物架 收纳架 书报架 餐具架 层架 书架宜家109,家具家装 > 家具 > 层架,当当网,家逸1007004009,厨具|收纳保鲜|餐具笼、餐具架,迦南 碗碟架 碗架 碟架 沥水篮 不锈钢餐具架 置物架（带托水盘）,Home,亚马逊(卓越网),迦南1007004009,厨具|收纳保鲜|餐具笼、餐具架,诗美嘉单层餐具架SAE-514,其他 > 其他,亚马逊(卓越网),诗美嘉1007004009,厨具|收纳保鲜|餐具笼、餐具架,淘乐士 宜家风格创意日式波浪锅盖架 厨房汤勺餐具架 防滑置物架 果绿色,家用/类别/厨具/餐具/餐勺/汤匙、调羹,亚马逊(卓越网),淘乐士1007004009,厨具|收纳保鲜|餐具笼、餐具架,千顺陶瓷创意筷子筒 防霉沥水筷子笼 包邮带铁架骨瓷餐具笼 紫荆花,厨具>餐具>筷勺/刀叉>千顺>千顺陶瓷创意筷子筒 防霉沥水筷子笼 包邮...,京东商城,千顺陶瓷1007004009,厨具|收纳保鲜|餐具笼、餐具架,爱尚活LOFALi不锈钢沥水碗碟架碗架双层厨房用具置物架收纳架层架餐具架滴水架NO.295,厨具>烹饪锅具>厨用杂件>爱尚活（LOFALI）>爱尚活LOFALi不锈钢沥水碗碟架碗架双...,京东商城,爱尚活旗舰店1007004009,厨具|收纳保鲜|餐具笼、餐具架,艺柳园 多功能层架置物架 /收纳架/书报架/餐具架/层架/书柜/逸家/宜家 二三组合109+110,家具>储物家具>层架/置物架>艺柳园>艺柳园 多功能层架置物架 /收纳架/书报...,京东商城,艺柳园韩式家居1007004009,厨具|收纳保鲜|餐具笼、餐具架,好空间 置物架 碗碟架厨房调味瓶收纳架沥水架餐具架C057,所有分类>家居家纺、锅具餐具>厨具锅具>厨房置物架>好空间>好空间 置物架 碗碟...,1号店,好空间1007004009,厨具|收纳保鲜|餐具笼、餐具架,淘乐士 宜家风格创意日式波浪锅盖架 厨房汤勺餐具架 防滑置物架（4个装）一色一个,所有分类>家居家纺、锅具餐具>厨具锅具>锅盖/蒸格/蒸架>淘乐士>淘乐士 宜家风格创意...,1号店,淘乐士1007004009,厨具|收纳保鲜|餐具笼、餐具架,onlinem盎睐玛特不锈钢金属餐具架放碗碟沥水架不带盖厨房用具洗碗架颜色随机k-507,家居家装>生活日用>收纳用品>盎睐玛特（onlineM）>onlinem盎睐玛特不锈钢金属餐具架放...,京东商城,蝶艺美onlineM时尚家居1007004009,厨具|收纳保鲜|餐具笼、餐具架,双庆金属餐具架 放碗碟沥水架 不带盖厨房用具洗碗架 1002 颜色随机,家居家装>生活日用>收纳用品>双庆金属餐具架 放碗碟沥水架 不带盖厨房...,京东商城,奇尔汇1007004009,厨具|收纳保鲜|餐具笼、餐具架,川木 日本 碗架 厨房滴水碗盆收纳架 置物架 餐具架 沥水架 (白色),厨具 > 厨房保鲜、收纳 > 厨房置物架 > 碗盘架,亚马逊(卓越网),川木1007004009,厨具|收纳保鲜|餐具笼、餐具架,淘乐士厨房浴室折叠置物架多用储物架整理棚收纳架杂物架餐具架4个装 白色,首页>家居/家装建材/厨具>生活日用>收纳用品>淘乐士厨房浴室折叠置物架多用储物架整...,苏宁,淘乐士1007004009,厨具|收纳保鲜|餐具笼、餐具架,双庆 金属餐具架 置物架 放碗碟沥水架 不带盖厨房用具洗碗架 1002,所有分类>家居家纺、锅具餐具>收纳洗晒>收纳层架>收纳架>双庆>双庆 金属餐具架 置...,1号店,双庆1007004009,厨具|收纳保鲜|餐具笼、餐具架,振兴 厨房滴水碗盆收纳架 餐具架 沥水架 3551 小号,所有分类>家居家纺、锅具餐具>厨具锅具>厨房置物架>振兴>振兴 厨房滴水碗盆收...,1号店,振兴1007004009,厨具|收纳保鲜|餐具笼、餐具架,厨房浴室折叠置物架多用储物架整理棚收纳架杂物架餐具架 2个装 白色,首页>家居/家装建材/厨具>生活日用>收纳用品>厨房浴室折叠置物架多用储物架整理棚收...,苏宁,淘乐士1007004009,厨具|收纳保鲜|餐具笼、餐具架,瑾瑜御瓷 景德镇陶瓷筷子筒防霉花色筷笼创意带铁架骨瓷餐具笼 K款,厨具 > 餐具 > 筷子,亚马逊(卓越网),瑾瑜御瓷1007004009,厨具|收纳保鲜|餐具笼、餐具架,瑾瑜御瓷 景德镇陶瓷筷子筒防霉花色筷笼创意带铁架骨瓷餐具笼 I款,厨具 > 餐具 > 筷子,亚马逊(卓越网),瑾瑜御瓷1007004009,厨具|收纳保鲜|餐具笼、餐具架,千顺陶瓷创意厨房筷子筒防霉沥水筷子笼架盒包邮带铁架骨瓷餐具笼 妙曼花香,厨具>餐具>筷勺/刀叉>千顺>千顺陶瓷创意厨房筷子筒防霉沥水筷子笼架盒...,京东商城,千顺陶瓷1007004009,厨具|收纳保鲜|餐具笼、餐具架,亲爱的 厨房置物架塑料碗盘架餐具沥水篮碗盘收纳架沥水架餐具架碗盘柜,所有分类>家居家纺、锅具餐具>厨具锅具>厨房置物架>亲爱的>亲爱的 厨房置物架塑...,1号店,亲爱的1007004009,厨具|收纳保鲜|餐具笼、餐具架,日光生活 多功能碗碟架,金属双层餐具架，大容量，抗磨损，不沾水，耐久实用，历久如新,首页 > 日光生活HIKARI家居专场 > 多功能碗碟架,唯品会,无1007004009,厨具|收纳保鲜|餐具笼、餐具架,双庆1002 金属餐具架 放碗碟沥水架 不带盖厨房用具洗碗架 颜色随机不指定,家居家装>生活日用>收纳用品>双庆>双庆1002 金属餐具架 放碗碟沥水架 ...,京东商城,小奇猫家居专营店1007004009,厨具|收纳保鲜|餐具笼、餐具架,淘乐士多功能刀架砧板菜板架筷子餐具架杯子架 厨房收纳置物架 铁艺挂架,厨具>厨房配件>储物/置物架>淘乐士>淘乐士多功能刀架砧板菜板架筷子餐具架杯子...,京东商城,陶钰源家居专营店1007004009,厨具|收纳保鲜|餐具笼、餐具架,邑彩居icaiju美厨多功能炫银餐具架沥水架双层碗碟架F003多用收纳架,厨具>厨房配件>储物/置物架>邑彩居 >邑彩居icaiju美厨多功能炫银餐具架沥...,京东商城,邑彩生活馆1007004009,厨具|收纳保鲜|餐具笼、餐具架,合兴利HESINLY大号不锈钢筷子筒餐具笼加厚厨具筒,厨具>厨房配件>储物/置物架>合兴利（HESInLY）>合兴利HESINLY大号不锈钢筷子筒餐具...,京东商城,合兴利家居馆1007004009,厨具|收纳保鲜|餐具笼、餐具架,爱尚活LOFALi不锈钢沥水碗碟架碗架双层厨房用具置物架收纳架层架餐具架滴水架NO.019,厨具>厨房配件>储物/置物架>爱尚活（LOFALI）>爱尚活LOFALi不锈钢沥水碗碟架碗架双...,京东商城,爱尚活旗舰店1007004009,厨具|收纳保鲜|餐具笼、餐具架,日本进口川木碗架滴水碗盆收纳架厨房置物架餐具架沥水架 白色,首页>家居/家装建材/厨具>生活日用>收纳用品>日本进口川木碗架滴水碗盆收纳架厨房置...,苏宁,1007004009,厨具|收纳保鲜|餐具笼、餐具架,金利娴子分格餐具笼 创意餐具盒子筷子盒筷子筒 沥水塑料筷子盒子 白色,厨具>厨房配件>储物/置物架> 金利娴子>金利娴子分格餐具笼 创意餐具盒子筷子盒筷...,京东商城,墨森家居专营店1007004009,厨具|收纳保鲜|餐具笼、餐具架,日本进口碗架厨房滴水碗盘架餐具架沥水架大号051868 白色 白色,厨具>厨房配件>储物/置物架> FaSoLa>日本进口碗架厨房滴水碗盘架餐具架沥水架大...,京东商城,川木家居用品专营店1007004009,厨具|收纳保鲜|餐具笼、餐具架,洁夫人 厨房置物架超值组（6连钩+餐具架） 承重3kg,家居家装>生活日用>浴室用品> 洁夫人>洁夫人 厨房置物架超值组（6连钩+餐具架...,京东商城,寰宇家居专营店1007004009,厨具|收纳保鲜|餐具笼、餐具架,振兴 YH5892 四格餐具筒筷子筒 餐具架 餐具收纳筒 厨具架,家居日用 > 厨房用品 > 厨房杂件 > 置物架 > 振兴 YH5892 四格餐具筒筷子筒 餐具架 餐具收纳筒 厨具架,当当网,尚品1007004009,厨具|收纳保鲜|餐具笼、餐具架,JUNQUAN/君泉 厨房 不锈钢 多功能 置物架 菜刀架 调料架 餐具架 筷子筒 500mm单杯 刀架 不带砧,首页>家居/家装建材/厨具>厨卫装修>厨卫挂件/五金>JUNQUAN/君泉厨房不锈钢...,苏宁,君泉(JunQuan)