1007007008,厨具|茶具、咖啡具|茶宠摆件,宜兴紫砂壶 紫砂摆件 李爱民 招财镇宅 24k描纯金龙蟾 墨绿泥 保真 摆件 杂玩,厨具>茶具/咖啡具>茶宠摆件>万新>宜兴紫砂壶 紫砂摆件 李爱民 招财镇宅...,京东商城,新寅陶艺1007007008,厨具|茶具、咖啡具|茶宠摆件,中闽富润屋 树脂变色茶宠(变彩色) 邂逅 GA2145 邂逅变绿玉,厨具>茶具/咖啡具>茶宠摆件>中闽富润屋 树脂变色茶宠(变彩色) ...,京东商城,中闽富润屋旗舰店1007007008,厨具|茶具、咖啡具|茶宠摆件,香港一园茶具 琉璃 功夫茶具配件 琉璃 养壶笔架 茶宠 高端茶桌摆件 新品上架 一园琉璃小支架,厨具>茶具/咖啡具>茶宠摆件>一园>香港一园茶具 琉璃 功夫茶具配件 琉璃 ...,京东商城,一园工厂店1007007008,厨具|茶具、咖啡具|茶宠摆件,名壶秋月 喷水莲子 莲心盖托 紫砂茶宠 茶盘配饰 名品折扣 春到壶到,厨具>茶具/咖啡具>茶宠摆件>名壶秋月 >名壶秋月 喷水莲子 莲心盖托 紫砂茶宠 ...,京东商城,名壶秋月艺术馆1007007008,厨具|茶具、咖啡具|茶宠摆件,德化商城 茶具 精品紫砂茶宠摆件 哥窑茶宠 福星茶玩 BWCC06,厨具>茶具/咖啡具>茶宠摆件>言艺>德化商城 茶具 精品紫砂茶宠摆件 哥窑茶...,京东商城,德化商城专营店1007007008,厨具|茶具、咖啡具|茶宠摆件,陶都宜兴紫砂茶宠 可爱萌猪 憨态可掬 茶玩摆件,厨具>茶具/咖啡具>茶宠摆件>陶都宜兴紫砂茶宠 可爱萌猪 憨态可掬 茶...,京东商城,紫砂壶旗舰店1007007008,厨具|茶具、咖啡具|茶宠摆件,陶都 宜兴紫砂精品茶具雕塑 原矿紫砂 七星金蟾 茶宠茶玩,厨具>茶具/咖啡具>茶宠摆件>陶都 宜兴紫砂精品茶具雕塑 原矿紫砂 七...,京东商城,紫砂壶旗舰店1007007008,厨具|茶具、咖啡具|茶宠摆件,陶瓷故事 紫砂精品摆件 太平有象大象宜兴紫砂吉祥平安高档商务礼品（单只） 两只,厨具>茶具/咖啡具>茶宠摆件>陶瓷故事 紫砂精品摆件 太平有象大象宜兴...,京东商城,缤纷家居馆1007007008,厨具|茶具、咖啡具|茶宠摆件,黄龙壶缘 宜兴紫砂手工茶宠 （朱泥莲心养壶垫） 原矿朱泥 紫砂茶宠,厨具>茶具/咖啡具>茶宠摆件>黄龙壶缘 宜兴紫砂手工茶宠 （朱泥莲心养...,京东商城,黄龙壶缘1007007008,厨具|茶具、咖啡具|茶宠摆件,中闽富润屋 树脂变色茶宠变绿 双手举元宝佛 GA1788,厨具>茶具/咖啡具>茶宠摆件>中闽富润屋 树脂变色茶宠变绿 双手...,京东商城,中闽富润屋旗舰店1007007008,厨具|茶具、咖啡具|茶宠摆件,左器 茶具配件倒流香炉熏香炉工艺品摆件礼佛器皿烟可以倒流茶宠摆件 WLP65 款式一金色,厨具>茶具/咖啡具>茶具配件>左器 茶具配件倒流香炉熏香炉工艺品摆件礼...,京东商城,左器生活馆1007007008,厨具|茶具、咖啡具|茶宠摆件,茗臣尚品 宜兴紫砂茶宠 精品文艺小和尚 段泥,厨具>茶具/咖啡具>茶宠摆件>茗臣尚品 宜兴紫砂茶宠 精品文艺小和尚 ...,京东商城,茗臣尚品1007007008,厨具|茶具、咖啡具|茶宠摆件,华盛和 宜兴紫砂茶宠 两用茶宠 实用茶具配件 树桩盖托茶宠 段泥,厨具>茶具/咖啡具>茶宠摆件>华盛和 宜兴紫砂茶宠 两用茶宠 实用茶具...,京东商城,玉臻陶艺1007007008,厨具|茶具、咖啡具|茶宠摆件,万新 新寅陶艺 紫砂摆件 杂玩 郭栋制 [坐达摩] 包真 II,厨具>茶具/咖啡具>茶宠摆件>万新>万新 新寅陶艺 紫砂摆件 杂玩 郭栋制 ...,京东商城,新寅陶艺1007007008,厨具|茶具、咖啡具|茶宠摆件,言世茶具 台湾乐淘缘 汝窑 哥窑茶宠 陶瓷茶具 紫砂茶滤 茶漏斗过滤网架 ys-cl993 汝窑茶圣,厨具>茶具/咖啡具>茶宠摆件>言世茶具 台湾乐淘缘 汝窑 哥窑茶宠 陶...,京东商城,言世茶具1007007008,厨具|茶具、咖啡具|茶宠摆件,陶瓷故事 宜兴紫砂茶宠 五福猪 工艺摆件 5只装,厨具>茶具/咖啡具>茶宠摆件>陶瓷故事 宜兴紫砂茶宠 五福猪 工艺摆件...,京东商城,祥韧家居生活馆1007007008,厨具|茶具、咖啡具|茶宠摆件,台湾原产名贵绿檀木香道用具 事事如意 线香卧香炉 新品九折包邮,厨具>茶具/咖啡具>茶宠摆件>台湾原产名贵绿檀木香道用具 事事如意 线...,京东商城,凌烟阁茶具专营店1007007008,厨具|茶具、咖啡具|茶宠摆件,黄龙壶缘 宜兴紫砂手工茶宠 （小将军龟摆件）原矿古铜泥 紫砂茶宠茶具,厨具>茶具/咖啡具>茶宠摆件>黄龙壶缘>黄龙壶缘 宜兴紫砂手工茶宠 （小将军龟摆...,京东商城,黄龙壶缘1007007008,厨具|茶具、咖啡具|茶宠摆件,黄龙壶缘 宜兴紫砂手工茶宠 （狮球摆件 ）原矿紫泥 紫砂茶宠茶具,厨具>茶具/咖啡具>茶宠摆件>黄龙壶缘>黄龙壶缘 宜兴紫砂手工茶宠 （狮球摆件 ...,京东商城,黄龙壶缘1007007008,厨具|茶具、咖啡具|茶宠摆件,中闽富润屋 摆件精品 茶宠雕塑全手工紫砂茶宠满载而归招财蟾,厨具>茶具/咖啡具>茶宠摆件>中闽富润屋 摆件精品 茶宠雕塑全手工紫...,京东商城,中闽富润屋旗舰店1007007008,厨具|茶具、咖啡具|茶宠摆件,万新 宜兴紫砂壶 花盆 《大水洗》烟缸 水培 紫泥 水盂 石生氏刻,厨具>茶具/咖啡具>茶宠摆件>万新 宜兴紫砂壶 花盆 《大水洗》烟缸...,京东商城,新寅陶艺1007007008,厨具|茶具、咖啡具|茶宠摆件,大彬堂 宜兴紫砂茶玩摆件 刘新华作品 纯手工原创花瓶之融岱1542,厨具>茶具/咖啡具>茶宠摆件>大彬堂>大彬堂 宜兴紫砂茶玩摆件 刘新华作品 纯...,京东商城,大彬堂宜兴紫砂茶具旗舰店1007007008,厨具|茶具、咖啡具|茶宠摆件,中闽富润屋 雕塑摆件精品功夫茶具配件 紫砂茶宠紫砂茶宠 拿钱币+举元宝+礼盒包装,厨具>茶具/咖啡具>茶宠摆件>中闽富润屋 雕塑摆件精品功夫茶具配件 紫...,京东商城,中闽富润屋旗舰店1007007008,厨具|茶具、咖啡具|茶宠摆件,东道汝窑茶具 天青釉开片 卧龙 香道线香插 香炉摆件,厨具>茶具/咖啡具>茶宠摆件>东道汝窑茶具 天青釉开片 卧龙 香道线香...,京东商城,凌烟阁茶具专营店1007007008,厨具|茶具、咖啡具|茶宠摆件,中闽富润屋 功夫茶具 摆件精品 全手工 紫砂茶宠 蘑菇兔,厨具>茶具/咖啡具>茶宠摆件>中闽富润屋 功夫茶具 摆件精品 全手工 ...,京东商城,中闽富润屋旗舰店1007007008,厨具|茶具、咖啡具|茶宠摆件,陶瓷故事 宜兴精品紫砂茶宠摆件 知足常乐茶玩工艺品 茶道用品 知足摆件 右脚,厨具>餐具>碗/碟/盘>陶瓷故事>陶瓷故事 宜兴精品紫砂茶宠摆件 知足常乐...,京东商城,楼龙旗舰店1007007008,厨具|茶具、咖啡具|茶宠摆件,三义成茶宠新年茶礼小和尚茶宠茶玩摆件工艺品系列 思学,厨具>茶具/咖啡具>茶宠摆件>三义成>三义成茶宠新年茶礼小和尚茶宠茶玩摆件工艺...,京东商城,三义成1007007008,厨具|茶具、咖啡具|茶宠摆件,华威礼业 哥窑茶宠招财龙生九子茶道配件 开片釉陶瓷哥窑茶宠 茶艺配件摆件茶具摆件 龙生九子全套,厨具>茶具/咖啡具>茶宠摆件>华威礼业 哥窑茶宠招财龙生九子茶道配件 ...,京东商城,华威礼业1007007008,厨具|茶具、咖啡具|茶宠摆件,华威礼业 十八罗汉宋代哥窑茶宠 精品汝窑开片茶玩 功夫茶具茶道18罗汉 静坐罗汉,厨具>茶具/咖啡具>茶宠摆件>华威礼业 十八罗汉宋代哥窑茶宠 精品汝窑...,京东商城,华威礼业1007007008,厨具|茶具、咖啡具|茶宠摆件,华威礼业 十八罗汉宋代哥窑茶宠 精品汝窑开片茶玩 功夫茶具茶道18罗汉 托塔罗汉,厨具>茶具/咖啡具>茶宠摆件>华威礼业 十八罗汉宋代哥窑茶宠 精品汝窑...,京东商城,华威礼业1007007008,厨具|茶具、咖啡具|茶宠摆件,宜兴紫砂壶 紫砂雕塑 摆件 李爱民制 招财镇宅 新款树樱蟾,厨具>茶具/咖啡具>茶宠摆件>万新>宜兴紫砂壶 紫砂雕塑 摆件 李爱民制 招...,京东商城,新寅陶艺1007007008,厨具|茶具、咖啡具|茶宠摆件,御雕坊功夫茶具套装茶道配件茶宠 CJ-CC 黄弥勒佛,厨具>茶具/咖啡具>茶宠摆件>御雕坊>御雕坊功夫茶具套装茶道配件茶宠 CJ-C...,京东商城,御雕坊陶瓷旗舰店1007007008,厨具|茶具、咖啡具|茶宠摆件,三义成茶宠新年茶礼店庆礼变色茶宠 白菜,厨具>茶具/咖啡具>茶宠摆件>三义成>三义成茶宠新年茶礼店庆礼变色茶宠 白菜,京东商城,三义成1007007008,厨具|茶具、咖啡具|茶宠摆件,中闽富润屋 功夫茶具 招财吉祥物摆件12生肖风水摆件 吉祥物 鼠,厨具>茶具/咖啡具>茶宠摆件>中闽富润屋 功夫茶具 招财吉祥物摆件...,京东商城,中闽富润屋旗舰店1007007008,厨具|茶具、咖啡具|茶宠摆件,陶瓷故事 精品紫砂茶宠摆件 招财大金蟾 手工茶宠 红色,厨具>茶具/咖啡具>茶宠摆件>陶瓷故事 精品紫砂茶宠摆件 招财大金蟾 ...,京东商城,祥韧家居生活馆1007007008,厨具|茶具、咖啡具|茶宠摆件,陶瓷故事 宜兴精品紫砂茶宠摆件 知足常乐茶玩工艺品 茶道用品 知足摆件 右脚,厨具>茶具/咖啡具>茶宠摆件>陶瓷故事 宜兴精品紫砂茶宠摆件 知足常乐...,京东商城,祥韧家居生活馆1007007008,厨具|茶具、咖啡具|茶宠摆件,迈克思 艺韵系列道财佛 茶宠摆件 中国瓷器德化陶瓷 哥窑仿宋 家居家用 茶具配件 高档精礼品,家居 > 家居装饰 > 工艺茶具 > 茶宠,亚马逊(卓越网),迈克思1007007008,厨具|茶具、咖啡具|茶宠摆件,迈克思 艺韵系列悟音老人 茶宠摆件 中国瓷器德化陶瓷 哥窑仿宋 家居家用 茶具配件高档精礼品,家居 > 家居装饰 > 工艺茶具 > 茶宠,亚马逊(卓越网),迈克思1007007008,厨具|茶具、咖啡具|茶宠摆件,品茶忆友 十二生肖茶宠汝窑茶宠紫砂茶具茶玩摆件陶瓷工艺品 虎,厨具>茶具/咖啡具>茶宠摆件>品茶忆友>品茶忆友 十二生肖茶宠汝窑茶宠紫砂茶具...,京东商城,品茶忆友旗舰店1007007008,厨具|茶具、咖啡具|茶宠摆件,陶瓷故事 宜兴紫砂精品茶宠摆件 手工制作送财灵猴 工艺摆件招财均码(招财),家居日用>创意小件>陶瓷故事>陶瓷故事 宜兴紫砂精品茶宠摆件 手工制作送财灵猴 工艺摆件招财均码(招财),国美电器网上商城,圣唐家居专营店1007007008,厨具|茶具、咖啡具|茶宠摆件,瑞恒逸品汝瓷茶宠福禄寿三星报喜之福星（青瓷） 高官厚禄 三星齐聚福 旺财旺宅旺丁,厨具>茶具/咖啡具>茶宠摆件>瑞恒逸品汝瓷茶宠福禄寿三星报喜之福星（青...,京东商城,浩瑞达尚品家居1007007008,厨具|茶具、咖啡具|茶宠摆件,中闽富润屋 功夫茶具 招财吉祥物摆件12生肖风水摆件 吉祥物 虎,厨具>茶具/咖啡具>茶宠摆件>中闽富润屋 功夫茶具 招财吉祥物摆件...,京东商城,中闽富润屋旗舰店1007007008,厨具|茶具、咖啡具|茶宠摆件,汉唐茶盘 茶宠摆件精品 紫砂时来运转茶道零配 功夫茶具配件特价,家居日用 > 厨房用品 > 水具茶具酒具 > 茶具 > 商品详情,当当网,汉唐1007007008,厨具|茶具、咖啡具|茶宠摆件,品茶忆友 精品宜兴紫砂茶宠摆件 一夜暴富 招财金蟾 手工茶宠茶玩,所有分类>家居家纺、锅具餐具>餐具水具>茶具1>茶宠摆件>品茶忆友>品茶忆友 精品宜兴紫...,1号店,品茶忆友1007007008,厨具|茶具、咖啡具|茶宠摆件,尚言坊 茶具茶道配件茶玩摆件 汝窑哥窑可养开片 茶宠童趣(大),所有分类>家居家纺、锅具餐具>餐具水具>茶具1>茶宠摆件>尚言坊>尚言坊 茶具茶道配件...,1号店,尚言坊1007007008,厨具|茶具、咖啡具|茶宠摆件,尚言坊 茶具配件 茶玩摆件 陶制小雕塑 汝窑如来佛茶宠 单个(小),所有分类>家居家纺、锅具餐具>餐具水具>茶具1>茶宠摆件>尚言坊>尚言坊 茶具配件 茶...,1号店,尚言坊1007007008,厨具|茶具、咖啡具|茶宠摆件,尚言坊 茶道紫砂茶宠 茶玩摆件 宜兴紫砂工艺品 树枝蜗牛,所有分类>家居家纺、锅具餐具>餐具水具>茶具1>茶宠摆件>尚言坊>尚言坊 茶道紫砂茶宠...,1号店,尚言坊1007007008,厨具|茶具、咖啡具|茶宠摆件,宏中 宜兴紫砂手链 紫砂茶宠摆件 全手工紫砂茶玩 紫砂佛珠手链,所有分类>家居家纺、锅具餐具>餐具水具>茶具1>茶宠摆件>宏中>宏中 宜兴紫砂手链 ...,1号店,宏中1007007008,厨具|茶具、咖啡具|茶宠摆件,美斯尼 紫艺陶缘 宜兴紫砂茶宠 童子戏金蟾 茶道摆件,所有分类>家居家纺、锅具餐具>餐具水具>茶具1>茶宠摆件>美斯尼>美斯尼 紫艺陶缘 宜...,1号店,美斯尼1007007008,厨具|茶具、咖啡具|茶宠摆件,美斯尼 紫艺陶缘 宜兴紫砂茶宠 五子登科 青蛙喷水托碟 茶道摆件 黄色,所有分类>家居家纺、锅具餐具>餐具水具>茶具1>茶宠摆件>美斯尼>美斯尼 紫艺陶缘 宜...,1号店,美斯尼1007007008,厨具|茶具、咖啡具|茶宠摆件,郑品 翡翠白菜 变色茶宠 家居摆设 功夫茶道 配件 茶玩CC41004,所有分类>家居家纺、锅具餐具>餐具水具>茶具1>茶宠摆件>郑品>郑品 翡翠白菜 变色...,1号店,郑品1007007008,厨具|茶具、咖啡具|茶宠摆件,特【爱壶人东亚紫砂】精品手工宜兴紫砂茶宠摆件茶具 一朵莲花小青蛙,家居日用>茶具>爱壶人>特【爱壶人东亚紫砂】精品手工宜兴紫砂茶宠摆件茶具 一朵莲花小青蛙,国美电器网上商城,爱壶人紫砂旗舰店1007007008,厨具|茶具、咖啡具|茶宠摆件,【爱壶人东亚紫砂】精品手工宜兴紫砂茶宠摆件茶具 厚德载物名片夹 花纹(红色),家居日用>茶具>爱壶人>【爱壶人东亚紫砂】精品手工宜兴紫砂茶宠摆件茶具 厚德载物名片夹 花纹(红色),国美电器网上商城,爱壶人紫砂旗舰店1007007008,厨具|茶具、咖啡具|茶宠摆件,成艺 汝窑功夫茶具配件 老寿星茶宠,所有分类>家居家纺、锅具餐具>餐具水具>茶具1>茶宠摆件>成艺>成艺 汝窑功夫茶具配...,1号店,成艺1007007008,厨具|茶具、咖啡具|茶宠摆件,漢唐 汉唐茶盘茶具 茶宠精品 紫砂茶宠茶玩摆件 手工大莲蓬 茶道配件,所有分类>家居家纺、锅具餐具>餐具水具>茶具1>茶宠摆件>漢唐>漢唐 汉唐茶盘茶具 ...,1号店,漢唐1007007008,厨具|茶具、咖啡具|茶宠摆件,【爱壶人东亚紫砂】精品手工宜兴紫砂茶宠摆件茶具 五龙喷水壶垫 壶托,家居日用>茶具>爱壶人>【爱壶人东亚紫砂】精品手工宜兴紫砂茶宠摆件茶具 五龙喷水壶垫 壶托,国美电器网上商城,爱壶人1007007008,厨具|茶具、咖啡具|茶宠摆件,【爱壶人东亚紫砂】精品手工宜兴紫砂茶宠摆件茶具 开心罗汉逍遥佛 中号,家居日用>茶具>爱壶人>【爱壶人东亚紫砂】精品手工宜兴紫砂茶宠摆件茶具 开心罗汉逍遥佛 中号,国美电器网上商城,爱壶人1007007008,厨具|茶具、咖啡具|茶宠摆件,【爱壶人东亚紫砂】精品手工宜兴紫砂茶宠摆件茶具 小猪头 憨厚可爱(橙色),家居日用>茶具>爱壶人>【爱壶人东亚紫砂】精品手工宜兴紫砂茶宠摆件茶具 小猪头 憨厚可爱(橙色),国美电器网上商城,爱壶人紫砂旗舰店1007007008,厨具|茶具、咖啡具|茶宠摆件,茶具配件  茶宠摆件 汉白 汝窑茶宠 孙权 三国人物 刘关张 桃园结义,家居日用>茶具>品道天元>茶具配件  茶宠摆件 汉白 汝窑茶宠 孙权 三国人物 刘关张 桃园结义,国美电器网上商城,品道天元1007007008,厨具|茶具、咖啡具|茶宠摆件,陶瓷故事 宜兴紫砂精品茶宠摆件送财灵猴纯手工超萌茶宠(招财),家居日用>茶具>陶瓷故事>陶瓷故事 宜兴紫砂精品茶宠摆件送财灵猴纯手工超萌茶宠(招财),国美电器网上商城,礼用和家居专营店1007007008,厨具|茶具、咖啡具|茶宠摆件,【东亚紫砂】精品手工宜兴紫砂茶宠摆件茶具 养壶垫杯垫 三色藕片(黄色),家居日用>茶具>爱壶人>【东亚紫砂】精品手工宜兴紫砂茶宠摆件茶具 养壶垫杯垫 三色藕片(黄色),国美电器网上商城,爱壶人紫砂旗舰店1007007008,厨具|茶具、咖啡具|茶宠摆件,云在青天 Q版小和尚 汝窑全手工摆件精品陶瓷茶具茶宠高档茶道配件,所有分类>家居家纺、锅具餐具>餐具水具>茶具1>茶宠摆件>云在青天>云在青天 Q版小和尚...,1号店,云在青天1007007008,厨具|茶具、咖啡具|茶宠摆件,特【爱壶人东亚紫砂】精品手工宜兴紫砂茶宠摆件茶具  小小聚钱袋福袋(黄灰色),家居日用>茶具>爱壶人>特【爱壶人东亚紫砂】精品手工宜兴紫砂茶宠摆件茶具  小小聚钱袋福袋(黄灰色),国美电器网上商城,爱壶人紫砂旗舰店1007007008,厨具|茶具、咖啡具|茶宠摆件,品茶忆友 宜兴拇指青娃茶宠 紫砂精品摆件 顶呱呱 功夫茶具,所有分类>家居家纺、锅具餐具>餐具水具>茶具1>茶宠摆件>品茶忆友>品茶忆友 宜兴拇指青...,1号店,品茶忆友1007007008,厨具|茶具、咖啡具|茶宠摆件,郑品 汝窑如意人生线香座 陶瓷香炉 茶宠摆件 陶瓷摆件qyt511-2,首页>家居/家装建材/厨具>餐厨用具>茶具>郑品汝窑如意人生线香座陶瓷香炉...,苏宁,郑品1007007008,厨具|茶具、咖啡具|茶宠摆件,唐宋八大家之王安石（汉白釉）,所有分类>家居家纺、锅具餐具>餐具水具>茶具1>茶宠摆件>恒福>唐宋八大家之王安石（...,1号店,恒福1007007008,厨具|茶具、咖啡具|茶宠摆件,祥龙迎福,所有分类>家居家纺、锅具餐具>餐具水具>茶具1>茶宠摆件>恒福>祥龙迎福,1号店,恒福1007007008,厨具|茶具、咖啡具|茶宠摆件,瑾瑜御瓷 景德镇陶瓷冰裂茶宠精品茶宠摆件 开心招财弥勒佛 C款驼背公公一个,厨具 > 茶具 > 茶具套装,亚马逊(卓越网),瑾瑜御瓷1007007008,厨具|茶具、咖啡具|茶宠摆件,瑞恒逸品紫砂茶宠摆件马上有福 马年幸福,厨具 > 茶具 > 茶具配件 > 茶宠,亚马逊(卓越网),瑞恒逸品1007007008,厨具|茶具、咖啡具|茶宠摆件,陶瓷故事 精品宜兴紫砂茶宠 茶玩 坐井观天 紫砂红 工艺摆件创意茶宠摆件,家装建材 > 时尚家饰 > 摆饰/挂件 > 商品详情,当当网,陶瓷故事1007007008,厨具|茶具、咖啡具|茶宠摆件,言艺精品汝瓷工艺品 紫砂汝窑茶宠摆件 富贵纳福猪 BWCC93(青色富贵猪BWCC93-B),家居日用>茶具>言艺>言艺精品汝瓷工艺品 紫砂汝窑茶宠摆件 富贵纳福猪 BWCC93(青色富贵猪BWCC93-B),国美电器网上商城,言艺家居旗舰店1007007008,厨具|茶具、咖啡具|茶宠摆件,陶瓷故事 紫砂精品茶宠摆件 紫砂送财虎全手工超萌茶宠 茶道配件,家居日用 > 厨房用品 > 水具茶具酒具 > 茶具 > 商品详情,当当网,陶瓷故事1007007008,厨具|茶具、咖啡具|茶宠摆件,陶瓷故事 宜兴紫砂茶宠摆件 瞌睡童子全手工超萌茶宠 茶道配件,家居日用 > 厨房用品 > 水具茶具酒具 > 茶具 > 商品详情,当当网,陶瓷故事1007007008,厨具|茶具、咖啡具|茶宠摆件,威尔美斯 茶宠摆件 茶道用具 紫砂茶宠一只装031 悟音137 货到付款,家居日用 > 厨房用品 > 水具茶具酒具 > 茶具 > 商品详情,当当网,威尔美斯1007007008,厨具|茶具、咖啡具|茶宠摆件,百鸿 茶宠摆件 茶具汝瓷茶宠 多款月白茶宠 DP-RYYBCC12K 坐莲观音,首页 >家居家装 >厨房餐饮 >茶具 >百鸿 茶宠摆件 茶具汝瓷茶宠 多款月白茶宠 DP-RYYBCC12K,vjia,百鸿茶具旗舰店1007007008,厨具|茶具、咖啡具|茶宠摆件,百鸿 汝窑十二生肖茶宠摆件 生肖印章 生肖装饰礼品 摆件装饰 鼠,首页 >家居家装 >厨房餐饮 >茶具 >百鸿 汝窑十二生肖茶宠摆件 生肖印章 生肖装饰礼品 摆件装饰,vjia,百鸿茶具旗舰店1007007008,厨具|茶具、咖啡具|茶宠摆件,陶瓷故事 精品紫砂茶宠摆件 招财大金蟾 手工茶宠 两色可选红色均码,家装建材 > 时尚家饰 > 摆饰/挂件 > 商品详情,当当网,红兔子1007007008,厨具|茶具、咖啡具|茶宠摆件,汉唐茶具精品紫砂茶宠摆件 宜兴手工制作茶玩 茶道配件 坐猪茶宠 坐猪,厨具>茶具/咖啡具>茶宠摆件>汉唐（hantang）>汉唐茶具精品紫砂茶宠摆件 宜兴手工制作茶...,京东商城,汉唐家居官方旗舰店1007007008,厨具|茶具、咖啡具|茶宠摆件,汉唐茶具精品紫砂茶宠摆件 宜兴手工 松鼠拖盖茶宠茶玩 功夫茶具配件 黄色,厨具>茶具/咖啡具>茶宠摆件>汉唐（hantang）>汉唐茶具精品紫砂茶宠摆件 宜兴手工 松鼠...,京东商城,汉唐家居官方旗舰店1007007008,厨具|茶具、咖啡具|茶宠摆件,黄龙壶缘 宜兴紫砂手工茶宠 （墨绿泥辟邪茶宠摆件）原矿墨绿泥 紫砂茶宠茶具,厨具>茶具/咖啡具>茶宠摆件>黄龙壶缘 宜兴紫砂手工茶宠 （墨绿泥辟邪...,京东商城,黄龙壶缘1007007008,厨具|茶具、咖啡具|茶宠摆件,岩森活檀香塔香沉香道 高山流水陶瓷熏香炉香薰灯炉器具 LS-907中号莲花香炉,厨具>茶具/咖啡具>茶宠摆件>堂哥窑（Tigeryao）>岩森活檀香塔香沉香道 高山流水陶瓷熏香炉...,京东商城,莱盛工坊1007007008,厨具|茶具、咖啡具|茶宠摆件,无器 汝窑 南极仙翁 老寿星 茶宠 摆件 茶具配件 CC25811,厨具>茶具/咖啡具>茶宠摆件>无器>无器 汝窑 南极仙翁 老寿星 茶宠 摆件...,京东商城,一善禅家居专营店1007007008,厨具|茶具、咖啡具|茶宠摆件,陶立方 紫砂茶宠 精品手工青瓷开片茶玩 弥勒佛大茶宠摆件TF-5078 道逍遥,厨具>茶具/咖啡具>茶宠摆件>陶立方 >陶立方 紫砂茶宠 精品手工青瓷开片茶玩...,京东商城,陶立方官方旗舰店1007007008,厨具|茶具、咖啡具|茶宠摆件,汉唐精品手工 紫砂茶玩茶宠摆件 茶具茶盘配件 茶宠小荷花禅 紫色,厨具>茶具/咖啡具>茶宠摆件>汉唐（hantang）>汉唐精品手工 紫砂茶玩茶宠摆件 茶具茶盘...,京东商城,汉唐家居官方旗舰店1007007008,厨具|茶具、咖啡具|茶宠摆件,德化商城 精品哥窑茶宠 茶具配件 汝窑茶宠紫砂茶宠茶玩摆件 茶道零配 琴,厨具>茶具/咖啡具>茶宠摆件>龙鹏>德化商城 精品哥窑茶宠 茶具配件 汝窑茶...,京东商城,德化商城专营店1007007008,厨具|茶具、咖啡具|茶宠摆件,十二生肖开片汝窑茶宠茶道功夫茶具 陶瓷茶玩工艺品摆件 哥窑 虎,厨具>茶具/咖啡具>茶宠摆件>品茶忆友>十二生肖开片汝窑茶宠茶道功夫茶具 陶瓷茶...,京东商城,品茶忆友旗舰店1007007008,厨具|茶具、咖啡具|茶宠摆件,旭旭的壶 宜兴紫砂茶道配件 茶具配饰 茶宠摆件 茶玩精品朱泥龙龟 图片色,厨具>茶具/咖啡具>茶宠摆件>旭旭的壶>旭旭的壶 宜兴紫砂茶道配件 茶具配饰 茶...,京东商城,1007007008,厨具|茶具、咖啡具|茶宠摆件,宜兴紫砂茶道配件 茶具配饰 茶宠摆件 茶玩精品 喷水青蛙田螺 图片色,厨具>茶具/咖啡具>茶宠摆件>旭旭的壶>宜兴紫砂茶道配件 茶具配饰 茶宠摆件 茶...,京东商城,1007007008,厨具|茶具、咖啡具|茶宠摆件,百鸿 12生肖万福窑茶宠摆件 茶具配件 茶玩 汝窑茶宠 陶瓷茶宠 WP12YYSX 兔,厨具>茶具/咖啡具>茶宠摆件>百鸿>百鸿 12生肖万福窑茶宠摆件 茶具配件 ...,京东商城,百鸿旗舰店1007007008,厨具|茶具、咖啡具|茶宠摆件,【爱壶人东亚紫砂】精品手工宜兴紫砂茶宠摆件茶具 欢喜连连兔 单个价 黄色兔子,厨具>茶具/咖啡具>茶宠摆件>爱壶人>【爱壶人东亚紫砂】精品手工宜兴紫砂茶宠摆...,京东商城,null1007007008,厨具|茶具、咖啡具|茶宠摆件,莲品 精品哥窑开片茶宠(大号)摆件德化陶瓷 手工制作 茶盘必备 收藏送亲朋 寿星,厨具>茶具/咖啡具>茶宠摆件>莲品>莲品 精品哥窑开片茶宠(大号)摆件德化陶...,京东商城,1007007008,厨具|茶具、咖啡具|茶宠摆件,瑞恒逸品紫砂茶宠摆件福寿双全寿桃 精品雕塑 造型逼真 添福添寿摆件,厨具>茶具/咖啡具>茶宠摆件>瑞恒逸品>瑞恒逸品紫砂茶宠摆件福寿双全寿桃 精品雕...,京东商城,1007007008,厨具|茶具、咖啡具|茶宠摆件,礼米 茶宠摆件 变色茶宠茶玩 功夫茶具配件 茶道配件 茶道必备CC41ZSVV17K 变色红虎,厨具>茶具/咖啡具>茶宠摆件>礼米>礼米 茶宠摆件 变色茶宠茶玩 功夫茶具配...,京东商城,礼米官方旗舰店1007007008,厨具|茶具、咖啡具|茶宠摆件,宜兴紫砂小和尚 祝福小沙弥 茶宠摆件 茶玩精品茶盘摆件 黄衣,厨具>茶具/咖啡具>茶宠摆件>陶先生（Mrtao） >宜兴紫砂小和尚 祝福小沙弥 茶宠摆件 茶...,京东商城,1007007008,厨具|茶具、咖啡具|茶宠摆件,郑品 汝窑十二生肖茶宠摆件 生肖印章 生肖装饰礼品 摆件装饰WP12YYSX 蛇,厨具>茶具/咖啡具>茶宠摆件>郑品>郑品 汝窑十二生肖茶宠摆件 生肖印章 生...,京东商城,郑品茶具旗舰店