1007007001,厨具|茶具、咖啡具|整套茶具,郑品 宜兴紫砂茶具茶盘 整套电磁炉茶具套装Z-XKV41K 马到成功,厨具>茶具/咖啡具>整套茶具>郑品 宜兴紫砂茶具茶盘 整套电磁炉茶具...,京东商城,郑品茶具旗舰店1007007001,厨具|茶具、咖啡具|整套茶具,郑品 月白荷韵汝窑茶具陶瓷茶具套装DTYBHY06,厨具>茶具/咖啡具>整套茶具>郑品 月白荷韵汝窑茶具陶瓷茶具套装DTY...,京东商城,郑品茶具旗舰店1007007001,厨具|茶具、咖啡具|整套茶具,郑品 唐诗陶瓷功夫茶具套装11件DTT1Y062,厨具>茶具/咖啡具>整套茶具>郑品 唐诗陶瓷功夫茶具套装11件DTT1...,京东商城,郑品茶具旗舰店1007007001,厨具|茶具、咖啡具|整套茶具,郑品 龙泉青瓷梅花陶瓷功夫茶具套装9件G75442085,厨具>茶具/咖啡具>整套茶具>郑品 龙泉青瓷梅花陶瓷功夫茶具套装9件G...,京东商城,郑品茶具旗舰店1007007001,厨具|茶具、咖啡具|整套茶具,郑品 汝窑开片裂纹月白陶瓷功夫茶具套装DTRBCR07,厨具>茶具/咖啡具>整套茶具>郑品 汝窑开片裂纹月白陶瓷功夫茶具套装D...,京东商城,郑品茶具旗舰店1007007001,厨具|茶具、咖啡具|整套茶具,郑品 名家壶 宜兴紫砂壶 功夫茶具 整套茶具DTZ1Y078,厨具>茶具/咖啡具>整套茶具>郑品 名家壶 宜兴紫砂壶 功夫茶具 整套...,京东商城,郑品茶具旗舰店1007007001,厨具|茶具、咖啡具|整套茶具,博度bodoo一壶两杯二杯茶具竹托盘套装办公室家居旅行简易陶瓷整套功夫茶具海螺结晶釉独家 碧海蓝带烟灰缸,厨具>茶具/咖啡具>整套茶具>博度bodoo一壶两杯二杯茶具竹托盘套装...,京东商城,博度旗舰店1007007001,厨具|茶具、咖啡具|整套茶具,东茶西壶 整套茶具套装 双层大杯茶具(精)飞燕荷花(7头双层杯),厨具>茶具/咖啡具>整套茶具>东茶西壶 整套茶具套装 双层大杯茶具(精...,京东商城,东茶西壶旗舰店1007007001,厨具|茶具、咖啡具|整套茶具,东茶西壶 整套茶具配件 隔热双层杯 双层大杯茶具(精)红金福寿(7头双层杯),厨具>茶具/咖啡具>整套茶具>东茶西壶 整套茶具配件 隔热双层杯 双层...,京东商城,东茶西壶旗舰店1007007001,厨具|茶具、咖啡具|整套茶具,汝窑茶具,茶具套装,陶瓷茶具,礼盒包装,功夫茶具,天青汝窑祥云壶,厨具>茶具/咖啡具>整套茶具>京礼道>汝窑茶具,茶具套装,陶瓷茶具,礼盒包装,...,京东商城,京礼道1007007001,厨具|茶具、咖啡具|整套茶具,祥鸿德景德镇8头茶具套装 CJJJ-03CP 蓝海龙 普通包装,厨具>茶具/咖啡具>整套茶具>祥鸿德>祥鸿德景德镇8头茶具套装 CJJJ-03...,京东商城,祥鸿德陶瓷旗舰店1007007001,厨具|茶具、咖啡具|整套茶具,祥鸿德景德镇8头双层防烫茶具套装 CJJJ-05CPB 踏雪寻梅 普通包装,厨具>茶具/咖啡具>整套茶具>祥鸿德>祥鸿德景德镇8头双层防烫茶具套装 CJJ...,京东商城,祥鸿德陶瓷旗舰店1007007001,厨具|茶具、咖啡具|整套茶具,唐丰茶具 茶盘整套紫砂 功夫茶壶茶具套装电磁炉组合 第二款,厨具>茶具/咖啡具>整套茶具>信柏SURPAQ >唐丰茶具 茶盘整套紫砂 功夫茶壶茶具套装...,京东商城,臻茗尚品茶艺轩1007007001,厨具|茶具、咖啡具|整套茶具,陶立方 飘逸杯组合茶具 新款高档送礼功夫茶具开片汝窑茶杯套装TF-5018 绕梁余香-天青礼盒装,厨具>茶具/咖啡具>整套茶具>陶立方 >陶立方 飘逸杯组合茶具 新款高档送礼功夫...,京东商城,陶立方官方旗舰店1007007001,厨具|茶具、咖啡具|整套茶具,京礼道 天蓝汝窑功夫整套茶具套装,厨具>茶具/咖啡具>整套茶具>京礼道>京礼道 天蓝汝窑功夫整套茶具套装,京东商城,京礼道1007007001,厨具|茶具、咖啡具|整套茶具,京礼道 月白汝窑功夫整套茶具套装,厨具>茶具/咖啡具>整套茶具>京礼道 月白汝窑功夫整套茶具套装,京东商城,京礼道1007007001,厨具|茶具、咖啡具|整套茶具,陶瓷故事 飘逸杯办公茶具玻璃杯700A加耐热玻璃带柄茶杯4个组合价,厨具>茶具/咖啡具>整套茶具>陶瓷故事 飘逸杯办公茶具玻璃杯700A加...,京东商城,夏至家居1007007001,厨具|茶具、咖啡具|整套茶具,景德镇浩东陶瓷7头釉中彩青花瓷 双层隔热茶具套装 礼盒包装 园林,厨具>茶具/咖啡具>整套茶具>景德镇浩东陶瓷7头釉中彩青花瓷 双层隔热...,京东商城,浩东陶瓷官方旗舰店1007007001,厨具|茶具、咖啡具|整套茶具,藏壶者宜兴紫砂壶 名家手工（西施壶6件套）原矿黑墩头 紫砂茶具茶壶 260cc,厨具>茶具/咖啡具>整套茶具>藏壶者宜兴紫砂壶 名家手工（西施壶6件套...,京东商城,藏壶者旗舰店1007007001,厨具|茶具、咖啡具|整套茶具,淘瓷公社 尊贵智能电热实木茶盘/(三合一/) 黑釉金丝牡丹茶具,厨具>茶具/咖啡具>整套茶具>淘瓷公社 尊贵智能电热实木茶盘/(三合一...,京东商城,淘瓷公社1007007001,厨具|茶具、咖啡具|整套茶具,韵泰 紫砂功夫茶具实木套装 茶道电磁炉檀木茶盘YT-90208 黑檀大汉至尊-虎啸,厨具>茶具/咖啡具>整套茶具>韵泰 紫砂功夫茶具实木套装 茶道电磁炉檀...,京东商城,韵泰官方旗舰店1007007001,厨具|茶具、咖啡具|整套茶具,唐丰 和谐鸡翅木整套功夫茶具套装 实木茶盘 3合一抽水电热炉 紫砂汝窑汝瓷陶瓷礼品1504 鸡翅和谐-三羊开泰,厨具>茶具/咖啡具>整套茶具>唐丰>唐丰 和谐鸡翅木整套功夫茶具套装 实木茶...,京东商城,唐丰官方旗舰店1007007001,厨具|茶具、咖啡具|整套茶具,唐采 『齐白石』圆满系列 茶具组9201,厨具>茶具/咖啡具>整套茶具>唐采 『齐白石』圆满系列 茶具组9201,京东商城,易居尚官方旗舰店1007007001,厨具|茶具、咖啡具|整套茶具,陶之念 白金叶7头茶具 景德镇茶具套装,厨具>茶具/咖啡具>整套茶具>陶之念>陶之念 白金叶7头茶具 景德镇茶具套装,京东商城,陶恋坊陶瓷旗舰店1007007001,厨具|茶具、咖啡具|整套茶具,奇神 宜兴紫砂 金镶玉紫砂套装 仿古红,厨具>茶具/咖啡具>整套茶具>奇神 宜兴紫砂 金镶玉紫砂套装 仿古红,京东商城,艺福堂茶具专营店1007007001,厨具|茶具、咖啡具|整套茶具,陶瓷故事 茶具套装 定窑白简约8件套组 功夫茶具茶壶茶杯精品礼盒装,厨具>茶具/咖啡具>整套茶具>陶瓷故事 茶具套装 定窑白简约8件套组 ...,京东商城,缤纷家居馆1007007001,厨具|茶具、咖啡具|整套茶具,常生源 整套功夫茶具茶盘鸡翅木黑檀紫砂电磁套装 祥云降福-汝窑南瓜,厨具>茶具/咖啡具>整套茶具>常生源>常生源 整套功夫茶具茶盘鸡翅木黑檀紫砂电...,京东商城,常生源官方旗舰店1007007001,厨具|茶具、咖啡具|整套茶具,祥福哥颂 整套龙泉青瓷功夫茶具套装 哥窑陶瓷茶具带梅子青茶壶茶杯GS02 米黄釉套装,厨具>茶具/咖啡具>整套茶具>祥福>祥福哥颂 整套龙泉青瓷功夫茶具套装 哥窑...,京东商城,祥福官方旗舰店1007007001,厨具|茶具、咖啡具|整套茶具,雅川礼瓷 薄胎青花· 骨瓷功夫茶具 ·9头富贵牡丹,厨具>茶具/咖啡具>整套茶具>雅川礼瓷 薄胎青花· 骨瓷功夫茶具 ...,京东商城,雅川礼瓷1007007001,厨具|茶具、咖啡具|整套茶具,君肴 瓷都德化 整套功夫茶具套装 陶瓷茶具14件套 多款可选 黑竹子 安全泡沫包装,厨具>茶具/咖啡具>整套茶具>君肴 瓷都德化 整套功夫茶具套装 陶瓷茶...,京东商城,君肴家瓷生活馆1007007001,厨具|茶具、咖啡具|整套茶具,德化商城 言艺茶具 正品冰裂釉 冰裂茶具 6色杯茶具套装 BWBT15 冰裂配不抽水电磁炉BWBT15,厨具>茶具/咖啡具>整套茶具>言艺>德化商城 言艺茶具 正品冰裂釉 冰裂茶具...,京东商城,德化商城专营店1007007001,厨具|茶具、咖啡具|整套茶具,陆宝（LUPAO) 镜清茶道套装 盖碗茶杯能量球 陶瓷茶具B121 悦然盖碗雅致黑,厨具>茶具/咖啡具>整套茶具>陆宝（LUPAO） >陆宝（LUPAO) 镜清茶道套装 盖碗...,京东商城,青石道旗舰店1007007001,厨具|茶具、咖啡具|整套茶具,瑞瓷掬 茶具套装 汝窑功夫茶具套装 9头翠鸟茶具+君子大茶盘,厨具>茶具/咖啡具>整套茶具>瑞瓷掬（Ruiciju）>瑞瓷掬 茶具套装 汝窑功夫茶具套装 9...,京东商城,景德瓷生活馆1007007001,厨具|茶具、咖啡具|整套茶具,一茶一坐飘逸壶四件 整套茶具套装 一壶两杯托盘茶盘 过滤玻璃茶壶茶杯玻璃杯,厨具>茶具/咖啡具>整套茶具>一茶一坐飘逸壶四件 整套茶具套装 一壶两...,京东商城,生活办公用品商城1007007001,厨具|茶具、咖啡具|整套茶具,德化商城 茶具 白瓷手绘青花茶具套装 荷花功夫茶具整套六件,厨具>茶具/咖啡具>整套茶具>言艺>德化商城 茶具 白瓷手绘青花茶具套装 荷...,京东商城,德化商城专营店1007007001,厨具|茶具、咖啡具|整套茶具,德化商城 宜兴紫砂茶具套装莲花功夫茶具特价整套茶具实木茶盘套装,厨具>茶具/咖啡具>整套茶具>德化商城 宜兴紫砂茶具套装莲花功夫茶具特...,京东商城,德化商城专营店1007007001,厨具|茶具、咖啡具|整套茶具,祥鸿德紫砂冰裂茶具套装功夫茶具祥云四合一电磁炉 CJTZ-04BL 侧把紫砂 普通包装,厨具>茶具/咖啡具>整套茶具>祥鸿德>祥鸿德紫砂冰裂茶具套装功夫茶具祥云四合一...,京东商城,祥鸿德陶瓷旗舰店1007007001,厨具|茶具、咖啡具|整套茶具,祥鸿德紫砂功夫茶具套装祥云茶盘四合一电磁炉 CJTZ-03BL 全黑紫砂 普通包装,厨具>茶具/咖啡具>整套茶具>祥鸿德>祥鸿德紫砂功夫茶具套装祥云茶盘四合一电磁...,京东商城,祥鸿德陶瓷旗舰店1007007001,厨具|茶具、咖啡具|整套茶具,岩森活茶具 汝窑 一壶两杯企鹅壶 办公旅行功夫茶具 LS-803 天青,厨具>茶具/咖啡具>整套茶具>岩森活茶具 汝窑 一壶两杯企鹅壶 办公旅...,京东商城,莱盛工坊1007007001,厨具|茶具、咖啡具|整套茶具,Art Craft 玻璃茶具套装 茶壶 茶杯 花茶壶 茶具套装 600ml壶+2杯,厨具>茶具/咖啡具>整套茶具>亚诺>Art Craft 玻璃茶具套装 茶壶 ...,京东商城,宜品家居馆1007007001,厨具|茶具、咖啡具|整套茶具,德化商城 茶具套装特价 整套茶具 陶瓷功夫茶具 电磁炉实木茶盘 牡丹白瓷,厨具>茶具/咖啡具>整套茶具>德化商城 茶具套装特价 整套茶具 陶瓷功...,京东商城,德化商城专营店1007007001,厨具|茶具、咖啡具|整套茶具,鑫徳鸿窑 整套开片汝窑陶瓷功夫茶具 配黑檀花梨实木茶盘茶具套装TZ055,厨具>茶具/咖啡具>整套茶具>鑫德鸿窑>鑫徳鸿窑 整套开片汝窑陶瓷功夫茶具 配黑...,京东商城,皇茗旗舰店1007007001,厨具|茶具、咖啡具|整套茶具,陶瓷故事 恒福工夫茶具 汝窑开片喜乐壶组一壶五杯 粉青,厨具>茶具/咖啡具>整套茶具>陶瓷故事 恒福工夫茶具 汝窑开片喜乐壶组...,京东商城,缤纷家居馆1007007001,厨具|茶具、咖啡具|整套茶具,德化商城 汝窑功夫茶具 陶瓷茶具套装 多款可选礼盒包装 套餐三天青汝窑三足平底茶具,厨具>茶具/咖啡具>整套茶具>龙鹏>德化商城 汝窑功夫茶具 陶瓷茶具套装 多...,京东商城,德化商城专营店1007007001,厨具|茶具、咖啡具|整套茶具,鑫徳鸿窑 整套冰裂陶瓷功夫茶具套装 带四合一电磁炉实木茶盘茶具组合TZ065 套餐四,厨具>茶具/咖啡具>整套茶具>鑫德鸿窑>鑫徳鸿窑 整套冰裂陶瓷功夫茶具套装 带四...,京东商城,皇茗旗舰店1007007001,厨具|茶具、咖啡具|整套茶具,鑫徳鸿窑 整套冰裂陶瓷功夫茶具套装 带四合一电磁炉实木茶盘茶具组合TZ065 套餐二十四,厨具>茶具/咖啡具>整套茶具>鑫德鸿窑>鑫徳鸿窑 整套冰裂陶瓷功夫茶具套装 带四...,京东商城,皇茗旗舰店1007007001,厨具|茶具、咖啡具|整套茶具,岩森活 手绘青花陶瓷提梁壶 茶壶手提壶 小茶壶功夫茶具泡茶壶过滤壶 LS-830 高白玉瓷,厨具>茶具/咖啡具>整套茶具>岩森活>岩森活 手绘青花陶瓷提梁壶 茶壶手提壶 ...,京东商城,莱盛工坊1007007001,厨具|茶具、咖啡具|整套茶具,关耳窑 紫砂陶瓷茶具套装 功夫茶具整套 柏木茶盘电磁炉 陶瓷茶具TZ-BJYS052K 款式六马到成功,厨具>茶具/咖啡具>整套茶具>关耳窑 紫砂陶瓷茶具套装 功夫茶具整套 ...,京东商城,关耳窑旗舰店1007007001,厨具|茶具、咖啡具|整套茶具,诗心景德镇陶瓷功夫茶具套装欧式 色釉紫金蓝,厨具>茶具/咖啡具>整套茶具>诗心景德镇陶瓷功夫茶具套装欧式 色釉紫金...,京东商城,诗心旗舰店1007007001,厨具|茶具、咖啡具|整套茶具,水善品 玉瓷粉彩功夫茶具茶盘组合套装 配 茶道配件 送 八包铁观音茶叶,厨具>茶具/咖啡具>整套茶具>水善品>水善品 玉瓷粉彩功夫茶具茶盘组合套装 配...,京东商城,水善品瓷艺家居1007007001,厨具|茶具、咖啡具|整套茶具,左器茶具 开片汝窑 仿宋陶瓷功夫茶具整套茶具功夫茶 高档汝窑茶具礼盒装送礼 TZ03 壶组,厨具>茶具/咖啡具>整套茶具>左器茶具 开片汝窑 仿宋陶瓷功夫茶具整套...,京东商城,左器生活馆1007007001,厨具|茶具、咖啡具|整套茶具,瑞瓷掬茶具套装 哥窑功夫茶具套装 陶瓷整套茶具 8头哥窑茶具套装,厨具>茶具/咖啡具>整套茶具>瑞瓷掬（Ruiciju）>瑞瓷掬茶具套装 哥窑功夫茶具套装 陶瓷整...,京东商城,景德瓷生活馆1007007001,厨具|茶具、咖啡具|整套茶具,常生源 宜兴紫砂功夫茶具茶壶茶杯套装 紫砂虎啸,厨具>茶具/咖啡具>整套茶具>常生源>常生源 宜兴紫砂功夫茶具茶壶茶杯套装 紫...,京东商城,常生源官方旗舰店1007007001,厨具|茶具、咖啡具|整套茶具,祥福 整套宜兴紫砂汝窑陶瓷功夫茶具套装 配电磁炉木茶盘茶具组合TZ069 套餐四,厨具>茶具/咖啡具>整套茶具>祥福>祥福 整套宜兴紫砂汝窑陶瓷功夫茶具套装 ...,京东商城,祥福官方旗舰店1007007001,厨具|茶具、咖啡具|整套茶具,唐丰 特价原木柯木荷花整套功夫茶具套装 实木茶盘 3合一抽水电热炉 紫砂汝窑陶瓷礼品0 柯木荷花-铁锈釉祥者,厨具>茶具/咖啡具>整套茶具>唐丰>唐丰 特价原木柯木荷花整套功夫茶具套装 ...,京东商城,唐丰官方旗舰店1007007001,厨具|茶具、咖啡具|整套茶具,百鸿 陶瓷茶具套装 整套功夫茶具 柏木茶盘电磁炉 陶瓷茶具特价 TZ-BJYS052K 黑釉金龙,厨具>茶具/咖啡具>整套茶具>百鸿 陶瓷茶具套装 整套功夫茶具 柏木茶...,京东商城,百鸿旗舰店1007007001,厨具|茶具、咖啡具|整套茶具,诗心景德镇陶瓷托盘茶具套装 白色浮雕古龙,厨具>茶具/咖啡具>整套茶具>诗心景德镇陶瓷托盘茶具套装 白色浮雕古龙,京东商城,诗心旗舰店1007007001,厨具|茶具、咖啡具|整套茶具,诗心景德镇陶瓷茶具套装功夫茶杯,厨具>茶具/咖啡具>整套茶具>诗心景德镇陶瓷茶具套装功夫茶杯,京东商城,诗心旗舰店1007007001,厨具|茶具、咖啡具|整套茶具,华盛和 宜兴 紫砂壶 紫砂功夫茶具套装 茶具礼盒套装 梅花壶 紫泥 200cc 原版套装,厨具>茶具/咖啡具>整套茶具>华盛和>华盛和 宜兴 紫砂壶 紫砂功夫茶具套装 ...,京东商城,玉臻陶艺1007007001,厨具|茶具、咖啡具|整套茶具,关耳窑 峻宇雕墙茶具茶盘套装 整套茶具汝窑陶瓷T-ZBZB003 款式G,厨具>茶具/咖啡具>整套茶具>关耳窑 峻宇雕墙茶具茶盘套装 整套茶具汝...,京东商城,关耳窑旗舰店1007007001,厨具|茶具、咖啡具|整套茶具,唐丰 进口红木黑檀木悠然整套功夫茶具套装 实木茶盘 紫砂汝窑 茶壶茶海茶道陶瓷礼 D款悠然-陶瓷龙舟白套装,厨具>茶具/咖啡具>整套茶具>唐丰 进口红木黑檀木悠然整套功夫茶具套装...,京东商城,唐丰官方旗舰店1007007001,厨具|茶具、咖啡具|整套茶具,郑品 整套茶具茶盘套装 陶瓷紫砂茶具 电磁炉套装Z-YSWUS4K 养神A电水壶套装,厨具>茶具/咖啡具>整套茶具>郑品 整套茶具茶盘套装 陶瓷紫砂茶具 电...,京东商城,郑品茶具旗舰店1007007001,厨具|茶具、咖啡具|整套茶具,关耳窑 紫砂茶具套装 百家姓乌金石茶盘 茶具茶盘套装 功夫茶具Z-S4ZLV 百家姓大富套装3合1,厨具>茶具/咖啡具>整套茶具>关耳窑 紫砂茶具套装 百家姓乌金石茶盘 ...,京东商城,关耳窑旗舰店1007007001,厨具|茶具、咖啡具|整套茶具,关耳窑 多款茶盘青花瓷茶具套装 陶瓷紫砂茶具 茶盘电磁炉TZ-QHCTZ10 杯架祥云电磁炉套装,厨具>茶具/咖啡具>整套茶具>关耳窑 多款茶盘青花瓷茶具套装 陶瓷紫砂...,京东商城,关耳窑旗舰店1007007001,厨具|茶具、咖啡具|整套茶具,丰陶张生 正品汝窑套装茶具 汝瓷茶壶 公道杯 茶碗 礼盒10头 汝窑盖碗套装,厨具>茶具/咖啡具>整套茶具>丰陶张生 正品汝窑套装茶具 汝瓷茶壶 公...,京东商城,丰陶张生家居馆1007007001,厨具|茶具、咖啡具|整套茶具,玩土成金 磨砂玉玲珑茶具套装,厨具>茶具/咖啡具>整套茶具>玩土成金 磨砂玉玲珑茶具套装,京东商城,景德镇秦朗瓷业1007007001,厨具|茶具、咖啡具|整套茶具,玩土成金 景德镇10头功夫茶具套装 硕果累累,厨具>茶具/咖啡具>整套茶具>玩土成金 景德镇10头功夫茶具套装 硕果...,京东商城,景德镇秦朗瓷业1007007001,厨具|茶具、咖啡具|整套茶具,爱安贝 aianbei 景德镇蝶恋花提梁壶功夫茶具套装 七头套装 LQ-150（不含茶盘）,厨具>茶具/咖啡具>整套茶具>爱安贝（ianbei）>爱安贝 aianbei 景德镇蝶恋花提梁...,京东商城,上海爱安贝aianbei官方旗舰店1007007001,厨具|茶具、咖啡具|整套茶具,郑品 整套陶瓷紫砂茶具实木茶盘套装 功夫茶具紫砂 电磁炉茶盘TZ-CKMDCG025 紫砂内白套装,厨具>茶具/咖啡具>整套茶具>郑品 整套陶瓷紫砂茶具实木茶盘套装 功夫...,京东商城,郑品茶具旗舰店1007007001,厨具|茶具、咖啡具|整套茶具,陶瓷故事 茶具套装定窑白简约8件套组功夫茶具茶壶茶杯精品礼盒装,厨具>茶具/咖啡具>整套茶具>陶瓷故事 茶具套装定窑白简约8件套组功夫...,京东商城,祥韧家居生活馆1007007001,厨具|茶具、咖啡具|整套茶具,雅诚德 天堂鸟7头茶具 一壶六杯陶瓷 茶具 茶壶茶杯,厨具>茶具/咖啡具>整套茶具>雅诚德 天堂鸟7头茶具 一壶六杯陶瓷 茶...,京东商城,祥韧家居生活馆1007007001,厨具|茶具、咖啡具|整套茶具,快乐鱼 中国龙球壶 茶具五件套 茶具套装 AJH63,厨具>茶具/咖啡具>整套茶具>快乐鱼 中国龙球壶 茶具五件套 茶具套装...,京东商城,祥韧家居生活馆1007007001,厨具|茶具、咖啡具|整套茶具,快乐鱼 圆口壶配茶具 仕女图陶瓷茶具套装 五件套茶杯 AJH60,厨具>茶具/咖啡具>整套茶具>快乐鱼 圆口壶配茶具 仕女图陶瓷茶具套装...,京东商城,祥韧家居生活馆1007007001,厨具|茶具、咖啡具|整套茶具,飘逸玻璃杯 可拆洗泡茶器茶壶套装 -AKT-008-,厨具>茶具/咖啡具>整套茶具>飘逸玻璃杯 可拆洗泡茶器茶壶套装 -AK...,京东商城,祥韧家居生活馆1007007001,厨具|茶具、咖啡具|整套茶具,华威礼业 台湾聚宝龙汝窑 美人响杯套组 天青色可开片 汝窑汝瓷茶具套装,厨具>茶具/咖啡具>整套茶具>华威礼业 台湾聚宝龙汝窑 美人响杯套组 ...,京东商城,华威礼业1007007001,厨具|茶具、咖啡具|整套茶具,唐丰 整套茶具茶盘鸡翅木实木功夫茶具套装 第二款,厨具>茶具/咖啡具>整套茶具>唐丰>唐丰 整套茶具茶盘鸡翅木实木功夫茶具套装...,京东商城,臻茗尚品茶艺轩1007007001,厨具|茶具、咖啡具|整套茶具,陶瓷故事 茶具套装定窑白简约8件套组功夫茶具茶壶茶杯精品礼盒装,厨具>茶具/咖啡具>整套茶具>陶瓷故事 茶具套装定窑白简约8件套组功夫...,京东商城,祥韧家居生活馆1007007001,厨具|茶具、咖啡具|整套茶具,汝窑祥云茶侧茶具套装 开片功夫茶具套组 天青,厨具>茶具/咖啡具>整套茶具>汝窑祥云茶侧茶具套装 开片功夫茶具套组 ...,京东商城,祥韧家居生活馆1007007001,厨具|茶具、咖啡具|整套茶具,唐丰 高端贵尊黑檀花梨木整套功夫茶具套装 实木茶盘 3合一抽水电热炉 紫砂汝窑陶瓷1515 花梨贵尊-铜瓷同醉,厨具>茶具/咖啡具>整套茶具>唐丰>唐丰 高端贵尊黑檀花梨木整套功夫茶具套装...,京东商城,唐丰官方旗舰店1007007001,厨具|茶具、咖啡具|整套茶具,唐丰 黑檀木象吉功夫茶具套装 带烟灰缸实木茶盘 3合一抽水电热炉 汝窑紫砂陶瓷茶具1462 D黑檀象吉铁锈祥者,厨具>茶具/咖啡具>整套茶具>唐丰>唐丰 黑檀木象吉功夫茶具套装 带烟灰缸实...,京东商城,唐丰官方旗舰店1007007001,厨具|茶具、咖啡具|整套茶具,新瓷代 清平乐茶具套 陶瓷茶具套装 一壶四杯碟 礼盒包装 包邮,厨具>茶具/咖啡具>整套茶具>新瓷代 清平乐茶具套 陶瓷茶具套装 一壶...,京东商城,新瓷代旗舰店1007007001,厨具|茶具、咖啡具|整套茶具,祥福 整块特大乌金石茶具套装 开片汝窑陶瓷茶具组 石制黑金石茶海茶盘TZ023 海角七号+心心相印绿,厨具>茶具/咖啡具>整套茶具>祥福>祥福 整块特大乌金石茶具套装 开片汝窑陶...,京东商城,祥福官方旗舰店1007007001,厨具|茶具、咖啡具|整套茶具,新瓷代 假日天堂茶具套 精美陶瓷茶具套 配茶盘 实用礼品,厨具>茶具/咖啡具>整套茶具>新瓷代 假日天堂茶具套 精美陶瓷茶具套 ...,京东商城,新瓷代旗舰店1007007001,厨具|茶具、咖啡具|整套茶具,常生源 整套茶具花梨实木竹茶盘功夫陶瓷茶具套装 花梨汉典-汝窑南瓜,厨具>茶具/咖啡具>整套茶具>常生源>常生源 整套茶具花梨实木竹茶盘功夫陶瓷茶...,京东商城,常生源官方旗舰店1007007001,厨具|茶具、咖啡具|整套茶具,唐丰茶具 柯木茶盘汝窑开片汝瓷电磁炉整套装,厨具>茶具/咖啡具>整套茶具>信柏SURPAQ >唐丰茶具 柯木茶盘汝窑开片汝瓷电磁炉整套...,京东商城,臻茗尚品茶艺轩1007007001,厨具|茶具、咖啡具|整套茶具,唐丰 紫砂茶具 原矿紫砂 整套茶具《仿古》范君华作品TF-360 仿古茶具,厨具>茶具/咖啡具>整套茶具>唐丰>唐丰 紫砂茶具 原矿紫砂 整套茶具《仿古...,京东商城,唐丰官方旗舰店1007007001,厨具|茶具、咖啡具|整套茶具,君肴 紫砂功夫茶具升级套装 幽雅清香实木茶盘 排水 随手泡烧水壶,厨具>茶具/咖啡具>整套茶具>君肴 紫砂功夫茶具升级套装 幽雅清香实木...,京东商城,君肴家瓷生活馆1007007001,厨具|茶具、咖啡具|整套茶具,祥鸿德紫砂功夫茶具套装组合带盘电茶壶 CJTZ-04JS 白釉紫砂黑色 普通包装,厨具>茶具/咖啡具>整套茶具>祥鸿德>祥鸿德紫砂功夫茶具套装组合带盘电茶壶 C...,京东商城,祥鸿德陶瓷旗舰店1007007001,厨具|茶具、咖啡具|整套茶具,中闽富润屋 电镀茶具离子镀茶具电镀银 10入福寿无疆礼盒包装,厨具>茶具/咖啡具>整套茶具>中闽富润屋 电镀茶具离子镀茶具电镀银 1...,京东商城,中闽富润屋旗舰店1007007001,厨具|茶具、咖啡具|整套茶具,中闽富润屋 红釉茶具(精品)红釉虚线花10入茶具套装 礼盒包装,厨具>茶具/咖啡具>整套茶具>中闽富润屋 红釉茶具(精品)红釉虚线花1...,京东商城,中闽富润屋旗舰店1007007001,厨具|茶具、咖啡具|整套茶具,景德镇浩东陶瓷 釉中彩 青花瓷 旅游茶具 便携茶具 7头功夫茶具套装 鲤鱼跃龙门,厨具>茶具/咖啡具>整套茶具>景德镇浩东陶瓷 釉中彩 青花瓷 旅游茶具...,京东商城,浩东陶瓷官方旗舰店1007007001,厨具|茶具、咖啡具|整套茶具,恒越 8头兰荷之舞美人瓶茶具 整套茶具 功夫茶具 茶具套装 礼盒装,厨具>茶具/咖啡具>整套茶具>恒越 8头兰荷之舞美人瓶茶具 整套茶具 ...,京东商城,南岭窑陶瓷旗舰店1007007001,厨具|茶具、咖啡具|整套茶具,祥鸿德冰裂多彩功夫茶具套装带四合一电磁炉整套茶具 CJTZ-02QC 七彩色 普通包装,厨具>茶具/咖啡具>整套茶具>祥鸿德>祥鸿德冰裂多彩功夫茶具套装带四合一电磁炉...,京东商城,祥鸿德陶瓷旗舰店1007007001,厨具|茶具、咖啡具|整套茶具,藏壶者宜兴紫砂壶 名家手工（仿古壶6件套装）原矿黑墩头 紫砂茶具茶壶 230cc,厨具>茶具/咖啡具>整套茶具>藏壶者宜兴紫砂壶 名家手工（仿古壶6件套...,京东商城,藏壶者旗舰店1007007001,厨具|茶具、咖啡具|整套茶具,宏中HZ红茶茶具纯手工紫砂茶具套装礼盒装 如意紫砂壶套装全能9件套,厨具>茶具/咖啡具>整套茶具>宏中>宏中HZ红茶茶具纯手工紫砂茶具套装礼盒装...,京东商城,幸福家