1007008008,厨具|厨房清洗用品|防油贴纸,DIY 畸良 卡通厨房防油贴纸 隔油贴 防油烟 瓷砖贴纸 多款 蒲公英,,亚马逊(卓越网),DIY 畸良1007008008,厨具|厨房清洗用品|防油贴纸,斯格雅 橱柜防水防潮带胶铝箔 耐磨铝箔贴纸 防水铝箔纸带胶 宽度0.61米-长度1米,家装建材>厨房卫浴>厨卫五金/挂件>斯格雅 橱柜防水防潮带胶铝箔 耐磨铝箔贴...,京东商城,斯格雅家居专营店1007008008,厨具|厨房清洗用品|防油贴纸,煤气灶铝箔耐高温防油盘 清洁垫10片装,首页>家居/家装建材/厨具>清洁用品>清洁工具>煤气灶铝箔耐高温防油盘清洁垫10片...,苏宁,贸号1007008008,厨具|厨房清洗用品|防油贴纸,吉睿JiRui 田园铝箔厨房专用耐高温易清洁防油烟贴纸45*75CM 十个装,家居家装>家装软饰>墙贴/装饰贴>吉睿>吉睿JiRui 田园铝箔厨房专用耐高温易...,京东商城,吉睿家居生活馆1007008008,厨具|厨房清洗用品|防油贴纸,御用家喜 三张促销装 三层复合铝箔防油贴纸 厨房贴纸 耐150度高温 75*45CM 厨房专用,所有分类>家居家纺、锅具餐具>装饰/日用>装饰贴>御用家喜>御用家喜 三张促销装...,1号店,御用家喜1007008008,厨具|厨房清洗用品|防油贴纸,普润 厨房贴纸 防油污贴纸 1套5张 G1407,家居日用 > 厨房用品 > 厨房杂件 > 厨房配件 > 商品详情,当当网,普润1007008008,厨具|厨房清洗用品|防油贴纸,孖堡家居 高档厨房防油贴 铝箔材质耐高温瓷砖墙贴 加厚防水防油烟灶台墙贴纸 粉色玫瑰花,家装建材 > 时尚家饰 > 墙壁装饰 > 商品详情,当当网,孖堡家居1007008008,厨具|厨房清洗用品|防油贴纸,【支持货到付款】馨颜 墙壁厨房装饰清洁防水耐高温防油贴纸大版60*90cm 营养搭档生菜,家居家装>家装软饰>装饰字画>馨颜>【支持货到付款】馨颜 墙壁厨房装饰清洁防...,京东商城,馨颜生活旗舰店1007008008,厨具|厨房清洗用品|防油贴纸,厨房防污贴纸 瓷砖贴 隔油防油贴纸 厨房瓷砖贴防油贴纸 耐高温油烟贴铝珀墙贴纸 果蔬Y1032,家居家装>家装软饰>其他>红兔子>厨房防污贴纸 瓷砖贴 隔油防油贴纸 厨房...,京东商城,1007008008,厨具|厨房清洗用品|防油贴纸,简家 高档厨房特大防油污贴纸 防油烟贴瓷砖橱柜装饰贴纸 E7419 大号白色花朵D104,家居家装>清洁用品>家庭清洁>简家>简家 高档厨房特大防油污贴纸 防油烟贴瓷...,京东商城,简家家居旗舰店1007008008,厨具|厨房清洗用品|防油贴纸,厨房防污贴纸 瓷砖贴 隔油防油贴纸 厨房瓷砖贴防油贴纸 耐高温油烟贴铝珀墙贴纸 花瓣,家居家装>家装软饰>其他>红兔子>厨房防污贴纸 瓷砖贴 隔油防油贴纸 厨房...,京东商城,祥韧家居生活馆1007008008,厨具|厨房清洗用品|防油贴纸,厨房防污贴纸 瓷砖贴 隔油防油贴纸 蓝天白云 JJD155-2,家居家装>家装软饰>墙画墙贴>红兔子>厨房防污贴纸 瓷砖贴 隔油防油贴纸 蓝天...,京东商城,普润家居专营店1007008008,厨具|厨房清洗用品|防油贴纸,厨房防污贴纸 瓷砖贴 隔油防油贴纸 厨房瓷砖贴防油贴纸 耐高温油烟贴铝珀墙贴纸 玫瑰花Y1012,家居家装>家装软饰>其他>红兔子>厨房防污贴纸 瓷砖贴 隔油防油贴纸 厨房...,京东商城,圣唐家居馆1007008008,厨具|厨房清洗用品|防油贴纸,【货到付款】馨颜墙壁厨房装饰清洁防水耐高温防油贴纸大版 紫荆花簇,家居家装>家装软饰>墙画墙贴>馨颜>【货到付款】馨颜墙壁厨房装饰清洁防水耐高...,京东商城,馨颜生活旗舰店1007008008,厨具|厨房清洗用品|防油贴纸,壹汇 高品质油烟贴 防水防油不留痕 厨房防油贴纸 TL-210 厨房贴纸 TL250红色玫瑰75*45C,家居家装>家装软饰>墙画墙贴>壹汇>壹汇 高品质油烟贴 防水防油不留痕 厨房...,京东商城,壹汇1007008008,厨具|厨房清洗用品|防油贴纸,嫒尚宅品 家用厨房防油贴纸 耐高温瓷砖灶台橱柜厨房油烟贴纸铝箔纸 A-0023 037粉玫瑰,厨具>烹饪锅具>厨用杂件>嫒尚宅品 家用厨房防油贴纸 耐高温瓷砖灶...,京东商城,颖思家居专营店1007008008,厨具|厨房清洗用品|防油贴纸,居梦坞 高档铝箔油烟贴 耐高温厨房贴纸 防油贴 瓷砖贴 防水油烟贴纸 45*75cm 单个 FYT-001 素色瓷砖 中号,家居家装>家装软饰>墙贴/装饰贴>居梦坞（Dreamwall）>居梦坞 高档铝箔油烟贴 耐高温厨房贴纸 ...,京东商城,居梦坞现代家居装饰旗舰店1007008008,厨具|厨房清洗用品|防油贴纸,孖堡家居 高档厨房防油贴 铝箔材质耐高温瓷砖墙贴 加厚防水防油烟贴灶台环保装饰墙贴 郁金香 45*75CM,家居家装>家装软饰>墙贴/装饰贴>孖堡家居>孖堡家居 高档厨房防油贴 铝箔材质耐高温...,京东商城,孖堡家居旗舰店1007008008,厨具|厨房清洗用品|防油贴纸,孖堡家居 高档厨房环保装饰防油贴 铝箔材质耐高温瓷砖墙贴 加厚防水防油烟贴灶台墙贴纸 海豚 45*75CM,家居家装>家装软饰>墙贴/装饰贴>孖堡家居>孖堡家居 高档厨房环保装饰防油贴 铝箔材...,京东商城,孖堡家居旗舰店1007008008,厨具|厨房清洗用品|防油贴纸,居梦坞 高档铝箔油烟贴 耐高温厨房贴纸 防油贴 瓷砖贴 防水油烟贴纸 45*75cm 单个 3007 卷发小甜心 中号,家居家装>家装软饰>墙贴/装饰贴>居梦坞（Dreamwall）>居梦坞 高档铝箔油烟贴 耐高温厨房贴纸 ...,京东商城,居梦坞现代家居装饰旗舰店1007008008,厨具|厨房清洗用品|防油贴纸,斯图 防油贴 3个装 厨房餐厅家居 耐高温防油污贴纸 ST1008春光灿烂,家居家装>家装软饰>墙贴/装饰贴>斯图>斯图 防油贴 3个装 厨房餐厅家居 耐...,京东商城,斯图旗舰店1007008008,厨具|厨房清洗用品|防油贴纸,斯图 (sitoo) 防油贴 厨房餐厅家居 耐高温防油污贴纸 瓷砖贴 墙纸 墙贴 瓷砖贴 (花之恋)ST1030,家居家装>家装软饰>墙贴/装饰贴>斯图>斯图 (sitoo) 防油贴 厨房餐厅家...,京东商城,斯图旗舰店1007008008,厨具|厨房清洗用品|防油贴纸,韩式厨房防油贴纸 厨房贴玻璃贴 耐高温 2张,家居家装>家装软饰>墙画墙贴>魅之优品>韩式厨房防油贴纸 厨房贴玻璃贴 耐高温 ...,京东商城,义乌仁璟家居1007008008,厨具|厨房清洗用品|防油贴纸,忆美特防油贴 厨房墙贴纸 隔热耐高温10件套装 图案随机组合 45*75cm*10张,家居家装>家装软饰>墙贴/装饰贴>忆美特（EMIT）>忆美特防油贴 厨房墙贴纸 隔热耐高温10...,京东商城,忆美特时尚家饰1007008008,厨具|厨房清洗用品|防油贴纸,忆美特 耐高温镀铝箔防油贴 美化厨房方便清洁 卡通白猫 45*75cm*1片装,家居家装>家装软饰>墙贴/装饰贴>忆美特（EMIT）>忆美特 耐高温镀铝箔防油贴 美化厨房方便...,京东商城,忆美特时尚家饰1007008008,厨具|厨房清洗用品|防油贴纸,居梦坞 FYT-013彩色郁金香高档铝箔油烟贴 耐高温厨房贴纸 防油贴 瓷砖贴防水油烟贴纸 45*75cm 单个,首页>家居/家装建材/厨具>生活日用>装饰用品>居梦坞FYT-013彩色郁金香高档...,苏宁,1007008008,厨具|厨房清洗用品|防油贴纸,藏乐厨房防油贴纸 大号油烟贴60*90 铝箔墙贴纸耐高温瓷砖贴特价 45*75诗海捞贝,家居家装>家装软饰>装饰字画>藏乐（Cangle）>藏乐厨房防油贴纸 大号油烟贴60*90 ...,京东商城,文武家居生活馆1007008008,厨具|厨房清洗用品|防油贴纸,爱满屋 耐高温卷装牛油纸 硅油纸 烤盘纸 烹调纸 5米盒装带裁纸刀 5m独立装,厨具>厨房配件>烘焙/烧烤>爱满屋（amw）>爱满屋 耐高温卷装牛油纸 硅油纸 烤盘纸...,京东商城,爱满屋家居专营店1007008008,厨具|厨房清洗用品|防油贴纸,潘尼珂 韩国创意厨房高档铝箔防油贴纸 蒲公英 （60cm*90cm),首页>家居/家装建材/厨具>生活日用>装饰用品>潘尼珂韩国创意厨房高档铝箔防油贴纸...,苏宁,潘尼珂1007008008,厨具|厨房清洗用品|防油贴纸,红兔子 厨房瓷砖贴防油贴纸 耐高温油烟贴铝珀墙贴纸 防水墙贴纸 铝珀灶台贴油烟贴墙贴 四张装  防油贴花色随机发放,家装建材 > 时尚家饰 > 墙壁装饰 > 商品详情,当当网,红兔子1007008008,厨具|厨房清洗用品|防油贴纸,喜家家 厨房防油贴灶台油烟贴墙贴专用60*90cm 瓜果,家居家装>家装软饰>墙贴/装饰贴>喜家家>喜家家 厨房防油贴灶台油烟贴墙贴专用60...,京东商城,喜家家家居生活馆1007008008,厨具|厨房清洗用品|防油贴纸,忆美特 耐高温镀铝箔防油贴 美化厨房方便清洁 时尚格子 45*75cm*2片装,家居家装>家装软饰>墙贴/装饰贴>忆美特（EMIT）>忆美特 耐高温镀铝箔防油贴 美化厨房方便...,京东商城,忆美特时尚家饰1007008008,厨具|厨房清洗用品|防油贴纸,【支持货到付款】馨颜 墙壁厨房装饰清洁防水耐高温防油贴纸格子款60*90cm 罗曼方舟,家居家装>家装软饰>墙贴/装饰贴>馨颜>【支持货到付款】馨颜 墙壁厨房装饰清洁防...,京东商城,馨颜生活旗舰店1007008008,厨具|厨房清洗用品|防油贴纸,【支持货到付款】馨颜 墙壁厨房装饰清洁防水耐高温防油贴纸格子款60*90cm 阳春往事,家居家装>家装软饰>墙贴/装饰贴>馨颜>【支持货到付款】馨颜 墙壁厨房装饰清洁防...,京东商城,馨颜生活旗舰店1007008008,厨具|厨房清洗用品|防油贴纸,【支持货到付款】馨颜 墙壁厨房装饰清洁防水耐高温防油贴纸大版60*90cm 营养搭档小葱,家居家装>家装软饰>墙贴/装饰贴>馨颜>【支持货到付款】馨颜 墙壁厨房装饰清洁防...,京东商城,馨颜生活旗舰店1007008008,厨具|厨房清洗用品|防油贴纸,帕加马 三层复合铝箔防油贴纸 耐高温防油污贴纸 厨房贴纸 45CM宽*75CM长 BH1008春暖花开,家居家装>家装软饰>墙贴/装饰贴>帕加马>帕加马 三层复合铝箔防油贴纸 耐高温防...,京东商城,帕加马专营店1007008008,厨具|厨房清洗用品|防油贴纸,洪麦美家 防油贴 贴纸 墙上贴画 厨房墙贴 耐高温 易清除 防油贴纸,所有分类>家居家纺、锅具餐具>装饰/日用>装饰贴>洪麦美家>洪麦美家 防油贴 贴...,1号店,洪麦美家1007008008,厨具|厨房清洗用品|防油贴纸,温庭 特大号60*90cm家用厨房防油贴纸 耐高温 厨房贴纸防油烟贴纸,所有分类>家居家纺、锅具餐具>装饰/日用>装饰贴>温庭>温庭 特大号60*9...,1号店,温庭1007008008,厨具|厨房清洗用品|防油贴纸,吉睿JiRui 田园铝箔厨房专用耐高温易清洁防油烟贴纸45*75CM 蒲公英款KS-010 两个装,家居家装>家装软饰>墙贴/装饰贴>吉睿>吉睿JiRui 田园铝箔厨房专用耐高温易...,京东商城,吉睿家居生活馆1007008008,厨具|厨房清洗用品|防油贴纸,韩版厨房防油贴纸厨房贴纸 吸油纸 耐高温防油烟贴 铝箔墙贴 防油纸 厨房瓷砖贴 铝珀墙贴 D104梅花 75*45CM,家居家装>家装软饰>墙贴/装饰贴> 其它>韩版厨房防油贴纸厨房贴纸 吸油纸 耐高温...,京东商城,生活演义创意家居1007008008,厨具|厨房清洗用品|防油贴纸,能臣特价厨房瓷砖贴铝箔防油贴纸 耐高温油烟贴铝珀墙贴纸75*45 厚06,家居家装>家装软饰>墙贴/装饰贴> 能臣（nengchen）>能臣特价厨房瓷砖贴铝箔防油贴纸 耐高温油...,京东商城,能臣家居专营店1007008008,厨具|厨房清洗用品|防油贴纸,吉睿JiRui 田园铝箔厨房专用耐高温易清洁防油烟贴纸45*75CM 水果汇KS-028 两个装,家居家装>家装软饰>墙贴/装饰贴>吉睿>吉睿JiRui 田园铝箔厨房专用耐高温易...,京东商城,吉睿家居生活馆1007008008,厨具|厨房清洗用品|防油贴纸,孖堡家居防油贴 油烟贴瓷砖贴 透明铝箔材质 加厚防水防油烟贴 厨房灶台防油贴纸 葡萄水果,家装建材 > 时尚家饰 > 墙壁装饰 > 孖堡家居防油贴 油烟贴瓷砖贴 透明铝箔材质 加厚防水防油烟贴 厨...,当当网,孖堡家居