1007007001,厨具|茶具、咖啡具|整套茶具,嘉尚 德化白瓷提梁功夫茶具套装 7头黑牡丹 大号,厨具>茶具/咖啡具>整套茶具>嘉尚 德化白瓷提梁功夫茶具套装 7头黑牡...,京东商城,华艺伦1007007001,厨具|茶具、咖啡具|整套茶具,思喜 800ml景德镇陶瓷冰裂纹手绘荷花大容量提梁壶茶具套装JD-CJ007 (不含茶盘),厨具>茶具/咖啡具>整套茶具>思喜>思喜 800ml景德镇陶瓷冰裂纹手绘荷花...,京东商城,思喜家居专营店1007007001,厨具|茶具、咖啡具|整套茶具,青筑汝窑天青 南瓜汝瓷功夫茶壶（10头装）,厨具>茶具/咖啡具>整套茶具>青筑>青筑功夫茶壶,京东商城,青筑1007007001,厨具|茶具、咖啡具|整套茶具,青筑弟窑粉青12头金钟壶配茶盘青瓷功夫茶礼品套装,厨具>茶具/咖啡具>整套茶具>青筑>青筑青瓷功夫茶礼品套装,京东商城,青筑1007007001,厨具|茶具、咖啡具|整套茶具,思喜 陶瓷功夫茶具礼盒套装 青釉雕刻 大展宏图 JD-CJ011,厨具>茶具/咖啡具>整套茶具>思喜>思喜 陶瓷功夫茶具礼盒套装 青釉雕刻 大...,京东商城,思喜瓷艺家居1007007001,厨具|茶具、咖啡具|整套茶具,思喜 800ml哑光白大容量提梁壶陶瓷茶具7入礼盒套装茶艺人生JD-CJ014（不含茶盘）,厨具>茶具/咖啡具>整套茶具>思喜>思喜 800ml哑光白大容量提梁壶陶瓷茶...,京东商城,思喜瓷艺家居1007007001,厨具|茶具、咖啡具|整套茶具,一屋窑耐热玻璃精品咖啡茶杯+碟70ML FH-340PTY,厨具>茶具/咖啡具>整套茶具>一屋窑>一屋窑咖啡茶杯+碟,京东商城,一屋窑1007007001,厨具|茶具、咖啡具|整套茶具,怡品堂茶具套装景德镇陶瓷功夫茶具 仿宋影青,厨具>茶具/咖啡具>整套茶具>怡品堂>怡品堂茶具套装景德镇陶瓷功夫茶具 仿宋影...,京东商城,怡品堂1007007001,厨具|茶具、咖啡具|整套茶具,创虹玻璃茶艺杯580套组,厨具>茶具/咖啡具>整套茶具>创虹>创虹茶艺杯580套组,京东商城,创虹1007007001,厨具|茶具、咖啡具|整套茶具,美瓷怡家 13头茶具整套 功夫茶具套装 景德镇陶瓷,所有分类>家居家纺、锅具餐具>餐具水具>茶具1>整套茶具>美瓷怡家>美瓷怡家 13头茶具...,1号店,美瓷怡家1007007001,厨具|茶具、咖啡具|整套茶具,恒越陶瓷 德化瓷器 象牙白瓷 红茶茶具 22头青花功夫茶具,所有分类>家居家纺、锅具餐具>餐具水具>茶具1>整套茶具>恒越陶瓷>恒越陶瓷 德化瓷器 ...,1号店,恒越陶瓷1007007001,厨具|茶具、咖啡具|整套茶具,东道 恒福工夫茶具 汝窑开片喜乐壶组一壶五杯 月白天青粉青,所有分类>家居家纺、锅具餐具>餐具水具>茶具1>整套茶具>东道>东道 恒福工夫茶具 ...,1号店,东道1007007001,厨具|茶具、咖啡具|整套茶具,茗臣尚品 宜兴紫砂茶具 菱花小茗杯 一套6杯 80毫升 原矿紫砂泥茶道必备,所有分类>家居家纺、锅具餐具>餐具水具>茶具1>整套茶具>茗臣尚品>茗臣尚品 宜兴紫砂茶...,1号店,茗臣尚品1007007001,厨具|茶具、咖啡具|整套茶具,恒福 茶具套装 手心莲梅子青功夫茶具 壶公道杯品茗杯8件套,所有分类>家居家纺、锅具餐具>餐具水具>茶具1>整套茶具>恒福>恒福 茶具套装 手心...,1号店,恒福1007007001,厨具|茶具、咖啡具|整套茶具,恒越陶瓷 德化瓷器 德化 象牙白瓷 10头亚光金牡丹 茶具,所有分类>家居家纺、锅具餐具>餐具水具>茶具1>整套茶具>恒越陶瓷>恒越陶瓷 德化瓷器 ...,1号店,恒越陶瓷1007007001,厨具|茶具、咖啡具|整套茶具,喜米 迷你型小茶具超便携车载旅行茶具旅游茶具黑紫砂功夫茶具茶壶茶盘茶杯套装,所有分类>家居家纺、锅具餐具>餐具水具>茶具1>整套茶具>喜米>喜米 迷你型小茶具超...,1号店,喜米1007007001,厨具|茶具、咖啡具|整套茶具,玉竹艺潭 陶瓷 高档手绘茶具礼品 青花 蝶恋花,所有分类>家居家纺、锅具餐具>餐具水具>茶具1>整套茶具>玉竹艺潭>玉竹艺潭 陶瓷 高...,1号店,玉竹艺潭1007007001,厨具|茶具、咖啡具|整套茶具,恒越陶瓷 象牙白瓷 檀木茶盘 套装34件套 电磁炉 水壶 茶盘茶具套装,所有分类>家居家纺、锅具餐具>餐具水具>茶具1>整套茶具>恒越陶瓷>恒越陶瓷 象牙白瓷 ...,1号店,恒越陶瓷1007007001,厨具|茶具、咖啡具|整套茶具,山田烧一壶五杯茶具C492-568（红富贵）,厨具>茶具/咖啡具>整套茶具>山田烧>山田烧茶具C492-568,京东商城,山田烧1007007001,厨具|茶具、咖啡具|整套茶具,尚明 耐热玻璃 飘逸杯 泡茶杯 茶具套装 茶壶 杯子 G-15 带2只小杯,厨具>茶具/咖啡具>整套茶具>尚明>尚明 耐热玻璃 飘逸杯 泡茶杯 茶具套装...,京东商城,玉臻陶艺1007007001,厨具|茶具、咖啡具|整套茶具,祥福茶具 开片汝窑 仿宋陶瓷功夫茶具整套茶具功夫茶 高档汝窑茶具 天青色RY048 天青,厨具>茶具/咖啡具>整套茶具>祥福>祥福茶具 开片汝窑 仿宋陶瓷功夫茶具整套...,京东商城,祥福官方旗舰店1007007001,厨具|茶具、咖啡具|整套茶具,嘉尚 骨质瓷釉中彩功夫茶具套装 5头青花童趣盖碗,厨具>茶具/咖啡具>整套茶具>嘉尚 骨质瓷釉中彩功夫茶具套装 5头青花...,京东商城,华艺伦1007007001,厨具|茶具、咖啡具|整套茶具,雪狼 梅花茶具 手绘 中国红瓷 花草 整套 结婚礼品 创意时尚 BN,厨具>茶具/咖啡具>整套茶具>雪狼（snowwolf）>雪狼 梅花茶具 手绘 中国红瓷 花草 整...,京东商城,苗苗红家居礼品1007007001,厨具|茶具、咖啡具|整套茶具,【紫砂之家】 全手工 宜兴紫砂壶 仿古14件套 原矿底槽清 180cc 14650B,厨具>茶具/咖啡具>整套茶具>【紫砂之家】 全手工 宜兴紫砂壶 仿古...,京东商城,紫砂之家官方旗舰店1007007001,厨具|茶具、咖啡具|整套茶具,雪狼 宫庭黄 珐琅彩手绘 法兰瓷 珐琅瓷 茶具 套装 节日送礼 整套 时尚创意 HY,厨具>茶具/咖啡具>整套茶具>雪狼（snowwolf）>雪狼 宫庭黄 珐琅彩手绘 法兰瓷 珐琅瓷...,京东商城,苗苗红家居礼品1007007001,厨具|茶具、咖啡具|整套茶具,雪狼 醴陵釉下彩 柳荫鱼乐 高温整套茶具 健康 创意 乔迁高级礼品 DFH,雪狼（snowwolf）>雪狼 醴陵釉下彩 柳荫鱼乐 高温整套茶具...,京东商城,苗苗红家居礼品1007007001,厨具|茶具、咖啡具|整套茶具,天福茗茶 台湾陆羽茶艺 紫砂风云壶组220cc,厨具>茶具/咖啡具>整套茶具>天福茗茶 台湾陆羽茶艺 紫砂风云壶组22...,京东商城,天福茗茶茶具店1007007001,厨具|茶具、咖啡具|整套茶具,特澳博骨瓷 骨质瓷 茶具 茶具套装—银梦花语 中式茶具 送托盘,厨具>茶具/咖啡具>整套茶具>特澳博骨瓷 骨质瓷 茶具 茶具套装—银梦...,京东商城,特澳博1007007001,厨具|茶具、咖啡具|整套茶具,泥之歌 景德镇茶具 手绘茶具（暗香）7头,厨具>茶具/咖啡具>整套茶具>泥之歌 景德镇茶具 手绘茶具（暗香）...,京东商城,淘陶网1007007001,厨具|茶具、咖啡具|整套茶具,雅集 孟宗竹留清香竹制抽屉式功夫茶具套装 办公居家茶盘组合 汝瓷四件套茶盘套装,厨具>茶具/咖啡具>整套茶具>雅集>雅集 孟宗竹留清香竹制抽屉式功夫茶具套装...,京东商城,艺福堂茶具专营店1007007001,厨具|茶具、咖啡具|整套茶具,恒越 德化瓷器 象牙白瓷 功夫茶具 7头亚光秋韵吉祥茶具 象牙白,厨具>茶具/咖啡具>整套茶具>恒越 德化瓷器 象牙白瓷 功夫茶具 7头...,京东商城,欣麦专营店1007007001,厨具|茶具、咖啡具|整套茶具,泥之歌 景德镇茶具 白云（彩荷花）11头,厨具>茶具/咖啡具>整套茶具>泥之歌 景德镇茶具 白云（彩荷花）1...,京东商城,淘陶网1007007001,厨具|茶具、咖啡具|整套茶具,祥福 汝窑 汝瓷 整套茶具 茶具套组 汝瓷盖碗 茶具套装 盖碗9入RY154,厨具>茶具/咖啡具>整套茶具>祥福>祥福 汝窑 汝瓷 整套茶具 茶具套组 汝...,京东商城,祥福官方旗舰店1007007001,厨具|茶具、咖啡具|整套茶具,品茶忆友 汝窑茶具套装开片汝窑功夫茶具,厨具>茶具/咖啡具>整套茶具>品茶忆友>品茶忆友 汝窑茶具套装开片汝窑功夫茶具,京东商城,品茶忆友旗舰店1007007001,厨具|茶具、咖啡具|整套茶具,祥福 茶具 汴京汝窑三足壶组9入茶具套组 壶组茶具 RY156,厨具>茶具/咖啡具>整套茶具>祥福>祥福 茶具 汴京汝窑三足壶组9入茶具套组...,京东商城,祥福官方旗舰店1007007001,厨具|茶具、咖啡具|整套茶具,荆琼宜兴手工紫砂茶具10件套装 梅桩壶套组,厨具>茶具/咖啡具>整套茶具>荆琼紫砂>荆琼梅桩壶套组,京东商城,荆琼紫砂1007007001,厨具|茶具、咖啡具|整套茶具,恒越 陶瓷 象牙白瓷 茶具 黑檀木 茶盘 电磁炉 水壶 檀木茶盘套装组合 青花-34件,厨具>茶具/咖啡具>整套茶具>恒越 陶瓷 象牙白瓷 茶具 黑檀木 茶盘...,京东商城,欣麦专营店1007007001,厨具|茶具、咖啡具|整套茶具,北府瓷业雕刻时光优质骨瓷个性茶具礼品套装,厨具>茶具/咖啡具>整套茶具>北府瓷业雕刻时光优质骨瓷个性茶具礼品套装,京东商城,芊芊家家居旗舰店1007007001,厨具|茶具、咖啡具|整套茶具,祥福 茶具 台湾宜龙茶具 茶具套装 整套功夫茶具 茶礼 青花童嬉 TC081 茶海,厨具>茶具/咖啡具>整套茶具>祥福>祥福 茶具 台湾宜龙茶具 茶具套装 整套...,京东商城,祥福官方旗舰店1007007001,厨具|茶具、咖啡具|整套茶具,祥福 茶具 台湾宜龙茶具 茶具套装 整套功夫茶具 茶礼 花团锦簇 TC075,厨具>茶具/咖啡具>整套茶具>祥福>祥福 茶具 台湾宜龙茶具 茶具套装 整套...,京东商城,祥福官方旗舰店1007007001,厨具|茶具、咖啡具|整套茶具,祥福 茶具 纯手绘精品陶瓷茶具 时尚送礼礼盒功夫茶具套装组 山水TC233,厨具>茶具/咖啡具>整套茶具>祥福>祥福 茶具 纯手绘精品陶瓷茶具 时尚送礼...,京东商城,祥福官方旗舰店1007007001,厨具|茶具、咖啡具|整套茶具,恒越陶瓷 象牙白瓷 30件四合一茶盘茶具套装 电磁炉 水壶,所有分类>家居家纺、锅具餐具>餐具水具>茶具1>整套茶具>恒越陶瓷>恒越陶瓷 象牙白瓷 ...,1号店,恒越陶瓷1007007001,厨具|茶具、咖啡具|整套茶具,百鸿白诗陶瓷功夫茶具套装实木茶盘电热壶Z-1150612,厨具>茶具/咖啡具>整套茶具>百鸿>百鸿白诗陶瓷功夫茶具套装实木茶盘电热壶Z...,京东商城,百鸿旗舰店1007007001,厨具|茶具、咖啡具|整套茶具,百鸿 整套手工雕刻紫砂功夫茶具鸡翅木4合1电磁炉茶盘套装Z-332098,厨具>茶具/咖啡具>整套茶具>百鸿 整套手工雕刻紫砂功夫茶具鸡翅木4合...,京东商城,百鸿旗舰店1007007001,厨具|茶具、咖啡具|整套茶具,百鸿 功夫茶具套装冰裂釉陶瓷茶具实木茶盘T-L24006,厨具>茶具/咖啡具>整套茶具>百鸿 功夫茶具套装冰裂釉陶瓷茶具实木茶盘...,京东商城,百鸿旗舰店1007007001,厨具|茶具、咖啡具|整套茶具,三义成茶具新年茶礼7头古韵琴声茶盘茶具茶巾茶礼套装（赠送光盘）,厨具>茶具/咖啡具>整套茶具>三义成>三义成茶具新年茶礼7头古韵琴声茶盘茶具茶...,京东商城,三义成1007007001,厨具|茶具、咖啡具|整套茶具,百鸿 黑金龙陶瓷功夫茶具套装实木海豚电磁炉茶盘套装Z-11U072-2,厨具>茶具/咖啡具>整套茶具>百鸿 黑金龙陶瓷功夫茶具套装实木海豚电磁...,京东商城,百鸿旗舰店1007007001,厨具|茶具、咖啡具|整套茶具,台湾建窑 陶瓷功夫茶具套装 仿古青花九件圆托套组 礼品茶具 230ml,厨具>茶具/咖啡具>整套茶具>建窑>台湾建窑 陶瓷功夫茶具套装 仿古青花九件...,京东商城,紫艺陶缘专营店1007007001,厨具|茶具、咖啡具|整套茶具,三义成茶壶新年茶礼成德化瓷5头青花手抓壶茶具套装,厨具>茶具/咖啡具>整套茶具>三义成>三义成茶壶新年茶礼成德化瓷5头青花手抓壶...,京东商城,三义成1007007001,厨具|茶具、咖啡具|整套茶具,三义成茶具新年茶礼德化瓷10头亚光陶和诚处世盖碗茶具茶礼套装,厨具>茶具/咖啡具>整套茶具>三义成>三义成茶具新年茶礼德化瓷10头亚光陶和诚...,京东商城,三义成1007007001,厨具|茶具、咖啡具|整套茶具,万年利WNL 祥云花梨木茶盘配四合一智能电磁炉黑紫砂圆杯功夫茶具22件套装,厨具>茶具/咖啡具>整套茶具>万年利>万年利茶具套装,京东商城,万年利1007007001,厨具|茶具、咖啡具|整套茶具,品茶忆友宜兴紫砂茶具套装如意茶组一壶六杯礼盒装,厨具>茶具/咖啡具>整套茶具>品茶忆友>品茶忆友宜兴紫砂茶具套装如意茶组一壶六杯...,京东商城,品茶忆友旗舰店1007007001,厨具|茶具、咖啡具|整套茶具,雪狼 和家 紫砂茶具 套壶茶具 宜兴正品 3人茶具 HJ,厨具>茶具/咖啡具>整套茶具>雪狼（snowwolf）>雪狼 和家 紫砂茶具 套壶茶具 宜兴正品...,京东商城,苗苗红家居礼品1007007001,厨具|茶具、咖啡具|整套茶具,百鸿 整套紫砂茶具套装柏木茶盘套装WWTT631,厨具>茶具/咖啡具>整套茶具>百鸿 整套紫砂茶具套装柏木茶盘套装WWT...,京东商城,百鸿旗舰店1007007001,厨具|茶具、咖啡具|整套茶具,百鸿紫砂功夫茶具四合一电磁炉茶盘套装Z-113072,厨具>茶具/咖啡具>整套茶具>百鸿紫砂功夫茶具四合一电磁炉茶盘套装Z-...,京东商城,百鸿旗舰店1007007001,厨具|茶具、咖啡具|整套茶具,金镶玉 一壶六杯汉扁紫砂胎体包金茶具套装 0130,厨具>茶具/咖啡具>整套茶具>金镶玉>金镶玉茶具套装,京东商城,金镶玉1007007001,厨具|茶具、咖啡具|整套茶具,百鸿 整套陶瓷茶具套装柏木茶盘套装Z-124A1411 黄金龙款,厨具>茶具/咖啡具>整套茶具>百鸿 整套陶瓷茶具套装柏木茶盘套装Z-1...,京东商城,百鸿旗舰店1007007001,厨具|茶具、咖啡具|整套茶具,壹叁玖零 汝窑功夫茶具套装天青,厨具>茶具/咖啡具>整套茶具>壹叁玖零>壹叁玖零 汝窑功夫茶具套装天青,京东商城,壹叁玖零1007007001,厨具|茶具、咖啡具|整套茶具,百鸿亭窑陶瓷功夫茶具套装实木茶盘整套T-BYH551 套装二,厨具>茶具/咖啡具>整套茶具>百鸿亭窑陶瓷功夫茶具套装实木茶盘整套T-...,京东商城,百鸿旗舰店1007007001,厨具|茶具、咖啡具|整套茶具,百鸿红茶玻璃茶具送礼六款B-SHPCQ 红茶玻璃(黑龙)7件,厨具>茶具/咖啡具>整套茶具>百鸿>百鸿红茶玻璃茶具送礼六款B-SHPCQ ...,京东商城,百鸿旗舰店1007007001,厨具|茶具、咖啡具|整套茶具,祥福 宜兴紫砂壶茶具套装 黑色紫砂 整套茶具 紫砂壶套组 ZSH007,厨具>茶具/咖啡具>整套茶具>祥福 宜兴紫砂壶茶具套装 黑色紫砂 整套...,京东商城,祥福官方旗舰店1007007001,厨具|茶具、咖啡具|整套茶具,金镶玉 一壶六杯一功道杯璞玉冰裂釉镶金茶具套装 0052,厨具>茶具/咖啡具>整套茶具>金镶玉>金镶玉茶具套装,京东商城,金镶玉1007007001,厨具|茶具、咖啡具|整套茶具,雅诚德 7头雅家茶具（清风荷花图）,厨具>茶具/咖啡具>整套茶具>雅诚德>雅诚德茶具,京东商城,雅诚德1007007001,厨具|茶具、咖啡具|整套茶具,亿嘉IJARL 5件套稀世光华浅黄时尚茶具套装F158FDS009,厨具>茶具/咖啡具>整套茶具>亿嘉（IJARL）>亿嘉时尚茶具,京东商城,亿嘉（IJARL）1007007001,厨具|茶具、咖啡具|整套茶具,三义成茶具新年茶礼德化瓷7头手绘青花一枝独秀壶茶具茶礼套装,厨具>茶具/咖啡具>整套茶具>三义成>三义成茶具新年茶礼德化瓷7头手绘青花一枝...,京东商城,三义成1007007001,厨具|茶具、咖啡具|整套茶具,三义成茶具新年茶礼汝窑如意壶托盘四件组（月白）,厨具>茶具/咖啡具>整套茶具>三义成>三义成茶具新年茶礼汝窑如意壶托盘四件组（...,京东商城,三义成1007007001,厨具|茶具、咖啡具|整套茶具,百鸿 整套紫砂茶具套装大茶船Z-DCC26J05,厨具>茶具/咖啡具>整套茶具>百鸿 整套紫砂茶具套装大茶船Z-DCC2...,京东商城,百鸿旗舰店1007007001,厨具|茶具、咖啡具|整套茶具,关耳窑整套紫砂功夫茶具配茶盘套装TZ-M12K99 红福齐天套装,厨具>茶具/咖啡具>整套茶具>关耳窑整套紫砂功夫茶具配茶盘套装TZ-M...,京东商城,关耳窑旗舰店1007007001,厨具|茶具、咖啡具|整套茶具,百鸿 陶瓷功夫茶具套装千禧龙茶盘整套ZT-12KQXL761 千禧龙茶盘+八马茶具,厨具>茶具/咖啡具>整套茶具>百鸿 陶瓷功夫茶具套装千禧龙茶盘整套ZT...,京东商城,百鸿旗舰店1007007001,厨具|茶具、咖啡具|整套茶具,百鸿 陶瓷功夫茶具套装千禧龙茶盘整套ZT-12KQXL761 千禧龙茶盘+黑诗茶具,厨具>茶具/咖啡具>整套茶具>百鸿 陶瓷功夫茶具套装千禧龙茶盘整套ZT...,京东商城,百鸿旗舰店1007007001,厨具|茶具、咖啡具|整套茶具,关耳窑 冰裂釉陶瓷功夫茶具套装四合一电磁炉实木茶盘T-L13104 多彩冰裂套装,厨具>茶具/咖啡具>整套茶具>关耳窑 冰裂釉陶瓷功夫茶具套装四合一电磁...,京东商城,关耳窑旗舰店1007007001,厨具|茶具、咖啡具|整套茶具,关耳窑 整套黑金龙陶瓷功夫茶具千禧龙树脂茶盘套装 T-419001,厨具>茶具/咖啡具>整套茶具>关耳窑 整套黑金龙陶瓷功夫茶具千禧龙树脂...,京东商城,关耳窑旗舰店1007007001,厨具|茶具、咖啡具|整套茶具,关耳窑 陶瓷功夫茶具套装千禧龙茶盘整套ZT-12KQXL761 千禧龙茶盘+黑龙茶具,厨具>茶具/咖啡具>整套茶具>关耳窑 陶瓷功夫茶具套装千禧龙茶盘整套Z...,京东商城,关耳窑旗舰店1007007001,厨具|茶具、咖啡具|整套茶具,关耳窑 陶瓷功夫茶具套装养神柏木茶盘整套T-YSRY551 月白荷韵套装,厨具>茶具/咖啡具>整套茶具>关耳窑>关耳窑 陶瓷功夫茶具套装养神柏木茶盘整套...,京东商城,关耳窑旗舰店1007007001,厨具|茶具、咖啡具|整套茶具,百鸿雅阁实木茶盘海豚电磁炉陶瓷茶具套装功夫茶具ZT-12KSYG084 红福茶具,厨具>茶具/咖啡具>整套茶具>百鸿雅阁实木茶盘海豚电磁炉陶瓷茶具套装功...,京东商城,百鸿旗舰店1007007001,厨具|茶具、咖啡具|整套茶具,百鸿 藏玉龙图腾紫砂套装乌金石茶盘套装 Z-ZSST067,厨具>茶具/咖啡具>整套茶具>百鸿>百鸿 藏玉龙图腾紫砂套装乌金石茶盘套装 ...,京东商城,百鸿旗舰店1007007001,厨具|茶具、咖啡具|整套茶具,关耳窑陶瓷功夫茶具四合一电磁炉实木茶盘套装T-1120834,厨具>茶具/咖啡具>整套茶具>关耳窑>关耳窑陶瓷功夫茶具四合一电磁炉实木茶盘套...,京东商城,关耳窑旗舰店1007007001,厨具|茶具、咖啡具|整套茶具,百鸿 陶瓷茶具套装 雅阁实木四合一电磁炉茶盘套装TZ-1YG134 黑雅阁紫砂4合1套装,厨具>茶具/咖啡具>整套茶具>百鸿 陶瓷茶具套装 雅阁实木四合一电磁炉...,京东商城,百鸿旗舰店1007007001,厨具|茶具、咖啡具|整套茶具,百鸿 陶瓷茶具套装 雅阁实木四合一电磁炉茶盘套装TZ-1YG134 黑雅阁白金龙4合1套装,厨具>茶具/咖啡具>整套茶具>百鸿 陶瓷茶具套装 雅阁实木四合一电磁炉...,京东商城,百鸿旗舰店1007007001,厨具|茶具、咖啡具|整套茶具,关耳窑 宜兴紫砂茶具套装陶瓷茶具4合1电磁炉实木茶盘套装TZ-M12K543 黄金龙,厨具>茶具/咖啡具>整套茶具>关耳窑 宜兴紫砂茶具套装陶瓷茶具4合1电...,京东商城,关耳窑旗舰店1007007001,厨具|茶具、咖啡具|整套茶具,关耳窑陶瓷邑窑功夫茶具套装实木茶盘整套Z-KXY5YY025 套餐2,厨具>茶具/咖啡具>整套茶具>关耳窑>关耳窑陶瓷邑窑功夫茶具套装实木茶盘整套Z...,京东商城,关耳窑旗舰店1007007001,厨具|茶具、咖啡具|整套茶具,百鸿 宜兴紫砂茶具套装陶瓷茶具4合1电磁炉实木茶盘套装TZ-M12K543 黑金龙,厨具>茶具/咖啡具>整套茶具>百鸿 宜兴紫砂茶具套装陶瓷茶具4合1电磁...,京东商城,百鸿旗舰店1007007001,厨具|茶具、咖啡具|整套茶具,关耳窑 水纹侧把壶茶具 办公室茶具 陶瓷功夫茶具套装9件G76086005,厨具>茶具/咖啡具>整套茶具>关耳窑 水纹侧把壶茶具 办公室茶具 陶瓷...,京东商城,关耳窑旗舰店1007007001,厨具|茶具、咖啡具|整套茶具,关耳窑雅阁实木茶盘海豚电磁炉陶瓷茶具套装功夫茶具ZT-12KSYG084 白金龙,厨具>茶具/咖啡具>整套茶具>关耳窑雅阁实木茶盘海豚电磁炉陶瓷茶具套装...,京东商城,关耳窑旗舰店1007007001,厨具|茶具、咖啡具|整套茶具,鑫德鸿窑 节节高升茶具套装 台湾 正品汝窑 RY106,厨具>茶具/咖啡具>整套茶具>鑫德鸿窑>鑫德鸿窑 节节高升茶具套装 台湾 正品...,京东商城,皇茗旗舰店1007007001,厨具|茶具、咖啡具|整套茶具,祥福 开片汝瓷茶具套装 正品 汝窑四方杯 整套茶具 RY166 月白,厨具>茶具/咖啡具>整套茶具>祥福>祥福 开片汝瓷茶具套装 正品 汝窑四方杯...,京东商城,祥福官方旗舰店1007007001,厨具|茶具、咖啡具|整套茶具,祥福 正品汝瓷茶具 开片汝瓷茶具套装 功夫茶具 RY168 月白,厨具>茶具/咖啡具>整套茶具>祥福>祥福 正品汝瓷茶具 开片汝瓷茶具套装 功...,京东商城,祥福官方旗舰店1007007001,厨具|茶具、咖啡具|整套茶具,百鸿 祥云黑檀木茶盘紫砂茶具套装 8款茶具Z-213001C 黑檀祥云三羊开泰4合1套装,厨具>茶具/咖啡具>整套茶具>百鸿 祥云黑檀木茶盘紫砂茶具套装 8款茶...,京东商城,百鸿旗舰店1007007001,厨具|茶具、咖啡具|整套茶具,百鸿陶瓷功夫茶具套装实木茶盘电热壶TZ-BJ12K003 黄金龙,厨具>茶具/咖啡具>整套茶具>百鸿陶瓷功夫茶具套装实木茶盘电热壶TZ-...,京东商城,百鸿旗舰店1007007001,厨具|茶具、咖啡具|整套茶具,百鸿 紫砂茶具 宜兴功夫 茶具套装 电磁炉实木茶盘 陶瓷 茶具 整套茶具特价Z-11U072 马到成功,厨具>茶具/咖啡具>整套茶具>百鸿 紫砂茶具 宜兴功夫 茶具套装 电磁...,京东商城,百鸿旗舰店1007007001,厨具|茶具、咖啡具|整套茶具,关耳窑功夫茶具柏木茶盘电热壶套装TZ-BJ12K003 白鹭,厨具>茶具/咖啡具>整套茶具>关耳窑>关耳窑功夫茶具柏木茶盘电热壶套装TZ-B...,京东商城,关耳窑旗舰店1007007001,厨具|茶具、咖啡具|整套茶具,关耳窑陶瓷功夫茶具柏木茶盘套装T-YST6K521 养神黑诗套装,厨具>茶具/咖啡具>整套茶具>关耳窑陶瓷功夫茶具柏木茶盘套装T-YST...,京东商城,关耳窑旗舰店1007007001,厨具|茶具、咖啡具|整套茶具,百鸿 亭窑陶瓷茶具套装 整套功夫茶具陶瓷茶具套装 整套功夫茶具DT1STY55,厨具>茶具/咖啡具>整套茶具>百鸿 亭窑陶瓷茶具套装 整套功夫茶具陶瓷...,京东商城,百鸿旗舰店1007007001,厨具|茶具、咖啡具|整套茶具,祥福 台湾陆宝 茶具套装 陶瓷整套茶具 能量顶级茶礼 TC246,厨具>茶具/咖啡具>整套茶具>祥福>祥福 台湾陆宝 茶具套装 陶瓷整套茶具 ...,京东商城,祥福官方旗舰店1007007001,厨具|茶具、咖啡具|整套茶具,左茗右器 家庭装手工玻璃茶具套组整套茶具功夫茶具套装配茶盘,左茗右器 家庭装手工玻璃茶具套组整套茶具...,京东商城,左茗右器旗舰店1007007001,厨具|茶具、咖啡具|整套茶具,南岭窑 玉龙戏浪 整套茶具 功夫茶具套装 汝瓷哥窑SXD039茶漏,南岭窑 玉龙戏浪 整套茶具 功夫茶具套装...,京东商城,南岭窑陶瓷旗舰店1007007001,厨具|茶具、咖啡具|整套茶具,汇邦钢化玻璃整套茶具茶盘HB-739配汝窑荷叶杯HB-1108会说话的电茶炉茶具1600W,汇邦（HB）>汇邦钢化玻璃整套茶具茶盘HB-739配汝...,京东商城,汇邦茶具旗舰店1007007001,厨具|茶具、咖啡具|整套茶具,HEISOU黑手 耐高温玻璃飘逸杯礼盒套装(一壶四杯)KT008,厨具>茶具/咖啡具>整套茶具> 黑手>黑手玻璃杯,京东商城,黑手1007007001,厨具|茶具、咖啡具|整套茶具,常生源 茶具功夫陶瓷茶具无礼盒 中国结款,厨具>茶具/咖啡具>整套茶具>常生源>常生源 茶具功夫陶瓷茶具无礼盒 中国结款,京东商城,常生源官方旗舰店1007007001,厨具|茶具、咖啡具|整套茶具,百鸿 绿菠萝造型茶具套装 陶瓷 功夫茶具套装瓷器 茶壶 杯垫茶杯 DTG75928A088,厨具>茶具/咖啡具>整套茶具>百鸿>百鸿 绿菠萝造型茶具套装 陶瓷 功夫茶具...,京东商城,百鸿旗舰店1007007001,厨具|茶具、咖啡具|整套茶具,汇茶具整套茶具邦油檀木电磁炉茶盘茶具套装功夫茶具自动抽水HB-8807A功夫茶具1800W,汇邦（HB）>汇茶具整套茶具邦油檀木电磁炉茶盘茶具套装...,京东商城,汇邦茶具旗舰店