1007004004,厨具|收纳保鲜|一次性饭盒,禧宏 一次性四格饭盒一次性连体餐盒米白快餐盒便当盒打包盒300个,所有分类>厨卫清洁、纸、清洁剂>一次性用品>一次性餐具>一次性餐盒>禧宏>禧宏 一次性四格饭盒...,1号店,禧宏1007004004,厨具|收纳保鲜|一次性饭盒,商吉 51cup 500ml高档一次性打包盒 透明塑料快餐盒 饭盒50套,所有分类>厨卫清洁、纸、清洁剂>一次性用品>一次性餐具>一次性餐盒>商吉 51cup>商吉 51cup 5...,1号店,商吉 51cup1007004004,厨具|收纳保鲜|一次性饭盒,禧宏 一次性餐盒 便当盒 高档打包盒 快餐盒 连体单格盒子 饭盒 1000套,所有分类>厨卫清洁、纸、清洁剂>一次性用品>一次性餐具>一次性餐盒>禧宏>禧宏 一次性餐盒 便...,1号店,禧宏1007004004,厨具|收纳保鲜|一次性饭盒,芭比娃娃白/粉少女670ML PP单层饭盒BPL-1112白粉-1，F,首页>家居>厨房用品>餐具,银泰网,芭比娃娃1007004004,厨具|收纳保鲜|一次性饭盒,禧宏一次性餐盒四格 环保餐盒 四格连体 一次性连体餐盒 饭盒（A007*300个）,厨具>餐具>一次性餐具>禧宏（xihong）>禧宏一次性餐盒四格 环保餐盒 四格连体 ...,京东商城,千牛家居1007004004,厨具|收纳保鲜|一次性饭盒,禧宏 一次性餐盒 分格饭盒 透明打包盒2格一次性饭盒 梅菜扣肉盒（650双格*300套）,厨具 > 保鲜用品 > 保温饭盒、便当盒,亚马逊(卓越网),禧宏1007004004,厨具|收纳保鲜|一次性饭盒,特百洁一次性餐盒 饭盒 快餐盒 便当盒 套餐盒 打包盒 （1000毫升正方形*300套）,首页>家居/家装建材/厨具>餐厨用具>保鲜盒/便当盒>特百洁一次性餐盒饭盒快餐盒便当...,苏宁,特百洁1007004004,厨具|收纳保鲜|一次性饭盒,金柏能 柏能饭盒 圆形三层 2.1L 蓝色,首页>厨房用具>餐具>便携餐具>金柏能 金柏能,易迅网, 金柏能1007004004,厨具|收纳保鲜|一次性饭盒,酒店专供一次性打包饭盒650ml 长方形餐具盒 便当盒A650（500只）,厨具>餐具>一次性餐具>其它>酒店专供一次性打包饭盒650ml 长方形...,京东商城,尚丽屋日用家居生活馆1007004004,厨具|收纳保鲜|一次性饭盒,特百洁带盖圆形塑料碗一次性饭盒 微波碗 汤碗 圆形盒（750ML汤碗*300套）,家居日用 > 厨房用品 > 一次性餐具 > 商品详情,当当网,特百洁1007004004,厨具|收纳保鲜|一次性饭盒,禧宏含盖一次性饭盒 便当盒 打包盒 外卖盒 一次性餐盒（台湾129黑红*1000个）,家居日用 > 厨房用品 > 一次性餐具 > 商品详情,当当网,禧宏1007004004,厨具|收纳保鲜|一次性饭盒,一次性餐盒 环保餐盒 打包盒 快餐盒外卖盒 单格卤味盒饭盒1000套 红色,首页>家居/家装建材/厨具>餐厨用具>保鲜盒/便当盒>一次性餐盒环保餐盒打包盒快餐盒...,苏宁,禧宏1007004004,厨具|收纳保鲜|一次性饭盒,Peter Rabbit 比得兔绿色方形保温饭盒900ml PR-3507-1,首页 >厨具锅具 >餐具 >便携餐具 >Peter Rabbit 比得兔 >PR-3507-1,易迅网,Peter Rabbit/比得兔1007004004,厨具|收纳保鲜|一次性饭盒,酒店专供一次性打包饭盒700ml 长方形餐具盒 便当盒A700（500只）,厨具>餐具>一次性餐具>其它>酒店专供一次性打包饭盒700ml 长方形...,京东商城,尚丽屋日用家居生活馆1007004004,厨具|收纳保鲜|一次性饭盒,一次性饭盒 塑料餐盒一次性饭盒 长方形食品盒 外面盒 （1200ml凸盖150套）,厨具>餐具>一次性餐具>禧宏（xihong）>一次性饭盒 塑料餐盒一次性饭盒 长方形食...,京东商城,1007004004,厨具|收纳保鲜|一次性饭盒,一次性塑料保鲜盒 外卖盒 快餐盒 饭盒 方形食盒（500毫升*300套）,厨具>餐具>一次性餐具>禧宏（xihong）>一次性塑料保鲜盒 外卖盒 快餐盒 饭盒 ...,京东商城,禧宏一次性用品旗舰店1007004004,厨具|收纳保鲜|一次性饭盒,一次性五格饭盒 塑料快餐盒 外卖便当盒黑红商务套餐盒600个,厨具>收纳保鲜>饭盒/提锅>禧宏（xihong）>一次性五格饭盒 塑料快餐盒 外卖便当盒黑...,京东商城,1007004004,厨具|收纳保鲜|一次性饭盒,禧宏一次性餐盒 环保餐盒 打包盒 快餐盒外卖盒 单格卤味盒饭盒1000套,家居日用 > 厨房用品 > 一次性餐具 > 禧宏一次性餐盒 环保餐盒 打包盒 快餐盒外卖盒 单格卤味盒饭盒10...,当当网,禧宏1007004004,厨具|收纳保鲜|一次性饭盒,1000ml方形一次性外卖盒打包餐盒 寿司盒 饭盒 食品盒 保鲜盒100个装,家居日用 > 厨房用品 > 一次性餐具 > 1000ml方形一次性外卖盒打包餐盒 寿司盒 饭盒 食品盒 保鲜盒100...,当当网,特百洁1007004004,厨具|收纳保鲜|一次性饭盒,禧宏 2格餐盒盖浇饭碗全微波PP饭盒打包盒外卖盒 UH24-17 450套/箱,家居日用 > 厨房用品 > 一次性餐具 > 禧宏 2格餐盒盖浇饭碗全微波PP饭盒打包盒外卖盒 UH24-17 450套/...,当当网,禧宏1007004004,厨具|收纳保鲜|一次性饭盒,禧宏带盖一次性四格餐盒 四格饭盒 打包盒 外卖盒 环保餐盒（黑红餐盒*1000个）,厨具>餐具>一次性用品> 禧宏（xihong）>禧宏带盖一次性四格餐盒 四格饭盒 打包盒...,京东商城,千牛家居专营店1007004004,厨具|收纳保鲜|一次性饭盒,特百洁圆形塑料碗 带盖 一次性饭盒 微波碗 汤碗（1000ML圆形汤碗* 600套）,厨具>餐具>一次性餐具>特百洁>特百洁圆形塑料碗 带盖 一次性饭盒 微波...,京东商城,千牛家居1007004004,厨具|收纳保鲜|一次性饭盒,禧宏 一次性保鲜盒 外卖盒 饭盒 汤盒 圆形盒便当盒（750毫升圆形盒*450套）,其他 > 其他,亚马逊(卓越网),禧宏1007004004,厨具|收纳保鲜|一次性饭盒,金五缘一次性塑料保鲜盒 外卖盒 圆柱形 汤碗汤盒 饭盒（1000毫升圆形盒*300套）,首页>家居/家装建材/厨具>餐厨用具>保鲜盒/便当盒>金五缘一次性塑料保鲜盒外卖盒圆柱...,苏宁,金五缘1007004004,厨具|收纳保鲜|一次性饭盒,禧宏一次性四格餐盒 一次性环保餐盒 饭盒 打包盒 便当盒（JN-01*100个）,首页>家居/家装建材/厨具>餐厨用具>保鲜盒/便当盒>禧宏一次性四格餐盒一次性环保餐盒...,苏宁,禧宏1007004004,厨具|收纳保鲜|一次性饭盒,禧宏一次性餐盒四格 环保餐盒 四格连体 一次性连体餐盒 饭盒（A007*300个）,家居日用 > 厨房用品 > 一次性餐具 > 商品详情,当当网,禧宏1007004004,厨具|收纳保鲜|一次性饭盒,禧宏超值一次性快餐盒一次性连体三格餐盒打包外卖盒一次性饭盒（A302*100个）,家居日用 > 厨房用品 > 一次性餐具 > 商品详情,当当网,禧宏1007004004,厨具|收纳保鲜|一次性饭盒,一次性塑料保鲜盒 外卖盒 快餐盒 饭盒方形盒（650毫升方形盒*300套）,厨具>餐具>一次性餐具>禧宏（xihong）>一次性塑料保鲜盒 外卖盒 快餐盒 饭盒方...,京东商城,禧宏一次性用品旗舰店1007004004,厨具|收纳保鲜|一次性饭盒,禧宏高档商务套餐便 UH-F5/2五格餐盒含盖一次性饭盒 餐盒 打包盒（600套）,厨具>餐具>一次性餐具>禧宏高档商务套餐便 UH-F5/2五格餐...,京东商城,禧宏一次性用品旗舰店1007004004,厨具|收纳保鲜|一次性饭盒,禧宏650ml两格餐盒一次性双格餐盒分格饭盒一次性饭盒（50套）,厨具>餐具>一次性餐具>禧宏（xihong）>禧宏650ml两格餐盒一次性双格餐盒分格...,京东商城,禧宏一次性用品旗舰店1007004004,厨具|收纳保鲜|一次性饭盒,禧宏 一次性四格饭盒一次性连体餐盒米白快餐盒便当盒打包盒300个,所有分类>厨卫清洁、纸、清洁剂>一次性用品>一次性餐具>一次性餐盒>禧宏>禧宏 一次性四格饭盒...,1号店,禧宏1007004004,厨具|收纳保鲜|一次性饭盒,商吉 51cup 750ml一次性打包盒透明优质塑料饭盒长方形50只,所有分类>厨卫清洁、纸、清洁剂>一次性用品>一次性餐具>一次性餐盒>商吉 51cup>商吉 51cup 7...,1号店,商吉 51cup1007004004,厨具|收纳保鲜|一次性饭盒,禧宏一次性餐盒打包盒 带盖塑料透明饭盒 寿司盒 包装盒（小一浅*4000只）,厨具>餐具>一次性餐具>禧宏一次性餐盒打包盒 带盖塑料透明饭盒 ...,京东商城,千牛家居1007004004,厨具|收纳保鲜|一次性饭盒,禧宏 960毫升一次性普通纸碗 打包碗 一次性饭盒 纸桶碗 方便面碗 饭碗1000个含盖 优惠多多 欢迎抢购,其他 > 其他,亚马逊(卓越网),禧宏1007004004,厨具|收纳保鲜|一次性饭盒,金五缘 金五缘一次性塑料保鲜盒 外卖盒 快餐盒 饭盒 椭圆食盒（650毫升*300套）,其他 > 其他,亚马逊(卓越网),金五缘1007004004,厨具|收纳保鲜|一次性饭盒,禧宏 禧宏高档一次性餐盒一次性四格饭盒外卖打包盒一次性便当盒（JN-01*1000套）,其他 > 其他,亚马逊(卓越网),禧宏1007004004,厨具|收纳保鲜|一次性饭盒,禧宏 一次性透明餐盒 便当盒 四格餐盒 4格餐盒透明饭盒（四格透明餐盒*1000套）,其他 > 其他,亚马逊(卓越网),禧宏1007004004,厨具|收纳保鲜|一次性饭盒,特百洁一次性餐盒 分格饭盒 透明打包盒2格一次性饭盒 梅菜扣肉盒（650双格*300套）,厨具>餐具>一次性餐具>特百洁>特百洁一次性餐盒 分格饭盒 透明打包盒2...,京东商城,推广、家居生活、餐饮娱乐等场所使用,健康环保耐高温1007004004,厨具|收纳保鲜|一次性饭盒,禧宏配盖850毫升一次性餐盒 饭盒批发汤碗 饭碗 塑料碗（波丽碗* 600个）,首页>家居/家装建材/厨具>餐厨用具>餐具>禧宏配盖850毫升一次性餐盒饭盒批...,苏宁,禧宏1007004004,厨具|收纳保鲜|一次性饭盒,金五缘一次性塑料保鲜盒 外卖盒 快餐盒 饭盒方形盒（650毫升方形盒*300套）,首页>家居/家装建材/厨具>餐厨用具>保鲜盒/便当盒>金五缘一次性塑料保鲜盒外卖盒快餐...,苏宁,金五缘1007004004,厨具|收纳保鲜|一次性饭盒,特百洁一次性保鲜盒 外卖盒 饭盒 汤盒 圆形盒便当盒（750毫升圆形盒*450套）,首页>家居/家装建材/厨具>餐厨用具>保鲜盒/便当盒>特百洁一次性保鲜盒外卖盒饭盒汤...,苏宁,特百洁1007004004,厨具|收纳保鲜|一次性饭盒,禧宏含盖一次性餐盒 饭盒 便当盒 打包盒 外卖盒 环保塑料餐盒（黑色餐盒* 100套）,首页>家居/家装建材/厨具>餐厨用具>保鲜盒/便当盒>禧宏含盖一次性餐盒饭盒便当盒打...,苏宁,禧宏1007004004,厨具|收纳保鲜|一次性饭盒,一次性餐盒 饭盒 快餐盒 便当盒 套餐盒 打包盒 四格 （厦商四格餐盒*420套）,首页>家居/家装建材/厨具>餐厨用具>保鲜盒/便当盒>一次性餐盒饭盒快餐盒便当盒套...,苏宁,禧宏1007004004,厨具|收纳保鲜|一次性饭盒,禧宏一次性餐盒 便当盒 高档打包盒 快餐盒 连体单格盒子 饭盒（A106单格*1000套）,首页>家居/家装建材/厨具>餐厨用具>保鲜盒/便当盒>禧宏一次性餐盒便当盒高档打包盒...,苏宁,禧宏1007004004,厨具|收纳保鲜|一次性饭盒,带盖一次性餐盒 环保饭盒 打包盒 单格盖浇饭盒300套/箱,厨具>餐具>一次性餐具>禧宏（xihong）>带盖一次性餐盒 环保饭盒 打包盒 单格盖...,京东商城,禧宏一次性用品旗舰店1007004004,厨具|收纳保鲜|一次性饭盒,一次性餐盒 单格黑色打包盒 盖浇饭盒 一次性餐具带盖*900个 黑色,首页>家居/家装建材/厨具>餐厨用具>保鲜盒/便当盒>一次性餐盒单格黑色打包盒盖浇饭盒...,苏宁,禧宏1007004004,厨具|收纳保鲜|一次性饭盒,禧宏500ml优质一次性塑料保鲜盒 500ml优质一次性塑料保鲜盒 方形饭盒 食品盒 方形饭盒 食品盒100只,家居日用 > 厨房用品 > 一次性餐具 > 禧宏500ml优质一次性塑料保鲜盒 500ml优质一次性塑料保鲜盒 方形...,当当网,禧宏1007004004,厨具|收纳保鲜|一次性饭盒,金五缘一次性塑料保鲜盒 外卖盒 快餐盒 饭盒 方形食盒（500毫升*300套）,厨具>餐具>一次性餐具>金五缘一次性塑料保鲜盒 外卖盒 快餐盒 ...,京东商城,金五缘航空杯1007004004,厨具|收纳保鲜|一次性饭盒,金五缘一次性保鲜盒 外卖盒 饭盒 食品盒 长方形（1000毫升*300套）,厨具>餐具>一次性餐具>金五缘一次性保鲜盒 外卖盒 饭盒 食品盒...,京东商城,金五缘航空杯1007004004,厨具|收纳保鲜|一次性饭盒,禧宏 含盖 一次性饭盒 一次性餐盒 便当盒 打包盒 外卖盒 1000套,厨具 > 餐具 > 一次性餐具,亚马逊(卓越网),禧宏1007004004,厨具|收纳保鲜|一次性饭盒,禧宏一次性四格打包盒 一次性环保餐盒 一次性外卖盒 饭盒 四格连体盒（100套）,厨具>餐具>一次性餐具>禧宏（xihong）>禧宏一次性四格打包盒 一次性环保餐盒 一...,京东商城,禧宏一次性用品旗舰店1007004004,厨具|收纳保鲜|一次性饭盒,禧宏 一次性打包盒寿司盒带盖透明饭盒塑料糕点盒果蔬菜盒中一深3000个,所有分类>厨卫清洁、纸、清洁剂>一次性用品>一次性餐具>一次性餐盒>禧宏>禧宏 一次性打包盒寿...,1号店,禧宏1007004004,厨具|收纳保鲜|一次性饭盒,禧宏 一次性透明餐盒 便当盒 四格餐盒 4格餐盒透明饭盒1000套/箱 ,家居家纺、锅具餐具>餐具水具>保鲜盒>禧宏,1号店,禧宏1007004004,厨具|收纳保鲜|一次性饭盒,一次性餐盒 饭盒 快餐盒 便当盒 套餐盒 打包盒 四格 （厦商四格餐盒*420套）,厨具>餐具>一次性餐具>一次性餐盒 饭盒 快餐盒 便当盒 套餐盒...,京东商城,千牛家居1007004004,厨具|收纳保鲜|一次性饭盒,禧宏700毫升带盖一次性纸碗 环保碗 打包碗 饭碗 汤碗 便当碗 餐碗 饭盒餐盒1000套,厨具>餐具>一次性餐具>禧宏700毫升带盖一次性纸碗 环保碗 打...,京东商城,千牛家居1007004004,厨具|收纳保鲜|一次性饭盒,特百洁一次性保鲜盒 一次性餐盒 饭盒 食品盒 方形食品盒（1000毫升*300套）,厨具>餐具>一次性餐具>特百洁>特百洁一次性保鲜盒 一次性餐盒 饭盒 食...,京东商城,千牛家居1007004004,厨具|收纳保鲜|一次性饭盒,特百洁一次性饭盒 塑料餐盒一次性饭盒 长方形食品盒 外面盒 （1200ml凸盖150套）,厨具>餐具>一次性餐具>特百洁>特百洁一次性饭盒 塑料餐盒一次性饭盒 长...,京东商城,推广、家居生活、餐饮娱乐等场所使用,健康环保耐高温1007004004,厨具|收纳保鲜|一次性饭盒,含盖960ml一次性打包纸碗 环保碗 一次性饭盒 1000个,厨具>餐具>一次性餐具>禧宏（xihong）>含盖960ml一次性打包纸碗 环保碗 一...,京东商城,禧宏一次性用品旗舰店1007004004,厨具|收纳保鲜|一次性饭盒,禧宏 一次性餐盒四格 环保餐盒 四格连体 一次性连体餐盒 饭盒（A007*300个）,其他 > 其他,亚马逊(卓越网),禧宏1007004004,厨具|收纳保鲜|一次性饭盒,禧宏 一次性餐盒 便当盒 高档打包盒 快餐盒 连体单格盒子 饭盒（A106单格*1000套）,其他 > 其他,亚马逊(卓越网),禧宏1007004004,厨具|收纳保鲜|一次性饭盒,禧宏含盖双格一次性饭盒 便当盒 打包盒 外卖盒 塑料餐盒（双格6828餐盒*150套）,首页>家居/家装建材/厨具>餐厨用具>保鲜盒/便当盒>禧宏含盖双格一次性饭盒便当盒打包...,苏宁,禧宏1007004004,厨具|收纳保鲜|一次性饭盒,特百洁一次性塑料保鲜盒 外卖盒 快餐盒 饭盒方形盒（650毫升方形盒*300套）,家居日用 > 厨房用品 > 一次性餐具 > 商品详情,当当网,特百洁1007004004,厨具|收纳保鲜|一次性饭盒,康苗饭盒王A03CS单格一次性餐具 打包餐具 外卖餐具400ml（600套）,厨具 > 餐具 > 一次性餐具,亚马逊(卓越网),康苗饭盒王1007004004,厨具|收纳保鲜|一次性饭盒,禧宏一次性餐盒四格 环保餐盒 四格连体 一次性连体餐盒 饭盒（A007*100个）,家居日用 > 厨房用品 > 一次性餐具 > 商品详情,当当网,禧宏1007004004,厨具|收纳保鲜|一次性饭盒,酒店专供一次性打包饭盒625ml 圆形餐具盒 便当盒H26（300只）,厨具>餐具>一次性餐具>其它>酒店专供一次性打包饭盒625ml 圆形餐...,京东商城,尚丽屋日用家居生活馆1007004004,厨具|收纳保鲜|一次性饭盒,带盖一次性餐盒 环保饭盒 打包盒 单格盖浇饭盒300套/箱 白色,首页>家居/家装建材/厨具>餐厨用具>保鲜盒/便当盒>带盖一次性餐盒环保饭盒打包盒单...,苏宁,禧宏1007004004,厨具|收纳保鲜|一次性饭盒,禧宏一次性五格饭盒 塑料快餐盒 外卖便当盒黑红商务套餐盒600个装,家居日用 > 厨房用品 > 一次性餐具 > 禧宏一次性五格饭盒 塑料快餐盒 外卖便当盒黑红商务套餐盒600个...,当当网,禧宏1007004004,厨具|收纳保鲜|一次性饭盒,一次性保鲜盒 汤盒 圆形盒便当盒 外卖盒 饭盒 （380毫升圆形盒*450套）,家居日用 > 厨房用品 > 碗盘餐具 > 一次性保鲜盒 汤盒 圆形盒便当盒 外卖盒 饭盒 （380毫升圆形盒*4...,当当网,禧宏1007004004,厨具|收纳保鲜|一次性饭盒,金五缘一次性塑料保鲜盒 外卖盒 快餐盒 饭盒方形盒（650毫升方形盒*300套）,厨具>餐具>一次性餐具>特百洁>金五缘一次性塑料保鲜盒 外卖盒 快餐盒 ...,京东商城,推广、家居生活、餐饮娱乐等场所使用,健康环保耐高温1007004004,厨具|收纳保鲜|一次性饭盒,禧宏 带盖圆形塑料碗一次性饭盒 微波碗 汤碗 圆形盒（750ML汤碗*300套）,其他 > 其他,亚马逊(卓越网),禧宏1007004004,厨具|收纳保鲜|一次性饭盒,禧宏 双格餐盒一次性双格餐盒 分格饭盒 塑料透明打包盒 一次性饭盒（650毫升*50套）,其他 > 其他,亚马逊(卓越网),禧宏1007004004,厨具|收纳保鲜|一次性饭盒,禧宏 超值一次性快餐盒一次性连体三格餐盒打包外卖盒一次性饭盒（A302*100个）,其他 > 其他,亚马逊(卓越网),禧宏1007004004,厨具|收纳保鲜|一次性饭盒,禧宏960毫升一次性普通纸碗 打包碗 一次性饭盒 纸桶碗 方便面碗 饭碗1000个含盖,家居日用 > 厨房用品 > 一次性餐具 > 商品详情,当当网,禧宏1007004004,厨具|收纳保鲜|一次性饭盒,特百洁一次性饭盒 塑料餐盒一次性饭盒 长方形食品盒 外面盒 （1200ml凸盖150套）,家居日用 > 厨房用品 > 一次性餐具 > 商品详情,当当网,特百洁1007004004,厨具|收纳保鲜|一次性饭盒,禧宏一次性四格饭盒一次性连体餐盒米白快餐盒便当盒打包盒（C006四格连体*300个）,家居日用 > 厨房用品 > 一次性餐具 > 商品详情,当当网,禧宏1007004004,厨具|收纳保鲜|一次性饭盒,一次性餐盒 饭盒 快餐盒 便当盒 套餐盒 打包盒 （1000毫升正方形*300套）,厨具>餐具>一次性餐具>禧宏（xihong）>一次性餐盒 饭盒 快餐盒 便当盒 套餐盒...,京东商城,禧宏一次性用品旗舰店1007004004,厨具|收纳保鲜|一次性饭盒,岸宝正品 长方形餐盒1000ml 塑料一次饭餐盒 便携汤饭盒,家居家装>清洁用品>一次性用品>岸宝>岸宝正品 长方形餐盒1000ml 塑料一...,京东商城,岸宝1007004004,厨具|收纳保鲜|一次性饭盒,禧宏750ml带盖一次性方形快餐盒保鲜盒外卖盒饭盒食品盒 100个,家居日用 > 厨房用品 > 一次性餐具 > 禧宏750ml带盖一次性方形快餐盒保鲜盒外卖盒饭盒食品盒 100个,当当网,禧宏1007004004,厨具|收纳保鲜|一次性饭盒,【哆啦A梦】双层时尚族饭盒   ,时尚居家>厨房用具>餐具>【哆啦A梦】双层时尚族饭盒   ,为为网,哆啦A梦1007004004,厨具|收纳保鲜|一次性饭盒,爱之佳 2078 400ml 方便大腕 一次性碗 一次性塑料汤碗 一次性餐具 饭盒 面碗 塑料碗 透明塑料碗,家用/类别/厨具/餐具/一次性餐具,亚马逊(卓越网),爱之佳1007004004,厨具|收纳保鲜|一次性饭盒,金五缘650ml一次性餐盒 分格饭盒 塑料透明打包盒 2格一次性饭盒 （50套）,其他/商品/其他,亚马逊(卓越网),金五缘1007004004,厨具|收纳保鲜|一次性饭盒,禧宏960毫升一次性普通纸碗 打包碗 一次性饭盒 纸桶碗 方便面碗 饭碗1000个含盖,首页>家居/家装建材/厨具>餐厨用具>餐具>禧宏960毫升一次性普通纸碗打包碗...,苏宁,禧宏1007004004,厨具|收纳保鲜|一次性饭盒,特百洁960毫升一次性加厚纸碗 打包碗 一次性饭盒 纸桶碗 面碗 饭碗 汤碗1000个含盖,首页>家居/家装建材/厨具>餐厨用具>餐具>特百洁960毫升一次性加厚纸碗打包...,苏宁,特百洁1007004004,厨具|收纳保鲜|一次性饭盒,禧宏一次性四格饭盒一次性连体餐盒米白快餐盒便当盒打包盒（C006四格连体*300个）,首页>家居/家装建材/厨具>餐厨用具>保鲜盒/便当盒>禧宏一次性四格饭盒一次性连体餐盒米白...,苏宁,禧宏1007004004,厨具|收纳保鲜|一次性饭盒,禧宏一次性透明餐盒 便当盒 四格餐盒 4格餐盒透明饭盒（四格透明餐盒*100套）,首页>家居/家装建材/厨具>餐厨用具>保鲜盒/便当盒>禧宏一次性透明餐盒便当盒四格餐盒...,苏宁,禧宏1007004004,厨具|收纳保鲜|一次性饭盒,禧宏含盖一次性饭盒 便当盒 打包盒 外卖盒 一次性餐盒（台湾129黑红*1000个）,首页>家居/家装建材/厨具>餐厨用具>保鲜盒/便当盒>禧宏含盖一次性饭盒便当盒打包盒...,苏宁,禧宏1007004004,厨具|收纳保鲜|一次性饭盒,特百洁一次性塑料保鲜盒 外卖盒 圆柱形 汤碗汤盒 饭盒（1000毫升圆形盒*300套）,家居日用 > 厨房用品 > 一次性餐具 > 商品详情,当当网,特百洁1007004004,厨具|收纳保鲜|一次性饭盒,禧宏含盖双格一次性饭盒 便当盒 打包盒 外卖盒 塑料餐盒1000ml（双格餐盒*50套）,家居日用 > 厨房用品 > 一次性餐具 > 商品详情,当当网,禧宏1007004004,厨具|收纳保鲜|一次性饭盒,酒店专供一次性打包饭盒1000ml 圆形餐具盒 便当盒H35（400只）,厨具>餐具>一次性餐具>其它>酒店专供一次性打包饭盒1000ml 圆形...,京东商城,尚丽屋日用家居生活馆1007004004,厨具|收纳保鲜|一次性饭盒,一次性塑料保鲜盒 外卖盒 快餐盒 饭盒 椭圆食盒（650毫升*300套）,厨具>餐具>一次性餐具>禧宏（xihong）>一次性塑料保鲜盒 外卖盒 快餐盒 饭盒 ...,京东商城,禧宏一次性用品旗舰店1007004004,厨具|收纳保鲜|一次性饭盒,1000ml方形一次性外卖盒打包餐盒 寿司盒 饭盒 食品盒 保鲜盒100个,厨具>餐具>一次性餐具>禧宏（xihong）>1000ml方形一次性外卖盒打包餐盒 寿...,京东商城,1007004004,厨具|收纳保鲜|一次性饭盒,金五缘一次性三格快餐盒 一次性连体三格餐盒环保餐盒饭盒 一次性饭盒（100套）,其他/商品/其他,亚马逊(卓越网),金五缘1007004004,厨具|收纳保鲜|一次性饭盒,金五缘 一次性四格餐盒 一次性环保餐盒 饭盒 打包盒 便当盒 一次性塑料盒子100套,其他 > 其他,亚马逊(卓越网),金五缘1007004004,厨具|收纳保鲜|一次性饭盒,金五缘一次性双格餐盒 分格饭盒 塑料透明打包盒 2格一次性饭盒 （650ml*300套）,厨具>餐具>一次性餐具>金五缘一次性双格餐盒 分格饭盒 塑料透明...,京东商城,金五缘航空杯1007004004,厨具|收纳保鲜|一次性饭盒,商吉 51cup 500ml圆形优质塑料一次性饭盒 快餐外卖保鲜盒50套,所有分类>厨卫清洁、纸、清洁剂>一次性用品>一次性餐具>一次性餐盒>商吉 51cup>商吉 51cup 5...,1号店,商吉 51cup1007004004,厨具|收纳保鲜|一次性饭盒,商吉 51cup 2号牛皮纸打包盒食品盒环保快餐便当盒纸饭盒100只,所有分类>厨卫清洁、纸、清洁剂>一次性用品>一次性餐具>一次性餐盒>商吉 51cup>商吉 51cup 2...,1号店,商吉 51cup1007004004,厨具|收纳保鲜|一次性饭盒,金五缘一次性塑料保鲜盒 外卖盒 圆柱形 汤碗汤盒 饭盒（1000毫升圆形盒*300套）,厨具>餐具>一次性餐具>特百洁>金五缘一次性塑料保鲜盒 外卖盒 圆柱形 ...,京东商城,推广、家居生活、餐饮娱乐等场所使用,健康环保耐高温1007004004,厨具|收纳保鲜|一次性饭盒,禧宏一次性餐盒 打包盒 带盖塑料透明饭盒 寿司盒 包装盒（大一深*2000只）,厨具>餐具>一次性餐具>禧宏一次性餐盒 打包盒 带盖塑料透明饭盒...,京东商城,千牛家居1007004004,厨具|收纳保鲜|一次性饭盒,禧宏 含盖一次性餐盒 饭盒 便当盒 打包盒 外卖盒 环保塑料餐盒（黑色餐盒* 100套）,其他 > 其他,亚马逊(卓越网),禧宏1007004004,厨具|收纳保鲜|一次性饭盒,禧宏 带盖一次性四格餐盒 四格饭盒 打包盒 外卖盒 环保餐盒（黑红餐盒*1000个）,其他 > 其他,亚马逊(卓越网),禧宏1007004004,厨具|收纳保鲜|一次性饭盒,特百洁一次性塑料保鲜盒 外卖盒 快餐盒 饭盒 椭圆食盒（500毫升*300套）,首页>家居/家装建材/厨具>餐厨用具>保鲜盒/便当盒>特百洁一次性塑料保鲜盒外卖盒快餐...,苏宁,特百洁