1007003005,厨具|刀、剪、菜板|刀具配件,台湾正士作 磨刀工具 专业笔式磨刀棒 ZSZ-XJ0017,厨具>刀剪菜板>刀具配件>台湾正士作 磨刀工具 专业笔式磨刀棒 Z...,京东商城,礼想家1007003005,厨具|刀、剪、菜板|刀具配件,京瓷 Kyocera 精密陶瓷 磨刀器（金属刀专用）RSN-20 黑,厨具>刀剪菜板>刀具配件>京瓷（kyocera）>京瓷 Kyocera 精密陶瓷 磨刀器（...,京东商城,欣麦专营店1007003005,厨具|刀、剪、菜板|刀具配件,王麻子 九件白塘刀,家居日用>刀具配件>王麻子>王麻子 九件白塘刀,国美电器网上商城,王麻子1007003005,厨具|刀、剪、菜板|刀具配件,信柏 厨房万能防菌收纳筒 厨房置物架 餐具收纳筒 刀具收纳 刀架 紫色,厨具>刀剪菜板>刀具配件>信柏SURPAQ >信柏 厨房万能防菌收纳筒 厨房置物架 餐...,京东商城,信柏专卖店1007003005,厨具|刀、剪、菜板|刀具配件,onlinem盎睐玛特美耐皿砧板切菜板 多功能陶瓷削皮器水果刀带砧板三件套k-1048 紫阳花,厨具>刀剪菜板>刀具配件>盎睐玛特（onlineM）>onlinem盎睐玛特美耐皿砧板切菜板 ...,京东商城,蝶艺美onlineM时尚家居1007003005,厨具|刀、剪、菜板|刀具配件,金门胡子王 厨房刀具 5色可选 刨刀+水果刀经济实惠二件套 蓝色,厨具>刀剪菜板>刀具配件>胡子王 >金门胡子王 厨房刀具 5色可选 刨刀+水...,京东商城,胡子王旗舰店1007003005,厨具|刀、剪、菜板|刀具配件,阳江十八子作不锈钢切削器 W-510多功能切片器,家居日用>刀具配件>十八子作>阳江十八子作不锈钢切削器 W-510多功能切片器,国美电器网上商城,十八子作1007003005,厨具|刀、剪、菜板|刀具配件,王麻子 七件高级美容套装,家居日用>刀具配件>王麻子>王麻子 七件高级美容套装,国美电器网上商城,王麻子旗舰店1007003005,厨具|刀、剪、菜板|刀具配件,法克曼阿卡丽娜磨刀器42178,厨具>刀剪菜板>刀具配件>法克曼（Fackelmann）>法克曼磨刀器,京东商城,法克曼（Fackelmann）1007003005,厨具|刀、剪、菜板|刀具配件,英锋 AnySharp Pro 礼盒装 磨刀器,厨具>刀剪菜板>刀具配件>英锋（AnySharp）>英锋磨刀器,京东商城,英锋（AnySharp）1007003005,厨具|刀、剪、菜板|刀具配件,ARCOS 锐高仕-UTENSILS红酒开瓶器红酒开瓶器礼盒装-604400,厨具>刀剪菜板>刀具配件>锐高仕>ARCOS 锐高仕-UTENSILS红酒...,京东商城,欧雅尚品家居馆1007003005,厨具|刀、剪、菜板|刀具配件,巧媳妇开瓶 AM011,厨具>刀剪菜板>刀具配件>巧媳妇>巧媳妇开瓶 AM011,京东商城,宏瑞生活馆1007003005,厨具|刀、剪、菜板|刀具配件,京瓷陶瓷刀 KB-20W SL / BR 礼盒水笔适用C-300笔芯,厨具>刀剪菜板>刀具配件>京瓷（kyocera）>京瓷陶瓷刀 KB-20W SL / ...,京东商城,欣麦家居专营店1007003005,厨具|刀、剪、菜板|刀具配件,多功能不锈钢水果切片器/西瓜切 大号切果器(39*27.6cm),厨具>刀剪菜板>刀具配件>双庆>多功能不锈钢水果切片器/西瓜切 大号切果...,京东商城,吉满家居专营店1007003005,厨具|刀、剪、菜板|刀具配件,宏宝 磨刀器家用 小型磨刀器 磨刀架 厨房 金刚磨刀石 HLK018-01A,厨具>刀剪菜板>刀具配件>宏宝（HOBO）>宏宝 磨刀器家用 小型磨刀器 磨刀架 厨...,京东商城,宏宝家居1007003005,厨具|刀、剪、菜板|刀具配件,Escrison精品5、菜、削刀架 陶瓷刀刀架 水果刀架 亚克力非不锈钢刀座 3合一刀架,厨具>刀剪菜板>刀具配件>艾森·克里森(Escrison)>Escrison精品5、菜、削刀架 陶瓷...,京东商城,Escrison（艾森克里森） 陶瓷刀旗舰店1007003005,厨具|刀、剪、菜板|刀具配件,POLO厨房必备多功能刀具组套装 不锈钢厨具5件套,家居日用>刀具配件>爱尔兰保罗>POLO厨房必备多功能刀具组套装 不锈钢厨具5件套,国美电器网上商城,爱尔兰保罗1007003005,厨具|刀、剪、菜板|刀具配件,三合一转旋转可挂式多功能果蔬削皮器 创意削皮刀刮皮刀刨丝器 玫红,厨具>刀剪菜板>刀具配件>嫒尚宅品>三合一转旋转可挂式多功能果蔬削皮器 创意...,京东商城,1007003005,厨具|刀、剪、菜板|刀具配件,磨刀匠GRINDER 便携磨刀器 可磨折叠刀/折刀/户外刀/军刀T0501TC 黑色,厨具>刀剪菜板>刀具配件>磨刀匠（GRINDER） >磨刀匠GRINDER 便携磨刀器 可磨折...,京东商城,泰帝旗舰店1007003005,厨具|刀、剪、菜板|刀具配件,艾铂赫IBOH B015典雅不锈钢五件套,厨具>刀剪菜板>刀具配件>艾铂赫（IBOH）>艾铂赫IBOH B015典雅不锈钢五件套,京东商城,菲玛思1007003005,厨具|刀、剪、菜板|刀具配件,酷家陶瓷刨刀 陶瓷水果刀 "酷乐" 黑刀礼盒两件套KJ-CK601 KJ-CK601B,厨具>刀剪菜板>刀具配件>其它>酷家陶瓷刨刀 陶瓷水果刀 "酷乐" 黑刀...,京东商城,百悦网旗舰店1007003005,厨具|刀、剪、菜板|刀具配件,onlinem盎睐玛特美耐皿砧板切菜板 多功能陶瓷削皮器水果刀带砧板三件套k-1048 舞动蝴蝶,厨具>刀剪菜板>刀具配件>盎睐玛特（onlineM）>onlinem盎睐玛特美耐皿砧板切菜板 ...,京东商城,蝶艺美onlineM时尚家居1007003005,厨具|刀、剪、菜板|刀具配件,磨刀匠GRINDER 双面金刚石磨刀棒 配磨刀辅助刀架 陶瓷刀磨刀石磨刀器,厨具>刀剪菜板>刀具配件>磨刀匠（GRINDER） >磨刀匠GRINDER 双面金刚石磨刀棒...,京东商城,TAIDEA家居专营店1007003005,厨具|刀、剪、菜板|刀具配件,张小泉简易三件套搭配整竹纯天然环保砧板组合S80300100+W70002000,家居日用>刀具配件>张小泉>张小泉简易三件套搭配整竹纯天然环保砧板组合S80300100+W70002000,国美电器网上商城,张小泉1007003005,厨具|刀、剪、菜板|刀具配件,先后 陶瓷刀具 黑色刃削皮器 紫色,厨具>刀剪菜板>刀具配件>先后 陶瓷刀具 黑色刃削皮器 紫色,京东商城,先后创意家居1007003005,厨具|刀、剪、菜板|刀具配件,王麻子 7件白塘刀修脚刀(皮包),家居日用>刀具配件>王麻子>王麻子 7件白塘刀修脚刀(皮包),国美电器网上商城,王麻子旗舰店1007003005,厨具|刀、剪、菜板|刀具配件,王麻子 七件高级美容套装,家居日用>刀具配件>王麻子>王麻子 七件高级美容套装,国美电器网上商城,王麻子旗舰店1007003005,厨具|刀、剪、菜板|刀具配件,多样屋TAYOHYA4孔竹刀座TA110303001ZZ,厨具>刀剪菜板>刀具配件>多样屋TAYOHYA4孔竹刀座TA110...,京东商城,易居尚官方旗舰店1007003005,厨具|刀、剪、菜板|刀具配件,大吉 核桃夹子组合装(一大一小) 可夹 胡桃 碧根果 红,厨具>刀剪菜板>刀具配件>大吉>大吉 核桃夹子组合装(一大一小) 可夹 ...,京东商城,大吉旗舰店1007003005,厨具|刀、剪、菜板|刀具配件,酷菲偲彩虹刀具系列磨刀棒LOR100,厨具>刀剪菜板>刀具配件>酷菲偲>酷菲偲刀具,京东商城,酷菲偲1007003005,厨具|刀、剪、菜板|刀具配件,台湾制造 日光生活 厨房用快速磨刀器石 可挂手握式磨刀器 Q301,厨具>刀剪菜板>刀具配件>日光生活>台湾制造 日光生活 厨房用快速磨刀器石 ...,京东商城,日光生活1007003005,厨具|刀、剪、菜板|刀具配件,法克曼 2只装 桔子剥皮器 开橙子器 剥桔子器 48016,厨具>刀剪菜板>刀具配件>法克曼（Fackelmann）>法克曼 2只装 桔子剥皮器 开橙子器 剥...,京东商城,金熙家美家居厨房用品专营店1007003005,厨具|刀、剪、菜板|刀具配件,巧媳妇多用钳AM-010,厨具>刀剪菜板>刀具配件>巧媳妇>巧媳妇多用钳AM-010,京东商城,宏瑞生活馆1007003005,厨具|刀、剪、菜板|刀具配件,旭派 陶瓷刀 三件套 亚克力刀架 刀座 黑色 20.5*16.5*9,厨具>刀剪菜板>刀具配件>旭派 陶瓷刀 三件套 亚克力刀架 刀座 ...,京东商城,旭派官方旗舰店1007003005,厨具|刀、剪、菜板|刀具配件,巧媳妇不锈钢厨具套装6件套不锈钢 优质橡塑柄含厨具架cj002-6,厨具>刀剪菜板>刀具配件>巧媳妇（SMARTWIFE）>巧媳妇不锈钢厨具套装6件套不锈钢 优质橡...,京东商城,潮南今灿家居日用专营店1007003005,厨具|刀、剪、菜板|刀具配件,巧刃CuCut立式塑料刀座 恬静黄 18*14.5*23.5cm,厨具>刀剪菜板>刀具配件>巧刃CuCut立式塑料刀座 恬静黄 18...,京东商城,66家居1007003005,厨具|刀、剪、菜板|刀具配件,umbra HOLD UP 高架刀架 (330585) 白色660,厨具>刀剪菜板>刀具配件>umbra HOLD UP 高架刀架 (...,京东商城,加拿大umbra家居用品店1007003005,厨具|刀、剪、菜板|刀具配件,安雅 差旅道具套装 刀、手柄、削皮器、开瓶器和卫生切板D462 颜色随机发货,厨具>刀剪菜板>刀具配件>安雅 差旅道具套装 刀、手柄、削皮器、开...,京东商城,淘金百货1007003005,厨具|刀、剪、菜板|刀具配件,百年蔷薇高级五件套亚力克刀架,厨具>刀剪菜板>刀具配件>喜木坊>百年蔷薇高级五件套亚力克刀架,京东商城,橡果国际网络旗舰店1007003005,厨具|刀、剪、菜板|刀具配件,宏宝 合金不锈钢核桃夹螃蟹工具夹小山核桃核桃钳子坚果夹 HLK022-01,厨具>刀剪菜板>刀具配件>宏宝（HOBO）>宏宝 合金不锈钢核桃夹螃蟹工具夹小山核桃...,京东商城,宏宝家居1007003005,厨具|刀、剪、菜板|刀具配件,汇丰信佳 雅致长条形 耐用不锈钢刃 削皮器 削水果去皮器 削皮刀 颜色种类较多.随机发货,厨具>刀剪菜板>刀具配件>汇丰信佳 雅致长条形 耐用不锈钢刃 削皮...,京东商城,汇丰信佳旗舰店1007003005,厨具|刀、剪、菜板|刀具配件,巧媳妇黑碳防滑磨刀石AM-03,厨具>刀剪菜板>刀具配件>巧媳妇（SMARTWIFE）>巧媳妇黑碳防滑磨刀石AM-03,京东商城,太原唐久大卖场1007003005,厨具|刀、剪、菜板|刀具配件,Eva Solo 磁力刀架，8把,厨具>刀剪菜板>刀具配件>Eva Solo>Eva Solo 磁力刀架，8把,京东商城,RoyalDesign欧洲皇家设计潮品1007003005,厨具|刀、剪、菜板|刀具配件,台湾陶瓷冰酒石 独创威士忌洋酒红酒冰酒石 9枚入DH254_白色,厨具>刀剪菜板>刀具配件>珀挺potent>台湾陶瓷冰酒石 独创威士忌洋酒红酒冰酒石...,京东商城,艾能家居旗舰店1007003005,厨具|刀、剪、菜板|刀具配件,京瓷 Kyocera 精密陶瓷 磨刀器（金属刀专用）RSN-20 黄,厨具>刀剪菜板>刀具配件>京瓷（kyocera）>京瓷 Kyocera 精密陶瓷 磨刀器（...,京东商城,欣麦专营店1007003005,厨具|刀、剪、菜板|刀具配件,Escrison精品4、6、菜刀架 透明款 陶瓷刀刀架 水果刀 亚克力非不锈钢刀座,厨具>刀剪菜板>刀具配件>艾森·克里森(Escrison)>Escrison精品4、6、菜刀架 透明...,京东商城,Escrison（艾森克里森） 陶瓷刀旗舰店1007003005,厨具|刀、剪、菜板|刀具配件,王麻子 多功能工具（小）,家居日用>刀具配件>王麻子>王麻子 多功能工具（小）,国美电器网上商城,王麻子旗舰店1007003005,厨具|刀、剪、菜板|刀具配件,王麻子 MA9G-1九件美容套装,家居日用>刀具配件>王麻子>王麻子 MA9G-1九件美容套装,国美电器网上商城,王麻子旗舰店1007003005,厨具|刀、剪、菜板|刀具配件,王麻子 十件高级美容修脚组合套装,家居日用>刀具配件>王麻子>王麻子 十件高级美容修脚组合套装,国美电器网上商城,王麻子旗舰店1007003005,厨具|刀、剪、菜板|刀具配件,王麻子 3件白塘刀修脚刀,家居日用>刀具配件>王麻子>王麻子 3件白塘刀修脚刀,国美电器网上商城,王麻子旗舰店1007003005,厨具|刀、剪、菜板|刀具配件,伊藤彩 日本进口  波浪形料理刀 两只装 011723,家居日用>刀具配件>伊藤彩>伊藤彩 日本进口  波浪形料理刀 两只装 011723,国美电器网上商城,伊藤彩1007003005,厨具|刀、剪、菜板|刀具配件,厨之宝九件套 夹碗器 多用锅盖架 不沾油抹布 计算机 蛋清分离器 多功能料理器 餐具三件套,厨具>刀剪菜板>刀具配件>其它>厨之宝九件套 夹碗器 多用锅盖架 不沾油...,京东商城,橡果国际官方旗舰店1007003005,厨具|刀、剪、菜板|刀具配件,厨具礼品套装开瓶器/压蒜器/核桃钳厨房小工具厨具用品大礼包,厨具>刀剪菜板>刀具配件>品和>厨具礼品套装开瓶器/压蒜器/核桃钳厨房小...,京东商城,null1007003005,厨具|刀、剪、菜板|刀具配件,顶级厨具套装红酒酒具套装开瓶器压蒜器核桃钳核桃夹开罐器,厨具>刀剪菜板>刀具配件>品和>顶级厨具套装红酒酒具套装开瓶器压蒜器核桃...,京东商城,卡冉柏家居专营店1007003005,厨具|刀、剪、菜板|刀具配件,进口Duendu水晶杯醒酒器红酒杯高脚杯保养布清洁布擦杯布新品,厨具>刀剪菜板>刀具配件>品和>进口Duendu水晶杯醒酒器红酒杯高脚杯...,京东商城,卡冉柏家居专营店1007003005,厨具|刀、剪、菜板|刀具配件,艾铂赫IBOH B017多用厨房刀,厨具>刀剪菜板>刀具配件>其它>艾铂赫IBOH B017多用厨房刀,京东商城,菲玛思1007003005,厨具|刀、剪、菜板|刀具配件,酷艺家 圆形多用三合一去皮刀 削皮器 K60061 粉色,厨具>刀剪菜板>刀具配件>酷艺家>酷艺家 圆形多用三合一去皮刀 削皮器 K...,京东商城,鸿润诚品家居专营店