1007007001,厨具|茶具、咖啡具|整套茶具,关耳窑 乌金石茶盘茶具套装紫砂茶具套装 整套茶具套装 T-YZPL3T053 套装3虎啸,厨具>茶具/咖啡具>整套茶具>关耳窑>关耳窑 乌金石茶盘茶具套装紫砂茶具套装 ...,京东商城,关耳窑旗舰店1007007001,厨具|茶具、咖啡具|整套茶具,关耳窑 乌金石茶盘茶具套装陶瓷茶具套装 整套茶具套装 T-ZP4KK092 套装一红腾花,厨具>茶具/咖啡具>整套茶具>关耳窑 乌金石茶盘茶具套装陶瓷茶具套装 ...,京东商城,关耳窑旗舰店1007007001,厨具|茶具、咖啡具|整套茶具,尚帝 陶圣窑功夫茶具套装 整套陶瓷 仿古雕花茶具茶壶茶杯 XMDT-XQTSYM,厨具>茶具/咖啡具>整套茶具>尚帝 陶圣窑功夫茶具套装 整套陶瓷 仿古...,京东商城,尚帝旗舰店1007007001,厨具|茶具、咖啡具|整套茶具,尚帝 3款整套功夫陶瓷茶具套装 带杯架茶盘实木套装送礼 T-KBHF581 红色,厨具>茶具/咖啡具>整套茶具>尚帝（shangdi）>尚帝 3款整套功夫陶瓷茶具套装 带杯架茶...,京东商城,尚帝旗舰店1007007001,厨具|茶具、咖啡具|整套茶具,尚帝 龙德堂茶具 黑檀茶盘 紫砂茶具 4合1套装 Z-213001C 款式四,厨具>茶具/咖啡具>整套茶具>仁品>尚帝 龙德堂茶具 黑檀茶盘 紫砂茶具 4...,京东商城,尚帝旗舰店1007007001,厨具|茶具、咖啡具|整套茶具,尚帝 整套茶具实木茶盘套装 电磁炉四合一 龙泉青瓷 TZ-SSCJ007 款式三,厨具>茶具/咖啡具>整套茶具>仁品>尚帝 整套茶具实木茶盘套装 电磁炉四合一...,京东商城,尚帝旗舰店1007007001,厨具|茶具、咖啡具|整套茶具,怡品尚瓷 功夫茶具套装 青花瓷手抓壶款 一壶两杯一茶盘（两色茶盘）不二之选系列时尚套装 原竹色,厨具>茶具/咖啡具>整套茶具>怡品尚瓷>怡品尚瓷 功夫茶具套装 青花瓷手抓壶款 ...,京东商城,怡品尚瓷1007007001,厨具|茶具、咖啡具|整套茶具,石趣 实木茶盘茶海 开片汝窑陶瓷整套功夫茶具套装TZ024 一号茶具套装,厨具>茶具/咖啡具>整套茶具>石趣 实木茶盘茶海 开片汝窑陶瓷整套功...,京东商城,淘福1007007001,厨具|茶具、咖啡具|整套茶具,源龙清 30件套实木茶盘紫砂功夫茶具套装,厨具>茶具/咖啡具>整套茶具>源龙青>源龙青茶具套装,京东商城,源龙青1007007001,厨具|茶具、咖啡具|整套茶具,百鸿 藏玉龙图腾紫砂套装乌金石茶盘套装 Z-ZSST067 龙德堂虎啸,厨具>茶具/咖啡具>整套茶具>百鸿>百鸿 藏玉龙图腾紫砂套装乌金石茶盘套装 ...,京东商城,百鸿旗舰店1007007001,厨具|茶具、咖啡具|整套茶具,雪狼 新品 艺术之源 龙泉青瓷功夫茶具 套装 会议礼物 特价免邮 mcc,厨具>茶具/咖啡具>整套茶具>青筑>雪狼 新品 艺术之源 龙泉青瓷功夫茶具 ...,京东商城,苗苗红家居礼品1007007001,厨具|茶具、咖啡具|整套茶具,瑞瓷掬 8头瀛洲哥窑景德镇茶具套装,厨具>茶具/咖啡具>整套茶具>瑞瓷掬 8头瀛洲哥窑景德镇茶具套装,京东商城,景德瓷生活馆1007007001,厨具|茶具、咖啡具|整套茶具,瑞瓷掬 7头木棉花 景德镇茶具套装,厨具>茶具/咖啡具>整套茶具>瑞瓷掬（Ruiciju）>瑞瓷掬 7头木棉花 景德镇茶具套装,京东商城,景德瓷生活馆1007007001,厨具|茶具、咖啡具|整套茶具,a-life最生活 玻璃茶具 茶具 玻璃茶具三件套 高硼硅 B-1008,厨具>茶具/咖啡具>整套茶具>A-life>a-life最生活 玻璃茶具 茶具 玻璃...,京东商城,最生活旗舰店21007007001,厨具|茶具、咖啡具|整套茶具,尚帝 大富陶瓷茶具套装 功夫茶具茶壶茶杯茶宠 18件 DTRVV80K2 红色,厨具>茶具/咖啡具>整套茶具>尚帝（shangdi）>尚帝 大富陶瓷茶具套装 功夫茶具茶壶茶杯...,京东商城,尚帝旗舰店1007007001,厨具|茶具、咖啡具|整套茶具,宏陶茶具 煌艺金边富贵鸟功夫茶具套装,厨具>茶具/咖啡具>整套茶具>宏陶茶具 煌艺金边富贵鸟功夫茶具套装,京东商城,宏陶生活馆1007007001,厨具|茶具、咖啡具|整套茶具,怡品尚瓷茶具套装陶瓷功夫茶景德镇手绘青花瓷 点红山水,厨具>茶具/咖啡具>整套茶具>怡品尚瓷>怡品尚瓷茶具套装陶瓷功夫茶景德镇手绘青花...,京东商城,怡品尚瓷1007007001,厨具|茶具、咖啡具|整套茶具,怡品尚瓷茶具套装功夫茶景德镇青花瓷手绘茶具 康熙荷花,厨具>茶具/咖啡具>整套茶具>怡品尚瓷>怡品尚瓷茶具套装功夫茶景德镇青花瓷手绘茶...,京东商城,怡品尚瓷1007007001,厨具|茶具、咖啡具|整套茶具,优妮彩 中国红金荷花双层杯大茶盘 8头景德镇瓷器茶具套装礼品 LC-B134,厨具>茶具/咖啡具>整套茶具>优妮彩 中国红金荷花双层杯大茶盘 8头景...,京东商城,优妮彩1007007001,厨具|茶具、咖啡具|整套茶具,雪花釉茶具 陶瓷功夫茶具 整套套装茶具 茶壶 陶瓷茶杯公道杯 玉雪蓝宝石,厨具>茶具/咖啡具>整套茶具>雪花釉茶具 陶瓷功夫茶具 整套套装茶具 ...,京东商城,汇茶官方旗舰店1007007001,厨具|茶具、咖啡具|整套茶具,壹叁玖零 汝窑功夫茶具公道杯 圆茶海天青,厨具>茶具/咖啡具>整套茶具>壹叁玖零>壹叁玖零 汝窑功夫茶具公道杯 圆茶海天青,京东商城,壹叁玖零1007007001,厨具|茶具、咖啡具|整套茶具,佐治万古烧 鸿运 急须 日本原装进口手工制紫砂陶茶壶 侧把日式茶壶180ml,厨具>茶具/咖啡具>整套茶具>佐治 >佐治万古烧 鸿运 急须 日本原装进口手工...,京东商城,舶来品家居馆1007007001,厨具|茶具、咖啡具|整套茶具,悠家良品 青瓷茶具套装 高档茶具礼盒 整套茶具 9头青瓷 礼盒装 B款,厨具>茶具/咖啡具>整套茶具>悠家良品 青瓷茶具套装 高档茶具礼盒 整...,京东商城,悠家良品旗舰店1007007001,厨具|茶具、咖啡具|整套茶具,言艺茶具 陶瓷青瓷旅行茶具 办公茶具套装小竹奉茶盘 BWYZ63 鸣秋会友白色,厨具>茶具/咖啡具>整套茶具>言艺茶具 陶瓷青瓷旅行茶具 办公茶具套装...,京东商城,言艺家居旗舰店1007007001,厨具|茶具、咖啡具|整套茶具,雅集整套功夫茶具 青照陶瓷汝窑功夫套装TU 竹茶盘带茶巾 茶具/咖啡具,厨具>茶具/咖啡具>整套茶具>雅集>雅集整套功夫茶具 青照陶瓷汝窑功夫套装T...,京东商城,艺福堂茶具专营店1007007001,厨具|茶具、咖啡具|整套茶具,唐丰 茶具功夫茶具茶盘电磁炉整套装 第四款,厨具>茶具/咖啡具>整套茶具>唐丰>唐丰 茶具功夫茶具茶盘电磁炉整套装 第四...,京东商城,臻茗尚品茶艺轩1007007001,厨具|茶具、咖啡具|整套茶具,唐丰 整套茶具黑檀实木茶盘茶道电磁炉功夫茶艺套装 H款,厨具>茶具/咖啡具>整套茶具>唐丰>唐丰 整套茶具黑檀实木茶盘茶道电磁炉功夫...,京东商城,1007007001,厨具|茶具、咖啡具|整套茶具,晟皓景德镇陶瓷器7头双层隔热防烫茶杯居家日用茶具套装CJTZ-02HZ 黄金盏,厨具>茶具/咖啡具>整套茶具>晟皓景德镇陶瓷器7头双层隔热防烫茶杯居家...,京东商城,晟皓陶瓷官方旗舰店1007007001,厨具|茶具、咖啡具|整套茶具,晟皓景德镇陶瓷青花瓷釉中彩高档居家带托盘茶具 双层隔热防烫茶杯茶壶套装 CJTZ-02S 苏州园林,厨具>茶具/咖啡具>整套茶具>晟皓景德镇陶瓷青花瓷釉中彩高档居家带托盘...,京东商城,晟皓陶瓷官方旗舰店1007007001,厨具|茶具、咖啡具|整套茶具,祥福 整套开片汝窑陶瓷功夫茶具套装 配实木茶盘茶海茶具组TZ024 2号,厨具>茶具/咖啡具>整套茶具>祥福 整套开片汝窑陶瓷功夫茶具套装 配实...,京东商城,祥福官方旗舰店1007007001,厨具|茶具、咖啡具|整套茶具,苏氏新绿釉浮雕双龙戏珠7头茶具组75181,所有分类>家居家纺、锅具餐具>餐具水具>茶具1>整套茶具>苏氏>苏氏新绿釉浮雕双龙戏...,1号店,苏氏1007007001,厨具|茶具、咖啡具|整套茶具,雪狼 新品红金龙 双龙戏珠 整套茶具套装 茶盘 双层隔热陶瓷 SDY 1,厨具>茶具/咖啡具>整套茶具>雪狼（snowwolf）>雪狼 新品红金龙 双龙戏珠 整套茶具套装...,京东商城,苗苗红家居礼品1007007001,厨具|茶具、咖啡具|整套茶具,鑫德鸿窑 整套开片汝窑功夫茶具套装 配荷叶倾心实木茶盘 TZ031 黑色茶盘套装,厨具>茶具/咖啡具>整套茶具>鑫德鸿窑 整套开片汝窑功夫茶具套装 配荷...,京东商城,皇茗旗舰店1007007001,厨具|茶具、咖啡具|整套茶具,百鸿 整套宜兴紫砂茶具/功夫茶具套装 电磁炉实木茶盘杯架 T-XMLDT042A 套装11,厨具>茶具/咖啡具>整套茶具>百鸿>百鸿 整套宜兴紫砂茶具/功夫茶具套装 电...,京东商城,百鸿旗舰店1007007001,厨具|茶具、咖啡具|整套茶具,百鸿 宜兴紫砂茶具 柯木茶盘 功夫茶具 电磁炉茶盘 茶具组合 Z-XMCZ034 套装4,厨具>茶具/咖啡具>整套茶具>百鸿>百鸿 宜兴紫砂茶具 柯木茶盘 功夫茶具 ...,京东商城,百鸿旗舰店1007007001,厨具|茶具、咖啡具|整套茶具,百鸿 陶瓷功夫茶具套装 冰裂茶具套装 电磁炉4合1实木茶盘 T-6KHBT 唐诗红色,厨具>茶具/咖啡具>整套茶具>百鸿 陶瓷功夫茶具套装 冰裂茶具套装 电...,京东商城,百鸿旗舰店1007007001,厨具|茶具、咖啡具|整套茶具,百鸿 哥窑茶具汝窑茶具套装 开片汝瓷茶具 祥云大号实木茶盘电磁炉 T-XMXYBJ055 红色富贵猪,厨具>茶具/咖啡具>整套茶具>百鸿>百鸿 哥窑茶具汝窑茶具套装 开片汝瓷茶具...,京东商城,百鸿旗舰店1007007001,厨具|茶具、咖啡具|整套茶具,百鸿 黑檀电磁炉茶盘套装 黑檀木茶盘 紫砂功夫茶具 整套茶具 Z-XMWF086 套装2,厨具>茶具/咖啡具>整套茶具>百鸿>百鸿 黑檀电磁炉茶盘套装 黑檀木茶盘 紫...,京东商城,百鸿旗舰店1007007001,厨具|茶具、咖啡具|整套茶具,尚帝 陶瓷茶具套装 整套电磁炉杯架实木茶盘 创意茶具瓷器多款 T-XMXYBJ065 套装4,厨具>茶具/咖啡具>整套茶具>仁品>尚帝 陶瓷茶具套装 整套电磁炉杯架实木茶...,京东商城,尚帝旗舰店1007007001,厨具|茶具、咖啡具|整套茶具,尚帝 茶具鸡翅木 茶具套装 宜兴紫砂功夫茶具套装 实木茶盘 Z-XMXZS064 套装2,厨具>茶具/咖啡具>整套茶具>仁品>尚帝 茶具鸡翅木 茶具套装 宜兴紫砂功夫...,京东商城,尚帝旗舰店1007007001,厨具|茶具、咖啡具|整套茶具,尚帝 陶瓷功夫茶具套装 冰裂茶具套装 电磁炉4合1实木茶盘 T-6KHBT 唐诗咖色,厨具>茶具/咖啡具>整套茶具>尚帝（shangdi）>尚帝 陶瓷功夫茶具套装 冰裂茶具套装 电...,京东商城,尚帝旗舰店1007007001,厨具|茶具、咖啡具|整套茶具,尚帝 茶具套装 整套茶具宜兴紫砂功夫茶具 电磁炉实木茶盘套装 T-XMYYQX042 黑诗,厨具>茶具/咖啡具>整套茶具>仁品>尚帝 茶具套装 整套茶具宜兴紫砂功夫茶具...,京东商城,尚帝旗舰店1007007001,厨具|茶具、咖啡具|整套茶具,鼎艺精品功夫茶具 汝窑茶具套装 茶具礼品 创新浮雕工艺 高档茶具礼盒装 红釉 特小号,厨具>茶具/咖啡具>整套茶具>鼎艺>鼎艺精品功夫茶具 汝窑茶具套装 茶具礼品...,京东商城,鼎艺旗舰店1007007001,厨具|茶具、咖啡具|整套茶具,尚帝 乌金石茶盘套装 黑檀茶具组合 茶道套装 4款 陶瓷功夫茶具 T-XMWJS054 套装3,厨具>茶具/咖啡具>整套茶具>尚帝（shangdi）>尚帝 乌金石茶盘套装 黑檀茶具组合 茶道...,京东商城,尚帝旗舰店1007007001,厨具|茶具、咖啡具|整套茶具,尚帝 冰裂茶具 陶瓷功夫茶具套装 实木茶盘电磁炉抽水 Z-XMSSBL063 套装3,厨具>茶具/咖啡具>整套茶具>尚帝 冰裂茶具 陶瓷功夫茶具套装 实木茶...,京东商城,尚帝旗舰店1007007001,厨具|茶具、咖啡具|整套茶具,泥之歌 景德镇陶瓷兰藤花吉祥壶 7头,厨具>茶具/咖啡具>整套茶具>泥之歌 景德镇陶瓷兰藤花吉祥壶 7头,京东商城,淘陶网1007007001,厨具|茶具、咖啡具|整套茶具,关耳窑 乌金石茶盘茶具套装 黑檀茶盘茶具组合 茶道套装 陶瓷功夫茶具 T-XMWJS054 套装2,厨具>茶具/咖啡具>整套茶具>关耳窑>关耳窑 乌金石茶盘茶具套装 黑檀茶盘茶具...,京东商城,关耳窑旗舰店1007007001,厨具|茶具、咖啡具|整套茶具,关耳窑 宜兴紫砂茶具 功夫茶具套装 电磁炉实木茶盘杯架 T-XMLDT042A 套装11,厨具>茶具/咖啡具>整套茶具>关耳窑 宜兴紫砂茶具 功夫茶具套装 电磁...,京东商城,关耳窑旗舰店1007007001,厨具|茶具、咖啡具|整套茶具,关耳窑 宜兴紫砂茶具 功夫茶具 柯木茶盘 电磁炉茶盘 茶具组合 Z-XMCZ034 套装5,厨具>茶具/咖啡具>整套茶具>关耳窑>关耳窑 宜兴紫砂茶具 功夫茶具 柯木茶盘...,京东商城,关耳窑旗舰店1007007001,厨具|茶具、咖啡具|整套茶具,关耳窑 陶瓷功夫茶具套装 冰裂茶具套装 电磁炉4合1实木茶盘 T-6KHBT 唐诗红色,厨具>茶具/咖啡具>整套茶具>关耳窑 陶瓷功夫茶具套装 冰裂茶具套装 ...,京东商城,关耳窑旗舰店1007007001,厨具|茶具、咖啡具|整套茶具,关耳窑 哥窑茶具汝窑茶具套装 开片汝瓷茶具 祥云大号实木茶盘电磁炉 T-XMXYBJ055 黑色富贵猪,厨具>茶具/咖啡具>整套茶具>关耳窑>关耳窑 哥窑茶具汝窑茶具套装 开片汝瓷茶...,京东商城,关耳窑旗舰店1007007001,厨具|茶具、咖啡具|整套茶具,百鸿 红茶玻璃功夫茶具 陶瓷 双耳泡茶器 DTBH5KLS 套装五,厨具>茶具/咖啡具>整套茶具>百鸿 红茶玻璃功夫茶具 陶瓷 双耳泡茶器...,京东商城,百鸿旗舰店1007007001,厨具|茶具、咖啡具|整套茶具,关耳窑 紫砂功夫茶具 黑檀电磁炉茶盘套装 黑檀木茶盘 整套茶具 Z-XMWF086 套装1,厨具>茶具/咖啡具>整套茶具>关耳窑>关耳窑 紫砂功夫茶具 黑檀电磁炉茶盘套装...,京东商城,关耳窑旗舰店1007007001,厨具|茶具、咖啡具|整套茶具,优妮彩 精典极品骨瓷功夫茶具13件套 景德镇陶瓷器 多款可选 骨瓷花鸟功夫茶具,厨具>茶具/咖啡具>整套茶具>优妮彩>优妮彩 精典极品骨瓷功夫茶具13件套 景...,京东商城,优妮彩1007007001,厨具|茶具、咖啡具|整套茶具,优妮彩 景德镇陶瓷极品纯白浮雕龙15件 带陶瓷大茶盘全套茶具套装 LC-A131 多款可选 纯白浮雕龙15件,厨具>茶具/咖啡具>整套茶具>优妮彩>优妮彩 景德镇陶瓷极品纯白浮雕龙15件 ...,京东商城,优妮彩1007007001,厨具|茶具、咖啡具|整套茶具,晟皓景德镇瓷器10头青花釉中彩功夫茶具套装 CJTZ-03DY 童趣,厨具>茶具/咖啡具>整套茶具>晟皓景德镇瓷器10头青花釉中彩功夫茶具套...,京东商城,晟皓陶瓷官方旗舰店1007007001,厨具|茶具、咖啡具|整套茶具,鑫德鸿窑 整套宜兴紫砂功夫茶具套装 配电磁炉荷叶倾心黑色实木茶盘 TZ007 红中莲套装,厨具>茶具/咖啡具>整套茶具>鑫德鸿窑>鑫德鸿窑 整套宜兴紫砂功夫茶具套装 配电...,京东商城,皇茗旗舰店1007007001,厨具|茶具、咖啡具|整套茶具,百鸿 紫砂茶具 汝窑茶具套装实木茶盘整套 Z-BJXY044 杯架祥云汝窑古道套装,厨具>茶具/咖啡具>整套茶具>百鸿 紫砂茶具 汝窑茶具套装实木茶盘整套...,京东商城,百鸿旗舰店1007007001,厨具|茶具、咖啡具|整套茶具,旅行功夫茶具套装 杯茶水分离 中容量 户外休闲旅行茶具包方便携带 世外桃源,厨具>茶具/咖啡具>整套茶具>旅行功夫茶具套装 杯茶水分离 中容量 户...,京东商城,京礼道1007007001,厨具|茶具、咖啡具|整套茶具,玩土成金 礼盒装7头双层杯不烫手茶具套装 亚光春色,厨具>茶具/咖啡具>整套茶具>玩土成金 礼盒装7头双层杯不烫手茶具套装...,京东商城,景德镇秦朗瓷业1007007001,厨具|茶具、咖啡具|整套茶具,唐丰茶具 送礼 陶瓷茶具 手绘 铁釉 德化窑 茶具套装特价TF-1186 傲梅-段香,厨具>茶具/咖啡具>整套茶具>唐丰茶具 送礼 陶瓷茶具 手绘 铁釉 德...,京东商城,唐丰官方旗舰店1007007001,厨具|茶具、咖啡具|整套茶具,肖字和德XZHD茶具冰裂茶具茶壶款套装HD-冰裂,厨具>茶具/咖啡具>整套茶具>肖字和德XZHD茶具冰裂茶具茶壶款套装H...,京东商城,幸福家1007007001,厨具|茶具、咖啡具|整套茶具,优妮彩 青花江南 红茶泡茶器玻璃茶具+陶瓷茶杯套装 礼品 多款可选 青花鹭栖红茶泡茶器,厨具>茶具/咖啡具>整套茶具>优妮彩>优妮彩 青花江南 红茶泡茶器玻璃茶具+陶...,京东商城,优妮彩1007007001,厨具|茶具、咖啡具|整套茶具,陶瓷故事龙泉青瓷创意功夫茶具套装 茶侧陶瓷手抓茶壶 一壶两杯 （不含茶盘） 粉青,厨具>茶具/咖啡具>整套茶具>陶瓷故事>陶瓷故事龙泉青瓷创意功夫茶具套装 茶侧陶...,京东商城,夏至家居1007007001,厨具|茶具、咖啡具|整套茶具,唐丰品牌正品茶具 宜兴 原紫砂茶具 整套 功夫茶具 茶具套装TF-344 浪淘沙8入,厨具>茶具/咖啡具>整套茶具>唐丰>唐丰品牌正品茶具 宜兴 原紫砂茶具 整套...,京东商城,唐丰官方旗舰店1007007001,厨具|茶具、咖啡具|整套茶具,陶瓷故事 青瓷餐具 牡丹饭碗四只加耐热玻璃三件套办公杯 组合装 牡丹碗4只+玻璃杯1只套装 梅子青,厨具>茶具/咖啡具>整套茶具>陶瓷故事>陶瓷故事 青瓷餐具 牡丹饭碗四只加耐热玻...,京东商城,圣唐家居馆1007007001,厨具|茶具、咖啡具|整套茶具,唐丰茶具 玲珑镂空青瓷茶具不漏水 陶瓷 整套 功夫茶具 TF-1342,厨具>茶具/咖啡具>整套茶具>唐丰>唐丰茶具 玲珑镂空青瓷茶具不漏水 陶瓷 ...,京东商城,唐丰官方旗舰店1007007001,厨具|茶具、咖啡具|整套茶具,陶立方 精品茶具套装亚光白釉凹凸金红牡丹功夫茶具居家送礼高档彩盒 G75892,厨具>茶具/咖啡具>整套茶具>陶立方 精品茶具套装亚光白釉凹凸金红牡丹...,京东商城,陶立方官方旗舰店1007007001,厨具|茶具、咖啡具|整套茶具,三义成定窑新年茶礼曲阳定瓷定窑7头瓜棱壶功夫茶具套装,厨具>茶具/咖啡具>整套茶具>三义成>三义成定窑新年茶礼曲阳定瓷定窑7头瓜棱壶...,京东商城,三义成1007007001,厨具|茶具、咖啡具|整套茶具,肖字和德XZHD紫砂功夫茶具套装HD-鸟语花香紫砂套装 金福寿款,厨具>茶具/咖啡具>整套茶具>肖字和德XZHD紫砂功夫茶具套装HD-鸟...,京东商城,幸福家1007007001,厨具|茶具、咖啡具|整套茶具,肖字和德XZHD铁观音鉴赏茶具精品玉瓷茶具套装,厨具>茶具/咖啡具>整套茶具>肖字和德XZHD铁观音鉴赏茶具精品玉瓷茶...,京东商城,幸福家1007007001,厨具|茶具、咖啡具|整套茶具,南岭窑 陶瓷整套功夫茶具套装 电磁炉实木茶盘 青花 汝窑 迎福汝窑套装,厨具>茶具/咖啡具>整套茶具>恒越>南岭窑 陶瓷整套功夫茶具套装 电磁炉实木...,京东商城,南岭窑陶瓷旗舰店1007007001,厨具|茶具、咖啡具|整套茶具,唐丰茶具套装电磁炉自动功夫茶具整套 第一款,厨具>茶具/咖啡具>整套茶具>唐丰>唐丰茶具套装电磁炉自动功夫茶具整套 第一...,京东商城,臻茗尚品茶艺轩1007007001,厨具|茶具、咖啡具|整套茶具,茗汇家居生活馆 原产地君得名窑 宁静致远汝窑套组 汝窑茶具,厨具>茶具/咖啡具>整套茶具>君得>茗汇家居生活馆 原产地君得名窑 宁静致远...,京东商城,茗汇家居生活馆1007007001,厨具|茶具、咖啡具|整套茶具,雪狼 新品 雪花釉功夫茶具套装正品 整套陶瓷乔迁结婚礼品 特价免邮 XD,厨具>茶具/咖啡具>整套茶具>雪狼（snowwolf）>雪狼 新品 雪花釉功夫茶具套装正品 整套...,京东商城,苗苗红家居礼品1007007001,厨具|茶具、咖啡具|整套茶具,陶立方 陶瓷玻璃便携式旅行茶具车载茶具红茶茶具旅行套装泡茶器 A-037 青花,厨具>茶具/咖啡具>整套茶具>陶立方 >陶立方 陶瓷玻璃便携式旅行茶具车载茶具红...,京东商城,陶立方官方旗舰店1007007001,厨具|茶具、咖啡具|整套茶具,鼎艺精品功夫茶具 汝窑茶具套装 茶具礼品 创新浮雕工艺 高档茶具礼盒装 特大号,厨具>茶具/咖啡具>整套茶具>鼎艺>鼎艺精品功夫茶具 汝窑茶具套装 茶具礼品...,京东商城,鼎艺旗舰店1007007001,厨具|茶具、咖啡具|整套茶具,百鸿 紫砂茶具 汝窑茶具套装实木茶盘整套 Z-BJXY044 杯架祥云黄金龙套装,厨具>茶具/咖啡具>整套茶具>百鸿 紫砂茶具 汝窑茶具套装实木茶盘整套...,京东商城,百鸿旗舰店1007007001,厨具|茶具、咖啡具|整套茶具,祥福 整套开片汝窑粗陶茶具 陶瓷茶具配黑檀木实木茶盘TZ020 1号,厨具>茶具/咖啡具>整套茶具>祥福>祥福 整套开片汝窑粗陶茶具 陶瓷茶具配黑...,京东商城,祥福官方旗舰店1007007001,厨具|茶具、咖啡具|整套茶具,肖字和德XZHD陶瓷茶具功夫茶具套装HD-188陶瓷套装 水点桃花,厨具>茶具/咖啡具>整套茶具>肖字和德XZHD陶瓷茶具功夫茶具套装HD...,京东商城,幸福家1007007001,厨具|茶具、咖啡具|整套茶具,鑫德鸿窑 整套茶具 浮龙白瓷茶具套装 平板茶盘 TZ005,厨具>茶具/咖啡具>整套茶具>鑫德鸿窑 整套茶具 浮龙白瓷茶具套装 平...,京东商城,皇茗旗舰店1007007001,厨具|茶具、咖啡具|整套茶具,恒越 德化瓷器 象牙白瓷 功夫茶具 8头玉兰颂 有福茶具 ,厨具>茶具/咖啡具>整套茶具>恒越>恒越 德化瓷器 象牙白瓷 功夫茶具 8头...,京东商城,欣麦家居专营店1007007001,厨具|茶具、咖啡具|整套茶具,郑品 整套茶具5款可选 鸡翅木茶盘 电磁炉茶盘抽水 实木套装TZ-G76345A075 鸡翅木套装(荷塘清趣),厨具>茶具/咖啡具>整套茶具>郑品>郑品 整套茶具5款可选 鸡翅木茶盘 电磁...,京东商城,郑品茶具旗舰店1007007001,厨具|茶具、咖啡具|整套茶具,郑品 4合1电磁炉茶盘套装 整套哥窑茶具 TZ-A010HL009 哥窑一叶知秋,厨具>茶具/咖啡具>整套茶具>郑品>郑品 4合1电磁炉茶盘套装 整套哥窑茶具...,京东商城,郑品茶具旗舰店1007007001,厨具|茶具、咖啡具|整套茶具,三义成茶具圣诞元旦双庆汝窑11头礼盒功夫茶具套装 南瓜壶,厨具>茶具/咖啡具>整套茶具>三义成>三义成茶具圣诞元旦双庆汝窑11头礼盒功夫...,京东商城,三义成1007007001,厨具|茶具、咖啡具|整套茶具,欧凯隆 8头方款 托盘550ml 大容量陶瓷茶具咖啡具 礼盒套装 多款花色可选 1.花开富贵 5.戏曲脸谱,厨具>茶具/咖啡具>整套茶具>欧凯隆 8头方款 托盘550ml 大容量...,京东商城,欧凯隆旗舰店1007007001,厨具|茶具、咖啡具|整套茶具,尚帝整套茶具茶盘套装陶制茶具TZ-G76085A046 黑檀腾龙套装(中扁壶),尚帝整套茶具茶盘套装陶制茶具TZ-G76...,京东商城,尚帝旗舰店1007007001,厨具|茶具、咖啡具|整套茶具,言艺茶具 陶瓷功夫茶具套装 青花瓷 新玲珑瓷工艺 BWT84,厨具>茶具/咖啡具>整套茶具>言艺>言艺茶具 陶瓷功夫茶具套装 青花瓷 新玲...,京东商城,言艺家居旗舰店1007007001,厨具|茶具、咖啡具|整套茶具,唐丰高档功夫茶具茶盘电磁炉套装 第一款,厨具>茶具/咖啡具>整套茶具>信柏SURPAQ >唐丰高档功夫茶具茶盘电磁炉套装 第一款,京东商城,臻茗尚品茶艺轩1007007001,厨具|茶具、咖啡具|整套茶具,苏生陶瓷功夫茶具整套电磁炉实木茶盘宜兴紫砂茶具套装 黑色 套装九,厨具>茶具/咖啡具>整套茶具>苏生>苏生陶瓷功夫茶具整套电磁炉实木茶盘宜兴紫...,京东商城,苏生旗舰店1007007001,厨具|茶具、咖啡具|整套茶具,雪狼 新品 斗彩陶瓷创意个性整套茶具套装 喜上梅梢 礼盒特价 TH Y,厨具>茶具/咖啡具>整套茶具>雪狼（snowwolf）>雪狼 新品 斗彩陶瓷创意个性整套茶具套...,京东商城,苗苗红家居礼品1007007001,厨具|茶具、咖啡具|整套茶具,新品 琉璃家居茶具套装办公泡茶整套个人茶具陶瓷器茶具高档礼品 一堂和气,厨具>茶具/咖啡具>整套茶具>陶先生（Mrtao） >新品 琉璃家居茶具套装办公泡茶整套个人茶...,京东商城,陶家庄茶具专营店1007007001,厨具|茶具、咖啡具|整套茶具,唐丰高档茶具茶盘功夫茶具电磁炉套装整套 第二款,厨具>茶具/咖啡具>整套茶具>唐丰>唐丰高档茶具茶盘功夫茶具电磁炉套装整套 ...,京东商城,臻茗尚品茶艺轩1007007001,厨具|茶具、咖啡具|整套茶具,唐丰茶具套装 功夫实木茶具套装组合 第三款,厨具>茶具/咖啡具>整套茶具>信柏SURPAQ >唐丰茶具套装 功夫实木茶具套装组合 第三...,京东商城,臻茗尚品茶艺轩1007007001,厨具|茶具、咖啡具|整套茶具,唐丰高档茶具茶盘茶道功夫茶具电磁炉套装整套 第一款,厨具>茶具/咖啡具>整套茶具>信柏SURPAQ >唐丰高档茶具茶盘茶道功夫茶具电磁炉套装整...,京东商城,臻茗尚品茶艺轩