1007007008,厨具|茶具、咖啡具|茶宠摆件,言艺茶具 精品茶宠摆件 哥窑茶宠 纳福弥勒茶玩 BWCC12,家居日用 > 厨房用品 > 水具茶具酒具 > 茶具 > 商品详情,当当网,言艺1007007008,厨具|茶具、咖啡具|茶宠摆件,易臣 早生贵子 8X4X6cm 原矿段泥 全手工 紫砂茶宠 茶玩摆件 可喷水,厨具>茶具/咖啡具>茶宠摆件>易臣 早生贵子 8X4X6cm 原矿段泥...,京东商城,易臣1007007008,厨具|茶具、咖啡具|茶宠摆件,易臣 宜兴茶宠 原矿清水泥全手工茶玩摆件 筷子架冬瓜猪情侣款,厨具>茶具/咖啡具>茶宠摆件>易臣 宜兴茶宠 原矿清水泥全手工茶玩摆件...,京东商城,易臣1007007008,厨具|茶具、咖啡具|茶宠摆件,【紫砂之家】 全手工 宜兴紫砂 马到成功 14563,厨具>茶具/咖啡具>茶宠摆件>【紫砂之家】 全手工 宜兴紫砂 马到成功...,京东商城,紫砂之家官方旗舰店1007007008,厨具|茶具、咖啡具|茶宠摆件,茗臣尚品 宜兴紫砂茶宠 大西瓜 原矿紫砂泥,厨具>茶具/咖啡具>茶宠摆件>茗臣尚品>茗臣尚品 宜兴紫砂茶宠 大西瓜 原矿紫...,京东商城,茗臣尚品1007007008,厨具|茶具、咖啡具|茶宠摆件,祥福 茶具 紫砂茶宠 招财猫 茶玩摆件 茶道摆件 CD144 咖色,厨具>茶具/咖啡具>茶宠摆件>祥福>祥福 茶具 紫砂茶宠 招财猫 茶玩摆件 ...,京东商城,祥福官方旗舰店1007007008,厨具|茶具、咖啡具|茶宠摆件,祥福 茶具 紫砂茶宠 枕头猪 趴趴猪茶玩 招财进宝 CD0007,厨具>茶具/咖啡具>茶宠摆件>祥福 茶具 紫砂茶宠 枕头猪 趴趴猪茶玩...,京东商城,祥福官方旗舰店1007007008,厨具|茶具、咖啡具|茶宠摆件,言艺茶具 汝窑手把件 茶宠摆件 瑞兽龙龟BWCC38,厨具>餐具>茶具/咖啡具>言艺茶具 汝窑手把件 茶宠摆件 瑞兽龙龟...,京东商城,言艺家居旗舰店1007007008,厨具|茶具、咖啡具|茶宠摆件,易臣 紫砂茶宠宜兴原矿段泥全手工茶宠摆件 茶道配件吉祥如意,厨具>茶具/咖啡具>茶宠摆件>易臣>易臣 紫砂茶宠宜兴原矿段泥全手工茶宠摆件...,京东商城,易臣1007007008,厨具|茶具、咖啡具|茶宠摆件,言艺茶具 精品哥窑茶宠摆件 得福弥勒茶玩 BWCC08,厨具>茶具/咖啡具>茶宠摆件>言艺茶具 精品哥窑茶宠摆件 得福弥勒茶玩...,京东商城,言艺家居旗舰店1007007008,厨具|茶具、咖啡具|茶宠摆件,紫艺陶缘 宜兴紫砂茶宠 白菜百财 茶道摆件,厨具>茶具/咖啡具>茶宠摆件>紫艺陶缘 宜兴紫砂茶宠 白菜百财 茶道摆...,京东商城,紫艺陶缘专营店1007007008,厨具|茶具、咖啡具|茶宠摆件,常生源 变色金蟾三足 真人发声 含钱币 招财进宝 0389,厨具>茶具/咖啡具>茶宠摆件>常生源>常生源 变色金蟾三足 真人发声 含钱币 ...,京东商城,惠拍在线1007007008,厨具|茶具、咖啡具|茶宠摆件,家装节 品茶忆友 宜兴紫砂茶宠招财进宝小金蟾茶道用具 黄色,厨具>茶具/咖啡具>茶宠摆件>品茶忆友>家装节 品茶忆友 宜兴紫砂茶宠招财进宝小...,京东商城,品茶忆友旗舰店1007007008,厨具|茶具、咖啡具|茶宠摆件,大彬堂 宜兴紫砂茶具 茶玩摆件茶道周边 荷叶莲蓬与蛙1311,厨具>茶具/咖啡具>茶宠摆件>大彬堂 宜兴紫砂茶具 茶玩摆件茶道周边 ...,京东商城,大彬堂紫砂茶具旗舰店1007007008,厨具|茶具、咖啡具|茶宠摆件,紫砂哥窑 天青开片 茶宠摆件 三国人物 曹操,厨具、餐具 > 茶具组合 > 品道天元 ,国美电器网上商城,1007007008,厨具|茶具、咖啡具|茶宠摆件,言艺茶具 哥窑茶宠童趣 小沙弥系列茶玩摆件 茶道零配 BWCC83 小沙弥系列梦入禅境CC83,厨具>茶具/咖啡具>茶宠摆件>言艺茶具 哥窑茶宠童趣 小沙弥系列茶玩摆...,京东商城,言艺家居旗舰店1007007008,厨具|茶具、咖啡具|茶宠摆件,东茶西壶 树脂变色茶宠摆件12生肖兔生日礼物吉祥兔宝宝 玉兔 大号变色,厨具>餐具>茶具/咖啡具>东茶西壶 树脂变色茶宠摆件12生肖兔生日...,京东商城,东茶西壶旗舰店1007007008,厨具|茶具、咖啡具|茶宠摆件,尚帝 紫砂茶宠茶玩 撒尿娃娃 小和尚尿茶宠 小童子 LPHTSLWW,厨具>茶具/咖啡具>茶宠摆件>尚帝（shangdi）>尚帝 紫砂茶宠茶玩 撒尿娃娃 小和尚尿茶...,京东商城,尚帝旗舰店1007007008,厨具|茶具、咖啡具|茶宠摆件,尚帝 宜兴紫砂茶宠 摆件 茶趣 茶道零配件 变玉色麒麟 CC41091,厨具>茶具/咖啡具>茶宠摆件>尚帝（shangdi）>尚帝 宜兴紫砂茶宠 摆件 茶趣 茶道零配...,京东商城,尚帝旗舰店1007007008,厨具|茶具、咖啡具|茶宠摆件,荆琼紫砂 变色 金蟾 茶宠,厨具>茶具/咖啡具>茶宠摆件>荆琼紫砂>荆琼紫砂茶宠,京东商城,荆琼紫砂1007007008,厨具|茶具、咖啡具|茶宠摆件,紫砂茶宠摆件精品茶宠 紫砂小书生全手工超萌茶宠T0961 如图,厨具>茶具/咖啡具>茶宠摆件>紫砂茶宠摆件精品茶宠 紫砂小书生全手工超...,京东商城,夏至家居1007007008,厨具|茶具、咖啡具|茶宠摆件,陶瓷故事 宜兴精品紫砂茶宠茶玩 茶道摆件 招财貔貅紫泥清水泥 紫褐色貔貅,厨具>茶具/咖啡具>茶宠摆件>陶瓷故事 宜兴精品紫砂茶宠茶玩 茶道摆件...,京东商城,夏至家居1007007008,厨具|茶具、咖啡具|茶宠摆件,悠家良品 茶具汝窑茶宠 开片茶宠 十二生肖 茶宠摆件摆具 生肖虎,厨具>茶具/咖啡具>茶宠摆件>悠家良品 茶具汝窑茶宠 开片茶宠 十...,京东商城,悠家良品旗舰店1007007008,厨具|茶具、咖啡具|茶宠摆件,旗航 宜兴紫砂壶茶具 茶宠 招财如意羊 原矿紫砂泥,厨具>茶具/咖啡具>茶宠摆件>旗航>旗航 宜兴紫砂壶茶具 茶宠 招财如意羊 ...,京东商城,祥艺商贸1007007008,厨具|茶具、咖啡具|茶宠摆件,唐丰茶具 汝窑茶宠茶具TF-1050 第二款,厨具>茶具/咖啡具>茶宠摆件>信柏SURPAQ >唐丰茶具 汝窑茶宠茶具TF-1050 第...,京东商城,臻茗尚品茶艺轩1007007008,厨具|茶具、咖啡具|茶宠摆件,【紫砂之家】 全手工 宜兴紫砂茶宠 十二生肖 精品摆件 段泥 0cc 13037,厨具>茶具/咖啡具>茶宠摆件>【紫砂之家】 全手工 宜兴紫砂茶宠 十...,京东商城,紫砂之家官方旗舰店1007007008,厨具|茶具、咖啡具|茶宠摆件,旗航 宜兴紫砂壶茶具 茶宠 双色金蟾 原矿紫砂泥,厨具>茶具/咖啡具>茶宠摆件>旗航>旗航 宜兴紫砂壶茶具 茶宠 双色金蟾 原...,京东商城,祥艺商贸1007007008,厨具|茶具、咖啡具|茶宠摆件,旗航 宜兴紫砂壶茶具 茶宠 黄绿葫芦 原矿紫砂泥,厨具>茶具/咖啡具>茶宠摆件>旗航>旗航 宜兴紫砂壶茶具 茶宠 黄绿葫芦 原...,京东商城,祥艺商贸1007007008,厨具|茶具、咖啡具|茶宠摆件,东茶西壶 茶道配件紫砂茶宠七星招财蟾,厨具>茶具/咖啡具>茶宠摆件>东茶西壶 茶道配件紫砂茶宠七星招财蟾,京东商城,东茶西壶旗舰店1007007008,厨具|茶具、咖啡具|茶宠摆件,旗航 宜兴紫砂壶茶具 茶宠 紫泥拇指青蛙 喷水 原矿紫砂泥,厨具>茶具/咖啡具>茶宠摆件>旗航>旗航 宜兴紫砂壶茶具 茶宠 紫泥拇指青蛙...,京东商城,祥艺商贸1007007008,厨具|茶具、咖啡具|茶宠摆件,旗航 宜兴紫砂壶茶具 茶宠 树桩茶托 原矿紫砂泥,厨具>茶具/咖啡具>茶宠摆件>旗航>旗航 宜兴紫砂壶茶具 茶宠 树桩茶托 原...,京东商城,祥艺商贸1007007008,厨具|茶具、咖啡具|茶宠摆件,藏壶者宜兴紫砂手工茶宠（托宝佛摆件）,厨具>茶具/咖啡具>茶宠摆件>藏壶者 >藏壶者宜兴紫砂手工茶宠（托宝佛摆件）,京东商城,藏壶者旗舰店1007007008,厨具|茶具、咖啡具|茶宠摆件,汝窑茶宠 汝瓷蝉翼开片可养 茶玩 茶趣 茶盘摆件 茶具配件 生财有路 生财有路,厨具>茶具/咖啡具>茶宠摆件>汝窑茶宠 汝瓷蝉翼开片可养 茶玩 茶趣 ...,京东商城,汇茶官方旗舰店1007007008,厨具|茶具、咖啡具|茶宠摆件,优妮彩 龙头 龟身 兽 宜兴紫砂茶宠摆件 茶具配件必备 LZ-C028,厨具>餐具>茶具/咖啡具>优妮彩 龙头 龟身 兽 宜兴紫砂茶宠摆件...,京东商城,优妮彩1007007008,厨具|茶具、咖啡具|茶宠摆件,东茶西壶 紫砂茶宠紫砂茶宠 心相连情侣猪GA2815,厨具>茶具/咖啡具>茶宠摆件>东茶西壶 紫砂茶宠紫砂茶宠 心相连情侣猪...,京东商城,东茶西壶旗舰店1007007008,厨具|茶具、咖啡具|茶宠摆件,新寅陶艺 紫砂摆件 郭栋制 [布袋罗汉]包真,厨具>茶具/咖啡具>茶宠摆件>万新>新寅陶艺 紫砂摆件 郭栋制 [布袋罗汉]...,京东商城,新寅陶艺1007007008,厨具|茶具、咖啡具|茶宠摆件,家装节 艺福堂茶具 一叶观音手工段泥紫砂茶宠 Z41115 茶具/咖啡具,厨具>茶具/咖啡具>茶宠摆件>艺福堂>家装节 艺福堂茶具 一叶观音手工段泥紫砂...,京东商城,艺福堂茶具专营店1007007008,厨具|茶具、咖啡具|茶宠摆件,旗航 宜兴紫砂壶茶具 茶宠 旺财 原矿紫砂泥,厨具>茶具/咖啡具>茶宠摆件>旗航>旗航 宜兴紫砂壶茶具 茶宠 旺财 原矿...,京东商城,祥艺商贸1007007008,厨具|茶具、咖啡具|茶宠摆件,藏壶者宜兴紫砂手工茶宠摆件（高瞻远瞩一）,厨具>餐具>茶具/咖啡具>藏壶者宜兴紫砂手工茶宠摆件（高瞻远瞩一）,京东商城,藏壶者旗舰店1007007008,厨具|茶具、咖啡具|茶宠摆件,东茶西壶 变色茶宠摆件树脂变色茶宠磁吸小情侣(变绿玉色)GA2156 变绿玉色,厨具>茶具/咖啡具>茶宠摆件>东茶西壶 变色茶宠摆件树脂变色茶宠磁吸小...,京东商城,东茶西壶旗舰店1007007008,厨具|茶具、咖啡具|茶宠摆件,东茶西壶 茶具摆件树脂变色茶宠年年有鱼(变绿玉)GA1989 变绿玉色,厨具>茶具/咖啡具>茶宠摆件>东茶西壶 茶具摆件树脂变色茶宠年年有鱼(...,京东商城,东茶西壶旗舰店1007007008,厨具|茶具、咖啡具|茶宠摆件,东茶西壶 茶具摆件 树脂变色茶宠大坐佛(变绿玉色)GA1144,厨具>茶具/咖啡具>茶宠摆件>东茶西壶 茶具摆件 树脂变色茶宠大坐佛(...,京东商城,东茶西壶旗舰店1007007008,厨具|茶具、咖啡具|茶宠摆件,祥福茶具 自在小和尚茶宠 茶道茶宠物茶玩摆件 哥窑青瓷茶韵CD181 青瓷,厨具>茶具/咖啡具>茶宠摆件>祥福茶具 自在小和尚茶宠 茶道茶宠物茶玩...,京东商城,祥福官方旗舰店1007007008,厨具|茶具、咖啡具|茶宠摆件,东茶西壶 吉祥物摆件树脂仿鸡血石合成玉 吉祥麒麟 脚踩绣球GA2747 仿红玉麒麟踩绣球,厨具>茶具/咖啡具>茶宠摆件>东茶西壶 吉祥物摆件树脂仿鸡血石合成玉 ...,京东商城,东茶西壶旗舰店1007007008,厨具|茶具、咖啡具|茶宠摆件,优妮彩 景德镇手绘粉彩小号陶瓷器盖碗 梅妻鹤子 品茗必备 LB-D037,厨具>茶具/咖啡具>茶宠摆件>优妮彩>优妮彩 景德镇手绘粉彩小号陶瓷器盖碗 梅...,京东商城,优妮彩1007007008,厨具|茶具、咖啡具|茶宠摆件,优妮彩 怪兽鱼 宜兴紫砂茶宠摆件 茶具配件必备 LZ-C001,厨具>茶具/咖啡具>茶宠摆件>优妮彩 怪兽鱼 宜兴紫砂茶宠摆件 茶具...,京东商城,优妮彩1007007008,厨具|茶具、咖啡具|茶宠摆件,向品 张爱成 纯手工雕塑 舞狮人 三足宝 高档 金蟾 紫砂茶宠摆件咖啡色,小家电 > 厨房电器 > 电水壶\\瓶 > 电水壶,亚马逊(卓越网),向品1007007008,厨具|茶具、咖啡具|茶宠摆件,万新 宜兴 紫砂摆件 李爱民制 招财镇宅 24k描纯金 转眼发财金蟾 保真,厨具>茶具/咖啡具>茶宠摆件>万新>万新 宜兴 紫砂摆件 李爱民制 招财镇宅...,京东商城,新寅陶艺1007007008,厨具|茶具、咖啡具|茶宠摆件,百鸿 可爱发财猪 神态憨厚 茶具茶宠摆件 功夫茶具茶玩 茶道零配 CCFCZ08 红色,厨具>茶具/咖啡具>茶具配件>百鸿 可爱发财猪 神态憨厚 茶具茶宠摆件...,京东商城,百鸿旗舰店1007007008,厨具|茶具、咖啡具|茶宠摆件,一品景轩 正宗宜兴紫砂茶宠摆件 小葫芦 黄色,厨具 > 茶具 > 茶具配件 > 茶宠,亚马逊(卓越网),一品景轩1007007008,厨具|茶具、咖啡具|茶宠摆件,藏壶者宜兴手工紫砂茶宠 （精品墨绿泥龟龙摆件二） 原矿墨绿泥 紫砂茶宠摆件,藏壶者 >藏壶者宜兴手工紫砂茶宠 （精品墨绿泥龟龙...,京东商城,藏壶者旗舰店1007007008,厨具|茶具、咖啡具|茶宠摆件,怡品尚瓷茶具 茶宠功夫茶具摆件茶具零配 汝窑开片 小鹿 汝窑,厨具>茶具/咖啡具>茶宠摆件>怡品尚瓷>怡品尚瓷茶具 茶宠功夫茶具摆件茶具零配 ...,京东商城,怡品尚瓷1007007008,厨具|茶具、咖啡具|茶宠摆件,茗汇家居生活馆 原产地君得名窑 龙生九子老三狴犴汝窑茶宠,厨具>茶具/咖啡具>茶宠摆件>君得>茗汇家居生活馆 原产地君得名窑 龙生九子...,京东商城,茗汇家居生活馆1007007008,厨具|茶具、咖啡具|茶宠摆件,哥窑茶宠 精品茶玩 茶趣 摆件紫砂陶瓷功夫茶具 茶道配件 汽车摆件 年年有余 1,厨具>茶具/咖啡具>茶宠摆件>哥窑茶宠 精品茶玩 茶趣 摆件紫砂陶瓷功...,京东商城,汇茶官方旗舰店1007007008,厨具|茶具、咖啡具|茶宠摆件,旗航 宜兴紫砂壶茶具 茶宠 二友品茶 原矿紫砂泥,厨具>茶具/咖啡具>茶宠摆件>旗航>旗航 宜兴紫砂壶茶具 茶宠 二友品茶 ...,京东商城,祥艺商贸1007007008,厨具|茶具、咖啡具|茶宠摆件,大彬堂 宜兴紫砂茶玩摆件 刘新华 纯手工紫泥粗陶随意笔筒1537,厨具>茶具/咖啡具>茶宠摆件>大彬堂 宜兴紫砂茶玩摆件 刘新华 纯手工...,京东商城,大彬堂紫砂茶具旗舰店1007007008,厨具|茶具、咖啡具|茶宠摆件,陶瓷故事 宜兴紫砂精品茶宠 招财猫摆件 米黄色,厨具>茶具/咖啡具>茶宠摆件>陶瓷故事>陶瓷故事 宜兴紫砂精品茶宠 招财猫摆件 ...,京东商城,圣唐家居馆1007007008,厨具|茶具、咖啡具|茶宠摆件,三义成定窑新年茶礼曲阳定瓷定窑摆件工艺品布袋笑佛大号,厨具>茶具/咖啡具>茶宠摆件>三义成>三义成定窑新年茶礼曲阳定瓷定窑摆件工艺品...,京东商城,三义成1007007008,厨具|茶具、咖啡具|茶宠摆件,品茶忆友 愤怒的小鸟 茶宠 宜兴紫砂茶玩精品茶宠摆件茶道配件 蓝色,品茶忆友 愤怒的小鸟 茶宠 宜兴紫砂茶玩...,京东商城,品茶忆友旗舰店1007007008,厨具|茶具、咖啡具|茶宠摆件,历史人物龙泉青瓷哥窑茶宠精品摆件茶盘摆件茶玩 李白,厨具>茶具/咖啡具>茶宠摆件>陶先生（Mrtao） >历史人物龙泉青瓷哥窑茶宠精品摆件茶盘摆件...,京东商城,陶家庄茶具专营店1007007008,厨具|茶具、咖啡具|茶宠摆件,三义成茶宠新年茶礼可爱十二生肖系列 猴,厨具>茶具/咖啡具>茶宠摆件>三义成>三义成茶宠新年茶礼可爱十二生肖系列 猴,京东商城,三义成1007007008,厨具|茶具、咖啡具|茶宠摆件,藏壶者宜兴紫砂手工茶宠摆件（笑口常开）,藏壶者宜兴紫砂手工茶宠摆件（笑口常开）,京东商城,藏壶者旗舰店1007007008,厨具|茶具、咖啡具|茶宠摆件,恒福 特色陶土手绘青花瓷礼品套装茶杯杯子 陶瓷茶壶套装 陶瓷茶海茶具套装办公 瓷整套茶具,厨具>茶具/咖啡具>茶宠摆件>陶先生（Mrtao） >恒福 特色陶土手绘青花瓷礼品套装茶杯杯子...,京东商城,陶家庄茶具专营店1007007008,厨具|茶具、咖啡具|茶宠摆件,三义成定窑新年茶礼曲阳定瓷定窑摆件工艺品王涌泉纯手工作品 剔花梅瓶,厨具>茶具/咖啡具>茶宠摆件>三义成>三义成定窑新年茶礼曲阳定瓷定窑摆件工艺品...,京东商城,三义成1007007008,厨具|茶具、咖啡具|茶宠摆件,郑品 功夫茶具配件 陶瓷家居摆件 白瓷弥勒佛 CCT2ML1,厨具>茶具/咖啡具>茶宠摆件>郑品 功夫茶具配件 陶瓷家居摆件 白瓷弥...,京东商城,郑品茶具旗舰店1007007008,厨具|茶具、咖啡具|茶宠摆件,祥福 茶具 紫砂精品 变色茶宠 茶玩 茶道配件 茶具摆件 CD0008 小号,厨具>茶具/咖啡具>茶宠摆件>祥福>祥福 茶具 紫砂精品 变色茶宠 茶玩 茶...,京东商城,祥福官方旗舰店1007007008,厨具|茶具、咖啡具|茶宠摆件,90-茶宠摆件 泡茶玩偶 正品变玉色茶宠《变玉中佛》,厨具>餐具>茶具/咖啡具>90-茶宠摆件 泡茶玩偶 正品变玉色茶宠...,京东商城,臻茗尚品茶艺轩1007007008,厨具|茶具、咖啡具|茶宠摆件,唐丰茶具 招财金蟾 茶宠摆件 茶宠茶具 金蟾《变玉金蟾》TF-176,家居日用 > 厨房用品 > 水具茶具酒具 > 茶具,当当网,唐丰1007007008,厨具|茶具、咖啡具|茶宠摆件,陶瓷故事 宜兴精品紫砂茶宠摆件 知足常乐茶玩工艺品 茶道用品 知足摆件 左右脚可选右脚,家居日用 > 厨房用品 > 水具茶具酒具 > 茶具 > 商品详情,当当网,AITA1007007008,厨具|茶具、咖啡具|茶宠摆件,汉白汝窑 茶宠摆件 乡仕正品 三国人物 关羽,家居日用>茶具>品道天元>汉白汝窑 茶宠摆件 乡仕正品 三国人物 关羽,国美电器网上商城,品道天元旗舰店1007007008,厨具|茶具、咖啡具|茶宠摆件,陶瓷故事 紫砂精品茶宠摆件 紫砂送财虎全手工超萌茶宠 茶道配件,家居日用 > 厨房用品 > 水具茶具酒具 > 茶具 > 商品详情,当当网,陶瓷故事1007007008,厨具|茶具、咖啡具|茶宠摆件,陶瓷故事 宜兴紫砂精品茶宠摆件 济公佛 全手工茶宠,家居日用 > 厨房用品 > 水具茶具酒具 > 茶具 > 商品详情,当当网,陶瓷故事1007007008,厨具|茶具、咖啡具|茶宠摆件,唐丰茶具 宜兴紫砂茶玩茶宠 紫砂茶宠 一团和气 茶宠 TF-1028,厨具>茶具/咖啡具>茶宠摆件>唐丰>唐丰茶具 宜兴紫砂茶玩茶宠 紫砂茶宠 一...,京东商城,唐丰官方旗舰店1007007008,厨具|茶具、咖啡具|茶宠摆件,郑品 宋代哥窑茶宠 精品可养汝窑开片茶玩 紫砂功夫茶具茶道 CCGRY61 哥窑寿桃佛,厨具>茶具/咖啡具>茶宠摆件>郑品>郑品 宋代哥窑茶宠 精品可养汝窑开片茶玩...,京东商城,郑品茶具旗舰店1007007008,厨具|茶具、咖啡具|茶宠摆件,唐丰开片汝瓷茶宠 十二生肖可养开片茶道汝窑茶宠 收藏品TF-1436 羊,厨具>茶具/咖啡具>茶宠摆件>唐丰开片汝瓷茶宠 十二生肖可养开片茶道汝...,京东商城,唐丰官方旗舰店1007007008,厨具|茶具、咖啡具|茶宠摆件,郑品 可爱发财猪 神态憨厚 茶具茶宠摆件 茶道零配 CCFCZ08,所有分类>家居家纺、锅具餐具>餐具水具>茶具1>茶宠摆件>郑品>郑品 可爱发财猪 神...,1号店,郑品1007007008,厨具|茶具、咖啡具|茶宠摆件,关耳窑 冰裂釉茶宠 三个和尚提水 功夫茶具配件 茶玩摆件 CCSGHS02,所有分类>家居家纺、锅具餐具>餐具水具>茶具1>茶宠摆件>关耳窑>关耳窑 冰裂釉茶宠 ...,1号店,关耳窑1007007008,厨具|茶具、咖啡具|茶宠摆件,尚帝 可爱发财猪 神态憨厚 茶具茶宠摆件 CCFCZ08,所有分类>家居家纺、锅具餐具>餐具水具>茶具1>茶宠摆件>尚帝>尚帝 可爱发财猪 神...,1号店,尚帝1007007008,厨具|茶具、咖啡具|茶宠摆件,瑞恒逸品 紫砂摆件向上发 象上发财 兴官运 财运 旺事业,所有分类>家居家纺、锅具餐具>餐具水具>茶具1>茶宠摆件>瑞恒逸品>瑞恒逸品 紫砂摆件向...,1号店,瑞恒逸品1007007008,厨具|茶具、咖啡具|茶宠摆件,茗臣尚品 宜兴紫砂茶宠 招财进宝 紫砂泥,所有分类>家居家纺、锅具餐具>餐具水具>茶具1>茶宠摆件>茗臣尚品>茗臣尚品 宜兴紫砂茶...,1号店,茗臣尚品1007007008,厨具|茶具、咖啡具|茶宠摆件,瑞恒逸品 紫砂茶宠彩珠招财金蟾 旺财瑞兽,所有分类>家居家纺、锅具餐具>餐具水具>茶具1>茶宠摆件>瑞恒逸品>瑞恒逸品 紫砂茶宠彩...,1号店,瑞恒逸品1007007008,厨具|茶具、咖啡具|茶宠摆件,瑞恒逸品 茶宠汝窑灵蛇吉祥 多面灵蛇兆喻五福,所有分类>家居家纺、锅具餐具>餐具水具>茶具1>茶宠摆件>瑞恒逸品>瑞恒逸品 茶宠汝窑灵...,1号店,瑞恒逸品1007007008,厨具|茶具、咖啡具|茶宠摆件,瑞恒逸品 紫砂茶宠转眼发财金蟾 旺财瑞兽,所有分类>家居家纺、锅具餐具>餐具水具>茶具1>茶宠摆件>瑞恒逸品>瑞恒逸品 紫砂茶宠转...,1号店,瑞恒逸品1007007008,厨具|茶具、咖啡具|茶宠摆件,万新 宜兴紫砂摆件 高级工艺美术师殷小平制 福禄鸳鸯,所有分类>家居家纺、锅具餐具>餐具水具>茶具1>茶宠摆件>万新>万新 宜兴紫砂摆件 ...,1号店,万新1007007008,厨具|茶具、咖啡具|茶宠摆件,美斯尼 日本 满天星迷你小铁壶 茶玩茶具配件 精品小茶宠摆件,家居日用 > 厨房用品 > 水具茶具酒具 > 茶具,当当网,美斯尼1007007008,厨具|茶具、咖啡具|茶宠摆件,万新 宜兴紫砂壶 紫砂茶宠 摆件 民间高手郭栋制 新品陆羽品茶,所有分类>家居家纺、锅具餐具>餐具水具>茶具1>茶宠摆件>万新>万新 宜兴紫砂壶 紫...,1号店,万新1007007008,厨具|茶具、咖啡具|茶宠摆件,关耳窑 宋代哥窑茶宠 精品可养汝窑开片茶玩 功夫茶具茶道家具摆件CCGRY61,所有分类>家居家纺、锅具餐具>餐具水具>茶具1>茶宠摆件>关耳窑>关耳窑 宋代哥窑茶宠...,1号店,关耳窑1007007008,厨具|茶具、咖啡具|茶宠摆件,万新 紫砂摆件 郭栋制 [扛布袋罗汉]包真,所有分类>家居家纺、锅具餐具>餐具水具>茶具1>茶宠摆件>万新>万新 紫砂摆件 郭栋...,1号店,万新1007007008,厨具|茶具、咖啡具|茶宠摆件,万新 宜兴紫砂壶 紫砂摆件 茶宠 高手郭栋制 财神,所有分类>家居家纺、锅具餐具>餐具水具>茶具1>茶宠摆件>万新>万新 宜兴紫砂壶 紫...,1号店,万新1007007008,厨具|茶具、咖啡具|茶宠摆件,大彬堂 宜兴紫砂茶玩摆件 刘新华 纯手工粗陶小花瓶之曲径1532,所有分类>家居家纺、锅具餐具>餐具水具>茶具1>茶宠摆件>大彬堂>大彬堂 宜兴紫砂茶玩...,1号店,大彬堂1007007008,厨具|茶具、咖啡具|茶宠摆件,君肴 乡仕茶宠 哥窑蝉翼开片可养 茶道茶玩配件摆件 历史人物,所有分类>家居家纺、锅具餐具>餐具水具>茶具1>茶宠摆件>君肴>君肴 乡仕茶宠 哥窑...,1号店,君肴1007007008,厨具|茶具、咖啡具|茶宠摆件,万新 紫砂茶宠 李爱民制 招财镇宅 碧荷听蟾 青段泥,所有分类>家居家纺、锅具餐具>餐具水具>茶具1>茶宠摆件>万新>万新 紫砂茶宠 李爱...,1号店,万新1007007008,厨具|茶具、咖啡具|茶宠摆件,陶瓷故事 宜兴精品紫砂茶宠摆件 知足常乐茶玩工艺品 茶道用品 知足摆件 左右脚可选,所有分类>家居家纺、锅具餐具>餐具水具>茶具1>茶宠摆件>陶瓷故事>陶瓷故事 宜兴精品紫...,1号店,陶瓷故事1007007008,厨具|茶具、咖啡具|茶宠摆件,哲明 乾窑冰裂 弥勒佛 茶宠茶玩 紫砂茶宠摆件哥窑 茶盘配件,所有分类>家居家纺、锅具餐具>餐具水具>茶具1>茶宠摆件>哲明>哲明 乾窑冰裂 弥勒...,1号店,哲明1007007008,厨具|茶具、咖啡具|茶宠摆件,万新 宜兴紫砂壶 紫砂摆件 《小荷花香插》 一对,所有分类>家居家纺、锅具餐具>餐具水具>茶具1>茶宠摆件>万新>万新 宜兴紫砂壶 紫...,1号店,万新1007007008,厨具|茶具、咖啡具|茶宠摆件,万新 紫砂摆件 李爱民制 招财镇宅 24k描纯金 转眼发财金蟾,所有分类>家居家纺、锅具餐具>餐具水具>茶具1>茶宠摆件>万新>万新 紫砂摆件 李爱...,1号店,万新1007007008,厨具|茶具、咖啡具|茶宠摆件,陶瓷故事 精品紫砂茶宠摆件 招财大金蟾 手工茶宠 两色可选红色,所有分类>家居家纺、锅具餐具>装饰/日用>摆挂件>陶瓷故事>陶瓷故事 精品紫砂茶...,1号店,陶瓷故事1007007008,厨具|茶具、咖啡具|茶宠摆件,唐丰 茶具功夫茶具套装茶宠摆件 变玉色中佛茶宠,厨具 > 茶具 > 茶具套装,亚马逊(卓越网),唐丰1007007008,厨具|茶具、咖啡具|茶宠摆件,万新 宜兴紫砂壶 紫砂杂玩 李爱民制 招财镇宅 新款荷叶蟾 紫泥,所有分类>家居家纺、锅具餐具>餐具水具>茶具1>茶宠摆件>万新>万新 宜兴紫砂壶 紫...,1号店,万新1007007008,厨具|茶具、咖啡具|茶宠摆件,唐丰茶具 茶宠茶道茶艺饰品彩陶摆件三顾茅庐诸 第一款,厨具>茶具/咖啡具>茶宠摆件>信柏SURPAQ >唐丰茶具 茶宠茶道茶艺饰品彩陶摆件三顾茅...,京东商城,臻茗尚品茶艺轩1007007008,厨具|茶具、咖啡具|茶宠摆件,宜兴紫砂壶 紫砂摆件 李爱民制 招财镇宅 24k描纯金 龙蟾 保真 清水泥,厨具>茶具/咖啡具>茶宠摆件>万新>宜兴紫砂壶 紫砂摆件 李爱民制 招财镇宅...,京东商城,新寅陶艺1007007008,厨具|茶具、咖啡具|茶宠摆件,宜兴紫砂壶 紫砂摆件 高手郭栋制 [点石成金] 保真 窑变,厨具>茶具/咖啡具>茶宠摆件>宜兴紫砂壶 紫砂摆件 高手郭栋制 [点石...,京东商城,新寅陶艺