1007004004,厨具|收纳保鲜|一次性饭盒,特百洁双格餐盒一次性双格餐盒 分格饭盒 塑料透明打包盒 一次性饭盒（650毫升*50套）,首页>家居/家装建材/厨具>餐厨用具>保鲜盒/便当盒>特百洁双格餐盒一次性双格餐盒分格饭...,苏宁,特百洁1007004004,厨具|收纳保鲜|一次性饭盒,禧宏一次性打包盒 寿司盒 带盖透明饭盒 塑料糕点盒 果蔬菜盒（中一深*3000个）,首页>家居/家装建材/厨具>餐厨用具>保鲜盒/便当盒>禧宏一次性打包盒寿司盒带盖透明饭...,苏宁,禧宏1007004004,厨具|收纳保鲜|一次性饭盒,禧宏960毫升含盖一次性纸碗 汤碗 打包碗 环保碗 一次性饭盒 方便面碗 快餐盒1000个,家居日用 > 厨房用品 > 一次性餐具 > 商品详情,当当网,禧宏1007004004,厨具|收纳保鲜|一次性饭盒,正品 可爱创意学生儿童户外饭盒 打包便当盒餐盒 PP塑料安全无毒 900ml 绿色,厨具>厨房配件>饭盒/提锅>其它>正品 可爱创意学生儿童户外饭盒 打包便当...,京东商城,淘金百货1007004004,厨具|收纳保鲜|一次性饭盒,金五缘一次性四格打包盒 一次性环保餐盒 一次性外卖盒 饭盒 四格连体盒（100套）,其他/商品/其他,亚马逊(卓越网),金五缘1007004004,厨具|收纳保鲜|一次性饭盒,Hello Kitty桃红女童圆型单层饭盒ZR2100043H，F,首页>家居>厨房用品>餐具,银泰网,HELLO KITTY1007004004,厨具|收纳保鲜|一次性饭盒,振兴 A保温餐盒BP568 800ML上班便携饭盒 便当盒子 JJA63-34,所有分类>家居家纺、锅具餐具>餐具水具>保温饭盒>振兴>振兴 A保温餐盒BP...,1号店,振兴1007004004,厨具|收纳保鲜|一次性饭盒,金五缘 750ML高档一次性环保餐盒 透明塑料 一次性饭盒打包盒快餐盒300套,所有分类>厨卫清洁、纸、清洁剂>一次性用品>一次性餐具>一次性餐盒>金五缘>金五缘 750ML高...,1号店,金五缘1007004004,厨具|收纳保鲜|一次性饭盒,禧宏 650ml一次性餐盒 分格饭盒 塑料透明打包盒 2格一次性饭盒 300套/箱,所有分类>厨卫清洁、纸、清洁剂>一次性用品>一次性餐具>一次性餐盒>禧宏>禧宏 650ml一次...,1号店,禧宏1007004004,厨具|收纳保鲜|一次性饭盒,商吉 51cup 800ml圆形优质塑料一次性饭盒打包快餐盒外卖盒50套,所有分类>厨卫清洁、纸、清洁剂>一次性用品>一次性餐具>一次性餐盒>商吉 51cup>商吉 51cup 8...,1号店,商吉 51cup1007004004,厨具|收纳保鲜|一次性饭盒,禧宏 1200ml饭盒 塑料餐盒 打包盒 一次性饭盒 长方形餐盒,所有分类>厨卫清洁、纸、清洁剂>一次性用品>一次性餐具>一次性餐盒>禧宏>禧宏 1200ml饭...,1号店,禧宏1007004004,厨具|收纳保鲜|一次性饭盒,禧宏 配盖850毫升一次性餐盒 饭盒汤碗 饭碗 塑料碗 600个/箱,所有分类>厨卫清洁、纸、清洁剂>一次性用品>一次性餐具>一次性餐盒>禧宏>禧宏 配盖850毫升...,1号店,禧宏1007004004,厨具|收纳保鲜|一次性饭盒,小绿芽Green Sprouts 婴幼儿童便携旅行餐盒/饭盒 餐具 红色小猴子,母婴>喂养用品>餐具>Green Sprouts>小绿芽Green Sprouts 婴幼...,京东商城,加州樱桃美国生活馆1007004004,厨具|收纳保鲜|一次性饭盒,禧宏加厚680毫升含盖一次性纸碗 打包碗 汤碗 一次性饭盒 餐盒 汤盒 面碗1000个,厨具>餐具>一次性用品>禧宏（xihong）>禧宏加厚680毫升含盖一次性纸碗 打包碗...,京东商城,千牛家居1007004004,厨具|收纳保鲜|一次性饭盒,禧宏700毫升带盖一次性纸碗 环保碗 打包碗 饭碗 汤碗 便当碗 餐碗 饭盒餐盒1000套,首页>家居/家装建材/厨具>餐厨用具>餐具>禧宏700毫升带盖一次性纸碗环保碗...,苏宁,禧宏1007004004,厨具|收纳保鲜|一次性饭盒,禧宏一次性透明餐盒 便当盒 四格餐盒 4格餐盒透明饭盒（四格透明餐盒*1000套）,首页>家居/家装建材/厨具>餐厨用具>保鲜盒/便当盒>禧宏一次性透明餐盒便当盒四格餐盒...,苏宁,禧宏1007004004,厨具|收纳保鲜|一次性饭盒,禧宏超值一次性快餐盒一次性连体三格餐盒打包外卖盒一次性饭盒（A302*100个）,首页>家居/家装建材/厨具>餐厨用具>保鲜盒/便当盒>禧宏超值一次性快餐盒一次性连体三格餐...,苏宁,禧宏1007004004,厨具|收纳保鲜|一次性饭盒,乐扣乐扣保鲜盒塑料餐盒1.6L乐扣保鲜盒大容量饭盒收纳盒HPL824 白色,首页>乐扣乐扣(LOOK&LOOK)家居旗舰店>乐扣乐扣保鲜盒塑料餐盒1.6L乐扣保...,苏宁,乐扣乐扣1007004004,厨具|收纳保鲜|一次性饭盒,禧宏加厚680毫升含盖一次性纸碗 打包碗 汤碗 一次性饭盒 餐盒 汤盒 面碗1000个,家居日用 > 厨房用品 > 一次性餐具 > 商品详情,当当网,禧宏1007004004,厨具|收纳保鲜|一次性饭盒,禧宏含盖一次性五格黑色快餐盒一次性饭盒外送 外卖盒 打包盒 便当盒（黑色五格*600套）,家居日用 > 厨房用品 > 一次性餐具 > 商品详情,当当网,禧宏1007004004,厨具|收纳保鲜|一次性饭盒,禧宏一次性餐盒 打包盒 带盖塑料透明饭盒 寿司盒 包装盒（大一深*2000只）,家居日用 > 厨房用品 > 一次性餐具 > 商品详情,当当网,禧宏1007004004,厨具|收纳保鲜|一次性饭盒,禧宏一次性打包盒 寿司盒 带盖透明饭盒 塑料糕点盒 果蔬菜盒（中一深*3000个）,家居日用 > 厨房用品 > 一次性餐具 > 商品详情,当当网,禧宏1007004004,厨具|收纳保鲜|一次性饭盒,康苗饭盒王F05S五格一次性饭盒打包盒外卖饭盒1050ml（300套）,厨具 > 餐具 > 一次性餐具,亚马逊(卓越网),康苗饭盒王1007004004,厨具|收纳保鲜|一次性饭盒,禧宏一次性餐盒 便当盒 高档打包盒 快餐盒 连体单格盒子 饭盒（A106单格*100套）,家居日用 > 厨房用品 > 一次性餐具 > 商品详情,当当网,禧宏