1007003005,厨具|刀、剪、菜板|刀具配件,先后 陶瓷刀具 白色刃削皮器 绿色,厨具>刀剪菜板>刀具配件>先后 陶瓷刀具 白色刃削皮器 绿色,京东商城,先后创意家居1007003005,厨具|刀、剪、菜板|刀具配件,京瓷Kyocera KB-20W 礼盒水笔适用C-300笔芯 黄棕色,厨具>刀剪菜板>刀具配件>京瓷>京瓷Kyocera KB-20W 礼盒...,京东商城,欣麦专营店1007003005,厨具|刀、剪、菜板|刀具配件,WMF福腾宝SPITZENKLASSE系列磨刀棒1895946030,厨具>刀剪菜板>刀具配件>福腾宝（WMF）>福腾宝磨刀棒1895946030,京东商城,福腾宝（WMF）1007003005,厨具|刀、剪、菜板|刀具配件,美帝亚精品刀架亚克力四槽刀座DY400,厨具>刀剪菜板>刀具配件>美帝亚（MIDDIA）>美帝亚刀具配件,京东商城,美帝亚（MIDDIA）1007003005,厨具|刀、剪、菜板|刀具配件,王麻子 十件高级美容修脚组合套装,家居日用>刀具配件>王麻子>王麻子 十件高级美容修脚组合套装,国美电器网上商城,王麻子旗舰店1007003005,厨具|刀、剪、菜板|刀具配件,巧媳妇磨刀石 棕刚玉防滑磨刀石-am-02,厨具>刀剪砧板>刀具配件>巧媳妇>巧媳妇磨刀石 棕刚玉防滑磨刀石-am-0...,京东商城,潮南今灿家居日用专营店1007003005,厨具|刀、剪、菜板|刀具配件,巧刃CuCut大水牛塑料刀座 优雅灰 315*150*235,厨具>刀剪菜板>刀具配件>巧刃（CuCut) >巧刃CuCut大水牛塑料刀座 优雅灰 3...,京东商城,66家居1007003005,厨具|刀、剪、菜板|刀具配件,多样屋TAYOHYA4孔竹刀座TA110303001ZZ（商品重复上架）,厨具>刀剪菜板>刀具配件>多样屋TAYOHYA4孔竹刀座TA110...,京东商城,易居尚官方旗舰店1007003005,厨具|刀、剪、菜板|刀具配件,十八子作 不锈钢护指器 Z-01 多功能切菜护手器手指保护器,厨具>刀剪菜板>刀具配件>十八子作>十八子作 不锈钢护指器 Z-01 多功能...,京东商城,十八子作官方旗舰店1007003005,厨具|刀、剪、菜板|刀具配件,七鲤CHINICERA 特级陶瓷刀/锆瓷刀 精刃黑削皮器,家居日用>刀具配件>七鲤>七鲤CHINICERA 特级陶瓷刀/锆瓷刀 精刃黑削皮器,国美电器网上商城,七鲤官方旗舰店1007003005,厨具|刀、剪、菜板|刀具配件,王麻子 6件高级美容套装,家居日用>刀具配件>王麻子>王麻子 6件高级美容套装,国美电器网上商城,王麻子旗舰店1007003005,厨具|刀、剪、菜板|刀具配件,王麻子 3件黑塘刀修脚刀,家居日用>刀具配件>王麻子>王麻子 3件黑塘刀修脚刀,国美电器网上商城,王麻子旗舰店1007003005,厨具|刀、剪、菜板|刀具配件,HORWOOD皇家伍磨刀金刚砂A000904,家居日用>刀具配件>皇家伍德>HORWOOD皇家伍磨刀金刚砂A000904,国美电器网上商城,皇家伍德1007003005,厨具|刀、剪、菜板|刀具配件,梅轩 强磁力刀架 厨具挂架 磁铁磁吸引60CM送 6钢钩,家居日用>刀具配件>梅轩>梅轩 强磁力刀架 厨具挂架 磁铁磁吸引60CM送 6钢钩,国美电器网上商城,梅轩旗舰店1007003005,厨具|刀、剪、菜板|刀具配件,日本进口磨刀石 磨刀器 D-5735,厨具>刀剪菜板>刀具配件>日本进口磨刀石 磨刀器 D-5735,京东商城,爱丽思1007003005,厨具|刀、剪、菜板|刀具配件,日本原装进口削皮器 水果削皮刀 不锈钢去皮器,厨具>刀剪菜板>刀具配件>其它>日本原装进口削皮器 水果削皮刀 不锈钢去...,京东商城,优乐购生活馆1007003005,厨具|刀、剪、菜板|刀具配件,A牌 蔬果削皮器削皮刀A-112,厨具>刀剪菜板>刀具配件>A牌>A牌 蔬果削皮器削皮刀A-112,京东商城,1007003005,厨具|刀、剪、菜板|刀具配件,Escrison精品菜刀刀架 套装陶瓷刀刀架 菜刀 水果刀 亚克力非不锈钢刀座 46菜削刀架,厨具>刀剪菜板>刀具配件>艾森·克里森(Escrison)>Escrison精品菜刀刀架 套装陶瓷刀...,京东商城,Escrison（艾森克里森） 陶瓷刀旗舰店1007003005,厨具|刀、剪、菜板|刀具配件,酷家陶瓷刀 厨房养生刀 抗菌洁净 耐磨超利"酷彩" 时尚两件套KJ-CK600 颜色随机发货,厨具>刀剪菜板>刀具配件>其它>酷家陶瓷刀 厨房养生刀 抗菌洁净 耐磨超...,京东商城,百悦网旗舰店1007003005,厨具|刀、剪、菜板|刀具配件,居家夫人居家夫人厨房用具 家用磨刀棒磨刀石 刀具套装必备厨具,厨具>刀剪菜板>刀具配件>居家夫人（jujiafuren）>居家夫人居家夫人厨房用具 家用磨刀棒磨刀...,京东商城,居家夫人官方旗舰店1007003005,厨具|刀、剪、菜板|刀具配件,力王 LIVEON 新型双槽磨刀器 蓝色,厨具>刀剪菜板>刀具配件>力王 LIVEON 新型双槽磨刀器 蓝...,京东商城,力王厨房1007003005,厨具|刀、剪、菜板|刀具配件,贝印 KAI 折叠水果刀 DG-2011,厨具>刀剪菜板>刀具配件>贝印>贝印 KAI 折叠水果刀 DG-2011,京东商城,贝印家居旗舰店1007003005,厨具|刀、剪、菜板|刀具配件,张小泉凤凰归来磨刀棒 S80280600,厨具>刀剪砧板>刀具配件>张小泉>张小泉凤凰归来磨刀棒 S80280600,京东商城,张小泉1007003005,厨具|刀、剪、菜板|刀具配件,汪吾铨 全不锈钢核桃工具钳1020,厨具>刀剪菜板>刀具配件>汪吾铨>汪吾铨工具钳,京东商城,汪吾铨1007003005,厨具|刀、剪、菜板|刀具配件,王麻子 多功能工具救生锤车载多功能,家居日用 > 刀剪砧板 > 刀具配件 > 王麻子,国美电器网上商城,王麻子1007003005,厨具|刀、剪、菜板|刀具配件,欧美达omuda厨房用品 皇冠系列磨刀器 磨刀棒,厨具>刀剪菜板>刀具配件>欧美达omuda厨房用品 皇冠系列磨刀器...,京东商城,欧美达居家用品旗舰店1007003005,厨具|刀、剪、菜板|刀具配件,大吉不锈钢核桃夹(大) 上口部内径46MM 型号HT1 红,厨具>刀剪菜板>刀具配件>大吉不锈钢核桃夹(大) 上口部内径46M...,京东商城,大吉旗舰店1007003005,厨具|刀、剪、菜板|刀具配件,欧美达omuda厨房用具康德爱心黑钻硬铬拉丝磨刀棒磨刀器磨刀石,厨具>刀剪砧板>刀具配件>欧美达omuda厨房用具康德爱心黑钻硬铬...,京东商城,欧美达居家用品旗舰店1007003005,厨具|刀、剪、菜板|刀具配件,时尚环保神奇刀座/刀架 不锈钢刀、陶瓷刀通用 红绿紫 红色,厨具>刀剪菜板>刀具配件>时尚环保神奇刀座/刀架 不锈钢刀、陶瓷刀...,京东商城,力王厨房1007003005,厨具|刀、剪、菜板|刀具配件,钻技ZUANJ 韩国原装进口 ZJ-S27 多功能双面磨刀器 专业磨刀石,厨具>刀剪菜板>刀具配件>双立人（ZWILLING）>钻技ZUANJ 韩国原装进口 ZJ-S2...,京东商城,悦祥家居馆1007003005,厨具|刀、剪、菜板|刀具配件,官方正品阳江十八子作 SSB-02 家用 10寸超强力磁力磨刀棒,厨具>刀剪菜板>刀具配件>十八子作>官方正品阳江十八子作 SSB-02 家用...,京东商城,十八子作官方旗舰店1007003005,厨具|刀、剪、菜板|刀具配件,Escrison精品4、6、菜、削刀架 黑色 陶瓷刀刀架 水果刀 亚克力非不锈钢刀座,厨具>刀剪菜板>刀具配件>艾森·克里森(Escrison)>Escrison精品4、6、菜、削刀架 ...,京东商城,Escrison（艾森克里森） 陶瓷刀旗舰店1007003005,厨具|刀、剪、菜板|刀具配件,巧媳妇棕刚玉防滑磨刀石AM-02,家居日用>刀具配件>巧媳妇>巧媳妇棕刚玉防滑磨刀石AM-02,国美电器网上商城,巧媳妇1007003005,厨具|刀、剪、菜板|刀具配件,金王电镀多功能水果削皮机去提核一体机,厨具>刀剪菜板>刀具配件>金王（Gold king）>金王电镀多功能水果削皮机去提核一体机,京东商城,山东金王旗舰店1007003005,厨具|刀、剪、菜板|刀具配件,磨刀匠GRINDER 便携式剪刀专用磨刀器/磨刀石 家用剪刀/修眉剪必备T0801C 红色,厨具>刀剪菜板>刀具配件>磨刀匠（GRINDER） >磨刀匠GRINDER 便携式剪刀专用磨刀...,京东商城,null1007003005,厨具|刀、剪、菜板|刀具配件,品和创意红酒架欧式酒架酒柜大炮密码酒架葡萄酒瓶架子高档酒具,厨具>刀剪菜板>刀具配件>品和>品和创意红酒架欧式酒架酒柜大炮密码酒架葡...,京东商城,1007003005,厨具|刀、剪、菜板|刀具配件,特价正品出口韩国水果削皮机削苹果机苹果削皮器送大号切果器 白色,厨具>刀剪菜板>刀具配件>德明>特价正品出口韩国水果削皮机削苹果机苹果削...,京东商城,1007003005,厨具|刀、剪、菜板|刀具配件,阳江十八子作不锈钢 厨房配件W-500厨房切丝器,家居日用>刀具配件>十八子作>阳江十八子作不锈钢 厨房配件W-500厨房切丝器,国美电器网上商城,十八子作1007003005,厨具|刀、剪、菜板|刀具配件,阳江十八子作 SM-02 家用 磨刀石 菜刀 防滑 磨刀器,家居日用>刀具配件>十八子作>阳江十八子作 SM-02 家用 磨刀石 菜刀 防滑 磨刀器,国美电器网上商城,十八子作1007003005,厨具|刀、剪、菜板|刀具配件,阳江十八子作SE-03高级不锈钢打蛋器,家居日用>刀具配件>十八子作>阳江十八子作SE-03高级不锈钢打蛋器,国美电器网上商城,十八子作1007003005,厨具|刀、剪、菜板|刀具配件,先后 陶瓷刀具 白色刃削皮器 紫色,厨具>刀剪菜板>刀具配件>先后 陶瓷刀具 白色刃削皮器 紫色,京东商城,先后创意家居1007003005,厨具|刀、剪、菜板|刀具配件,天天享不锈钢刀具红柄十件套装厨具用品T020 银色 20.5cm,厨具>刀剪菜板>刀具配件>天天享不锈钢刀具红柄十件套装厨具用品T0...,京东商城,天天享官方旗舰店1007003005,厨具|刀、剪、菜板|刀具配件,贝印 KAI 水果刀 木刀鞘 DG-2010,厨具>刀剪菜板>刀具配件>贝印>贝印 KAI 水果刀 木刀鞘 DG-20...,京东商城,贝印家居旗舰店1007003005,厨具|刀、剪、菜板|刀具配件,力王 LIVEON 绿碳化硅磨刀石 送底座,厨具>刀剪菜板>刀具配件>力王 LIVEON 绿碳化硅磨刀石 送...,京东商城,力王厨房1007003005,厨具|刀、剪、菜板|刀具配件,优质白色磨刀器 优质白色磨刀器 快速磨刀 磨刀石 方便实用 厨用工具 特价,厨具>刀剪菜板>刀具配件>H&3>优质白色磨刀器 优质白色磨刀器 快速磨刀...,京东商城,H&3厨具旗舰店1007003005,厨具|刀、剪、菜板|刀具配件,王麻子 6件高级美容套装,家居日用>刀具配件>王麻子>王麻子 6件高级美容套装,国美电器网上商城,王麻子旗舰店1007003005,厨具|刀、剪、菜板|刀具配件,皇家伍德（HORWOOD）磨刀金刚砂A000904,厨具>刀剪菜板>刀具配件>皇家伍德（HORWOOD）磨刀金刚砂A0...,京东商城,HORWOOD皇家伍德厨具旗舰店1007003005,厨具|刀、剪、菜板|刀具配件,SURKR韩国进口陶瓷刀刨刀刮皮刀具厨房用具创意家居刨子水果刀苹果削皮器 黄色,厨具>刀剪菜板>刀具配件>SURKR >SURKR韩国进口陶瓷刀刨刀刮皮刀具厨房...,京东商城,天使爱韩国生活馆1007003005,厨具|刀、剪、菜板|刀具配件,时尚环保神奇刀座/刀架 不锈钢刀、陶瓷刀通用 红绿紫 绿色,厨具>刀剪菜板>刀具配件>时尚环保神奇刀座/刀架 不锈钢刀、陶瓷刀...,京东商城,力王厨房1007003005,厨具|刀、剪、菜板|刀具配件,力王 LIVEON 绿碳化硅双面磨刀石,厨具>刀剪菜板>刀具配件>力王 LIVEON 绿碳化硅双面磨刀石,京东商城,力王厨房1007003005,厨具|刀、剪、菜板|刀具配件,热卖幸福家厨房置物架太空铝挂件挂架刀架 双排活动挂钩 50cm双杯,厨具>刀剪菜板>刀具配件>其它>热卖幸福家厨房置物架太空铝挂件挂架刀架 ...,京东商城,幸福家1007003005,厨具|刀、剪、菜板|刀具配件,法克曼 罐头开罐器 罐头刀 铁皮罐头刀45533,厨具>刀剪菜板>刀具配件>法克曼（Fackelmann）>法克曼 罐头开罐器 罐头刀 铁皮罐头刀4...,京东商城,金熙家美家居厨房用品专营店1007003005,厨具|刀、剪、菜板|刀具配件,正品阳江十八子作刀具 带叉子水果刀 多功能削皮刀 多用果刀UK-01,厨具>刀剪菜板>刀具配件>十八子作>正品阳江十八子作刀具 带叉子水果刀 多功...,京东商城,十八子作官方旗舰店1007003005,厨具|刀、剪、菜板|刀具配件,酷艺家 实用鱼鳞刨/轻松祛除鱼鳞 K12009,厨具>刀剪菜板>刀具配件>酷艺家>酷艺家 实用鱼鳞刨/轻松祛除鱼鳞 K12...,京东商城,鸿润诚品家居专营店1007003005,厨具|刀、剪、菜板|刀具配件,王麻子 多功能工具救生锤车载多功能,家居日用>刀具配件>王麻子>王麻子 多功能工具救生锤车载多功能,国美电器网上商城,王麻子旗舰店1007003005,厨具|刀、剪、菜板|刀具配件,简家 新款全不锈钢切苹果器切果器水果分割器 E9672,厨具>刀剪菜板>刀具配件>简家 新款全不锈钢切苹果器切果器水果分...,京东商城,简家家居旗舰店1007003005,厨具|刀、剪、菜板|刀具配件,磨刀匠GRINDER 多功能磨刀器/磨刀石 可磨水果刀/折叠刀/瑞士刀T0601T 红色,厨具>刀剪菜板>刀具配件>磨刀匠（GRINDER） >磨刀匠GRINDER 多功能磨刀器/磨刀...,京东商城,泰帝旗舰店1007003005,厨具|刀、剪、菜板|刀具配件,酷家陶瓷刀 陶瓷厨师刀水果刀 陶瓷刨 pp菜板"酷逸"脸谱礼盒 四件套KJ-CK602P KJ-CK602P,厨具>刀剪菜板>刀具配件>其它>酷家陶瓷刀 陶瓷厨师刀水果刀 陶瓷刨 p...,京东商城,百悦网旗舰店1007003005,厨具|刀、剪、菜板|刀具配件,阳江十八子作厨房 水果涾削皮器W-313陶瓷小瓜刨,家居日用>刀具配件>十八子作>阳江十八子作厨房 水果涾削皮器W-313陶瓷小瓜刨,国美电器网上商城,十八子作1007003005,厨具|刀、剪、菜板|刀具配件,力王 LIVEON 新型双槽磨刀器 玫红色,厨具>刀剪菜板>刀具配件>力王 LIVEON 新型双槽磨刀器 玫...,京东商城,力王厨房1007003005,厨具|刀、剪、菜板|刀具配件,先后 陶瓷刀具 白色刃削皮器 橙色,厨具>刀剪菜板>刀具配件>先后 陶瓷刀具 白色刃削皮器 橙色,京东商城,先后创意家居1007003005,厨具|刀、剪、菜板|刀具配件,苏泊尔（SUPOR）KG01A1银悦系列厨房小工具磨刀器家用磨刀石双口磨刀棒,家居日用>刀具配件>苏泊尔（SUPOR）>苏泊尔（SUPOR）KG01A1银悦系列厨房小工具磨刀器家用磨刀石双口磨刀棒,国美电器网上商城,苏泊尔（SUPOR）1007003005,厨具|刀、剪、菜板|刀具配件,王麻子 MA9G-1九件美容套装,家居日用 > 刀剪砧板 > 刀具配件 > 王麻子,国美电器网上商城,王麻子1007003005,厨具|刀、剪、菜板|刀具配件,大吉 核桃夹子组合装(一大一小) 可夹 胡桃 碧根果 亮蓝,厨具>刀剪菜板>刀具配件>大吉>大吉 核桃夹子组合装(一大一小) 可夹 ...,京东商城,大吉旗舰店1007003005,厨具|刀、剪、菜板|刀具配件,欧美达omuda厨房用具康德爱心彩钻硬铬拉丝磨刀棒磨刀器磨刀石,厨具>刀剪砧板>刀具配件>欧美达omuda厨房用具康德爱心彩钻硬铬...,京东商城,欧美达居家用品旗舰店1007003005,厨具|刀、剪、菜板|刀具配件,多样屋TAYOHYA黑色经典磨刀棒TA110102018ZZ,厨具>刀剪菜板>刀具配件>多样屋TAYOHYA黑色经典磨刀棒TA1...,京东商城,易居尚官方旗舰店1007003005,厨具|刀、剪、菜板|刀具配件,先后陶瓷刀 陶瓷刀具 亚克力刀架 MSBJ6（黑色）,厨具>刀剪菜板>刀具配件>先后陶瓷刀 陶瓷刀具 亚克力刀架 MSB...,京东商城,先后家居1007003005,厨具|刀、剪、菜板|刀具配件,天天享厨具刀具七件套不锈钢切菜刀/万能剪/砍骨刀/磨力棒/万用刀系列七件套刀T018 银色 28cm,厨具>刀剪菜板>刀具配件>双立人>天天享厨具刀具七件套不锈钢切菜刀/万能剪...,京东商城,天天享官方旗舰店1007003005,厨具|刀、剪、菜板|刀具配件,先后陶瓷刀 陶瓷瓜刨 白色刃削皮器,厨具>刀剪菜板>刀具配件>先后陶瓷刀 陶瓷瓜刨 白色刃削皮器,京东商城,先后创意家居1007003005,厨具|刀、剪、菜板|刀具配件,美厨不锈钢锅铲 CJ001-02+折叠式旅游水果刀 D-1,厨具>刀剪菜板>刀具配件>巧媳妇（SMARTWIFE）>美厨不锈钢锅铲 CJ001-02+折叠式...,京东商城,宏瑞生活馆1007003005,厨具|刀、剪、菜板|刀具配件,宏宝 合金不锈钢核桃夹螃蟹工具夹小山核桃核桃钳子坚果夹 HLK022-01,厨具>刀剪菜板>刀具配件>宏宝（HOBO）>宏宝 合金不锈钢核桃夹螃蟹工具夹小山核桃...,京东商城,宏宝家居专卖1007003005,厨具|刀、剪、菜板|刀具配件,振兴 SA7805带刷瓜刨 多功能瓜果刀 削皮刀 颜色随机,厨具>刀剪菜板>刀具配件>振兴>振兴 SA7805带刷瓜刨 多功能瓜果刀...,京东商城,生活演义创意家居1007003005,厨具|刀、剪、菜板|刀具配件,汇丰信佳 日式弧形 耐用不锈钢刀刃 削皮器 削水果去皮器 削皮刀 颜色种类较多.随机发货,厨具>刀剪菜板>刀具配件>汇丰信佳 日式弧形 耐用不锈钢刀刃 削皮...,京东商城,汇丰信佳旗舰店1007003005,厨具|刀、剪、菜板|刀具配件,官方正品 阳江十八子作 SM-02 家用 磨刀石 菜刀 防滑 磨刀器,厨具>刀剪菜板>刀具配件>十八子作>官方正品 阳江十八子作 SM-02 家用...,京东商城,十八子作官方旗舰店1007003005,厨具|刀、剪、菜板|刀具配件,宏宝 精品五金工具 家用折叠工具64件套HBZ-039-1,家居日用>刀具配件>宏宝>宏宝 精品五金工具 家用折叠工具64件套HBZ-039-1,国美电器网上商城,宏宝1007003005,厨具|刀、剪、菜板|刀具配件,金得宝黑色陶瓷瓜刨2Y-BA 削皮器 削皮工具,家居日用>刀具配件>金得宝>金得宝黑色陶瓷瓜刨2Y-BA 削皮器 削皮工具,国美电器网上商城,金得宝1007003005,厨具|刀、剪、菜板|刀具配件,胡子王创意厨房用品 金门菜刀 陶瓷紫磨刀器 保养刃口锋利,厨具>刀剪菜板>刀具配件>胡子王 >胡子王创意厨房用品 金门菜刀 陶瓷紫磨刀...,京东商城,胡子王旗舰店1007003005,厨具|刀、剪、菜板|刀具配件,包邮核桃夹 高档山核桃夹 创意核桃夹 圣诞鹿核桃夹 佳节礼品,厨具>刀剪菜板>刀具配件>品和>包邮核桃夹 高档山核桃夹 创意核桃夹 圣...,京东商城,卡冉柏家居专营店1007003005,厨具|刀、剪、菜板|刀具配件,onlinem盎睐玛特美耐皿砧板切菜板 多功能陶瓷削皮器水果刀带砧板三件套k-1048 粉红玫瑰,厨具>刀剪菜板>刀具配件>盎睐玛特（onlineM）>onlinem盎睐玛特美耐皿砧板切菜板 ...,京东商城,蝶艺美onlineM时尚家居1007003005,厨具|刀、剪、菜板|刀具配件,阳江十八子作W290厨房小瓜刨 多功能削皮刀刨刀瓜果刀削皮器,家居日用>刀具配件>十八子作>阳江十八子作W290厨房小瓜刨 多功能削皮刀刨刀瓜果刀削皮器,国美电器网上商城,十八子作1007003005,厨具|刀、剪、菜板|刀具配件,王麻子 MS9G-3九件美容套装,家居日用>刀具配件>王麻子>王麻子 MS9G-3九件美容套装,国美电器网上商城,王麻子旗舰店1007003005,厨具|刀、剪、菜板|刀具配件,英锋 AnySharp Silver 银色款 磨刀器,厨具>刀剪菜板>刀具配件>英锋（AnySharp）>英锋磨刀器,京东商城,英锋（AnySharp）1007003005,厨具|刀、剪、菜板|刀具配件,欧美达omuda厨房用具高级白刚玉双面油石 磨刀石菜刀石磨刀器,厨具>刀剪砧板>刀具配件>欧美达omuda厨房用具高级白刚玉双面油...,京东商城,欧美达居家用品旗舰店1007003005,厨具|刀、剪、菜板|刀具配件,巧厨不锈钢漏 CJ002-03,厨具>刀剪菜板>刀具配件>巧媳妇>巧厨不锈钢漏 CJ002-03,京东商城,宏瑞生活馆1007003005,厨具|刀、剪、菜板|刀具配件,热卖幸福家厨房置物架太空铝挂件挂架刀架 双排活动挂钩 40cm单杯,厨具>刀剪菜板>刀具配件>其它>热卖幸福家厨房置物架太空铝挂件挂架刀架 ...,京东商城,幸福家1007003005,厨具|刀、剪、菜板|刀具配件,欧美达omdua 厨房烹饪用具创意榉木套刀架 刀座,厨具>刀剪菜板>刀具配件>欧美达omdua 厨房烹饪用具创意榉木套...,京东商城,欧美达居家用品旗舰店1007003005,厨具|刀、剪、菜板|刀具配件,十八子作 8寸磁力磨刀棒 厨房工具家用菜刀厨刀强力磨刀器SSB-03,厨具>刀剪菜板>刀具配件>十八子作>十八子作 8寸磁力磨刀棒 厨房工具家用菜...,京东商城,十八子作官方旗舰店1007003005,厨具|刀、剪、菜板|刀具配件,【京品年货】双立人双刃磨刀器,厨具>刀剪菜板>刀具配件>双立人（ZWILLING）>【京品年货】双立人双刃磨刀器,京东商城,双立人旗舰店1007003005,厨具|刀、剪、菜板|刀具配件,博鑫 创意指环式玉米刨 剥玉米器 颜色随机,厨具>刀剪菜板>刀具配件>振兴>博鑫 创意指环式玉米刨 剥玉米器 颜色随...,京东商城,生活演义创意家居1007003005,厨具|刀、剪、菜板|刀具配件,官方正品 阳江十八子作SC-05多功能开罐器,厨具>刀剪菜板>刀具配件>十八子作>官方正品 阳江十八子作SC-05多功能开...,京东商城,十八子作官方旗舰店1007003005,厨具|刀、剪、菜板|刀具配件,美厨（maxcook） 多功能收纳 大号熊猫合金刀架MSSB732-A（托盘 颜色随机）,厨具>刀剪菜板>刀具配件>美厨（maxcook）>美厨多功能收纳,京东商城,美厨（maxcook）1007003005,厨具|刀、剪、菜板|刀具配件,金得宝蓝柄陶瓷瓜刨6Y-LGA 削皮器 削皮工具,家居日用>刀具配件>金得宝>金得宝蓝柄陶瓷瓜刨6Y-LGA 削皮器 削皮工具,国美电器网上商城,金得宝1007003005,厨具|刀、剪、菜板|刀具配件,信柏 厨房万能防菌收纳筒 厨房置物架 餐具收纳筒 刀具收纳 刀架 绿色,厨具>刀剪菜板>刀具配件>信柏SURPAQ >信柏 厨房万能防菌收纳筒 厨房置物架 餐...,京东商城,信柏专卖店1007003005,厨具|刀、剪、菜板|刀具配件,百润厨具套装 红酒开瓶器 压蒜器开罐器核桃夹厨具套装厨房工具,厨具>刀剪菜板>刀具配件>百润>百润厨具套装 红酒开瓶器 压蒜器开罐器核...,京东商城,晟维家居专营店1007003005,厨具|刀、剪、菜板|刀具配件,SIMELO自然元素系列不粘锅不锈钢锅专用木铲,厨具>刀剪菜板>刀具配件>SIMELO>SIMELO自然元素系列不粘锅不锈钢锅专...,京东商城,1007003005,厨具|刀、剪、菜板|刀具配件,Escrison精品菜刀刀架 套装陶瓷刀刀架 菜刀 水果刀 亚克力非不锈钢刀座 菜刀单刀刀架,厨具>刀剪菜板>刀具配件>艾森·克里森(Escrison)>Escrison精品菜刀刀架 套装陶瓷刀...,京东商城,Escrison（艾森克里森） 陶瓷刀旗舰店1007003005,厨具|刀、剪、菜板|刀具配件,酷艺家 圆形多用三合一去皮刀 削皮器 K60061 黄色,厨具>刀剪菜板>刀具配件>酷艺家>酷艺家 圆形多用三合一去皮刀 削皮器 K...,京东商城,鸿润诚品家居专营店1007003005,厨具|刀、剪、菜板|刀具配件,爱仕达ASD 刀板三件套ZP03DB,厨具>刀剪菜板>刀具配件>爱仕达（ASD）>爱仕达ASD 刀板三件套ZP03DB,京东商城,爱仕达金策堂专卖店1007003005,厨具|刀、剪、菜板|刀具配件,居家夫人精钢石磨刀器 防滑底座家用安全磨刀石刀具套装必备,厨具>刀剪菜板>刀具配件>居家夫人（jujiafuren）>居家夫人精钢石磨刀器 防滑底座家用安全磨...,京东商城,居家夫人官方旗舰店1007003005,厨具|刀、剪、菜板|刀具配件,阳江十八子作W-315陶瓷小瓜刨,家居日用>刀具配件>十八子作>阳江十八子作W-315陶瓷小瓜刨,国美电器网上商城,十八子作1007003005,厨具|刀、剪、菜板|刀具配件,力王 LIVEON 新型双槽磨刀器 紫色,厨具>刀剪菜板>刀具配件>力王 LIVEON 新型双槽磨刀器 紫...,京东商城,力王厨房1007003005,厨具|刀、剪、菜板|刀具配件,先后 陶瓷刀具 白色刃削皮器 蓝色,厨具>刀剪菜板>刀具配件>先后 陶瓷刀具 白色刃削皮器 蓝色,京东商城,先后创意家居1007003005,厨具|刀、剪、菜板|刀具配件,王麻子 MC7G-2七件美容套装,家居日用>刀具配件>王麻子>王麻子 MC7G-2七件美容套装,国美电器网上商城,王麻子旗舰店1007003005,厨具|刀、剪、菜板|刀具配件,双立人 Zwilling Others 磨刀棒 32576-230-022,厨具>刀剪菜板>刀具配件>双立人（ZWILLING）>双立人磨刀棒,京东商城,双立人（ZWILLING）1007003005,厨具|刀、剪、菜板|刀具配件,英锋 AnySharp Classic 经典款 磨刀器,厨具>刀剪菜板>刀具配件>英锋（AnySharp）>英锋磨刀器,京东商城,英锋（AnySharp）1007003005,厨具|刀、剪、菜板|刀具配件,佩蒂厨房 PETIT COOK 多功能抗菌刀架 105*170*202MM 抗菌ABS白色 PT-S105,厨具>刀剪菜板>刀具配件>佩蒂厨房 PETIT COOK 多功能抗...,京东商城,通业家居1007003005,厨具|刀、剪、菜板|刀具配件,巧厨不锈钢锅铲 CJ002-02,厨具>刀剪菜板>刀具配件>巧媳妇>巧厨不锈钢锅铲 CJ002-02,京东商城,宏瑞生活馆1007003005,厨具|刀、剪、菜板|刀具配件,超厚不锈钢刀架 挂架刀座 多用置物架带挂钩单杆挂架 厨房厨具用品,厨具>刀剪菜板>刀具配件>锐佳>超厚不锈钢刀架 挂架刀座 多用置物架...,京东商城,淘易家居