1007008008,厨具|厨房清洗用品|防油贴纸,吉满 厨房防油贴纸 防油污油烟贴纸 墙贴 蜜蜂采花,当当网 > 家居日用 > 厨房用品 > 其它,当当网,吉满1007008008,厨具|厨房清洗用品|防油贴纸,韩国高档耐高温铝箔防油污贴纸 厨房防油贴纸 白色猫咪Diy创意家居 墙贴,当当网 > 家居日用 > 厨房用品 > 厨房清洁,当当网,1007008008,厨具|厨房清洗用品|防油贴纸,EMIT忆美特厨房铝箔防油污贴纸-易撕易贴易清洗 FY008,所有分类>家居家纺、锅具餐具>装饰/日用>其他生活日用品>EMIT>EMIT忆美特厨房铝...,1号店,EMIT1007008008,厨具|厨房清洗用品|防油贴纸,潘尼珂 品质生活家庭厨具优质不锈钢锅铲 赠铝箔厨房防油贴纸1张 双层加厚竹纤维百洁布1块(不沾油 不用洗涤精) 三件套家家炒菜必备 和油污说再见,厨具 > 厨房小器具 > 汤勺 ,亚马逊(卓越网),潘尼珂1007008008,厨具|厨房清洗用品|防油贴纸,厨房防油贴纸耐高温防油烟贴纸 耐高温墙贴大号多款选,家居日用 > 清洁护理 > 清洁工具 > 商品详情,当当网,维特尔1007008008,厨具|厨房清洗用品|防油贴纸,Unitek韩国进口卡通组合墙贴可移除瓷砖装饰贴纸 花瓣舞21x10.5cm/4片装,优越者（UNITEK）>Unitek韩国进口卡通组合墙贴可移除瓷...,京东商城,璜谷家饰1007008008,厨具|厨房清洗用品|防油贴纸,欧唛(oumai) 防油贴 OM1034《雨后玫瑰》3个装 厨房餐厅家居 耐高温防油污贴纸,家居家装>家装软饰>墙画墙贴>欧唛(oumai) 防油贴 OM1034...,京东商城,欧唛旗舰店1007008008,厨具|厨房清洗用品|防油贴纸,欧唛(oumai) 防油贴 OM1054《粉色诱惑》3个装 厨房餐厅家居 耐高温防油污贴纸,家居家装>家装软饰>墙画墙贴>欧唛(oumai) 防油贴 OM1054...,京东商城,欧唛旗舰店1007008008,厨具|厨房清洗用品|防油贴纸,爱丽丝 3个装《果实累累》 餐厅 高档厨房防油贴纸 防油污贴纸 铝箔 3pcs AL1009,所有分类>家居家纺、锅具餐具>厨具锅具>厨房工具>锡纸/油纸>爱丽丝>爱丽丝 3个装《果实...,1号店,爱丽丝1007008008,厨具|厨房清洗用品|防油贴纸,宜美贴（Yimt） 厨房灶台专用铝箔防油贴纸玫瑰情缘F036,家居家装>家装软饰>墙画墙贴>宜美贴（Yimt） 厨房灶台专用铝箔防油...,京东商城,宜美贴旗舰店1007008008,厨具|厨房清洗用品|防油贴纸,美乐家饰Magicfix韩国进口防油烟贴厨房专用AL系列 AL-01 45X75厘米,家居家装>家装软饰>墙画墙贴>美乐家饰Magicfix韩国进口防油烟贴...,京东商城,美乐家饰1007008008,厨具|厨房清洗用品|防油贴纸,忆美特 EMIT 厨房贴防油贴 45*100cm 隔油防水耐高温 铝箔材料 卡通熊 FY004,家用/类别/家居/家居装饰/墙贴、装饰贴/防油贴,亚马逊(卓越网),Emit 忆美特1007008008,厨具|厨房清洗用品|防油贴纸,EMIT 忆美特 铝箔防油贴2件套 厨房灶台抗油污 耐高温 45*75cm FY051-52,家用/类别/家居/家居装饰/墙贴、装饰贴/瓷砖贴玻璃贴,亚马逊(卓越网),Emit 忆美特1007008008,厨具|厨房清洗用品|防油贴纸,Pearl Life 珍珠生活 金属柄双层茶叶滤网 C-8687 6.5cm,首页 > 厨房 > 厨房配件 > 珍珠生活 > 产品编号: S2F-2HJ-093_136,新蛋商城,珍珠生活1007008008,厨具|厨房清洗用品|防油贴纸,厨房墙贴厨房防油贴纸 厨房贴纸 防油纸 -玫瑰花瓣 （2个）,厨具 > 厨用小工具 > 隔热防溅工具 > 防油贴纸、挡板 ,亚马逊(卓越网),好阿姨1007008008,厨具|厨房清洗用品|防油贴纸,EMIT 忆美特 厨房铝箔防油贴 45*75cm2件套 灶台防油污 可移 无残胶 FY026-30,家用/类别/家居/家居装饰/墙贴、装饰贴/瓷砖贴玻璃贴,亚马逊(卓越网),Emit 忆美特1007008008,厨具|厨房清洗用品|防油贴纸,手信 厨房防油贴纸/防油贴纸/防油贴 耐高温/ 透明/防油贴整卷,家用/类别/厨具/厨房装饰,亚马逊(卓越网),手信1007008008,厨具|厨房清洗用品|防油贴纸,喜利多/Siligo 家居厨房防油铝箔贴纸 4张 下午茶,喜利多/Siligo 家居厨房防油铝箔贴...,京东商城,喜利多家居旗舰店1007008008,厨具|厨房清洗用品|防油贴纸,siligo/喜利多 厨房贴纸 放油贴 铝箔厨房防油贴纸大号,所有分类>家居家纺、锅具餐具>厨具锅具>厨房工具>锡纸/油纸>siligo/喜利多>siligo/喜利多...,1号店,siligo/喜利多1007008008,厨具|厨房清洗用品|防油贴纸,欧唛(oumai) 防油贴 厨房餐厅家居 耐高温防油污贴纸 (水果蔬菜)1006,家居家装>家装软饰>墙画墙贴>欧唛(oumai) 防油贴 厨房餐厅家居...,京东商城,欧唛旗舰店1007008008,厨具|厨房清洗用品|防油贴纸,欧唛(oumai) 防油贴 厨房餐厅家居 耐高温防油污贴纸 (玫瑰爱情)1050,家居家装>家装软饰>墙画墙贴>欧唛(oumai) 防油贴 厨房餐厅家居...,京东商城,欧唛旗舰店1007008008,厨具|厨房清洗用品|防油贴纸,宜美贴（Yimt） 铝箔防油贴纸蝶舞花间F037 厨房灶台专用隔油耐高温,家居家装>家装软饰>墙画墙贴>宜美贴（Yimt） 铝箔防油贴纸蝶舞花间...,京东商城,宜美贴旗舰店1007008008,厨具|厨房清洗用品|防油贴纸,FIXPIX韩国进口厨房灶台瓷砖防油污 浴室防潮翻新贴纸 马赛克 11092缤纷蓝格 50x250cm,FIXPIX>FIXPIX韩国进口厨房灶台瓷砖防油污 ...,京东商城,璜谷家饰1007008008,厨具|厨房清洗用品|防油贴纸,喜利多siligo 防油贴 厨房餐厅家居 耐高温防油污贴纸 铝箔厨房防油贴纸大号 草莓,喜利多siligo 防油贴 厨房餐厅家居...,京东商城,喜利多家居旗舰店1007008008,厨具|厨房清洗用品|防油贴纸,班歌牌 厨房贴 餐厅贴《美味佐料》高档厨房防油贴纸 墙贴 防油污贴纸 墙纸 透明铝箔纸 厨房防油贴纸/瓷砖贴纸/防油墙纸 耐热易清洗 厨房用品 BG1005,其他/商品/其他,亚马逊(卓越网),班歌1007008008,厨具|厨房清洗用品|防油贴纸,东洋铝Toyal 厨房防油贴纸 贴膜 耐高温吸壁墙贴 日本原装进口正品 (米色),厨具 > 厨用小工具 > 隔热防溅工具 > 防油贴纸、挡板,亚马逊(卓越网),东洋铝Toyal1007008008,厨具|厨房清洗用品|防油贴纸,特价卡通儿童房墙贴 家居家饰卧室教室布置可移除墙贴纸贴花贴画,家居家装>家装软饰>墙画墙贴>特价卡通儿童房墙贴 家居家饰卧室教室布置...,京东商城,叮叮贴饰1007008008,厨具|厨房清洗用品|防油贴纸,QJ奇积-5.7cm贴纸白体三阶魔方精装 QJ8003-BZL,QJ奇积-5.7cm贴纸白体三阶魔方精装...,京东商城,奇奇玩具1007008008,厨具|厨房清洗用品|防油贴纸,彩家乐防油贴厨房专用铝箔防油贴方便清洁装饰贴纸律动音符,彩家乐防油贴厨房专用铝箔防油贴方便清洁装...,京东商城,彩家乐家居专营店1007008008,厨具|厨房清洗用品|防油贴纸,忆美特厨房防油贴 灶台瓷砖贴 有效隔离油污 FY022(雪梨) 45cm* 家居就旗舰店,忆美特（EMIT）>忆美特厨房防油贴 灶台瓷砖贴 有效隔离油...,京东商城,家居就建材家居旗舰店1007008008,厨具|厨房清洗用品|防油贴纸,特价2013新款厨房贴纸大号铝箔防油贴纸可移除餐厅墙贴瓷砖贴纸,家居家装>家装软饰>墙画墙贴>特价2013新款厨房贴纸大号铝箔防油贴纸...,京东商城,叮叮贴饰1007008008,厨具|厨房清洗用品|防油贴纸,谷典牌 厨房防油防水耐高温贴纸 透明铝箔 厨房贴 美味食品GD1032,家居家装>家装软饰>墙画墙贴>谷典>谷典牌 厨房防油防水耐高温贴纸 透明铝箔...,京东商城,谷典旗舰店1007008008,厨具|厨房清洗用品|防油贴纸,特价2013新款厨房贴纸大号铝箔防油贴纸可移除餐厅墙贴瓷砖贴纸,家居家装>家装软饰>墙画墙贴>特价2013新款厨房贴纸大号铝箔防油贴纸...,京东商城,叮叮贴饰1007008008,厨具|厨房清洗用品|防油贴纸,小马车品 汽车贴纸 马3 马6专用 盾 超酷图案 个性门贴0221 黑色18*17.3cm,汽车用品 > 汽车内饰 > 遮阳挡、避光垫 > 车贴,亚马逊(卓越网),小马车品1007008008,厨具|厨房清洗用品|防油贴纸,Lemon Tree 柠檬树 【全国】柠檬树 厨房防油贴纸 耐高温/防油/免清洗 一套8片装 8片装款式随机发 买二送一张,家用/类别/家居/家居装饰/墙贴、装饰贴/墙贴,亚马逊(卓越网),Lemon Tree 柠檬树1007008008,厨具|厨房清洗用品|防油贴纸,Lemon Tree 柠檬树 柠檬树 加厚款厨房防油贴纸防水耐高温装饰贴纸一套8片装大号 8片装生命之花 买二套送一张,家用/类别/家居/家居装饰/墙贴、装饰贴/墙贴,亚马逊(卓越网),Lemon Tree 柠檬树1007008008,厨具|厨房清洗用品|防油贴纸,Lemon Tree 柠檬树 柠檬树 加厚款厨房防油贴纸防水耐高温装饰贴纸一套8片装大号 8片装花仙子之恋 买二套送一张,家用/类别/家居/家居装饰/墙贴、装饰贴/墙贴,亚马逊(卓越网),Lemon Tree 柠檬树1007008008,厨具|厨房清洗用品|防油贴纸,Lemon Tree 柠檬树 厨房贴纸防油烟瓷砖贴玻璃贴大号墙贴纸 铝箔防油贴纸 买五送一 TL247蝶变葵(铝箔) 中,家用/类别/家居/家居装饰/墙贴、装饰贴/墙贴,亚马逊(卓越网),Lemon Tree 柠檬树1007008008,厨具|厨房清洗用品|防油贴纸,厨房防油贴纸 墙贴 防油污贴纸 墙纸 透明铝箔15款,电脑办公 > 办公用品 > 其它,当当网,1007008008,厨具|厨房清洗用品|防油贴纸,厨房防油贴纸-大树,家居日用 > 厨房用品 > 厨房杂件 > 厨房配件 > 商品详情,当当网,想飘1007008008,厨具|厨房清洗用品|防油贴纸,BBMONG 贝贝梦 韩国原装贴纸 儿童卡通墙贴 可移除瓷砖贴 防水墙纸 看图学习填图 生日蛋糕 FDT-903,母婴用品 > 育儿房装饰 > 墙贴,亚马逊(卓越网),BBMONG 贝贝梦1007008008,厨具|厨房清洗用品|防油贴纸,英达罗 厨房防油贴 蓝色马赛克 铝箔瓷砖贴,英达罗>英达罗 厨房防油贴 蓝色马赛克 铝箔瓷砖...,京东商城,英达罗家居旗舰店1007008008,厨具|厨房清洗用品|防油贴纸,楼龙 厨房防污贴纸 瓷砖贴 隔油防油贴纸 蓝天白云 JJD155,所有分类>厨卫清洁、纸、清洁剂>纸制品>厨房用纸>楼龙>楼龙 厨房防污贴纸 ...,1号店,楼龙1007008008,厨具|厨房清洗用品|防油贴纸,沐坤 三层复合铝箔防油贴纸 厨房贴纸 耐150度高温 75*45CM 爱心大树,家居家装>家装软饰>墙贴/装饰贴>沐坤>沐坤 三层复合铝箔防油贴纸 厨房贴纸 耐...,京东商城,悠然居家1007008008,厨具|厨房清洗用品|防油贴纸,欧凡高档厨房防油贴油烟贴纸（橙子）90*50cm 2片装 WD-6320,家居家装>家装软饰>其他>欧凡>欧凡高档厨房防油贴油烟贴纸（橙子）90*...,京东商城,欧凡家居生活馆1007008008,厨具|厨房清洗用品|防油贴纸,【货到付款】馨颜 墙壁厨房装饰清洁防水耐高温防油贴纸75*45cm 樱花家园,家居家装>家装软饰>装饰字画>馨颜>【货到付款】馨颜 墙壁厨房装饰清洁防水耐...,京东商城,馨颜生活旗舰店1007008008,厨具|厨房清洗用品|防油贴纸,【货到付款】馨颜 墙壁厨房装饰清洁防水耐高温防油贴纸75*45cm 爱心家园,家居家装>家装软饰>装饰字画>馨颜>【货到付款】馨颜 墙壁厨房装饰清洁防水耐...,京东商城,馨颜生活旗舰店1007008008,厨具|厨房清洗用品|防油贴纸,货到付款馨颜墙壁厨房装饰清洁防水耐高温防油贴纸格子款 寒风傲骨,家居家装>家装软饰>装饰字画>馨颜>货到付款馨颜墙壁厨房装饰清洁防水耐高温防...,京东商城,馨颜生活旗舰店1007008008,厨具|厨房清洗用品|防油贴纸,货到付款馨颜墙壁厨房装饰清洁防水耐高温防油贴纸格子款 浪漫海滩,家居家装>家装软饰>装饰字画>馨颜>货到付款馨颜墙壁厨房装饰清洁防水耐高温防...,京东商城,馨颜生活旗舰店1007008008,厨具|厨房清洗用品|防油贴纸,喜家家厨房防油贴灶台油烟贴墙贴专用45*75cm 海豚,家居家装>家装软饰>装饰字画>喜家家>喜家家厨房防油贴灶台油烟贴墙贴专用45*...,京东商城,喜家家家居生活馆1007008008,厨具|厨房清洗用品|防油贴纸,厨房防污贴纸 瓷砖贴 隔油防油贴纸 蓝天白云 JJD155-2,家居家装>家装软饰>墙画墙贴>楼龙(Loulong)>厨房防污贴纸 瓷砖贴 隔油防油贴纸 蓝天...,京东商城,楼龙旗舰店1007008008,厨具|厨房清洗用品|防油贴纸,Z-LABEL立标 可移除胶粘 红边 姓名胸贴 手写不干胶自粘标签贴纸ZWM3025 标签尺寸:8.6×5.6 cm 20张/本,Z-LABEL® Brand Removable Self-Adhesive Name Badges, "Hello my name is"Red Border, 3-3/8"X 2-3/16",Pack Of20,办公用品 > 纸类 > 笔记本、便签、随意贴 > 随意贴,亚马逊(卓越网),Z-LABEL 立标1007008008,厨具|厨房清洗用品|防油贴纸,秒杀 彩家乐大号厨房防油贴 田园 四叶草45*90cm PET+铝箔 耐高温保护瓷砖防油污贴纸 厨房装饰墙贴 方便清洁 特价促销,家具家装 > 时尚家饰 > 墙壁装饰,当当网,彩家乐1007008008,厨具|厨房清洗用品|防油贴纸,斯图牌 防油贴 3个装 厨房餐厅家居 耐高温防油污贴纸斯图ST1034,家具家装 > 时尚家饰 > 墙壁装饰,当当网,斯图1007008008,厨具|厨房清洗用品|防油贴纸,防油贴纸60*90cm大号 新饰线墙贴纸 厨房贴纸防油溅面罩,家装建材 > 时尚家饰 > 墙壁装饰 > 商品详情,当当网,新饰线1007008008,厨具|厨房清洗用品|防油贴纸,大号防油贴纸60cm*90cm 新饰线墙贴纸 厨房贴纸防油烟贴纸,家装建材 > 时尚家饰 > 墙壁装饰 > 商品详情,当当网,新饰线1007008008,厨具|厨房清洗用品|防油贴纸,普润 高档唯美防油贴纸 耐高温 蓝天白云 厨房防污贴纸 隔油瓷砖贴 JJD155,家居日用 > 清洁护理 > 其它 > 商品详情,当当网,无1007008008,厨具|厨房清洗用品|防油贴纸,简家 可爱卡通环保可移除墙贴纸儿童房贴纸瓷砖贴玻璃贴 K1243,家装建材 > 时尚家饰 > 墙壁装饰 > 商品详情,当当网,简家1007008008,厨具|厨房清洗用品|防油贴纸,斯图 (sitoo) 防油贴 厨房餐厅家居 耐高温防油污贴纸 瓷砖贴 墙纸 墙贴 瓷砖贴 (海豚之恋)ST1033,家装建材>墙地面材料>壁纸>斯图 (sitoo) 防油贴 厨房餐厅家...,京东商城,斯图壁纸1007008008,厨具|厨房清洗用品|防油贴纸,Wheatley 惠特利 出口韩国铝箔防油装饰贴纸 防水贴纸(水果)a1C04-2-011,,亚马逊(卓越网),Wheatley 惠特利1007008008,厨具|厨房清洗用品|防油贴纸,润格 厨房防油贴纸进口高档铝铂耐高温灶台瓷砖吸烟油纸尺寸45*75,所有分类>家居家纺、锅具餐具>装饰/日用>装饰贴>润格>润格 厨房防油贴纸进...,1号店,润格1007008008,厨具|厨房清洗用品|防油贴纸,御用家喜 三层复合铝箔防油贴纸 厨房贴纸 耐150度高温 75*45CM,所有分类>家居家纺、锅具餐具>装饰/日用>装饰贴>御用家喜>御用家喜 三层复合铝...,1号店,御用家喜1007008008,厨具|厨房清洗用品|防油贴纸,开馨宝 爱丽丝女孩 厨房用铝箔耐高温防油贴纸 厨房贴纸-花瓣-卷发动漫女孩Y1003）,所有分类>家居家纺、锅具餐具>装饰/日用>装饰贴>开馨宝>开馨宝 爱丽丝女孩 ...,1号店,开馨宝1007008008,厨具|厨房清洗用品|防油贴纸,孖堡家居 高档厨房防油贴 铝箔材质耐高温瓷砖墙贴 加厚防水防油烟灶台墙贴纸 玫瑰五线谱,家装建材 > 时尚家饰 > 墙壁装饰 > 商品详情,当当网,孖堡家居1007008008,厨具|厨房清洗用品|防油贴纸,高档厨房防油贴 铝箔材质耐高温 防油烟灶台墙贴纸AY3003黑猫公主,秋田>高档厨房防油贴 铝箔材质耐高温 防油烟灶...,京东商城,驰尚家居专营店1007008008,厨具|厨房清洗用品|防油贴纸,【支持货到付款】馨颜 墙壁厨房装饰清洁防水耐高温防油贴纸大版60*90cm 营养搭档纸袋,家居家装>家装软饰>装饰字画>馨颜>【支持货到付款】馨颜 墙壁厨房装饰清洁防...,京东商城,馨颜生活旗舰店1007008008,厨具|厨房清洗用品|防油贴纸,【支持货到付款】馨颜 墙壁厨房装饰清洁防水耐高温防油贴纸格子款60*90cm 营养搭档,家居家装>家装软饰>装饰字画>馨颜>【支持货到付款】馨颜 墙壁厨房装饰清洁防...,京东商城,馨颜生活旗舰店1007008008,厨具|厨房清洗用品|防油贴纸,厨房防污贴纸 瓷砖贴 隔油防油贴纸 厨房瓷砖贴防油贴纸 耐高温油烟贴铝珀墙贴纸 玫瑰花Y1012,家居家装>家装软饰>其他>红兔子>厨房防污贴纸 瓷砖贴 隔油防油贴纸 厨房...,京东商城,1007008008,厨具|厨房清洗用品|防油贴纸,欧凡 高档厨房防油贴油烟贴纸（欣欣向荣）75*45cm 2片装 WD-6313,家居家装>家装软饰>其他>欧凡>欧凡 高档厨房防油贴油烟贴纸（欣欣向荣）...,京东商城,欧凡家居生活馆1007008008,厨具|厨房清洗用品|防油贴纸,车爱人 汽车车贴 外饰用品 搞笑贴纸 个性车贴 铝箔24K纯爷们车贴 黑色 单个装,汽车用品>内饰精品>功能用品>车爱人（CHE AI REN）>车爱人 汽车车贴 外饰用品 搞笑贴纸 个...,京东商城,1007008008,厨具|厨房清洗用品|防油贴纸,开馨宝 日式家居防油贴耐热防水易清洁防油贴纸厨房贴纸 5个装G107841 45*90cm,家居家装>家装软饰>其他>开馨宝>开馨宝 日式家居防油贴耐热防水易清洁防油...,京东商城,开馨宝旗舰店1007008008,厨具|厨房清洗用品|防油贴纸,消防员隔热服 耐高温防火工作服 无石棉铝箔 消防隔热战斗服 军用避火服 可以独立使用,家装建材 > 五金工具 > 家用五金 > 商品详情,当当网,江波1007008008,厨具|厨房清洗用品|防油贴纸,厨房瓷砖贴防油贴纸 普润 耐高温油烟贴铝珀墙贴纸 防水墙贴纸 铝珀灶台贴油烟贴墙贴,家装建材 > 时尚家饰 > 墙壁装饰 > 商品详情,当当网,米悦家纺1007008008,厨具|厨房清洗用品|防油贴纸,孖堡家居 高档厨房防油贴 铝箔材质耐高温瓷砖墙贴 加厚防水防油烟灶台墙贴纸 圆圈装饰油烟贴 45cm*75cm,家居家装>家装软饰>墙画墙贴>孖堡家居>孖堡家居 高档厨房防油贴 铝箔材质耐高温...,京东商城,孖堡家居旗舰店1007008008,厨具|厨房清洗用品|防油贴纸,孖堡家居 高档厨房防油贴 铝箔材质耐高温瓷砖墙贴 加厚防水防油烟灶台墙贴纸 向日葵,所有分类>家居家纺、锅具餐具>装饰/日用>装饰贴>孖堡家居>孖堡家居 高档厨房防...,1号店,孖堡家居1007008008,厨具|厨房清洗用品|防油贴纸,居梦坞 高档铝箔油烟贴 耐高温厨房贴纸 防油贴 瓷砖贴 防水油烟贴纸 45*75cm 单个 YLT-033 美味搭档 中号,家居家装>家装软饰>墙贴/装饰贴>居梦坞（Dreamwall）>居梦坞 高档铝箔油烟贴 耐高温厨房贴纸 ...,京东商城,居梦坞现代家居装饰旗舰店1007008008,厨具|厨房清洗用品|防油贴纸,吉睿JiRui 田园铝箔厨房专用耐高温易清洁防油烟贴纸45*75CM 蜻荷款KS-019 两个装,吉睿>吉睿JiRui 田园铝箔厨房专用耐高温易...,京东商城,吉睿家居生活馆1007008008,厨具|厨房清洗用品|防油贴纸,居梦坞 高档铝箔油烟贴 耐高温厨房贴纸 防油贴 瓷砖贴 防水油烟贴纸 45*75cm 单个 3006 厨房用具 中号,家居家装>家装软饰>墙贴/装饰贴>居梦坞（Dreamwall）>居梦坞 高档铝箔油烟贴 耐高温厨房贴纸 ...,京东商城,居梦坞现代家居装饰旗舰店1007008008,厨具|厨房清洗用品|防油贴纸,斯图 防油贴 3个装 厨房餐厅家居 耐高温防油污贴纸 ST1032美味食品,家居家装>家装软饰>墙贴/装饰贴>斯图>斯图 防油贴 3个装 厨房餐厅家居 耐...,京东商城,斯图旗舰店1007008008,厨具|厨房清洗用品|防油贴纸,斯图 防油贴 3个装 厨房餐厅家居 耐高温防油污贴 ST1050玫瑰爱情,家居家装>家装软饰>墙贴/装饰贴>斯图>斯图 防油贴 3个装 厨房餐厅家居 耐...,京东商城,斯图旗舰店1007008008,厨具|厨房清洗用品|防油贴纸,特大号 组合墙贴 墙贴 壁贴 瓷砖贴 幼儿园贴纸,家居家装>家装软饰>墙画墙贴>其它>特大号 组合墙贴 墙贴 壁贴 瓷砖贴 幼...,京东商城,吉满家居专营店1007008008,厨具|厨房清洗用品|防油贴纸,吉睿JiRui 田园铝箔厨房专用耐高温易清洁防油烟贴纸60*90 琴莲小镇HD-045 五个装,吉睿>吉睿JiRui 田园铝箔厨房专用耐高温易...,京东商城,吉睿家居生活馆1007008008,厨具|厨房清洗用品|防油贴纸,斯图 (sitoo) 防油贴 厨房餐厅家居 耐高温防油污贴纸 瓷砖贴 墙纸 墙贴 瓷砖贴 (薰衣草)ST1011,家居家装>家装软饰>墙贴/装饰贴>斯图>斯图 (sitoo) 防油贴 厨房餐厅家...,京东商城,斯图旗舰店1007008008,厨具|厨房清洗用品|防油贴纸,忆美特防油贴 厨房墙贴纸 隔热耐高温10件套装 FY-A010-A 45*75cm*10张,家居家装>家装软饰>墙贴/装饰贴>忆美特（EMIT）>忆美特防油贴 厨房墙贴纸 隔热耐高温10...,京东商城,忆美特时尚家饰1007008008,厨具|厨房清洗用品|防油贴纸,EMIT 忆美特 厨房防油贴 镀铝箔油烟贴10件套（45*75cm）10款流行款式 图案随机搭配,家居 > 家居装饰 > 墙贴、装饰贴 > 防油贴,亚马逊(卓越网),Emit 忆美特1007008008,厨具|厨房清洗用品|防油贴纸,居梦坞FYT-007 可爱蘑菇 高档铝箔油烟贴 耐高温厨房贴纸 防油贴 瓷砖贴防水油烟贴纸 45*75cm 单个,首页>家居/家装建材/厨具>生活日用>装饰用品>居梦坞FYT-007可爱蘑菇高档...,苏宁,1007008008,厨具|厨房清洗用品|防油贴纸,潘尼珂 韩国创意厨房高档铝箔防油贴纸 海豚,首页>家居/家装建材/厨具>生活日用>装饰用品>潘尼珂韩国创意厨房高档铝箔防油贴纸...,苏宁,潘尼珂1007008008,厨具|厨房清洗用品|防油贴纸,吉睿JiRui 田园铝箔厨房专用耐高温易清洁防油烟贴纸60*90 颜色随机 十个装,吉睿>吉睿JiRui 田园铝箔厨房专用耐高温易...,京东商城,吉睿家居生活馆1007008008,厨具|厨房清洗用品|防油贴纸,爱满屋AMW四联绿色愤怒的小鸟卡通蛋糕面包翻糖干幕丝模具100%硅胶 正品耐高温烤箱模具,厨具>厨房配件>烘焙/烧烤>爱满屋（amw）>爱满屋AMW四联绿色愤怒的小鸟卡通蛋糕面...,京东商城,爱满屋家居专营店1007008008,厨具|厨房清洗用品|防油贴纸,红兔子 厨房瓷砖贴防油贴纸 耐高温油烟贴铝珀墙贴纸 防水墙贴纸 铝珀灶台贴油烟贴墙贴 八张装 防油贴花色随机发放,家装建材 > 时尚家饰 > 墙壁装饰 > 商品详情,当当网,红兔子1007008008,厨具|厨房清洗用品|防油贴纸,居梦坞 个性厨房卫浴儿童房墙贴DIY小鱼房间背景墙贴 防水装饰墙贴纸 玻璃瓷砖贴 浅蓝,家居家装>家装软饰>墙贴/装饰贴>居梦坞（Dreamwall）>居梦坞 个性厨房卫浴儿童房墙贴DIY小鱼...,京东商城,居梦坞现代家居装饰旗舰店1007008008,厨具|厨房清洗用品|防油贴纸,忆美特雕刻墙贴画 厨房墙贴纸 墙角小花 红色 EH0800112,家居家装>家装软饰>墙贴/装饰贴>忆美特（EMIT）>忆美特雕刻墙贴画 厨房墙贴纸 墙角小花 ...,京东商城,忆美特时尚家饰1007008008,厨具|厨房清洗用品|防油贴纸,韩版厨房防油贴纸厨房贴纸 吸油纸耐高温防油烟贴铝箔墙贴防油纸 D105草原 90*60CM,家居家装>家装软饰>墙贴/装饰贴>其它>韩版厨房防油贴纸厨房贴纸 吸油纸耐高温防...,京东商城,生活演义创意家居1007008008,厨具|厨房清洗用品|防油贴纸,【支持货到付款】馨颜 墙壁厨房装饰清洁防水耐高温防油贴纸格子款60*90cm 春暖花开,家居家装>家装软饰>墙贴/装饰贴>馨颜>【支持货到付款】馨颜 墙壁厨房装饰清洁防...,京东商城,馨颜生活旗舰店1007008008,厨具|厨房清洗用品|防油贴纸,车爱人 汽车贴纸 铝合金低调车贴 铝箔车贴 金属车贴 汽车用品 外饰用品 红色,汽车用品>汽车装饰>功能小件>车爱人（CHE AI REN）>车爱人 汽车贴纸 铝合金低调车贴 铝箔车...,京东商城,车魅影车品专营店1007008008,厨具|厨房清洗用品|防油贴纸,孖堡家居 高档厨房防油贴 铝箔材质耐高温瓷砖墙贴 加厚防水防油烟灶台墙贴 水果蔬菜,所有分类>家居家纺、锅具餐具>装饰/日用>装饰贴>孖堡家居>孖堡家居 高档厨房防...,1号店,孖堡家居1007008008,厨具|厨房清洗用品|防油贴纸,温庭 特大号60*90cm高档铝箔防油纸 灶台厨房贴耐高温 瓷砖贴墙贴 厨房防油贴纸,所有分类>家居家纺、锅具餐具>装饰/日用>装饰贴>温庭>温庭 特大号60*9...,1号店,温庭1007008008,厨具|厨房清洗用品|防油贴纸,温庭 特大号60*90cm耐高温铝箔厨房防油贴纸瓷砖贴防水墙贴油烟机贴纸,所有分类>家居家纺、锅具餐具>装饰/日用>装饰贴>温庭>温庭 特大号60*9...,1号店,温庭1007008008,厨具|厨房清洗用品|防油贴纸,睿酷德 厨房防油贴纸 耐高温防油烟纸贴 装饰墙贴铝箔瓷砖橱柜贴饰纸 玫瑰花瓣,家居日用 > 清洁护理 > 其它 > 商品详情,当当网,睿酷德