1007007008,厨具|茶具、咖啡具|茶宠摆件,三义成仿汝窑汉白禅趣茶玩茶宠十八罗汉 坐鹿罗汉,厨具>茶具/咖啡具>茶宠摆件>三义成>三义成仿汝窑汉白禅趣茶玩茶宠十八罗汉 坐...,京东商城,三义成1007007008,厨具|茶具、咖啡具|茶宠摆件,三义成仿汝窑汉白禅趣茶玩茶宠十八罗汉 欢喜罗汉,厨具>茶具/咖啡具>茶宠摆件>三义成>三义成仿汝窑汉白禅趣茶玩茶宠十八罗汉 欢...,京东商城,三义成1007007008,厨具|茶具、咖啡具|茶宠摆件,三义成禅趣茶玩哥窑十八罗汉 芭蕉罗汉,厨具>茶具/咖啡具>茶宠摆件>三义成>三义成禅趣茶玩哥窑十八罗汉 芭蕉罗汉,京东商城,三义成1007007008,厨具|茶具、咖啡具|茶宠摆件,三义成禅趣茶玩哥窑十八罗汉 挖耳罗汉,厨具>茶具/咖啡具>茶宠摆件>三义成>三义成禅趣茶玩哥窑十八罗汉 挖耳罗汉,京东商城,三义成1007007008,厨具|茶具、咖啡具|茶宠摆件,宁不凡 陶瓷汝窑茶宠摆件精品 功夫茶道配件 茶玩手工可开片汝瓷 牛,厨具>茶具/咖啡具>茶宠摆件>宁不凡 >宁不凡 陶瓷汝窑茶宠摆件精品 功夫茶道配...,京东商城,宁不凡家居旗舰店1007007008,厨具|茶具、咖啡具|茶宠摆件,紫砂茶宠摆件精品茶宠 紫砂小书生全手工超萌茶宠茶玩茶趣工艺摆件T0961 -1407025,家居日用 > 厨房用品 > 水具茶具酒具 > 茶具 > 商品详情,当当网,陶瓷故事1007007008,厨具|茶具、咖啡具|茶宠摆件,精品茶宠摆件恒福祥龙迎福茶宠招财金兔定窑白瓷茶宠茶玩茶趣工艺品摆件生肖礼物-1407018 龙-1407018,家居日用 > 厨房用品 > 水具茶具酒具 > 茶具 > 商品详情,当当网,陶瓷故事1007007008,厨具|茶具、咖啡具|茶宠摆件,紫砂茶宠摆件精品茶宠紫砂送财灵猴全手工超萌茶宠差玩茶趣工艺品摆件T0967-1407020,家装建材 > 时尚家饰 > 摆饰/挂件 > 商品详情,当当网,陶瓷故事1007007008,厨具|茶具、咖啡具|茶宠摆件,淘瓷公社 十八罗汉茶宠摆件 功夫茶具精品玩物 高档茶宠装饰 探手罗汉,厨具>茶具/咖啡具>茶宠摆件>淘瓷公社>淘瓷公社 十八罗汉茶宠摆件 功夫茶具精品...,京东商城,淘瓷公社1007007008,厨具|茶具、咖啡具|茶宠摆件,正品汝窑茶宠 汝瓷茶玩 茶道配件 茶趣 多款式可选 水月观音,厨具>茶具/咖啡具>茶宠摆件>恒家福（hengjiafu）>正品汝窑茶宠 汝瓷茶玩 茶道配件 茶趣 ...,京东商城,恒家福尊韵专卖店1007007008,厨具|茶具、咖啡具|茶宠摆件,瑞恒逸品紫砂茶宠摆件梦想成真,厨具 > 茶具 > 茶具配件 > 茶宠,亚马逊(卓越网),瑞恒逸品1007007008,厨具|茶具、咖啡具|茶宠摆件,黄龙壶缘 宜兴紫砂手工茶宠（小唐僧茶宠摆件）原矿段泥 紫砂精品茶宠摆件,厨具>茶具/咖啡具>茶宠摆件> 黄龙壶缘>黄龙壶缘 宜兴紫砂手工茶宠（小唐僧茶宠摆...,京东商城,黄龙壶缘1007007008,厨具|茶具、咖啡具|茶宠摆件,宁不凡 汝窑茶宠摆件 手工精品茶玩 蓄力待发,厨具>茶具/咖啡具>茶宠摆件> 宁不凡 >宁不凡 汝窑茶宠摆件 手工精品茶玩 蓄力...,京东商城,宁不凡家居旗舰店1007007008,厨具|茶具、咖啡具|茶宠摆件,金蟾蜍金蝉茶玩茶盘摆件变色茶宠功夫茶具套装茶道配件,厨具>茶具/咖啡具>茶宠摆件> 荔江>金蟾蜍金蝉茶玩茶盘摆件变色茶宠功夫茶具套...,京东商城,荔江旗舰店1007007008,厨具|茶具、咖啡具|茶宠摆件,家装节 品茶忆友 宜兴紫砂茶宠拇指青娃顶呱呱茶道用具,厨具>茶具/咖啡具>茶宠摆件> 品茶忆友>家装节 品茶忆友 宜兴紫砂茶宠拇指青娃顶...,京东商城,品茶忆友茶叶旗舰店1007007008,厨具|茶具、咖啡具|茶宠摆件,壶中世界 宜兴紫砂手工茶宠（精品一夜暴富摆件）原矿紫泥 紫砂精品茶宠摆件,厨具>茶具/咖啡具>茶宠摆件> 壶中世界（huzhongshijie）>壶中世界 宜兴紫砂手工茶宠（精品一夜暴富...,京东商城,壶中世界紫砂旗舰店1007007008,厨具|茶具、咖啡具|茶宠摆件,关耳窑 古熏炉铁锈釉茶宠茶趣 茶沫釉香炉 香道茶道mpa020-4AK 一如观音,厨具>茶具/咖啡具>茶宠摆件> 关耳窑>关耳窑 古熏炉铁锈釉茶宠茶趣 茶沫釉香炉...,京东商城,关耳窑旗舰店1007007008,厨具|茶具、咖啡具|茶宠摆件,博度 宜兴紫砂茶宠 小貔貅 招财 茶玩摆件 对貔貅,厨具>茶具/咖啡具>茶宠摆件> 博度 >博度 宜兴紫砂茶宠 小貔貅 招财 茶...,京东商城,博度旗舰店1007007008,厨具|茶具、咖啡具|茶宠摆件,大彬堂 宜兴紫砂 功夫茶具茶宠摆件 刘新华手制 紫泥双鱼香插1461,厨具 > 茶具 > 茶具配件,亚马逊(卓越网),大彬堂1007007008,厨具|茶具、咖啡具|茶宠摆件,大彬堂 功夫茶具 紫砂茶宠摆件 刘新华手制 紫泥挂釉烟缸花盆1553,厨具 > 茶具,亚马逊(卓越网),大彬堂1007007008,厨具|茶具、咖啡具|茶宠摆件,品茶忆友 百年好合茶宠 宜兴紫砂茶玩精品手工茶宠 茶桌茶盘摆件 3,厨具>茶具/咖啡具>茶宠摆件> 品茶忆友>品茶忆友 百年好合茶宠 宜兴紫砂茶玩精品...,京东商城,品茶忆友茶叶旗舰店1007007008,厨具|茶具、咖啡具|茶宠摆件,大彬堂 宜兴紫砂 功夫茶具茶宠摆件 刘新华手制 紫泥樱花香插1462,厨具 > 茶具 > 茶具配件,亚马逊(卓越网),大彬堂1007007008,厨具|茶具、咖啡具|茶宠摆件,锦坤 茶宠摆件 哥窑茶 宠童趣若有所思哥窑茶宠,所有分类>家居家纺、锅具餐具>餐具水具>茶具1>茶宠摆件>锦坤>锦坤 茶宠摆件 哥窑...,1号店,锦坤1007007008,厨具|茶具、咖啡具|茶宠摆件,金玺 汝窑青瓷开片茶圣茶宠摆件 精品汝窑功夫茶具,厨具>茶具/咖啡具>茶宠摆件> 金玺>金玺 汝窑青瓷开片茶圣茶宠摆件 精品汝窑...,京东商城,千彩官方旗舰店1007007008,厨具|茶具、咖啡具|茶宠摆件,大彬堂 宜兴紫砂茶具 茶宠摆件 段泥招财进宝大眼金蟾1615,,亚马逊(卓越网),大彬堂1007007008,厨具|茶具、咖啡具|茶宠摆件,淘瓷公社 十八罗汉茶宠摆件 功夫茶具精品玩物 高档茶宠装饰 挖耳罗汉,厨具>茶具/咖啡具>茶宠摆件> 淘瓷公社>淘瓷公社 十八罗汉茶宠摆件 功夫茶具精品...,京东商城,淘瓷公社1007007008,厨具|茶具、咖啡具|茶宠摆件,汝窑茶宠精品 陶瓷茶具汝瓷茶玩茶宠摆件 打坐小和尚摆件 汝窑 专心一志小和尚茶宠,厨具>茶具/咖啡具>茶宠摆件> 瑞瓷掬（Ruiciju）>汝窑茶宠精品 陶瓷茶具汝瓷茶玩茶宠摆件 ...,京东商城,景德瓷生活馆1007007008,厨具|茶具、咖啡具|茶宠摆件,尚帝 铁锈釉茶宠茶趣 功夫茶具配件 功夫茶玩qyt213-17AK 寿中寿,厨具>茶具/咖啡具>茶宠摆件> 尚帝（shangdi）>尚帝 铁锈釉茶宠茶趣 功夫茶具配件 功夫...,京东商城,尚帝旗舰店1007007008,厨具|茶具、咖啡具|茶宠摆件,礼米 铁锈釉茶宠茶趣 功夫茶具配件 功夫茶玩qyt213-17AK 一心向佛,厨具>茶具/咖啡具>茶宠摆件> 礼米>礼米 铁锈釉茶宠茶趣 功夫茶具配件 功夫...,京东商城,礼米官方旗舰店1007007008,厨具|茶具、咖啡具|茶宠摆件,御茶园 正品茶宠摆件 宜兴紫砂茶宠摆件 侍女茶宠,厨具>茶具/咖啡具>茶宠摆件> 御茶园>御茶园 正品茶宠摆件 宜兴紫砂茶宠摆件 ...,京东商城,御茶园茗茶1007007008,厨具|茶具、咖啡具|茶宠摆件,凌烟阁 宜兴仿古紫砂香炉 熏香炉兽钮檀香炉 盘香塔香 特价包邮 款一,厨具>茶具/咖啡具>茶宠摆件> 凌烟阁（lingyange） >凌烟阁 宜兴仿古紫砂香炉 熏香炉兽钮檀香...,京东商城,凌烟阁茶具专营店1007007008,厨具|茶具、咖啡具|茶宠摆件,盛壶天下 宜兴紫砂茶宠摆件 (描24K金如意马茶宠摆件) 原矿紫泥 手工紫砂壶茶壶茶具雕塑,厨具>茶具/咖啡具>茶宠摆件> 砂海撷英（shahaixieying）>盛壶天下 宜兴紫砂茶宠摆件 (描24K金...,京东商城,砂海撷英旗舰店1007007008,厨具|茶具、咖啡具|茶宠摆件,十二生肖开片汝窑茶宠茶道功夫茶具 陶瓷茶玩工艺品摆件 哥窑 猴,厨具>茶具/咖啡具>茶宠摆件> 品茶忆友>十二生肖开片汝窑茶宠茶道功夫茶具 陶瓷茶...,京东商城,品茶忆友茶叶旗舰店1007007008,厨具|茶具、咖啡具|茶宠摆件,品茶忆友 茶宠葫芦 宜兴紫砂茶宠摆件 精品葫芦茶宠 精致茶具摆件 红色,厨具>茶具/咖啡具>茶宠摆件> 品茶忆友>品茶忆友 茶宠葫芦 宜兴紫砂茶宠摆件 精...,京东商城,品茶忆友茶叶旗舰店1007007008,厨具|茶具、咖啡具|茶宠摆件,宜兴紫砂茶宠茶道摆件 辈辈有福猪 辈辈有财猪,厨具>茶具/咖啡具>茶宠摆件> 茶玩家>宜兴紫砂茶宠茶道摆件 辈辈有福猪 辈辈有...,京东商城,国风豪礼1007007008,厨具|茶具、咖啡具|茶宠摆件,多款可选 陶瓷花插 迷你小花瓶 纯手工制作 现代型礼品 茶道配件 茶玩 办公室花器 三号粉青,厨具>茶具/咖啡具>茶宠摆件> 恒家福（hengjiafu）>多款可选 陶瓷花插 迷你小花瓶 纯手工制...,京东商城,恒家福尊韵专卖店1007007008,厨具|茶具、咖啡具|茶宠摆件,尚帝 陶瓷茶宠 招财童子 哈哈佛 纯手工雕刻彩砂陶茶玩摆件2014WHCC11K (左)招财童子,厨具>茶具/咖啡具>茶宠摆件> 尚帝（shangdi）>尚帝 陶瓷茶宠 招财童子 哈哈佛 纯手工...,京东商城,尚帝旗舰店1007007008,厨具|茶具、咖啡具|茶宠摆件,新款手绘陶瓷杯 薄胎大号青花瓷釉下彩绘品茗杯 主人茶杯茶碗 成蓬结籽 单个茶杯,厨具>茶具/咖啡具>茶宠摆件> 壶安美>新款手绘陶瓷杯 薄胎大号青花瓷釉下彩绘品...,京东商城,祺彤香茶具专营店1007007008,厨具|茶具、咖啡具|茶宠摆件,万新 新寅陶艺 宜兴紫砂壶 高档紫砂摆件 杂玩 【梅花笔筒】,厨具>茶具/咖啡具>茶宠摆件> 万新>万新 新寅陶艺 宜兴紫砂壶 高档紫砂摆件...,京东商城,新寅陶艺1007007008,厨具|茶具、咖啡具|茶宠摆件,【爱壶人】宜兴茶道六君子六件套装 天然竹制六件套 四方茶字款,厨具>茶具/咖啡具>茶宠摆件> 爱壶人>【爱壶人】宜兴茶道六君子六件套装 天然竹...,京东商城,爱壶人紫砂旗舰店1007007008,厨具|茶具、咖啡具|茶宠摆件,唐丰 宜兴紫砂手工茶宠功夫茶具套装配件茶玩摆件车载饰品TF-1655 五虎上将-关羽,厨具>茶具/咖啡具>茶宠摆件> 唐丰>唐丰 宜兴紫砂手工茶宠功夫茶具套装配件茶...,京东商城,唐丰官方旗舰店1007007008,厨具|茶具、咖啡具|茶宠摆件,伴月塘 紫砂茶宠 日常摆件 福娃茶宠 鱼抱娃茶宠 寿桃娃 其他,厨具>茶具/咖啡具>茶宠摆件> 伴月塘 >伴月塘 紫砂茶宠 日常摆件 福娃茶宠...,京东商城,伴月塘茶具家居专营店1007007008,厨具|茶具、咖啡具|茶宠摆件,伴月塘 紫砂茶宠 蔬菜茶宠 蛙哦系列 柿子,厨具>茶具/咖啡具>茶宠摆件> 伴月塘 >伴月塘 紫砂茶宠 蔬菜茶宠 蛙哦系列...,京东商城,伴月塘茶具家居专营店1007007008,厨具|茶具、咖啡具|茶宠摆件,郑品 铁锈釉茶宠茶趣 功夫茶具配件 功夫茶玩qyt213-17AK 平安佛,厨具>茶具/咖啡具>茶宠摆件> 郑品>郑品 铁锈釉茶宠茶趣 功夫茶具配件 功夫...,京东商城,郑品茶具旗舰店1007007008,厨具|茶具、咖啡具|茶宠摆件,礼米 佛道六度沙弥茶宠纯手工雕刻摆件 功夫茶具茶宠 陶瓷茶玩2014WHCC5K 随心,厨具>茶具/咖啡具>茶宠摆件> 礼米>礼米 佛道六度沙弥茶宠纯手工雕刻摆件 功...,京东商城,礼米官方旗舰店1007007008,厨具|茶具、咖啡具|茶宠摆件,伴月塘 紫砂茶宠 日常摆件 神兽茶宠 龙系列 鳞爪龙茶宠,厨具>茶具/咖啡具>茶宠摆件> 伴月塘 >伴月塘 紫砂茶宠 日常摆件 神兽茶宠 ...,京东商城,伴月塘茶具家居专营店1007007008,厨具|茶具、咖啡具|茶宠摆件,尚言坊 功夫茶具香道香炉香器 紫砂彩砂陶祈福静心香炉盘香香座 彩砂陶-静心香炉,厨具>茶具/咖啡具>茶宠摆件> 尚言坊>尚言坊 功夫茶具香道香炉香器 紫砂彩砂陶...,京东商城,尚言坊旗舰店1007007008,厨具|茶具、咖啡具|茶宠摆件,多款可选 汝窑大号花插 汝瓷花器 汝窑花插 陶瓷花瓶 茶道配件 摆件 贰金刚月白,厨具>茶具/咖啡具>茶宠摆件> 丰陶张生>多款可选 汝窑大号花插 汝瓷花器 汝窑花...,京东商城,丰陶张生家居馆1007007008,厨具|茶具、咖啡具|茶宠摆件,多款可选 汝窑大号花插 汝瓷花器 汝窑花插 陶瓷花瓶 茶道配件 摆件 肆金刚天青,厨具>茶具/咖啡具>茶宠摆件> 丰陶张生>多款可选 汝窑大号花插 汝瓷花器 汝窑花...,京东商城,丰陶张生家居馆1007007008,厨具|茶具、咖啡具|茶宠摆件,茶具配件 茶玩摆件 汝瓷工艺品 汝窑茶宠 可养开片 9款 汝窑龙龟,厨具>茶具/咖啡具>茶宠摆件> 圣立>茶具配件 茶玩摆件 汝瓷工艺品 汝窑茶宠...,京东商城,上锦家居专营店1007007008,厨具|茶具、咖啡具|茶宠摆件,中国古代英雄人物摆设三国演义雕塑陶瓷茶宠摆件曹操刘备哥窑款 胸怀天下,厨具>茶具/咖啡具>茶宠摆件> 圣立>中国古代英雄人物摆设三国演义雕塑陶瓷茶宠...,京东商城,上锦家居专营店1007007008,厨具|茶具、咖啡具|茶宠摆件,中国古代英雄人物摆设三国演义雕塑陶瓷茶宠摆件曹操刘备哥窑款 诸葛亮,厨具>茶具/咖啡具>茶宠摆件> 圣立>中国古代英雄人物摆设三国演义雕塑陶瓷茶宠...,京东商城,上锦家居专营店1007007008,厨具|茶具、咖啡具|茶宠摆件,多款式可选 正品汝窑花插 陶瓷茶瓶 日式花器 创意家居摆件 茶道配件 肆金刚天青,厨具>茶具/咖啡具>茶宠摆件> 恒家福（hengjiafu）>多款式可选 正品汝窑花插 陶瓷茶瓶 日式...,京东商城,恒家福尊韵专卖店1007007008,厨具|茶具、咖啡具|茶宠摆件,精品全手工紫砂茶宠摆件 开片哥窑喷水撒尿童子 创意可爱小牛娃娃 喜牛,厨具>茶具/咖啡具>茶宠摆件> 工尚坊>精品全手工紫砂茶宠摆件 开片哥窑喷水撒尿...,京东商城,凯雅家居专营店1007007008,厨具|茶具、咖啡具|茶宠摆件,工尚坊精品全手工紫砂茶宠摆件 开片哥窑喷水撒尿童子 创意可爱 宜兴陶土紫砂 撒尿童 童趣二,厨具>茶具/咖啡具>茶宠摆件> 工尚坊>工尚坊精品全手工紫砂茶宠摆件 开片哥窑喷...,京东商城,凯雅家居专营店1007007008,厨具|茶具、咖啡具|茶宠摆件,怡品堂茶具 茶宠功夫茶具茶道摆件手工玩宠 汝窑开片 读书小和尚,厨具>茶具/咖啡具>茶宠摆件> 怡品堂>怡品堂茶具 茶宠功夫茶具茶道摆件手工玩宠...,京东商城,怡品堂1007007008,厨具|茶具、咖啡具|茶宠摆件,君肴 李白醉酒 茶宠摆件 汉白汝窑 开片 可养,家居日用>茶具>君肴>君肴 李白醉酒 茶宠摆件 汉白汝窑 开片 可养,国美电器网上商城,君肴1007007008,厨具|茶具、咖啡具|茶宠摆件,君肴 汉白汝窑 茶宠摆件 乡仕正品 三国人物 关羽,家居日用>茶具>君肴>君肴 汉白汝窑 茶宠摆件 乡仕正品 三国人物 关羽,国美电器网上商城,君肴1007007008,厨具|茶具、咖啡具|茶宠摆件,君肴 茶宠摆件 哥窑 刘备 三国人物 刘关张 桃园结义,家居日用>茶具>君肴>君肴 茶宠摆件 哥窑 刘备 三国人物 刘关张 桃园结义,国美电器网上商城,君肴1007007008,厨具|茶具、咖啡具|茶宠摆件,万仟堂 茶宠 陶瓷 精品茶玩 茶具摆件配件周边 茶鹰,厨具>茶具/咖啡具>茶宠摆件> 万仟堂（Edenus） >万仟堂 茶宠 陶瓷 精品茶玩 茶具摆件配...,京东商城,万仟堂旗舰店1007007008,厨具|茶具、咖啡具|茶宠摆件,嘉斯佰特 紫砂石磨紫砂壶托茶壶垫雕塑茶宠杂件茶盘磨盘宜兴正品,厨具>茶具/咖啡具>茶宠摆件> 嘉斯佰特>嘉斯佰特 紫砂石磨紫砂壶托茶壶垫雕塑茶宠...,京东商城,嘉斯佰特官方旗舰店1007007008,厨具|茶具、咖啡具|茶宠摆件,大彬堂 宜兴紫砂摆件 刘新华作品 全手工原创茶宠尊者之十五1673,所有分类>家居家纺、锅具餐具>餐具水具>茶具1>茶宠摆件>大彬堂>大彬堂 宜兴紫砂摆件...,1号店,大彬堂1007007008,厨具|茶具、咖啡具|茶宠摆件,祥福茶具 茶宠精品 陶瓷茶宠摆件 十二生肖茶宠茶具摆件 茶宠猪牛马羊 茶宠 马,厨具>茶具/咖啡具>茶宠摆件> 祥福>祥福茶具 茶宠精品 陶瓷茶宠摆件 十二生...,京东商城,祥福官方旗舰店1007007008,厨具|茶具、咖啡具|茶宠摆件,祥福茶具 茶宠精品 陶瓷茶宠摆件 十二生肖茶宠茶具摆件 茶宠猪牛马羊 茶宠 碗沙弥,厨具>茶具/咖啡具>茶宠摆件> 祥福>祥福茶具 茶宠精品 陶瓷茶宠摆件 十二生...,京东商城,祥福官方旗舰店1007007008,厨具|茶具、咖啡具|茶宠摆件,友乐礼 功夫茶具汝窑茶宠精品 陶瓷茶具 紫砂茶滤 茶漏斗过滤网架 青十全,厨具>茶具/咖啡具>茶宠摆件> 友乐礼>友乐礼 功夫茶具汝窑茶宠精品 陶瓷茶具 ...,京东商城,友乐礼家居专营店1007007008,厨具|茶具、咖啡具|茶宠摆件,多款可选 正品宜兴紫砂茶宠 茶道配件 功夫茶具摆件 祈福茶宠黄,厨具>茶具/咖啡具>茶宠摆件> 恒家福（hengjiafu）>多款可选 正品宜兴紫砂茶宠 茶道配件 功...,京东商城,恒家福尊韵专卖店1007007008,厨具|茶具、咖啡具|茶宠摆件,三义成宜兴原矿紫砂茶宠国家级助理工艺美术师陈祖勇作品枇杷童子,厨具>茶具/咖啡具>茶宠摆件> 三义成>三义成宜兴原矿紫砂茶宠国家级助理工艺美术...,京东商城,三义成1007007008,厨具|茶具、咖啡具|茶宠摆件,郑品 佛道六度沙弥茶宠纯手工雕刻摆件 功夫茶具茶宠 陶瓷茶玩2014WHCC5K 随缘,厨具>茶具/咖啡具>茶宠摆件> 郑品>郑品 佛道六度沙弥茶宠纯手工雕刻摆件 功...,京东商城,郑品茶具旗舰店1007007008,厨具|茶具、咖啡具|茶宠摆件,三义成曲阳定窑摆件可爱十二生肖 虎,厨具>茶具/咖啡具>茶宠摆件> 三义成>三义成曲阳定窑摆件可爱十二生肖 虎,京东商城,三义成1007007008,厨具|茶具、咖啡具|茶宠摆件,尊儒 汝窑兔子可养开片汝窑茶宠摆件 精品汝瓷工艺品 陶瓷玉兔汝,首页>家居/家装建材/厨具>餐厨用具>茶具>尊儒汝窑兔子可养开片汝窑茶宠摆件...,苏宁,尊儒1007007008,厨具|茶具、咖啡具|茶宠摆件,【东亚紫砂】精品手工宜兴紫砂茶宠摆件茶具 拉毛趴趴小狗 三色选(灰色 小号),家居日用>茶具>爱壶人茶具>【东亚紫砂】精品手工宜兴紫砂茶宠摆件茶具 拉毛趴趴小狗 三色选(灰色 小号),国美电器网上商城,爱壶人茶具1007007008,厨具|茶具、咖啡具|茶宠摆件,唐丰 茶具 哥窑茶宠 开片茶宠 陶瓷 哥窑茶宠精品 多选择TF-1080,所有分类>家居家纺、锅具餐具>餐具水具>茶具1>茶宠摆件>唐丰>唐丰 茶具 哥窑茶宠 开片茶宠 陶瓷 哥窑茶宠精品 多选择TF-1080,1号店,唐丰1007007008,厨具|茶具、咖啡具|茶宠摆件,德化商城 龙鹏 茶具茶道零配 哥窑茶宠摆件 功夫茶具配件 可开片茶宠精品(欢天),家居日用>茶具>龙鹏茶具>德化商城 龙鹏 茶具茶道零配 哥窑茶宠摆件 功夫茶具配件 可开片茶宠精品(欢天),国美电器网上商城,龙鹏茶具1007007008,厨具|茶具、咖啡具|茶宠摆件,【东亚紫砂】宜兴紫砂 精品茶宠摆件 福禄双喜小和尚 心想事成(葫芦小和尚),家居日用>茶具>爱壶人茶具>【东亚紫砂】宜兴紫砂 精品茶宠摆件 福禄双喜小和尚 心想事成(葫芦小和尚),国美电器网上商城,爱壶人茶具1007007008,厨具|茶具、咖啡具|茶宠摆件,关耳窑 非洲黑檀木雕福禄寿报喜 家居风水摆件 茶宠摆件 工艺品 2014MDFL(禄星报喜),家居日用>茶具>关耳窑茶具>关耳窑 非洲黑檀木雕福禄寿报喜 家居风水摆件 茶宠摆件 工艺品 2014MDFL(禄星报喜),国美电器网上商城,关耳窑茶具1007007008,厨具|茶具、咖啡具|茶宠摆件,郑品 新款月白茶宠 茶道摆件 功夫茶具茶宠 多款月白茶宠摆件 DP-RYYBCC12K,所有分类>家居家纺、锅具餐具>餐具水具>茶具1>茶宠摆件>郑品,1号店,茶宠摆件