1015006007,母婴童|童车童床|三轮车,炫梦奇儿童二轮滑板车 脚踏车 成人滑板车 可折叠,玩具 > 童车出行 > 儿童滑板车 > 商品详情,当当网,炫梦奇
1015006007,母婴童|童车童床|三轮车,出口欧美CHIC儿童手推三轮车自行车 多功能宝宝手推车 小孩脚踏车 婴儿童车 (发泡轮-红色),母婴用品 > 童车、推车 > 三轮推车伞车 > 推车,亚马逊(卓越网),CHIC
1015006007,母婴童|童车童床|三轮车,Goodbaby 好孩子 多功能双向推杆可平躺婴儿手推车A516 送蚊帐 半蓬 红色A516G-K025,运动户外休闲 > 自行车,亚马逊(卓越网),goodbaby 好孩子
1015006007,母婴童|童车童床|三轮车,HAPPY 小龙哈彼超宽大全蓬婴儿手推车可平躺LA503H 红色LA503H-K213,运动户外休闲 > 自行车,亚马逊(卓越网),HAPPY
1015006007,母婴童|童车童床|三轮车,舒贝乐 SHUBEILE 儿童三轮车/宝宝自行车/脚踏车,所有分类>母婴用品、玩具>童车/床/汽座>三轮车>舒贝乐 SHUBEILE>舒贝乐 SHUBEI...,1号店,舒贝乐 SHUBEILE
1015006007,母婴童|童车童床|三轮车,小龙哈彼 多功能儿童三轮车 LSR401R-W-,所有分类>母婴用品、玩具>童车/床/汽座>三轮车>小龙哈彼>小龙哈彼 多功能儿童...,1号店,小龙哈彼
1015006007,母婴童|童车童床|三轮车,SUNCOLOR 圣卡洛 新型高级儿童三轮滑板车,玩具 > 童车、助步、轮滑 > 三轮车 玩具 > 童车、助步、轮滑 > 滑板车,亚马逊(卓越网),SUNCOLOR 圣卡洛
1015006007,母婴童|童车童床|三轮车,儿童三轮车 宝宝手推车 脚踏车自行车 儿童三轮手推车 出门必备 红色,玩具乐器>适用年龄>3-6岁> 世海玩具（SHIHAI）>儿童三轮车 宝宝手推车 脚踏车自行车 儿...,京东商城,童乐园
1015006007,母婴童|童车童床|三轮车,卡优比儿童三轮车 脚踏车手推车自行车带护栏童车 飘逸白色带伞,其他 > 其他,亚马逊(卓越网),卡优比
1015006007,母婴童|童车童床|三轮车,MamaKids婴儿脚踏车 儿童三轮车 婴儿车儿童儿童车 脚踏车带安全带 粉,母婴>童车童床>三轮车> mamakids>MamaKids婴儿脚踏车 儿童三轮车 ...,京东商城,mamakids母婴官方旗舰店
1015006007,母婴童|童车童床|三轮车,日本MINI儿童三轮车脚踏车童车室内户外三轮车 红色,母婴>童车童床>三轮车>IDES>日本MINI儿童三轮车脚踏车童车室内户外...,京东商城,浩贝佳母婴专营店
1015006007,母婴童|童车童床|三轮车,儿童三轮车 宝宝三轮车 多功能三轮 贝多福四合一三轮 黄色,母婴>童车童床>三轮车> 贝多福>儿童三轮车 宝宝三轮车 多功能三轮 贝多...,京东商城,酷贝童车专营店
1015006007,母婴童|童车童床|三轮车,出口欧美CHIC儿童手推三轮车自行车 多功能宝宝手推车 小孩脚踏车 婴儿童车 发泡轮-粉色,母婴>童车童床>三轮车>IDES>出口欧美CHIC儿童手推三轮车自行车 多...,京东商城,浩贝佳母婴专营店
1015006007,母婴童|童车童床|三轮车,出口韩国CHIC儿童手推三轮车自行车 多功能宝宝手推车 小孩脚踏车 婴儿童车 发泡轮绿色,母婴>童车童床>三轮车>GREAT>出口韩国CHIC儿童手推三轮车自行车 多...,京东商城,禹光孕婴童生活馆
1015006007,母婴童|童车童床|三轮车,宝宝好 豪华儿童三轮车 宝宝脚踏车婴儿车手推车三轮自行车TC6609-0016 天蓝色,母婴>童车童床>三轮车>孩子王>宝宝好 豪华儿童三轮车 宝宝脚踏车婴儿车...,京东商城,乐美母婴生活馆
1015006007,母婴童|童车童床|三轮车,台湾原装进口 WEPLAY幼儿园玩具 三轮车旋风车脚踏车WJ6625-0034,母婴>童车童床>三轮车> 七色花>台湾原装进口 WEPLAY幼儿园玩具 三...,京东商城,乐美母婴生活馆
1015006007,母婴童|童车童床|三轮车,小虎子童车儿童三轮车脚踏车高档充气轮胎手推车骑行车950 海洋蓝,母婴>童车童床>三轮车> 小虎子>小虎子童车儿童三轮车脚踏车高档充气轮胎手...,京东商城,可为母婴专营店
1015006007,母婴童|童车童床|三轮车,小丽明 125mm大气PU闪光轮 全铝豪华闪光踏板带音乐 三轮滑板车 红色,母婴>童车童床>扭扭车>小丽明>小丽明 125mm大气PU闪光轮 全铝豪...,京东商城,乐美母婴生活馆
1015006007,母婴童|童车童床|三轮车,货到付款 炫梦奇三轮闪光滑板车 脚踏车蛙式车 可折叠高度可调节 蓝色豪华版,母婴>童车童床>滑板车>炫梦奇>货到付款 炫梦奇三轮闪光滑板车 脚踏车蛙...,京东商城,炫梦奇专营店
1015006007,母婴童|童车童床|三轮车,XIXIBAOBAO儿童滑板车 玩具童车 扭扭车 踏板车 脚踏车 三轮闪光减震 大减震款 蓝色,母婴>童车童床>滑板车> 嬉戏宝宝>XIXIBAOBAO儿童滑板车 玩具童车...,京东商城,乐鹏母婴专营店
1015006007,母婴童|童车童床|三轮车,LUCKYTED 优动儿童蛙式滑板车儿童 滑板车 闪光双后刹蛙式车三轮车童车玩具 豪华款小号粉红色,玩具乐器>适用年龄>6-14岁> luckyted>LUCKYTED 优动儿童蛙式滑板车儿童...,京东商城,luckyted玩具城
1015006007,母婴童|童车童床|三轮车,XIXIBAOBAO儿童滑板车 玩具童车 扭扭车 踏板车 脚踏车 三轮闪光减震,母婴>童车童床>滑板车> 嬉戏宝宝>XIXIBAOBAO儿童滑板车 玩具童车...,京东商城,乐鹏母婴专营店
1015006007,母婴童|童车童床|三轮车,正版欧标 滑板车 儿童 三轮车 双踏车 儿童脚踏车 踏踏车 叭叭跑 粉色 小号83厘米,玩具乐器>健身玩具>户外玩具> 图图玩国 >正版欧标 滑板车 儿童 三轮车 双踏车 ...,京东商城,优舒美
1015006007,母婴童|童车童床|三轮车,正版森贝儿家族 熊宝宝三轮车 兔宝宝木马 狗宝宝弹簧木马33428,玩具 > 娃娃玩具 > 过家家玩具 > 正版森贝儿家族 熊宝宝三轮车 兔宝宝木马 狗宝宝弹簧木马33428,当当网,森贝儿
1015006007,母婴童|童车童床|三轮车,欧洲儿童三轮脚踏车 三轮车 伞车 自行车,首页>母婴>童车童床>婴儿车>三轮车>欧洲儿童三轮脚踏车三轮车伞车自...,苏宁,child care
1015006007,母婴童|童车童床|三轮车,出口欧洲儿童三轮脚踏车 三轮车 伞车 自行车 清湖蓝,首页>母婴>童车童床>婴儿车>三轮车>出口欧洲儿童三轮脚踏车三轮车伞车...,苏宁,child care
1015006007,母婴童|童车童床|三轮车,小龙哈彼 多功能三轮车 LSR808R 深卡其布色,所有分类>母婴用品、玩具>童车/床/汽座>三轮车>小龙哈彼>小龙哈彼 多功能三轮...,1号店,小龙哈彼
1015006007,母婴童|童车童床|三轮车,儿童三轮车婴儿手推车宝宝脚踏车自行车多功能童车玩具可调节座椅 绿色,玩具乐器>健身玩具>户外玩具> 灿成（CANCHN）>儿童三轮车婴儿手推车宝宝脚踏车自行车多功...,京东商城,美娃母婴专营店
1015006007,母婴童|童车童床|三轮车,正品 SIRDAR/萨达儿童米高滑板车 PU三轮车冲浪滑板车 玩具车米高车 天空蓝,首页>>>极限运动>正品SIRDAR/萨达儿童米高滑板...,苏宁,SIRDAR/萨达
1015006007,母婴童|童车童床|三轮车,好孩子儿童三轮车 宝宝脚踏车手推童车goodbaby婴儿自行车SR800R-M004D,首页>母婴>童车童床>婴儿车>三轮车>好孩子儿童三轮车宝宝脚踏车手推童车...,苏宁,好孩子
1015006007,母婴童|童车童床|三轮车,Goodbaby/好孩子 迪斯尼卡通摇马三轮车 SR86R-,所有分类>母婴用品、玩具>童车/床/汽座>三轮车>Goodbaby/好孩子,1号店,三轮车
1015006007,母婴童|童车童床|三轮车,货到付款 艾威 健身车 磁控立式 家用静音减肥健身自行车脚踏车BC6750,运动户外 > 健身器械 > 健身车 > 商品详情,当当网,艾威
1015006007,母婴童|童车童床|三轮车,嘉乐 早教玩具 脚踩童车 386,玩具 > 童车出行 > 儿童三轮车 > 商品详情,当当网,嘉乐
1015006007,母婴童|童车童床|三轮车,锐骑（RAYCH）R30 单速不倒翁三轮车（非变速） 黑色,运动健康>运动器械>骑行运动>锐骑（raych）>锐骑（RAYCH）R30 单速不倒翁三轮...,京东商城,RAYCH锐骑单车
1015006007,母婴童|童车童床|三轮车,【贝之家】新款儿童三轮车 脚踏车 两用童车 带推柄 DR818粉色,母婴>童车童床>三轮车>贝之家>【贝之家】新款儿童三轮车 脚踏车 两用童...,京东商城,贝之家官方旗舰店
1015006007,母婴童|童车童床|三轮车,小虎子（little Tiger)701款（六色糖果色）儿童学步滑行童车 黄色,母婴>童车童床>三轮车>小虎子>小虎子（little Tiger)701...,京东商城,小虎子旗舰店
1015006007,母婴童|童车童床|三轮车,正润IDES-NBT带后置物篮三轮车 ZR0036,母婴>童车童床>健身车>正润IDES-NBT带后置物篮三轮车 Z...,京东商城,买道母婴用品
1015006007,母婴童|童车童床|三轮车,小虎子童车*豪华版Pororo韩国企鹅玩具童车 儿童手推脚踏车三轮车 蓝色,母婴>童车童床>三轮车>小虎子童车*豪华版Pororo韩国企鹅玩...,京东商城,小虎子旗舰店
1015006007,母婴童|童车童床|三轮车,贝迪乐 全铝 新型折叠 全铝 PU激光轮 三轮滑板车支持货到付款,当当网 > 运动户外 > 户外用品 > 极限运动系列 > 轮滑系列,当当网,红兔子
1015006007,母婴童|童车童床|三轮车,小虎子（Little Tiger)6811 带离合器 手推脚踏多功能儿童三轮车 红黑色,母婴>童车童床>三轮车>小虎子>小虎子（Little Tiger)681...,京东商城,小虎子旗舰店
1015006007,母婴童|童车童床|三轮车,瑞士米高micro Mini迷你小童三轮滑板车 水蓝MM00022,运动健康>运动器械>极限轮滑>瑞士米高micro Mini迷你小童三轮...,京东商城,米高体育专营店
1015006007,母婴童|童车童床|三轮车,小泰克/little tikes 609169 可爱长颈鹿脚踏车 骑行车,母婴>童车童床>健身车>小泰克/little tikes 609...,京东商城,奇奇玩具
1015006007,母婴童|童车童床|三轮车,贝迪乐 全铝 新型折叠 全铝 PU激光轮 三轮滑板车,当当网 > 运动户外 > 户外用品 > 极限运动系列 > 轮滑系列,当当网,暖宝宝
1015006007,母婴童|童车童床|三轮车,Goodbaby 好孩子 三轮车 SR49S-H301D,玩具 > 童车出行 > 儿童三轮车 > 商品详情,当当网,Goodbaby 好孩子
1015006007,母婴童|童车童床|三轮车,川公子拖斗三轮车583,首页 > 车床椅/寝具 > 童车,母婴之家,川公子
1015006007,母婴童|童车童床|三轮车,小丽明滑板车XLM-2005音乐+闪灯全铝三轮滑板车,运动户外 > 运动器材 > 轮滑运动 > 商品详情,当当网,小丽明
1015006007,母婴童|童车童床|三轮车,托马斯 三轮滑板车4532,所有分类 > 母婴用品、玩具 > 童车/床/汽座 > 自行车 > 托马斯和朋友,1号店,
1015006007,母婴童|童车童床|三轮车,KIDDIE LAND 童梦园 迪士尼反斗车王三轮车 039404,玩具 > 童车、助步、轮滑 > 三轮车,亚马逊(卓越网),KIDDIE LAND 童梦园
1015006007,母婴童|童车童床|三轮车,GREAT奥特曼发光三轮滑板车,玩具 > 童车、助步、轮滑 > 三轮车,亚马逊(卓越网),GREAT
1015006007,母婴童|童车童床|三轮车,格灵童烤漆儿童三轮车钢架童车宝宝脚踏车自行车 白色标配+刹车+护栏,母婴>童车童床>三轮车>格灵童>格灵童烤漆儿童三轮车钢架童车宝宝脚踏车自...,京东商城,好又多母婴专营店
1015006007,母婴童|童车童床|三轮车,爱亲亲 儿童三轮车脚踏车 宝宝自行车玩具,玩具乐器>健身玩具>户外玩具>爱亲亲>爱亲亲 儿童三轮车脚踏车 宝宝自行车玩具,京东商城,亲亲玩具旗舰店
1015006007,母婴童|童车童床|三轮车,小虎子 脚踏车童车手推车自行车三轮 802,所有分类>母婴用品、玩具>童车/床/汽座>童车/儿童轮滑>儿童自行车>小虎子>小虎子 脚踏车童车手...,1号店,小虎子
1015006007,母婴童|童车童床|三轮车,Goodbaby/好孩子儿童宝宝三轮车/脚踏车SR44R F308蓝色,母婴>童车童床>三轮车>好孩子（Goodbaby）>Goodbaby/好孩子儿童宝宝三轮车/...,京东商城,好孩子童车专卖店
1015006007,母婴童|童车童床|三轮车,格灵童钢架儿童三轮车脚踏车幼儿自行车 蓝色,母婴>童车童床>三轮车>格灵童钢架儿童三轮车脚踏车幼儿自行车 蓝...,京东商城,好又多母婴专营店
1015006007,母婴童|童车童床|三轮车,乐卡儿童三轮车儿童脚踏车 婴儿车儿童车T301/T302 T305大气红903玫瑰红,母婴>童车童床>三轮车>乐卡（Lecoco）>乐卡儿童三轮车儿童脚踏车 婴儿车儿童车T...,京东商城,Lecoco乐卡旗舰店
1015006007,母婴童|童车童床|三轮车,QQ太郎 儿童三轮车 三轮童车 儿童车 珍珠白粉A款,运动健康>运动器械>骑行运动>QQ太郎>QQ太郎 儿童三轮车 三轮童车 儿童车 ...,京东商城,QQ太郎旗舰店
1015006007,母婴童|童车童床|三轮车,QQ太郎 新品儿童三轮踏板滑板玩具车 YT6506-0011,母婴>童车童床>三轮车>QQ太郎 新品儿童三轮踏板滑板玩具车 Y...,京东商城,POSCN官方旗舰店
1015006007,母婴童|童车童床|三轮车,POSCN QQ太郎 儿童三轮车宝宝脚踏车婴儿自行车小孩童车 宝石蓝D款,母婴>童车童床>三轮车>POSCN QQ太郎 儿童三轮车宝宝脚踏...,京东商城,POSCN官方旗舰店
1015006007,母婴童|童车童床|三轮车,恒泰三轮自行车 儿童三轮车 宝宝人力车 超酷三轮脚踏车5311 蓝色,玩具乐器>适用年龄>3-6岁>恒泰三轮自行车 儿童三轮车 宝宝人力车 ...,京东商城,竹马玩具汇
1015006007,母婴童|童车童床|三轮车,灿成童车双胞胎双人双座儿童三轮脚踏双座宝宝三轮车 中国红,母婴>童车童床>三轮车> 灿成（CANCHN）>灿成童车双胞胎双人双座儿童三轮脚踏双座宝...,京东商城,灿成旗舰店
1015006007,母婴童|童车童床|三轮车,嘻嘻宝宝 铁宽板激光三轮儿童滑板车 闪光轮 童车 玩具 三轮车滑滑车305,玩具/类别/童车、助步、轮滑/三轮车,亚马逊(卓越网),嘻嘻宝宝
1015006007,母婴童|童车童床|三轮车,琪安特 儿童三轮车脚踏车 婴儿宝宝手推儿童车 蓝色有护栏有棚实心轮,母婴>童车童床>三轮车>琪安特>琪安特 儿童三轮车脚踏车 婴儿宝宝手推儿...,京东商城,迪比乐母婴专营店
1015006007,母婴童|童车童床|三轮车,格灵童钢架儿童三轮车脚踏车幼儿自行车 白色,母婴>童车童床>三轮车>格灵童钢架儿童三轮车脚踏车幼儿自行车 白...,京东商城,好又多母婴专营店
1015006007,母婴童|童车童床|三轮车,舒贝乐305儿童三轮车 宝宝脚踏车 多首炫彩闪光音乐 绿色,母婴>童车童床>三轮车>舒贝乐>舒贝乐305儿童三轮车 宝宝脚踏车 多首...,京东商城,宝宝乐
1015006007,母婴童|童车童床|三轮车,好孩子--维尼钟三轮车SR66R-F302-[满299-60 先领券后下单],母婴>童车童床>三轮车>好孩子--维尼钟三轮车SR66R-F30...,京东商城,乐友孕婴童
1015006007,母婴童|童车童床|三轮车,canchn灿成童车儿童三轮车脚踏车宝宝三轮手推车孩儿童自行车,母婴>童车童床>三轮车>canchn灿成童车儿童三轮车脚踏车宝宝...,京东商城,灿成旗舰店
1015006007,母婴童|童车童床|三轮车,QQ太郎 儿童铝合金带闪光轮带刹车三轮滑板车 YT6506-0001 A款双子座,母婴>童车童床>三轮车>QQ太郎 儿童铝合金带闪光轮带刹车三轮滑...,京东商城,POSCN官方旗舰店
1015006007,母婴童|童车童床|三轮车,goodbaby 好孩子 儿童宝宝三轮车/脚踏车SR44R-F308/J201D 红色（SR44R-J201D）,婴儿用品,亚马逊(卓越网),goodbaby 好孩子
1015006007,母婴童|童车童床|三轮车,goodbaby 好孩子 儿童宝宝三轮车/脚踏车SR44R-F308/J201D 蓝色（SR44R-F308）,婴儿用品,亚马逊(卓越网),goodbaby 好孩子
1015006007,母婴童|童车童床|三轮车,乐卡儿童三轮车脚踏车儿童车T301/T302 T302纪念版大气红,母婴>童车童床>三轮车> 乐卡（Lecoco）>乐卡儿童三轮车脚踏车儿童车T301/T3...,京东商城,Lecoco乐卡旗舰店
1015006007,母婴童|童车童床|三轮车,托马斯音乐盒三轮滑板车D04429,首页>母婴>童车童床>婴儿车>健身车>托马斯音乐盒三轮滑板车D04429,苏宁,托马斯
1015006007,母婴童|童车童床|三轮车,艾威BC6760立式磁控健身车 家用自行车 静音心率脚踏车 健身器材理疗康复适全老年人用,运动健康>运动器械>健身器械>艾威BC6760立式磁控健身车 家用自行...,京东商城,感动运动专营店
1015006007,母婴童|童车童床|三轮车,小丽明PU闪光轮滑板车XLM-2009AS儿童三轮车小孩童车 宝宝滑板车 蓝色,玩具乐器>健身玩具>户外玩具>小丽明>小丽明PU闪光轮滑板车XLM-2009A...,京东商城,金色童年玩具专营店
1015006007,母婴童|童车童床|三轮车,POSCN QQ太郎 三轮滑板车铝合金儿童车带闪光轮带刹车 A款双鱼座,母婴>童车童床>三轮车>POSCN QQ太郎 三轮滑板车铝合金儿...,京东商城,POSCN官方旗舰店
1015006007,母婴童|童车童床|三轮车,POSCN QQ太郎新品儿童三轮车宝宝脚踏车 婴儿自行车小孩童车 粉色C款,母婴>童车童床>三轮车>POSCN QQ太郎新品儿童三轮车宝宝脚...,京东商城,POSCN官方旗舰店
1015006007,母婴童|童车童床|三轮车,格灵童三轮车万向太阳伞 红色,母婴>童车童床>三轮车>格灵童三轮车万向太阳伞 红色,京东商城,好又多母婴专营店
1015006007,母婴童|童车童床|三轮车,GREAT迪迦奥特曼三轮车ZR0018,母婴>童车童床>三轮车>GREAT迪迦奥特曼三轮车ZR0018,京东商城,买道官方旗舰店
1015006007,母婴童|童车童床|三轮车,全网最全配置豪华烤塑款 儿童三轮车宝宝脚踏手推车小孩子婴幼儿童车自行车 烤塑蓝祼车(不含刹车及其他配件),母婴>童车童床>三轮车>格灵童>全网最全配置豪华烤塑款 儿童三轮车宝宝脚...,京东商城,贝贝旗舰店
1015006007,母婴童|童车童床|三轮车,格灵童烤漆顶级配置儿童三轮车宝宝童车男孩脚踏车小孩自行车婴儿车幼儿手推车 女孩 55,母婴>童车童床>三轮车>格灵童>格灵童烤漆顶级配置儿童三轮车宝宝童车男孩...,京东商城,贝贝旗舰店
1015006007,母婴童|童车童床|三轮车,瑞士米高T把三轮滑板车 可折叠,玩具乐器>健身玩具>户外玩具>米高（micro）>瑞士米高T把三轮滑板车 可折叠,京东商城,瑞士micro官方旗舰店
1015006007,母婴童|童车童床|三轮车,瑞士米高micro MMaxi M0019大童三轮滑板车 粉色,运动健康>运动器械>极限轮滑>米高（micro）>瑞士米高micro MMaxi M001...,京东商城,米高体育专营店
1015006007,母婴童|童车童床|三轮车,POSCN QQ太郎新品儿童三轮车宝宝脚踏车 婴儿自行车小孩童车 白标蓝A款,母婴>童车童床>三轮车>POSCN QQ太郎新品儿童三轮车宝宝脚...,京东商城,POSCN官方旗舰店
1015006007,母婴童|童车童床|三轮车,家中宝多功能T305三轮车红色,玩具 > 童车、助步、轮滑 > 三轮车,亚马逊(卓越网),家中宝
1015006007,母婴童|童车童床|三轮车,Happydino 小龙哈彼 三轮车LSR602R-G207 好孩子旗下品牌,玩具 > 童车、助步、轮滑 > 三轮车,亚马逊(卓越网),Happydino 小龙哈彼
1015006007,母婴童|童车童床|三轮车,舒贝乐儿童三轮车 宝宝脚踏车 童车 婴儿三轮车自行车 好孩子童车 粉红色,母婴>童车童床>三轮车>舒贝乐儿童三轮车 宝宝脚踏车 童车 婴儿...,京东商城,宝宝乐
1015006007,母婴童|童车童床|三轮车,POSCN POSCN 儿童滑板车 三轮车 全铝闪光 YT6506-0043 A款狮子座,母婴>童车童床>健身车>POSCN>POSCN POSCN 儿童滑板车 三轮...,京东商城,POSCN官方旗舰店
1015006007,母婴童|童车童床|三轮车,Goodbaby/好孩子滑板车 迪斯尼音乐玩具/脚踩刹车/车把可调 SC30-J103D,母婴>童车童床>三轮车>Goodbaby/好孩子滑板车 迪斯尼音...,京东商城,永盛华远母婴专营店
1015006007,母婴童|童车童床|三轮车,Lecoco乐卡旗舰店1元补差价专用 补运费,母婴>童车童床>三轮车>Lecoco>Lecoco乐卡旗舰店1元补差价专用 补...,京东商城,Lecoco乐卡旗舰店
1015006007,母婴童|童车童床|三轮车,恒泰童车 三轮车脚踏车儿童自行车色彩鲜艳大礼盒装 5310 三轮脚踏车橘红,玩具乐器>遥控/电动>遥控船>恒泰>恒泰童车 三轮车脚踏车儿童自行车色彩鲜艳...,京东商城,福福玩具
1015006007,母婴童|童车童床|三轮车,小人类 三轮车自行车 多功能儿童手推脚踏车/ 带护拦与手推杆 613Q 玫瑰粉,母婴>童车童床>三轮车>小人类>小人类 三轮车自行车 多功能儿童手推...,京东商城,骅舜童婴旗舰店
1015006007,母婴童|童车童床|三轮车,POSCN 儿童蛙式滑板车双后刹三轮车活力车扭扭车 YT6535-0030 升级版大号粉红色,母婴>童车童床>健身车>POSCN>POSCN 儿童蛙式滑板车双后刹三轮车活...,京东商城,
1015006007,母婴童|童车童床|三轮车,POSCN 双后刹减震蛙式滑板车儿童三轮车滑板车童车 YT6535-0031 蓝色,母婴>童车童床>健身车>POSCN>POSCN 双后刹减震蛙式滑板车儿童三轮...,京东商城,POSCN官方旗舰店
1015006007,母婴童|童车童床|三轮车,POSCN 儿童滑板车蛙式扭扭车三轮车带刹车漂移车大号 YT6535-0037 黑色,母婴>童车童床>健身车>POSCN 儿童滑板车蛙式扭扭车三轮车带...,京东商城,POSCN官方旗舰店
1015006007,母婴童|童车童床|三轮车,POSCN 儿童滑板车蛙式扭扭车三轮车带刹车漂移车大号 YT6535-0037 蓝色,母婴>童车童床>健身车>POSCN 儿童滑板车蛙式扭扭车三轮车带...,京东商城,POSCN官方旗舰店
1015006007,母婴童|童车童床|三轮车,恒泰童车 三轮车脚踏车儿童自行车色彩鲜艳大礼盒装 三轮脚踏车 黄,玩具乐器>健身玩具>户外玩具>恒泰>恒泰童车 三轮车脚踏车儿童自行车色彩鲜艳...,京东商城,点点玩具专营店
1015006007,母婴童|童车童床|三轮车,货到付款！炫梦奇嘟嘟熊 三轮健身车 儿童活力滑板车扭扭车 闪光轮带刹车 海军蓝,母婴>童车童床>三轮车>炫梦奇>货到付款！炫梦奇嘟嘟熊 三轮健身车 儿童...,京东商城,炫梦奇专营店
1015006007,母婴童|童车童床|三轮车,小丽明 儿童滑板车 三轮车 扭扭车 宝宝生日礼物玩具滑行车 2068 蓝色,玩具乐器>健身玩具>户外玩具>小丽明>小丽明 儿童滑板车 三轮车 扭扭车 宝宝...,京东商城,佳贝玩具
1015006007,母婴童|童车童床|三轮车,琪安特 儿童三轮车脚踏车 婴儿宝宝手推儿童车 蓝色有护栏无棚充气轮,母婴>童车童床>三轮车>琪安特>琪安特 儿童三轮车脚踏车 婴儿宝宝手推儿...,京东商城,迪比乐母婴专营店
1015006007,母婴童|童车童床|三轮车,Little Tiger小虎子三轮车950红色,母婴>童车童床>三轮车>小虎子>小虎子三轮车,京东商城,小虎子
1015006007,母婴童|童车童床|三轮车,鹰豪836智宝小超人 三轮车儿童宝宝婴儿脚踏车 蓝色,玩具乐器>遥控/电动>轨道/助力>鹰豪>鹰豪836智宝小超人 三轮车儿童宝宝婴儿...,京东商城,唯宝孕婴童
1015006007,母婴童|童车童床|三轮车,小虎子儿童三轮车自行车 宝宝手推三轮童车 婴幼儿脚踏车952 蓝色,母婴>童车童床>三轮车>小虎子>小虎子儿童三轮车自行车 宝宝手推三轮童车...,京东商城,亲宝贝母婴专营店
1015006007,母婴童|童车童床|三轮车,韩国儿童蛙式滑板车太空车三轮活力车扭扭车 B款颜色随机,母婴>童车童床>三轮车>韩国儿童蛙式滑板车太空车三轮活力车扭扭车...,京东商城,亲宝贝母婴专营店
1015006007,母婴童|童车童床|三轮车,好孩子儿童三轮车 宝宝脚踏车手推童车goodbaby婴儿自行车SR600R 红色SR600R-L008,母婴>童车童床>三轮车>好孩子（Goodbaby）>好孩子儿童三轮车 宝宝脚踏车手推童车go...,京东商城,好孩子母婴专营店
1015006007,母婴童|童车童床|三轮车,POSCN 儿童滑板车蛙式扭扭车三轮车带刹车漂移车大号 YT6535-0037 蓝色,玩具 > 童车、助步、轮滑 > 滑板车,亚马逊(卓越网),Youngtry/优动
1015006007,母婴童|童车童床|三轮车,Lecoco乐卡 多功能儿童三轮车脚踏车宝宝三轮手推车童车小孩自行车 (T306舒适版雅典白),玩具 > 童车、助步、轮滑 > 三轮车,亚马逊(卓越网),lecoco 乐卡
1015006007,母婴童|童车童床|三轮车,大贸商（DMS）儿童三轮滑板车 闪光轮 全铝材质加厚型 儿童 滑轮车蓝色 AF00908,首页>母婴>童车童床>婴儿车>三轮车>大贸商（DMS）儿童三轮滑板车闪光...,苏宁,大贸商
1015006007,母婴童|童车童床|三轮车,活石 iimo儿童三轮车脚踏车婴儿手推车宝宝童车儿童自行车 林子颖宝宝童车,所有分类>母婴用品、玩具>童车/床/汽座>婴儿手推车>三轮推车>活石>活石 iimo儿童三...,1号店,活石
