1015005006,母婴童|洗护用品|妈妈护肤,赫兰希HENACL祛妊娠纹精华乳 产后修复淡化妊娠纹祛除肥胖纹 3月 套装 妊娠纹3月装,个护化妆>身体护肤>纤体塑形> 赫兰希（HENACL）>赫兰希HENACL祛妊娠纹精华乳 产后修...,京东商城,赫兰希旗舰店
1015005006,母婴童|洗护用品|妈妈护肤,美国Aussie袋鼠洗护系列 改善毛糙 滋润保湿洗发水400ml,个护化妆>洗发护发>洗发> 伊思（it‘s skin）>美国Aussie袋鼠洗护系列 改善毛糙 ...,京东商城,雅黛全球购
1015005006,母婴童|洗护用品|妈妈护肤,正品 塞巴斯汀焕彩滋养泡沫(多色)200ml 护色锁色修护型 进口包邮,个护化妆>洗发护发>护发> 塞巴斯汀（SEBASTIAN）>正品 塞巴斯汀焕彩滋养泡沫(多色)200...,京东商城,上海香琦化妆品专营店
1015005006,母婴童|洗护用品|妈妈护肤,正品 office/欧菲姿 光果甘草BB霜 美白裸妆保湿控油遮瑕强 BH02,个护化妆>香水彩妆>底妆> 欧菲姿（OFFICE）>正品 office/欧菲姿 光果甘草BB...,京东商城,欧菲姿官方旗舰店
1015005006,母婴童|洗护用品|妈妈护肤,十月天使倍护营养洗发液200g孕妇洗发水孕妇专用洗护用品   ,购物中心>洗护>成人护肤清洁>头部>十月天使倍护营养洗发液200g孕妇洗发水孕妇专用洗护用品,乐友, 十月天使
1015005006,母婴童|洗护用品|妈妈护肤,纽如兰孕妇护肤品化妆品 牛奶舒柔洁面霜100m 螯合重金属 深层清洁,首页>美妆>护肤清洁面膜>面部清洁>洁面膏/霜>纽如兰孕妇护肤品化妆品牛奶舒柔洁面...,苏宁,纽如蘭
1015005006,母婴童|洗护用品|妈妈护肤,嗳呵妈咪保湿3件套装 孕妇化妆品\\护肤品 天然补水洁面水乳液,首页>母婴>洗护用品>护肤用品>孕妈护肤>嗳呵妈咪保湿3件套装孕妇化妆品\\护...,苏宁,嗳呵(elsker)
1015005006,母婴童|洗护用品|妈妈护肤,亲润 大米嫩白身体乳 孕妇护肤品 孕妇专用化妆品 润肤乳 天然保湿 D511,首页>母婴>洗护用品>护肤用品>孕婴童护体>亲润大米嫩白身体乳孕妇护肤品孕...,苏宁,亲润
1015005006,母婴童|洗护用品|妈妈护肤,蕴妙 (孕妇专用)牛奶滋润护手霜4支超值装，蕴含牛奶润白、滋养的独特力量,首页 > 蕴妙ecomom孕妇护肤专场 > (孕妇专用)牛奶滋润护手霜4支超值装,唯品会,无
1015005006,母婴童|洗护用品|妈妈护肤,Sebamed/施巴洁肤皂100g 孕妇成人洁肤皂 全身洗澡沐浴护肤香皂,首页>母婴>洗护用品>护肤用品>孕婴童洁肤>Sebamed/施巴洁肤皂100g...,苏宁,施巴
1015005006,母婴童|洗护用品|妈妈护肤,郁美净浴后乳液220g 5瓶装 身体乳液,首页 > 妈妈护理 > 身体护理 > 护肤乳 > 郁美净浴后乳液220g 5瓶装 身体乳液,贝备网,郁美净
1015005006,母婴童|洗护用品|妈妈护肤,片仔癀保湿滋润蜜90ml 2瓶装 保湿滋润 乳液,首页 > 妈妈护理 > 面部护理 > 乳液 > 片仔癀保湿滋润蜜90ml 2瓶装 保湿滋润 乳液,贝备网,片仔癀
1015005006,母婴童|洗护用品|妈妈护肤,片仔癀保湿滋润蜜90ml 5瓶装 乳液 滋润保湿,首页 > 妈妈护理 > 面部护理 > 乳液 > 片仔癀保湿滋润蜜90ml 5瓶装 乳液 滋润保湿,贝备网,片仔癀
