1015005006,母婴童|洗护用品|妈妈护肤,植木方 孕妇专用护肤品 预防妊娠纹精华液150ml 孕妇化妆品,母婴>洗护用品>妈妈护肤>植木方 孕妇专用护肤品 预防妊娠纹精华液...,京东商城,四海在线母婴专营店
1015005006,母婴童|洗护用品|妈妈护肤,植木方 天然孕妇专用护肤品 滋养保湿乳液120ml 孕妇化妆品哺乳期护肤,母婴>洗护用品>妈妈护肤>植木方 天然孕妇专用护肤品 滋养保湿乳液...,京东商城,四海在线母婴专营店
1015005006,母婴童|洗护用品|妈妈护肤,嗳呵 有机优蓓柔润洁面泡沫150g 孕妇护肤品 孕妇适用化妆品,母婴用品 > 孕婴洗护 > 孕妈咪洗护 > 洁面 > 商品详情,当当网,嗳呵
1015005006,母婴童|洗护用品|妈妈护肤,孕肤宝 孕晚期-胶原紧肤洁面乳 孕妇护肤品/孕妇化妆品/保湿补水/送礼,母婴>洗护用品>宝宝护肤>孕肤宝 孕晚期-胶原紧肤洁面乳 孕妇护肤...,京东商城,孕肤宝
1015005006,母婴童|洗护用品|妈妈护肤,孕肤宝 水润肌保湿洁面泡沫135ML 孕妇专用 孕妇护肤品 孕妇适用化妆品,母婴用品 > 孕婴洗护 > 孕妈咪洗护 > 洁面 > 商品详情,当当网,孕肤宝
1015005006,母婴童|洗护用品|妈妈护肤,Ampais恩贝氏孕妇护肤品孕妇化妆品套装（5件套）,母婴用品 > 孕妈用品 > 护肤/祛纹/清洁 > 商品详情,当当网,恩贝氏
1015005006,母婴童|洗护用品|妈妈护肤,孕爱丝瓜补水润白洁面乳 孕妇洁面奶 孕妇护肤品 妈妈护肤/化妆品,母婴>妈妈专区>妈妈美容>孕爱丝瓜补水润白洁面乳 孕妇洁面奶 孕妇...,京东商城,孕爱旗舰店
1015005006,母婴童|洗护用品|妈妈护肤,十月天使深层保湿凝露50g 孕妇护肤品孕妇专用化妆品清爽保湿补水10095,母婴>洗护用品>妈妈护肤>十月天使>十月天使深层保湿凝露50g 孕妇护肤品孕...,京东商城,耀邦母婴专营店
1015005006,母婴童|洗护用品|妈妈护肤,十月天使女性柔护清洁液160ml 孕妇护肤品孕妇专用化妆品祛味止痒,母婴>洗护用品>洗发沐浴>十月天使>十月天使女性柔护清洁液160ml 孕妇护...,京东商城,旁白母婴专营店
1015005006,母婴童|洗护用品|妈妈护肤,十月天使孕纹修复液 孕妇专用护肤品 化妆品 产后修复妊娠纹 H101 48ml,母婴>洗护用品>妈妈护肤>十月天使>十月天使孕纹修复液 孕妇专用护肤品 化妆...,京东商城,旁白母婴专营店
1015005006,母婴童|洗护用品|妈妈护肤,十月天使 精纯滋养眼精华15g 孕妇护肤品孕妇专用化妆品黑眼圈皱纹 10078,母婴>洗护用品>妈妈护肤>十月天使>十月天使 精纯滋养眼精华15g 孕妇护肤...,京东商城,耀邦母婴专营店
1015005006,母婴童|洗护用品|妈妈护肤,予爱产后妊娠纹修复套装 淡印淡斑面部身体皆宜 产妇 妈妈专用护肤品 化妆品,母婴>洗护用品>妈妈护肤>予爱产后妊娠纹修复套装 淡印淡斑面部身体...,京东商城,予爱母婴专营店
1015005006,母婴童|洗护用品|妈妈护肤,予爱 深海滋养保湿补水五件套 孕妇妈妈专用护肤品化妆品,母婴>洗护用品>妈妈护肤>予爱 深海滋养保湿补水五件套 孕妇妈妈专...,京东商城,予爱母婴专营店
1015005006,母婴童|洗护用品|妈妈护肤,十月天使 深层保湿凝露 孕妇护肤品孕妇专用化妆品清爽保湿补水,母婴用品 > 妈妈用品 > 妈妈护肤,亚马逊(卓越网),十月天使
1015005006,母婴童|洗护用品|妈妈护肤,孕亲 橄榄水润系列4件套清爽型 孕妇护肤品孕妇化妆品,母婴>妈妈专区>妈妈美容>孕亲 橄榄水润系列4件套清爽型 孕妇护肤...,京东商城,孕亲母婴旗舰店
1015005006,母婴童|洗护用品|妈妈护肤,孕亲 橄榄水润系列3件套清爽型 孕妇护肤品孕妇化妆品,母婴>妈妈专区>妈妈美容>孕亲>孕亲 橄榄水润系列3件套清爽型 孕妇护肤...,京东商城,孕亲母婴旗舰店
1015005006,母婴童|洗护用品|妈妈护肤,美呵孕妇专用面膜蚕丝面膜贴滋润美白保湿孕妇护肤/化妆品食品级孕妇护肤品超级无添加 MC0012,母婴>妈妈专区>妈妈美容>美呵孕妇专用面膜蚕丝面膜贴滋润美白保湿孕...,京东商城,美呵旗舰店
1015005006,母婴童|洗护用品|妈妈护肤,资韵堂雪蚕丝润滋养沐浴露两件套 孕妇护肤品\\化妆品 孕期专用,母婴>妈妈专区>妈妈美容>资韵堂雪蚕丝润滋养沐浴露两件套 孕妇护肤...,京东商城,金韵娇儿专卖店
1015005006,母婴童|洗护用品|妈妈护肤,子初孕妇护肤品套装保湿孕妇化妆品,个护化妆>面部护肤>套装>其它>子初孕妇护肤品套装保湿孕妇化妆品,京东商城,七色馆
1015005006,母婴童|洗护用品|妈妈护肤,雅滋美特（Artismade）亮颜醒肤洁面乳 120ml/孕妇护肤品/专用洁面乳/洗面奶/孕妇化妆品/滋养,美容化妆 > 面部护肤 > 面部清洁,亚马逊(卓越网),雅滋美特
1015005006,母婴童|洗护用品|妈妈护肤,雅滋美特全润呵护平衡乳80ml 孕妇补水/保湿/孕妇护肤品/妈妈化妆品,母婴用品 > 妈妈用品 > 妈妈护肤 ,亚马逊(卓越网),雅滋美特
1015005006,母婴童|洗护用品|妈妈护肤,美呵 孕妇滋养面霜 提拉紧致 抗皱 美白孕妇专用护肤品孕期化妆品 MC0009,母婴>洗护用品>妈妈护肤>美呵 孕妇滋养面霜 提拉紧致 抗皱 美白...,京东商城,美呵旗舰店
1015005006,母婴童|洗护用品|妈妈护肤,ANNUNCIATION 十月天使 去屑营养洗发乳200g 孕妇护肤品 孕妇 化妆品 10056 C,母婴用品 > 妈妈用品 > 妈妈护肤,亚马逊(卓越网),ANNUNCIATION 十月天使
1015005006,母婴童|洗护用品|妈妈护肤,ANNUNCIATION 十月天使 十月天使清爽洗护套装 孕妇护肤品孕妇化妆品 洗发 护发 沐浴,母婴用品 > 清洁、洗浴、护肤 > 洗浴用品 > 沐浴液,亚马逊(卓越网),
1015005006,母婴童|洗护用品|妈妈护肤,十月天使 保湿套装 孕妇护肤品 孕妇专用化妆品 保湿 补水 11124,母婴>洗护用品>妈妈护肤>十月天使>十月天使 保湿套装 孕妇护肤品 孕妇专用...,京东商城,亲宝贝母婴专营店
1015005006,母婴童|洗护用品|妈妈护肤,十月天使 产后术痕修复凝露30g 孕妇护肤品 孕妇专用化妆品 祛疤10099,母婴>洗护用品>妈妈护肤>十月天使>十月天使 产后术痕修复凝露30g 孕妇...,京东商城,亲宝贝母婴专营店
1015005006,母婴童|洗护用品|妈妈护肤,十月天使防脱营养洗发乳200g,母婴>洗护用品>洗发沐浴>十月天使>十月天使防脱营养洗发乳200g,京东商城,快乐宝贝
1015005006,母婴童|洗护用品|妈妈护肤,春纪日霜 弹力娇嫩日霜50g 防护 紧致肌肤 恢复弹性,个护化妆>面部护肤>护肤>春纪>春纪日霜 弹力娇嫩日霜50g 防护 紧致...,京东商城,芷芷堂美妆专营店
1015005006,母婴童|洗护用品|妈妈护肤,十月天使柔白润肤霜50g,母婴>洗护用品>妈妈护肤>十月天使>十月天使柔白润肤霜50g,京东商城,快乐宝贝
1015005006,母婴童|洗护用品|妈妈护肤,丽质生/LoraZen 亚马逊布里奇果透白遮瑕BB霜 滋润保湿 补水美白 化妆品正品35g,个护化妆>香水彩妆>底妆>丽质生（lorazen）>丽质生/LoraZen 亚马逊布里奇果透...,京东商城,丽质生官方旗舰店
1015005006,母婴童|洗护用品|妈妈护肤,孕爱牛蒡净透控油乳 孕妇控油乳 孕妇护肤品 妈妈化妆品,母婴>洗护用品>妈妈护肤>孕爱牛蒡净透控油乳 孕妇控油乳 孕妇护肤...,京东商城,孕爱旗舰店
1015005006,母婴童|洗护用品|妈妈护肤,十月天使 孕妇护发素 孕妇护肤品 孕妇专用化妆品 孕妇洗护用品,母婴>洗护用品>妈妈护肤>十月天使>十月天使 孕妇护发素 孕妇护肤品 孕妇专...,京东商城,婴唯爱官方旗舰店
1015005006,母婴童|洗护用品|妈妈护肤,十月天使去屑营养洗发乳 200g（御彩系列）,母婴>洗护用品>妈妈护肤>十月天使>十月天使去屑营养洗发乳 200g（御彩系...,京东商城,大益购旗舰店
1015005006,母婴童|洗护用品|妈妈护肤,十月天使美容润肤皂75g,母婴>洗护用品>妈妈护肤>十月天使>十月天使美容润肤皂75g,京东商城,大益购旗舰店
1015005006,母婴童|洗护用品|妈妈护肤,科颜氏全身保湿护肤乳小样30ML,个护化妆>身体护肤>润肤>科颜氏（Kiehl's）>科颜氏全身保湿护肤乳小样30ML,京东商城,迈际
1015005006,母婴童|洗护用品|妈妈护肤,纽比士冰蓝海盐 沐浴皂 美白保湿洗澡皂抗敏感 手工皂 J13390 无,首页> 个护化妆> 个人护理> 身体护理> 手工/香皂> 纽比士冰蓝海盐 沐浴皂 美白保湿洗澡皂抗敏感 手工皂 J13390,凡客诚品,纽比士
1015005006,母婴童|洗护用品|妈妈护肤,CO.E韩伊橄榄精纯橄榄油125ml-,美妆个护>精华>韩伊>CO.E韩伊橄榄精纯橄榄油125ml-,国美电器网上商城,乐蜂官方旗舰店
1015005006,母婴童|洗护用品|妈妈护肤,水漾莹润3度系列保湿精华40ml,美妆个护>精华>丸美>水漾莹润3度系列保湿精华40ml,国美电器网上商城,东方润姿化妆品专营店
1015005006,母婴童|洗护用品|妈妈护肤,性感薄荷泡浴淋浴啫喱,健康医疗>两性护理>春画>性感薄荷泡浴淋浴啫喱,国美电器网上商城,春画
1015005006,母婴童|洗护用品|妈妈护肤,韩伊 橄榄美白保湿洁面乳125g深层洁面美白保湿,首页 >美妆个护 >面部护理 >洁面卸妆 >韩伊 橄榄美白保湿洁面乳125g深层洁面美白保湿,vjia,伊人红妆旗舰店
1015005006,母婴童|洗护用品|妈妈护肤,Mom Face 亲润 豆乳滋养洁面乳 孕妇洗面奶 孕妇专用洁面乳 孕妇护肤 孕妇护肤品X311,首页 >母婴童装 >孕妈专区 >孕妈护肤 >Mom Face 亲润 豆乳滋养洁面乳 孕妇洗面奶 孕妇专用洁面乳 孕妇护肤 孕妇护肤品X311,vjia,亲润旗舰店
1015005006,母婴童|洗护用品|妈妈护肤,DLEOWA 黛蒂安娜 蜗牛美肌水润洁面乳100g,美容化妆 > 面部护肤 > 面部清洁 > 洁面,亚马逊(卓越网),DLEOWA 黛蒂安娜
1015005006,母婴童|洗护用品|妈妈护肤,正品特价贝亲XA79妊娠纹按摩霜120g 孕纹护理 孕妇护肤品/化妆品	 （支持货到付款）,母婴用品 > 孕妈用品 > 护肤/祛纹/清洁 > 商品详情,当当网,Pigeon 贝亲
1015005006,母婴童|洗护用品|妈妈护肤,十月天使  舒润霜套装 孕妇护肤品*化妆品 缓解黯淡干燥  10130	(支持货到付款),母婴用品 > 孕妈用品 > 护肤/祛纹/清洁 > 商品详情,当当网,十月天使
1015005006,母婴童|洗护用品|妈妈护肤,十月天使保湿活肤洁面乳保湿系列 120g,母婴用品 > 孕妈用品 > 护肤/祛纹/清洁 > 商品详情,当当网,十月天使
1015005006,母婴童|洗护用品|妈妈护肤,欧莱雅 雪颜美白舒缓晚霜50ml 特价,美容化妆 > 面部护理 > 晚霜,亚马逊(卓越网),
1015005006,母婴童|洗护用品|妈妈护肤,十月天使 孕纹防护液 48ml,母婴用品 > 孕妈用品 > 护肤/祛纹/清洁 > 商品详情,当当网,十月天使
1015005006,母婴童|洗护用品|妈妈护肤,十月天使 柔白润肤霜 50g,母婴用品 > 孕妈用品 > 护肤/祛纹/清洁 > 商品详情,当当网,十月天使
1015005006,母婴童|洗护用品|妈妈护肤,十月天使 清透平衡洁面啫喱 120g,母婴用品 > 孕妈用品 > 护肤/祛纹/清洁 > 商品详情,当当网,十月天使
1015005006,母婴童|洗护用品|妈妈护肤,新西兰英乐士 清肌水润修颜孕妇洁面乳/孕妇洗面奶/孕妇用品护肤品C1/200ml,母婴用品 > 孕婴洗护 > 孕妈咪洗护 > 洁面 > 商品详情,当当网,英乐士
1015005006,母婴童|洗护用品|妈妈护肤,【货到付款】程程深层保湿滋润蜗牛护手霜60G 男/女士可用 秋冬防皲裂保湿护理,时尚美妆 > 个人护理 > 手足护理 > 护手霜,当当网,程程
1015005006,母婴童|洗护用品|妈妈护肤,安安金纯A＇Gensn鲜芦荟祛痘无印洁面膏100g 洗面奶,时尚美妆 > 美容护肤 > 洁面 > 商品详情,当当网,安安
1015005006,母婴童|洗护用品|妈妈护肤,百雀羚 水润保湿洁面乳 95g  专柜正品,时尚美妆 > 美容护肤 > 洁面 > 商品详情,当当网,百雀羚
1015005006,母婴童|洗护用品|妈妈护肤,Sana 珊娜 豆乳弹力美肌精华素 60g,时尚美妆 > 美容护肤 > 精华 > 商品详情,当当网,Sana 珊娜
1015005006,母婴童|洗护用品|妈妈护肤,安安金纯 橄榄油深层水嫩晶透紧肤水 150ml 0414,时尚美妆 > 美容护肤 > 爽肤 > 商品详情,当当网,安安
1015005006,母婴童|洗护用品|妈妈护肤,倩碧温和型液体洁面皂小样(干,混合)15ML,时尚美妆 > 美容护肤 > 洁面,当当网,倩碧
1015005006,母婴童|洗护用品|妈妈护肤, 秀丽韩润河按摩霜40ml,紧致肌肤弹性保湿修护 ,商城首页 >商品列表 > 蝶妆,为为网,蝶妆
1015005006,母婴童|洗护用品|妈妈护肤,韩伊水蜜桃粉颜嫩白保湿6件套+CO.E韩伊橄榄精纯橄榄油125ml,首页>护肤用品>护肤套装>韩伊水蜜桃粉颜嫩白保湿6件套+CO.E韩伊橄榄精纯橄榄油125ml,乐蜂网,韩伊
1015005006,母婴童|洗护用品|妈妈护肤,十月妈咪 O.C.T.mami 御用级天然净透紧致补水锁水美肌6件套 10016 13Q4,首页>婴童>孕产妇专区>面部护理,银泰网,十月妈咪
1015005006,母婴童|洗护用品|妈妈护肤,【原装正品】卡诗双重菁纯润泽系列旅行套装 神仙油50ml+发膜75ml+洗发水80ml,时尚美妆 > 个人护理 > 头发护理 > 洗护套装 > 商品详情,当当网,卡诗
1015005006,母婴童|洗护用品|妈妈护肤,潘婷乳液修复润发精华素750ml,美妆个护>洗发护发>潘婷>潘婷乳液修复润发精华素750ml,国美电器网上商城,潘婷
1015005006,母婴童|洗护用品|妈妈护肤,Mammy village/六甲村 防妊娠霜 嫩肤霜妊娠纹产前预防产后修复霜/ 滋润型120g,所有分类>母婴用品、玩具>孕妈专区>孕妈洗护>身体护理>Mammy village/六甲村>Mammy vill...,1号店,Mammy village/六甲村
1015005006,母婴童|洗护用品|妈妈护肤,资韵堂 雪蚕丝润眼部紧致精华 抗皱淡化眼纹 孕产妇护肤品,所有分类>母婴用品、玩具>孕妈专区>孕妈洗护>面部护理>资韵堂>资韵堂 雪蚕丝润眼部...,1号店,资韵堂
1015005006,母婴童|洗护用品|妈妈护肤,帕玛氏 palmer's 孕产淡化妊娠纹按摩霜 (美版)125G,所有分类>母婴用品、玩具>孕妈专区>孕妈洗护>祛妊娠纹>帕玛氏,1号店,祛妊娠纹
1015005006,母婴童|洗护用品|妈妈护肤,妈妈美 淡斑靓肤套装 哺乳期祛斑美白套装哺乳期护肤品,所有分类>母婴用品、玩具>孕妈专区>孕妈洗护>其他洗护产品>妈妈美>妈妈美 淡斑靓肤套装...,1号店,妈妈美
1015005006,母婴童|洗护用品|妈妈护肤,小甘菊手足龟裂修护霜20ml/盒,首页>美妆>美体沐浴手足>手部护理>手霜>小甘菊手足龟裂修护霜20ml/盒,苏宁,
1015005006,母婴童|洗护用品|妈妈护肤,亲润 孕妇护肤品 豆乳滋养补水睡眠面膜 天然保湿 孕期专用护肤品 孕妈化妆品 X306,首页>母婴>洗护用品>护肤用品>孕婴童护脸>亲润孕妇护肤品豆乳滋养补水睡眠面...,苏宁,亲润
1015005006,母婴童|洗护用品|妈妈护肤,亲润 豆乳滋养保湿三件套 孕妇护肤品套装 孕妇化妆品 天然保湿补水专用 X105-B,首页>母婴>洗护用品>护肤用品>孕婴童护脸>亲润豆乳滋养保湿三件套孕妇护肤品...,苏宁,亲润
1015005006,母婴童|洗护用品|妈妈护肤,新西兰英乐士 孕妇腿脚肿胀舒缓按摩霜/按摩油/按摩膏/消除肿胀感/缓解胀痛/孕妇用品护肤品R4/120ml,首页>母婴>洗护用品>护肤用品>孕婴童护体>新西兰英乐士孕妇腿脚肿胀舒缓按摩霜...,苏宁,
1015005006,母婴童|洗护用品|妈妈护肤,嗳呵孕妈咪修护保养套装,首页>母婴>洗护用品>护肤用品>洗护套装/礼盒>嗳呵孕妈咪修护保养套装,苏宁,嗳呵
1015005006,母婴童|洗护用品|妈妈护肤,十月天使 舒润滋养乳100g,所有分类>母婴用品、玩具>孕妈专区>孕妈洗护>面部护理>十月天使>十月天使 舒润滋养乳...,1号店,十月天使
1015005006,母婴童|洗护用品|妈妈护肤,菲丽洁 纯天然按摩油 150ml,首页>身体护理>手足护理>手部护理套装>菲丽洁 菲丽洁 纯天然按摩油 150ml,易迅网, 菲丽洁
1015005006,母婴童|洗护用品|妈妈护肤,碧芝莱祛妊娠纹乳液  产前防护 产后修复 祛疤痕 150ml,家居日用>油壶 >碧芝莱>碧芝莱祛妊娠纹乳液  产前防护 产后修复 祛疤痕 150ml,国美电器网上商城,凯希k品专营店
1015005006,母婴童|洗护用品|妈妈护肤,贝亲妊娠纹按摩霜 XA79 120g,母婴用品 玩具>护理用品>贝亲>贝亲妊娠纹按摩霜 XA79 120g,国美电器网上商城,久爱久母婴专营店
1015005006,母婴童|洗护用品|妈妈护肤,珀莱雅靓白肌密柔润洁面乳 120ML,美妆个护>洁面>珀莱雅>珀莱雅靓白肌密柔润洁面乳 120ML,国美电器网上商城,珀莱雅
1015005006,母婴童|洗护用品|妈妈护肤,梵瑞思 极润闪烁唇彩 4.5ml 最全16色可选(1号晶莹纯),美妆个护>唇膏唇彩>梵瑞思>梵瑞思 极润闪烁唇彩 4.5ml 最全16色可选(1号晶莹纯),国美电器网上商城,瑷炫美妆专营店
1015005006,母婴童|洗护用品|妈妈护肤,春纪 五谷黑白米四件 BB霜,美妆个护>套装>春纪>春纪 五谷黑白米四件 BB霜,国美电器网上商城,春纪
1015005006,母婴童|洗护用品|妈妈护肤,丸美BB新肌洁面乳120g,美妆个护>洁面>丸美>丸美BB新肌洁面乳120g,国美电器网上商城,丸美
1015005006,母婴童|洗护用品|妈妈护肤,袋鼠妈妈小麦妊娠纹防护弹力霜120g 孕期防止妊娠纹,母婴用品 玩具>妈妈护肤>袋鼠妈妈>袋鼠妈妈小麦妊娠纹防护弹力霜120g 孕期防止妊娠纹,国美电器网上商城,袋鼠妈妈旗舰店
1015005006,母婴童|洗护用品|妈妈护肤,韩伊CO.E橄榄美白保湿洗面奶200g,美妆个护>洁面>CO.E韩伊>韩伊CO.E橄榄美白保湿洗面奶200g,国美电器网上商城,潮妆护肤美妆专营店
1015005006,母婴童|洗护用品|妈妈护肤,十月天使防护隔离霜10010,首页>母婴>洗护用品>护肤用品>孕婴童护脸>十月天使防护隔离霜10010,苏宁,十月天使
1015005006,母婴童|洗护用品|妈妈护肤,圣荷纳诺美胸精华露 产后修复套装,美妆个护>纤体瘦身>圣荷>圣荷纳诺美胸精华露 产后修复套装,国美电器网上商城,圣荷旗舰店
1015005006,母婴童|洗护用品|妈妈护肤,十月天使孕纹修护乳 妊娠纹修护乳 100g 10052,母婴>妈妈专区>妈妈美容>十月天使>十月天使孕纹修护乳 妊娠纹修护乳 100...,京东商城,三只小猪母婴专营店
1015005006,母婴童|洗护用品|妈妈护肤,纯羊脂膏（乳头龟裂膏） 37g,母婴用品 玩具>婴幼护肤>美德乐>纯羊脂膏（乳头龟裂膏） 37g,国美电器网上商城,美德乐
1015005006,母婴童|洗护用品|妈妈护肤,婴姿坊妊娠按摩膏B60-08,母婴用品 玩具>婴幼护肤>婴姿坊>婴姿坊妊娠按摩膏B60-08,国美电器网上商城,婴姿坊
1015005006,母婴童|洗护用品|妈妈护肤,ornalia澳娜莉亚瀛蓝润泽三件套,美妆个护>套装>澳娜莉亚>ornalia澳娜莉亚瀛蓝润泽三件套,国美电器网上商城,澳娜莉亚
1015005006,母婴童|洗护用品|妈妈护肤,格兰玛弗兰旗舰店海伦洁面乳100ML高效保湿温和无刺激,美妆个护>洁面>格兰玛弗兰>格兰玛弗兰旗舰店海伦洁面乳100ML高效保湿温和无刺激,国美电器网上商城,格兰玛弗兰
1015005006,母婴童|洗护用品|妈妈护肤,安肤奇清爽控油洁面乳 女 包邮 保湿 补水 100g　正品,美妆个护>洁面>安肤奇>安肤奇清爽控油洁面乳 女 包邮 保湿 补水 100g　正品,国美电器网上商城,安肤奇官方旗舰店
1015005006,母婴童|洗护用品|妈妈护肤,原森密语 COAROO护肤黑莓果萃透白洁面乳120g 深层清洁洗面奶 清洁护肤化妆品,时尚美妆 > 美容护肤 > 洁面 > 商品详情,当当网,原森密语
1015005006,母婴童|洗护用品|妈妈护肤,贞采源 咖啡草控油净爽洁面乳洗面奶100g 深层清洁,美妆个护>洁面>贞采源>贞采源 咖啡草控油净爽洁面乳洗面奶100g 深层清洁,国美电器网上商城,贞采源
1015005006,母婴童|洗护用品|妈妈护肤,韩妙正品 乳木果 水妍保湿 洁面乳130g 洗面奶,美妆个护>洁面>韩妙>韩妙正品 乳木果 水妍保湿 洁面乳130g 洗面奶,国美电器网上商城,韩妙
1015005006,母婴童|洗护用品|妈妈护肤,姿昂 韩国 姿昂 五味保润洗颜乳 100g 洗面奶洁面乳 保湿 滋润专柜正品,美容化妆 > 面部护理 > 洁面 > 乳、霜、膏,亚马逊(卓越网),姿昂
1015005006,母婴童|洗护用品|妈妈护肤,欧珀莱俊士超值3件套（温和洁面膏125g+霜50g+防晒隔离液50ml）,时尚美妆 > 男士专区 > 脸部护理 > 商品详情,当当网,Aupres欧珀莱
1015005006,母婴童|洗护用品|妈妈护肤,欧珀莱俊士超值7件套（温和洁面膏+乳+露+霜+隔离液+眼部精华液+清痘啫喱）,时尚美妆 > 男士专区 > 脸部护理 > 商品详情,当当网,Aupres欧珀莱
1015005006,母婴童|洗护用品|妈妈护肤,自然堂 弹力紧致洁容霜 100g 舒缓 紧致提拉 正品包邮 洗面奶,美妆个护>洁面>自然堂>自然堂 弹力紧致洁容霜 100g 舒缓 紧致提拉 正品包邮 洗面奶,国美电器网上商城,自然堂
1015005006,母婴童|洗护用品|妈妈护肤,蕴妙ecomom孕妇面部基础3件套 孕妇化妆品套装 孕妇护肤品套装,母婴用品 > 孕婴洗护 > 护肤品 > 商品详情,当当网,蕴妙ecomom
1015005006,母婴童|洗护用品|妈妈护肤,比诺贝比-妊娠纹修复精华素40ml,首页 > 贝亲&乖比比&小米米&比诺贝比婴童洗护专场 > 比诺贝比-妊娠纹修复精华素40ml,唯品会,无
1015005006,母婴童|洗护用品|妈妈护肤,新西兰进口 海丝蓓康清爽飘逸洗发水 适合油性发质 400ml 9400571744678,文轩网 > 百货 > 时尚美妆 > 个人护理 > 头发护理 > 洗发护发 > 新西兰进口 海丝蓓康清爽飘逸洗发水 适合油性发质 400ml 9400571744678,文轩网,海丝蓓康 Health Basic
1015005006,母婴童|洗护用品|妈妈护肤,本草堂 活颜滋补三件套 礼盒 美白淡斑 去黄补水 护肤品正品套装,美妆个护>套装>本草堂>本草堂 活颜滋补三件套 礼盒 美白淡斑 去黄补水 护肤品正品套装,国美电器网上商城,本草堂
1015005006,母婴童|洗护用品|妈妈护肤,全因爱妈妈水盈多效眼霜20ml,母婴用品 > 孕妈用品 > 护肤/祛纹/清洁 > 商品详情,当当网,全因爱
1015005006,母婴童|洗护用品|妈妈护肤,正品如新(Nuskin）180°再生洁面乳/洗面奶 美国进口,个护化妆>面部护肤>清洁>其它>正品如新(Nuskin）180°再生洁面...,京东商城,美妆优品
1015005006,母婴童|洗护用品|妈妈护肤,比诺贝比-妊娠纹防护乳180g,首页 > 贝亲&乖比比&比诺贝比婴童洗护专场 > 比诺贝比-妊娠纹防护乳180g,唯品会,无
1015005006,母婴童|洗护用品|妈妈护肤,玉兰油 多效美白霜50g,首页 > 玉兰油OLAY护肤品专场 > 多效美白霜50g,唯品会,无
1015005006,母婴童|洗护用品|妈妈护肤,韩雅蜗牛臻金修复小礼盒(蜗牛BB霜7g+修复霜10g),首页 > 护肤用品 > 护肤套装 > 韩雅蜗牛臻金修复小礼盒(蜗牛BB霜7g+修复霜10g),乐蜂网,韩雅
1015005006,母婴童|洗护用品|妈妈护肤,卡尼尔舒缓特润保湿组合（洗面奶100ml+爽肤水200ml+滋养霜50ml）,首页 > 护肤用品 > 护肤套装 > 卡尼尔舒缓特润保湿组合（洗面奶100ml+爽肤水200ml+滋养霜50ml）,乐蜂网,卡尼尔
1015005006,母婴童|洗护用品|妈妈护肤,fruit of the earth闪露芦荟护肤啫喱(一对) 56g*2,美妆商城首页 > 闪露（Fruit of the Earth） > 啫哩/凝露/凝胶 > fruit of the earth闪露芦荟护肤啫喱(一对) 56g,聚美优品,闪露（Fruit of the Earth）
1015005006,母婴童|洗护用品|妈妈护肤,芙优润海藻芦荟眼凝胶 50g,美妆商城首页 > 芙优润(Premium Care) > 眼部护理 > 芙优润海藻芦荟眼凝胶 50g,聚美优品,芙优润(Premium Care)
1015005006,母婴童|洗护用品|妈妈护肤,上海女人夜来香护手霜（三件套盒）55ml*3,时尚美妆 > 个人护理 > 手足护理 > 护手霜 > 商品详情,当当网,上海女人
1015005006,母婴童|洗护用品|妈妈护肤,欧佩 金蚕丝 臻白水润洁面乳 120g,美容化妆 > 面部护理 > 洁面 > 乳、霜、膏,亚马逊(卓越网),欧佩
1015005006,母婴童|洗护用品|妈妈护肤,肌情 橄榄平衡洁面膏,首页 >美妆个护 >面部护理 >洁面卸妆 >肌情 橄榄平衡洁面膏,vjia,
1015005006,母婴童|洗护用品|妈妈护肤,专柜正品 泊美洗面奶 植物倍水润系列I 保湿洁面膏120g(水润型),美妆个护>洁面>泊美>专柜正品 泊美洗面奶 植物倍水润系列I 保湿洁面膏120g(水润型),国美电器网上商城,泊美
