1015006007,母婴童|童车童床|三轮车,Tao yu tang/淘雨堂 格灵童 钢架 儿童三轮车小孩自行车 婴儿推车宝宝脚踏车 可选护栏可配伞,所有分类>母婴用品、玩具>玩具>运动户外>Tao yu tang/淘雨堂>Tao yu tan...,1号店,Tao yu tang/淘雨堂
1015006007,母婴童|童车童床|三轮车,儿童三轮车516 安全婴儿童车 宝宝三轮童车 高档童车 耐用童车,母婴用品 玩具>健身车>A+B>儿童三轮车516 安全婴儿童车 宝宝三轮童车 高档童车 耐用童车,国美电器网上商城,A+B
1015006007,母婴童|童车童床|三轮车,直销儿童三轮车 宝宝脚踏车小推车 婴儿童车(粉色),运动户外>其他户外用品>KIDZAMO>直销儿童三轮车 宝宝脚踏车小推车 婴儿童车(粉色),国美电器网上商城,奇士俱乐部旗舰店
1015006007,母婴童|童车童床|三轮车,艾威BC6760立式磁控健身车 家用室内自行车 静音心率脚踏车 健身器材,运动户外>健身器械>艾威>艾威BC6760立式磁控健身车 家用室内自行车 静音心率脚踏车 健身器材,国美电器网上商城,艾威
1015006007,母婴童|童车童床|三轮车,小虎子 儿童三轮车推车脚踏车 多功能三轮童车自行车950 (红),玩具 > 童车、助步、轮滑 > 三轮车,亚马逊(卓越网),小虎子
1015006007,母婴童|童车童床|三轮车,【蝴蝶节 惊价】贝嘉琦铝合金手推车宝宝童车 儿童三轮车脚踏婴儿自行车 充气轮包邮 红色,母婴>童车童床>三轮车>贝嘉琦>【蝴蝶节 惊价】贝嘉琦铝合金手推车宝宝童...,京东商城,绿森童车专卖店
1015006007,母婴童|童车童床|三轮车,祺月cheerway儿童三轮车 童车婴儿三轮车XG18819-A301中国红 天蓝色,母婴>童车童床>三轮车>祺月（Cheerway）>祺月cheerway儿童三轮车 童车婴儿...,京东商城,祺月官方旗舰店
1015006007,母婴童|童车童床|三轮车,2014款舒贝乐三轮车,母婴>童车童床>三轮车>舒贝乐>2014款舒贝乐三轮车,京东商城,天赐宝贝母婴用品
1015006007,母婴童|童车童床|三轮车,好孩子 Goodbaby 三轮车 欧式多功能儿童宝宝脚踏车 红色 SR600R-L008,母婴>童车童床>自行车>好孩子（Goodbaby）>好孩子 Goodbaby 三轮车 欧式多...,京东商城,好孩子思享专营店
1015006007,母婴童|童车童床|三轮车,小龙哈彼宝宝儿童三轮车 脚踏车 LSR401R-H203 绿色,母婴>童车童床>自行车>好孩子（Goodbaby）>小龙哈彼宝宝儿童三轮车 脚踏车 LSR4...,京东商城,null
1015006007,母婴童|童车童床|三轮车,小龙哈彼多功能儿童三轮车/伞车可做摇马手推车 LSR52R-G205,母婴>童车童床>自行车>好孩子（Goodbaby）>小龙哈彼多功能儿童三轮车/伞车可做摇马手...,京东商城,null
1015006007,母婴童|童车童床|三轮车,卡蒂小猪 儿童三轮推车宝宝自行车小孩脚踏车婴儿手推车童车轻巧 B31咖啡色,母婴>童车童床>三轮车>卡蒂小猪（CARTY PIG）>卡蒂小猪 儿童三轮推车宝宝自行车小孩脚踏...,京东商城,乐美母婴生活馆
1015006007,母婴童|童车童床|三轮车,韩国豪华CHIC儿童脚踏三轮车小孩手推车自行车宝宝童车婴儿 发泡轮红色,母婴>童车童床>自行车>栋马>韩国豪华CHIC儿童脚踏三轮车小孩手推车...,京东商城,卿贝母婴专营店
1015006007,母婴童|童车童床|三轮车,灿成童车 儿童三轮车脚踏车 婴儿手推车 轻便 宝宝自行车 可调节 圣诞礼物 元旦送礼 升级版-高配版中国红,玩具乐器>健身玩具>户外玩具>活石>灿成童车 儿童三轮车脚踏车 婴儿手推车 ...,京东商城,贝趣玩具
1015006007,母婴童|童车童床|三轮车,栋马铝合金手推车宝宝童车 儿童三轮车脚踏婴儿自行车 充气轮多省包邮 法拉利红(高钢碳)发泡轮+高配,母婴>童车童床>三轮车>栋马>栋马铝合金手推车宝宝童车 儿童三轮车脚踏...,京东商城,栋马童车旗舰店
1015006007,母婴童|童车童床|三轮车,孩子家 宝宝婴儿 儿童三轮车划板车开心兔,母婴>童车童床>三轮车>孩子家>孩子家 宝宝婴儿 儿童三轮车划板车开心兔,京东商城,孩子家母婴专营店
1015006007,母婴童|童车童床|三轮车,小人类 儿童三轮车/音乐扭扭车/四轮车/摇摇车/摇摆车/健身车 801A 绿色大象,母婴>童车童床>健身车>小人类>小人类 儿童三轮车/音乐扭扭车/四轮车/...,京东商城,骅舜母婴专营店
1015006007,母婴童|童车童床|三轮车,【新春狂欢价】贝嘉琦铝合金手推车宝宝童车 儿童三轮车脚踏婴儿自行车 充气轮包邮 黄色,母婴>童车童床>三轮车>贝嘉琦>【新春狂欢价】贝嘉琦铝合金手推车宝宝童车...,京东商城,绿森童车专卖店
1015006007,母婴童|童车童床|三轮车,恒泰 童车儿童三轮车 宝宝三轮脚踏车童车小孩户外运动自行车玩具车(黄色童车),母婴用品 玩具>健身玩具>恒泰>恒泰 童车儿童三轮车 宝宝三轮脚踏车童车小孩户外运动自行车玩具车(黄色童车),国美电器网上商城,贝趣玩具专营店
1015006007,母婴童|童车童床|三轮车,灿成 童车 儿童三轮车儿童脚踏车 婴儿手推车 宝宝自行车(高配版中国红),母婴用品 玩具>健身玩具>灿成>灿成 童车 儿童三轮车儿童脚踏车 婴儿手推车 宝宝自行车(高配版中国红),国美电器网上商城,贝趣玩具专营店
1015006007,母婴童|童车童床|三轮车,日本iimo儿童三轮车脚踏车豪华多功能儿童自行车 三轮推车 可拆卸 送原装伞+妈咪包咖啡色,母婴>童车童床>三轮车>IIMO>日本iimo儿童三轮车脚踏车豪华多功能儿...,京东商城,禹光孕婴童生活馆
1015006007,母婴童|童车童床|三轮车,淘雨堂小小飞龙国宝/果宝特工宽板大轮滑板车铁三轮脚踏车童车滑步车带灯光带刹车 喜洋洋图案,玩具乐器>健身玩具>户外玩具>淘雨堂>淘雨堂小小飞龙国宝/果宝特工宽板大轮滑板...,京东商城,淘堂母婴
1015006007,母婴童|童车童床|三轮车,出口日韩 MIMI-TRIKE 儿童三轮车脚踏车童车户外三轮车 特价促销 天使蓝 天使蓝,母婴>童车童床>三轮车>IIMO>出口日韩 MIMI-TRIKE 儿童三轮...,京东商城,禹光孕婴童生活馆
1015006007,母婴童|童车童床|三轮车,乐卡儿童三轮车脚踏车 宝宝小孩幼儿童车 脚蹬玩具车 新年礼物 白色,玩具乐器>健身玩具>户外玩具>KidSmart>乐卡儿童三轮车脚踏车 宝宝小孩幼儿童车 ...,京东商城,三宝商城
1015006007,母婴童|童车童床|三轮车,日本ides 儿童折叠三轮车童车自行车手推车脚踏车童车三轮车免安装 可折叠红色,母婴>童车童床>三轮车>IDES>日本ides 儿童折叠三轮车童车自行车手...,京东商城,浩贝佳母婴专营店
1015006007,母婴童|童车童床|三轮车,日本出口 ides iimo儿童三轮车童车自行车手推车脚踏车童车三轮车 红色,母婴>童车童床>三轮车>IDES>日本出口 ides iimo儿童三轮车童...,京东商城,浩贝佳母婴专营店
1015006007,母婴童|童车童床|三轮车,Little Tikes 小泰克3合1推行三轮车（海军蓝）,首页 > Little Tikes玩具专场 > 小泰克3合1推行三轮车（海军蓝）,唯品会,无
1015006007,母婴童|童车童床|三轮车,HAPPY 瑞贝 小龙哈彼儿童三轮车手推车脚踏车LSR900R-H-L127/L126 LSR900R-H-L127,运动户外休闲 > 自行车,亚马逊(卓越网),HAPPY
1015006007,母婴童|童车童床|三轮车,JS儿童三轮车儿童脚踏车 宝宝三轮自行车 小孩 多功能自行车脚踏车 德国原单婴儿三轮车童车 (白色),玩具 > 童车、助步、轮滑 > 三轮车,亚马逊(卓越网),JS
1015006007,母婴童|童车童床|三轮车,骏杰动感 老年代步电动滑板车 迷你折叠车 三轮电动车酷骑街车 残疾车三轮电动滑 黑色 36V三节超威电池+倒档,运动户外>骑行运动>电动车>骏杰动感>骏杰动感 老年代步电动滑板车 迷你折叠车...,京东商城,骏杰动感运动专营店
1015006007,母婴童|童车童床|三轮车,宝宝好 231G豪华婴儿童孩子三轮脚踏自行车手推卡通带音乐多省,所有分类>母婴用品、玩具>童车/床/汽座>三轮车>宝宝好>宝宝好 231G豪华...,1号店,宝宝好
1015006007,母婴童|童车童床|三轮车,儿童三轮车 宝宝手推车 脚踏车自行车 儿童三轮手推车 出门必备 灰色,玩具乐器>适用年龄>3-6岁> 世海玩具（SHIHAI）>儿童三轮车 宝宝手推车 脚踏车自行车 儿...,京东商城,童乐园
1015006007,母婴童|童车童床|三轮车,小虎子至尊950（四合一）儿童三轮车 外贸款 公主玫(外贸款),母婴>童车童床>三轮车>小虎子>小虎子至尊950（四合一）儿童三轮车 外...,京东商城,小虎子旗舰店
1015006007,母婴童|童车童床|三轮车,欧洲土豪金充气轮 三轮脚踏车自行车 童车 手推车三轮车 酷黑色充气轮至尊款,母婴>童车童床>三轮车> babytrold>欧洲土豪金充气轮 三轮脚踏车自行车 童车...,京东商城,乐翔婴童生活馆
1015006007,母婴童|童车童床|三轮车,出口欧美CHIC儿童手推三轮车自行车 多功能宝宝手推车 小孩脚踏车 婴儿童车 发泡轮-蓝色,母婴>童车童床>三轮车>IDES>出口欧美CHIC儿童手推三轮车自行车 多...,京东商城,浩贝佳母婴专营店
1015006007,母婴童|童车童床|三轮车,台湾原装进口 WEPLAY玩具 幼儿脚踏车 三轮车 兜风车WJ6625-0035,母婴>童车童床>三轮车> 七色花>台湾原装进口 WEPLAY玩具 幼儿脚踏...,京东商城,乐美母婴生活馆
1015006007,母婴童|童车童床|三轮车,小丽明正品 全铝三轮闪光滑板车 PVC闪光轮 儿童脚踏车 多色可选 红色,母婴>童车童床>扭扭车>小丽明>小丽明正品 全铝三轮闪光滑板车 PVC闪...,京东商城,乐美母婴生活馆
1015006007,母婴童|童车童床|三轮车,货到付款 炫梦奇三轮闪光滑板车 脚踏车蛙式车 可折叠高度可调节 粉色豪华版,母婴>童车童床>滑板车>炫梦奇>货到付款 炫梦奇三轮闪光滑板车 脚踏车蛙...,京东商城,炫梦奇专营店
1015006007,母婴童|童车童床|三轮车,出口韩国CHIC儿童手推三轮车自行车 多功能宝宝手推车 小孩脚踏车 婴儿童车 充气轮2014豪华版粉色,母婴>童车童床>三轮车> GREAT>出口韩国CHIC儿童手推三轮车自行车 多...,京东商城,禹光孕婴童生活馆
1015006007,母婴童|童车童床|三轮车,出口日本IDES DRT 折叠三轮车三轮童车 手推三轮车,母婴>童车童床>三轮车> GREAT>出口日本IDES DRT 折叠三轮车三轮...,京东商城,禹光孕婴童生活馆
1015006007,母婴童|童车童床|三轮车,HAPPY DINO/小龙哈彼童车粉色公主 粉色淑女 自行车脚踏车 LG1699X-W-H303 16寸,母婴>童车童床>自行车> 小龙哈彼（Happy dino）>HAPPY DINO/小龙哈彼童车粉色公...,京东商城,全优母婴
1015006007,母婴童|童车童床|三轮车,龙业 经济28型杆窗轨滑车 5个/包,家装建材 > 五金工具 > 家用五金 > 龙业 经济28型杆窗轨滑车 5个/包,当当网,龙业
1015006007,母婴童|童车童床|三轮车,好孩子 Goodbaby/好孩子 儿童宝宝三轮车/脚踏车 欧式多功能SR600R-L009,首页>母婴>童车童床>婴儿车>三轮车>好孩子Goodbaby/好孩子儿...,苏宁,好孩子(GOODBABY)
1015006007,母婴童|童车童床|三轮车,正品小虎子儿童三轮车脚踏车婴儿童车小孩多功能手推车950D充气轮,玩具 > 童车出行 > 儿童三轮车 > 正品小虎子儿童三轮车脚踏车婴儿童车小孩多功能手推车950D充气轮,当当网,Littletiger/小虎子
1015006007,母婴童|童车童床|三轮车,节日送礼 香港BBW 儿童脚踏三轮车 宝宝自行车 日本三轮脚踏车婴儿童车2-3-4岁,玩具乐器>益智玩具>拖拉玩具> 天影（tiyin）>节日送礼 香港BBW 儿童脚踏三轮车 宝...,京东商城,tiyin玩具专营店
1015006007,母婴童|童车童床|三轮车,Goodbaby/好孩子 儿童三轮车 宝宝脚踏车手推童车goodbaby婴儿自行车SR600R,所有分类>母婴用品、玩具>童车/床/汽座>三轮车>Goodbaby/好孩子>Goodbaby/好...,1号店,Goodbaby/好孩子
1015006007,母婴童|童车童床|三轮车,朗斯柏BC51000 健身车脚踏车自行车,首页>运动户外>体育休闲>健身器材>朗斯柏BC51000健身车脚踏车自...,苏宁,朗斯柏
1015006007,母婴童|童车童床|三轮车,捷弟巴客 3岁以上适用JDBUG三轮滑板车COOLCARVRE（国际版）,首页 > 捷弟巴客&ISL玩具专场 > 捷弟巴客 3岁以上适用JDBUG三轮滑板车COOLCARVRE（国际版）,唯品会,无
1015006007,母婴童|童车童床|三轮车,HAPPY DINO 滑板车宝宝脚踏车骑行车玩具车LSC60A-K336/L135,所有分类>母婴用品、玩具>玩具>童车/轮滑>滑板车>HAPPY DINO,1号店,滑板车
1015006007,母婴童|童车童床|三轮车,smarTrike Smart Trike&可人 多功能婴童儿童三轮车宝宝脚踏车 手推童车,所有分类>母婴用品、玩具>童车/床/汽座>三轮车>smarTrike,1号店,三轮车
1015006007,母婴童|童车童床|三轮车,好孩子 迪士尼 多功能婴儿三轮车SR86R儿童三轮车,所有分类>母婴用品、玩具>童车/床/汽座>三轮车>好孩子,1号店,三轮车
1015006007,母婴童|童车童床|三轮车,儿童三轮车 带翻斗 小孩三轮 简易三轮(红色 板座),母婴用品 玩具>学步车/三轮车>贝多福学步车/三轮车>儿童三轮车 带翻斗 小孩三轮 简易三轮(红色 板座),国美电器网上商城,贝多福学步车/三轮车