1015006007,母婴童|童车童床|三轮车,好来喜SX108可爱卡通带安全防护栏儿童三轮手推车 天蓝,母婴>童车童床>三轮车>好来喜>好来喜SX108可爱卡通带安全防护栏儿童...,京东商城,好来喜官方旗舰店
1015006007,母婴童|童车童床|三轮车,优贝RoyalBaby 欧式儿童三轮自行车 粉色,母婴>童车童床>三轮车>好孩子（Goodbaby）>优贝RoyalBaby 欧式儿童三轮自行...,京东商城,麦车车母婴旗舰店
1015006007,母婴童|童车童床|三轮车,优贝RoyalBaby 欧式儿童三轮自行车 红色,母婴>童车童床>三轮车>好孩子（Goodbaby）>优贝RoyalBaby 欧式儿童三轮自行...,京东商城,麦车车母婴旗舰店
1015006007,母婴童|童车童床|三轮车,瑞士米高micro MMaxi M0019大童三轮滑板车 紫色,运动健康>运动器械>极限轮滑>瑞士米高micro MMaxi M001...,京东商城,米高体育专营店
1015006007,母婴童|童车童床|三轮车,小虎子108单 手推脚踏多 可拆卸儿童三轮车 红蓝,母婴>童车童床>三轮车>小虎子>小虎子108单 手推脚踏多 可拆卸儿童三...,京东商城,小虎子旗舰店
1015006007,母婴童|童车童床|三轮车,全铝船型超轻PU激光轮三轮滑板车 送工具 承重90kg支持货到付款,当当网 > 运动户外 > 户外用品 > 极限运动系列 > 轮滑系列,当当网,红兔子
1015006007,母婴童|童车童床|三轮车,小虎子6811儿童三轮车 红色,母婴>童车童床>三轮车>小虎子>小虎子6811儿童三轮车 红色,京东商城,婴孚母婴旗舰店
1015006007,母婴童|童车童床|三轮车,全铝船型超轻PU激光轮三轮滑板车 送工具 承重90kg支持货到付款,当当网 > 运动户外 > 户外用品 > 极限运动系列 > 轮滑系列,当当网,舞神
1015006007,母婴童|童车童床|三轮车,贝迪乐 TJ-204 出口欧美 海绵宝宝 儿童三轮滑板车支持货到付款,当当网 > 运动户外 > 户外用品 > 极限运动系列 > 轮滑系列,当当网,飘王
1015006007,母婴童|童车童床|三轮车,正品瑞士米高滑板车Maxi Micro 米高大童三轮滑板车 粉色,玩具 > 电动,亚马逊(卓越网),瑞士米高
1015006007,母婴童|童车童床|三轮车,淘雨堂小小飞龙国宝/果宝特工宽板大轮滑板车铁三轮脚踏车童车滑步车带灯光带刹车,玩具乐器>健身玩具>户外玩具>淘雨堂>淘雨堂小小飞龙国宝/果宝特工宽板大轮滑板...,京东商城,淘堂母婴
1015006007,母婴童|童车童床|三轮车,goodbaby 好孩子 三轮车SR45MR-A-H104,玩具 > 童车、助步、轮滑 > 三轮车,亚马逊(卓越网),goodbaby 好孩子
1015006007,母婴童|童车童床|三轮车,IDES折叠三轮童车NEO(日本品牌),玩具 > 童车、助步、轮滑 > 三轮车,亚马逊(卓越网),IDES
1015006007,母婴童|童车童床|三轮车,正润 IIMO 儿童三轮车 ZR0042 咖啡,母婴>童车童床>三轮车>正润 IIMO 儿童三轮车 ZR0042...,京东商城,美嘉林贸易
1015006007,母婴童|童车童床|三轮车,淘雨堂 儿童三轮车 安全婴儿童车516,玩具乐器>健身玩具>户外玩具>A+B>淘雨堂 儿童三轮车 安全婴儿童车516,京东商城,淘堂母婴
1015006007,母婴童|童车童床|三轮车,折叠式三轮车二代-------来自美国百年骑乘玩具品牌Radio Flyer,玩具 > 童车、助步、轮滑 > 三轮车,亚马逊(卓越网),Radio Flyer
1015006007,母婴童|童车童床|三轮车,艾威BC8320-51立式磁控健身车 家用室内自行车 静音脚踏车 健身器材,运动健康>运动器械>健身器械>艾威>艾威BC8320-51立式磁控健身车 家...,京东商城,秀健运动器材专营店
1015006007,母婴童|童车童床|三轮车,GREAT--金甲女孩滑板车(带小包),购物中心>车床椅>滑板车>三轮>GREAT--金甲女孩滑板车(带小包),乐友,GREAT
1015006007,母婴童|童车童床|三轮车,Goodbaby/好孩子儿童宝宝三轮车/脚踏车SR44R J201D红色,母婴>童车童床>三轮车>好孩子（Goodbaby）>Goodbaby/好孩子儿童宝宝三轮车/...,京东商城,好孩子童车专卖店
1015006007,母婴童|童车童床|三轮车,小虎子 脚踏车童车手推车自行车三轮 802橙黄均码,母婴用品、玩具>童车/床/汽座>儿童自行车,1号店,小虎子
1015006007,母婴童|童车童床|三轮车,小小恐龙--三轮新型激光滑板车XKL-318-[满299-60 先领券后下单],母婴>童车童床>健身车>小小恐龙--三轮新型激光滑板车XKL-3...,京东商城,乐友孕婴童
1015006007,母婴童|童车童床|三轮车,宝宝好童车231G豪儿童三轮车宝宝脚踏车婴儿车手推车三轮自行车 粉色,母婴>童车童床>三轮车>宝宝好>宝宝好童车231G豪儿童三轮车宝宝脚踏车...,京东商城,宝宝好官方旗舰店
1015006007,母婴童|童车童床|三轮车,POSCN QQ太郎 儿童三轮车宝宝脚踏车婴儿自行车小孩童车 玛瑙红D款,母婴>童车童床>三轮车>POSCN QQ太郎 儿童三轮车宝宝脚踏...,京东商城,POSCN官方旗舰店
1015006007,母婴童|童车童床|三轮车,POSCN QQ太郎 儿童三轮车宝宝脚踏车婴儿自行车小孩童车 珍珠白/粉D款,母婴>童车童床>三轮车>POSCN QQ太郎 儿童三轮车宝宝脚踏...,京东商城,POSCN官方旗舰店
1015006007,母婴童|童车童床|三轮车,琪安特 儿童三轮车脚踏车 婴儿宝宝手推儿童车 红色无护栏无棚实心轮,母婴>童车童床>三轮车>琪安特>琪安特 儿童三轮车脚踏车 婴儿宝宝手推儿...,京东商城,迪比乐母婴专营店
1015006007,母婴童|童车童床|三轮车,酷可猫 儿童扭扭车 摇摆车 溜溜车 蛙式 滑板车 滑行车 脚踏车 三轮车 静音 法拉利红,母婴>童车童床>三轮车>酷可猫（COCOMAO）>酷可猫 儿童扭扭车 摇摆车 溜溜车 蛙式...,京东商城,骅舜童婴旗舰店
1015006007,母婴童|童车童床|三轮车,灿成童车双胞胎双人双座儿童三轮脚踏双座宝宝三轮车 苹果绿,母婴>童车童床>三轮车>灿成（CANCHN）>灿成童车双胞胎双人双座儿童三轮脚踏双座宝...,京东商城,灿成旗舰店
1015006007,母婴童|童车童床|三轮车,琪安特 儿童三轮车脚踏车 婴儿宝宝手推儿童车 红色有护栏有棚实心轮,母婴>童车童床>三轮车>琪安特>琪安特 儿童三轮车脚踏车 婴儿宝宝手推儿...,京东商城,迪比乐母婴专营店
1015006007,母婴童|童车童床|三轮车,Happy Dino 小龙哈彼 童车前扶手可打开 儿童三轮车 YT6508-0035 蓝篷,母婴>童车童床>三轮车>Happy Dino 小龙哈彼 童车前扶...,京东商城,POSCN官方旗舰店
1015006007,母婴童|童车童床|三轮车,舒贝乐305儿童三轮车 宝宝脚踏车 多首炫彩闪光音乐 大红色,母婴>童车童床>三轮车>舒贝乐>舒贝乐305儿童三轮车 宝宝脚踏车 多首...,京东商城,宝宝乐
1015006007,母婴童|童车童床|三轮车,Happy Dino 小龙哈彼 童车前扶手可打开 儿童三轮车 YT6508-0035 绿篷,母婴>童车童床>三轮车>Happy Dino 小龙哈彼 童车前扶...,京东商城,POSCN官方旗舰店
1015006007,母婴童|童车童床|三轮车,特价 小虎子儿童三轮车脚踏车宝宝三轮童车手推车 包邮 红色,母婴>童车童床>三轮车>小虎子>特价 小虎子儿童三轮车脚踏车宝宝三轮童车...,京东商城,荟智母婴专营店
1015006007,母婴童|童车童床|三轮车,灿成童车 儿童三轮车脚踏车 多功能婴儿车手推车宝宝自行车座椅配防蚊帐篷 T016绿色,母婴>童车童床>三轮车>灿成（CANCHN）>灿成童车 儿童三轮车脚踏车 多功能婴儿车...,京东商城,I baby玩具城
1015006007,母婴童|童车童床|三轮车,QQ太郎 儿童铝合金带闪光轮带刹车三轮滑板车 YT6506-0001 A款双鱼座,母婴>童车童床>三轮车>QQ太郎 儿童铝合金带闪光轮带刹车三轮滑...,京东商城,POSCN官方旗舰店
1015006007,母婴童|童车童床|三轮车,小龙哈彼滑板车LSC60AK336(品牌小龙哈彼),首页 > 车床椅/寝具 > 三轮车,母婴之家,小龙哈彼
1015006007,母婴童|童车童床|三轮车,三轮滑板车SR-G-J5-5*4.5A,首页>母婴>童车童床>婴儿车>健身车>三轮滑板车SR-G-J5-5*4.5...,苏宁,远大
1015006007,母婴童|童车童床|三轮车,艾威BC6850立式磁控健身车 豪华家用室内自行车 健身器材 静音心率脚踏车康复锻炼适合老年人用,运动健康>运动器械>健身器械>艾威>艾威BC6850立式磁控健身车 豪华家用...,京东商城,感动运动专营店
1015006007,母婴童|童车童床|三轮车,POSCN QQ太郎 三轮滑板车铝合金儿童车带闪光轮带刹车 可爱女孩C款,母婴>童车童床>三轮车>POSCN QQ太郎 三轮滑板车铝合金儿...,京东商城,POSCN官方旗舰店
1015006007,母婴童|童车童床|三轮车,POSCN QQ太郎新品儿童三轮车宝宝脚踏车 婴儿自行车小孩童车 白标蓝C款,母婴>童车童床>三轮车>POSCN QQ太郎新品儿童三轮车宝宝脚...,京东商城,POSCN官方旗舰店
1015006007,母婴童|童车童床|三轮车,格灵童三轮车万向太阳伞 蓝色,母婴>童车童床>三轮车>格灵童三轮车万向太阳伞 蓝色,京东商城,好又多母婴专营店
1015006007,母婴童|童车童床|三轮车,小龙哈彼-三轮车 LSR509S-G301,母婴>童车童床>三轮车>小龙哈彼-三轮车 LSR509S-G30...,京东商城,好孩子官方旗舰店
1015006007,母婴童|童车童床|三轮车,KZT三轮童车 IDES-KZT-08Y,首页>母婴>童车童床>婴儿车>三轮车>KZT三轮童车IDES-KZT-0...,苏宁,正润
1015006007,母婴童|童车童床|三轮车,好孩子-三轮车 SR44R-F308,母婴>童车童床>三轮车>好孩子-三轮车 SR44R-F308,京东商城,好孩子官方旗舰店
1015006007,母婴童|童车童床|三轮车,babyhome儿童三轮车 脚踏车 三轮自行车 两用童车 带推柄三色可选 DR818粉,母婴>童车童床>三轮车>贝之家>babyhome儿童三轮车 脚踏车 三轮...,京东商城,babyhome贝之家
1015006007,母婴童|童车童床|三轮车,灿成儿童三轮车宝宝三轮脚踏车 婴幼儿三轮手推车 潮妈-玫红,母婴>童车童床>三轮车> 灿成童车>灿成儿童三轮车宝宝三轮脚踏车 婴幼儿三轮...,京东商城,灿成旗舰店
1015006007,母婴童|童车童床|三轮车,QQ太郎 正品 瑞士米高同款 三轮滑板车C款 带刹车儿童玩具 高端款B款生命绿,运动健康>运动器械>骑行运动>QQ太郎>QQ太郎 正品 瑞士米高同款 三轮滑板车...,京东商城,QQ太郎旗舰店
1015006007,母婴童|童车童床|三轮车,POSCN QQ太郎活力板滑板游龙板蛇板火箭板二轮滑板车 经典款海绵宝宝游龙款,母婴>童车童床>健身车>POSCN QQ太郎活力板滑板游龙板蛇板...,京东商城,POSCN官方旗舰店
1015006007,母婴童|童车童床|三轮车,POSCN QQ太郎新品儿童三轮车宝宝脚踏车 婴儿自行车小孩童车 白标粉A款,母婴>童车童床>三轮车>POSCN QQ太郎新品儿童三轮车宝宝脚...,京东商城,POSCN官方旗舰店
1015006007,母婴童|童车童床|三轮车,QQ太郎 新品发布 三轮滑板车 踏板车儿童玩具车 内蒙古/甘肃/青海/宁夏,母婴>童车童床>三轮车>QQ太郎 新品发布 三轮滑板车 踏板车儿...,京东商城,POSCN官方旗舰店
1015006007,母婴童|童车童床|三轮车,美国岱宇Dyaco 原装进口 立式电控健身车 室内自行车 脚踏车FU300 货到付款 北上广深天津上门安装,运动户外 > 健身器械 > 健身车 > 商品详情,当当网,岱宇DYACO
1015006007,母婴童|童车童床|三轮车,龙祥 爱就推门滑板车铁三轮PVC带灯2182_1 WJ-241-AJ43,所有分类>母婴用品、玩具>玩具>运动户外>龙祥>龙祥 爱就推门滑板车...,1号店,龙祥
1015006007,母婴童|童车童床|三轮车,Goodbaby/好孩子 儿童自行车 宝宝三轮车 脚踏车SR600R 1-3岁 多功能 欧式高档三轮车 J04,所有分类>母婴用品、玩具>童车/床/汽座>婴儿手推车>三轮推车>Goodbaby/好孩子>Goodbaby/好...,1号店,Goodbaby/好孩子
1015006007,母婴童|童车童床|三轮车,POSCN POSCN 儿童滑板车 三轮车 全铝闪光 YT6506-0043 A款双子座,母婴>童车童床>健身车>POSCN>POSCN POSCN 儿童滑板车 三轮...,京东商城,POSCN官方旗舰店
1015006007,母婴童|童车童床|三轮车,日本idea iimo 2代可拆卸三轮车折叠婴儿车儿童脚踏车台湾产 咖啡色包邮 送遮阳伞,玩具 > 童车、助步、轮滑 > 三轮车,亚马逊(卓越网),IIMO
1015006007,母婴童|童车童床|三轮车,POSCN POSCN 儿童滑板车 三轮车 全铝闪光 YT6506-0043 A款白羊座,母婴>童车童床>健身车>POSCN>POSCN POSCN 儿童滑板车 三轮...,京东商城,POSCN官方旗舰店
1015006007,母婴童|童车童床|三轮车,恒泰童车 三轮车脚踏车儿童自行车色彩鲜艳大礼盒装 5310 三轮脚踏车黄,玩具乐器>遥控/电动>遥控船>恒泰>恒泰童车 三轮车脚踏车儿童自行车色彩鲜艳...,京东商城,福福玩具
1015006007,母婴童|童车童床|三轮车,小人类 三轮车自行车 多功能儿童手推脚踏车/ 带护拦与手推杆 613Q 深紫色,母婴>童车童床>三轮车>小人类>小人类 三轮车自行车 多功能儿童手推...,京东商城,骅舜童婴旗舰店
1015006007,母婴童|童车童床|三轮车,好孩子迪士尼系列12寸高档自行车脚踏车GG1232Q-H105D,母婴>童车童床>自行车>好孩子迪士尼系列12寸高档自行车脚踏车G...,京东商城,妈咪好孩子专营店
1015006007,母婴童|童车童床|三轮车,好孩子儿童宝宝三轮车/脚踏车SR45MR-A-H104迪士尼米奇,母婴>童车童床>三轮车>好孩子儿童宝宝三轮车/脚踏车SR45MR...,京东商城,妈咪好孩子专营店
1015006007,母婴童|童车童床|三轮车,小龙哈彼Happy dino LSR200欧式运动脚踏三轮车 L128绿色,母婴>童车童床>三轮车>小龙哈彼（Happy dino）>小龙哈彼Happy dino LSR20...,京东商城,麦车车母婴旗舰店
1015006007,母婴童|童车童床|三轮车,舒贝乐儿童三轮车 脚踏车 宝宝三轮车 2到4岁可以骑 绿色仙子,母婴>童车童床>三轮车>舒贝乐>舒贝乐儿童三轮车 脚踏车 宝宝三轮车 2...,京东商城,宝宝乐
1015006007,母婴童|童车童床|三轮车,好孩子(Goodbaby)三轮车 儿童脚踏车带避震 SR66R-J302D,母婴>童车童床>三轮车>好孩子（Goodbaby）>好孩子(Goodbaby)三轮车 儿童脚...,京东商城,妈咪乐母婴馆
1015006007,母婴童|童车童床|三轮车,小龙人儿童三轮车宝宝脚踏车小孩童车三轮车6609-S,母婴>童车童床>三轮车>Bang on the door >小龙人儿童三轮车宝宝脚踏车小孩童车三轮车...,京东商城,耀邦母婴专营店
1015006007,母婴童|童车童床|三轮车,【贝智乐】小孩儿童三轮车宝宝脚踏车童车婴儿三轮自行车好孩子童车 2 蓝色,母婴>童车童床>三轮车>【贝智乐】小孩儿童三轮车宝宝脚踏车童车婴...,京东商城,贝智乐玩具商城
1015006007,母婴童|童车童床|三轮车,小龙人儿童三轮车宝宝脚踏车小孩童车三轮车6609-S,母婴>童车童床>三轮车>Bang on the door >小龙人儿童三轮车宝宝脚踏车小孩童车三轮车...,京东商城,亲宝贝母婴专营店
1015006007,母婴童|童车童床|三轮车,韩国儿童蛙式滑板车太空车三轮活力车扭扭车 A款颜色随机,母婴>童车童床>三轮车>韩国儿童蛙式滑板车太空车三轮活力车扭扭车...,京东商城,亲宝贝母婴专营店
1015006007,母婴童|童车童床|三轮车,小龙哈彼童车 LSR300 安全防护 儿童三轮车 自行车 脚踏车 玩具车,母婴>童车童床>三轮车>小龙哈彼>小龙哈彼童车 LSR300 安全防护 儿...,京东商城,永盛华远母婴专营店
1015006007,母婴童|童车童床|三轮车,goodbaby 好孩子迪士尼米妮造型 儿童滑板车三轮车SC20D SC20D-A-J301D,母婴>童车童床>健身车>好孩子>goodbaby 好孩子迪士尼米妮造型 ...,京东商城,好孩子母婴专营店
1015006007,母婴童|童车童床|三轮车,琪安特儿童三轮车 环保闪光烤漆版 （折叠脚踏 带刹车） 孔雀蓝,母婴>童车童床>三轮车>琪安特>琪安特儿童三轮车 环保闪光烤漆版 （折叠...,京东商城,银座母婴官方旗舰店
1015006007,母婴童|童车童床|三轮车,好孩子儿童三轮车 宝宝脚踏车手推童车goodbaby婴儿自行车SR600R 蓝色SR600R-L009,母婴>童车童床>三轮车>好孩子（Goodbaby）>好孩子儿童三轮车 宝宝脚踏车手推童车go...,京东商城,好孩子母婴专营店
1015006007,母婴童|童车童床|三轮车,POSCN 儿童蛙式滑板车 双后刹蛙式车 三轮车扭扭车 YT6535-0024 中号粉红色,玩具 > 童车、助步、轮滑 > 滑板车,亚马逊(卓越网),Youngtry/优动
1015006007,母婴童|童车童床|三轮车,POSCN 双后刹减震蛙式滑板车儿童三轮车滑板车童车 YT6535-0031 粉红色,玩具 > 童车、助步、轮滑 > 滑板车,亚马逊(卓越网),Youngtry/优动
1015006007,母婴童|童车童床|三轮车,Goodbaby好孩子官方旗舰店/迪士尼系列多功能婴儿三轮车 SR86R-A-L002D,玩具 > 童车出行 > 儿童三轮车 > 商品详情,当当网,Goodbaby 好孩子
1015006007,母婴童|童车童床|三轮车,MIMI-trike儿童三轮车 脚踏车 宝宝童车 儿童自行车 简易童车,玩具 > 童车出行 > 儿童三轮车 > 商品详情,当当网,iimo
1015006007,母婴童|童车童床|三轮车,好孩子多功能二合一站坐两用儿童三轮滑板车sc800童车助步车,首页>母婴>童车童床>婴儿车>三轮车>好孩子多功能二合一站坐两用儿童三轮滑...,苏宁,好孩子
1015006007,母婴童|童车童床|三轮车,可爱布丁 宝宝玩具 三轮滑轮车滑板车,所有分类>母婴用品、玩具>玩具>运动户外>可爱布丁>可爱布丁 宝宝玩具 ...,1号店,可爱布丁
1015006007,母婴童|童车童床|三轮车,康贝（Combi）儿童三轮车（莱姆绿）,母婴>童车童床>三轮车>康贝>康贝三轮车,京东商城,康贝
1015006007,母婴童|童车童床|三轮车,儿童童车／儿童活力车,玩具 > 童车、助步、轮滑 > 三轮车,亚马逊(卓越网),麦光玩具
1015006007,母婴童|童车童床|三轮车,OUBIAO 欧标叭叭跑 踏步车 双踏车 滑板车A125 G 儿童超爱 (粉色),玩具 > 童车、助步、轮滑 > 三轮车,亚马逊(卓越网),OUBIAO 欧标
1015006007,母婴童|童车童床|三轮车,灿成童车 儿童三轮车脚踏车 婴儿手推车 宝宝自行车0-3岁(豪华版中国红送蚊帐1件),母婴用品 玩具>模型玩具>灿成>灿成童车 儿童三轮车脚踏车 婴儿手推车 宝宝自行车0-3岁(豪华版中国红送蚊帐1件),国美电器网上商城,贝趣玩具专营店
1015006007,母婴童|童车童床|三轮车,Combi康贝 娃乐都 儿童三轮车 3310 绿色/ 3311橙色 绿色,母婴>童车童床>三轮车>康贝（Combi）>Combi康贝 娃乐都 儿童三轮车 33...,京东商城,爱呵婴童
1015006007,母婴童|童车童床|三轮车,【蝴蝶节 惊价】贝嘉琦 滑板车 儿童三轮滑板车瑞士踏板车轮滑车 三合一滑板车 特价 升降款橙,母婴>童车童床>三轮车>贝嘉琦>【蝴蝶节 惊价】贝嘉琦 滑板车 儿童三轮...,京东商城,绿森童车专卖店
1015006007,母婴童|童车童床|三轮车,五祥铝合金手推车宝宝童车 儿童三轮车脚踏婴儿自行车 充气轮 银色-铝合金,母婴>童车童床>三轮车>森夏>五祥铝合金手推车宝宝童车 儿童三轮车脚踏...,京东商城,雪儿母婴汇
1015006007,母婴童|童车童床|三轮车,小人类 儿童三轮车/音乐扭扭车/四轮车/摇摇车/摇摆车/健身车 801A 蓝色熊猫,母婴>童车童床>健身车>小人类>小人类 儿童三轮车/音乐扭扭车/四轮车/...,京东商城,骅舜母婴专营店
1015006007,母婴童|童车童床|三轮车,小龙哈彼三轮车LSR200 K121红色,母婴>童车童床>三轮车>小龙哈彼（Happy dino）>小龙哈彼三轮车LSR200 K121红色,京东商城,银座母婴官方旗舰店
1015006007,母婴童|童车童床|三轮车,正步家用迷你超静音折叠磁控车健身车自行车脚踏车 822粉红色,运动健康>运动器械>健身器械>正步>正步家用迷你超静音折叠磁控车健身车自行车...,京东商城,正步运动旗舰店
1015006007,母婴童|童车童床|三轮车,正步家用迷你超静音折叠磁控车健身车自行车脚踏车 823绿色,运动健康>运动器械>健身器械>正步>正步家用迷你超静音折叠磁控车健身车自行车...,京东商城,正步运动旗舰店
1015006007,母婴童|童车童床|三轮车,小丽明儿童蛙式滑板车小孩蛙式玩具三轮车 扭扭车宝宝童车XLM-901,玩具乐器>健身玩具>户外玩具>小丽明>小丽明儿童蛙式滑板车小孩蛙式玩具三轮车 ...,京东商城,尚可多童趣专营店
1015006007,母婴童|童车童床|三轮车,恒泰 儿童三轮车 宝宝三轮脚踏车童车小孩户外运动自行车玩具车 儿童自行车 年货节日生日礼 宝宝三轮车 黄色,玩具乐器>健身玩具>户外玩具>恒泰>恒泰 儿童三轮车 宝宝三轮脚踏车童车小孩...,京东商城,淘淘玩铺
1015006007,母婴童|童车童床|三轮车,哈哈亮彩滑板车 三轮新款滑板车 户外健身 588 橙色,玩具乐器>DIY玩具>情景玩具>喜羊羊与灰太狼>哈哈亮彩滑板车 三轮新款滑板车 户外健身...,京东商城,艺隆玩具专营店
1015006007,母婴童|童车童床|三轮车,栋马铝合金手推车宝宝童车 儿童三轮车脚踏婴儿自行车 充气轮多省包邮 法拉利红(高钢碳)发泡轮+顶配,母婴>童车童床>三轮车>栋马>栋马铝合金手推车宝宝童车 儿童三轮车脚踏...,京东商城,栋马童车旗舰店
1015006007,母婴童|童车童床|三轮车,栋马铝合金手推车宝宝童车 儿童三轮车脚踏婴儿自行车 充气轮多省包邮 玫红(铝合金)充气轮+顶配,母婴>童车童床>三轮车>栋马>栋马铝合金手推车宝宝童车 儿童三轮车脚踏...,京东商城,栋马童车旗舰店
1015006007,母婴童|童车童床|三轮车,货到付款！炫梦奇儿童蛙式车 滑板车 三轮车 可折叠 带小筐豪华版海军蓝,母婴>童车童床>健身车>炫梦奇>货到付款！炫梦奇儿童蛙式车 滑板车 三轮...,京东商城,炫梦奇专营店
1015006007,母婴童|童车童床|三轮车,恒泰儿童三轮车 宝宝三轮脚踏车童车小孩户外运动自行车玩具车(橙色),母婴用品 玩具>模型玩具>恒泰>恒泰儿童三轮车 宝宝三轮脚踏车童车小孩户外运动自行车玩具车(橙色),国美电器网上商城,贝趣玩具专营店
1015006007,母婴童|童车童床|三轮车,恒泰 童车儿童三轮车 宝宝三轮脚踏车童车小孩户外运动自行车玩具车(橙色童车),母婴用品 玩具>健身玩具>恒泰>恒泰 童车儿童三轮车 宝宝三轮脚踏车童车小孩户外运动自行车玩具车(橙色童车),国美电器网上商城,贝趣玩具专营店
1015006007,母婴童|童车童床|三轮车,儿童三轮车 脚踏车 婴儿手推车 宝宝童车 儿童玩具车(咖啡色童车),母婴用品 玩具>健身玩具>活石>儿童三轮车 脚踏车 婴儿手推车 宝宝童车 儿童玩具车(咖啡色童车),国美电器网上商城,贝趣玩具专营店
1015006007,母婴童|童车童床|三轮车,SUNBODY 森宝迪 新型儿童三轮滑板车,玩具 > 童车、助步、轮滑 > 三轮车 ,亚马逊(卓越网),森宝迪 SUNBODY
1015006007,母婴童|童车童床|三轮车,出口日韩 MIMI-TRIKE 儿童三轮车脚踏车童车户外三轮车 特价促销 天使白 活力绿,母婴>童车童床>三轮车>IIMO>出口日韩 MIMI-TRIKE 儿童三轮...,京东商城,禹光孕婴童生活馆
1015006007,母婴童|童车童床|三轮车,出口日韩 MIMI-TRIKE 儿童三轮车脚踏车童车户外三轮车 特价促销 天使蓝 天使白,母婴>童车童床>三轮车>IIMO>出口日韩 MIMI-TRIKE 儿童三轮...,京东商城,禹光孕婴童生活馆
1015006007,母婴童|童车童床|三轮车,灿成童车儿童三轮车脚踏车 宝宝 三轮车 童车 脚踏 儿童车 手推车,玩具乐器>适用年龄>3-6岁>灿成（CANCHN）>灿成童车儿童三轮车脚踏车 宝宝 三轮车 ...,京东商城,麦乐母婴玩具旗舰店
1015006007,母婴童|童车童床|三轮车,乐卡儿童三轮车脚踏车 宝宝小孩幼儿童车 脚蹬玩具车 新年礼物 红色,玩具乐器>健身玩具>户外玩具>KidSmart>乐卡儿童三轮车脚踏车 宝宝小孩幼儿童车 ...,京东商城,三宝商城
1015006007,母婴童|童车童床|三轮车,那些花儿 儿童滑板车 小孩二轮闪光滑板车滑滑车三轮脚踏车滑行车玩具特价另赠送 粉色包邮 铃铛 护具六件套,玩具乐器>健身玩具>户外玩具>那些花儿（TFLOWER）>那些花儿 儿童滑板车 小孩二轮闪光滑板车...,京东商城,那些花儿
1015006007,母婴童|童车童床|三轮车, 小龙哈彼 14寸儿童自行车LG1458QX-H209/J309脚踏车(粉色),母婴用品 玩具>自行车>小龙哈彼自行车> 小龙哈彼 14寸儿童自行车LG1458QX-H209/J309脚踏车(粉色),国美电器网上商城,小龙哈彼自行车
1015006007,母婴童|童车童床|三轮车,日本ides 儿童折叠三轮车童车自行车手推车脚踏车童车三轮车免安装 可折叠 (红色),玩具 > 童车、助步、轮滑 > 三轮车,亚马逊(卓越网),IDES
1015006007,母婴童|童车童床|三轮车,小龙哈彼三轮车LSR800R,玩具 > 童车出行 > 儿童三轮车 > 商品详情,当当网,小龙哈彼
